city,publisher,source,source_url,rank,headline,link,collected_at_iso
Delhi-NCR,Jagran,Delhi-NCR • Jagran,https://www.jagran.com/delhi-ncr,29,"गाजियाबाद: मतांतरण की सूचना से मचा हड़कंप, धरने पर बैठे लोग; जांच में जुटे पुलिस अधिकारी",https://www.jagran.com/uttar-pradesh/ghaziabad-ghaziabad-conversion-attempt-allegations-in-school-basement-40227795.html,2026-05-04T21:13:55+00:00
Delhi-NCR,Jagran,Delhi-NCR • Jagran,https://www.jagran.com/delhi-ncr,30,"गाजियाबाद की चार सड़कें बनेंगी आधुनिक, 4.51 करोड़ से लगेंगे स्टाइलिश पोल और आकर्षक लाइटें",https://www.jagran.com/uttar-pradesh/ghaziabad-ghaziabad-roads-get-rs-451-cr-stylish-lighting-upgrade-40227768.html,2026-05-04T21:13:55+00:00
Delhi-NCR,Jagran,Delhi-NCR • Jagran,https://www.jagran.com/delhi-ncr,31,"पश्चिम बंगाल और असम में BJP की जीत पर गुरुग्राम में कार्यकर्ताओं ने मनाया जश्न, PM मोदी की तस्वीर पर चढ़ाया लड्डू",https://www.jagran.com/haryana/gurgaon-gurugram-celebrates-bjp-victory-in-bengal-assam-elections-40227782.html,2026-05-04T21:13:55+00:00
Delhi-NCR,Jagran,Delhi-NCR • Jagran,https://www.jagran.com/delhi-ncr,32,"गुरुग्राम में सांप के काटने से युवक की मौत, बारिश के दौरान झुग्गी में घुस गया था सांप",https://www.jagran.com/haryana/gurgaon-man-dies-after-snake-bite-in-gurugram-slum-during-rain-40227700.html,2026-05-04T21:13:55+00:00
Delhi-NCR,Jagran,Delhi-NCR • Jagran,https://www.jagran.com/delhi-ncr,33,"हरियाणा के खिलाड़ियों से वादाखिलाफी, 9 साल बाद भी फाइलों में ही बंद 5 लाख रुपये की स्वास्थ्य बीमा योजना",https://www.jagran.com/haryana/gurgaon-haryana-sports-health-insurance-scheme-10-years-unimplemented-40227586.html,2026-05-04T21:13:55+00:00
Delhi-NCR,Jagran,Delhi-NCR • Jagran,https://www.jagran.com/delhi-ncr,34,"गुरुग्राम: वेतन बढ़ोतरी के लिए श्रमिकों का प्रदर्शन, अपनी मांगों पर अड़े; छावनी में तब्दील हुआ इलाका",https://www.jagran.com/haryana/gurgaon-vision-rx-lab-gurugram-workers-protest-for-salary-hike-40227539.html,2026-05-04T21:13:55+00:00
Delhi-NCR,Jagran,Delhi-NCR • Jagran,https://www.jagran.com/delhi-ncr,35,"गुरुग्राम में टाइल्स के गोदाम में लगी आग, दमकल की तीन गाड़ियों ने पाया काबू",https://www.jagran.com/haryana/gurgaon-gurugram-tile-warehouse-fire-3-fire-tenders-control-blaze-40227486.html,2026-05-04T21:13:55+00:00
Delhi-NCR,Jagran,Delhi-NCR • Jagran,https://www.jagran.com/delhi-ncr,36,"ग्रेटर नोएडा की बेनेट यूनिवर्सिटी में छात्रा से रैगिंग का Video वायरल, ABVP ने की कड़ी कार्रवाई की मांग",https://www.jagran.com/uttar-pradesh/noida-bennett-university-ragging-video-abvp-demands-strict-action-40228062.html,2026-05-04T21:13:55+00:00
Delhi-NCR,Jagran,Delhi-NCR • Jagran,https://www.jagran.com/delhi-ncr,37,"नोएडा में तीन मंजिला इमारत में शॉर्ट सर्किट से लगी आग, फायर ब्रिगेड ने समय रहते पाया काबू",https://www.jagran.com/uttar-pradesh/noida-noida-building-fire-short-circuit-blamed-for-sector-4-blaze-40228010.html,2026-05-04T21:13:55+00:00
Delhi-NCR,Jagran,Delhi-NCR • Jagran,https://www.jagran.com/delhi-ncr,38,"नोएडा में डार्क वेब से गांजा मंगाकर बेचने वाले दो तस्कर गिरफ्तार, पीजी-हॉस्टल के छात्रों को करते थे सप्लाई",https://www.jagran.com/uttar-pradesh/noida-noida-dark-web-og-ganja-traffickers-arrested-8-lakh-seized-40227890.html,2026-05-04T21:13:55+00:00
Delhi-NCR,Jagran,Delhi-NCR • Jagran,https://www.jagran.com/delhi-ncr,39,"नोएडा: कम वेतन मिलने से भड़के कर्मचारी, हड़ताल की दी चेतावनी, हेल्थ विभाग के अधिकारियों को 6 दिन का अल्टीमेटम",https://www.jagran.com/uttar-pradesh/noida-noida-district-hospital-workers-strike-over-unpaid-wages-pf-40227862.html,2026-05-04T21:13:55+00:00
Delhi-NCR,Jagran,Delhi-NCR • Jagran,https://www.jagran.com/delhi-ncr,40,"दिल्ली-NCR की ‘डेथ वैली’ बनी अरावली की झीलें, ‘ब्लू लेक’ के नाम पर मौत बांट रहीं इंटरनेट रील्स",https://www.jagran.com/haryana/faridabad-aravalli-lakes-ncrs-death-valley-for-youth-social-media-lures-40227744.html,2026-05-04T21:13:55+00:00
Delhi-NCR,Jagran,Delhi-NCR • Jagran,https://www.jagran.com/delhi-ncr,41,फरीदाबाद: बेटे के सामने हुई बेइज्जती... जूता व्यापारी ने फांसी लगाकर दी जान; सुसाइड नोट में बयां किया दर्द,https://www.jagran.com/haryana/faridabad-faridabad-shoe-merchant-suicide-humiliation-over-debt-40227561.html,2026-05-04T21:13:55+00:00
Delhi-NCR,Jagran,Delhi-NCR • Jagran,https://www.jagran.com/delhi-ncr,42,"फरीदाबाद: मानसून से पहले खुली दावों की पोल, हल्की बारिश में ही दिल्ली-आगरा हाईवे पर भरा पानी",https://www.jagran.com/haryana/faridabad-faridabad-highway-waterlogging-after-light-rain-exposes-claims-40227488.html,2026-05-04T21:13:55+00:00
Delhi-NCR,Jagran,Delhi-NCR • Jagran,https://www.jagran.com/delhi-ncr,43,"फरीदाबाद में 2 बेटों के साथ पिता आगरा नहर में कूदा, 5 किमी दूर जिंदा मिला बड़ा बेटा; सर्च ऑपरेशन जारी",https://www.jagran.com/haryana/faridabad-faridabad-father-jumps-into-agra-canal-with-two-sons-40227476.html,2026-05-04T21:13:55+00:00
Delhi-NCR,Jagran,Delhi-NCR • Jagran,https://www.jagran.com/delhi-ncr,44,"फरीदाबाद में आंधी-बारिश से आफत, मंडियों में खुले में पड़ा गेहूं भीगा; भुगतान के लिए भटक रहे किसान",https://www.jagran.com/haryana/faridabad-faridabad-wheat-soaked-by-rain-mandis-face-storage-crisis-40227358.html,2026-05-04T21:13:55+00:00
Delhi-NCR,Jagran,Delhi-NCR • Jagran,https://www.jagran.com/delhi-ncr,45,"फुटपाथ और नालियों का इंतजार, पलवल के हसनपुर में बढ़ी लोगों की मुश्किलें; दो महीने बनी थी सड़क",https://www.jagran.com/haryana/palwal-palwal-hasanpur-road-lacks-footpaths-drains-after-2-months-40225997.html,2026-05-04T21:13:55+00:00
Delhi-NCR,Jagran,Delhi-NCR • Jagran,https://www.jagran.com/delhi-ncr,46,"पलवल में मेहंदी की रस्म के दौरान बदमाशों ने की ताबड़तोड़ फायरिंग, दुल्हन के भाई को लगी गोली",https://www.jagran.com/haryana/palwal-palwal-firing-brides-brother-shot-at-mehndi-ceremony-40223713.html,2026-05-04T21:13:55+00:00
Delhi-NCR,Jagran,Delhi-NCR • Jagran,https://www.jagran.com/delhi-ncr,47,"सड़कों पर रील बनाने वालों की खैर नहीं, ऑपरेशन 'लगाम' शुरू; 22 दिन में 9106 वाहनों से वसूला ढाई करोड़ जुर्माना",https://www.jagran.com/haryana/palwal-palwal-police-operation-lagaam-targets-road-hooliganism-reels-40221603.html,2026-05-04T21:13:55+00:00
Delhi-NCR,Jagran,Delhi-NCR • Jagran,https://www.jagran.com/delhi-ncr,48,"कार से रस्सी बांधकर रुपयों से भरा ATM उखाड़कर ले गए बदमाश, CCTV देख उड़े पलवल पुलिस के होश",https://www.jagran.com/haryana/palwal-palwal-pnb-atm-uprooted-by-thieves-439-lakh-stolen-40221582.html,2026-05-04T21:13:55+00:00
Delhi-NCR,Jagran,Delhi-NCR • Jagran,https://www.jagran.com/delhi-ncr,49,"35 करोड़ की लागत से बढ़ेगी हरियाणा-यूपी कनेक्टिविटी, हसनपुर यमुना पुल अप्रोच सड़क का काम तेज",https://www.jagran.com/haryana/palwal-hasanpur-yamuna-bridge-35-cr-approach-road-work-begins-40219403.html,2026-05-04T21:13:55+00:00
Delhi-NCR,Jagran,Delhi-NCR • Jagran,https://www.jagran.com/delhi-ncr,50,"हाथरस में मर्यादा की सारी हदें पार: 5 हजार की शर्त के लिए गांव में निर्वस्त्र होकर घूमा युवक, पुलिस ने दबोचा",https://www.jagran.com/uttar-pradesh/hathras-hathras-man-walks-naked-for-bet-viral-video-leads-to-arrest-40228296.html,2026-05-04T21:13:55+00:00
Delhi-NCR,Jagran,Delhi-NCR • Jagran,https://www.jagran.com/delhi-ncr,51,"UP को वन ट्रिलियन डॉलर इकोनॉमी बनाने के लिए हर जिले में तैनात होंगे दो-दो 'सीएम फेलो', बनाएंगे आर्थिक रणनीति",https://www.jagran.com/uttar-pradesh/lucknow-city-up-cabinet-approves-cm-fellows-for-one-trillion-economy-goal-40228277.html,2026-05-04T21:13:55+00:00
Delhi-NCR,Jagran,Delhi-NCR • Jagran,https://www.jagran.com/delhi-ncr,52,"बरेली में खौफनाक वारदात: अपहरण के बाद मुंह बोली मां की हत्या, रेलवे ट्रेक पर मिला शव",https://www.jagran.com/uttar-pradesh/bareilly-city-bareilly-woman-kidnapped-murdered-over-property-dispute-40228280.html,2026-05-04T21:13:55+00:00
Delhi-NCR,Jagran,Delhi-NCR • Jagran,https://www.jagran.com/delhi-ncr,53,"बुलंदशहर में छोटे भाई को जेल भेजने के लिए बड़े भाई ने खुद को मारी गोली, Video Viral",https://www.jagran.com/uttar-pradesh/bulandshahr-bulandshahr-man-shoots-self-to-frame-brother-in-property-row-40228288.html,2026-05-04T21:13:55+00:00
Delhi-NCR,Jagran,Delhi-NCR • Jagran,https://www.jagran.com/delhi-ncr,54,"यूपी के 150 सरकारी स्कूलों में बनेंगी ड्रीम स्किल लैब, अब छात्र सीखेंगे AI और रोबोटिक्स",https://www.jagran.com/uttar-pradesh/lucknow-city-up-govt-schools-get-dream-skill-labs-for-ai-robotics-40228203.html,2026-05-04T21:13:55+00:00
Delhi-NCR,Jagran,Delhi-NCR • Jagran,https://www.jagran.com/delhi-ncr,55,"अब डिजिटल साक्ष्य से मिलेगा तुरंत न्याय: सबूतों से छेड़छाड़ होगी बंद, UP कैबिनेट ने इन 3 नियमों को दी मंजूरी",https://www.jagran.com/uttar-pradesh/lucknow-city-up-courts-go-digital-eevidence-summons-community-service-40228221.html,2026-05-04T21:13:55+00:00
Delhi-NCR,Jagran,Delhi-NCR • Jagran,https://www.jagran.com/delhi-ncr,56,"वाराणसी में पुलिस को चकमा देकर कोतवाली से भागा आफताब गिरफ्तार, अमित बनकर हिंदु युवती से की थी शादी",https://www.jagran.com/uttar-pradesh/varanasi-city-varanasi-aftab-ansari-rearrested-after-kotwali-escape-40228282.html,2026-05-04T21:13:55+00:00
Delhi-NCR,Jagran,Delhi-NCR • Jagran,https://www.jagran.com/delhi-ncr,57,"9 और 10 मई को यूपी के 17 जिलों में होगी PGT भर्ती परीक्षा, मुख्य सचिव ने जारी किए सख्त दिशा निर्देश",https://www.jagran.com/uttar-pradesh/lucknow-city-up-pgt-exam-2022-dates-announced-may-910-high-competition-40228269.html,2026-05-04T21:13:55+00:00
Delhi-NCR,Jagran,Delhi-NCR • Jagran,https://www.jagran.com/delhi-ncr,58,"सिसवा विधायक के घर पहुंच CM योगी, प्रेमसागर पटेल की पत्नी के",https://www.jagran.com/uttar-pradesh/maharajganj-cm-yogi-adityanath-visits-maharajganj-condoles-mlas-wife-demise-40228002.html,2026-05-04T21:13:55+00:00
Delhi-NCR,Jagran,Delhi-NCR • Jagran,https://www.jagran.com/delhi-ncr,59,Raja Shivaji Box Office: मंडे को महादेव की कृपा से धनवान हुई,https://www.jagran.com/entertainment/box-office-raja-shivaji-box-office-collection-day-4-riteish-deshmukh-sanjay-dutt-movie-pass-monday-test-40227987.html,2026-05-04T21:13:55+00:00
Delhi-NCR,Jagran,Delhi-NCR • Jagran,https://www.jagran.com/delhi-ncr,60,"पश्चिम बंगाल में भाजपा की जीत पर धनबाद में जश्न, सांसद ढुलू",https://www.jagran.com/jharkhand/dhanbad-bjp-victory-in-west-bengal-sparks-celebration-in-dhanbad-mp-dhullu-mahato-says-people-chose-nationalism-and-development-40228000.html,2026-05-04T21:13:55+00:00
Delhi-NCR,Jagran,Delhi-NCR • Jagran,https://www.jagran.com/delhi-ncr,61,"ओबरा तापीय परियोजना की सभी इकाइयां बंद, उत्‍तर प्रदेश में बा",https://www.jagran.com/uttar-pradesh/sonbhadra-production-stopped-by-all-units-of-obra-b-project-demand-decline-after-heavy-rains-40228009.html,2026-05-04T21:13:55+00:00
Delhi-NCR,Jagran,Delhi-NCR • Jagran,https://www.jagran.com/delhi-ncr,62,"मोतिहारी में युवतियों से जबरन कराया जा रहा था देह व्यापार, ट",https://www.jagran.com/bihar/east-champaran-motihari-forced-prostitution-racket-busted-toto-driver-arrested-40228006.html,2026-05-04T21:13:55+00:00
Delhi-NCR,Jagran,Delhi-NCR • Jagran,https://www.jagran.com/delhi-ncr,63,Jalukbari Election Result: हिमंत बिस्वा सरमा जालुकबाड़ी से ल,https://www.jagran.com/news/national-jalukbari-assembly-election-result-2026-himanta-biswa-sarma-vs-bidisha-neog-vote-counting-updates-40227302.html,2026-05-04T21:13:55+00:00
Delhi-NCR,Jagran,Delhi-NCR • Jagran,https://www.jagran.com/delhi-ncr,64,West Bengal Election Results: नवादा में हुमायूं कबीर 27 हजार,https://www.jagran.com/news/national-naoda-vidhan-sabha-chunav-result-2026-humayun-kabir-40227231.html,2026-05-04T21:13:55+00:00
Delhi-NCR,Jagran,Delhi-NCR • Jagran,https://www.jagran.com/delhi-ncr,65,HPBOSE 12th Result 2026: हिमाचल शिक्षा बोर्ड ने जारी किया रि,https://www.jagran.com/himachal-pradesh/dharmshala-hpbose-12th-result-today-himachal-board-declares-class-12-results-40226938.html,2026-05-04T21:13:55+00:00
Delhi-NCR,Jagran,Delhi-NCR • Jagran,https://www.jagran.com/delhi-ncr,66,"सावधान! कानपुर में ऑटो में टप्पेबाजी वाला गिरोह सक्रिय, 'सास",https://www.jagran.com/uttar-pradesh/kanpur-city-kanpur-police-bust-inter-state-fraud-gang-4-arrested-for-15-lakh-jewelry-theft-40227994.html,2026-05-04T21:13:55+00:00
Delhi-NCR,Jagran,Delhi-NCR • Jagran,https://www.jagran.com/delhi-ncr,67,MI vs LSG Live Cricket Score: मुंबई ने पहले गेंदबाजी का किया,https://www.jagran.com/cricket/match-report-ipl-2026-mi-vs-lsg-live-score-updates-mumbai-indians-vs-lucknow-super-giants-cricket-match-today-scorecard-playing-11-ipl-news-hardik-pandya-rishabh-pant-lb-30000502.html,2026-05-04T21:13:55+00:00
Delhi-NCR,Jagran,Delhi-NCR • Jagran,https://www.jagran.com/delhi-ncr,68,"बंगाल में TMC की जीत का ‘एम फैक्टर’, ज्यादातर विजेता मुस्लिम समुदाय से",https://www.jagran.com/elections/west-bengal-vidhan-sabha-most-of-the-tmc-winners-in-bengal-are-from-the-muslim-community-40228218.html,2026-05-04T21:13:55+00:00
Delhi-NCR,Jagran,Delhi-NCR • Jagran,https://www.jagran.com/delhi-ncr,69,"West Bengal Vidhan Sabha Election Result 2026: बीजेपी ने बंगाल में जीतीं 206 सीटें, 79 पर TMC का कब्जा; 2 सीटों पर सिमटी कांग्रेस",https://www.jagran.com/politics/national-west-bengal-vidhan-sabha-chunav-result-2026-live-updates-tmc-vs-bjp-vs-congress-293-seats-assembly-election-result-latest-news-in-hindi-lb-30000500.html,2026-05-04T21:13:55+00:00
Delhi-NCR,Jagran,Delhi-NCR • Jagran,https://www.jagran.com/delhi-ncr,70,"West Bengal Vidhan Sabha Election Result 2026: पहले चरण की 152 सीटों में कौन कितनी सीटों पर आगे, देखें लिस्ट",https://www.jagran.com/politics/national-west-bengal-election-trends-bjp-leads-in-north-bengal-40227352.html,2026-05-04T21:13:55+00:00
Delhi-NCR,Jagran,Delhi-NCR • Jagran,https://www.jagran.com/delhi-ncr,71,क्यों फंस गई स्टालिन की अपनी सीट? दो बड़े कारणों से बिगड़ा DMK का समीकरण,https://www.jagran.com/politics/national-stalins-dmk-faces-defeat-in-tamil-nadu-antihindu-politics-blamed-40227685.html,2026-05-04T21:13:55+00:00
Delhi-NCR,Jagran,Delhi-NCR • Jagran,https://www.jagran.com/delhi-ncr,72,Did You Know,https://www.jagran.com/did-you-know-news-hindi.html,2026-05-04T21:13:55+00:00
Delhi-NCR,Jagran,Delhi-NCR • Jagran,https://www.jagran.com/delhi-ncr,73,मिडिल ईस्ट संकट,https://www.jagran.com/topics/Israel-Iran-Conflict,2026-05-04T21:13:55+00:00
Delhi-NCR,Jagran,Delhi-NCR • Jagran,https://www.jagran.com/delhi-ncr,74,विधानसभा चुनाव परिणाम 2026,https://www.jagran.com/topics/assembly-election-2026,2026-05-04T21:13:55+00:00
Delhi-NCR,Jagran,Delhi-NCR • Jagran,https://www.jagran.com/delhi-ncr,75,जबलपुर क्रूज हादसा,https://www.jagran.com/topics/Jabalpur-Cruise,2026-05-04T21:13:55+00:00
Delhi-NCR,Jagran,Delhi-NCR • Jagran,https://www.jagran.com/delhi-ncr,76,Submit your news,https://www.jagran.com/citizen-journalism-hindi.html,2026-05-04T21:13:55+00:00
Delhi-NCR,Jagran,Delhi-NCR • Jagran,https://www.jagran.com/delhi-ncr,77,Message from the Editor,https://www.jagran.com/policies-and-standards.html,2026-05-04T21:13:55+00:00
Hyderabad,DC,Hyderabad • DC,https://www.deccanchronicle.com/location/india/southern-states,1,Assembly Elections 2026,https://www.deccanchronicle.com/assembly-elections-2026,2026-05-04T21:13:55+00:00
Hyderabad,DC,Hyderabad • DC,https://www.deccanchronicle.com/location/india/southern-states,2,Opinion and Editorials,https://www.deccanchronicle.com/opinion,2026-05-04T21:13:55+00:00
Hyderabad,DC,Hyderabad • DC,https://www.deccanchronicle.com/location/india/southern-states,3,Telangana Rising 2047,https://www.deccanchronicle.com/tags/Telangana-Rising-2047,2026-05-04T21:13:55+00:00
Chennai,DC,Chennai • DC,https://www.deccanchronicle.com/location/india/tamil-nadu/chennai-madras,1,Assembly Elections 2026,https://www.deccanchronicle.com/assembly-elections-2026,2026-05-04T21:13:55+00:00
Chennai,DC,Chennai • DC,https://www.deccanchronicle.com/location/india/tamil-nadu/chennai-madras,2,Opinion and Editorials,https://www.deccanchronicle.com/opinion,2026-05-04T21:13:55+00:00
Chennai,DC,Chennai • DC,https://www.deccanchronicle.com/location/india/tamil-nadu/chennai-madras,3,Telangana Rising 2047,https://www.deccanchronicle.com/tags/Telangana-Rising-2047,2026-05-04T21:13:55+00:00
Chennai,The Hindu,Chennai • The Hindu,https://www.thehindu.com/news/cities/chennai/,1,AIADMK suffers major losses in its traditional stronghold,https://www.thehindu.com/elections/tamil-nadu-assembly/tamil-nadu-assembly-election-2026-aiadmk-suffers-major-losses-in-its-traditional-stronghold/article70940010.ece,2026-05-04T21:13:55+00:00
Chennai,The Hindu,Chennai • The Hindu,https://www.thehindu.com/news/cities/chennai/,2,DMK wins two of five constituencies in north Chennai,https://www.thehindu.com/news/cities/chennai/dmk-wins-two-of-five-constituencies-in-north-chennai/article70939805.ece,2026-05-04T21:13:55+00:00
Chennai,The Hindu,Chennai • The Hindu,https://www.thehindu.com/news/cities/chennai/,3,The Gen Z vote that shook the Tamil Nadu elections,https://www.thehindu.com/news/cities/chennai/the-gen-z-vote-that-shook-the-tamil-nadu-elections/article70939888.ece,2026-05-04T21:13:55+00:00
Chennai,The Hindu,Chennai • The Hindu,https://www.thehindu.com/news/cities/chennai/,4,DMK’s fortress of Chennai breached like never before,https://www.thehindu.com/data/tamil-nadu-assembly-election-results-2026-tvk-dmk-aiadmk-vijay-stalin-chennai/article70938658.ece,2026-05-04T21:13:55+00:00
Chennai,The Hindu,Chennai • The Hindu,https://www.thehindu.com/news/cities/chennai/,5,"Tamil Nadu CM M.K. Stalin defeated in Kolathur: who is TVK’s V.S. Babu, the winner?",https://www.thehindu.com/elections/tamil-nadu-assembly/tamil-nadu-cm-mk-stalin-defeated-in-kolathur-who-is-tvks-vs-babu-the-winner/article70938429.ece,2026-05-04T21:13:55+00:00
Chennai,The Hindu,Chennai • The Hindu,https://www.thehindu.com/news/cities/chennai/,6,"TVK chief Vijay makes stunning debut, disrupts T.N.’s bipolar politics but falls short of magic figure",https://www.thehindu.com/elections/tamil-nadu-assembly/tamil-nadu-assembly-elections-2026-results-tvk-chief-vijay-makes-stunning-debut-disrupts-state-bipolar-politics/article70939583.ece,2026-05-04T21:13:55+00:00
Chennai,The Hindu,Chennai • The Hindu,https://www.thehindu.com/news/cities/chennai/,7,"No wins for women candidates of DMK, BJP; TVK’s newcomers unseat veterans",https://www.thehindu.com/news/national/tamil-nadu/no-wins-for-women-candidates-of-dmk-bjp-tvks-newcomers-unseat-veterans/article70939678.ece,2026-05-04T21:13:55+00:00
Chennai,The Hindu,Chennai • The Hindu,https://www.thehindu.com/news/cities/chennai/,8,"DMK would function as efficient Opposition, says M. K. Stalin",https://www.thehindu.com/elections/tamil-nadu-assembly/dmk-would-function-as-efficient-opposition-says-m-k-stalin/article70939703.ece,2026-05-04T21:13:55+00:00
Chennai,The Hindu,Chennai • The Hindu,https://www.thehindu.com/news/cities/chennai/,9,A garbage bin in Chennai Metropolitan Area that combines sustainability and aesthetics,https://www.thehindu.com/news/cities/chennai/a-garbage-bin-in-chennai-metropolitan-area-that-combines-sustainability-and-aesthetics/article70934386.ece,2026-05-04T21:13:55+00:00
Chennai,The Hindu,Chennai • The Hindu,https://www.thehindu.com/news/cities/chennai/,10,Read books at Kolapakkam ration shop,https://www.thehindu.com/news/cities/chennai/read-books-atkolapakkamration-shop/article70932141.ece,2026-05-04T21:13:55+00:00
Chennai,The Hindu,Chennai • The Hindu,https://www.thehindu.com/news/cities/chennai/,11,A wedding with purpose: couple turns non-recyclable plastic waste into stage decor,https://www.thehindu.com/news/cities/chennai/a-wedding-with-purpose-couple-turns-non-recyclable-plastic-waste-into-stage-decor/article70932046.ece,2026-05-04T21:13:55+00:00
Chennai,The Hindu,Chennai • The Hindu,https://www.thehindu.com/news/cities/chennai/,12,Garbage dump fire chokes residential zone in Perumbakkam,https://www.thehindu.com/news/cities/chennai/garbage-dumpfire-chokes-residential-zone-in-perumbakkam/article70934260.ece,2026-05-04T21:13:55+00:00
Chennai,The Hindu,Chennai • The Hindu,https://www.thehindu.com/news/cities/chennai/,13,Missing: Chennai’s new master plan,https://www.thehindu.com/news/national/tamil-nadu/missing-chennais-new-master-plan/article70932917.ece,2026-05-04T21:13:55+00:00
Chennai,The Hindu,Chennai • The Hindu,https://www.thehindu.com/news/cities/chennai/,14,"Uthandi residents raise concerns over ₹91-crore flood canal project, flag environmental and groundwater risks",https://www.thehindu.com/news/cities/chennai/uthandi-residents-raise-concerns-over-91-crore-flood-canal-project-flag-environmental-and-groundwater-risks/article70915751.ece,2026-05-04T21:13:55+00:00
