city,publisher,source,source_url,rank,headline,link,collected_at_iso
Pune,Pune Mirror,Pune • Pune Mirror,https://punemirror.com/,10,"Lohagad Murder Probe: Police Recreate Crime Scene With Chetan Chaudhary, Focus on Gait Analysis",https://punemirror.com/city/pune/lohagad-murder-case-chetan-chaudhary-crime-scene-reconstruction/,2026-07-01T12:43:09+00:00
Pune,Pune Mirror,Pune • Pune Mirror,https://punemirror.com/,11,OnePlus N6 battery delivers powerful boost for budget buyers,https://punemirror.com/technology/oneplus-n6-battery-budget-india-launch/,2026-07-01T12:43:09+00:00
Pune,Pune Mirror,Pune • Pune Mirror,https://punemirror.com/,12,Amazon Prime Day OnePlus deals unlock powerful savings for buyers,https://punemirror.com/business/amazon-prime-day-oneplus-deals-sale/,2026-07-01T12:43:09+00:00
Pune,Pune Mirror,Pune • Pune Mirror,https://punemirror.com/,13,"iOS 26.5.2 security update delivers urgent, powerful protection",https://punemirror.com/technology/ios-26-5-2-security-update-ai-threats/,2026-07-01T12:43:09+00:00
Pune,Pune Mirror,Pune • Pune Mirror,https://punemirror.com/,14,Samsung Galaxy Ring 2 Powerful Shift Promises Smarter Health,https://punemirror.com/technology/samsung-galaxy-ring-2-ai-health-iphone/,2026-07-01T12:43:09+00:00
Pune,Pune Mirror,Pune • Pune Mirror,https://punemirror.com/,15,Ketan Agarwal Case: Police to Conduct Gait Analysis of Accused as Probe Enters Critical Phase,https://punemirror.com/city/pune/ketan-agarwal-case-gait-analysis-chetan-chaudhary-police-custody-july-3/,2026-07-01T12:43:09+00:00
Pune,Pune Mirror,Pune • Pune Mirror,https://punemirror.com/,16,Welcome to the Jungle OTT release: promising signs for JioHotstar debut,https://punemirror.com/entertainment/welcome-to-the-jungle-ott-release-update/,2026-07-01T12:43:09+00:00
Pune,Pune Mirror,Pune • Pune Mirror,https://punemirror.com/,17,"Samsung Galaxy M47 5G: Powerful, promising mid-range upgrade",https://punemirror.com/technology/samsung-galaxy-m47-5g-battery-price-india/,2026-07-01T12:43:09+00:00
Pune,Pune Mirror,Pune • Pune Mirror,https://punemirror.com/,18,iPhone 17 price hike shock: Power warning for Indian buyers,https://punemirror.com/technology/iphone-17-price-hike-india-rumours/,2026-07-01T12:43:09+00:00
Pune,Pune Mirror,Pune • Pune Mirror,https://punemirror.com/,19,"Google Pixel 10 deal delivers massive, exciting savings",https://punemirror.com/technology/google-pixel-10-deal-big-discount-amazon/,2026-07-01T12:43:09+00:00
Pune,Pune Mirror,Pune • Pune Mirror,https://punemirror.com/,20,EPFO 3.0 PF withdrawal delivers powerful relief for workers,https://punemirror.com/business/epfo-3-0-pf-withdrawal-upi-atm-benefits/,2026-07-01T12:43:09+00:00
Pune,Pune Mirror,Pune • Pune Mirror,https://punemirror.com/,21,PMC Launches ‘Seva Wari’ Initiative to Welcome Lakhs of Warkaris During Palkhi Stay in Pune,https://punemirror.com/city/pune/pmc-seva-wari-initiative-palkhi-pune-warkari-facilities/,2026-07-01T12:43:09+00:00
Pune,Pune Mirror,Pune • Pune Mirror,https://punemirror.com/,22,"Property Dispute, Domestic Discord Turn Fatal in Pimpri-Chinchwad",https://punemirror.com/city/pune/pimpri-chinchwad-two-murders-property-dispute-domestic-killing/,2026-07-01T12:43:09+00:00
Pune,Pune Mirror,Pune • Pune Mirror,https://punemirror.com/,23,Siya’s Brother Sahil Goyal Faces ₹10 Crore Legal Notice Over Lawyer Dispute,https://punemirror.com/city/pune/siyas-brother-sahil-goyal-faces-%e2%82%b910-crore-legal-notice-over-lawyer-dispute/,2026-07-01T12:43:09+00:00
Pune,Pune Mirror,Pune • Pune Mirror,https://punemirror.com/,24,"Centre Revises Toll Norms: Minimum 60 km Gap Between Toll Plazas on New Highways, Expressways",https://punemirror.com/city/pune/centre-new-toll-rules-60-km-gap-between-toll-plazas/,2026-07-01T12:43:09+00:00
Pune,Pune Mirror,Pune • Pune Mirror,https://punemirror.com/,25,Family Alleges Medical Negligence After Newborn Dies During Delivery at Wagholi Hospital,https://punemirror.com/city/pune/kesnand-hospital-medical-negligence-newborn-death-wagholi/,2026-07-01T12:43:09+00:00
Pune,Pune Mirror,Pune • Pune Mirror,https://punemirror.com/,26,MSRTC Officials Get One-Month Deadline to Improve Performance or Face Disciplinary Action,https://punemirror.com/city/pune/msrtc-officials-one-month-performance-review-disciplinary-action/,2026-07-01T12:43:09+00:00
Pune,Pune Mirror,Pune • Pune Mirror,https://punemirror.com/,27,Rockfall Damages Car Inside Mumbai-Pune Expressway Missing Link Tunnel; Driver Escapes Unhurt,https://punemirror.com/city/pune/mumbai-pune-expressway-missing-link-tunnel-rockfall-car/,2026-07-01T12:43:09+00:00
Pune,Pune Mirror,Pune • Pune Mirror,https://punemirror.com/,28,PCMC Employee Arrested for Molesting Woman Teacher at Zonal Office,https://punemirror.com/city/pcmc/pcmc-employee-arrested-woman-molestation-census-duty/,2026-07-01T12:43:09+00:00
Pune,Pune Mirror,Pune • Pune Mirror,https://punemirror.com/,29,"Pimpri-Chinchwad May Shut Swimming Pools, Warns of Water Cuts if Monsoon Delay Continues",https://punemirror.com/city/pcmc/pimpri-chinchwad-water-crisis-swimming-pools-water-cuts/,2026-07-01T12:43:09+00:00
Pune,Pune Mirror,Pune • Pune Mirror,https://punemirror.com/,30,Chaos over ‘nominated corporators,https://punemirror.com/city/pune/pcmc-nominated-corporator-appointment-row/,2026-07-01T12:43:09+00:00
Pune,Pune Mirror,Pune • Pune Mirror,https://punemirror.com/,31,"Woman Held for Attempted Child Abduction in Pimpri-Chinchwad; Knife, Sedatives Found",https://punemirror.com/city/pune/pimpri-chinchwad-child-abduction-attempt-woman-held/,2026-07-01T12:43:09+00:00
Pune,Pune Mirror,Pune • Pune Mirror,https://punemirror.com/,32,"Tamara Residents Flag Safety Lapses, Move PCMC Against Builder",https://punemirror.com/city/pcmc/tamara-society-pcmc-builder-safety-complaint/,2026-07-01T12:43:09+00:00
Pune,Pune Mirror,Pune • Pune Mirror,https://punemirror.com/,33,Six-Woman Gang Held for Stealing Gold from Bus Passengers in Pimpri Chinchwad,https://punemirror.com/city/pcmc/pimpri-chinchwad-bus-jewellery-theft-women-gang/,2026-07-01T12:43:09+00:00
Pune,Pune Mirror,Pune • Pune Mirror,https://punemirror.com/,34,"PCMC Plans ₹243 Crore Road Repairs Across 306 km, Focus on Data-Driven Maintenance",https://punemirror.com/city/pcmc/pcmc-road-repair-plan-243-crore-gis-rams/,2026-07-01T12:43:09+00:00
Pune,Pune Mirror,Pune • Pune Mirror,https://punemirror.com/,35,Civic body stares at financial crisis,https://punemirror.com/city/pcmc/pcmc-metro-development-charges-liability/,2026-07-01T12:43:09+00:00
Pune,Pune Mirror,Pune • Pune Mirror,https://punemirror.com/,36,Major drug bust in twin towns,https://punemirror.com/city/pcmc/pimpri-chinchwad-narcotics-warehouse-raid/,2026-07-01T12:43:09+00:00
Pune,Pune Mirror,Pune • Pune Mirror,https://punemirror.com/,37,Cockroach Janta Party Founder Abhijeet Dipke Allegedly Assaulted During Jaipur Protest,https://punemirror.com/news/abhijeet-dipke-assaulted-during-youth-protest-at-jaipur-shaheed-smarak/,2026-07-01T12:43:09+00:00
Pune,Pune Mirror,Pune • Pune Mirror,https://punemirror.com/,38,"LPG Rules changing from June 1, Government Enforces One Connection Per Household",https://punemirror.com/news/lpg-rules-changing-from-june-1-government-enforces-one-connection-per-household/,2026-07-01T12:43:09+00:00
Pune,Pune Mirror,Pune • Pune Mirror,https://punemirror.com/,39,POWER BANK CATCHES FIRE ON INDIGO FLIGHT AT CHANDIGARH AIRPORT; 6 INJURED IN EMERGENCY EVACUATION,https://punemirror.com/news/indigo-power-bank-fire-chandigarh-airport-emergency-evacuation-may-2026/,2026-07-01T12:43:09+00:00
Pune,Pune Mirror,Pune • Pune Mirror,https://punemirror.com/,40,Suvendu Adhikari’s Personal Assistant Shot Dead In Post-Poll Violence In West Bengal,https://punemirror.com/news/suvendu-adhikari-pa-chandranath-rath-shot-dead-west-bengal-post-poll-violence-2026/,2026-07-01T12:43:09+00:00
Pune,Pune Mirror,Pune • Pune Mirror,https://punemirror.com/,41,Indus Waters Treaty Shines as New India-Pakistan Flashpoint After Track-2 Discussions Trigger Speculation,https://punemirror.com/india/indus-waters-treaty-india-pakistan-track-2-talks/,2026-07-01T12:43:09+00:00
Pune,Pune Mirror,Pune • Pune Mirror,https://punemirror.com/,42,"Flames, Fear, and a Frantic Monday: Fire Tears Through Lucknow Coaching Centre as Students Leap for Their Lives",https://punemirror.com/news/flames-fear-and-a-frantic-monday-fire-tears-through-lucknow-coaching-centre-as-students-leap-for-their-lives/,2026-07-01T12:43:09+00:00
Pune,Pune Mirror,Pune • Pune Mirror,https://punemirror.com/,43,Relief on the Horizon: 40 LPG Tankers Head to India as Hormuz Strait Re-opnens,https://punemirror.com/india/india-40-lpg-tankers-hormuz-route-reopens-relief/,2026-07-01T12:43:09+00:00
Pune,Pune Mirror,Pune • Pune Mirror,https://punemirror.com/,44,Cockroach Janta Party in open letter to PM Modi Demands Rs. 1 Crore for Families of NEET Students Who Died by Suicide,https://punemirror.com/india/cockroach-janta-party-neet-row-open-letter-pm-modi/,2026-07-01T12:43:09+00:00
Pune,Pune Mirror,Pune • Pune Mirror,https://punemirror.com/,45,Petrol diesel sale restrictions decisively lifted as Centre eases emergency fuel curbs,https://punemirror.com/business/petrol-diesel-sale-restrictions-end-july-1/,2026-07-01T12:43:09+00:00
Pune,Pune Mirror,Pune • Pune Mirror,https://punemirror.com/,46,Flipkart GOAT Sale iPhone Deals Unlock Stunning Savings,https://punemirror.com/business/flipkart-goat-sale-iphone-deals-2026/,2026-07-01T12:43:09+00:00
Pune,Pune Mirror,Pune • Pune Mirror,https://punemirror.com/,47,"Anant Ambani Donates 25 Electric Buses to TTD, Adding to Tirumala’s Growing EV Fleet",https://punemirror.com/business/anant-ambani-donates-25-electric-buses-to-ttd-adding-to-tirumalas-growing-ev-fleet/,2026-07-01T12:43:09+00:00
Pune,Pune Mirror,Pune • Pune Mirror,https://punemirror.com/,48,Amazon Prime Day 2026 delivers spectacular smartphone savings,https://punemirror.com/business/amazon-prime-day-2026-smartphone-deals/,2026-07-01T12:43:09+00:00
Pune,Pune Mirror,Pune • Pune Mirror,https://punemirror.com/,49,"India LPG imports Strait of Hormuz crisis shows fragile relief, powerful warning",https://punemirror.com/world/india-lpg-imports-strait-of-hormuz/,2026-07-01T12:43:09+00:00
Pune,Pune Mirror,Pune • Pune Mirror,https://punemirror.com/,50,"PM MODI ARRIVES IN FRANCE, FOCUSING ON TECH, DIPLOMACY AND G7 SUMMIT",https://punemirror.com/world/pm-modi-france-visit-nice-macron-g7-summit/,2026-07-01T12:43:09+00:00
Pune,Pune Mirror,Pune • Pune Mirror,https://punemirror.com/,51,Three Indian sailors killed in US strike on oil tanker off Oman coast,https://punemirror.com/world/indian-sailors-killed-us-strike-oman-oil-tanker/,2026-07-01T12:43:09+00:00
Pune,Pune Mirror,Pune • Pune Mirror,https://punemirror.com/,52,Trump not being taken seriously,https://punemirror.com/world/trump-mixed-signals-iran-war-leadership-global-concerns/,2026-07-01T12:43:09+00:00
Pune,Pune Mirror,Pune • Pune Mirror,https://punemirror.com/,53,"Affordable EVs in India: Exciting Hyundai, Kia plan to challenge Tata Nexon EV",https://punemirror.com/automobile/affordable-evs-in-india-hyundai-kia-nexon/,2026-07-01T12:43:09+00:00
Pune,Pune Mirror,Pune • Pune Mirror,https://punemirror.com/,54,New Renault Duster Export Kicks Off From Chennai,https://punemirror.com/business/new-renault-duster-export-india-africa/,2026-07-01T12:43:09+00:00
Pune,Pune Mirror,Pune • Pune Mirror,https://punemirror.com/,55,New Toyota Hilux India Launch: Stunning Upgrade Set To Shake Up Pickup Segment,https://punemirror.com/automobile/new-toyota-hilux-india-launch-28-july/,2026-07-01T12:43:09+00:00
Pune,Pune Mirror,Pune • Pune Mirror,https://punemirror.com/,56,Mahindra Vision S Baby Scorpio N: Exciting Rugged SUV Sets Bold New Benchmark,https://punemirror.com/automobile/mahindra-vision-s-baby-scorpio-n-suv-2027/,2026-07-01T12:43:09+00:00
Pune,Pune Mirror,Pune • Pune Mirror,https://punemirror.com/,57,Samsung Health update delivers powerful new heart health boost,https://punemirror.com/technology/samsung-health-update-vitals-heart-score/,2026-07-01T12:43:09+00:00
Pune,Pune Mirror,Pune • Pune Mirror,https://punemirror.com/,58,Flat stomach obsession: Taapsee Pannu’s powerful wake-up call,https://punemirror.com/health/flat-stomach-obsession-taapsee-body-positivity/,2026-07-01T12:43:09+00:00
Pune,Pune Mirror,Pune • Pune Mirror,https://punemirror.com/,59,Why Migraine Is More Than Just a Headache,https://punemirror.com/health/migraine-morethan-headache/,2026-07-01T12:43:09+00:00
Pune,Pune Mirror,Pune • Pune Mirror,https://punemirror.com/,60,Two-week social media break delivers powerful mental health boost,https://punemirror.com/health/two-week-social-media-break-brain-benefits/,2026-07-01T12:43:09+00:00
Pune,Pune Mirror,Pune • Pune Mirror,https://punemirror.com/,61,Meta FIFA World Cup 2026 features deliver powerful fan boost,https://punemirror.com/sports/meta-fifa-world-cup-2026-features/,2026-07-01T12:43:09+00:00
Pune,Pune Mirror,Pune • Pune Mirror,https://punemirror.com/,62,FIFA World Cup Launch Edition Delivers Powerful New Netflix Gaming Boost,https://punemirror.com/sports/fifa-world-cup-launch-edition-game/,2026-07-01T12:43:09+00:00
Pune,Pune Mirror,Pune • Pune Mirror,https://punemirror.com/,63,Virat Kohli Ruled out of ODI Series Due To Hamstring Injury,https://punemirror.com/sports/viratkohli-odi-ruledout-sports-injury/,2026-07-01T12:43:09+00:00
Pune,Pune Mirror,Pune • Pune Mirror,https://punemirror.com/,64,RCB Win Back-To-Back Ipl Titles But No Victory Parade In Bengaluru,https://punemirror.com/sports/cricket/rcb-ipl-2026-title-no-victory-parade-bengaluru-stampede-2025-dk-shivakumar-june-2026/,2026-07-01T12:43:09+00:00
Pune,Pune Mirror,Pune • Pune Mirror,https://punemirror.com/,65,The Device on Deepinder Goyal’s Temple That Stole the Spotlight — and Why the Internet Is Split,https://punemirror.com/trending/deepinder-goyal-temple-device-podcast-viral/,2026-07-01T12:43:09+00:00
Pune,Pune Mirror,Pune • Pune Mirror,https://punemirror.com/,66,The Hyper-Speed Era: Why Everything Is a ‘Trend’ and Nothing Lasts,https://punemirror.com/trending/why-everything-is-a-trend-and-nothing-lasts/,2026-07-01T12:43:09+00:00
Pune,Pune Mirror,Pune • Pune Mirror,https://punemirror.com/,67,Amazon Black Friday OnePlus Deals 2025: Massive Savings on Flagship Phones,https://punemirror.com/technology/amazon-black-friday-oneplus-deals-2025/,2026-07-01T12:43:09+00:00
Pune,Pune Mirror,Pune • Pune Mirror,https://punemirror.com/,68,Nobel Prize 2025: Discovery of Regulatory T-Cells and FOXP3 Gene Wins Medicine Award,https://punemirror.com/news/nobel-prize-2025-discovery-of-regulatory-t-cells-and-foxp3-gene-wins-medicine-award/,2026-07-01T12:43:09+00:00
Pune,Pune Mirror,Pune • Pune Mirror,https://punemirror.com/,69,Pahalgam terrorist gunned down; Three killed in J-K encounter,https://punemirror.com/trending/pahalgam-terrorist-gunned-down-three-killed-in-j-k-encounter/,2026-07-01T12:43:09+00:00
Pune,Pune Mirror,Pune • Pune Mirror,https://punemirror.com/,70,Startup India Fund of Funds 2.0: Powerful Boost for Startups,https://punemirror.com/india/startup-india-fund-of-funds-2-0-boost/,2026-07-01T12:43:09+00:00
Pune,Pune Mirror,Pune • Pune Mirror,https://punemirror.com/,71,Sarvam AI Bulbul V3 delivers stunning win over global AI rivals,https://punemirror.com/technology/ai/sarvam-ai-bulbul-v3-outshines-rivals/,2026-07-01T12:43:09+00:00
Pune,Pune Mirror,Pune • Pune Mirror,https://punemirror.com/,72,The Startup Evolution: From Survival Mode to Sustainable Success,https://punemirror.com/business/startups/from-survival-mode-to-sustainable-success/,2026-07-01T12:43:09+00:00
Pune,Pune Mirror,Pune • Pune Mirror,https://punemirror.com/,73,6 fast and nutritious oat breakfast recipes to get you going,https://punemirror.com/lifestyle/healthy-oat-breakfast-recipes/,2026-07-01T12:43:09+00:00
Pune,Pune Mirror,Pune • Pune Mirror,https://punemirror.com/,74,Why Youngsters Prefer Late-Night Rides Despite Safety Risks,https://punemirror.com/lifestyle/latenight-ride-youngsters-freedom/,2026-07-01T12:43:09+00:00
Pune,Pune Mirror,Pune • Pune Mirror,https://punemirror.com/,75,"Air India To Cut Domestic Flights By 22%, International By 27% As High Fuel Prices Squeeze Operations",https://punemirror.com/lifestyle/travel/air-india-domestic-flights-cut-22-percent-fuel-prices-june-august-2026/,2026-07-01T12:43:09+00:00
Pune,Pune Mirror,Pune • Pune Mirror,https://punemirror.com/,76,"Denim Comeback: How Old-School Jeans Styles Are Returning, Low-Waist Vs High-Waist Jeans: What’s Trending In 2026",https://punemirror.com/lifestyle/denimcomeback-fashiontrend-jeans/,2026-07-01T12:43:09+00:00
Pune,Pune Mirror,Pune • Pune Mirror,https://punemirror.com/,77,Why is this generation delaying and questioning marriage,https://punemirror.com/news/why-is-this-generation-delaying-and-questioning-marriage/,2026-07-01T12:43:09+00:00
Pune,Pune Mirror,Pune • Pune Mirror,https://punemirror.com/,78,EPFO services unavailable: urgent warning as major system upgrade pauses key PF facilities,https://punemirror.com/business/finance/epfo-services-unavailable-june-26-29-upgrade/,2026-07-01T12:43:09+00:00
Pune,Pune Mirror,Pune • Pune Mirror,https://punemirror.com/,79,PhonePe inactive wallet fee draws backlash over Rs 100 charge,https://punemirror.com/business/phonepe-inactive-wallet-fee-rs100-quarterly/,2026-07-01T12:43:09+00:00
Pune,Pune Mirror,Pune • Pune Mirror,https://punemirror.com/,80,RBI WhatsApp phishing scam sparks dangerous new fraud warning,https://punemirror.com/business/rbi-whatsapp-phishing-scam-warning/,2026-07-01T12:43:09+00:00
Pune,Pune Mirror,Pune • Pune Mirror,https://punemirror.com/,81,South Korea sixth-largest stock market triumphs in stunning AI-fuelled surge,https://punemirror.com/business/finance/south-korea-sixth-largest-stock-market/,2026-07-01T12:43:09+00:00
Pune,Pune Mirror,Pune • Pune Mirror,https://punemirror.com/,82,UPI transactions May 2026 deliver stunning record high,https://punemirror.com/business/upi-transactions-may-2026-record-surge-india/,2026-07-01T12:43:09+00:00
Pune,Pune Mirror,Pune • Pune Mirror,https://punemirror.com/,83,Death Sentence in Nasrapur Child Murder Case,https://punemirror.com/city/pune/nasrapur-horror-convict-gets-death-penalty/,2026-07-01T12:43:09+00:00
Pune,Pune Mirror,Pune • Pune Mirror,https://punemirror.com/,84,Lohagad Murder Probe: Police Send Accused’s Phones for Forensic Analysis After Alleged Deletion of Chats,https://punemirror.com/city/pune/lohagad-murder-deleted-chats-forensic-probe-siya-goyal-chetan-chaudhary/,2026-07-01T12:43:09+00:00
Pune,Pune Mirror,Pune • Pune Mirror,https://punemirror.com/,85,Lohagad Murder Probe: Accused Shift Blame on Each Other as Police Uncover Fresh Interrogation Details,https://punemirror.com/city/pune/lohagad-murder-case-siya-goyal-chetan-chaudhary-conflicting-statements-police-probe/,2026-07-01T12:43:09+00:00
Pune,Pune Mirror,Pune • Pune Mirror,https://punemirror.com/,86,"Lohagad Murder Case: Siya Goyal’s Parents Break Silence, Seek Strictest Punishment if Daughter Is Found Guilty",https://punemirror.com/city/pune/lohagad-murder-case-siya-goyal-parents-break-silence-demand-strict-punishment/,2026-07-01T12:43:09+00:00
Pune,Pune Mirror,Pune • Pune Mirror,https://punemirror.com/,87,Hoodie Clue Cracks Lohagad Death Mystery: How a Pune Businessman’s ‘Accidental Fall’ Turned Into an Alleged Murder Case,https://punemirror.com/city/pune/hoodie-clue-ketan-agrawal-lohagad-fort-murder-investigation/,2026-07-01T12:43:09+00:00
Pune,Pune Mirror,Pune • Pune Mirror,https://punemirror.com/,88,Samsung Galaxy S25 Flipkart GOAT Sale Brings Stunning Discount Win,https://punemirror.com/technology/samsung-galaxy-s25-flipkart-goat-sale/,2026-07-01T12:43:09+00:00
Pune,Pune Mirror,Pune • Pune Mirror,https://punemirror.com/,89,"Airtel Netflix prepaid plans deliver powerful value under Rs 2,000",https://punemirror.com/news/airtel-netflix-prepaid-plans-guide/,2026-07-01T12:43:09+00:00
Pune,Pune Mirror,Pune • Pune Mirror,https://punemirror.com/,90,Labourer’s Death Under JCB Allegedly Covered Up as Road Accident; Four Booked in Pune District,https://punemirror.com/news/pune-labourer-jcb-death-coverup-daund-four-booked/,2026-07-01T12:43:09+00:00
Pune,Pune Mirror,Pune • Pune Mirror,https://punemirror.com/,91,"Palkhi Procession: Traffic Diversions Announced on Pune–Saswad, Jejuri and Phaltan Routes From July 11",https://punemirror.com/city/pune/palkhi-procession-traffic-diversions-pune-saswad-jejuri-july-2026/,2026-07-01T12:43:09+00:00
Pune,Pune Mirror,Pune • Pune Mirror,https://punemirror.com/,92,From Passport Fees to Credit Card Benefits: Key Rule Changes Effective From July 1,https://punemirror.com/city/pune/july-1-rule-changes-passport-aadhaar-credit-cards-fuel-sales/,2026-07-01T12:43:09+00:00
Pune,Pune Mirror,Pune • Pune Mirror,https://punemirror.com/,93,"Scrap Collector Robbed After Accepting Truck Ride, Dies in Separate Road Accident Near Shirur",https://punemirror.com/city/pune/shirur-scrap-collector-robbery-road-accident-death/,2026-07-01T12:43:09+00:00
Pune,Pune Mirror,Pune • Pune Mirror,https://punemirror.com/,94,"Lohagad Murder Case: Accused Rehearsed Alleged Push Before Killing Ketan Agarwal, Police Say",https://punemirror.com/city/pune/lohagad-murder-case-rehearsal-lullanagar-ketan-agarwal/,2026-07-01T12:43:09+00:00
Pune,Pune Mirror,Pune • Pune Mirror,https://punemirror.com/,95,Wild Gaur (Bison) Rescued After Getting Trapped Between Pipelines in Pune’s Sinhagad Road Area; Multi-Agency Operation Launched,https://punemirror.com/city/pune/wild-gaur-rescue-pune-sinhagad-road-pipeline-operation/,2026-07-01T12:43:09+00:00
Pune,Pune Mirror,Pune • Pune Mirror,https://punemirror.com/,96,Shelter Home Operator Booked After Employee’s Death; Suicide Note Alleges Workplace Harassment,https://punemirror.com/city/pune/fursungi-shelter-home-employee-death-suicide-note-harassment-case/,2026-07-01T12:43:09+00:00
Pune,Pune Mirror,Pune • Pune Mirror,https://punemirror.com/,97,Pune Likely to Receive Stronger Rainfall Over Next Few Days: IMD,https://punemirror.com/city/pune/weather/pune-weather-update-imd-rain-thunderstorm-forecast-next-three-days/,2026-07-01T12:43:09+00:00
Pune,Pune Mirror,Pune • Pune Mirror,https://punemirror.com/,98,"Siya Goyal, Alleged Lover Remanded To Five More Days’ Custody In Ketan Agrawal Murder Case",https://punemirror.com/city/pune/siya-goyal-chetan-chaudhary-custody-ketan-agrawal-murder/,2026-07-01T12:43:09+00:00
Pune,Pune Mirror,Pune • Pune Mirror,https://punemirror.com/,99,Central Railway to Run 16 Special Trains for Ashadhi Wari Pilgrims Bound for Pandharpur,https://punemirror.com/city/pune/ashadhi-wari-2026-central-railway-16-special-trains-pandharpur-pilgrims/,2026-07-01T12:43:09+00:00
Pune,Pune Mirror,Pune • Pune Mirror,https://punemirror.com/,100,Ketan Agarwal Death Case: Confusion Over Siya Goyal’s Legal Representation After Family Distances Itself from Lawyer,https://punemirror.com/city/pune/ketan-agarwal-murder-siya-goyal-lawyer-confusion-family-denies-advocate/,2026-07-01T12:43:09+00:00
Pune,Pune Mirror,Pune • Pune Mirror,https://punemirror.com/,101,Pune Traffic Diversions Announced for Sant Dnyaneshwar Maharaj Palkhi Procession,https://punemirror.com/city/pune/pune-palkhi-2026-traffic-diversions-alternate-routes-july-11-18/,2026-07-01T12:43:09+00:00
Pune,Pune Mirror,Pune • Pune Mirror,https://punemirror.com/,102,"Ketan Agarwal Homiside Probe: Police Trace Financial Trail, Udaipur Trip and Alleged Conspiracy",https://punemirror.com/city/pune/ketan-agarwal-murder-money-trail-udaipur-trip-deleted-chats/,2026-07-01T12:43:09+00:00
Pune,Pune Mirror,Pune • Pune Mirror,https://punemirror.com/,103,New Car Launch,https://punemirror.com/automobile/new-car-launch/,2026-07-01T12:43:09+00:00
Pune,Pune Mirror,Pune • Pune Mirror,https://punemirror.com/,104,"Amaal Mallik, on the Ketan Agarwal murder case, wants accountability for modern relationships",https://punemirror.com/entertainment/amaal-mallik-reacts-ketan-agarwal-murder-case/,2026-07-01T12:43:09+00:00
Pune,Pune Mirror,Pune • Pune Mirror,https://punemirror.com/,105,Xbox price hike shock: Microsoft’s bold move rattles gamers,https://punemirror.com/entertainment/xbox-price-hike-microsoft-august-2026/,2026-07-01T12:43:09+00:00
Pune,Pune Mirror,Pune • Pune Mirror,https://punemirror.com/,106,Cocktail 2 OTT Release Brings Surprising Box Office Triumph,https://punemirror.com/entertainment/cocktail-2-ott-release-netflix/,2026-07-01T12:43:09+00:00
Pune,Pune Mirror,Pune • Pune Mirror,https://punemirror.com/,107,The Devil Wears Prada 2 OTT delivers powerful streaming debut on JioHotstar,https://punemirror.com/entertainment/the-devil-wears-prada-2-ott-release-jiohotstar/,2026-07-01T12:43:09+00:00
Pune,Pune Mirror,Pune • Pune Mirror,https://punemirror.com/,108,ONMO+ cloud gaming delivers powerful boost to Indian gamers,https://punemirror.com/entertainment/onmo-cloud-gaming-india/,2026-07-01T12:43:09+00:00
Pune,Pune Mirror,Pune • Pune Mirror,https://punemirror.com/,109,"Panchayat season 5 delivers hopeful, powerful return in 2026",https://punemirror.com/entertainment/panchayat-season-5-2026-prime-video/,2026-07-01T12:43:09+00:00
Pune,Pune Mirror,Pune • Pune Mirror,https://punemirror.com/,110,Agent Kim Reactivated thrillingly escalates Netflix action stakes,https://punemirror.com/entertainment/agent-kim-reactivated-netflix-thriller/,2026-07-01T12:43:09+00:00
Pune,Pune Mirror,Pune • Pune Mirror,https://punemirror.com/,111,"One Piece season 3: One Piece delivers thrilling, ambitious Alabasta saga",https://punemirror.com/entertainment/one-piece-season-3-alabasta-2027/,2026-07-01T12:43:09+00:00
