city,publisher,source,source_url,rank,headline,link,collected_at_iso
Bengaluru,DC,Bengaluru • DC,https://www.deccanchronicle.com/location/india/karnataka/bengaluru,1,FIFA World Cup 2026,https://www.deccanchronicle.com/fifa-world-cup-2026,2026-07-10T11:10:36+00:00
Bengaluru,DC,Bengaluru • DC,https://www.deccanchronicle.com/location/india/karnataka/bengaluru,2,Opinion and Editorials,https://www.deccanchronicle.com/opinion,2026-07-10T11:10:36+00:00
Bengaluru,DC,Bengaluru • DC,https://www.deccanchronicle.com/location/india/karnataka/bengaluru,3,Assembly Elections 2026,https://www.deccanchronicle.com/assembly-elections-2026,2026-07-10T11:10:36+00:00
Bengaluru,DC,Bengaluru • DC,https://www.deccanchronicle.com/location/india/karnataka/bengaluru,4,Telangana Rising 2047,https://www.deccanchronicle.com/tags/Telangana-Rising-2047,2026-07-10T11:10:36+00:00
Mumbai,Mumbai Mirror,Mumbai • Mumbai Mirror,https://mumbaimirror.indiatimes.com/mumbai,1,Counting the silent victories,https://mumbaimirror.indiatimes.com/mumbai/counting-the-silent-victories/articleshow/132294992.html,2026-07-10T11:10:36+00:00
Mumbai,Mumbai Mirror,Mumbai • Mumbai Mirror,https://mumbaimirror.indiatimes.com/mumbai,2,A monsoon miracle: Doctors deliver baby by phone lights,https://mumbaimirror.indiatimes.com/mumbai/a-monsoon-miracle-doctors-deliver-baby-by-phone-lights/articleshow/132295715.html,2026-07-10T11:10:36+00:00
Mumbai,Mumbai Mirror,Mumbai • Mumbai Mirror,https://mumbaimirror.indiatimes.com/mumbai,3,Men play the long game,https://mumbaimirror.indiatimes.com/you/men-play-the-long-game/articleshow/132289620.html,2026-07-10T11:10:36+00:00
Mumbai,Mumbai Mirror,Mumbai • Mumbai Mirror,https://mumbaimirror.indiatimes.com/mumbai,4,Italy comes to Mumbai,https://mumbaimirror.indiatimes.com/unwind/italy-comes-to-mumbai/articleshow/132291287.html,2026-07-10T11:10:36+00:00
Mumbai,Mumbai Mirror,Mumbai • Mumbai Mirror,https://mumbaimirror.indiatimes.com/mumbai,5,HC orders return of Jhanvi Kukreja’s belongings,https://mumbaimirror.indiatimes.com/mumbai/hc-orders-return-of-jhanvi-kukrejas-belongings/articleshow/132295097.html,2026-07-10T11:10:36+00:00
Mumbai,Mumbai Mirror,Mumbai • Mumbai Mirror,https://mumbaimirror.indiatimes.com/mumbai,6,"Saved from death, but now forgotten",https://mumbaimirror.indiatimes.com/mumbai/saved-from-death-but-now-forgotten/articleshow/132296067.html,2026-07-10T11:10:36+00:00
Mumbai,Mumbai Mirror,Mumbai • Mumbai Mirror,https://mumbaimirror.indiatimes.com/mumbai,7,Till flood do us part,https://mumbaimirror.indiatimes.com/opinion/till-flood-do-us-part/articleshow/132292591.html,2026-07-10T11:10:36+00:00
Mumbai,Mumbai Mirror,Mumbai • Mumbai Mirror,https://mumbaimirror.indiatimes.com/mumbai,8,Ask The Sexpert,https://mumbaimirror.indiatimes.com/ask-the-sexpert,2026-07-10T11:10:36+00:00
Mumbai,Sakal,Mumbai • Sakal,https://www.esakal.com/pune,1,सकाळ लाईव्ह TV,https://www.esakal.com/live-tv,2026-07-10T11:10:36+00:00
Mumbai,Sakal,Mumbai • Sakal,https://www.esakal.com/pune,2,Refund and Cancellation,https://www.esakal.com/refund-and-cancellation,2026-07-10T11:10:36+00:00
Mumbai,Lokmat,Mumbai • Lokmat,https://www.lokmat.com/city/,1,Live News in Marathi,https://www.lokmat.com/live-news/,2026-07-10T11:10:36+00:00
Mumbai,Lokmat,Mumbai • Lokmat,https://www.lokmat.com/city/,2,गोठ्यात दूध काढण्याचे मशीन सुरू करताना विजेचा धक्का; आंबेगाव तालुक्यातील युवकाचा मृत्यू,https://www.lokmat.com/pune/a-youth-from-ambegaon-taluka-died-after-getting-electrocuted-while-starting-a-milking-machine-in-a-cowshed-a-a727/,2026-07-10T11:10:36+00:00
Mumbai,Lokmat,Mumbai • Lokmat,https://www.lokmat.com/city/,3,केतन अगरवाल हत्या प्रकरणात मोठी घडामोडी; थेट राष्ट्रपती मुर्मू यांच्याकडे धाव! वडिलांनी लिहिले पत्र,https://www.lokmat.com/pune/ketan-agarwal-case-big-developments-in-ketan-agarwal-murder-case-run-directly-to-president-murmu-father-writes-letter-a-a941/,2026-07-10T11:10:36+00:00
Mumbai,Lokmat,Mumbai • Lokmat,https://www.lokmat.com/city/,4,"'हरवलेला आमचा विठ्ठल पुन्हा आम्हाला दे', वारीत अजितदादांचे अनोखे स्मरण; विद्यार्थ्यांकडून वारकऱ्यां",https://www.lokmat.com/pune/pandharpur-wari-2026-give-us-back-our-lost-vitthal-ajitdadas-unique-memory-in-warit-students-provide-water-service-to-warkars-a-a727/,2026-07-10T11:10:36+00:00
Mumbai,Lokmat,Mumbai • Lokmat,https://www.lokmat.com/city/,5,"दोन्ही पालख्या पुण्यात मुक्कामी; वारकऱ्यांनी घेतला पुणे मेट्रोने प्रवास करण्याचा आनंद, ३ लाख प्रवाशा",https://www.lokmat.com/pune/both-palanquins-stopped-in-pune-warkars-enjoyed-traveling-by-pune-metro-3-lakh-passengers-traveled-a-a727/,2026-07-10T11:10:36+00:00
Mumbai,Lokmat,Mumbai • Lokmat,https://www.lokmat.com/city/,6,"LIVE: विरोधक गोंधळलेले आणि भरकटलेले, पावसावर राजकारण केले; एकनाथ शिंदेंची टोलेबाजी",https://www.lokmat.com/maharashtra/maharashtra-marathi-news-live-updates-10-july-2026-rain-updates-vidhan-sabha-adhiveshan-cm-devendra-fadnavis-eknath-shinde-cabinet-expansion-us-iran-war-donald-trump-pm-narendra-modi-fifa-world-cup-sharad-pawar-aashadhi-wari-india-vs-england-a-a573/,2026-07-10T11:10:36+00:00
Mumbai,Lokmat,Mumbai • Lokmat,https://www.lokmat.com/city/,7,"""त्या पोलिसालाच आमदार म्हणून घोषित करून टाका"", आव्हाड विधानसभेत सरकारवर संतापले, काय घडले?",https://www.lokmat.com/mumbai/jitendra-awhad-declare-that-policeman-as-an-mla-awhad-got-angry-with-the-government-in-the-assembly-what-happened-a-a571/,2026-07-10T11:10:36+00:00
Mumbai,Lokmat,Mumbai • Lokmat,https://www.lokmat.com/city/,8,"मुंबई-पुणे रेलमार्ग विस्कळीतच, २२ एक्स्प्रेस, ८ विशेष ट्रेन रद्द; प्रवाशांच्या त्रासात भर!",https://www.lokmat.com/mumbai/mumbai-pune-lonavala-karjat-bhor-ghat-railway-route-disrupted-22-express-8-special-trains-cancelled-passengers-get-suffered-a-a719/,2026-07-10T11:10:36+00:00
Mumbai,Lokmat,Mumbai • Lokmat,https://www.lokmat.com/city/,9,२०११ पूर्वीच्या झोपड्यांचे पुनर्वसन होणार; तीन महिन्यांत होणार पुनर्वसनाचा मास्टर प्लॅन,https://www.lokmat.com/mumbai/maharashtra-govt-assures-protection-for-pre-2011-slums-statewide-survey-and-rehabilitation-master-plan-in-3-months-a-a1012/,2026-07-10T11:10:36+00:00
Mumbai,Lokmat,Mumbai • Lokmat,https://www.lokmat.com/city/,10,महालक्ष्मी एक्स्प्रेस १७ जुलैपर्यंत रद्द; दरड कोसळल्यामुळे रेल्वे वाहतूक विस्कळीत,https://www.lokmat.com/kolhapur/mahalaxmi-express-cancelled-until-july-17-due-to-a-landslide-in-the-karjat-lonavala-ghat-section-a-a746/,2026-07-10T11:10:36+00:00
Mumbai,Lokmat,Mumbai • Lokmat,https://www.lokmat.com/city/,11,"पाकिस्तानी गँगस्टर शहजाद भट्टी कनेक्शन, नागपूरसह विदर्भात ATSची मोठी कारवाई; १० जण ताब्यात",https://www.lokmat.com/nagpur/pakistani-gangster-shahzad-bhatti-connection-ats-conducts-major-operation-in-vidarbha-including-nagpur-10-people-arrested-a-a877-c941/,2026-07-10T11:10:36+00:00
Mumbai,Lokmat,Mumbai • Lokmat,https://www.lokmat.com/city/,12,नागपुरात तुकाराम मुंढेंची दुसरी मोठी कारवाई!हिरा स्वीट्सनंतर 'इंदूर नमकीन प्रॉडक्ट्स'चा परवाना रद्द,https://www.lokmat.com/nagpur/tukaram-mundes-second-big-action-in-nagpur-after-hira-sweets-license-of-indore-namkeen-products-suspended-dirty-case-comes-to-light-a-a941/,2026-07-10T11:10:36+00:00
Mumbai,Lokmat,Mumbai • Lokmat,https://www.lokmat.com/city/,13,'मॅजिक क्रिश स्पा अँड सलून सेंटर'च्या आड सुरू होता कुंटनखाना; पोलिसांचा छापा,https://www.lokmat.com/nagpur/a-brothel-was-operating-behind-magic-krish-spa-and-salon-center-police-raid-a-a877-c1013/,2026-07-10T11:10:36+00:00
Mumbai,Lokmat,Mumbai • Lokmat,https://www.lokmat.com/city/,14,"पवित्र नात्याला मामाने फासले काळे; अल्पवयीन भाचीवर लैंगिक अत्याचार, फोटो-व्हिडिओ व्हायरल करण्याची धमकी",https://www.lokmat.com/nagpur/uncle-destroys-sacred-relationship-sexually-assaults-minor-niece-threatens-to-make-photos-and-videos-viral-a-a877-c1013/,2026-07-10T11:10:36+00:00
Mumbai,Lokmat,Mumbai • Lokmat,https://www.lokmat.com/city/,15,मृत्यूसाठी कुणालाही जबाबदार धरू नका.. टोकाचे पाऊल उचललेल्या हताश महिलेचे भावनिक आवाहन,https://www.lokmat.com/nagpur/dont-blame-anyone-for-the-death-emotional-appeal-from-a-desperate-woman-who-took-extreme-measures-a-a1013/,2026-07-10T11:10:36+00:00
Mumbai,Lokmat,Mumbai • Lokmat,https://www.lokmat.com/city/,16,"नाशिकमध्ये गुप्त बैठका, ठाकरेंचे १०-१२ नगरसेवक शिंदेसेनेच्या गळाला; प्रभागनिहाय ५ कोटी मिळणार?",https://www.lokmat.com/nashik/secret-meetings-in-nashik-10-12-uddhav-thackeray-corporators-may-join-eknath-shinde-shiv-sena-will-they-get-5-crores-ward-wise-a-a629/,2026-07-10T11:10:36+00:00
Mumbai,Lokmat,Mumbai • Lokmat,https://www.lokmat.com/city/,17,नाशिक हादरले! ९ वीच्या विद्यार्थिनीने दिला बाळाला जन्म; संबंध ठेवणाऱ्याबद्दल धक्कादायक खुलासा,https://www.lokmat.com/nashik/shocking-incident-in-nashik-9th-grade-student-gives-birth-at-government-ashram-school-a-a1001/,2026-07-10T11:10:36+00:00
Mumbai,Lokmat,Mumbai • Lokmat,https://www.lokmat.com/city/,18,"अभ्यासाचा कंटाळा आला, पुण्यातील युवक घर सोडून कोल्हापुरात; पोलिसांच्या सतर्कतेने नातेवाइकांची भेट",https://www.lokmat.com/kolhapur/a-young-man-from-nashik-who-had-left-home-to-stay-with-his-aunt-in-pune-for-his-studies-after-growing-weary-of-his-academic-work-arrived-in-kolhapur-a-a746/,2026-07-10T11:10:36+00:00
Mumbai,Lokmat,Mumbai • Lokmat,https://www.lokmat.com/city/,19,"नांदूर मधमेश्वर बंधाऱ्यातून 15 हजार 248 क्युसेक्स विसर्ग, गोदावरीकाठच्या नागरिकांना सतर्कतेचा इशारा",https://www.lokmat.com/nashik/15248-cusecs-discharged-from-nandur-madhameshwar-dam-alert-issued-to-citizens-along-godavari-a-a653/,2026-07-10T11:10:36+00:00
Mumbai,Lokmat,Mumbai • Lokmat,https://www.lokmat.com/city/,20,"व्यवसायात यश मिळवून देण्याचे आश्वासन, जादूटोण्याच्या नावाने महिलेवर अत्याचार; भोंदूविरुद्ध गुन्हा दाखल",https://www.lokmat.com/nashik/promised-success-in-business-tortured-woman-in-the-name-of-witchcraft-case-registered-against-fraudster-in-nashik-a-a597/,2026-07-10T11:10:36+00:00
Mumbai,Lokmat,Mumbai • Lokmat,https://www.lokmat.com/city/,21,"जेईई गुणपत्रिका फेच होत नसल्याने हजारो अर्ज अडकले; डिजिलॉकरच्या त्रुटी, विद्यार्थ्यांना फटका",https://www.lokmat.com/maharashtra/students-affected-by-technical-glitches-in-digilocker-during-the-ongoing-engineering-cap-2026-admission-process-a-a292-c746/,2026-07-10T11:10:36+00:00
Mumbai,Lokmat,Mumbai • Lokmat,https://www.lokmat.com/city/,22,एनसीसीच्या महाराष्ट्र बॅटरीमध्ये महिलेवर अत्याचार; दोन वर्षानंतर विधानपरिषदेत तक्रार,https://www.lokmat.com/kolhapur/complaint-regarding-the-sexual-assault-of-a-junior-female-employee-at-the-maharashtra-battery-ncc-bhavan-discussed-in-the-legislative-council-a-a746/,2026-07-10T11:10:36+00:00
Mumbai,Lokmat,Mumbai • Lokmat,https://www.lokmat.com/city/,23,"Kolhapur: घराची भिंत कोसळून महिला ठार; सुदैवाने १३ वर्षाचा मुलगा बचावला, कागलमधील दुर्घटना",https://www.lokmat.com/kolhapur/woman-killed-after-house-wall-collapses-in-kagal-kolhapur-a-a746/,2026-07-10T11:10:36+00:00
Mumbai,Lokmat,Mumbai • Lokmat,https://www.lokmat.com/city/,24,"Kolhapur News: अत्याचार पीडित मुलीने एकाचवेळी खाल्ली औषधे, आरोपींच्या नातेवाइकांकडून दबावाची चर्चा",https://www.lokmat.com/kolhapur/rape-victim-girl-took-medicines-at-once-in-kolhapur-pressure-from-relatives-of-accused-discussed-a-a746/,2026-07-10T11:10:36+00:00
Mumbai,Lokmat,Mumbai • Lokmat,https://www.lokmat.com/city/,25,"दोन कोटी रुपयांचा गांजा जाळून नष्ट, सांगली पोलिसांची कारवाई",https://www.lokmat.com/sangli/ganja-worth-rs-2-crore-destroyed-by-burning-sangli-police-take-action-a-a746/,2026-07-10T11:10:36+00:00
Mumbai,Lokmat,Mumbai • Lokmat,https://www.lokmat.com/city/,26,सांगलीतील आर सिटी मॉलमधील लिफ्ट परवानगी प्रकरणी तत्कालीन विद्युत निरीक्षक संजय राठोड निलंबित,https://www.lokmat.com/sangli/the-then-electrical-inspector-sanjay-rathod-was-suspended-in-the-lift-permit-case-at-r-city-mall-in-sangli-a-a746/,2026-07-10T11:10:36+00:00
Mumbai,Lokmat,Mumbai • Lokmat,https://www.lokmat.com/city/,27,"आईनेच पोटच्या पोरीला शारीरिक संबंध ठेवण्यास भाग पाडले, कोल्हापूर जिल्ह्यातील धक्कादायक घटना",https://www.lokmat.com/kolhapur/minor-girl-sexually-assaulted-in-hatkanangale-taluka-kolhapur-district-three-people-including-mother-arrested-a-a746/,2026-07-10T11:10:36+00:00
Mumbai,Lokmat,Mumbai • Lokmat,https://www.lokmat.com/city/,28,Sangli Crime: चोरट्याने पेटविल्याचा बनाव...आजीला पेटविले नात जावयाने; संशयितास अटक,https://www.lokmat.com/sangli/a-granddaughters-husband-set-his-grandmother-in-law-on-fire-following-a-dispute-over-property-division-then-fabricated-a-story-claiming-a-thief-had-set-her-ablaze-at-shetphale-in-sangli-district-a-a997-c746/,2026-07-10T11:10:36+00:00
Mumbai,Lokmat,Mumbai • Lokmat,https://www.lokmat.com/city/,29,परदेशी वैद्यकीय शिक्षणानंतरच्या पात्रता परीक्षेत ८६ टक्के विद्यार्थी नापास; चार वर्षांतील सर्वांत नीचांकी टक्का,https://www.lokmat.com/maharashtra/86-percent-of-students-fail-in-qualifying-exam-after-foreign-medical-education-a-a746/,2026-07-10T11:10:36+00:00
Mumbai,Lokmat,Mumbai • Lokmat,https://www.lokmat.com/city/,30,"दापोली-महाबळेश्वर राष्ट्रीय महामार्ग करा, प्रवीण दरेकर यांचे केंद्रीय मंत्री नितीन गडकरी यांना साकडे",https://www.lokmat.com/ratnagiri/make-dapoli-mahabaleshwar-national-highway-praveen-darekar-urges-union-minister-nitin-gadkari-a-a746/,2026-07-10T11:10:36+00:00
Mumbai,Lokmat,Mumbai • Lokmat,https://www.lokmat.com/city/,31,"Rain in Satara: कोयना धरणात ९ दिवसांत ३६ टीएमसीची भर, अर्धशतकी पाणीसाठ्याचा टप्पा पार",https://www.lokmat.com/satara/36-tmc-of-water-in-koyna-dam-in-9-days-heavy-rain-disrupts-normal-life-in-patan-taluka-a-a746/,2026-07-10T11:10:36+00:00
Mumbai,Lokmat,Mumbai • Lokmat,https://www.lokmat.com/city/,32,"रत्नागिरी-सातारा जिल्ह्याला जोडणाऱ्या रघुवीर घाटात भूस्खलन; रस्त्याची एक बाजू दरीत खचली, वाहतूक बंद",https://www.lokmat.com/ratnagiri/landslide-in-raghuveer-ghat-connecting-ratnagiri-satara-district-one-side-of-the-road-collapsed-into-a-valley-traffic-closed-a-a746/,2026-07-10T11:10:36+00:00
Mumbai,Lokmat,Mumbai • Lokmat,https://www.lokmat.com/city/,33,"Satara News: मुलाने तुटलेली वीज तार हातात धरली अन् चौघांचा जीव गेला, समयसूचकतेने लहान बहिणीचा जीव वाचला",https://www.lokmat.com/satara/four-members-of-the-same-family-died-while-trying-to-save-a-boy-who-had-suffered-an-electric-shock-from-a-wire-in-khamgaon-satara-district-the-younger-sisters-life-was-saved-thanks-to-quick-thinking-a-a746/,2026-07-10T11:10:36+00:00
Mumbai,Lokmat,Mumbai • Lokmat,https://www.lokmat.com/city/,34,"भूस्खलनामुळे साताऱ्याची जीवनवाहिनी फुटली, पालिकेकडून युद्धपातळीवर दुरूस्ती",https://www.lokmat.com/satara/a-landslide-caused-the-main-water-pipeline-of-the-kas-scheme-which-supplies-water-to-satara-city-to-burst-a-a746/,2026-07-10T11:10:36+00:00
Mumbai,Lokmat,Mumbai • Lokmat,https://www.lokmat.com/city/,35,काँग्रेस नगरसेविका पतीवर भरदिवसा चाकू हल्ला; उपचारादरम्यान मृत्यू,https://www.lokmat.com/akola/congress-corporators-husband-attacked-with-knife-in-broad-daylight-dies-during-treatment-a-a607/,2026-07-10T11:10:36+00:00
Mumbai,Lokmat,Mumbai • Lokmat,https://www.lokmat.com/city/,36,विनापरवाना बियाणे साठ्यावर कृषी विभागाचा छापा; २०.६० लाखांचा मुद्देमाल जप्त,https://www.lokmat.com/akola/agriculture-department-raids-unlicensed-seed-stock-goods-worth-rs-20-lakh-60-thousands-seized-a-a653/,2026-07-10T11:10:36+00:00
Mumbai,Lokmat,Mumbai • Lokmat,https://www.lokmat.com/city/,37,अकोल्यात रिलायन्स प्लांट परिसरात आगीचे तांडव; धुराच्या लोटांनी आसमंत काळवंडले,https://www.lokmat.com/akola/fire-breaks-out-in-reliance-plant-area-smoke-billows-into-the-sky-incident-on-akola-nanded-road-a-a747/,2026-07-10T11:10:36+00:00
Mumbai,Lokmat,Mumbai • Lokmat,https://www.lokmat.com/city/,38,"शिंदेसेनेच्या अकोला जिल्हाप्रमुख, महानगरप्रमुखांच्या नियुक्त्या जाहीर",https://www.lokmat.com/akola/appointments-of-shinde-senas-akola-district-chief-and-metropolitan-chief-announced-a-a941/,2026-07-10T11:10:36+00:00
Mumbai,Lokmat,Mumbai • Lokmat,https://www.lokmat.com/city/,39,"Akola: अधिक मासातील धार्मिक स्नान ठरले अखेरचे; मुलगाा बुडायला लागला, आईने उडी मारली; दोघांचाही नदीत बुडून मृत्यू",https://www.lokmat.com/akola/akola-religious-bath-in-the-rainy-season-turned-out-to-be-the-last-mother-and-daughter-drowned-in-the-river-while-saving-their-child-a-a571/,2026-07-10T11:10:36+00:00
Mumbai,Lokmat,Mumbai • Lokmat,https://www.lokmat.com/city/,40,"शक्तिपीठ महामार्ग रद्द करण्यासाठी शेतकरी विठ्ठलाला साकडे घालणार, १८ जुलैला भव्य पायी सदबुध्दी यात्रा",https://www.lokmat.com/maharashtra/against-the-backdrop-of-ashadhi-ekadashi-farmers-from-13-districts-will-undertake-a-sadbuddhi-yatra-on-foot-from-vakari-to-the-vitthal-temple-demanding-the-cancellation-of-the-shaktipeeth-highway-project-a-a746/,2026-07-10T11:10:36+00:00
Mumbai,Lokmat,Mumbai • Lokmat,https://www.lokmat.com/city/,41,"तपासणी केली, त्रुटी आढळल्या, पुरावे सापडले अन् ते मेडिकल केले सील; औषध प्रशासनाची सोलापुरात मोठी कारवाई",https://www.lokmat.com/solapur/inspection-done-errors-found-evidence-found-and-it-was-medically-sealed-drug-administration-takes-major-action-in-solapur-a-a941/,2026-07-10T11:10:36+00:00
Mumbai,Lokmat,Mumbai • Lokmat,https://www.lokmat.com/city/,42,सैराट’ फेम अभिनेता सल्याची रुग्णालयाकडून लूट; व्हिडिओ पाहिला अन् तुकाराम मुंढेंनी दिले चौकशीचे आदेश,https://www.lokmat.com/solapur/sairat-fame-actor-salya-robbed-from-hospital-watched-the-video-and-tukaram-mundhe-ordered-an-inquiry-a-a941/,2026-07-10T11:10:36+00:00
Mumbai,Lokmat,Mumbai • Lokmat,https://www.lokmat.com/city/,43,"प्रॉपर्टीच्या वादातून काका-काकूचा खून; हत्या करून पुतण्यांनी मित्राला दिले सोने, मुंबईमध्ये साहिलला अटक",https://www.lokmat.com/solapur/uncle-and-aunt-murdered-over-property-dispute-nephews-gave-gold-to-friend-after-murder-sahil-arrested-in-mumbai-a-a571/,2026-07-10T11:10:36+00:00
Mumbai,Lokmat,Mumbai • Lokmat,https://www.lokmat.com/city/,44,"भोंदू मनोहर भोसलेकडे अफाट 'माया'; २० बँक खात्यांमध्ये ३ कोटींची रोकड, २५ एकर जमीन अन् फ्लॅट",https://www.lokmat.com/solapur/sit-investigation-reveals-that-the-fraudulent-manohar-bhosale-holds-over-3-crore-across-20-bank-accounts-a-a1001/,2026-07-10T11:10:36+00:00
Mumbai,Lokmat,Mumbai • Lokmat,https://www.lokmat.com/city/,45,बाळासाहेब थोरात यांची एसीबी चौकशी नाकारण्याचा निर्णय कोणाचा?,https://www.lokmat.com/ahilyanagar/bombay-high-court-asks-maharashtra-govt-who-decided-to-deny-acb-probe-against-balasaheb-thorat-a-a1001/,2026-07-10T11:10:36+00:00
Mumbai,Lokmat,Mumbai • Lokmat,https://www.lokmat.com/city/,46,शिर्डी साईबाबा मंदिरात 'ब्रेक दर्शन'साठी आता मोजावे लागणार ३०० रुपये; संस्थानचा मोठा निर्णय,https://www.lokmat.com/ahilyanagar/shirdi-sai-baba-sansthan-increases-break-darshan-fee-for-vip-devotees-by-100-rupees-a-a1001/,2026-07-10T11:10:36+00:00
Mumbai,Lokmat,Mumbai • Lokmat,https://www.lokmat.com/city/,47,"""...तर शरद पवार राष्ट्रपती झाले असते""; रामदास आठवले यांचा गौप्यस्फोट",https://www.lokmat.com/ahilyanagar/sharad-pawar-could-have-been-president-if-he-joined-nda-in-2014-claims-union-minister-ramdas-athawale-a-a1001/,2026-07-10T11:10:36+00:00
