city,publisher,source,source_url,rank,headline,link,collected_at_iso
Bhopal,IE,Bhopal • IE,https://indianexpress.com/section/cities/bhopal/,99,Maharashtra CEO seeks EC nod for online self-mapping option for voters as pre-SIR exercise falls behind,https://indianexpress.com/article/cities/mumbai/maharashtra-ceo-seeks-ec-nod-for-online-self-mapping-option-for-voters-as-pre-sir-exercise-falls-behind-10666743/,2026-05-02T10:57:07+00:00
Bhopal,IE,Bhopal • IE,https://indianexpress.com/section/cities/bhopal/,100,NIA visits Mumbai Press Club after it suspends three members over Bhima Koregaon accused gathering,https://indianexpress.com/article/cities/mumbai/nia-visits-mumbai-press-club-after-it-suspends-three-members-over-bhima-koregaon-accused-gathering-10666744/,2026-05-02T10:57:07+00:00
Bhopal,IE,Bhopal • IE,https://indianexpress.com/section/cities/bhopal/,101,"Who are Israel’s West Bank settlers, and why are they attacking Palestinians?",https://indianexpress.com/article/explained/explained-global/who-are-israels-west-bank-settlers-and-why-are-they-attacking-palestinians-10666681/,2026-05-02T10:57:07+00:00
Bhopal,IE,Bhopal • IE,https://indianexpress.com/section/cities/bhopal/,102,"After a 4x rally and 92.5% EBITDA surge, what lies ahead for MTAR Technologies?",https://indianexpress.com/article/smart-stocks/mtar-technologies-isro-nuclear-energy-oracle-ai-data-stock-price-10666535/,2026-05-02T10:57:07+00:00
Bhopal,IE,Bhopal • IE,https://indianexpress.com/section/cities/bhopal/,103,Maharashtra Board HSC Result 2026: When and from where to check Class 12th marksheet?,https://indianexpress.com/article/education/maharashtra-hsc-12th-results-2026-when-and-from-where-to-check-marksheet-mahasscboard-in-hscresult-mkcl-org-10665921/,2026-05-02T10:57:07+00:00
Bhopal,IE,Bhopal • IE,https://indianexpress.com/section/cities/bhopal/,104,"From Ranchi school where Dhoni studied, 7-year-old swimming prodigy makes history",https://indianexpress.com/article/india/from-ranchi-school-where-dhoni-studied-7-year-old-swimming-prodigy-makes-history-10666678/,2026-05-02T10:57:07+00:00
Bhopal,IE,Bhopal • IE,https://indianexpress.com/section/cities/bhopal/,105,Newsletters ( opens in a new tab ),https://indianexpress.com/newsletters/,2026-05-02T10:57:07+00:00
Bhopal,IE,Bhopal • IE,https://indianexpress.com/section/cities/bhopal/,106,26/11 Stories of Strength ( opens in a new tab ),https://indianexpress.com/26-11/,2026-05-02T10:57:07+00:00
Bhopal,IE,Bhopal • IE,https://indianexpress.com/section/cities/bhopal/,107,Statutory provisions on reporting (sexual offenses),https://indianexpress.com/article/what-is/what-is-the-protection-of-children-from-sexual-offences-act-2012/,2026-05-02T10:57:07+00:00
Pune,Pune Mirror,Pune • Pune Mirror,https://punemirror.com/,1,Water Finally Flows into Mohammadwadi–Undri Tanks After 8-Year Delay,https://punemirror.com/city/pune-mohammadwadi-undri-water-tanks-start/,2026-05-02T10:57:07+00:00
Pune,Pune Mirror,Pune • Pune Mirror,https://punemirror.com/,2,"Pune Tender Row: Rs 34 Lakh Bid Swells to Rs 1.51 Crore, Allegations of Irregularities Surface",https://punemirror.com/city/pune/pmc/pmc-tender-row-34-lakh-to-1-51-crore-controversy/,2026-05-02T10:57:07+00:00
Pune,Pune Mirror,Pune • Pune Mirror,https://punemirror.com/,3,Pune Clears Rs 11.61 Crore Sports Nursery Project in Hadapsar to Boost Youth Training,https://punemirror.com/city/pune-hadapsar-sports-nursery-project-approval/,2026-05-02T10:57:07+00:00
Pune,Pune Mirror,Pune • Pune Mirror,https://punemirror.com/,4,PMPML Bus Purchase Row Intensifies; Prashant Jagtap to Move High Court,https://punemirror.com/city/pune/pmpml-bus-purchase-row-prashant-jagtap-high-court/,2026-05-02T10:57:07+00:00
Pune,Pune Mirror,Pune • Pune Mirror,https://punemirror.com/,5,Xbox Mode Windows 11 delivers powerful console-style boost,https://punemirror.com/entertainment/xbox-mode-windows-11-powerful-console-hub/,2026-05-02T10:57:07+00:00
Pune,Pune Mirror,Pune • Pune Mirror,https://punemirror.com/,6,Samsung Galaxy S27 Ultra Shockingly Bold Camera Shake-Up,https://punemirror.com/technology/samsung-galaxy-s27-ultra-big-shift/,2026-05-02T10:57:07+00:00
Pune,Pune Mirror,Pune • Pune Mirror,https://punemirror.com/,7,"Amazon Now India quick commerce makes bold, powerful push into 100 cities",https://punemirror.com/business/amazon-now-india-quick-commerce-100-cities/,2026-05-02T10:57:07+00:00
Pune,Pune Mirror,Pune • Pune Mirror,https://punemirror.com/,8,Realme GT 7T Flipkart deal: stunning price drop or missed chance?,https://punemirror.com/technology/realme-gt-7t-flipkart-deal-27999/,2026-05-02T10:57:07+00:00
Pune,Pune Mirror,Pune • Pune Mirror,https://punemirror.com/,9,Four Tourists Drown in Maval on Labour Day Holiday; Tragedy at Dam and Pavana River,https://punemirror.com/city/pune/maval-drowning-incident-jadhavwadi-dam-pavana-river/,2026-05-02T10:57:07+00:00
Pune,Pune Mirror,Pune • Pune Mirror,https://punemirror.com/,10,4-Year-Old Girl Found Dead in Pune’s Bhor,https://punemirror.com/city/pune/bhor-pune-child-death-case-man-arrested/,2026-05-02T10:57:07+00:00
Pune,Pune Mirror,Pune • Pune Mirror,https://punemirror.com/,11,2026 VW Taigun Facelift Review,https://punemirror.com/automobile/2026-vw-taigun-facelift-review/,2026-05-02T10:57:07+00:00
Pune,Pune Mirror,Pune • Pune Mirror,https://punemirror.com/,12,Mumbai Pune Expressway Missing Link Revolutionizes Commute Between Maharashtra’s Economic Hubs,https://punemirror.com/city/mumbai-pune-expressway-missing-link-opens/,2026-05-02T10:57:07+00:00
Pune,Pune Mirror,Pune • Pune Mirror,https://punemirror.com/,13,Mumbai Pune Missing Link delivers game-changing boost,https://punemirror.com/news/mumbai-pune-missing-link-benefits/,2026-05-02T10:57:07+00:00
Pune,Pune Mirror,Pune • Pune Mirror,https://punemirror.com/,14,Netflix Clips vertical video delivers powerful new mobile revamp,https://punemirror.com/entertainment/netflix-clips-vertical-video-mobile-revamp/,2026-05-02T10:57:07+00:00
Pune,Pune Mirror,Pune • Pune Mirror,https://punemirror.com/,15,"Exam Tamil web series delivers gripping, fearless suspense",https://punemirror.com/entertainment/exam-tamil-web-series-prime-video/,2026-05-02T10:57:07+00:00
Pune,Pune Mirror,Pune • Pune Mirror,https://punemirror.com/,16,"House of the Dragon Season 3 delivers brutal, unmissable comeback",https://punemirror.com/entertainment/house-of-the-dragon-season-3-june-22-hotstar/,2026-05-02T10:57:07+00:00
Pune,Pune Mirror,Pune • Pune Mirror,https://punemirror.com/,17,GPT-5.5 Cyber Breakthrough: Powerful New AI Shields Critical Systems,https://punemirror.com/technology/gpt-5-5-cyber-secure-ai-rollout/,2026-05-02T10:57:07+00:00
Pune,Pune Mirror,Pune • Pune Mirror,https://punemirror.com/,18,Raakaasa OTT release date delivers thrilling Netflix debut,https://punemirror.com/entertainment/raakaasa-ott-release-date-netflix/,2026-05-02T10:57:07+00:00
Pune,Pune Mirror,Pune • Pune Mirror,https://punemirror.com/,19,PS5 DRM check fury: Powerful backlash pushes Sony to clarify,https://punemirror.com/entertainment/ps5-drm-check-sony-clarifies-backlash/,2026-05-02T10:57:07+00:00
Pune,Pune Mirror,Pune • Pune Mirror,https://punemirror.com/,20,22-year-old woman’s throat slit in Chandannagar; accused absconding,https://punemirror.com/city/pune/chandannagar-woman-attack-pune-arrest-delay-protest/,2026-05-02T10:57:07+00:00
Pune,Pune Mirror,Pune • Pune Mirror,https://punemirror.com/,21,Mayor Orders Urgent Action to Clean Up Pashan Lake Amid Rising Pollution,https://punemirror.com/city/pune/pashan-lake-pollution-pune-mayor-action/,2026-05-02T10:57:07+00:00
Pune,Pune Mirror,Pune • Pune Mirror,https://punemirror.com/,22,PMPML Bus Crash on Bajirao Road Leaves Two Women Critically Injured,https://punemirror.com/city/pune/pune-bus-accident-pmpml-bajirao-road-two-wheeler/,2026-05-02T10:57:07+00:00
Pune,Pune Mirror,Pune • Pune Mirror,https://punemirror.com/,23,BJP-Backed Panel Defeated in Maharashtra Medical Council Polls; IMA Group Sweeps 8 of 9 Seats,https://punemirror.com/city/pune/mmc-election-results-ima-panel-bjp-defeat/,2026-05-02T10:57:07+00:00
Pune,Pune Mirror,Pune • Pune Mirror,https://punemirror.com/,24,Central Railway Launches Regular Hadapsar–Banaras Amrit Bharat Express Services,https://punemirror.com/city/pune/hadapsar-banaras-amrit-bharat-express-regular-service/,2026-05-02T10:57:07+00:00
Pune,Pune Mirror,Pune • Pune Mirror,https://punemirror.com/,25,Banaras–Pune Amrit Bharat Express Welcomed at Hadapsar Station,https://punemirror.com/city/pune/banaras-pune-amrit-bharat-express-hadapsar-arrival/,2026-05-02T10:57:07+00:00
Pune,Pune Mirror,Pune • Pune Mirror,https://punemirror.com/,26,"Pre-Monsoon Drive in Hinjewadi: MIDC, PMRDA Set May 31 Deadline for Key Works",https://punemirror.com/news/hinjewadi-pre-monsoon-work-midc-pmrda-deadline/,2026-05-02T10:57:07+00:00
Pune,Pune Mirror,Pune • Pune Mirror,https://punemirror.com/,27,Khadakwasla–Fursungi Underground Canal Project Gains Pace; 3 km Work Completed,https://punemirror.com/city/pune/khadakwasla-fursungi-underground-canal-project-progress/,2026-05-02T10:57:07+00:00
Pune,Pune Mirror,Pune • Pune Mirror,https://punemirror.com/,28,Why is PCMC ignoring pleas to shift Hedgewar Bhavan garbage centre?,https://punemirror.com/city/pcmc/why-is-pcmc-ignoring-pleas-to-shift-hedgewar-bhavan-garbage/,2026-05-02T10:57:07+00:00
Pune,Pune Mirror,Pune • Pune Mirror,https://punemirror.com/,29,"Dumping public moneyÂ into the waste, literally!",https://punemirror.com/city/pcmc/dumping-public-money-into-the-waste-literally/,2026-05-02T10:57:07+00:00
Pune,Pune Mirror,Pune • Pune Mirror,https://punemirror.com/,30,Strays get a home in twin towns,https://punemirror.com/city/pcmc/strays-get-a-home-in-twin-towns/,2026-05-02T10:57:07+00:00
Pune,Pune Mirror,Pune • Pune Mirror,https://punemirror.com/,31,City gasping for clean air,https://punemirror.com/city/pcmc/pimpri-chinchwad-air-pollution-health-crisis/,2026-05-02T10:57:07+00:00
Pune,Pune Mirror,Pune • Pune Mirror,https://punemirror.com/,32,Civic body stares at financial crisis,https://punemirror.com/city/pcmc/pcmc-metro-development-charges-liability/,2026-05-02T10:57:07+00:00
Pune,Pune Mirror,Pune • Pune Mirror,https://punemirror.com/,33,Major drug bust in twin towns,https://punemirror.com/city/pcmc/pimpri-chinchwad-narcotics-warehouse-raid/,2026-05-02T10:57:07+00:00
Pune,Pune Mirror,Pune • Pune Mirror,https://punemirror.com/,34,PCMC to Keep Tax Offices Open on Weekends and Holidays to Boost Property Tax Collection,https://punemirror.com/city/pcmc/pcmc-property-tax-collection-weekend-offices/,2026-05-02T10:57:07+00:00
Pune,Pune Mirror,Pune • Pune Mirror,https://punemirror.com/,35,"Central Railway Posts Strong FY26 Performance with New Trains, Revenue Growth",https://punemirror.com/india/central-railways/central-railway-fy26-performance-revenue-trains-india/,2026-05-02T10:57:07+00:00
Pune,Pune Mirror,Pune • Pune Mirror,https://punemirror.com/,36,Kerosene Distribution begins in 21 States,https://punemirror.com/india/kerosene-distribution-21-states-fuel-policy/,2026-05-02T10:57:07+00:00
Pune,Pune Mirror,Pune • Pune Mirror,https://punemirror.com/,37,India Post to Launch ‘24 Speed Post’ for Next-Day Delivery in Major Cities,https://punemirror.com/india/india-post-24-speed-post-next-day-delivery/,2026-05-02T10:57:07+00:00
Pune,Pune Mirror,Pune • Pune Mirror,https://punemirror.com/,38,Central Railway to Run Summer Special Trains From Pune to Meet Holiday Rush,https://punemirror.com/india/central-railways/central-railway-summer-special-trains-pune-2026/,2026-05-02T10:57:07+00:00
Pune,Pune Mirror,Pune • Pune Mirror,https://punemirror.com/,39,Railways Power E-commerce Leap: Amazon Enters Kashmir Valley with High-Speed Freight Corridor,https://punemirror.com/india/central-railways/indian-railways-amazon-kashmir-freight-corridor-logistics/,2026-05-02T10:57:07+00:00
Pune,Pune Mirror,Pune • Pune Mirror,https://punemirror.com/,40,Central Railway’s Crackdown Nets Rs 251.91 Crore from Ticketless Travel,https://punemirror.com/city/pune/central-railway-ticketless-travel-penalty-record-fy2025-26/,2026-05-02T10:57:07+00:00
Pune,Pune Mirror,Pune • Pune Mirror,https://punemirror.com/,41,Central Railway Ticket Checking Staff Set Remarkable Revenue Milestone in FY 2025–26,https://punemirror.com/city/pune/central-railway-ticket-checking-crorepati-staff/,2026-05-02T10:57:07+00:00
Pune,Pune Mirror,Pune • Pune Mirror,https://punemirror.com/,42,Strengthening Passenger Amenities and Crowd Management Across Indian Railways,https://punemirror.com/news/indian-railways-34000-crore-passenger-safety-infrastructure/,2026-05-02T10:57:07+00:00
Pune,Pune Mirror,Pune • Pune Mirror,https://punemirror.com/,43,Elon Musk xAI OpenAI clash ignites shocking AI distillation storm,https://punemirror.com/technology/elon-musk-xai-openai-distillation-dispute/,2026-05-02T10:57:07+00:00
Pune,Pune Mirror,Pune • Pune Mirror,https://punemirror.com/,44,"Google Q1 2026 earnings deliver stunning, record AI boom",https://punemirror.com/business/google-q1-2026-earnings-record-ai-boom/,2026-05-02T10:57:07+00:00
Pune,Pune Mirror,Pune • Pune Mirror,https://punemirror.com/,45,OpenAI Revenue Targets: Alarming Struggles Threaten IPO Plans,https://punemirror.com/business/openai-revenue-targets-ipo-struggles/,2026-05-02T10:57:07+00:00
Pune,Pune Mirror,Pune • Pune Mirror,https://punemirror.com/,46,Google Wallet Aadhaar Digital ID delivers powerful privacy boost,https://punemirror.com/business/google-wallet-aadhaar-digital-id-rollout/,2026-05-02T10:57:07+00:00
Pune,Pune Mirror,Pune • Pune Mirror,https://punemirror.com/,47,"Trump Gives Iran Three-Day Ultimatum; Araghchi Returns To Pakistan, Heads To Moscow",https://punemirror.com/news/trump-iran-three-day-ultimatum-araghchi-pakistan-moscow-april-2026/,2026-05-02T10:57:07+00:00
Pune,Pune Mirror,Pune • Pune Mirror,https://punemirror.com/,48,TRUMP EVACUATED UNHURT AFTER ARMED MAN OPENS FIRE AT WHITE HOUSE CORRESPONDENTS’ DINNER; SUSPECT IDENTIFIED,https://punemirror.com/news/trump-evacuated-white-house-correspondents-dinner-shooting-cole-allen-april-2026/,2026-05-02T10:57:07+00:00
Pune,Pune Mirror,Pune • Pune Mirror,https://punemirror.com/,49,‘Madman theory’ boomerangs,https://punemirror.com/world/trump-madman-theory-global-tensions-iran-policy/,2026-05-02T10:57:07+00:00
Pune,Pune Mirror,Pune • Pune Mirror,https://punemirror.com/,50,"US Expands Visa Screening, Starting March 30",https://punemirror.com/news/us-visa-social-media-screening-new-rules/,2026-05-02T10:57:07+00:00
Pune,Pune Mirror,Pune • Pune Mirror,https://punemirror.com/,51,Electric Vehicle Sales March 2026: Windsor EV Claims Stunning Victory in Booming Indian Market,https://punemirror.com/automobile/electric-vehicle-sales-march-2026-windsor/,2026-05-02T10:57:07+00:00
Pune,Pune Mirror,Pune • Pune Mirror,https://punemirror.com/,52,Tesla Model Y L Premium Delight: Powerful New Family EV for India,https://punemirror.com/automobile/tesla-model-y-l-premium-india-launch/,2026-05-02T10:57:07+00:00
Pune,Pune Mirror,Pune • Pune Mirror,https://punemirror.com/,53,"Tesla India Unveils the Six-Seater Model Y L: Range, Features, and Pricing",https://punemirror.com/automobile/tesla-india-unveils-the-six-seater-model-y-l-range-features-and-pricing/,2026-05-02T10:57:07+00:00
Pune,Pune Mirror,Pune • Pune Mirror,https://punemirror.com/,54,Renault Duster Achieves 5-Star BNCAP Safety Rating,https://punemirror.com/automobile/renault-duster-achieves-5-star-bncap-safety-rating/,2026-05-02T10:57:07+00:00
Pune,Pune Mirror,Pune • Pune Mirror,https://punemirror.com/,55,Head and neck cancers in India: alarming surge hits younger adults,https://punemirror.com/health/head-and-neck-cancers-in-india-early-risk/,2026-05-02T10:57:07+00:00
Pune,Pune Mirror,Pune • Pune Mirror,https://punemirror.com/,56,Microplastics liver disease danger: alarming new health threat,https://punemirror.com/health/microplastics-liver-disease-global-risk/,2026-05-02T10:57:07+00:00
Pune,Pune Mirror,Pune • Pune Mirror,https://punemirror.com/,57,Summer heat kidney stones crisis: alarming surge in Pune,https://punemirror.com/health/summer-heat-kidney-stones-pune-surge/,2026-05-02T10:57:07+00:00
Pune,Pune Mirror,Pune • Pune Mirror,https://punemirror.com/,58,Decoded: Stress- Liver Connection,https://punemirror.com/health/health-care/chronic-stress-fatty-liver-india-cortisol-impact/,2026-05-02T10:57:07+00:00
Pune,Pune Mirror,Pune • Pune Mirror,https://punemirror.com/,59,CSK THRASH MI BY 103 RUNS; GAIKWAD DEDICATES WIN TO MUKESH CHOUDHARY AFTER SEAMER’S PERSONAL LOSS,https://punemirror.com/sports/cricket/csk-beat-mi-103-runs-gaikwad-dedicates-mukesh-choudhary-ipl-2026/,2026-05-02T10:57:07+00:00
Pune,Pune Mirror,Pune • Pune Mirror,https://punemirror.com/,60,RCB Beat MI By 18 Runs In High-Scoring Thriller At Wankhede,https://punemirror.com/sports/cricket/rcb-beat-mi-18-runs/,2026-05-02T10:57:07+00:00
Pune,Pune Mirror,Pune • Pune Mirror,https://punemirror.com/,61,Mukul Choudhary Stars as LSG Beat KKR in Last-Ball IPL,https://punemirror.com/sports/mukul-choudhary-lsg-vs-kkr-last-ball-win-ipl-202/,2026-05-02T10:57:07+00:00
Pune,Pune Mirror,Pune • Pune Mirror,https://punemirror.com/,62,Last-Ball Chaos: Gujarat Titans Snatch 1-Run Victory,https://punemirror.com/sports/cricket/gt-vs-dc-last-ball-thriller-miller-decision-ipl-2026/,2026-05-02T10:57:07+00:00
Pune,Pune Mirror,Pune • Pune Mirror,https://punemirror.com/,63,The Device on Deepinder Goyal’s Temple That Stole the Spotlight — and Why the Internet Is Split,https://punemirror.com/trending/deepinder-goyal-temple-device-podcast-viral/,2026-05-02T10:57:07+00:00
Pune,Pune Mirror,Pune • Pune Mirror,https://punemirror.com/,64,The Hyper-Speed Era: Why Everything Is a ‘Trend’ and Nothing Lasts,https://punemirror.com/trending/why-everything-is-a-trend-and-nothing-lasts/,2026-05-02T10:57:07+00:00
Pune,Pune Mirror,Pune • Pune Mirror,https://punemirror.com/,65,Amazon Black Friday OnePlus Deals 2025: Massive Savings on Flagship Phones,https://punemirror.com/technology/amazon-black-friday-oneplus-deals-2025/,2026-05-02T10:57:07+00:00
Pune,Pune Mirror,Pune • Pune Mirror,https://punemirror.com/,66,Nobel Prize 2025: Discovery of Regulatory T-Cells and FOXP3 Gene Wins Medicine Award,https://punemirror.com/news/nobel-prize-2025-discovery-of-regulatory-t-cells-and-foxp3-gene-wins-medicine-award/,2026-05-02T10:57:07+00:00
Pune,Pune Mirror,Pune • Pune Mirror,https://punemirror.com/,67,Pahalgam terrorist gunned down; Three killed in J-K encounter,https://punemirror.com/trending/pahalgam-terrorist-gunned-down-three-killed-in-j-k-encounter/,2026-05-02T10:57:07+00:00
Pune,Pune Mirror,Pune • Pune Mirror,https://punemirror.com/,68,Startup India Fund of Funds 2.0: Powerful Boost for Startups,https://punemirror.com/india/startup-india-fund-of-funds-2-0-boost/,2026-05-02T10:57:07+00:00
Pune,Pune Mirror,Pune • Pune Mirror,https://punemirror.com/,69,Sarvam AI Bulbul V3 delivers stunning win over global AI rivals,https://punemirror.com/technology/ai/sarvam-ai-bulbul-v3-outshines-rivals/,2026-05-02T10:57:07+00:00
Pune,Pune Mirror,Pune • Pune Mirror,https://punemirror.com/,70,The Startup Evolution: From Survival Mode to Sustainable Success,https://punemirror.com/business/startups/from-survival-mode-to-sustainable-success/,2026-05-02T10:57:07+00:00
Pune,Pune Mirror,Pune • Pune Mirror,https://punemirror.com/,71,Filter Coffee Softy Delight: Powerful New Summer Hit In Pune,https://punemirror.com/lifestyle/filter-coffee-softy-pune-summer-dessert-trend/,2026-05-02T10:57:07+00:00
Pune,Pune Mirror,Pune • Pune Mirror,https://punemirror.com/,72,6 Summer Drinks To Beat The Heat,https://punemirror.com/lifestyle/traditional-indian-summer-drinks-heat-relief/,2026-05-02T10:57:07+00:00
Pune,Pune Mirror,Pune • Pune Mirror,https://punemirror.com/,73,AI-powered predictive sleep delivers powerful boost for Eight Sleep,https://punemirror.com/lifestyle/ai-powered-predictive-sleep-funding-boost/,2026-05-02T10:57:07+00:00
Pune,Pune Mirror,Pune • Pune Mirror,https://punemirror.com/,74,Heavy social media use among teenagers sparks alarming global warning,https://punemirror.com/lifestyle/heavy-social-media-use-among-teenagers/,2026-05-02T10:57:07+00:00
Pune,Pune Mirror,Pune • Pune Mirror,https://punemirror.com/,75,📅 When is Holi in 2026?,https://punemirror.com/lifestyle/holi-2026-date-significance-holika-dahan-celebrations/,2026-05-02T10:57:07+00:00
Pune,Pune Mirror,Pune • Pune Mirror,https://punemirror.com/,76,Samsung Finance+ EMI Scheme Unleashes Revolutionary Rs 33/Day Offer for Bespoke AI Appliances,https://punemirror.com/technology/samsung-finance-emi-scheme-india/,2026-05-02T10:57:07+00:00
Pune,Pune Mirror,Pune • Pune Mirror,https://punemirror.com/,77,Indian forex reserves show resilient surge even as rupee suffers steep fall,https://punemirror.com/business/indian-forex-reserves-rupee-weekly-loss-oil/,2026-05-02T10:57:07+00:00
Pune,Pune Mirror,Pune • Pune Mirror,https://punemirror.com/,78,Seamless KYC Financial Sector: Sitharaman Demands Bold SEBI Leadership,https://punemirror.com/business/seamless-kyc-financial-sector-sebi-sitharaman/,2026-05-02T10:57:07+00:00
Pune,Pune Mirror,Pune • Pune Mirror,https://punemirror.com/,79,RBI auto-debit rules bring powerful relief for digital payments,https://punemirror.com/business/rbi-auto-debit-rules-15000-limit-india/,2026-05-02T10:57:07+00:00
Pune,Pune Mirror,Pune • Pune Mirror,https://punemirror.com/,80,OpenAI Hiro Finance acquisition marks powerful new AI fintech shift,https://punemirror.com/business/openai-hiro-finance-acquisition-ai-fintech/,2026-05-02T10:57:07+00:00
Pune,Pune Mirror,Pune • Pune Mirror,https://punemirror.com/,81,₹2.45 Crore Oil Trading Fraud Uncovered in Pune; Two Accused Booked Again,https://punemirror.com/city/crime/pune-oil-trading-fraud-baner-painter-death-tathawade/,2026-05-02T10:57:07+00:00
Pune,Pune Mirror,Pune • Pune Mirror,https://punemirror.com/,82,"Pune Rural Police Seize Rs.2 Crore Mephedrone in Shirur, Arrest Garage Owner",https://punemirror.com/city/pune-shirur-garage-owner-mephedrone-police-links/,2026-05-02T10:57:07+00:00
Pune,Pune Mirror,Pune • Pune Mirror,https://punemirror.com/,83,Online gaming losses theft fuels shocking Pune tyre robbery,https://punemirror.com/city/crime/online-gaming-losses-theft-pune-tyre-robbery/,2026-05-02T10:57:07+00:00
Pune,Pune Mirror,Pune • Pune Mirror,https://punemirror.com/,84,Pune stepbrother car torching case: shocking family feud rocks Thergaon​,https://punemirror.com/city/pune/pune-stepbrother-car-torching-case/,2026-05-02T10:57:07+00:00
Pune,Pune Mirror,Pune • Pune Mirror,https://punemirror.com/,85,Pune doctor abduction: shocking highway gang extortion terrorises Pune,https://punemirror.com/city/crime/pune-doctor-abduction-19-lakh-extortion/,2026-05-02T10:57:07+00:00
Pune,Pune Mirror,Pune • Pune Mirror,https://punemirror.com/,86,Apple Vision Pro rumours spark powerful debate over AI future,https://punemirror.com/technology/apple-vision-pro-rumours-ai-future/,2026-05-02T10:57:07+00:00
Pune,Pune Mirror,Pune • Pune Mirror,https://punemirror.com/,87,iPhone 17 Pro Max price drop sparks powerful surge in demand,https://punemirror.com/technology/iphone-17-pro-max-price-drop-india/,2026-05-02T10:57:07+00:00
Pune,Pune Mirror,Pune • Pune Mirror,https://punemirror.com/,88,"Drishyam 3 teaser delivers chilling, powerful return for Georgekutty",https://punemirror.com/entertainment/drishyam-3-teaser-mohanlal-thriller-returns/,2026-05-02T10:57:07+00:00
Pune,Pune Mirror,Pune • Pune Mirror,https://punemirror.com/,89,"Dhurandhar plagiarism row: shocking court setback for Santosh, major relief for Aditya Dhar",https://punemirror.com/entertainment/dhurandhar-plagiarism-row-hc-relief-dhar/,2026-05-02T10:57:07+00:00
Pune,Pune Mirror,Pune • Pune Mirror,https://punemirror.com/,90,"Scientific outlook,the need of the hour",https://punemirror.com/news/maharashtra-fake-godmen-superstition-sangamner-case/,2026-05-02T10:57:07+00:00
Pune,Pune Mirror,Pune • Pune Mirror,https://punemirror.com/,91,Rules Voilated Within Hours of Mumbai–Pune ‘Missing Link’ Opening; Heavy Vehicles Spotted Despite Ban,https://punemirror.com/city/pune/mumbai-pune-missing-link-rule-violation-heavy-vehicles/,2026-05-02T10:57:07+00:00
Pune,Pune Mirror,Pune • Pune Mirror,https://punemirror.com/,92,"Pune–Bagdogra Direct Flights Take Off, Boosting Regional Connectivity",https://punemirror.com/city/pune/pune-bagdogra-direct-flight-air-india-express/,2026-05-02T10:57:07+00:00
Pune,Pune Mirror,Pune • Pune Mirror,https://punemirror.com/,93,Gas Leak Near Gangadham Chowk Leaves 17 Residents Breathless; Fire Team Averts Major Mishap,https://punemirror.com/city/pune/pune-gas-leak-gangadham-chowk-fire-brigade-response/,2026-05-02T10:57:07+00:00
Pune,Pune Mirror,Pune • Pune Mirror,https://punemirror.com/,94,"PMPML Introduces ‘Scan & Buy’ Tickets with QR Codes Across 2,000 Buses",https://punemirror.com/city/pune/pmpml-qr-code-ticketing-apli-app-pune-buses/,2026-05-02T10:57:07+00:00
Pune,Pune Mirror,Pune • Pune Mirror,https://punemirror.com/,95,‘Organisation Is Shiv Sena’s Real Strength’: Sanjay Raut Calls for Rebuilding Party Base in Pune,https://punemirror.com/city/pune/sanjay-raut-shiv-sena-organisation-pune-leadership-change/,2026-05-02T10:57:07+00:00
Pune,Pune Mirror,Pune • Pune Mirror,https://punemirror.com/,96,"Mayor Bungalow Tree Cutting Row: PMC Faces Heat, Commissioner Orders Probe and Action",https://punemirror.com/city/pune/pune-mayor-bungalow-tree-cutting-controversy-pmc-probe/,2026-05-02T10:57:07+00:00
