city,publisher,source,source_url,rank,headline,link,collected_at_iso
Bengaluru,DC,Bengaluru • DC,https://www.deccanchronicle.com/location/india/karnataka/bengaluru,1,FIFA World Cup 2026,https://www.deccanchronicle.com/fifa-world-cup-2026,2026-07-09T15:22:28+00:00
Bengaluru,DC,Bengaluru • DC,https://www.deccanchronicle.com/location/india/karnataka/bengaluru,2,Opinion and Editorials,https://www.deccanchronicle.com/opinion,2026-07-09T15:22:28+00:00
Bengaluru,DC,Bengaluru • DC,https://www.deccanchronicle.com/location/india/karnataka/bengaluru,3,Assembly Elections 2026,https://www.deccanchronicle.com/assembly-elections-2026,2026-07-09T15:22:28+00:00
Bengaluru,DC,Bengaluru • DC,https://www.deccanchronicle.com/location/india/karnataka/bengaluru,4,Telangana Rising 2047,https://www.deccanchronicle.com/tags/Telangana-Rising-2047,2026-07-09T15:22:28+00:00
Mumbai,Mumbai Mirror,Mumbai • Mumbai Mirror,https://mumbaimirror.indiatimes.com/mumbai,1,Trapped in digital rubble?,https://mumbaimirror.indiatimes.com/you/trapped-in-digital-rubble/articleshow/132266651.html,2026-07-09T15:22:28+00:00
Mumbai,Mumbai Mirror,Mumbai • Mumbai Mirror,https://mumbaimirror.indiatimes.com/mumbai,2,"Another tree fall, 50-yr-old injured",https://mumbaimirror.indiatimes.com/mumbai/another-tree-fall-50-yr-old-injured/articleshow/132268538.html,2026-07-09T15:22:28+00:00
Mumbai,Mumbai Mirror,Mumbai • Mumbai Mirror,https://mumbaimirror.indiatimes.com/mumbai,3,Paid agents or free speech?,https://mumbaimirror.indiatimes.com/mumbai/paid-agents-or-free-speech/articleshow/132270151.html,2026-07-09T15:22:28+00:00
Mumbai,Mumbai Mirror,Mumbai • Mumbai Mirror,https://mumbaimirror.indiatimes.com/mumbai,4,NATO summit revives Greenland row,https://mumbaimirror.indiatimes.com/opinion/nato-summit-revives-greenland-row/articleshow/132268280.html,2026-07-09T15:22:28+00:00
Mumbai,Mumbai Mirror,Mumbai • Mumbai Mirror,https://mumbaimirror.indiatimes.com/mumbai,5,‘BMC forcing us to do BLO work’,https://mumbaimirror.indiatimes.com/mumbai/bmc-forcing-us-to-do-blo-work/articleshow/132269297.html,2026-07-09T15:22:28+00:00
Mumbai,Mumbai Mirror,Mumbai • Mumbai Mirror,https://mumbaimirror.indiatimes.com/mumbai,6,How we live and die in this city,https://mumbaimirror.indiatimes.com/opinion/how-we-live-and-die-in-this-city/articleshow/132268286.html,2026-07-09T15:22:28+00:00
Mumbai,Mumbai Mirror,Mumbai • Mumbai Mirror,https://mumbaimirror.indiatimes.com/mumbai,7,The sculptor moulded by earth,https://mumbaimirror.indiatimes.com/unwind/the-sculptor-moulded-by-earth/articleshow/132267288.html,2026-07-09T15:22:28+00:00
Mumbai,Mumbai Mirror,Mumbai • Mumbai Mirror,https://mumbaimirror.indiatimes.com/mumbai,8,Ask The Sexpert,https://mumbaimirror.indiatimes.com/ask-the-sexpert,2026-07-09T15:22:28+00:00
Mumbai,Sakal,Mumbai • Sakal,https://www.esakal.com/pune,1,सकाळ लाईव्ह TV,https://www.esakal.com/live-tv,2026-07-09T15:22:28+00:00
Mumbai,Sakal,Mumbai • Sakal,https://www.esakal.com/pune,2,Refund and Cancellation,https://www.esakal.com/refund-and-cancellation,2026-07-09T15:22:28+00:00
Mumbai,Lokmat,Mumbai • Lokmat,https://www.lokmat.com/city/,1,Live News in Marathi,https://www.lokmat.com/live-news/,2026-07-09T15:22:28+00:00
Mumbai,Lokmat,Mumbai • Lokmat,https://www.lokmat.com/city/,2,"अभ्यासाचा कंटाळा आला, पुण्यातील युवक घर सोडून कोल्हापुरात; पोलिसांच्या सतर्कतेने नातेवाइकांची भेट",https://www.lokmat.com/kolhapur/a-young-man-from-nashik-who-had-left-home-to-stay-with-his-aunt-in-pune-for-his-studies-after-growing-weary-of-his-academic-work-arrived-in-kolhapur-a-a746/,2026-07-09T15:22:28+00:00
Mumbai,Lokmat,Mumbai • Lokmat,https://www.lokmat.com/city/,3,LIVE: ममता बॅनर्जी यांना पुन्हा झटका! तीन माजी खासदारांचा भाजपात प्रवेश,https://www.lokmat.com/maharashtra/maharashtra-marathi-news-live-updates-9-july-2026-rain-in-maharashtra-earthquake-in-nanded-latur-vidhan-sabha-adhiveshan-cm-devendra-fadnavis-pm-narendra-modi-us-israel-iran-attacks-donald-trump-india-vs-england-fifa-world-cup-eknath-shinde-a-a573/,2026-07-09T15:22:28+00:00
Mumbai,Lokmat,Mumbai • Lokmat,https://www.lokmat.com/city/,4,संत तुकाराम महाराजांची पालखी संचेती चौकात दाखल; पुण्यात भक्तीमय वातावरण,https://www.lokmat.com/pune/sant-tukaram-maharaj-palkhi-of-arrives-at-sancheti-chowk-devotional-atmosphere-in-pune-a-a1008/,2026-07-09T15:22:28+00:00
Mumbai,Lokmat,Mumbai • Lokmat,https://www.lokmat.com/city/,5,"""पोलीस म्हणून नोकरीला लावतो"", बारामतीत दोन पोलिसांचा तरुणीवर अत्याचार, एक आरोपी मुंबई पोलीस दलातील",https://www.lokmat.com/pune/baramati-crime-he-hired-me-as-a-policeman-two-policemen-raped-a-young-woman-in-baramati-one-of-the-policemen-is-from-the-mumbai-police-force-a-a571/,2026-07-09T15:22:28+00:00
Mumbai,Lokmat,Mumbai • Lokmat,https://www.lokmat.com/city/,6,"पाऊस काही थांबत नाही! १८ राज्ये अलर्टवर; ‘एल निनो’ अधिक तीव्र, मुंबई-महाराष्ट्रात काय होणार?",https://www.lokmat.com/national/monsoon-rain-forecast-for-10-july-2026-the-rains-are-not-stopping-18-states-on-alert-el-nino-is-getting-stronger-know-what-happen-in-mumbai-maharashtra-monsoon-rain-updates-a-a719/,2026-07-09T15:22:28+00:00
Mumbai,Lokmat,Mumbai • Lokmat,https://www.lokmat.com/city/,7,"""हे तुमचं काम नाही, ते पेट्रोलियम मंत्री बघतील"", राज ठाकरेंची नितीन गडकरींवर इथेनॉल धोरणावरून टीका",https://www.lokmat.com/mumbai/raj-thackeray-its-none-of-your-business-the-petroleum-minister-will-look-into-it-raj-thackeray-criticizes-nitin-gadkari-over-ethanol-policy-a-a571/,2026-07-09T15:22:28+00:00
Mumbai,Lokmat,Mumbai • Lokmat,https://www.lokmat.com/city/,8,हा जुगाड महाराष्ट्राबाहेर गेला नाही पाहिजे...; पावसाच्या पाण्यात स्कूटरच्या सायलेन्सरला लावला पाईप अन्...,https://www.lokmat.com/auto/this-jugaad-should-not-have-gone-outside-maharashtra-pipe-was-put-on-the-silencer-of-the-scooter-in-the-rainwater-and-a-a607/,2026-07-09T15:22:28+00:00
Mumbai,Lokmat,Mumbai • Lokmat,https://www.lokmat.com/city/,9,मतदारांपर्यंत SIR पोहोचवण्यासाठी प्रशासनाची नवी मोहीम; शहरभर होणार प्रचार,https://www.lokmat.com/nagpur/administrations-new-campaign-to-reach-sir-to-voters-campaign-will-be-held-across-the-city-a-a876-c1000/,2026-07-09T15:22:28+00:00
Mumbai,Lokmat,Mumbai • Lokmat,https://www.lokmat.com/city/,10,"डोक्यावर टोपी, हातात टाळ, काँग्रेसचेही ‘जय श्रीराम’!",https://www.lokmat.com/nagpur/congress-satyagraha-on-ram-temple-donation-issue-unique-movement-with-raghupati-raghav-rajaram-bhajan-a-a873-c1000/,2026-07-09T15:22:28+00:00
Mumbai,Lokmat,Mumbai • Lokmat,https://www.lokmat.com/city/,11,बलात्काराच्या गुन्ह्यातील फरार आरोपी अमरावतीत जेरबंद; न्यायालयाच्या आदेशाने कारागृहात रवानगी,https://www.lokmat.com/nagpur/absconding-accused-in-rape-case-arrested-in-amravati-sent-to-jail-on-court-order-a-a877-c1000/,2026-07-09T15:22:28+00:00
Mumbai,Lokmat,Mumbai • Lokmat,https://www.lokmat.com/city/,12,एसबीएल एनर्जी स्फोट चौकशी समितीवर आक्षेप; कायदेतज्ञाचा समावेश आवश्यक असल्याचा दावा,https://www.lokmat.com/nagpur/objections-to-sbl-energy-blast-inquiry-committee-claim-that-involvement-of-legal-expert-is-necessary-a-a511-c1000/,2026-07-09T15:22:28+00:00
Mumbai,Lokmat,Mumbai • Lokmat,https://www.lokmat.com/city/,13,नागपुरात ब्रिक्स सदस्य देशाची मोठी बैठक सुरू ; ११ देशांचे प्रतिनिधी सहभागी,https://www.lokmat.com/nagpur/a-major-meeting-of-brics-member-countries-begins-in-nagpur-representatives-of-11-countries-participate-a-a876-c1000/,2026-07-09T15:22:28+00:00
Mumbai,Lokmat,Mumbai • Lokmat,https://www.lokmat.com/city/,14,"नांदूर मधमेश्वर बंधाऱ्यातून 15 हजार 248 क्युसेक्स विसर्ग, गोदावरीकाठच्या नागरिकांना सतर्कतेचा इशारा",https://www.lokmat.com/nashik/15248-cusecs-discharged-from-nandur-madhameshwar-dam-alert-issued-to-citizens-along-godavari-a-a653/,2026-07-09T15:22:28+00:00
Mumbai,Lokmat,Mumbai • Lokmat,https://www.lokmat.com/city/,15,"व्यवसायात यश मिळवून देण्याचे आश्वासन, जादूटोण्याच्या नावाने महिलेवर अत्याचार; भोंदूविरुद्ध गुन्हा दाखल",https://www.lokmat.com/nashik/promised-success-in-business-tortured-woman-in-the-name-of-witchcraft-case-registered-against-fraudster-in-nashik-a-a597/,2026-07-09T15:22:28+00:00
Mumbai,Lokmat,Mumbai • Lokmat,https://www.lokmat.com/city/,16,"नाशिक TCS धर्मांतर प्रकरणात निदा खान, तौसिफ अत्तारला मोठा दिलासा; जामीन मंजूर",https://www.lokmat.com/nashik/nida-khan-gets-bail-in-nashik-tcs-harassment-case-no-relief-for-co-accused-a-a597/,2026-07-09T15:22:28+00:00
Mumbai,Lokmat,Mumbai • Lokmat,https://www.lokmat.com/city/,17,"अतिवृष्टीचा धोका! मुंबई, ठाणे, पुण्यासह 'या' जिल्ह्यांमधील शाळा-महाविद्यालयांना सुट्टी जाहीर",https://www.lokmat.com/maharashtra/rain-alert-danger-of-heavy-rain-holiday-declared-for-schools-and-colleges-in-these-districts-including-thane-pune-orders-issued-a-a571/,2026-07-09T15:22:28+00:00
Mumbai,Lokmat,Mumbai • Lokmat,https://www.lokmat.com/city/,18,"शाळांना १ रुपये, तर ग्रामपंचायती, सरकारी संस्थांना १ हजार रोपे मोफत; कोल्हापुरात वृक्षलागवडीची धूम",https://www.lokmat.com/kolhapur/free-saplings-are-being-provided-to-schools-gram-panchayats-and-government-institutions-in-kolhapur-district-for-tree-plantation-in-the-context-of-vanmahotsav-a-a818-c746/,2026-07-09T15:22:28+00:00
Mumbai,Lokmat,Mumbai • Lokmat,https://www.lokmat.com/city/,19,"कोल्हापुरात शिक्षण संस्थेच्या लिपिकाने चार शिक्षिकांना दिली बनावट नियुक्तिपत्रे; पाच जणांवर गुन्हा, एकास अटक",https://www.lokmat.com/kolhapur/an-educational-institution-clerk-gave-fake-appointment-letters-to-four-teachers-in-kolhapur-a-a746/,2026-07-09T15:22:28+00:00
Mumbai,Lokmat,Mumbai • Lokmat,https://www.lokmat.com/city/,20,"Kolhapur: पन्हाळ्यावर झालेल्या सर्व ४२०२ दस्तांची पुन्हा चौकशी होणार, नोंदणी महानिरीक्षकांचे आदेश",https://www.lokmat.com/kolhapur/all-4202-cases-registered-at-panhala-will-be-re-investigated-orders-of-the-inspector-general-of-registration-a-a746/,2026-07-09T15:22:28+00:00
Mumbai,Lokmat,Mumbai • Lokmat,https://www.lokmat.com/city/,21,Shaktipeeth Mahamarg: शक्तिपीठसाठी जमीन अधिग्रहणाची अधिसूचना जारी,https://www.lokmat.com/maharashtra/land-acquisition-notification-issued-for-shaktipeeth-a-a746/,2026-07-09T15:22:28+00:00
Mumbai,Lokmat,Mumbai • Lokmat,https://www.lokmat.com/city/,22,Sangli Crime: चोरट्याने पेटविल्याचा बनाव...आजीला पेटविले नात जावयाने; संशयितास अटक,https://www.lokmat.com/sangli/a-granddaughters-husband-set-his-grandmother-in-law-on-fire-following-a-dispute-over-property-division-then-fabricated-a-story-claiming-a-thief-had-set-her-ablaze-at-shetphale-in-sangli-district-a-a997-c746/,2026-07-09T15:22:28+00:00
Mumbai,Lokmat,Mumbai • Lokmat,https://www.lokmat.com/city/,23,परदेशी वैद्यकीय शिक्षणानंतरच्या पात्रता परीक्षेत ८६ टक्के विद्यार्थी नापास; चार वर्षांतील सर्वांत नीचांकी टक्का,https://www.lokmat.com/maharashtra/86-percent-of-students-fail-in-qualifying-exam-after-foreign-medical-education-a-a746/,2026-07-09T15:22:28+00:00
Mumbai,Lokmat,Mumbai • Lokmat,https://www.lokmat.com/city/,24,"ईडी करणार ५४ कोटींच्या सोने तस्करी प्रकरणाचा तपास, सांगलीच्या अक्षय बनसोडेची कसून चौकशी",https://www.lokmat.com/national/the-enforcement-directorate-will-now-investigate-the-case-involving-gold-worth-54-crore-seized-in-guwahati-akshay-bansode-from-sangli-is-being-subjected-to-intensive-questioning-a-a746/,2026-07-09T15:22:28+00:00
Mumbai,Lokmat,Mumbai • Lokmat,https://www.lokmat.com/city/,25,"Sangli: येडेनिपाणीत जमिनीच्या वादातून तलवारीने जीवघेणा हल्ला, एकाच कुटुंबातील पाचजण गंभीर जखमी",https://www.lokmat.com/sangli/five-members-of-the-same-family-seriously-injured-in-fatal-sword-attack-over-land-dispute-in-yedenipani-a-a746/,2026-07-09T15:22:28+00:00
Mumbai,Lokmat,Mumbai • Lokmat,https://www.lokmat.com/city/,26,"Satara News: मुलाने तुटलेली वीज तार हातात धरली अन् चौघांचा जीव गेला, समयसूचकतेने लहान बहिणीचा जीव वाचला",https://www.lokmat.com/satara/four-members-of-the-same-family-died-while-trying-to-save-a-boy-who-had-suffered-an-electric-shock-from-a-wire-in-khamgaon-satara-district-the-younger-sisters-life-was-saved-thanks-to-quick-thinking-a-a746/,2026-07-09T15:22:28+00:00
Mumbai,Lokmat,Mumbai • Lokmat,https://www.lokmat.com/city/,27,"भूस्खलनामुळे साताऱ्याची जीवनवाहिनी फुटली, पालिकेकडून युद्धपातळीवर दुरूस्ती",https://www.lokmat.com/satara/a-landslide-caused-the-main-water-pipeline-of-the-kas-scheme-which-supplies-water-to-satara-city-to-burst-a-a746/,2026-07-09T15:22:28+00:00
Mumbai,Lokmat,Mumbai • Lokmat,https://www.lokmat.com/city/,28,"Satara: डिकी उघडली अन् पिस्टल, काडतूस सापडले!; कासवरील नाकाबंदीत पोलिसांची कारवाई",https://www.lokmat.com/satara/during-a-blockade-at-kaas-the-satara-police-detained-a-suspect-with-a-criminal-record-and-seized-a-country-made-pistol-and-a-live-cartridge-a-a746/,2026-07-09T15:22:28+00:00
Mumbai,Lokmat,Mumbai • Lokmat,https://www.lokmat.com/city/,29,"महाबळेश्वर, माथेरानमधील अनधिकृत बांधकामांची चौकशी करणार, मंत्री चंद्रशेखर बावनकुळे यांची घोषणा",https://www.lokmat.com/mumbai/inquiry-to-be-conducted-into-unauthorized-constructions-in-mahabaleshwar-and-matheran-announcement-by-minister-chandrashekhar-bawankule-a-a746/,2026-07-09T15:22:28+00:00
Mumbai,Lokmat,Mumbai • Lokmat,https://www.lokmat.com/city/,30,"सातारा जिल्ह्यात पावसाचा जोर ओसरला; कोयना धरणातील पाणीसाठ्यात वाढ, जावळीत भूस्खलनाने ६१ लोक स्थलांतरित",https://www.lokmat.com/satara/the-intensity-of-rains-has-subsided-in-satara-district-koyna-dam-is-40-percent-full-61-people-displaced-by-landslide-in-jawali-a-a746/,2026-07-09T15:22:28+00:00
Mumbai,Lokmat,Mumbai • Lokmat,https://www.lokmat.com/city/,31,काँग्रेस नगरसेविका पतीवर भरदिवसा चाकू हल्ला; उपचारादरम्यान मृत्यू,https://www.lokmat.com/akola/congress-corporators-husband-attacked-with-knife-in-broad-daylight-dies-during-treatment-a-a607/,2026-07-09T15:22:28+00:00
Mumbai,Lokmat,Mumbai • Lokmat,https://www.lokmat.com/city/,32,विनापरवाना बियाणे साठ्यावर कृषी विभागाचा छापा; २०.६० लाखांचा मुद्देमाल जप्त,https://www.lokmat.com/akola/agriculture-department-raids-unlicensed-seed-stock-goods-worth-rs-20-lakh-60-thousands-seized-a-a653/,2026-07-09T15:22:28+00:00
Mumbai,Lokmat,Mumbai • Lokmat,https://www.lokmat.com/city/,33,अकोल्यात रिलायन्स प्लांट परिसरात आगीचे तांडव; धुराच्या लोटांनी आसमंत काळवंडले,https://www.lokmat.com/akola/fire-breaks-out-in-reliance-plant-area-smoke-billows-into-the-sky-incident-on-akola-nanded-road-a-a747/,2026-07-09T15:22:28+00:00
Mumbai,Lokmat,Mumbai • Lokmat,https://www.lokmat.com/city/,34,"शिंदेसेनेच्या अकोला जिल्हाप्रमुख, महानगरप्रमुखांच्या नियुक्त्या जाहीर",https://www.lokmat.com/akola/appointments-of-shinde-senas-akola-district-chief-and-metropolitan-chief-announced-a-a941/,2026-07-09T15:22:28+00:00
Mumbai,Lokmat,Mumbai • Lokmat,https://www.lokmat.com/city/,35,"Akola: अधिक मासातील धार्मिक स्नान ठरले अखेरचे; मुलगाा बुडायला लागला, आईने उडी मारली; दोघांचाही नदीत बुडून मृत्यू",https://www.lokmat.com/akola/akola-religious-bath-in-the-rainy-season-turned-out-to-be-the-last-mother-and-daughter-drowned-in-the-river-while-saving-their-child-a-a571/,2026-07-09T15:22:28+00:00
Mumbai,Lokmat,Mumbai • Lokmat,https://www.lokmat.com/city/,36,"शक्तिपीठ महामार्ग रद्द करण्यासाठी शेतकरी विठ्ठलाला साकडे घालणार, १८ जुलैला भव्य पायी सदबुध्दी यात्रा",https://www.lokmat.com/maharashtra/against-the-backdrop-of-ashadhi-ekadashi-farmers-from-13-districts-will-undertake-a-sadbuddhi-yatra-on-foot-from-vakari-to-the-vitthal-temple-demanding-the-cancellation-of-the-shaktipeeth-highway-project-a-a746/,2026-07-09T15:22:28+00:00
Mumbai,Lokmat,Mumbai • Lokmat,https://www.lokmat.com/city/,37,"तपासणी केली, त्रुटी आढळल्या, पुरावे सापडले अन् ते मेडिकल केले सील; औषध प्रशासनाची सोलापुरात मोठी कारवाई",https://www.lokmat.com/solapur/inspection-done-errors-found-evidence-found-and-it-was-medically-sealed-drug-administration-takes-major-action-in-solapur-a-a941/,2026-07-09T15:22:28+00:00
Mumbai,Lokmat,Mumbai • Lokmat,https://www.lokmat.com/city/,38,सैराट’ फेम अभिनेता सल्याची रुग्णालयाकडून लूट; व्हिडिओ पाहिला अन् तुकाराम मुंढेंनी दिले चौकशीचे आदेश,https://www.lokmat.com/solapur/sairat-fame-actor-salya-robbed-from-hospital-watched-the-video-and-tukaram-mundhe-ordered-an-inquiry-a-a941/,2026-07-09T15:22:28+00:00
Mumbai,Lokmat,Mumbai • Lokmat,https://www.lokmat.com/city/,39,"प्रॉपर्टीच्या वादातून काका-काकूचा खून; हत्या करून पुतण्यांनी मित्राला दिले सोने, मुंबईमध्ये साहिलला अटक",https://www.lokmat.com/solapur/uncle-and-aunt-murdered-over-property-dispute-nephews-gave-gold-to-friend-after-murder-sahil-arrested-in-mumbai-a-a571/,2026-07-09T15:22:28+00:00
Mumbai,Lokmat,Mumbai • Lokmat,https://www.lokmat.com/city/,40,"भोंदू मनोहर भोसलेकडे अफाट 'माया'; २० बँक खात्यांमध्ये ३ कोटींची रोकड, २५ एकर जमीन अन् फ्लॅट",https://www.lokmat.com/solapur/sit-investigation-reveals-that-the-fraudulent-manohar-bhosale-holds-over-3-crore-across-20-bank-accounts-a-a1001/,2026-07-09T15:22:28+00:00
Mumbai,Lokmat,Mumbai • Lokmat,https://www.lokmat.com/city/,41,शिर्डी साईबाबा मंदिरात 'ब्रेक दर्शन'साठी आता मोजावे लागणार ३०० रुपये; संस्थानचा मोठा निर्णय,https://www.lokmat.com/ahilyanagar/shirdi-sai-baba-sansthan-increases-break-darshan-fee-for-vip-devotees-by-100-rupees-a-a1001/,2026-07-09T15:22:28+00:00
Mumbai,Lokmat,Mumbai • Lokmat,https://www.lokmat.com/city/,42,"""...तर शरद पवार राष्ट्रपती झाले असते""; रामदास आठवले यांचा गौप्यस्फोट",https://www.lokmat.com/ahilyanagar/sharad-pawar-could-have-been-president-if-he-joined-nda-in-2014-claims-union-minister-ramdas-athawale-a-a1001/,2026-07-09T15:22:28+00:00
Mumbai,Lokmat,Mumbai • Lokmat,https://www.lokmat.com/city/,43,"'माहिती अधिकारातील बदल रद्द न झाल्यास पुन्हा जनआंदोलन करणार', अण्णा हजारे यांचा सरकारला इशारा",https://www.lokmat.com/ahilyanagar/will-launch-another-mass-movement-if-changes-in-right-to-information-are-not-repealed-anna-hazare-warns-government-a-a571/,2026-07-09T15:22:28+00:00
Mumbai,Lokmat,Mumbai • Lokmat,https://www.lokmat.com/city/,44,"बैल नाही, ट्रॅक्टरही नाही; माणसेच ओढताहेत पाभर !",https://www.lokmat.com/maharashtra/no-bulls-no-tractors-only-people-are-pulling-the-cart-a-a301/,2026-07-09T15:22:28+00:00
Mumbai,Lokmat,Mumbai • Lokmat,https://www.lokmat.com/city/,45,"आंबित धरण भरले; मुळाही प्रवाही, बळीराजा सुखावला, भात रोपांना संजीवनी",https://www.lokmat.com/maharashtra/ambit-dam-filled-radish-also-flowing-baliraja-is-happy-rice-plants-are-revived-farmers-are-happy-due-to-heavy-rains-a-a301/,2026-07-09T15:22:28+00:00
Mumbai,Lokmat,Mumbai • Lokmat,https://www.lokmat.com/city/,46,"राज्याच्या राजकारणात विनोद तावडे सक्रीय, खडसेंची भेट; भाजपाच्या केंद्रीय नेतृत्वाची नवी चाल?",https://www.lokmat.com/maharashtra/vinod-tawde-active-in-state-politics-meeting-with-eknath-khadse-new-move-by-bjp-central-leadership-a-a629/,2026-07-09T15:22:28+00:00
Mumbai,Lokmat,Mumbai • Lokmat,https://www.lokmat.com/city/,47,जळगावात रिपरिपमुळे जनजीवन विस्कळीत! मुसळधारची प्रतीक्षा कायम,https://www.lokmat.com/jalgaon/normal-life-disrupted-due-to-torrential-rains-in-jalgaon-waiting-for-torrential-rains-continues-a-a653/,2026-07-09T15:22:28+00:00
Mumbai,Lokmat,Mumbai • Lokmat,https://www.lokmat.com/city/,48,"सेल्फीचा मोह जिवावर बेतला, एकाचा पाय घसरला अन्...; अमळनेरमध्ये तीन मित्रांचा खदानीत बुडून मृत्यू",https://www.lokmat.com/jalgaon/while-taking-a-selfie-he-slipped-and-fell-into-a-quarry-three-friends-drowned-in-a-quarry-in-amalner-and-died-a-a571/,2026-07-09T15:22:28+00:00
