city,publisher,source,source_url,rank,headline,link,collected_at_iso
Lucknow,IE,Lucknow • IE,https://indianexpress.com/section/cities/lucknow/,76,Outer thigh pain: What different symptoms may reveal about the cause,https://indianexpress.com/article/lifestyle/health/outer-thigh-pain-symptoms-causes-hip-nerve-muscle-problems-10708364/,2026-07-01T12:43:09+00:00
Lucknow,IE,Lucknow • IE,https://indianexpress.com/section/cities/lucknow/,77,Pune airport to get direct Metro connectivity via Kalyani Nagar station,https://indianexpress.com/article/cities/pune/pune-metro-airport-line-kalyani-nagar-lohegaon-route-10766670/,2026-07-01T12:43:09+00:00
Lucknow,IE,Lucknow • IE,https://indianexpress.com/section/cities/lucknow/,78,Musafir Cafe teaser: Vikrant Massey is at the centre of a love triangle set in the hills,https://indianexpress.com/article/entertainment/bollywood/musafir-cafe-teaser-vikrant-massey-love-triangle-netflix-watch-10766531/,2026-07-01T12:43:09+00:00
Lucknow,IE,Lucknow • IE,https://indianexpress.com/section/cities/lucknow/,79,"Minors recruited, documents forged: Probe into Tamil Nadu gas leak deaths opens can of worms",https://indianexpress.com/article/india/tamil-nadu-seafood-factory-gas-leak-odisha-minor-recruitment-scam-10766671/,2026-07-01T12:43:09+00:00
Lucknow,IE,Lucknow • IE,https://indianexpress.com/section/cities/lucknow/,80,‘Ridiculous’ arrest memo said Raja Raghuvanshi murder accused Sonam was an ‘armed forces deserter’,https://indianexpress.com/article/india/meghalaya-hc-raja-sonam-raghuvanshi-honeymoon-murder-bail-police-10766674/,2026-07-01T12:43:09+00:00
Lucknow,IE,Lucknow • IE,https://indianexpress.com/section/cities/lucknow/,81,Box office flop to 1 billion views: How Jaya Janaki Nayaka aka Khoonkhar made history,https://indianexpress.com/article/entertainment/telugu/jaya-janaki-nayaka-khoonkhar-makes-history-1-billion-views-youtube-10766484/,2026-07-01T12:43:09+00:00
Lucknow,IE,Lucknow • IE,https://indianexpress.com/section/cities/lucknow/,82,"Discarding IVF embryo without couple’s consent is unlawful, rules consumer body",https://indianexpress.com/article/legal-news/discarding-ivf-embryo-couples-consent-is-unlawful-consumer-body-10766455/,2026-07-01T12:43:09+00:00
Lucknow,IE,Lucknow • IE,https://indianexpress.com/section/cities/lucknow/,83,UPSC Mains Answer Practice — GS 2 : India’s vision for Indian Ocean Region and UNHRC-mandated commissions (Week 161),https://indianexpress.com/article/upsc-current-affairs/upsc-essentials/upsc-mains-answer-practice-gs-2-week-161-10766227/,2026-07-01T12:43:09+00:00
Lucknow,IE,Lucknow • IE,https://indianexpress.com/section/cities/lucknow/,84,"What ‘Toy Story 5’ tells us about our world: For the AI-powered screen, the child is the toy",https://indianexpress.com/article/opinion/columns/what-toy-story-5-tells-us-about-our-world-for-the-ai-powered-screen-the-child-is-the-toy-10766613/,2026-07-01T12:43:09+00:00
Lucknow,IE,Lucknow • IE,https://indianexpress.com/section/cities/lucknow/,85,"Cabinet clears 8-km six-lane Dwarka tunnel in Delhi, four-lane highway in UP",https://indianexpress.com/article/business/cabinet-approves-dwarka-vasant-kunj-tunnel-kanpur-kabrai-highway-10766457/,2026-07-01T12:43:09+00:00
Lucknow,IE,Lucknow • IE,https://indianexpress.com/section/cities/lucknow/,86,9-hour mega block at Pune railway station on July 5; check full list of cancelled trains,https://indianexpress.com/article/cities/pune/pune-railway-station-mega-block-july-5-train-cancellations-10766569/,2026-07-01T12:43:09+00:00
Lucknow,IE,Lucknow • IE,https://indianexpress.com/section/cities/lucknow/,87,Newsletters ( opens in a new tab ),https://indianexpress.com/newsletters/,2026-07-01T12:43:09+00:00
Lucknow,IE,Lucknow • IE,https://indianexpress.com/section/cities/lucknow/,88,26/11 Stories of Strength ( opens in a new tab ),https://indianexpress.com/26-11/,2026-07-01T12:43:09+00:00
Lucknow,IE,Lucknow • IE,https://indianexpress.com/section/cities/lucknow/,89,Statutory provisions on reporting (sexual offenses),https://indianexpress.com/article/what-is/what-is-the-protection-of-children-from-sexual-offences-act-2012/,2026-07-01T12:43:09+00:00
Bhopal,Bhaskar,Bhopal • Bhaskar,https://www.bhaskar.com/local/mp/bhopal/,1,जॉब - एजुकेशन,https://www.bhaskar.com/career/,2026-07-01T12:43:09+00:00
Bhopal,Bhaskar,Bhopal • Bhaskar,https://www.bhaskar.com/local/mp/bhopal/,2,फेक न्यूज एक्सपोज़,https://www.bhaskar.com/no-fake-news/,2026-07-01T12:43:09+00:00
Bhopal,Bhaskar,Bhopal • Bhaskar,https://www.bhaskar.com/local/mp/bhopal/,3,लाइफ - साइंस,https://www.bhaskar.com/happylife/,2026-07-01T12:43:09+00:00
Bhopal,Bhaskar,Bhopal • Bhaskar,https://www.bhaskar.com/local/mp/bhopal/,4,"भट्‌टी के कटे तार के संपर्क में आकर ठेले से नीचे गिरे, सिर में लगी गंभीर चोट|भोपाल,Bhopal - Dainik Bhaskar",https://www.bhaskar.com/g/local/mp/bhopal/news/bhopal-chaiwala-death-live-wire-accident-138332950.html,2026-07-01T12:43:09+00:00
Bhopal,Bhaskar,Bhopal • Bhaskar,https://www.bhaskar.com/local/mp/bhopal/,5,"अब सरकारी तेल कंपनियों के बराबर दाम, कीमतों में अतिरिक्त कटौती नहीं|भोपाल,Bhopal - Dainik Bhaskar",https://www.bhaskar.com/g/local/mp/bhopal/news/nayara-petrol-diesel-price-equal-psu-pump-madhya-pradesh-138333036.html,2026-07-01T12:43:09+00:00
Bhopal,Bhaskar,Bhopal • Bhaskar,https://www.bhaskar.com/local/mp/bhopal/,6,"2 युवक घायल, एमपी नगर में हादसे के बाद ट्राला ड्राइवर फरार; पुलिस ने वाहन जब्त किया|भोपाल,Bhopal - Dainik Bhaskar",https://www.bhaskar.com/g/local/mp/bhopal/news/bhopal-car-trolley-accident-two-injured-driver-flees-138332717.html,2026-07-01T12:43:09+00:00
Bhopal,Bhaskar,Bhopal • Bhaskar,https://www.bhaskar.com/local/mp/bhopal/,7,"11 नोटिस के बाद भी काम में सुधार नहीं कर पाई कंपनी; सागर-रीवा की परियोजनाएं हुईं प्रभावित|भोपाल,Bhopal - Dainik Bhaskar",https://www.bhaskar.com/local/mp/bhopal/news/mp-urban-admin-blacklists-consulting-firm-egis-india-138334388.html,2026-07-01T12:43:09+00:00
Bhopal,Bhaskar,Bhopal • Bhaskar,https://www.bhaskar.com/local/mp/bhopal/,8,"नाले की समस्या पर अफसरों को लगाई फटकार; कहा- लापरवाही बर्दाश्त नहीं होगी|भोपाल,Bhopal - Dainik Bhaskar",https://www.bhaskar.com/local/mp/bhopal/news/bhopal-nale-problem-minister-sarang-action-fir-warning-138335409.html,2026-07-01T12:43:09+00:00
Bhopal,Bhaskar,Bhopal • Bhaskar,https://www.bhaskar.com/local/mp/bhopal/,9,"31 जुलाई तक प्रमोशन आदेश जारी करने की तैयारी; जीएडी ने बुलाई पहली डीपीसी बैठक|भोपाल,Bhopal - Dainik Bhaskar",https://www.bhaskar.com/local/mp/bhopal/news/mp-gad-starts-dpc-meeting-after-9-years-promotion-138333798.html,2026-07-01T12:43:09+00:00
Bhopal,Bhaskar,Bhopal • Bhaskar,https://www.bhaskar.com/local/mp/bhopal/,10,"तीन दिन का मौन सत्याग्रह रखेगी, बाइट और डिबेट में प्रवक्ता शामिल नहीं होंगे|भोपाल,Bhopal - Dainik Bhaskar",https://www.bhaskar.com/local/mp/bhopal/news/ujjain-mp-congress-electronic-media-boycott-land-deal-silent-protest-138335232.html,2026-07-01T12:43:09+00:00
Bhopal,Bhaskar,Bhopal • Bhaskar,https://www.bhaskar.com/local/mp/bhopal/,11,"पूरी रात नहीं सो सके यात्री, रेल मंत्री से शिकायत के बाद भी नहीं मिली राहत|भोपाल,Bhopal - Dainik Bhaskar",https://www.bhaskar.com/g/local/mp/bhopal/news/karnatka-sampark-kranti-express-ac-first-class-cockroach-rat-issue-138332525.html,2026-07-01T12:43:09+00:00
Bhopal,Bhaskar,Bhopal • Bhaskar,https://www.bhaskar.com/local/mp/bhopal/,12,"कहा-चंपत राय के घर पर बुलडोजर क्यों नहीं चला, मामले की जांच CBI को दी जाए|भोपाल,Bhopal - Dainik Bhaskar",https://www.bhaskar.com/local/mp/bhopal/news/ram-mandir-chadhava-chori-cbi-inquiry-demand-congress-138333738.html,2026-07-01T12:43:09+00:00
Bhopal,Bhaskar,Bhopal • Bhaskar,https://www.bhaskar.com/local/mp/bhopal/,13,"नदी-नाले उफान पर, घरों में घुसा पानी; MP के 7 संभागों तक पहुंचा मानसून|भोपाल,Bhopal - Dainik Bhaskar",https://www.bhaskar.com/local/mp/bhopal/news/mp-monsoon-advance-heavy-rain-alert-7-districts-138328406.html,2026-07-01T12:43:09+00:00
Bhopal,Bhaskar,Bhopal • Bhaskar,https://www.bhaskar.com/local/mp/bhopal/,14,"भोपाल समेत 3 जिलों में होगा काम, सीवेज- उद्योगों का जहरीला पानी रोकने पर फोकस|भोपाल,Bhopal - Dainik Bhaskar",https://www.bhaskar.com/g/local/mp/bhopal/news/mp-namami-gange-mission-betwa-river-clean-planning-138331880.html,2026-07-01T12:43:09+00:00
Bhopal,Bhaskar,Bhopal • Bhaskar,https://www.bhaskar.com/local/mp/bhopal/,15,"सीएम को लिखा- आवाज उठाना मजबूरी; दिग्विजय का ट्वीट- आपकी पीड़ा मैं समझ रहा हूं|भोपाल,Bhopal - Dainik Bhaskar",https://www.bhaskar.com/g/local/mp/indore/news/indore-minister-letter-cm-neglect-kailash-vijayvargiya-138332434.html,2026-07-01T12:43:09+00:00
Bhopal,Bhaskar,Bhopal • Bhaskar,https://www.bhaskar.com/local/mp/bhopal/,16,"नरोत्तम की शायरी, कहा- भूल हमारी माफ करें; मंत्री बोले- काश, सिंधिया मेरे क्षेत्र के सांसद होते|भोपाल,Bhopal - Dainik Bhaskar",https://www.bhaskar.com/local/mp/news/mp-congress-missing-mla-posters-narottam-mishra-shayari-apology-baat-khari-hai-138331800.html,2026-07-01T12:43:09+00:00
Bhopal,Bhaskar,Bhopal • Bhaskar,https://www.bhaskar.com/local/mp/bhopal/,17,"पार्षद रीता विश्वकर्मा बनीं आज की 'पब्लिक स्टार'; आपकी शिकायत भी पहुंच सकती है जिम्मेदारों तक|भोपाल,Bhopal - Dainik Bhaskar",https://www.bhaskar.com/local/mp/bhopal/news/bhopal-ward-councillor-reeta-vishwakarma-public-star-bhaskar-samadhan-resolve-issues-138328063.html,2026-07-01T12:43:09+00:00
Bhopal,Bhaskar,Bhopal • Bhaskar,https://www.bhaskar.com/local/mp/bhopal/,18,"निगम के दो सहायक यंत्रियों पर गिरी गाज, आयुक्त ने जारी किया कारण बताओ नोटिस|भोपाल,Bhopal - Dainik Bhaskar",https://www.bhaskar.com/g/local/mp/bhopal/news/bhopal-nagar-officials-notice-bada-talab-50m-perimeter-controversy-138331872.html,2026-07-01T12:43:09+00:00
Bhopal,Bhaskar,Bhopal • Bhaskar,https://www.bhaskar.com/local/mp/bhopal/,19,"निगम, मंडल, परियोजनाओं, योजनाओं में नियुक्त संविदा कर्मचारियों की विभाग नहीं दे रहे जानकारी|भोपाल,Bhopal - Dainik Bhaskar",https://www.bhaskar.com/g/local/mp/bhopal/news/up-govt-contract-staff-info-delay-gad-letters-cm-review-138327605.html,2026-07-01T12:43:09+00:00
Bhopal,Bhaskar,Bhopal • Bhaskar,https://www.bhaskar.com/local/mp/bhopal/,20,"FIR के बाद बोले IPL क्रिकेटर शशांक सिंह, कहा- चोरी का शक था, मोबाइल नहीं छीना|भोपाल,Bhopal - Dainik Bhaskar",https://www.bhaskar.com/local/mp/bhopal/news/shashank-singh-ipl-cricketer-fir-bhopal-cook-allegations-denied-138328542.html,2026-07-01T12:43:09+00:00
Bhopal,Bhaskar,Bhopal • Bhaskar,https://www.bhaskar.com/local/mp/bhopal/,21,"पिता की हत्या के बाद शव पेटी में छिपाया; बस में जिंदा जले 6 यात्री, बारिश के बाद सड़क पर बहने लगी गाड़ियां|भोपाल,Bhopal - Dainik Bhaskar",https://www.bhaskar.com/local/mp/news/mp-day-highlights-top-10-news-man-hides-fathers-body-in-box-6-die-in-bus-fire-cobra-regurgitates-dead-female-cobra-138335448.html,2026-07-01T12:43:09+00:00
Bhopal,Bhaskar,Bhopal • Bhaskar,https://www.bhaskar.com/local/mp/bhopal/,22,"परिवहन मंत्री से मिले बस एसोसिएशन के प्रतिनिधि; किराया वृद्धि और लंबित पंजीयन पर हुई चर्चा|भोपाल,Bhopal - Dainik Bhaskar",https://www.bhaskar.com/local/mp/bhopal/news/bus-association-transport-minister-fare-hike-registration-discussion-138335359.html,2026-07-01T12:43:09+00:00
Bhopal,Bhaskar,Bhopal • Bhaskar,https://www.bhaskar.com/local/mp/bhopal/,23,"'सेफ क्लिक 2.0' के तहत स्कूल में कार्यशाला, छात्रों को ऑनलाइन ठगी से बचाव के उपाय बताए|भोपाल,Bhopal - Dainik Bhaskar",https://www.bhaskar.com/local/mp/bhopal/news/bhopal-police-safe-click-2-0-workshop-students-online-fraud-prevention-138335030.html,2026-07-01T12:43:09+00:00
Bhopal,Bhaskar,Bhopal • Bhaskar,https://www.bhaskar.com/local/mp/bhopal/,24,"पंचायत मंत्री ने जताई नाराजगी, अफसरों से कहा-अधूरे भवनों को पूरा करा सरकारी उपयोग में लाएं|भोपाल,Bhopal - Dainik Bhaskar",https://www.bhaskar.com/local/mp/bhopal/news/mp-panchayat-minister-flags-incomplete-housing-projects-138334606.html,2026-07-01T12:43:09+00:00
Bhopal,Bhaskar,Bhopal • Bhaskar,https://www.bhaskar.com/local/mp/bhopal/,25,"कांग्रेस महासचिव निधि चतुर्वेदी ने लिखा- बीजेपी को ऑक्सीजन दे रहे पूर्व सीएम|भोपाल,Bhopal - Dainik Bhaskar",https://www.bhaskar.com/g/local/mp/bhopal/news/congress-leader-nidhi-chaturvedi-digvijaya-singh-land-controversy-bjp-138333263.html,2026-07-01T12:43:09+00:00
Bhopal,Bhaskar,Bhopal • Bhaskar,https://www.bhaskar.com/local/mp/bhopal/,26,"अवैध संबंधों का पति ने विरोध किया तो गला घोंटा; 77मिनट के कॉल से खुला राज|भोपाल,Bhopal - Dainik Bhaskar",https://www.bhaskar.com/local/mp/news/narsinghpur-wife-lover-murder-conspiracy-plan-138331843.html,2026-07-01T12:43:09+00:00
Bhopal,Bhaskar,Bhopal • Bhaskar,https://www.bhaskar.com/local/mp/bhopal/,27,"पत्नी, दो बेटों का मर्डर कर ट्रेन से कटने वाले का आखिरी कॉल, गुस्से ने परिवार उजाड़ा|भोपाल,Bhopal - Dainik Bhaskar",https://www.bhaskar.com/local/mp/morena/news/husband-kills-wife-sons-train-accident-call-wife-dance-anger-138329591.html,2026-07-01T12:43:09+00:00
Bhopal,Bhaskar,Bhopal • Bhaskar,https://www.bhaskar.com/local/mp/bhopal/,28,"6 दिन से रुका मानसून 8 और जिलों में पहुंचा, भोपाल से अ​भी 48 घंटे दूर, 32 जिलों में येलो अलर्ट|भोपाल,Bhopal - Dainik Bhaskar",https://www.bhaskar.com/local/mp/bhopal/news/monsoon-stalled-for-six-days-reaches-eight-more-districts-still-48-hours-away-from-bhopal-yellow-alert-in-32-districts-dbp-138330638.html,2026-07-01T12:43:09+00:00
Bhopal,Bhaskar,Bhopal • Bhaskar,https://www.bhaskar.com/local/mp/bhopal/,29,"सरकार का फैसला... पदोन्नति पर हाई कोर्ट का स्टे नहीं, प्रमोशन देंगे|भोपाल,Bhopal - Dainik Bhaskar",https://www.bhaskar.com/local/mp/bhopal/news/4-lakh-employees-will-get-benefit-dbp-138330594.html,2026-07-01T12:43:09+00:00
Bhopal,Bhaskar,Bhopal • Bhaskar,https://www.bhaskar.com/local/mp/bhopal/,30,"सिर्फ केस नहीं... डॉक्टरों के जीवन की सबसे ‘यादगार’ जंग थे ये मरीज|भोपाल,Bhopal - Dainik Bhaskar",https://www.bhaskar.com/local/mp/bhopal/news/not-just-cases-these-patients-were-the-most-memorable-battles-of-the-doctors-lives-dbp-138330406.html,2026-07-01T12:43:09+00:00
Bhopal,Bhaskar,Bhopal • Bhaskar,https://www.bhaskar.com/local/mp/bhopal/,31,"बोट क्लब रोड की डिजाइन बदलेगी, सीएम हाउस के तीखे ढलान पर बनेगा आइलैंड|भोपाल,Bhopal - Dainik Bhaskar",https://www.bhaskar.com/local/mp/bhopal/news/pwd-will-make-changes-on-the-advice-of-manit-experts-dbp-138330408.html,2026-07-01T12:43:09+00:00
Bhopal,Bhaskar,Bhopal • Bhaskar,https://www.bhaskar.com/local/mp/bhopal/,32,"क्रिप्टो में 30 प्रतिशत मुनाफे का लालच देकर बैंककर्मी से 27.55 लाख की साइबर ठगी|भोपाल,Bhopal - Dainik Bhaskar",https://www.bhaskar.com/local/mp/bhopal/news/showed-profits-then-trapped-in-the-name-of-tax-dbp-138330259.html,2026-07-01T12:43:09+00:00
Bhopal,Bhaskar,Bhopal • Bhaskar,https://www.bhaskar.com/local/mp/bhopal/,33,"तय तारीख पर कार्रवाई क्यों नहीं, अफसरों से जवाब-तलब, 2 इंजीनियरों को नोटिस|भोपाल,Bhopal - Dainik Bhaskar",https://www.bhaskar.com/local/mp/bhopal/news/the-review-continued-till-9-pm-in-the-municipal-corporation-dbp-138330222.html,2026-07-01T12:43:09+00:00
Bhopal,Bhaskar,Bhopal • Bhaskar,https://www.bhaskar.com/local/mp/bhopal/,34,"जोधपुर से चेन्नई के लिए चलेगी समर स्पेशल ट्रेन; जानिए भोपाल में कहां-क्या खास|भोपाल,Bhopal - Dainik Bhaskar",https://www.bhaskar.com/g/local/mp/bhopal/news/jodhpur-chennai-summer-special-train-bhopal-power-outage-updates-138328799.html,2026-07-01T12:43:09+00:00
Bhopal,Bhaskar,Bhopal • Bhaskar,https://www.bhaskar.com/local/mp/bhopal/,35,"बुजुर्ग दंपती की हत्या के बाद शूटरों ने शराब खरीदी, ऑनलाइन पेमेंट से ट्रेस हुए|भोपाल,Bhopal - Dainik Bhaskar",https://www.bhaskar.com/local/mp/bhopal/news/shooters-bought-alcohol-after-killing-elderly-couple-traced-through-online-payment-dbp-138330442.html,2026-07-01T12:43:09+00:00
Bhopal,Bhaskar,Bhopal • Bhaskar,https://www.bhaskar.com/local/mp/bhopal/,36,"केंद्र सरकार ने बढ़ाई डेट, जीस्टैट में 31 जुलाई तक दाखिल कर सकेंगे अपील",https://www.bhaskar.com/local/mp/bhopal/news/the-central-government-has-extended-the-date-for-filing-appeals-in-gst-till-july-31-dbp-138330231.html,2026-07-01T12:43:09+00:00
Bhopal,Bhaskar,Bhopal • Bhaskar,https://www.bhaskar.com/local/mp/bhopal/,37,"3 डिग्री गिरकर 30.6 डिग्री पर आया पारा, दिन-रात के तापमान में सिर्फ 5.6 डिग्री अंतर",https://www.bhaskar.com/local/mp/bhopal/news/the-mercury-dropped-by-30-degrees-to-3060-degrees-celsius-with-a-difference-of-only-560-degrees-between-day-and-night-temperatures-dbp-138330239.html,2026-07-01T12:43:09+00:00
Bhopal,Bhaskar,Bhopal • Bhaskar,https://www.bhaskar.com/local/mp/bhopal/,38,"गिरिबाला के घर घुसे थे छह बदमाश, जेवर के साथ रिवॉल्वर भी ले गए, बेटा करेगा शिनाख्त",https://www.bhaskar.com/local/mp/bhopal/news/six-criminals-entered-giribala39s-house-took-away-the-jewellery-along-with-a-revolver-her-son-will-identify-them-dbp-138330242.html,2026-07-01T12:43:09+00:00
Bhopal,Bhaskar,Bhopal • Bhaskar,https://www.bhaskar.com/local/mp/bhopal/,39,सज्जन व मसूद ने दिग्विजय सिंह को बताया-पार्टी का ‘स्लीपर सेल’,https://www.bhaskar.com/local/mp/bhopal/news/sajjan-and-masood-called-digvijay-singh-a-39sleeper-cell39-of-the-party-dbp-138330273.html,2026-07-01T12:43:09+00:00
Bhopal,Bhaskar,Bhopal • Bhaskar,https://www.bhaskar.com/local/mp/bhopal/,40,"जाति प्रमाण पत्र विवाद: राज्यमंत्री के गांव में बजेगी डोंडी, लोगों से पूछेंगे- बागरी एससी हैं या नहीं, साक्ष्य दें",https://www.bhaskar.com/local/mp/bhopal/news/the-drum-will-be-played-in-the-minister-of-states-village-people-will-be-asked-whether-the-bagris-are-sc-or-not-provide-evidence-dbp-138330416.html,2026-07-01T12:43:09+00:00
Bhopal,Bhaskar,Bhopal • Bhaskar,https://www.bhaskar.com/local/mp/bhopal/,41,"पूर्व डीजी व क्रिकेटर बेटे के खिलाफ दूसरा नौकर सामने आया, करने वाला था सुसाइड|भोपाल,Bhopal - Dainik Bhaskar",https://www.bhaskar.com/local/mp/bhopal/news/a-second-servant-came-forward-against-the-former-director-general-and-his-son-who-was-about-to-commit-suicide-dbp-138330453.html,2026-07-01T12:43:09+00:00
Bhopal,Bhaskar,Bhopal • Bhaskar,https://www.bhaskar.com/local/mp/bhopal/,42,आतंकी गतिविधि से जुड़े फराज को 14 दिन की जेल,https://www.bhaskar.com/local/mp/bhopal/news/faraz-sentenced-to-14-days-in-jail-for-his-involvement-in-terrorist-activities-dbp-138330457.html,2026-07-01T12:43:09+00:00
Bhopal,Bhaskar,Bhopal • Bhaskar,https://www.bhaskar.com/local/mp/bhopal/,43,कोचिंग संस्थानों को जवाब देने का आज अंतिम दिन,https://www.bhaskar.com/local/mp/bhopal/news/today-is-the-last-day-for-coaching-institutes-to-respond-dbp-138330461.html,2026-07-01T12:43:09+00:00
Bhopal,Bhaskar,Bhopal • Bhaskar,https://www.bhaskar.com/local/mp/bhopal/,44,आइसक्रीम का लालच देकर साथ ले गया था,https://www.bhaskar.com/local/mp/bhopal/news/he-was-lured-with-ice-cream-and-taken-along-dbp-138330467.html,2026-07-01T12:43:09+00:00
Bhopal,Bhaskar,Bhopal • Bhaskar,https://www.bhaskar.com/local/mp/bhopal/,45,फेथ ग्रुप की 22.46 करोड़ की संपत्ति ईडी ने की अटैच,https://www.bhaskar.com/local/mp/bhopal/news/ed-attaches-faith-groups-assets-worth-rs-2246-crore-dbp-138330469.html,2026-07-01T12:43:09+00:00
Bhopal,Bhaskar,Bhopal • Bhaskar,https://www.bhaskar.com/local/mp/bhopal/,46,"रैगिंग: मप्र देश में तीसरे नंबर पर, यूआईटी व आरजीपीवी भोपाल टॉप-10 संस्थानों में",https://www.bhaskar.com/local/mp/bhopal/news/ragging-madhya-pradesh-ranks-third-in-the-country-uit-and-rgpv-bhopal-among-top-10-institutions-dbp-138330483.html,2026-07-01T12:43:09+00:00
Bhopal,Bhaskar,Bhopal • Bhaskar,https://www.bhaskar.com/local/mp/bhopal/,47,बिजली बिल में राहत: 200 यूनिट पर 30 रु. तक बचेंगे,https://www.bhaskar.com/local/mp/bhopal/news/electricity-bill-relief-save-up-to-rs-30-per-200-units-dbp-138330486.html,2026-07-01T12:43:09+00:00
Bhopal,Bhaskar,Bhopal • Bhaskar,https://www.bhaskar.com/local/mp/bhopal/,48,"खींचतान के बाद साथ आए दिग्विजय-जीतू: कांग्रेस में डैमेज कंट्रोल- पीसीसी में साथ दिखे, भाजपा ने साधा निशाना",https://www.bhaskar.com/local/mp/bhopal/news/digvijay-and-jitu-come-together-after-a-tussle-dbp-138330685.html,2026-07-01T12:43:09+00:00
