city,publisher,source,source_url,rank,headline,link,collected_at_iso
Delhi-NCR,Jagran,Delhi-NCR • Jagran,https://www.jagran.com/delhi-ncr,26,"एमएमजी अस्पताल पहुंचे अपर निदेशक: न चला हेल्थ ATM, न मिला एक्सपायरी दवाओं का रजिस्टर; स्टाफ को फटकार",https://www.jagran.com/uttar-pradesh/ghaziabad-additional-director-visits-mmg-hospital-health-atm-non-functional-register-for-expired-medicines-missing-staff-reprimanded-40301373.html,2026-07-10T11:10:36+00:00
Delhi-NCR,Jagran,Delhi-NCR • Jagran,https://www.jagran.com/delhi-ncr,27,"गाजियाबाद में E-Challan शुरू होने पर कटे 1 लाख से ज्यादा चालान, 4 माह में 500% की बढ़ोतरी",https://www.jagran.com/uttar-pradesh/ghaziabad-ghaziabad-itms-cameras-500-rise-in-echallans-in-4-months-40301239.html,2026-07-10T11:10:36+00:00
Delhi-NCR,Jagran,Delhi-NCR • Jagran,https://www.jagran.com/delhi-ncr,28,"गाजियाबाद के मोदीनगर में भाजपा शहर अध्यक्ष के ससुर की चाकू मारकर हत्या, दामाद पर लगा आरोप",https://www.jagran.com/uttar-pradesh/ghaziabad-bjp-leaders-fatherinlaw-murdered-by-soninlaw-in-modinagar-40301185.html,2026-07-10T11:10:36+00:00
Delhi-NCR,Jagran,Delhi-NCR • Jagran,https://www.jagran.com/delhi-ncr,29,"अदालत ने कहा... पिता-भाई ही नहीं, पवित्र रिश्ते का भी किया कत्ल; दोषी बेटे को उम्रकैद",https://www.jagran.com/uttar-pradesh/ghaziabad-modinagar-fatherbrother-murder-case-court-says-that-sacred-relationship-was-also-murdered-and-guilty-son-was-sentenced-to-life-imprisonment-40301156.html,2026-07-10T11:10:36+00:00
Delhi-NCR,Jagran,Delhi-NCR • Jagran,https://www.jagran.com/delhi-ncr,30,"भारी बारिश से गाजियाबाद में सिस्टम 'फेल', करोड़ों का नुकसान; 300 से अधिक वाहन खराब",https://www.jagran.com/uttar-pradesh/ghaziabad-ghaziabad-monsoon-failure-300-vehicles-homes-damaged-40301003.html,2026-07-10T11:10:36+00:00
Delhi-NCR,Jagran,Delhi-NCR • Jagran,https://www.jagran.com/delhi-ncr,31,"मानसून में अरावली के 10 सीक्रेट स्पॉट बना रहे NCR वालों को दीवाना; दिल्ली के पास छिपे हैं झरने, झील और रहस्यमयी जंगल",https://www.jagran.com/haryana/gurgaon-aravalli-monsoon-delhincrs-hidden-gems-secret-spots-revealed-40301521.html,2026-07-10T11:10:36+00:00
Delhi-NCR,Jagran,Delhi-NCR • Jagran,https://www.jagran.com/delhi-ncr,32,"मानेसर वालों की बल्ले-बल्ले, विकास कार्यों से लोगों को मिलेगी राहत; खर्च होंगे 1 करोड़ से ज्यादा",https://www.jagran.com/haryana/gurgaon-manesar-garhi-village-gets-156-cr-road-sewer-water-project-40301519.html,2026-07-10T11:10:36+00:00
Delhi-NCR,Jagran,Delhi-NCR • Jagran,https://www.jagran.com/delhi-ncr,33,"जेल में वाटर कूलर और इंसुलिन के लिए फ्रिज की मांग, AAP के पूर्व मंत्री संजीव आरोड़ा की याचिका पर फैसला आज",https://www.jagran.com/haryana/gurgaon-sanjeev-aroras-jail-petitions-insulin-fridge-water-cooler-hearing-40301286.html,2026-07-10T11:10:36+00:00
Delhi-NCR,Jagran,Delhi-NCR • Jagran,https://www.jagran.com/delhi-ncr,34,"गुरुग्राम में 51 साल बाद न्यायिक व्यवस्था का नया युग, CJI सूर्यकांत करेंगे 'टावर ऑफ जस्टिस' का उद्घाटन",https://www.jagran.com/haryana/gurgaon-gurgaons-tower-of-justice-inauguration-new-era-for-judiciary-40301108.html,2026-07-10T11:10:36+00:00
Delhi-NCR,Jagran,Delhi-NCR • Jagran,https://www.jagran.com/delhi-ncr,35,"नोएडा: हरनंदी को तैरकर पार कर रहा युवक डूबा, तलाश में जुटी एनडीआरएफ की टीम",https://www.jagran.com/uttar-pradesh/noida-noida-man-drowns-in-harnandi-river-after-alcohol-consumption-40301332.html,2026-07-10T11:10:36+00:00
Delhi-NCR,Jagran,Delhi-NCR • Jagran,https://www.jagran.com/delhi-ncr,36,"नोएडा में चल रहा बड़ा 'खेल', अवैध कियोस्क से हर महीने 6 करोड़ की वसूली; एक्शन की तैयारी में प्राधिकरण",https://www.jagran.com/uttar-pradesh/noida-noida-illegal-kiosks-rake-in-rs-6-cr-monthly-across-societies-40301130.html,2026-07-10T11:10:36+00:00
Delhi-NCR,Jagran,Delhi-NCR • Jagran,https://www.jagran.com/delhi-ncr,37,"नोएडा में 26 एकड़ में बनेगा अंतरराष्ट्रीय खेल परिसर, खर्च होंगे 145 करोड़ रुपये; खिलाड़ियों को मिलेंगी सुविधाएं",https://www.jagran.com/uttar-pradesh/noida-noida-international-sports-complex-retender-for-2665-acres-40301124.html,2026-07-10T11:10:36+00:00
Delhi-NCR,Jagran,Delhi-NCR • Jagran,https://www.jagran.com/delhi-ncr,38,"ग्रेटर नोएडा श्रमिक हिंसा के मामले में 400 से अधिक पेज की चार्जशीट, 64 लोगों को बनाया आरोपित",https://www.jagran.com/uttar-pradesh/noida-greater-noida-64-accused-in-vipul-motors-labor-violence-case-40301119.html,2026-07-10T11:10:36+00:00
Delhi-NCR,Jagran,Delhi-NCR • Jagran,https://www.jagran.com/delhi-ncr,39,"विवादों से घिरे अपर आयुक्त संदीप भगिया का तबादला, अब ग्रेटर नोएडा में कौन संभालेंगे जिम्मेदारी?",https://www.jagran.com/uttar-pradesh/noida-sandeep-bhagia-transferred-amidst-controversy-in-gautam-buddh-nagar-40301080.html,2026-07-10T11:10:36+00:00
Delhi-NCR,Jagran,Delhi-NCR • Jagran,https://www.jagran.com/delhi-ncr,40,"दिल्ली HC ने DU को किया तलब, अदालत ने पूछा- शरणार्थी से पासपोर्ट की उम्मीद कैसे?",https://www.jagran.com/delhi/new-delhi-city-delhi-high-court-issues-notice-to-du-on-refugee-admission-40301572.html,2026-07-10T11:10:36+00:00
Delhi-NCR,Jagran,Delhi-NCR • Jagran,https://www.jagran.com/delhi-ncr,41,"दिल्ली में माफिया का दुस्साहस, सरकारी जमीन पर कब्जा कर चलाई पार्किंग; नाले में गिरी कार",https://www.jagran.com/delhi/new-delhi-city-delhi-parking-mafia-occupies-govt-land-car-falls-in-drain-40301549.html,2026-07-10T11:10:36+00:00
Delhi-NCR,Jagran,Delhi-NCR • Jagran,https://www.jagran.com/delhi-ncr,42,"नजफगढ़ हादसा: मामले ने लिया नया मोड़, 24 घंटे बाद भी पूल के लाइसेंस पर पुलिस मौन; साक्ष्य छिपाने का आरोप",https://www.jagran.com/delhi/new-delhi-city-najafgarh-drowning-police-silent-on-pool-license-cctv-removed-40301537.html,2026-07-10T11:10:36+00:00
Delhi-NCR,Jagran,Delhi-NCR • Jagran,https://www.jagran.com/delhi-ncr,43,"अब 31 जुलाई तक सरचार्ज माफी की छूट, फरीदाबाद के लोगों को बड़ी राहत; फिर से उठा सकेंगे योजना का लाभ",https://www.jagran.com/haryana/faridabad-faridabad-property-tax-surcharge-waiver-extended-to-july-31-40301260.html,2026-07-10T11:10:36+00:00
Delhi-NCR,Jagran,Delhi-NCR • Jagran,https://www.jagran.com/delhi-ncr,44,"'मुझे मार रहे हैं...', फोन पर विवाहिता ने जताया था अपनी जान का खतरा; कुछ देर बाद फंदे से लटका मिला शव",https://www.jagran.com/haryana/faridabad-faridabad-dowry-death-woman-found-hanged-7-booked-40301111.html,2026-07-10T11:10:36+00:00
Delhi-NCR,Jagran,Delhi-NCR • Jagran,https://www.jagran.com/delhi-ncr,45,"फ्रीज बैंक खाता खुलवाने के लिए नहीं लगाने होंगे चक्कर, आपके शहर में ही दूर होगी परेशानी; GRM मॉड्यूल लागू",https://www.jagran.com/haryana/faridabad-new-grm-unfreeze-bank-accounts-faster-after-cyber-fraud-40301110.html,2026-07-10T11:10:36+00:00
Delhi-NCR,Jagran,Delhi-NCR • Jagran,https://www.jagran.com/delhi-ncr,46,"फरीदाबाद में बड़े भाई की आत्महत्या के अगले दिन छोटे भाई ने भी दी जान, घरेलू कलह बनी वजह",https://www.jagran.com/haryana/faridabad-faridabad-brothers-suicide-domestic-dispute-claims-two-lives-40300844.html,2026-07-10T11:10:36+00:00
Delhi-NCR,Jagran,Delhi-NCR • Jagran,https://www.jagran.com/delhi-ncr,47,"पलवल जिला अस्पताल में मोबाइल टॉर्च की रोशनी में करना पड़ा गर्भवती का ऑपरेशन; बिजली, जनरेटर-इन्वर्टर भी फेल",https://www.jagran.com/haryana/palwal-palwal-hospital-doctors-use-phone-torch-for-surgery-during-power-cut-40301610.html,2026-07-10T11:10:36+00:00
Delhi-NCR,Jagran,Delhi-NCR • Jagran,https://www.jagran.com/delhi-ncr,48,"पलवल में वाहन चोर गिरोह का भंडाफोड़: शातिर बाइक चोर और कबाड़ी गिरफ्तार, भारी मात्रा में कटे हुए पार्ट्स बरामद",https://www.jagran.com/haryana/palwal-palwal-police-busts-vehicle-theft-ring-bike-thief-and-scrapper-arrested-40301465.html,2026-07-10T11:10:36+00:00
Delhi-NCR,Jagran,Delhi-NCR • Jagran,https://www.jagran.com/delhi-ncr,49,"PHOTOS: पलवल में आफत की बारिश! 3 घंटे में डूबा शहर, 29 करोड़ के नाले फेल; 'दो करोड़' पानी में बहे",https://www.jagran.com/haryana/palwal-palwal-weather-floods-heavy-rain-exposes-failed-drainage-system-40300387.html,2026-07-10T11:10:36+00:00
Delhi-NCR,Jagran,Delhi-NCR • Jagran,https://www.jagran.com/delhi-ncr,50,"आरटीओ का अधिकारी बनकर गोशाला की गाड़ी रोकी, 24 हजार ऐंठे; विभाग बोला- उस दिन ड्यूटी ही नहीं लगाई थी",https://www.jagran.com/haryana/palwal-palwal-rto-impersonators-extort-24k-from-gaushala-vehicle-40300366.html,2026-07-10T11:10:36+00:00
Delhi-NCR,Jagran,Delhi-NCR • Jagran,https://www.jagran.com/delhi-ncr,51,"जातिसूचक शब्द कहने का विरोध करने पर परिवार पर लाठी-डंडों और सरियों से हमला, एससी एक्ट में मामला दर्ज",https://www.jagran.com/haryana/palwal-palwal-family-attacked-for-protesting-casteist-slurs-40299247.html,2026-07-10T11:10:36+00:00
Delhi-NCR,Jagran,Delhi-NCR • Jagran,https://www.jagran.com/delhi-ncr,52,"वाराणसी से अमृतसर के ल‍िए गुरु रविदास के नाम से चलेगी ट्रेन, जान लें गाड़ी का नंबर, समय और ठहराव वाले स्‍टेशन",https://www.jagran.com/uttar-pradesh/varanasi-city-train-named-after-guru-ravidass-to-run-from-varanasi-to-amritsar-check-the-train-number-timings-and-scheduled-stops-40301617.html,2026-07-10T11:10:36+00:00
Delhi-NCR,Jagran,Delhi-NCR • Jagran,https://www.jagran.com/delhi-ncr,53,"अमेठी में ड्रेन की सफाई में लाखों के घोटाले का आरोप, तली की जुताई कर भुगतान का दावा; मुख्यमंत्री पोर्टल पर शिकायत",https://www.jagran.com/uttar-pradesh/amethi-amethi-drain-cleaning-scam-lakhs-allegedly-misused-cm-portal-complaint-40301615.html,2026-07-10T11:10:36+00:00
Delhi-NCR,Jagran,Delhi-NCR • Jagran,https://www.jagran.com/delhi-ncr,54,"औरैया में डीएम ने सीएचसी का किया निरीक्षण, बंद मशीनें चालू कराने के दिए निर्देश",https://www.jagran.com/uttar-pradesh/auraiya-auraiya-dm-inspects-dibiyapur-chc-orders-facility-upgrades-40301613.html,2026-07-10T11:10:36+00:00
Delhi-NCR,Jagran,Delhi-NCR • Jagran,https://www.jagran.com/delhi-ncr,55,"जहरीले सांपों से हापुड़ के देहात क्षेत्र में दहशत, बारिश में कई मामले आए सामने; वन विभाग अलर्ट",https://www.jagran.com/uttar-pradesh/hapur-city-hapur-venomous-snake-sightings-rise-krait-danger-in-monsoon-40301600.html,2026-07-10T11:10:36+00:00
Delhi-NCR,Jagran,Delhi-NCR • Jagran,https://www.jagran.com/delhi-ncr,56,"बुलंदशहर में नहर पर बन रहा सात मीटर चौड़ा पुल, इससे स्टेट हाईवे पर ट्रैफिक को मिलेगी रफ्तार",https://www.jagran.com/uttar-pradesh/bulandshahr-lakhawati-canal-bridge-construction-boosts-traffic-on-bulandshahr-syana-garh-state-highway-40301586.html,2026-07-10T11:10:36+00:00
Delhi-NCR,Jagran,Delhi-NCR • Jagran,https://www.jagran.com/delhi-ncr,57,"बहराइच में दबंगों ने महिला को लोहे की रॉड से पीट पीटकर किया घायल, सिर में लगे हैं सात टांके",https://www.jagran.com/uttar-pradesh/bahraich-bahraich-woman-attacked-with-iron-rod-police-inaction-alleged-40301608.html,2026-07-10T11:10:36+00:00
Delhi-NCR,Jagran,Delhi-NCR • Jagran,https://www.jagran.com/delhi-ncr,58,"उन्नाव में हाई कोर्ट के निर्देश पर कब्र से निकलवाया शव, संदिग्ध हालत में हुई थी युवक की मौत",https://www.jagran.com/uttar-pradesh/unnao-unnao-body-exhumed-on-high-court-order-after-suspicious-death-40301603.html,2026-07-10T11:10:36+00:00
Delhi-NCR,Jagran,Delhi-NCR • Jagran,https://www.jagran.com/delhi-ncr,59,"घर की उत्तर-पूर्व दिशा में भूलकर भी न रखें इस रंग की चीजें,",https://www.jagran.com/spiritual/vastu-shastra-never-keep-items-of-this-color-in-the-north-east-direction-of-your-home-according-to-vastu-40301370.html,2026-07-10T11:10:36+00:00
Delhi-NCR,Jagran,Delhi-NCR • Jagran,https://www.jagran.com/delhi-ncr,60,बिजनौर-हरिद्वार मार्ग पर मालन नदी का पानी आने से आवागमन रोका,https://www.jagran.com/uttar-pradesh/bijnor-traffic-halted-on-bijnor-haridwar-route-due-to-flow-of-malan-river-40301361.html,2026-07-10T11:10:36+00:00
Delhi-NCR,Jagran,Delhi-NCR • Jagran,https://www.jagran.com/delhi-ncr,61,"रेवाड़ी के पेट्रोल पंप पर युवती का 'हाईवोल्टेज ड्रामा', नशे",https://www.jagran.com/haryana/rewari-rewari-womans-highvoltage-drama-at-petrol-pump-40301358.html,2026-07-10T11:10:36+00:00
Delhi-NCR,Jagran,Delhi-NCR • Jagran,https://www.jagran.com/delhi-ncr,62,"गुजरात में चांदीपुरा वायरस का प्रकोप, अब तक 3 बच्चों की मौत,",https://www.jagran.com/gujarat/ahmedabad-chandipura-virus-outbreak-in-gujarat-health-department-on-high-alert-40301371.html,2026-07-10T11:10:36+00:00
Delhi-NCR,Jagran,Delhi-NCR • Jagran,https://www.jagran.com/delhi-ncr,63,"उत्तराखंड कांग्रेस एकजुट, आगामी चुनाव में जीत तय: केसी वेणुग",https://www.jagran.com/uttarakhand/dehradun-city-kc-venugopal-uttarakhand-congress-united-demands-temple-probe-40301362.html,2026-07-10T11:10:36+00:00
Delhi-NCR,Jagran,Delhi-NCR • Jagran,https://www.jagran.com/delhi-ncr,64,"अदाणी ग्रुप की एक और बड़ी साझेदारी, फ्रांस की नामी कंपनी से",https://www.jagran.com/business/biz-adani-group-big-move-partnership-with-dioxycle-to-advance-lowcarbon-chemical-manufacturing-40301368.html,2026-07-10T11:10:36+00:00
Delhi-NCR,Jagran,Delhi-NCR • Jagran,https://www.jagran.com/delhi-ncr,65,"लखनऊ के घूसखोर दारोगा और पीड़ित पक्ष के दर्ज होंगे बयान, एसी",https://www.jagran.com/uttar-pradesh/lucknow-city-lucknow-si-guddu-prasad-suspended-for-bribery-probe-on-40301366.html,2026-07-10T11:10:36+00:00
Delhi-NCR,Jagran,Delhi-NCR • Jagran,https://www.jagran.com/delhi-ncr,66,"आगरा में सॉफ्टवेयर इंजीनियर गिरफ्तार, मैट्रिमोनियल साइट पर क",https://www.jagran.com/uttar-pradesh/agra-city-agra-software-engineer-arrested-for-matrimonial-crypto-scam-40301353.html,2026-07-10T11:10:36+00:00
Delhi-NCR,Jagran,Delhi-NCR • Jagran,https://www.jagran.com/delhi-ncr,67,बैक-टू-बैक फ्लॉप फिल्में देने के बाद अब Aditya Roy Kapur का,https://www.jagran.com/entertainment/bollywood-aditya-roy-kapur-upcoming-romantic-film-will-be-directed-by-milap-milan-zaveri-40301328.html,2026-07-10T11:10:36+00:00
Delhi-NCR,Jagran,Delhi-NCR • Jagran,https://www.jagran.com/delhi-ncr,68,"जालंधर में बिस्त दोआब नहर फिर उफान पर, किनारा टूटते ही कॉलोन",https://www.jagran.com/punjab/jalandhar-city-bist-doab-canal-overflow-gadhaipur-kalia-colony-jalandhar-effect-40301363.html,2026-07-10T11:10:36+00:00
Delhi-NCR,Jagran,Delhi-NCR • Jagran,https://www.jagran.com/delhi-ncr,69,होर्मुज में भारी तनाव: अमेरिका ने ईरान के 80 ठिकानों पर किए ताबड़तोड़ हमले; तेल बाजार में मचा हड़कंप,https://www.jagran.com/world/america-tension-in-hormuz-us-launches-massive-attacks-on-iran-40298592.html,2026-07-10T11:10:36+00:00
Delhi-NCR,Jagran,Delhi-NCR • Jagran,https://www.jagran.com/delhi-ncr,70,"प्रयागराज में शोरूम से हीरे की अंगूठी चुराकर रफूचक्कर हुआ युवक, CCTV में कैद हुई वारदात",https://www.jagran.com/uttar-pradesh/prayagraj-prayagraj-diamond-ring-stolen-from-ora-fine-jewellery-showroom-40299265.html,2026-07-10T11:10:36+00:00
Delhi-NCR,Jagran,Delhi-NCR • Jagran,https://www.jagran.com/delhi-ncr,71,"38 मांगें मानो, नहीं तो..., PoK से पाकिस्तान सरकार को 48 घंटे का अल्टीमेटम",https://www.jagran.com/world/pakistan-48-hour-ultimatum-to-pakistan-government-from-pok-jaac-38-demands-to-accept-by-pak-govt-40300419.html,2026-07-10T11:10:36+00:00
Delhi-NCR,Jagran,Delhi-NCR • Jagran,https://www.jagran.com/delhi-ncr,72,"आठ सैनिकों की मौत के बाद भड़का ईरान, बोला- 'कोई भी अमेरिकी सैनिक जिंदा नहीं लौटेगा'",https://www.jagran.com/world/middle-east-no-american-soldier-will-return-alive-iran-issues-a-direct-warning-to-the-us-40299724.html,2026-07-10T11:10:36+00:00
Delhi-NCR,Jagran,Delhi-NCR • Jagran,https://www.jagran.com/delhi-ncr,73,Did You Know,https://www.jagran.com/did-you-know-news-hindi.html,2026-07-10T11:10:36+00:00
Delhi-NCR,Jagran,Delhi-NCR • Jagran,https://www.jagran.com/delhi-ncr,74,फुटबॉल विश्व कप,https://www.jagran.com/topics/fifa-world-cup-2026,2026-07-10T11:10:36+00:00
Delhi-NCR,Jagran,Delhi-NCR • Jagran,https://www.jagran.com/delhi-ncr,75,ए आई बूटकैंप,https://www.jagran.com/events/jagran-next/ai-bootcamp/index.html,2026-07-10T11:10:36+00:00
Delhi-NCR,Jagran,Delhi-NCR • Jagran,https://www.jagran.com/delhi-ncr,76,मिडिल ईस्ट संकट,https://www.jagran.com/topics/Israel-Iran-Conflict,2026-07-10T11:10:36+00:00
Delhi-NCR,Jagran,Delhi-NCR • Jagran,https://www.jagran.com/delhi-ncr,77,फीफा वर्ल्ड कप 2026,https://www.jagran.com/topics/FIFA-World-Cup-2026,2026-07-10T11:10:36+00:00
Delhi-NCR,Jagran,Delhi-NCR • Jagran,https://www.jagran.com/delhi-ncr,78,आज का राशिफल,https://www.jagran.com/topics/rashifal,2026-07-10T11:10:36+00:00
Delhi-NCR,Jagran,Delhi-NCR • Jagran,https://www.jagran.com/delhi-ncr,79,Submit your news,https://www.jagran.com/citizen-journalism-hindi.html,2026-07-10T11:10:36+00:00
Delhi-NCR,Jagran,Delhi-NCR • Jagran,https://www.jagran.com/delhi-ncr,80,Message from the Editor,https://www.jagran.com/policies-and-standards.html,2026-07-10T11:10:36+00:00
Hyderabad,DC,Hyderabad • DC,https://www.deccanchronicle.com/location/india/southern-states,1,FIFA World Cup 2026,https://www.deccanchronicle.com/fifa-world-cup-2026,2026-07-10T11:10:36+00:00
Hyderabad,DC,Hyderabad • DC,https://www.deccanchronicle.com/location/india/southern-states,2,Opinion and Editorials,https://www.deccanchronicle.com/opinion,2026-07-10T11:10:36+00:00
Hyderabad,DC,Hyderabad • DC,https://www.deccanchronicle.com/location/india/southern-states,3,Assembly Elections 2026,https://www.deccanchronicle.com/assembly-elections-2026,2026-07-10T11:10:36+00:00
Hyderabad,DC,Hyderabad • DC,https://www.deccanchronicle.com/location/india/southern-states,4,Telangana Rising 2047,https://www.deccanchronicle.com/tags/Telangana-Rising-2047,2026-07-10T11:10:36+00:00
Chennai,DC,Chennai • DC,https://www.deccanchronicle.com/location/india/tamil-nadu/chennai-madras,1,FIFA World Cup 2026,https://www.deccanchronicle.com/fifa-world-cup-2026,2026-07-10T11:10:36+00:00
Chennai,DC,Chennai • DC,https://www.deccanchronicle.com/location/india/tamil-nadu/chennai-madras,2,Opinion and Editorials,https://www.deccanchronicle.com/opinion,2026-07-10T11:10:36+00:00
Chennai,DC,Chennai • DC,https://www.deccanchronicle.com/location/india/tamil-nadu/chennai-madras,3,Assembly Elections 2026,https://www.deccanchronicle.com/assembly-elections-2026,2026-07-10T11:10:36+00:00
Chennai,DC,Chennai • DC,https://www.deccanchronicle.com/location/india/tamil-nadu/chennai-madras,4,Telangana Rising 2047,https://www.deccanchronicle.com/tags/Telangana-Rising-2047,2026-07-10T11:10:36+00:00
Chennai,The Hindu,Chennai • The Hindu,https://www.thehindu.com/news/cities/chennai/,1,Jana Nayagan gets ‘A’ certificate; likely to release in theatres on July 24,https://www.thehindu.com/entertainment/jana-nayagan-gets-a-certificate-likely-to-release-in-theatres-on-july-24/article71203461.ece,2026-07-10T11:10:36+00:00
Chennai,The Hindu,Chennai • The Hindu,https://www.thehindu.com/news/cities/chennai/,2,"How I became Mano: The singer on Ilaiyaraaja, SPB and 40 years in music",https://www.thehindu.com/entertainment/music/how-i-became-mano-the-singer-on-ilaiyaraaja-spb-and-40-years-in-music/article71202150.ece,2026-07-10T11:10:36+00:00
Chennai,The Hindu,Chennai • The Hindu,https://www.thehindu.com/news/cities/chennai/,3,Australia to return three antiquities stolen from Tamil Nadu temples,https://www.thehindu.com/news/national/tamil-nadu/australia-to-return-three-antiquities-stolen-from-tamil-nadu-temples/article71202173.ece,2026-07-10T11:10:36+00:00
Chennai,The Hindu,Chennai • The Hindu,https://www.thehindu.com/news/cities/chennai/,4,Gone girls | Death of 14 Juang girls from Odisha in Tiruvallur ammonia gas leak exposes tribe’s socio-economic struggle,https://www.thehindu.com/news/national/gone-girls/article71203970.ece,2026-07-10T11:10:36+00:00
