city,publisher,source,source_url,rank,headline,link,collected_at_iso
Chennai,The Hindu,Chennai • The Hindu,https://www.thehindu.com/news/cities/chennai/,25,Over 1.6 lakh teachers across Tamil Nadu appear for eligibility test paper-II,https://www.thehindu.com/news/cities/chennai/over-16-lakh-teachers-across-tamil-nadu-appear-for-eligibility-test-paper-ii/article71185723.ece,2026-07-05T21:08:32+00:00
Chennai,The Hindu,Chennai • The Hindu,https://www.thehindu.com/news/cities/chennai/,26,"Registration of properties has become easy, says Minister",https://www.thehindu.com/news/cities/chennai/registration-of-properties-has-become-easy-says-minister/article71186625.ece,2026-07-05T21:08:32+00:00
Chennai,The Hindu,Chennai • The Hindu,https://www.thehindu.com/news/cities/chennai/,27,"Pidari Ekaveeri: a fierce Goddess, a captivating smile, and Raja Raja’s mother-in-law’s grant",https://www.thehindu.com/news/cities/chennai/pidari-ekaveeri-a-fierce-goddess-a-captivating-smile-and-raja-rajas-mother-in-laws-grant/article71186067.ece,2026-07-05T21:08:32+00:00
Chennai,The Hindu,Chennai • The Hindu,https://www.thehindu.com/news/cities/chennai/,28,"Over 59,000 teachers take up TET exam across Tamil Nadu",https://www.thehindu.com/news/cities/chennai/over-59000-teachers-take-up-tet-exam-across-tamil-nadu/article71182873.ece,2026-07-05T21:08:32+00:00
Chennai,The Hindu,Chennai • The Hindu,https://www.thehindu.com/news/cities/chennai/,29,Ethanol-blended petrol is safe to use: oil firm representatives,https://www.thehindu.com/news/cities/chennai/ethanol-blended-petrol-is-safe-to-use-oil-firm-representatives/article71183616.ece,2026-07-05T21:08:32+00:00
Chennai,The Hindu,Chennai • The Hindu,https://www.thehindu.com/news/cities/chennai/,30,Priest arrested for stealing gold jewellery and silver articles from house,https://www.thehindu.com/news/cities/chennai/priest-arrested-for-stealing-gold-jewellery-and-silver-articles-from-house/article71182392.ece,2026-07-05T21:08:32+00:00
Chennai,The Hindu,Chennai • The Hindu,https://www.thehindu.com/news/cities/chennai/,31,Go to My Account,https://www.thehindu.com/myaccount/,2026-07-05T21:08:32+00:00
Chennai,The Hindu,Chennai • The Hindu,https://www.thehindu.com/news/cities/chennai/,32,35 mins ago - Health The missing link in India’s maternal health story,https://www.thehindu.com/sci-tech/health/the-missing-link-in-indias-maternal-health-story/article71186272.ece,2026-07-05T21:08:32+00:00
Chennai,The Hindu,Chennai • The Hindu,https://www.thehindu.com/news/cities/chennai/,33,"56 mins ago - Mumbai Five children among 6 killed, in Mumbai chawl collapse",https://www.thehindu.com/news/cities/mumbai/mumbai-maharashtra-mankhurd-chawl-house-collapse/article71186874.ece,2026-07-05T21:08:32+00:00
Chennai,The Hindu,Chennai • The Hindu,https://www.thehindu.com/news/cities/chennai/,34,"1 hour ago - Football Brazil vs Norway, FIFA World Cup LIVE Round of 16: Guimaraes misses early penalty",https://www.thehindu.com/sport/football/brazil-vs-norway-fifa-world-cup-live-updates/article71186804.ece,2026-07-05T21:08:32+00:00
Chennai,The Hindu,Chennai • The Hindu,https://www.thehindu.com/news/cities/chennai/,35,"Remain patient, Karnataka Chief Minister D.K. Shivakumar tells ministerial aspirants",https://www.thehindu.com/news/national/karnataka/remain-patient-karnataka-chief-minister-dk-shivakumar-tells-ministerial-aspirants/article71185669.ece,2026-07-05T21:08:32+00:00
Chennai,The Hindu,Chennai • The Hindu,https://www.thehindu.com/news/cities/chennai/,36,"Corrections and Clarifications — July 6, 2026",https://www.thehindu.com/opinion/Readers-Editor/corrections-and-clarifications/corrections-and-clarifications-july-6-2026/article71186291.ece,2026-07-05T21:08:32+00:00
Chennai,The Hindu,Chennai • The Hindu,https://www.thehindu.com/news/cities/chennai/,37,"AI-powered tools can trace missing persons faster, with more accuracy, say experts",https://www.thehindu.com/news/national/tamil-nadu/ai-powered-tools-can-trace-missing-persons-faster-with-more-accuracy-say-experts/article71186122.ece,2026-07-05T21:08:32+00:00
Chennai,The Hindu,Chennai • The Hindu,https://www.thehindu.com/news/cities/chennai/,38,"Letters to The Editor — July 6, 2026",https://www.thehindu.com/opinion/letters/letters-to-the-editor-july-6-2026/article71186304.ece,2026-07-05T21:08:32+00:00
Chennai,The Hindu,Chennai • The Hindu,https://www.thehindu.com/news/cities/chennai/,39,​Two together: on the Japanese Prime Minister’s visit to India,https://www.thehindu.com/opinion/editorial/two-together-on-the-japanese-prime-ministers-visit-to-india/article71185797.ece,2026-07-05T21:08:32+00:00
Lucknow,Jagran,Lucknow • Jagran,https://www.jagran.com/uttar-pradesh/lucknow-city,1,"यूपी सरकार से उपभोक्ताओं के विद्युत भार वृद्धि की उच्चस्तरीय जांच की मांग, बढ़कर हुआ 8.57 किलोवाट",https://www.jagran.com/uttar-pradesh/lucknow-city-up-electricity-load-increase-probe-demanded-capacity-gap-40296111.html,2026-07-05T21:08:32+00:00
Lucknow,Jagran,Lucknow • Jagran,https://www.jagran.com/uttar-pradesh/lucknow-city,2,"यूपी में नए सत्र से एक समान शैक्षणिक रणनीति लागू, सभी 75 जिलों में आयोजित होगी निपुण संकल्प कार्यशाला",https://www.jagran.com/uttar-pradesh/lucknow-city-up-nipun-bharat-mission-workshops-and-teacher-training-begins-40296031.html,2026-07-05T21:08:32+00:00
Lucknow,Jagran,Lucknow • Jagran,https://www.jagran.com/uttar-pradesh/lucknow-city,3,"यूपी में 12 जुलाई को बनेगा नया इतिहास, एक दिन में 35 करोड़ पौधे लगाएगी योगी सरकार",https://www.jagran.com/uttar-pradesh/lucknow-city-up-yogi-govt-to-plant-35-crore-saplings-on-july-12-40296070.html,2026-07-05T21:08:32+00:00
Lucknow,Jagran,Lucknow • Jagran,https://www.jagran.com/uttar-pradesh/lucknow-city,4,"'मंदिर की आस्था के साथ खिलवाड़ बर्दाश्त नहीं', भाजपा अध्यक्ष नितिन नवीन ने विपक्ष पर बोला हमला",https://www.jagran.com/uttar-pradesh/lucknow-city-nitin-naveen-bjp-to-win-up-2027-delhi-2029-warns-on-ram-mandir-40296029.html,2026-07-05T21:08:32+00:00
Lucknow,Jagran,Lucknow • Jagran,https://www.jagran.com/uttar-pradesh/lucknow-city,5,"योगी सरकार की फ्री IAS-PCS कोचिंग योजना का क्रेज, प्रवेश परीक्षा में 67 प्रतिशत से ज्यादा छात्र हुए शामिल; 1 अगस्त से शुरू होंगी क्लासेस",https://www.jagran.com/uttar-pradesh/lucknow-city-yogi-govts-free-iaspcs-coaching-sees-high-demand-in-up-40296028.html,2026-07-05T21:08:32+00:00
Lucknow,Jagran,Lucknow • Jagran,https://www.jagran.com/uttar-pradesh/lucknow-city,6,"लखनऊ में कलाकार-साहित्यकारों के बीच पहुंचे भाजपा अध्यक्ष नितिन नवीन, बोले-शासन को भी दें अपना परामर्श",https://www.jagran.com/uttar-pradesh/lucknow-city-bjp-president-nitin-naveen-met-with-artists-and-litterateurs-in-lucknow-and-urged-them-to-offer-their-counsel-to-the-administration-as-well-40296020.html,2026-07-05T21:08:32+00:00
Lucknow,Jagran,Lucknow • Jagran,https://www.jagran.com/uttar-pradesh/lucknow-city,7,"यूपी पीसीएस एसोसिएशन में बड़ा बदलाव, विश्व भूषण मिश्रा अध्यक्ष और डॉ. सृष्टि धवन महासचिव मनोनीत",https://www.jagran.com/uttar-pradesh/lucknow-city-up-pcs-association-executive-committee-appoints-vishwa-bhushan-mishra-president-and-dr-srishti-dhawan-general-secretary-40296007.html,2026-07-05T21:08:32+00:00
Lucknow,Jagran,Lucknow • Jagran,https://www.jagran.com/uttar-pradesh/lucknow-city,8,"डिप्टी सीएम ब्रजेश पाठक के आवास पर मैंगो पार्टी, भाजपा अध्यक्ष व सीएम योगी सहित सभी वरिष्ठ नेता ने उठाया आनंद",https://www.jagran.com/uttar-pradesh/lucknow-city-bjp-president-nitin-navin-deputy-cm-yogi-adityanath-deputy-cm-keshav-prasad-maurya-and-other-top-bjp-leaders-enjoyed-a-mango-party-at-deputy-cm-brajesh-pathaks-residence-40295971.html,2026-07-05T21:08:32+00:00
Lucknow,Jagran,Lucknow • Jagran,https://www.jagran.com/uttar-pradesh/lucknow-city,9,"उत्तर प्रदेश में 2027 की जीत 2029 में आसान करेगी एनडीए की राह, भाजपा अध्यक्ष नितिन नवीन को भरोसा",https://www.jagran.com/uttar-pradesh/lucknow-city-bjp-victory-in-uttar-pradesh-in-2027-will-pave-the-way-for-an-nda-win-in-2029-bjp-president-nitin-navin-confident-40295912.html,2026-07-05T21:08:32+00:00
Lucknow,Jagran,Lucknow • Jagran,https://www.jagran.com/uttar-pradesh/lucknow-city,10,"ईवी क्रांति में यूपी अव्वल: योगी सरकार ने बांटी 210 करोड़ से अधिक की सब्सिडी, 43 हजार से ज्यादा उपभोक्ताओं को मिला लाभ",https://www.jagran.com/uttar-pradesh/lucknow-city-up-ev-subsidy-yogi-govt-distributes-210-cr-to-43k-buyers-40295890.html,2026-07-05T21:08:32+00:00
Lucknow,Jagran,Lucknow • Jagran,https://www.jagran.com/uttar-pradesh/lucknow-city,11,"गन्ना किसानों को मिलेगा सामाजिक सुरक्षा का कवच, पीएम जीवन ज्योति और सुरक्षा बीमा योजना से जोड़े जाएंगे लाखों परिवार",https://www.jagran.com/uttar-pradesh/lucknow-city-up-sugarcane-farmers-get-social-security-cover-pmjjby-pmsby-40295879.html,2026-07-05T21:08:32+00:00
Lucknow,Jagran,Lucknow • Jagran,https://www.jagran.com/uttar-pradesh/lucknow-city,12,"यूपी के कई जिलों में बारिश और आंधी-तूफान का अलर्ट, मौसम विभाग ने जारी की चेतावनी",https://www.jagran.com/uttar-pradesh/lucknow-city-up-rain-alert-thunderstorms-and-heavy-showers-forecasted-40295840.html,2026-07-05T21:08:32+00:00
Lucknow,Jagran,Lucknow • Jagran,https://www.jagran.com/uttar-pradesh/lucknow-city,13,यूपी 2027 के चुनाव में क्या रहेगी भाजपा की रणनीति? नितिन नवीन ने लखनऊ की बैठक में खोल दिए पत्ते,https://www.jagran.com/uttar-pradesh/lucknow-city-nitin-naveen-outlines-bjps-up-2027-election-strategy-with-allies-40295797.html,2026-07-05T21:08:32+00:00
Lucknow,Jagran,Lucknow • Jagran,https://www.jagran.com/uttar-pradesh/lucknow-city,14,"उत्तर प्रदेश में मतदाताओं में पैठ बनाने के लिए कांग्रेस की पद यात्रा जल्द, पार्टी के पिछड़ा वर्ग को जिम्मेदारी",https://www.jagran.com/uttar-pradesh/lucknow-city-congress-to-launch-padyatra-soon-to-make-inroads-among-voters-in-uttar-pradesh-the-partys-backward-classes-wing-has-been-entrusted-with-the-responsibility-40295771.html,2026-07-05T21:08:32+00:00
Lucknow,Jagran,Lucknow • Jagran,https://www.jagran.com/uttar-pradesh/lucknow-city,15,"लखनऊ यूनिवर्सिटी में 18 साल बाद फिर शुरू होंगे D.Litt, D.Sc और LLD कोर्स में एडमिशन, ऐसे करें आवेदन",https://www.jagran.com/uttar-pradesh/lucknow-city-lucknow-university-resumes-dlitt-dsc-lld-admissions-40295748.html,2026-07-05T21:08:32+00:00
Lucknow,Jagran,Lucknow • Jagran,https://www.jagran.com/uttar-pradesh/lucknow-city,16,"दिल्ली में मौसम बेहद खराब, देश की राजधानी को जाने वाले तीन विमान लखनऊ डायवर्ट",https://www.jagran.com/uttar-pradesh/lucknow-city-bad-weather-in-delhi-three-flights-to-the-national-capital-diverted-to-lucknow-40295745.html,2026-07-05T21:08:32+00:00
Lucknow,Jagran,Lucknow • Jagran,https://www.jagran.com/uttar-pradesh/lucknow-city,17,"यूपी के सरकारी स्कूलों में बिना पढ़ाई के बीत रहा बच्चों का एक चौथाई समय, सर्वे में हुआ खुलासा",https://www.jagran.com/uttar-pradesh/lucknow-city-up-basic-schools-26-time-wasted-in-nonstudy-activities-40295725.html,2026-07-05T21:08:32+00:00
Lucknow,Jagran,Lucknow • Jagran,https://www.jagran.com/uttar-pradesh/lucknow-city,18,"उत्तर प्रदेश विधानसभा चुनाव में उतरने का तैयारी में लोक जनशक्ति पार्टी, लखनऊ में चिराग पासवान ने पेश किया दावा",https://www.jagran.com/uttar-pradesh/lucknow-city-lok-janshakti-party-gears-up-to-contest-the-uttar-pradesh-assembly-elections-chirag-paswan-stakes-a-claim-in-lucknow-40295717.html,2026-07-05T21:08:32+00:00
Lucknow,Jagran,Lucknow • Jagran,https://www.jagran.com/uttar-pradesh/lucknow-city,19,"टिंटेड ग्लास, 'CATCHM3' नंबर प्लेट, लखनऊ में ब्लैक BMW के सीक्रेट लॉकर से निकलीं नोटों की गड्डियां",https://www.jagran.com/uttar-pradesh/lucknow-city-26-lakh-rupees-recovered-from-the-locker-of-a-bmw-car-with-california-written-on-it-income-tax-department-is-investigating-40295351.html,2026-07-05T21:08:32+00:00
Lucknow,Jagran,Lucknow • Jagran,https://www.jagran.com/uttar-pradesh/lucknow-city,20,"लखनऊ में पुरानी रंजिश के चलते दो पक्षों में खूनी संघर्ष, एक युवक की पीट-पीटकर हत्या",https://www.jagran.com/uttar-pradesh/lucknow-city-lucknow-man-murdered-over-old-enmity-on-raebareli-road-40295425.html,2026-07-05T21:08:32+00:00
Lucknow,Jagran,Lucknow • Jagran,https://www.jagran.com/uttar-pradesh/lucknow-city,21,"राम मंदिर चढ़ावा चोरी: टिन्नू यादव का नाम लेने पर मिलती थी चेकिंग से छूट, SIT को बैंक कैशियर ने बताया",https://www.jagran.com/uttar-pradesh/ayodhya-bank-cashier-statement-to-sit-in-theft-of-temple-offerings-while-formal-checks-conducted-initially-they-later-discontinued-mentioning-tinnu-name-ensured-no-questioning-or-interference-anywhere-within-the-temple-complex-40295366.html,2026-07-05T21:08:32+00:00
Lucknow,Jagran,Lucknow • Jagran,https://www.jagran.com/uttar-pradesh/lucknow-city,22,"कोलकाता से वाराणसी जा रहा माल वाहक जलपोत गाजीपुर के पास गंगा में 20 द‍िन से फंसा, पानी कम होने से संचालन बाध‍ित, जांच के आदेश",https://www.jagran.com/uttar-pradesh/ghazipur-a-cargo-vessel-en-route-from-kolkata-to-varanasi-has-been-stuck-in-the-ganges-near-ghazipur-for-20-days-40292386.html,2026-07-05T21:08:32+00:00
Lucknow,Jagran,Lucknow • Jagran,https://www.jagran.com/uttar-pradesh/lucknow-city,23,वीर बहादुर सिंह पूर्वांचल व‍िश्‍वव‍िद्यालय के आठ बाबू सेवान‍िवृत्‍त‍ि का लाभ पाने के ल‍िए बने चपरासी,https://www.jagran.com/uttar-pradesh/jaunpur-eight-clerical-staff-members-at-veer-bahadur-singh-purvanchal-university-became-peons-to-avail-retirement-benefits-40292542.html,2026-07-05T21:08:32+00:00
Lucknow,Jagran,Lucknow • Jagran,https://www.jagran.com/uttar-pradesh/lucknow-city,24,राम मंदिर चढ़ावा चोरी: चंपत राय-अनिल मिश्रा और गोपाल राव पर FIR के लिए वकीलों ने दी तहरीर,https://www.jagran.com/uttar-pradesh/ayodhya-ram-mandir-offering-theft-lawyers-submit-complaint-seeking-fir-against-champat-rai-anil-mishra-and-gopal-rao-40292150.html,2026-07-05T21:08:32+00:00
Lucknow,Jagran,Lucknow • Jagran,https://www.jagran.com/uttar-pradesh/lucknow-city,25,"मिनी नंदिनी योजना में 10 गायों पर 11.80 लाख रुपये का अनुदान, योजना में ऋण लेने की अनिवार्यता खत्म",https://www.jagran.com/uttar-pradesh/pratapgarh-mini-nandini-yojana-1m-118k-grant-for-10-cows-in-pratapgarh-40291355.html,2026-07-05T21:08:32+00:00
Lucknow,Jagran,Lucknow • Jagran,https://www.jagran.com/uttar-pradesh/lucknow-city,26,"ब‍िजनौर में बंद किए गए बैराज के सभी 28 गेट, कुछ घंटे की बरसात से गंगा का पानी साढ़े चार गुना बढ़ा",https://www.jagran.com/uttar-pradesh/bijnor-bijnor-ganga-water-surges-barrage-gates-closed-for-ponding-40291851.html,2026-07-05T21:08:32+00:00
Lucknow,Jagran,Lucknow • Jagran,https://www.jagran.com/uttar-pradesh/lucknow-city,27,"द्रौपदी की जन्मस्थली से लेकर 'नीब करौरी बाबा' की तपोभूमि तक, फर्रुखाबाद में 7488 करोड़ के प्रोजेक्ट्स से बदल रही जिले की तस्वीर",https://www.jagran.com/uttar-pradesh/farrukhabad-farrukhabads-7488-cr-projects-from-history-to-modern-hub-40291222.html,2026-07-05T21:08:32+00:00
Lucknow,Jagran,Lucknow • Jagran,https://www.jagran.com/uttar-pradesh/lucknow-city,28,"हाथरस: पोस्टमैन की बेटी शिवानी चौधरी बनीं वायुसेना में फ्लाइंग ऑफिसर, पहले प्रयास में मिली सफलता",https://www.jagran.com/uttar-pradesh/hathras-postman-daughter-becomes-a-flying-officer-shivani-chaudhary-secures-a-position-in-the-indian-air-force-on-her-very-first-attempt-40288848.html,2026-07-05T21:08:32+00:00
Lucknow,Jagran,Lucknow • Jagran,https://www.jagran.com/uttar-pradesh/lucknow-city,29,रांची में पशुपालन विभाग के खाते से फिर 17 लाख की अवैध निकासी कुबेर पोर्टल पर फर्जी आईडी से घोटाला,https://www.jagran.com/jharkhand/ranchi-ranchi-frozen-semen-bank-fraud-17-lakh-embezzled-via-kuber-portal-40296164.html,2026-07-05T21:08:32+00:00
Lucknow,Jagran,Lucknow • Jagran,https://www.jagran.com/uttar-pradesh/lucknow-city,30,"राम मंदिर चढ़ावा चोरी: जांच… FIR, गिरफ्तारी और छापेमारी के बाद बैठक, मामले की 10 बड़ी बातें",https://www.jagran.com/uttar-pradesh/ayodhya-ram-mandir-donation-theft-trust-meeting-today-amid-probe-40296238.html,2026-07-05T21:08:32+00:00
Lucknow,Jagran,Lucknow • Jagran,https://www.jagran.com/uttar-pradesh/lucknow-city,31,"रिलीज के 2 दिन बाद ही OTT से हटा दी गई Diljit Dosanjh की फिल्म Satluj, प्लेटफॉर्म ने दी सफाई",https://www.jagran.com/entertainment/bollywood-diljit-dosanjh-arjun-rampal-controversial-film-satluj-removed-from-zee5-in-two-days-after-release-40296112.html,2026-07-05T21:08:32+00:00
Lucknow,Jagran,Lucknow • Jagran,https://www.jagran.com/uttar-pradesh/lucknow-city,32,LNG संकट टला: होर्मुज से सप्लाई सामान्य होने पर सरकार ने हटाए गैस पर लगे आपातकालीन प्रतिबंध,https://www.jagran.com/news/national-india-lifts-gas-supply-curbs-as-hormuz-lng-normalizes-40296163.html,2026-07-05T21:08:32+00:00
Lucknow,Jagran,Lucknow • Jagran,https://www.jagran.com/uttar-pradesh/lucknow-city,33,"मुंबई में भारी बारिश के बीच बहुमंजिला चॉल गिरने से 6 लोगों की मौत, 1 घायल",https://www.jagran.com/maharashtra/mumbai-mumbai-chawl-collapse-kills-6-in-mankhurd-amid-heavy-rain-40296179.html,2026-07-05T21:08:32+00:00
Lucknow,Jagran,Lucknow • Jagran,https://www.jagran.com/uttar-pradesh/lucknow-city,34,टिक-टिक करता टाइम-बम: यूक्रेन ने रूस पर लगाया कब्जे वाले इलाके में बायो-वेपन दफनाने का आरोप,https://www.jagran.com/world/russia-ukraine-accuses-russia-of-anthrax-bioweapon-threat-in-occupied-areas-40296229.html,2026-07-05T21:08:32+00:00
Lucknow,Jagran,Lucknow • Jagran,https://www.jagran.com/uttar-pradesh/lucknow-city,35,सूखे की आहट: मुजफ्फरपुर में जून में सामान्य से 54 फीसदी कम ब,https://www.jagran.com/bihar/muzaffarpur-weatherforecast-june-rainfall-deficit-el-nino-impact-paddy-cultivation-affected-40295671.html,2026-07-05T21:08:32+00:00
Lucknow,Jagran,Lucknow • Jagran,https://www.jagran.com/uttar-pradesh/lucknow-city,36,"वैश्विक मानचित्र पर उभरा गोरखपुर विश्वविद्यालय, विदेश से आए",https://www.jagran.com/uttar-pradesh/gorakhpur-city-gorakhpur-university-attracts-90-foreign-students-global-mba-40295670.html,2026-07-05T21:08:32+00:00
Lucknow,Jagran,Lucknow • Jagran,https://www.jagran.com/uttar-pradesh/lucknow-city,37,अयोध्या पुलिस जेल में कर रही राम मंदिर के चढ़ावा चोरी के आरो,https://www.jagran.com/uttar-pradesh/ayodhya-ayodhya-police-interrogate-accused-regarding-theft-of-offerings-inside-the-jail-investigating-officer-visits-the-district-prison-40295663.html,2026-07-05T21:08:32+00:00
Lucknow,Jagran,Lucknow • Jagran,https://www.jagran.com/uttar-pradesh/lucknow-city,38,"मनाली-लेह हाईवे नहीं... 'नाला', सड़क पर बाढ़ ने जोखिमभरा किय",https://www.jagran.com/himachal-pradesh/kullu-manalileh-highway-flooding-travel-risks-safe-options-40295666.html,2026-07-05T21:08:32+00:00
Lucknow,Jagran,Lucknow • Jagran,https://www.jagran.com/uttar-pradesh/lucknow-city,39,इन्फ्लुएंसर्स की देखा-देखी करवा रहे हैं मेडिकल टेस्ट? बेवजह,https://www.jagran.com/lifestyle/health-are-influencers-making-you-sick-the-dark-side-of-social-media-health-trends-40295659.html,2026-07-05T21:08:32+00:00
Lucknow,Jagran,Lucknow • Jagran,https://www.jagran.com/uttar-pradesh/lucknow-city,40,"'दत्तात्रेय होसबाले के बयान से पूरी तरह सहमत हूं', राम मंदिर",https://www.jagran.com/news/national-agree-with-hosabale-statement-on-ram-temple-donation-issue-says-rss-chief-mohan-bhagwat-40295658.html,2026-07-05T21:08:32+00:00
Lucknow,Jagran,Lucknow • Jagran,https://www.jagran.com/uttar-pradesh/lucknow-city,41,"Toyota Innova Hycross में E20 पेट्रोल से हुई परेशानी, निर्मा",https://www.jagran.com/automobile/latest-news-toyota-statement-on-viral-innova-hycross-e20-fuel-breakdown-issue-40295541.html,2026-07-05T21:08:32+00:00
Lucknow,Jagran,Lucknow • Jagran,https://www.jagran.com/uttar-pradesh/lucknow-city,42,रागी की खेती में आया नया 'गेम चेंजर'! रामगढ़ में इस मशीन से,https://www.jagran.com/jharkhand/ramgarh-dry-conoweeder-boosts-ragi-yield-in-ramgarh-jharkhand-40295641.html,2026-07-05T21:08:32+00:00
Lucknow,Jagran,Lucknow • Jagran,https://www.jagran.com/uttar-pradesh/lucknow-city,43,"'TMC का अस्तित्व खत्म हो चुका है', चंद्रिमा भट्टाचार्य के इस",https://www.jagran.com/west-bengal/kolkata-chandrima-bhattacharya-resigns-mamata-banerjee-takes-over-tmc-40295661.html,2026-07-05T21:08:32+00:00
