city,publisher,source,source_url,rank,headline,link,collected_at_iso
Delhi-NCR,Jagran,Delhi-NCR • Jagran,https://www.jagran.com/delhi-ncr,30,"गाजियाबाद में नौ माह से लापता छात्र का नहीं मिला सुराग, हत्या की आशंका",https://www.jagran.com/uttar-pradesh/ghaziabad-missing-ghaziabad-student-9-months-on-murder-feared-40300946.html,2026-07-10T03:52:08+00:00
Delhi-NCR,Jagran,Delhi-NCR • Jagran,https://www.jagran.com/delhi-ncr,31,"गुरुग्राम की इम्पीरिया एस्फेरा सोसायटी में गिरी बालकनी, निर्माण गुणवत्ता पर उठे गंभीर सवाल",https://www.jagran.com/haryana/gurgaon-gurgaon-balcony-collapse-imperia-asphera-raises-safety-concerns-40301030.html,2026-07-10T03:52:08+00:00
Delhi-NCR,Jagran,Delhi-NCR • Jagran,https://www.jagran.com/delhi-ncr,32,"SGT यूनिवर्सिटी के मालिक का बेटा था टारगेट! गुरुग्राम में एनकाउंटर में 4 शूटर ढेर, 3 पुलिसकर्मियों को भी लगी गोली",https://www.jagran.com/haryana/gurgaon-gurugram-encounter-4-deepak-nandal-gang-shooters-killed-40300925.html,2026-07-10T03:52:08+00:00
Delhi-NCR,Jagran,Delhi-NCR • Jagran,https://www.jagran.com/delhi-ncr,33,"गुरुग्राम में 10000 करोड़ की रिहायशी परियोजना पर हाईकोर्ट की रोक, नई बुकिंग पर फिलहाल प्रतिबंध",https://www.jagran.com/haryana/gurgaon-high-court-stays-new-bookings-at-oberoi-360-north-gurugram-40300389.html,2026-07-10T03:52:08+00:00
Delhi-NCR,Jagran,Delhi-NCR • Jagran,https://www.jagran.com/delhi-ncr,34,"सोहना पहाड़ी कंकाल केस: गला दबाकर की गई थी हत्या, DNA और कपड़ों से होगी पहचान; मिसिंग रिपोर्ट खंगाल रही पुलिस",https://www.jagran.com/haryana/gurgaon-sohna-hill-skeleton-case-murder-by-strangulation-confirmed-40300227.html,2026-07-10T03:52:08+00:00
Delhi-NCR,Jagran,Delhi-NCR • Jagran,https://www.jagran.com/delhi-ncr,35,"गुरुग्राम में रिहायशी प्लॉट में दुकान-सैलून चलाने वाले सावधान! डीएलएफ में सीलिंग की तैयारी, थमाया गया नोटिस",https://www.jagran.com/haryana/gurgaon-dlf-gurugram-sealing-notices-issued-for-illegal-commercial-use-40300220.html,2026-07-10T03:52:08+00:00
Delhi-NCR,Jagran,Delhi-NCR • Jagran,https://www.jagran.com/delhi-ncr,36,"25 दिन, 15 शहर, अब 2 और जुड़े; नोएडा एयरपोर्ट से मुंबई-श्रीनगर की सीधी उड़ान आज से शुरू",https://www.jagran.com/uttar-pradesh/noida-noida-airport-direct-indigo-flights-to-mumbai-srinagar-start-today-40300801.html,2026-07-10T03:52:08+00:00
Delhi-NCR,Jagran,Delhi-NCR • Jagran,https://www.jagran.com/delhi-ncr,37,"विपरीत दिशा में आ रही तेज रफ्तार स्कॉर्पियो बाइक और लोडर से भिड़ी, नाबालिग समेत दो की मौत; चार घायल",https://www.jagran.com/uttar-pradesh/noida-noida-wrongway-scorpio-accident-2-dead-4-injured-40301025.html,2026-07-10T03:52:08+00:00
Delhi-NCR,Jagran,Delhi-NCR • Jagran,https://www.jagran.com/delhi-ncr,38,"ग्रेटर नोएडा में चार मूर्ति गोल चक्कर पर खराब हुई ई-बस, यात्री हुए परेशान",https://www.jagran.com/uttar-pradesh/noida-noida-electric-bus-breaks-down-passengers-stranded-waterlogging-threat-40301022.html,2026-07-10T03:52:08+00:00
Delhi-NCR,Jagran,Delhi-NCR • Jagran,https://www.jagran.com/delhi-ncr,39,"24 साल बाद इंद्र देव सिंह हत्याकांड में तीन दोषियों को उम्रकैद, नोएडा पुलिस कमिश्नर लक्ष्मी सिंह कोर्ट में रहीं मौजूद",https://www.jagran.com/uttar-pradesh/noida-inder-dev-singh-murder-3-convicts-get-life-after-24-years-40300983.html,2026-07-10T03:52:08+00:00
Delhi-NCR,Jagran,Delhi-NCR • Jagran,https://www.jagran.com/delhi-ncr,40,"'बैंकों के विलय के बाद भी किराये की संपत्ति के लिए मकान मालिक की लिखित सहमति जरूरी', सुप्रीम कोर्ट का फैसला",https://www.jagran.com/delhi/new-delhi-city-sc-landlord-consent-must-for-bank-merger-tenancy-transfer-40301039.html,2026-07-10T03:52:08+00:00
Delhi-NCR,Jagran,Delhi-NCR • Jagran,https://www.jagran.com/delhi-ncr,41,"राजेंद्र भारती की विधायकी का फैसला आज, रुकेगी दोषसिद्धि तो मिलेगी राहत; दतिया उपचुनाव से पहले जगी बड़ी उम्मीद",https://www.jagran.com/delhi/new-delhi-city-delhi-hc-to-decide-rajendra-bharti-conviction-stay-plea-40300731.html,2026-07-10T03:52:08+00:00
Delhi-NCR,Jagran,Delhi-NCR • Jagran,https://www.jagran.com/delhi-ncr,42,"फरीदाबाद में बड़े भाई की आत्महत्या के अगले दिन छोटे भाई ने भी दी जान, घरेलू कलह बनी वजह",https://www.jagran.com/haryana/faridabad-faridabad-brothers-suicide-domestic-dispute-claims-two-lives-40300844.html,2026-07-10T03:52:08+00:00
Delhi-NCR,Jagran,Delhi-NCR • Jagran,https://www.jagran.com/delhi-ncr,43,"फरीदाबाद में 2 एक्सप्रेसवे को जोड़ने वाली मोहना रोड में भ्रष्टाचार, 66 फुट की सड़क नहीं बनाई; ACB से शिकायत",https://www.jagran.com/haryana/faridabad-mohana-road-cracks-acb-probe-sought-over-poor-construction-40300177.html,2026-07-10T03:52:08+00:00
Delhi-NCR,Jagran,Delhi-NCR • Jagran,https://www.jagran.com/delhi-ncr,44,"फरीदाबाद में प्रॉपर्टी टैक्स भरने वालों को बड़ी राहत, 31 अगस्त तक जमा करने पर ब्याज में मिलेगी 75% छूट",https://www.jagran.com/haryana/faridabad-faridabad-property-tax-interest-waiver-extended-to-aug-31-40300174.html,2026-07-10T03:52:08+00:00
Delhi-NCR,Jagran,Delhi-NCR • Jagran,https://www.jagran.com/delhi-ncr,45,"10 महीने से जिसकी हत्या के लिए काट रहे थे जेल, वो शव किसी और का निकला; सवालों में फरीदाबाद पुलिस की जांच",https://www.jagran.com/haryana/faridabad-faridabad-murder-case-dna-twist-frees-accused-after-10-months-40300031.html,2026-07-10T03:52:08+00:00
Delhi-NCR,Jagran,Delhi-NCR • Jagran,https://www.jagran.com/delhi-ncr,46,"फरीदाबाद में भारी बारिश से पुराना खेड़ी पुल धंसा, रास्ता पूरी तरह बंद; नगला एंक्लेव में बड़ा हादसा टला",https://www.jagran.com/haryana/faridabad-faridabad-old-khedi-bridge-collapses-due-to-rain-traffic-halted-40300049.html,2026-07-10T03:52:08+00:00
Delhi-NCR,Jagran,Delhi-NCR • Jagran,https://www.jagran.com/delhi-ncr,47,"PHOTOS: पलवल में आफत की बारिश! 3 घंटे में डूबा शहर, 29 करोड़ के नाले फेल; 'दो करोड़' पानी में बहे",https://www.jagran.com/haryana/palwal-palwal-weather-floods-heavy-rain-exposes-failed-drainage-system-40300387.html,2026-07-10T03:52:08+00:00
Delhi-NCR,Jagran,Delhi-NCR • Jagran,https://www.jagran.com/delhi-ncr,48,"आरटीओ का अधिकारी बनकर गोशाला की गाड़ी रोकी, 24 हजार ऐंठे; विभाग बोला- उस दिन ड्यूटी ही नहीं लगाई थी",https://www.jagran.com/haryana/palwal-palwal-rto-impersonators-extort-24k-from-gaushala-vehicle-40300366.html,2026-07-10T03:52:08+00:00
Delhi-NCR,Jagran,Delhi-NCR • Jagran,https://www.jagran.com/delhi-ncr,49,"जातिसूचक शब्द कहने का विरोध करने पर परिवार पर लाठी-डंडों और सरियों से हमला, एससी एक्ट में मामला दर्ज",https://www.jagran.com/haryana/palwal-palwal-family-attacked-for-protesting-casteist-slurs-40299247.html,2026-07-10T03:52:08+00:00
Delhi-NCR,Jagran,Delhi-NCR • Jagran,https://www.jagran.com/delhi-ncr,50,"पलवल में ग्राहक सेवा केंद्र चोरी का खुलासा, आरोपी गिरफ्तार; 1.80 लाख रुपये बरामद",https://www.jagran.com/haryana/palwal-palwal-man-arrested-for-csc-theft-rupees-1lakh-80-thousand-cash-recovered-40299229.html,2026-07-10T03:52:08+00:00
Delhi-NCR,Jagran,Delhi-NCR • Jagran,https://www.jagran.com/delhi-ncr,51,"बिहार में 6 हजार मोबाइलों से भरे ट्रक की महालूट! पलवल से मास्टरमाइंड गिरफ्तार, फिल्मी है पूरी कहानी",https://www.jagran.com/haryana/palwal-ecommerce-truck-loot-mastermind-naim-arrested-by-palwal-stf-40299140.html,2026-07-10T03:52:08+00:00
Delhi-NCR,Jagran,Delhi-NCR • Jagran,https://www.jagran.com/delhi-ncr,52,"हाथरस: एक ही रात में 20 लोगों को सांप ने डसा, सभी जिला अस्पताल में भर्ती; पांच दिनों में तीन की मौत",https://www.jagran.com/uttar-pradesh/hathras-in-hathras-20-people-were-bitten-by-snakes-in-a-single-night-all-have-been-admitted-to-the-district-hospital-and-three-have-died-in-the-last-five-days-40301132.html,2026-07-10T03:52:08+00:00
Delhi-NCR,Jagran,Delhi-NCR • Jagran,https://www.jagran.com/delhi-ncr,53,"अयोध्या को आज सीएम योगी की सौगात, 432 करोड़ की विकास परियोजनाओं की करेंगे लोकार्पण शिलान्यास",https://www.jagran.com/uttar-pradesh/ayodhya-cm-yogi-inaugurates-and-lays-foundation-for-432-cr-ayodhya-projects-40301133.html,2026-07-10T03:52:08+00:00
Delhi-NCR,Jagran,Delhi-NCR • Jagran,https://www.jagran.com/delhi-ncr,54,"गोरखपुर में मानसून सक्रिय, आज से होगी झमाझम बारिश",https://www.jagran.com/uttar-pradesh/gorakhpur-city-gorakhpur-monsoon-heavy-rain-expected-from-friday-40301125.html,2026-07-10T03:52:08+00:00
Delhi-NCR,Jagran,Delhi-NCR • Jagran,https://www.jagran.com/delhi-ncr,55,"गोरखपुर में नौसढ़ चौराहे से वाराणसी हाईवे तक बनेगा 24 करोड़ से RCC नाला, जलभराव की समस्या होगी कम",https://www.jagran.com/uttar-pradesh/gorakhpur-city-gorakhpur-34-cr-roads-and-drainage-projects-begin-in-5-wards-40301099.html,2026-07-10T03:52:08+00:00
Delhi-NCR,Jagran,Delhi-NCR • Jagran,https://www.jagran.com/delhi-ncr,56,"गोरखपुर से चलने वाली छह समर स्पेशल ट्रेनें निरस्त, यात्रियों को होगी परेशानी",https://www.jagran.com/uttar-pradesh/gorakhpur-city-gorakhpur-6-summer-special-trains-cancelled-by-railways-40301122.html,2026-07-10T03:52:08+00:00
Delhi-NCR,Jagran,Delhi-NCR • Jagran,https://www.jagran.com/delhi-ncr,57,"ग्रेटर नोएडा श्रमिक हिंसा के मामले में 400 से अधिक पेज की चार्जशीट, 64 लोगों को बनाया आरोपित",https://www.jagran.com/uttar-pradesh/noida-greater-noida-64-accused-in-vipul-motors-labor-violence-case-40301119.html,2026-07-10T03:52:08+00:00
Delhi-NCR,Jagran,Delhi-NCR • Jagran,https://www.jagran.com/delhi-ncr,58,"गोरखपुर के कई इलाकों में आज 7 घंटे तक रहेगी बिजली कटौती, जानें अपने एरिया का शेड्यूल",https://www.jagran.com/uttar-pradesh/gorakhpur-city-gorakhpur-power-cut-july-10th-outage-in-multiple-areas-40301095.html,2026-07-10T03:52:08+00:00
Delhi-NCR,Jagran,Delhi-NCR • Jagran,https://www.jagran.com/delhi-ncr,59,'इस्लामिक रिपब्लिक ऑफ जापान' ने दागीं 111 मिसाइलें... NATO स,https://www.jagran.com/world/other-trump-nato-summit-gaffe-calls-iran-islamic-republic-of-japan-40301112.html,2026-07-10T03:52:08+00:00
Delhi-NCR,Jagran,Delhi-NCR • Jagran,https://www.jagran.com/delhi-ncr,60,"पलामू में डायन का आरोप लगा घर में घुसे ग्रामीण, पीड़ित परिवा",https://www.jagran.com/jharkhand/palamu-family-assaulted-over-witchcraft-accusation-fir-filed-40301114.html,2026-07-10T03:52:08+00:00
Delhi-NCR,Jagran,Delhi-NCR • Jagran,https://www.jagran.com/delhi-ncr,61,"छोटी सी गलती और वोटर लिस्ट से कट जाएगा आपका नाम, दिल्ली में",https://www.jagran.com/delhi/new-delhi-city-delhi-sir-process-blos-not-answering-calls-voters-face-issues-40301101.html,2026-07-10T03:52:08+00:00
Delhi-NCR,Jagran,Delhi-NCR • Jagran,https://www.jagran.com/delhi-ncr,62,बिहार की नई टोल नीति लागू: बिना टैक्स दिए भागे तो लगेगा दोगु,https://www.jagran.com/bihar/muzaffarpur-bihar-new-toll-tax-policy-double-fine-for-evasion-on-sh-and-bridges-40300583.html,2026-07-10T03:52:08+00:00
Delhi-NCR,Jagran,Delhi-NCR • Jagran,https://www.jagran.com/delhi-ncr,63,"Honda Amaze को है घर लाना, एक लाख रुपये की Down Payment के ब",https://www.jagran.com/automobile/car-buyer-guide-honda-amaze-base-variant-calculate-emi-payments-if-down-payment-one-lakh-rupees-40299864.html,2026-07-10T03:52:08+00:00
Delhi-NCR,Jagran,Delhi-NCR • Jagran,https://www.jagran.com/delhi-ncr,64,382 करोड़ की 3 परियोजनाओं ने पकड़ी रफ्तार; बेगूसराय में सफर,https://www.jagran.com/bihar/begusarai-begusarai-382-cr-urban-projects-gain-momentum-dprs-soon-40301109.html,2026-07-10T03:52:08+00:00
Delhi-NCR,Jagran,Delhi-NCR • Jagran,https://www.jagran.com/delhi-ncr,65,"दिल्ली से गुजरात तक बारिश से थमी जिंदगी, यूपी में 19 लोगों न",https://www.jagran.com/news/national-weather-news-updates-delhi-up-bihar-heavy-rain-imd-alert-for-17-states-today-40301032.html,2026-07-10T03:52:08+00:00
Delhi-NCR,Jagran,Delhi-NCR • Jagran,https://www.jagran.com/delhi-ncr,66,"उत्तराखंड: पहाड़ से मैदान तक भारी बारिश से हाहाकार, 10 जिलों",https://www.jagran.com/uttarakhand/dehradun-city-uttarakhand-rain-havoc-10-districts-close-schools-107-roads-shut-40301092.html,2026-07-10T03:52:08+00:00
Delhi-NCR,Jagran,Delhi-NCR • Jagran,https://www.jagran.com/delhi-ncr,67,"बंगाल की खाड़ी में ओडिशा और बंगाल के 15 मछुआरे लापता, 3 सगे",https://www.jagran.com/odisha/bhubaneshwar-15-fishermen-missing-in-bay-of-bengal-odisha-families-seek-cm-help-40301100.html,2026-07-10T03:52:08+00:00
Delhi-NCR,Jagran,Delhi-NCR • Jagran,https://www.jagran.com/delhi-ncr,68,"जम्मू-कश्मीर: उधमपुर में बेकाबू होकर गड्ढे में गिरी कार, अमर",https://www.jagran.com/jammu-and-kashmir/udhampur-amarnath-yatra-accident-five-pilgrims-injured-in-udhampur-car-crash-40301102.html,2026-07-10T03:52:08+00:00
Delhi-NCR,Jagran,Delhi-NCR • Jagran,https://www.jagran.com/delhi-ncr,69,"Dharmendra ने निधन से पहले जाहिर की थी अपनी आखिरी इच्छा, हेमा मालिनी ने 8 महीने बाद किया खुलासा",https://www.jagran.com/entertainment/bollywood-hema-malini-recalls-dharmendras-last-wish-he-wanted-to-see-the-family-united-sunny-deol-bobby-deol-40297979.html,2026-07-10T03:52:08+00:00
Delhi-NCR,Jagran,Delhi-NCR • Jagran,https://www.jagran.com/delhi-ncr,70,होर्मुज में भारी तनाव: अमेरिका ने ईरान के 80 ठिकानों पर किए ताबड़तोड़ हमले; तेल बाजार में मचा हड़कंप,https://www.jagran.com/world/america-tension-in-hormuz-us-launches-massive-attacks-on-iran-40298592.html,2026-07-10T03:52:08+00:00
Delhi-NCR,Jagran,Delhi-NCR • Jagran,https://www.jagran.com/delhi-ncr,71,"TATA की इस कंपनी के खिलाफ विदेश में शुरू हुई आपराधिक कार्यवाही, जमशेदजी ने आजादी से 40 साल पहले की थी शुरुआत",https://www.jagran.com/business/share-market-tata-steel-netherlands-faces-criminal-charges-over-pollution-40299825.html,2026-07-10T03:52:08+00:00
Delhi-NCR,Jagran,Delhi-NCR • Jagran,https://www.jagran.com/delhi-ncr,72,"आइआइटी बीएचयू छात्रा से सामूहिक दुष्कर्म के मामले में विवेचक से बचाव पक्ष की जिरह पूरी, अगली सुनवाई 13 जुलाई को",https://www.jagran.com/uttar-pradesh/varanasi-city-cross-examination-of-the-investigating-officer-by-the-defense-in-the-iit-bhu-gang-misdeed-case-has-concluded-the-next-hearing-is-scheduled-for-13-july-40300539.html,2026-07-10T03:52:08+00:00
Delhi-NCR,Jagran,Delhi-NCR • Jagran,https://www.jagran.com/delhi-ncr,73,Did You Know,https://www.jagran.com/did-you-know-news-hindi.html,2026-07-10T03:52:08+00:00
Delhi-NCR,Jagran,Delhi-NCR • Jagran,https://www.jagran.com/delhi-ncr,74,फुटबॉल विश्व कप,https://www.jagran.com/topics/fifa-world-cup-2026,2026-07-10T03:52:08+00:00
Delhi-NCR,Jagran,Delhi-NCR • Jagran,https://www.jagran.com/delhi-ncr,75,ए आई बूटकैंप,https://www.jagran.com/events/jagran-next/ai-bootcamp/index.html,2026-07-10T03:52:08+00:00
Delhi-NCR,Jagran,Delhi-NCR • Jagran,https://www.jagran.com/delhi-ncr,76,मिडिल ईस्ट संकट,https://www.jagran.com/topics/Israel-Iran-Conflict,2026-07-10T03:52:08+00:00
Delhi-NCR,Jagran,Delhi-NCR • Jagran,https://www.jagran.com/delhi-ncr,77,फीफा वर्ल्ड कप 2026,https://www.jagran.com/topics/FIFA-World-Cup-2026,2026-07-10T03:52:08+00:00
Delhi-NCR,Jagran,Delhi-NCR • Jagran,https://www.jagran.com/delhi-ncr,78,आज का राशिफल,https://www.jagran.com/topics/rashifal,2026-07-10T03:52:08+00:00
Delhi-NCR,Jagran,Delhi-NCR • Jagran,https://www.jagran.com/delhi-ncr,79,Submit your news,https://www.jagran.com/citizen-journalism-hindi.html,2026-07-10T03:52:08+00:00
Delhi-NCR,Jagran,Delhi-NCR • Jagran,https://www.jagran.com/delhi-ncr,80,Message from the Editor,https://www.jagran.com/policies-and-standards.html,2026-07-10T03:52:08+00:00
Hyderabad,DC,Hyderabad • DC,https://www.deccanchronicle.com/location/india/southern-states,1,FIFA World Cup 2026,https://www.deccanchronicle.com/fifa-world-cup-2026,2026-07-10T03:52:08+00:00
Hyderabad,DC,Hyderabad • DC,https://www.deccanchronicle.com/location/india/southern-states,2,Opinion and Editorials,https://www.deccanchronicle.com/opinion,2026-07-10T03:52:08+00:00
Hyderabad,DC,Hyderabad • DC,https://www.deccanchronicle.com/location/india/southern-states,3,Assembly Elections 2026,https://www.deccanchronicle.com/assembly-elections-2026,2026-07-10T03:52:08+00:00
Hyderabad,DC,Hyderabad • DC,https://www.deccanchronicle.com/location/india/southern-states,4,Telangana Rising 2047,https://www.deccanchronicle.com/tags/Telangana-Rising-2047,2026-07-10T03:52:08+00:00
Chennai,DC,Chennai • DC,https://www.deccanchronicle.com/location/india/tamil-nadu/chennai-madras,1,FIFA World Cup 2026,https://www.deccanchronicle.com/fifa-world-cup-2026,2026-07-10T03:52:08+00:00
Chennai,DC,Chennai • DC,https://www.deccanchronicle.com/location/india/tamil-nadu/chennai-madras,2,Opinion and Editorials,https://www.deccanchronicle.com/opinion,2026-07-10T03:52:08+00:00
Chennai,DC,Chennai • DC,https://www.deccanchronicle.com/location/india/tamil-nadu/chennai-madras,3,Assembly Elections 2026,https://www.deccanchronicle.com/assembly-elections-2026,2026-07-10T03:52:08+00:00
Chennai,DC,Chennai • DC,https://www.deccanchronicle.com/location/india/tamil-nadu/chennai-madras,4,Telangana Rising 2047,https://www.deccanchronicle.com/tags/Telangana-Rising-2047,2026-07-10T03:52:08+00:00
Chennai,The Hindu,Chennai • The Hindu,https://www.thehindu.com/news/cities/chennai/,1,Jana Nayagan gets ‘A’ certificate; likely to release in theatres on July 24,https://www.thehindu.com/entertainment/jana-nayagan-gets-a-certificate-likely-to-release-in-theatres-on-july-24/article71203461.ece,2026-07-10T03:52:08+00:00
Chennai,The Hindu,Chennai • The Hindu,https://www.thehindu.com/news/cities/chennai/,2,"How I became Mano: The singer on Ilaiyaraaja, SPB and 40 years in music",https://www.thehindu.com/entertainment/music/how-i-became-mano-the-singer-on-ilaiyaraaja-spb-and-40-years-in-music/article71202150.ece,2026-07-10T03:52:08+00:00
Chennai,The Hindu,Chennai • The Hindu,https://www.thehindu.com/news/cities/chennai/,3,Australia to return three antiquities stolen from Tamil Nadu temples,https://www.thehindu.com/news/cities/chennai/australia-to-return-three-antiquities-stolen-from-tamil-nadu-temples/article71202173.ece,2026-07-10T03:52:08+00:00
Chennai,The Hindu,Chennai • The Hindu,https://www.thehindu.com/news/cities/chennai/,4,Gone girls | Death of 14 Juang girls from Odisha in Tiruvallur ammonia gas leak exposes tribe’s socio-economic struggle,https://www.thehindu.com/news/national/gone-girls/article71203970.ece,2026-07-10T03:52:08+00:00
Chennai,The Hindu,Chennai • The Hindu,https://www.thehindu.com/news/cities/chennai/,5,"Sudha Kongara suppressed receipt of ₹4.12 crore from 2D Entertainment for Parasakthi, Dawn Pictures tells Madras HC",https://www.thehindu.com/news/national/tamil-nadu/sudha-kongara-suppressed-receipt-of-412-crore-from-2d-entertainment-for-parasakthi-dawn-pictures-tells-madras-hc/article71201630.ece,2026-07-10T03:52:08+00:00
Chennai,The Hindu,Chennai • The Hindu,https://www.thehindu.com/news/cities/chennai/,6,Tamil Nadu continues to record high gross enrolment ratio of 92% at primary level,https://www.thehindu.com/news/cities/chennai/tamil-nadu-continues-to-record-high-gross-enrolment-ratio-of-92-at-primary-level/article71203091.ece,2026-07-10T03:52:08+00:00
Chennai,The Hindu,Chennai • The Hindu,https://www.thehindu.com/news/cities/chennai/,7,"Panel to be formed soon to examine liquor retail models in other States, says the Minister for Prohibition and Excise",https://www.thehindu.com/news/national/tamil-nadu/panel-to-be-formed-soon-to-examine-liquor-retail-models-in-other-states-says-the-minister-for-prohibition-and-excise/article71203583.ece,2026-07-10T03:52:08+00:00
Chennai,The Hindu,Chennai • The Hindu,https://www.thehindu.com/news/cities/chennai/,8,"Chennai’s residential market remained stable during first half of 2026, says report",https://www.thehindu.com/news/national/tamil-nadu/chennais-residential-market-stable-during-first-half-of-2026-says-report/article71203084.ece,2026-07-10T03:52:08+00:00
Chennai,The Hindu,Chennai • The Hindu,https://www.thehindu.com/news/cities/chennai/,9,Chennai reading communities and book clubs are helping readers rekindle a lost habit,https://www.thehindu.com/books/chennai-reading-communities-and-book-clubs-are-helping-readers-rekindle-a-lost-habit/article71075992.ece,2026-07-10T03:52:08+00:00
Chennai,The Hindu,Chennai • The Hindu,https://www.thehindu.com/news/cities/chennai/,10,"Chennai’s The Pole Camp takes the stage with Becoming, a thematic showcase",https://www.thehindu.com/life-and-style/fitness/chennais-the-pole-camp-takes-the-stage-with-becoming-a-thematic-showcase/article71193437.ece,2026-07-10T03:52:08+00:00
