city,publisher,source,source_url,rank,headline,link,collected_at_iso
Bengaluru,DC,Bengaluru • DC,https://www.deccanchronicle.com/location/india/karnataka/bengaluru,1,Opinion and Editorials,https://www.deccanchronicle.com/opinion,2026-06-03T21:21:56+00:00
Bengaluru,DC,Bengaluru • DC,https://www.deccanchronicle.com/location/india/karnataka/bengaluru,2,Assembly Elections 2026,https://www.deccanchronicle.com/assembly-elections-2026,2026-06-03T21:21:56+00:00
Bengaluru,DC,Bengaluru • DC,https://www.deccanchronicle.com/location/india/karnataka/bengaluru,3,Telangana Rising 2047,https://www.deccanchronicle.com/tags/Telangana-Rising-2047,2026-06-03T21:21:56+00:00
Mumbai,Mumbai Mirror,Mumbai • Mumbai Mirror,https://mumbaimirror.indiatimes.com/mumbai,1,Collapsing chowk wall poses serious accident risk,https://mumbaimirror.indiatimes.com/mumbai/collapsing-chowk-wall-poses-serious-accident-risk/articleshow/131468722.html,2026-06-03T21:21:56+00:00
Mumbai,Mumbai Mirror,Mumbai • Mumbai Mirror,https://mumbaimirror.indiatimes.com/mumbai,2,"UBT’s Nashik no-show gives ruling alliance a walkover, sparks buzz",https://mumbaimirror.indiatimes.com/mumbai/ubts-nashik-no-show-gives-ruling-alliance-a-walkover-sparks-buzz/articleshow/131469518.html,2026-06-03T21:21:56+00:00
Mumbai,Mumbai Mirror,Mumbai • Mumbai Mirror,https://mumbaimirror.indiatimes.com/mumbai,3,Govt to reopen Ladki Bahin eKYC?,https://mumbaimirror.indiatimes.com/mumbai/cover-story/govt-to-reopen-ladki-bahin-ekyc/articleshow/131469794.html,2026-06-03T21:21:56+00:00
Mumbai,Mumbai Mirror,Mumbai • Mumbai Mirror,https://mumbaimirror.indiatimes.com/mumbai,4,Many bid but few survive in BMC’s `168-cr tender race,https://mumbaimirror.indiatimes.com/mumbai/many-bid-but-few-survive-in-bmcs-168-cr-tender-race/articleshow/131469802.html,2026-06-03T21:21:56+00:00
Mumbai,Mumbai Mirror,Mumbai • Mumbai Mirror,https://mumbaimirror.indiatimes.com/mumbai,5,Fitness is about consistency,https://mumbaimirror.indiatimes.com/you/fitness-is-about-consistency/articleshow/131467284.html,2026-06-03T21:21:56+00:00
Mumbai,Mumbai Mirror,Mumbai • Mumbai Mirror,https://mumbaimirror.indiatimes.com/mumbai,6,AI chatbots have a pompous language problem,https://mumbaimirror.indiatimes.com/opinion/ai-chatbots-have-a-pompous-language-problem/articleshow/131466733.html,2026-06-03T21:21:56+00:00
Mumbai,Mumbai Mirror,Mumbai • Mumbai Mirror,https://mumbaimirror.indiatimes.com/mumbai,7,Redvpt is raising old home prices,https://mumbaimirror.indiatimes.com/opinion/redvpt-is-raising-old-home-prices/articleshow/131466749.html,2026-06-03T21:21:56+00:00
Mumbai,Mumbai Mirror,Mumbai • Mumbai Mirror,https://mumbaimirror.indiatimes.com/mumbai,8,Ask The Sexpert,https://mumbaimirror.indiatimes.com/ask-the-sexpert,2026-06-03T21:21:56+00:00
Mumbai,Sakal,Mumbai • Sakal,https://www.esakal.com/pune,1,सकाळ लाईव्ह TV,https://www.esakal.com/live-tv,2026-06-03T21:21:56+00:00
Mumbai,Sakal,Mumbai • Sakal,https://www.esakal.com/pune,2,Refund and Cancellation,https://www.esakal.com/refund-and-cancellation,2026-06-03T21:21:56+00:00
Mumbai,Lokmat,Mumbai • Lokmat,https://www.lokmat.com/city/,1,Live News in Marathi,https://www.lokmat.com/live-news/,2026-06-03T21:21:56+00:00
Mumbai,Lokmat,Mumbai • Lokmat,https://www.lokmat.com/city/,2,"नोकरीचे आमिष दाखवून लाखो रुपयांची फसवणूक, थिंकटेक कंपनीच्या सीईओला नाशिक येथून अटक!",https://www.lokmat.com/pune/ceo-of-thinktech-company-arrested-from-nashik-for-cheating-of-lakhs-of-rupees-on-the-pretext-of-job-a-a1012/,2026-06-03T21:21:56+00:00
Mumbai,Lokmat,Mumbai • Lokmat,https://www.lokmat.com/city/,3,पुणे महापालिका आरोग्य विभागात बायोमेट्रिक हजेरीला ठेंगा,https://www.lokmat.com/pune/pune-municipal-corporation-health-department-suspends-biometric-attendance-a-a1008/,2026-06-03T21:21:56+00:00
Mumbai,Lokmat,Mumbai • Lokmat,https://www.lokmat.com/city/,4,"धोलवड परिसरात वादळी वाऱ्याचा तडाखा, मुढेवाडीत शेती, केळी पिकाचे प्रचंड नुकसान",https://www.lokmat.com/pune/pune-news-storm-hits-dholwad-area-huge-damage-to-agriculture-banana-crop-in-mudhewadi-farmers-in-crisis-a-a1008/,2026-06-03T21:21:56+00:00
Mumbai,Lokmat,Mumbai • Lokmat,https://www.lokmat.com/city/,5,किल्ले रायगडावर दोन दिवसीय शिवराज्यभिषेक सोहळा रंगणार,https://www.lokmat.com/pune/pune-two-day-shivarajyabhishek-ceremony-to-be-held-at-raigad-fort-a-a1008/,2026-06-03T21:21:56+00:00
Mumbai,Lokmat,Mumbai • Lokmat,https://www.lokmat.com/city/,6,LIVE: तृणमूल काँग्रेसला दुहेरी धक्का! पक्षात फूट अन् अभिषेक बॅनर्जींच्या घरी ईडीची धाड,https://www.lokmat.com/maharashtra/maharashtra-marathi-news-3-june-2026-us-israel-iran-tensions-donald-trump-benjamin-netanyahu-pm-narendra-modi-monsoon-updates-neet-exam-paper-leak-cockroach-janata-party-maharashtra-vidhan-parishad-election-cm-devendra-fadnavis-eknath-shinde-a-a573/,2026-06-03T21:21:56+00:00
Mumbai,Lokmat,Mumbai • Lokmat,https://www.lokmat.com/city/,7,"मुंबईचे माजी महापौर हरेश्वर पाटील यांचे निधन, राजकीय व सामाजिक क्षेत्रात शोककळा",https://www.lokmat.com/mumbai/former-mumbai-mayor-hareshwar-patil-passes-away-mourning-in-political-and-social-circles-a-a840-c301/,2026-06-03T21:21:56+00:00
Mumbai,Lokmat,Mumbai • Lokmat,https://www.lokmat.com/city/,8,"मुंबई बुडत नाही, सारखे सखल भाग दाखवून बुडाल्याचं दाखवलं जातं; आयुक्त अश्विनी भिडे थेट बोलल्या",https://www.lokmat.com/mumbai/bmc-commissioner-ashwini-bhide-clarifies-mumbai-monsoon-situation-amid-opposition-allegations-a-a1001/,2026-06-03T21:21:56+00:00
Mumbai,Lokmat,Mumbai • Lokmat,https://www.lokmat.com/city/,9,"गृह खात्याचा अधिकारी ‘सायबर’ चोरांच्या जाळ्यात, क्रेडिट कार्ड ऑफरच्या आमिषाने लाखोंची फसवणूक; गुन्हा दाखल",https://www.lokmat.com/mumbai/home-department-official-falls-into-the-trap-of-cyber-thieves-cheated-of-lakhs-with-the-lure-of-credit-card-offer-case-registered-a-a1013/,2026-06-03T21:21:56+00:00
Mumbai,Lokmat,Mumbai • Lokmat,https://www.lokmat.com/city/,10,"आरे कॉलनीतील बेकायदा प्रार्थनास्थळावर बुलडोझर; पोलिस पथकासह एसआरपीएफ, रॅपिड ॲक्शन फोर्सचा कारवाईत सहभाग",https://www.lokmat.com/mumbai/bulldozer-at-illegal-place-of-worship-in-aarey-colony-srpf-rapid-action-force-along-with-police-team-participate-in-the-operation-a-a1013/,2026-06-03T21:21:56+00:00
Mumbai,Lokmat,Mumbai • Lokmat,https://www.lokmat.com/city/,11,एक वर्षाच्या लेकीला मागे ठेवून बनली आयटीबीपी अधिकारी; डॉ. युगंधराने घडवला कर्तृत्वाचा नवा इतिहास,https://www.lokmat.com/nagpur/leaving-behind-her-one-year-old-daughter-she-became-an-itbp-officer-dr-yugandhara-created-a-new-history-of-achievement-a-a1000/,2026-06-03T21:21:56+00:00
Mumbai,Lokmat,Mumbai • Lokmat,https://www.lokmat.com/city/,12,उकाड्याने हैराण विदर्भाला दिलासा? 'या' जिल्ह्यांमध्ये विजांच्या कडकडाटासह पावसाची शक्यता,https://www.lokmat.com/nagpur/relief-for-vidarbha-hit-by-heatwave-chance-of-rain-with-thunder-in-these-districts-a-a957-c1000/,2026-06-03T21:21:56+00:00
Mumbai,Lokmat,Mumbai • Lokmat,https://www.lokmat.com/city/,13,नागपूर कृषी उत्पन्न बाजार समितीच्या संत्रा प्रक्रिया प्रकल्पाला शासनाची मंजुरी,https://www.lokmat.com/nagpur/government-approves-nagpur-agricultural-produce-market-committees-orange-processing-project-a-a876-c1000/,2026-06-03T21:21:56+00:00
Mumbai,Lokmat,Mumbai • Lokmat,https://www.lokmat.com/city/,14,"नागपूर-मुंबई विमानसेवा कपातीवर गडकरी आक्रमक; टाटा समूहाला पत्र, उड्डाणे पूर्ववत करण्याची मागणी",https://www.lokmat.com/nagpur/gadkari-aggressive-on-nagpur-mumbai-flight-cuts-letter-to-tata-group-demand-to-restore-flights-a-a1000/,2026-06-03T21:21:56+00:00
Mumbai,Lokmat,Mumbai • Lokmat,https://www.lokmat.com/city/,15,"दिव्यांग निधी खर्चाची चौकशी, तीन दिवसात अहवाल सादर करा; जिल्हाधिकारी कुमार आशीवार्द यांचे आदेश",https://www.lokmat.com/nagpur/inquiry-into-expenditure-on-disabled-fund-submit-report-within-three-days-district-collector-kumar-ashiward-orders-a-a876-c1000/,2026-06-03T21:21:56+00:00
Mumbai,Lokmat,Mumbai • Lokmat,https://www.lokmat.com/city/,16,"अशोक खरातची पुन्हा नाशिकरोड जेलमध्ये रवानगी; सिन्नर पोलिसांची कोठडी संपली, आता सरकारवाडा पोलीस घेणार ताबा!",https://www.lokmat.com/nashik/ashok-kharat-sent-back-to-nashik-road-jail-sinnar-police-custody-ends-now-sarkarwada-police-will-take-over-a-a1013/,2026-06-03T21:21:56+00:00
Mumbai,Lokmat,Mumbai • Lokmat,https://www.lokmat.com/city/,17,वास्तव्य बदलवत अनेक भाविकांना गंडा; भोंदू कमलेशकडून राज्यभर फसवणूक,https://www.lokmat.com/nashik/many-devotees-cheated-by-changing-their-residence-impostor-kamlesh-cheated-the-entire-state-a-a1013/,2026-06-03T21:21:56+00:00
Mumbai,Lokmat,Mumbai • Lokmat,https://www.lokmat.com/city/,18,"Nashik Hit And Run: थरकाप उडवणारा व्हिडीओ; मुंबईवरून निघालेल्या कारने महिलेला उडवले, हवेत उडून खाली पडली अन् जीव गेला",https://www.lokmat.com/nashik/nashik-hit-and-run-shocking-video-a-car-leaving-from-mumbai-hit-a-woman-she-fell-into-the-air-and-died-a-a571/,2026-06-03T21:21:56+00:00
Mumbai,Lokmat,Mumbai • Lokmat,https://www.lokmat.com/city/,19,धरणात बुडून पती-पत्नीसह शेजारच्या दोन मुलांचा मृत्यू; २ वर्षांची चिमुकली पाण्यात जाणार तितक्यात...,https://www.lokmat.com/nashik/tragedy-at-nashik-dam-4-drown-toddler-saved-as-brave-woman-rushes-to-her-rescue-a-a1001/,2026-06-03T21:21:56+00:00
Mumbai,Lokmat,Mumbai • Lokmat,https://www.lokmat.com/city/,20,"कोल्हापुरातील तावडे हॉटेल येथे पुलावरुन कार कोसळली; एक ठार, तिघे जखमी",https://www.lokmat.com/kolhapur/car-falls-off-bridge-at-shiroli-zakat-naka-in-kolhapur-one-killed-three-injured-a-a746/,2026-06-03T21:21:56+00:00
Mumbai,Lokmat,Mumbai • Lokmat,https://www.lokmat.com/city/,21,"विरोधी टोळीसोबत फिरत असल्याचा राग; कोल्हापुरात तरुणांच्या टोळक्याने एडके, तलवारी नाचवत केली २५ वाहनांची तोडफोड",https://www.lokmat.com/kolhapur/angry-at-being-associated-with-an-opposing-gang-a-gang-of-youths-vandalized-25-vehicles-in-kolhapur-brandishing-swords-a-a746/,2026-06-03T21:21:56+00:00
Mumbai,Lokmat,Mumbai • Lokmat,https://www.lokmat.com/city/,22,"..तर वेगळा विचार करावा लागेल, सतेज पाटील काही लांबचे नाहीत; शिवाजीराव पाटील यांचा इशारा",https://www.lokmat.com/kolhapur/if-gokul-dudh-sangh-does-not-get-a-respectable-seat-in-the-elections-different-thoughts-satej-patil-is-not-far-away-mla-shivajirao-patil-gave-a-warning-a-a746/,2026-06-03T21:21:56+00:00
Mumbai,Lokmat,Mumbai • Lokmat,https://www.lokmat.com/city/,23,"Rain in Kolhapur: जयसिंगपूर, शिरोळला पावसाचा तडाखा; झाडे उन्मळून पडली, घरांवरील पत्रे उडाले",https://www.lokmat.com/kolhapur/rain-lashed-jaysingpur-shirol-trees-fell-roofs-on-houses-were-blown-off-a-a746/,2026-06-03T21:21:56+00:00
Mumbai,Lokmat,Mumbai • Lokmat,https://www.lokmat.com/city/,24,Karjmafi: ‘लाडक्या बहीण’ योजनेसारखा कर्जमाफीचा खेळ मांडू नका : राजू शेट्टी -video,https://www.lokmat.com/kolhapur/attempt-to-keep-farmers-in-suspense-once-again-by-giving-technical-reasons-for-loan-waivers-related-to-code-of-conduct-says-raju-shetty-a-a746/,2026-06-03T21:21:56+00:00
Mumbai,Lokmat,Mumbai • Lokmat,https://www.lokmat.com/city/,25,"साखर कारखानदारीत घराणेशाहीचे धुराडे अन् गव्हाणीत संघर्षाचा विस्तव, संस्था बंद पाडण्याच्या खेळ्या",https://www.lokmat.com/sangli/many-cooperative-factories-in-sangli-district-are-in-trouble-due-to-the-excesses-of-nepotism-a-a447-c746/,2026-06-03T21:21:56+00:00
Mumbai,Lokmat,Mumbai • Lokmat,https://www.lokmat.com/city/,26,"सहा महिने मानधन नाही; सांगलीत पाणीपुरवठा, स्वच्छतामधील कंत्राटी कर्मचाऱ्यांचे काम बंद आंदोलन",https://www.lokmat.com/sangli/no-honorarium-for-six-months-contract-workers-in-water-supply-and-sanitation-strike-in-sangli-a-a746/,2026-06-03T21:21:56+00:00
Mumbai,Lokmat,Mumbai • Lokmat,https://www.lokmat.com/city/,27,"Sangli Crime: मिरजेत टोळीयुद्धातून भरदिवसा तरुणावर प्राणघातक हल्ला, गंभीर जखमी",https://www.lokmat.com/sangli/a-youth-was-fatally-attacked-in-a-gang-war-in-the-takli-road-area-of-miraj-a-a746/,2026-06-03T21:21:56+00:00
Mumbai,Lokmat,Mumbai • Lokmat,https://www.lokmat.com/city/,28,"तानाजी पाटील यांच्या भूमिकेवर महाआघाडीचे गणित, क्रॉस व्होटिंगचा महायुतीला धोका",https://www.lokmat.com/maharashtra/the-future-of-the-mahavikas-aghadi-in-the-sangli-satara-vidhan-parishad-election-depends-on-the-role-of-shinde-sena-leader-tanaji-patil-a-a468-c746/,2026-06-03T21:21:56+00:00
Mumbai,Lokmat,Mumbai • Lokmat,https://www.lokmat.com/city/,29,"आमच्या विरोधात पोस्ट का करतोस, भाजप पदाधिकाऱ्याला जातिवाचक शिवीगाळ; विट्यात सचिन मोटेसह दोघांवर ॲट्रॉसिटीचा गुन्हा दाखल",https://www.lokmat.com/sangli/casteist-abuse-against-bjp-office-bearer-atrocity-case-registered-against-sachin-mote-and-two-others-in-vita-sangli-district-a-a746/,2026-06-03T21:21:56+00:00
Mumbai,Lokmat,Mumbai • Lokmat,https://www.lokmat.com/city/,30,'भाईचा बड्डे' झाला; पण अवघ्या सातारा जिल्हा परिषदेला कामाला लावून गेला!,https://www.lokmat.com/satara/political-circles-are-in-a-state-of-uproar-after-a-birthday-cake-was-cut-in-the-cabin-of-the-social-welfare-chairman-of-satara-zilla-parishad-in-the-presence-of-an-exiled-gangster-a-a746/,2026-06-03T21:21:56+00:00
Mumbai,Lokmat,Mumbai • Lokmat,https://www.lokmat.com/city/,31,"Vidhan Parishad Election: नाराज शेखर गोरे ९ जूनला भूमिका ठरविणार!, कार्यकर्त्यांशी संवाद साधण्यासाठी बोलावली बैठक",https://www.lokmat.com/satara/shekhar-gore-who-is-upset-over-not-getting-nomination-from-bjp-from-satara-sangli-vidhan-parishad-election-will-decide-his-stand-on-june-9-a-a746/,2026-06-03T21:21:56+00:00
Mumbai,Lokmat,Mumbai • Lokmat,https://www.lokmat.com/city/,32,"ladki bahin yojana: लाडक्या बहिणींच्या खात्यात ‘सायबर फ्रॉड’चा हप्ता, साताऱ्यात धक्कादायक प्रकार उघडकीस",https://www.lokmat.com/satara/cyber-fraud-hit-beloved-sisters-accounts-shocking-incident-revealed-in-satara-a-a746/,2026-06-03T21:21:56+00:00
Mumbai,Lokmat,Mumbai • Lokmat,https://www.lokmat.com/city/,33,Satara News: मलकापुरात दर बुधवार ‘नो व्हेहिकल डे’; पंतप्रधानांच्या इंधन बचतीच्या आवाहनाला प्रतिसाद,https://www.lokmat.com/satara/in-response-to-the-prime-minister-call-for-fuel-conservation-malkapur-municipality-has-announced-a-resolution-of-no-vehicle-day-every-wednesday-a-a746/,2026-06-03T21:21:56+00:00
Mumbai,Lokmat,Mumbai • Lokmat,https://www.lokmat.com/city/,34,"शेजाऱ्यानेच धमकी देत महिलेवर केला अनेकवेळा बलात्कार, गर्भपाताच्या गोळ्या घेतल्याने....",https://www.lokmat.com/akola/woman-raped-multiple-times-by-neighbor-after-threatening-her-after-taking-abortion-pills-a-a571/,2026-06-03T21:21:56+00:00
Mumbai,Lokmat,Mumbai • Lokmat,https://www.lokmat.com/city/,35,"देशप्रेम काय असते...! कारगिल युद्धावेळी १ लाख रुपये दिलेले, त्याच पाध्ये कुटुंबाकडून भारतीय लष्कराला एक कोटीचा निधी",https://www.lokmat.com/maharashtra/padhye-family-donates-rs-1-crore-to-indian-army-an-inspiring-example-of-social-commitment-a-a607/,2026-06-03T21:21:56+00:00
Mumbai,Lokmat,Mumbai • Lokmat,https://www.lokmat.com/city/,36,"दुचाकीच्या धडकेनंतर लक्झरी बसने घेतला पेट, बाळापूर शेगाव मार्गावरील घटना",https://www.lokmat.com/akola/luxury-bus-catches-fire-after-hitting-a-bike-incident-on-balapur-shegaon-road-a-a653/,2026-06-03T21:21:56+00:00
Mumbai,Lokmat,Mumbai • Lokmat,https://www.lokmat.com/city/,37,"भरदिवसा सप्तश्रृंगी ज्वेलर्समध्ये सशस्त्र दरोडा, बंदूक-कोयत्याच्या धाकावर ४०० ग्रॅम सोन्यासह २० लाखांचा ऐवज लंपास!",https://www.lokmat.com/crime/armed-robbery-at-saptashrungi-jewelers-in-broad-daylight-400-grams-of-gold-and-20-lakhs-worth-of-goods-stolen-at-gunpoint-a-a653/,2026-06-03T21:21:56+00:00
Mumbai,Lokmat,Mumbai • Lokmat,https://www.lokmat.com/city/,38,आई-वडील कामावर जाताच शेजाऱ्याचे राक्षसी कृत्य; चिमुकलीवर ६० वर्षाच्या व्यक्तींकडून अत्याचार,https://www.lokmat.com/akola/akola-crime-monstrous-act-as-parents-go-to-work-child-repeatedly-tortured-by-60-year-old-man-living-next-door-a-a571/,2026-06-03T21:21:56+00:00
Mumbai,Lokmat,Mumbai • Lokmat,https://www.lokmat.com/city/,39,"पत्नीचे अनैतिक संबंध, पत्नीसाठी व्हिडीओ बनवला, खूप रडून घेतला टोकाचा निर्णय; सोलापुरातील घटना",https://www.lokmat.com/solapur/solapur-crime-news-wifes-immoral-relationship-made-a-video-for-his-wife-took-an-extreme-decision-after-crying-a-lot-a-a941/,2026-06-03T21:21:56+00:00
Mumbai,Lokmat,Mumbai • Lokmat,https://www.lokmat.com/city/,40,"क्रिकेट शिकायला गेला अन् जीव गमावला; बार्शीत १५ वर्षांच्या मुलाचा रोलरखाली चिरडून अंत, प्रशिक्षक उभे होते लांब",https://www.lokmat.com/solapur/tragedy-at-cricket-camp-15-year-old-trainee-dies-after-heavy-pitch-roller-runs-over-him-in-barshi-a-a1001/,2026-06-03T21:21:56+00:00
Mumbai,Lokmat,Mumbai • Lokmat,https://www.lokmat.com/city/,41,"'हा धंदा सोपा नाय'! रीलमध्ये हसणारी रोहिणी वास्तवात मात्र तुटत होती, अवघ्या ७ दिवसांत तिने...",https://www.lokmat.com/solapur/this-business-is-not-easy-rohini-paradhye-who-was-smiling-in-the-reel-was-actually-breaking-down-a-a629/,2026-06-03T21:21:56+00:00
Mumbai,Lokmat,Mumbai • Lokmat,https://www.lokmat.com/city/,42,"समृध्दी महामार्गावर प्रवाशांना लुटणारी आंतरजिल्हा टोळी जेरबंद, लाखोंचा मुद्देमाल जप्त",https://www.lokmat.com/ahilyanagar/inter-district-gang-robbing-passengers-on-samriddhi-highway-arrested-ahilyanagar-local-crime-branch-takes-action-a-a328-c301/,2026-06-03T21:21:56+00:00
Mumbai,Lokmat,Mumbai • Lokmat,https://www.lokmat.com/city/,43,"शरद पवारांची साथ सोडली, भाजपामध्ये करणार प्रवेश; तनपुरे म्हणाले, ""मामांना भेटण्याचे धाडस नाही""",https://www.lokmat.com/mumbai/prajakt-tanpure-meets-supriya-sule-leaves-sharad-pawar-will-join-bjp-tanpure-said-i-dont-have-the-courage-to-meet-my-uncle-a-a571/,2026-06-03T21:21:56+00:00
Mumbai,Lokmat,Mumbai • Lokmat,https://www.lokmat.com/city/,44,"साठवण तलावात बुडून एमबीएच्या तीन विद्यार्थ्यांचा मृत्यू, अहिल्यानगर जिल्ह्यातील घटना",https://www.lokmat.com/maharashtra/three-mba-students-die-after-drowning-in-a-storage-pond-incident-in-chandrapur-near-loni-a-a756-c301/,2026-06-03T21:21:56+00:00
Mumbai,Lokmat,Mumbai • Lokmat,https://www.lokmat.com/city/,45,छत्रपती संभाजीनगर :,https://www.lokmat.com/chhatrapati-sambhajinagar/,2026-06-03T21:21:56+00:00
Mumbai,Lokmat,Mumbai • Lokmat,https://www.lokmat.com/city/,46,छ. संभाजीनगर-पुणे मार्गावर ३९ किलोमीटरच्या रस्त्यात फक्त खड्डे; रोज २० हजार वाहनांची कसरत!,https://www.lokmat.com/chhatrapati-sambhajinagar/toll-for-potholes-daily-20000-vehicles-suffer-on-chhatrapati-sambhajinagar-ahilyanagar-pune-route-greenfield-highway-delayed-a-a320/,2026-06-03T21:21:56+00:00
Mumbai,Lokmat,Mumbai • Lokmat,https://www.lokmat.com/city/,47,पुण्याची 'कोयता गँग' अहिल्यानगरमध्ये गजाआड; दरोड्याचा थरारक डाव पोलिसांनी उलटवला!,https://www.lokmat.com/ahilyanagar/punes-koyata-gang-in-trouble-in-ahilyanagar-police-foil-thrilling-robbery-plot-a-a1013/,2026-06-03T21:21:56+00:00
Mumbai,Lokmat,Mumbai • Lokmat,https://www.lokmat.com/city/,48,८० दिवसांनी सांगाडा बाहेर काढताच आई-बहिणीचा टाहो; जळगावातील 'त्या' चिमुरड्याच्या मृत्यूचा तपास सुरू,https://www.lokmat.com/jalgaon/jalgaon-crime-body-of-12-year-old-exhumed-after-80-days-as-cricket-death-takes-suspicious-turn-a-a1001/,2026-06-03T21:21:56+00:00
