city,publisher,source,source_url,rank,headline,link,collected_at_iso
Lucknow,IE,Lucknow • IE,https://indianexpress.com/section/cities/lucknow/,81,"Facing heat over Baruipur rape-murder, why Suvendu Adhikari government treads with caution",https://indianexpress.com/article/political-pulse/west-bengal-facing-heat-over-baruipur-rape-murder-why-suvendu-adhikari-govt-treads-with-caution-10779613/,2026-07-10T03:52:08+00:00
Lucknow,IE,Lucknow • IE,https://indianexpress.com/section/cities/lucknow/,82,"Bhupesh Baghel: ‘Punjab Congress has no rebellion, there is a spirit of competition’",https://indianexpress.com/article/political-pulse/bhupesh-baghel-punjab-congress-has-no-rebellion-there-is-a-spirit-of-competition-10779637/,2026-07-10T03:52:08+00:00
Lucknow,IE,Lucknow • IE,https://indianexpress.com/section/cities/lucknow/,83,Jharkhand unveils plan to adopt AI in governance,https://indianexpress.com/article/india/jharkhand-unveils-plan-to-adopt-ai-in-governance-10779867/,2026-07-10T03:52:08+00:00
Lucknow,IE,Lucknow • IE,https://indianexpress.com/section/cities/lucknow/,84,"Behind Bihar JD(U) rejig, a push for ‘survival’ after Nitish Kumar’s CM era",https://indianexpress.com/article/political-pulse/behind-bihar-jdu-rejig-a-push-for-survival-after-nitish-kumars-cm-era-10779600/,2026-07-10T03:52:08+00:00
Lucknow,IE,Lucknow • IE,https://indianexpress.com/section/cities/lucknow/,85,"A boy killed by a falling tree, Mumbai civic panel now wants contractors held liable for root damage",https://indianexpress.com/article/cities/mumbai/a-boy-killed-by-a-falling-tree-mumbai-civic-panel-now-wants-contractors-held-liable-for-root-damage-10779793/,2026-07-10T03:52:08+00:00
Lucknow,IE,Lucknow • IE,https://indianexpress.com/section/cities/lucknow/,86,Maharashtra wants 30-day preventive custody under BNSS. Can a state amend a Central law?,https://indianexpress.com/article/cities/mumbai/maharashtra-wants-30-day-preventive-custody-under-bnss-can-a-state-amend-a-central-law-10779786/,2026-07-10T03:52:08+00:00
Lucknow,IE,Lucknow • IE,https://indianexpress.com/section/cities/lucknow/,87,"Noise introduces screenless REP Band with HRV, stress and sleep tracking",https://indianexpress.com/article/technology/tech-news-technology/noise-introduces-screenless-rep-band-with-hrv-stress-and-sleep-tracking-10779638/,2026-07-10T03:52:08+00:00
Lucknow,IE,Lucknow • IE,https://indianexpress.com/section/cities/lucknow/,88,Newsletters ( opens in a new tab ),https://indianexpress.com/newsletters/,2026-07-10T03:52:08+00:00
Lucknow,IE,Lucknow • IE,https://indianexpress.com/section/cities/lucknow/,89,26/11 Stories of Strength ( opens in a new tab ),https://indianexpress.com/26-11/,2026-07-10T03:52:08+00:00
Lucknow,IE,Lucknow • IE,https://indianexpress.com/section/cities/lucknow/,90,Statutory provisions on reporting (sexual offenses),https://indianexpress.com/article/what-is/what-is-the-protection-of-children-from-sexual-offences-act-2012/,2026-07-10T03:52:08+00:00
Bhopal,Bhaskar,Bhopal • Bhaskar,https://www.bhaskar.com/local/mp/bhopal/,1,जॉब - एजुकेशन,https://www.bhaskar.com/career/,2026-07-10T03:52:08+00:00
Bhopal,Bhaskar,Bhopal • Bhaskar,https://www.bhaskar.com/local/mp/bhopal/,2,फेक न्यूज एक्सपोज़,https://www.bhaskar.com/no-fake-news/,2026-07-10T03:52:08+00:00
Bhopal,Bhaskar,Bhopal • Bhaskar,https://www.bhaskar.com/local/mp/bhopal/,3,लाइफ - साइंस,https://www.bhaskar.com/happylife/,2026-07-10T03:52:08+00:00
Bhopal,Bhaskar,Bhopal • Bhaskar,https://www.bhaskar.com/local/mp/bhopal/,4,"हर महीने सामने आ रहे पति–पत्नी के खतरनाक मानसिक केस, मर्डर तक की सोच|भोपाल,Bhopal - Dainik Bhaskar",https://www.bhaskar.com/g/local/mp/bhopal/news/relationships-rising-violence-men-cases-60-70-percent-increase-psychiatrist-statement-138401770.html,2026-07-10T03:52:08+00:00
Bhopal,Bhaskar,Bhopal • Bhaskar,https://www.bhaskar.com/local/mp/bhopal/,5,"48 लाख ग्रामीणों को मुफ्त रजिस्ट्री देने रेवेन्यू अफसरों को अधिकार, अब जल्द होगी कार्यवाही|भोपाल,Bhopal - Dainik Bhaskar",https://www.bhaskar.com/g/local/mp/bhopal/news/mp-villagers-get-free-registry-rights-to-revenue-officers-138402153.html,2026-07-10T03:52:08+00:00
Bhopal,Bhaskar,Bhopal • Bhaskar,https://www.bhaskar.com/local/mp/bhopal/,6,"चल रही चित्रांकन-2026’ कला प्रदर्शनी; जानिए भोपाल में आज कहां-क्या खास|भोपाल,Bhopal - Dainik Bhaskar",https://www.bhaskar.com/local/mp/bhopal/news/chitraankan-2026-art-exhibition-bhopal-events-138402109.html,2026-07-10T03:52:08+00:00
Bhopal,Bhaskar,Bhopal • Bhaskar,https://www.bhaskar.com/local/mp/bhopal/,7,"दतिया में चुनावी लीड घटकर 2656 वोटों पर आ गई थी; 4 पार्टियां बदल चुके भारती|भोपाल,Bhopal - Dainik Bhaskar",https://www.bhaskar.com/local/mp/bhopal/news/datia-narottam-mishra-election-loss-apology-rajendra-bharti-138401776.html,2026-07-10T03:52:08+00:00
Bhopal,Bhaskar,Bhopal • Bhaskar,https://www.bhaskar.com/local/mp/bhopal/,8,"विकास नहीं होने पर विधायक का छलका दर्द; 19 गाड़ियों के काफिले के साथ निकले गडकरी|भोपाल,Bhopal - Dainik Bhaskar",https://www.bhaskar.com/local/mp/news/kalapipal-shajapur-mla-ghanshyam-chandravanshi-sadak-demand-cm-mohan-yadav-protest-video-baat-khari-hai-138405148.html,2026-07-10T03:52:08+00:00
Bhopal,Bhaskar,Bhopal • Bhaskar,https://www.bhaskar.com/local/mp/bhopal/,9,"32 जिलों में सामान्य से ज्यादा पानी गिरा; आज पन्ना, सतना में आज हेवी रेन का अलर्ट|भोपाल,Bhopal - Dainik Bhaskar",https://www.bhaskar.com/local/mp/bhopal/news/panna-satna-heavy-rain-alert-mp-weather-news-138401628.html,2026-07-10T03:52:08+00:00
Bhopal,Bhaskar,Bhopal • Bhaskar,https://www.bhaskar.com/local/mp/bhopal/,10,"शिरोमणि विनोद शर्मा बने आज के 'पब्लिक स्टार'; आपकी शिकायत भी पहुंच सकती है जिम्मेदारों तक|भोपाल,Bhopal - Dainik Bhaskar",https://www.bhaskar.com/g/local/mp/bhopal/news/bhopal-public-star-vinod-sharma-resolves-electricity-issue-bhaskar-samadhan-138402118.html,2026-07-10T03:52:08+00:00
Bhopal,Bhaskar,Bhopal • Bhaskar,https://www.bhaskar.com/local/mp/bhopal/,11,"ओंकारेश्वर का आय-व्यय नहीं बताते, बगलामुखी मंदिर में फर्जी समिति ले रही थी चंदा|भोपाल,Bhopal - Dainik Bhaskar",https://www.bhaskar.com/local/mp/indore/news/ujjain-mahankal-temple-donation-security-qr-code-online-fraud-138404989.html,2026-07-10T03:52:08+00:00
Bhopal,Bhaskar,Bhopal • Bhaskar,https://www.bhaskar.com/local/mp/bhopal/,12,"इंदौर में ड्रग्स के साथ पकड़ाए आरोपियों ने लिया नाम; कांग्रेस बोली- बदले की कार्रवाई|भोपाल,Bhopal - Dainik Bhaskar",https://www.bhaskar.com/local/mp/indore/news/indore-dwarkapuri-police-chase-fugitive-arrested-escape-138400115.html,2026-07-10T03:52:08+00:00
Bhopal,Bhaskar,Bhopal • Bhaskar,https://www.bhaskar.com/local/mp/bhopal/,13,"जीतू पटवारी और हरीश चौधरी की कार्यप्रणाली पर उठाए थे सवाल|भोपाल,Bhopal - Dainik Bhaskar",https://www.bhaskar.com/local/mp/bhopal/news/mp-rakesh-yadav-joins-bjp-jitu-patwari-harish-chaudhary-controversy-138401263.html,2026-07-10T03:52:08+00:00
Bhopal,Bhaskar,Bhopal • Bhaskar,https://www.bhaskar.com/local/mp/bhopal/,14,"दिसंबर सत्र में 1,497 सवाल पूछे थे, जुलाई सत्र में सिर्फ 1,756 प्रश्न लगाए|भोपाल,Bhopal - Dainik Bhaskar",https://www.bhaskar.com/local/mp/bhopal/news/mp-vidhayak-sawal-assembly-session-mohan-sarkar-138400338.html,2026-07-10T03:52:08+00:00
Bhopal,Bhaskar,Bhopal • Bhaskar,https://www.bhaskar.com/local/mp/bhopal/,15,"किसानों ने मूंग खरीदी केंद्रों से बनाई दूरी, 2 हजार रु. घाटे में मंडी में बेच रहे फसल|भोपाल,Bhopal - Dainik Bhaskar",https://www.bhaskar.com/g/local/mp/bhopal/news/protests-in-12-districts-demand-for-100-procurement-at-msp-dbp-138405086.html,2026-07-10T03:52:08+00:00
Bhopal,Bhaskar,Bhopal • Bhaskar,https://www.bhaskar.com/local/mp/bhopal/,16,"फ्री स्कूटी पर डेडलाइन का दबाव, 31 तक हिसाब नहीं देने पर अटक सकता है बजट|भोपाल,Bhopal - Dainik Bhaskar",https://www.bhaskar.com/g/local/mp/bhopal/news/deadline-pressure-on-free-scooters-budget-could-be-stalled-if-accounts-are-not-submitted-by-the-31st-dbp-138405070.html,2026-07-10T03:52:08+00:00
Bhopal,Bhaskar,Bhopal • Bhaskar,https://www.bhaskar.com/local/mp/bhopal/,17,"भाजपा प्रदेशाध्यक्ष खंडेलवाल ने ग्रहण कराई सदस्यता|भोपाल,Bhopal - Dainik Bhaskar",https://www.bhaskar.com/g/local/mp/bhopal/news/congresss-rakesh-joins-bjp-dbp-138405052.html,2026-07-10T03:52:08+00:00
Bhopal,Bhaskar,Bhopal • Bhaskar,https://www.bhaskar.com/local/mp/bhopal/,18,"हर बार एक ही बहाना कि फायर एक्ट नहीं है, जबकि मौजूदा कानूनों में ही पर्याप्त प्रावधान|भोपाल,Bhopal - Dainik Bhaskar",https://www.bhaskar.com/g/local/mp/bhopal/news/1200-fire-incidents-every-year-but-no-action-is-taken-against-those-responsible-dbp-138405047.html,2026-07-10T03:52:08+00:00
Bhopal,Bhaskar,Bhopal • Bhaskar,https://www.bhaskar.com/local/mp/bhopal/,19,"बांधवगढ़ में मौत से जूझ रही मां से बिछड़ी भालू ‘लूना’ को बचाया, वन विहार में मिला नया जीवन|भोपाल,Bhopal - Dainik Bhaskar",https://www.bhaskar.com/g/local/mp/bhopal/news/bandhavgarh-bear-luna-separated-from-her-mother-battling-for-life-rescued-and-found-a-new-lease-of-life-at-van-vihar-dbp-138405038.html,2026-07-10T03:52:08+00:00
Bhopal,Bhaskar,Bhopal • Bhaskar,https://www.bhaskar.com/local/mp/bhopal/,20,"विवि कैंपस में कुत्तों को रोकने के लिए नोडल अफसर नियुक्त करें, प्रोफेसर बोले- अब क्या हम घूम-घूमकर कुत्तों को भगाएंगे|भोपाल,Bhopal - Dainik Bhaskar",https://www.bhaskar.com/g/local/mp/bhopal/news/appoint-a-nodal-officer-to-control-dogs-on-the-university-campus-the-professor-said-will-we-now-go-around-chasing-dogs-away-dbp-138405031.html,2026-07-10T03:52:08+00:00
Bhopal,Bhaskar,Bhopal • Bhaskar,https://www.bhaskar.com/local/mp/bhopal/,21,"एनजीटी ने 5 बार एक्शन टेकन रिपोर्ट मांगी, अफसर कहते रहे-कार्रवाई जारी; अब जुर्माना|भोपाल,Bhopal - Dainik Bhaskar",https://www.bhaskar.com/g/local/mp/bhopal/news/case-of-action-on-big-pond-dbp-138404994.html,2026-07-10T03:52:08+00:00
Bhopal,Bhaskar,Bhopal • Bhaskar,https://www.bhaskar.com/local/mp/bhopal/,22,"फर्जी खातों से विदेश भेजी रकम, इनमें भोपाल के 2 कारोबारी|भोपाल,Bhopal - Dainik Bhaskar",https://www.bhaskar.com/g/local/mp/bhopal/news/satta-app-owners-gave-protection-money-to-officers-dbp-138404971.html,2026-07-10T03:52:08+00:00
Bhopal,Bhaskar,Bhopal • Bhaskar,https://www.bhaskar.com/local/mp/bhopal/,23,"मेट्रो - 8 साल बाद जागे अफसर, अब नहीं बनेंगे ऐशबाग और गोविंदपुरा स्टेशन|भोपाल,Bhopal - Dainik Bhaskar",https://www.bhaskar.com/g/local/mp/bhopal/news/for-the-first-time-the-process-of-amendment-in-dpr-started-dbp-138404951.html,2026-07-10T03:52:08+00:00
Bhopal,Bhaskar,Bhopal • Bhaskar,https://www.bhaskar.com/local/mp/bhopal/,24,स्वामित्व योजना: तहसीलदार-नायब तहसीलदारों को मिले उपपंजीयक के अधिकार,https://www.bhaskar.com/g/local/mp/bhopal/news/tehsildars-and-naib-tehsildars-have-been-given-the-powers-of-sub-registrars-dbp-138404958.html,2026-07-10T03:52:08+00:00
Bhopal,Bhaskar,Bhopal • Bhaskar,https://www.bhaskar.com/local/mp/bhopal/,25,"पैसे लेकर भी प्लॉट व पजेशन नहीं, मेंटेनेंस के नाम पर अवैध वसूली, रहवासी पहुंचे कलेक्ट्रेट|भोपाल,Bhopal - Dainik Bhaskar",https://www.bhaskar.com/g/local/mp/bhopal/news/despite-receiving-money-no-plot-or-possession-was-given-illegal-collection-in-the-name-of-maintenance-residents-reached-the-collectorate-dbp-138405090.html,2026-07-10T03:52:08+00:00
Bhopal,Bhaskar,Bhopal • Bhaskar,https://www.bhaskar.com/local/mp/bhopal/,26,"कमाली मंदिर से रातों-रात मूर्तियां हटाईं, आरोप-यहां शॉपिंग कॉम्प्लेक्स बना रहे|भोपाल,Bhopal - Dainik Bhaskar",https://www.bhaskar.com/g/local/mp/bhopal/news/the-commotion-of-devotees-throughout-the-day-dbp-138405022.html,2026-07-10T03:52:08+00:00
Bhopal,Bhaskar,Bhopal • Bhaskar,https://www.bhaskar.com/local/mp/bhopal/,27,"तीसरी बार पकड़ी गई तो इंजीनियर को हाथ-पैर तोड़ने की धमकी|भोपाल,Bhopal - Dainik Bhaskar",https://www.bhaskar.com/g/local/mp/bhopal/news/electricity-theft-from-transformer-by-breaking-into-wall-dbp-138405011.html,2026-07-10T03:52:08+00:00
Bhopal,Bhaskar,Bhopal • Bhaskar,https://www.bhaskar.com/local/mp/bhopal/,28,500 पदों की भर्ती: कोर्ट के आदेश के चलते 87% का परिणाम जारी,https://www.bhaskar.com/g/local/mp/bhopal/news/87-results-released-due-to-court-order-dbp-138405007.html,2026-07-10T03:52:08+00:00
Bhopal,Bhaskar,Bhopal • Bhaskar,https://www.bhaskar.com/local/mp/bhopal/,29,"तत्कालीन फील्ड और प्रोजेक्ट डायरेक्टर दोनों का दावा- शंकराचार्य प्रतिमा का तकनीकी परीक्षण नहीं, शिकायत की तो बिना जांच हटाया|भोपाल,Bhopal - Dainik Bhaskar",https://www.bhaskar.com/g/local/mp/bhopal/news/the-then-field-and-project-directors-both-claimed-that-the-shankaracharya-statue-had-not-been-technically-tested-and-was-removed-without-investigation-after-a-complaint-dbp-138404980.html,2026-07-10T03:52:08+00:00
Bhopal,Bhaskar,Bhopal • Bhaskar,https://www.bhaskar.com/local/mp/bhopal/,30,"मंडला सबसे ज्यादा भीगा, भिंड में रेड अलर्ट, 24 घंटे में कई जिलों में तेज बारिश की चेतावनी|भोपाल,Bhopal - Dainik Bhaskar",https://www.bhaskar.com/local/mp/bhopal/news/gwalior-chambal-heavy-rain-bhind-red-alert-mp-monsoon-138393337.html,2026-07-10T03:52:08+00:00
Bhopal,Bhaskar,Bhopal • Bhaskar,https://www.bhaskar.com/local/mp/bhopal/,31,"गिरजेश बने सह संयोजक, ओबीसी मोर्चा के चार जिलाध्यक्ष और 3 संभागीय कार्यालय मंत्री भी बनाए|भोपाल,Bhopal - Dainik Bhaskar",https://www.bhaskar.com/local/mp/bhopal/news/mp-bjp-appointments-it-obc-morcha-hitesh-nagdev-convenor-138393943.html,2026-07-10T03:52:08+00:00
Bhopal,Bhaskar,Bhopal • Bhaskar,https://www.bhaskar.com/local/mp/bhopal/,32,"भोपाल के आहूजा ब्रदर्स के खिलाफ नए सबूत पेश, सौरभ चंद्राकर, रवि उप्पल समेत 66 आरोपियों पर शिकंजा|भोपाल,Bhopal - Dainik Bhaskar",https://www.bhaskar.com/g/local/mp/bhopal/news/mahadev-app-case-cbi-files-11-chargesheets-sourav-chandrakar-ravi-uppal-bhopal-ahuja-brothers-138400345.html,2026-07-10T03:52:08+00:00
Bhopal,Bhaskar,Bhopal • Bhaskar,https://www.bhaskar.com/local/mp/bhopal/,33,"1996 से अब तक न वेतन पुनरीक्षण हुआ, न कैडर रिव्यू और न ही प्रमोशन मिला|भोपाल,Bhopal - Dainik Bhaskar",https://www.bhaskar.com/local/mp/bhopal/news/mp-patwari-strike-salary-review-demand-138400773.html,2026-07-10T03:52:08+00:00
Bhopal,Bhaskar,Bhopal • Bhaskar,https://www.bhaskar.com/local/mp/bhopal/,34,"VIDEO बनाकर पीड़िता के भाई के मोबाइल पर भेजा; एक नाबालिग हिरासत में|भोपाल,Bhopal - Dainik Bhaskar",https://www.bhaskar.com/g/local/mp/bhopal/news/bhopal-minor-gang-rape-accused-send-video-victim-brother-138399277.html,2026-07-10T03:52:08+00:00
Bhopal,Bhaskar,Bhopal • Bhaskar,https://www.bhaskar.com/local/mp/bhopal/,35,"चलती बस में लगी आग, चाचा-भतीजे को लात-घूंसों से पीटा; CM के सामने विधायक बोले-जूते-चप्पल छोड़ दूंगा|भोपाल,Bhopal - Dainik Bhaskar",https://www.bhaskar.com/local/mp/news/mp-top-10-news-today-bus-catches-fire-uncle-nephew-assaulted-bjp-mla-tells-cm-he-wont-wear-shoes-until-roads-are-built-138400391.html,2026-07-10T03:52:08+00:00
Bhopal,Bhaskar,Bhopal • Bhaskar,https://www.bhaskar.com/local/mp/bhopal/,36,"भोपाल में सड़क पर बाइक लटकाकर जताया विरोध; लिखा-मैंने एथनॉल पिया है|भोपाल,Bhopal - Dainik Bhaskar",https://www.bhaskar.com/local/mp/bhopal/news/madhya-pradesh-aaps-ethanol-policy-protest-bike-crane-bhopal-138400571.html,2026-07-10T03:52:08+00:00
Bhopal,Bhaskar,Bhopal • Bhaskar,https://www.bhaskar.com/local/mp/bhopal/,37,"बंटवारा, नामांतरण और फौती प्रकरण में मांगी थी रकम, लोकायुक्त भोपाल की कार्रवाई|भोपाल,Bhopal - Dainik Bhaskar",https://www.bhaskar.com/local/mp/bhopal/news/vidisha-patwari-bribe-lokayukta-arrest-bantwara-namantaran-138400550.html,2026-07-10T03:52:08+00:00
Bhopal,Bhaskar,Bhopal • Bhaskar,https://www.bhaskar.com/local/mp/bhopal/,38,"खुद किया कन्यादान, 2022 में कैंसर से बेटे की मौत के बाद निभाया वादा|भोपाल,Bhopal - Dainik Bhaskar",https://www.bhaskar.com/local/mp/bhopal/news/madhya-pradesh-father-daughter-remarriage-widow-re-marriage-bhopal-ujjain-138400497.html,2026-07-10T03:52:08+00:00
Bhopal,Bhaskar,Bhopal • Bhaskar,https://www.bhaskar.com/local/mp/bhopal/,39,"महिला बोलीं-18 साल बाद भी कॉलोनी में मूलभूत सुविधाएं नहीं; एडीएम बोले- शिकायतों की जांच कराएंगे|भोपाल,Bhopal - Dainik Bhaskar",https://www.bhaskar.com/local/mp/bhopal/news/bhopal-colonies-basic-facilities-lack-adm-investigation-138400128.html,2026-07-10T03:52:08+00:00
Bhopal,Bhaskar,Bhopal • Bhaskar,https://www.bhaskar.com/local/mp/bhopal/,40,"शॉपिंग कॉम्प्लेक्स निर्माण की सूचना पर श्रद्धालुओं का विरोध, विरोध के बाद ट्रस्ट ने बदला रुख; कॉम्प्लेक्स पर सफाई|भोपाल,Bhopal - Dainik Bhaskar",https://www.bhaskar.com/local/mp/bhopal/news/kamali-mandir-statues-removed-protest-original-place-138400024.html,2026-07-10T03:52:08+00:00
Bhopal,Bhaskar,Bhopal • Bhaskar,https://www.bhaskar.com/local/mp/bhopal/,41,"दतिया उपचुनाव का हवाला देकर स्थगित की मीटिंग|भोपाल,Bhopal - Dainik Bhaskar",https://www.bhaskar.com/local/mp/bhopal/news/bjp-state-working-committee-meeting-orchha-report-card-instructions-138399543.html,2026-07-10T03:52:08+00:00
Bhopal,Bhaskar,Bhopal • Bhaskar,https://www.bhaskar.com/local/mp/bhopal/,42,"पुलिस से बोला- करणी सेना का पूर्व अध्यक्ष हूं, बेरोजगारों को दिए थे फर्जी नियुक्ति पत्र|भोपाल,Bhopal - Dainik Bhaskar",https://www.bhaskar.com/g/local/mp/bhopal/news/bhopal-ex-karni-sena-chief-arrested-job-scam-138399105.html,2026-07-10T03:52:08+00:00
Bhopal,Bhaskar,Bhopal • Bhaskar,https://www.bhaskar.com/local/mp/bhopal/,43,"अब तक पहली ही परीक्षा की डेट तय नहीं; सिलेबस और तारीख घोषित करने की मांग|भोपाल,Bhopal - Dainik Bhaskar",https://www.bhaskar.com/local/mp/bhopal/news/mp-teachers-exam-confusion-govt-clarify-tet-schedule-138398852.html,2026-07-10T03:52:08+00:00
Bhopal,Bhaskar,Bhopal • Bhaskar,https://www.bhaskar.com/local/mp/bhopal/,44,"3 साल पहले बनी प्राइवेट कमेटी लेती रही दान; अफसरों ने नहीं की कोई कार्रवाई|भोपाल,Bhopal - Dainik Bhaskar",https://www.bhaskar.com/local/mp/bhopal/news/mp-baglamukhi-temple-temple-fund-theft-scam-fake-committee-138397525.html,2026-07-10T03:52:08+00:00
Bhopal,Bhaskar,Bhopal • Bhaskar,https://www.bhaskar.com/local/mp/bhopal/,45,"पीसीसी चीफ ने पूछा- सरदार सरोवर समझौते में एमपी के ₹7,669 करोड़ क्यों छोड़े|भोपाल,Bhopal - Dainik Bhaskar",https://www.bhaskar.com/g/local/mp/bhopal/news/mp-congress-questions-rs-7669-cr-sardar-sarovar-deal-138398210.html,2026-07-10T03:52:08+00:00
Bhopal,Bhaskar,Bhopal • Bhaskar,https://www.bhaskar.com/local/mp/bhopal/,46,"बड़ा हादसा टला, आयशर कॉलेज के पास हुआ हादसा; टैंकर का केबिन जलकर खाक|भोपाल,Bhopal - Dainik Bhaskar",https://www.bhaskar.com/g/local/mp/bhopal/news/bhopal-ethanol-tanker-fire-near-iit-college-138398139.html,2026-07-10T03:52:08+00:00
Bhopal,Bhaskar,Bhopal • Bhaskar,https://www.bhaskar.com/local/mp/bhopal/,47,"भोपाल गर्ल्स स्कूल के 6 बच्चे सुरक्षित निकाले गए, दूसरे वाहन को बचाने में खोया कंट्रोल|भोपाल,Bhopal - Dainik Bhaskar",https://www.bhaskar.com/g/local/mp/bhopal/news/bhopal-girls-school-van-accident-koh-e-fiza-138398029.html,2026-07-10T03:52:08+00:00
Bhopal,Bhaskar,Bhopal • Bhaskar,https://www.bhaskar.com/local/mp/bhopal/,48,"बोले- वे वक्फ की हिफाजत क्या करेंगे, जो अपनी धार्मिक संस्थाएं नहीं संभाल पा रहे|भोपाल,Bhopal - Dainik Bhaskar",https://www.bhaskar.com/g/local/mp/bhopal/news/madhya-pradesh-wakf-board-non-muslim-appointment-controversy-jamiat-sadr-statement-138397128.html,2026-07-10T03:52:08+00:00
Bhopal,Bhaskar,Bhopal • Bhaskar,https://www.bhaskar.com/local/mp/bhopal/,49,"2320 में खरीदकर 2800 में बेच रहे, मुनाफे में सब हिस्सेदार…‘खुलासे’ से डर रही पुलिस|भोपाल,Bhopal - Dainik Bhaskar",https://www.bhaskar.com/local/mp/news/mp-ethanol-rice-scam-1160cr-govt-rice-138396530.html,2026-07-10T03:52:08+00:00
Bhopal,Bhaskar,Bhopal • Bhaskar,https://www.bhaskar.com/local/mp/bhopal/,50,"इलेक्ट्रॉनिक टिकट मिलेंगे, ट्रैकिंग डिवाइस हर दस सेकेंड में पता चलेगी लाइव लोकेशन|भोपाल,Bhopal - Dainik Bhaskar",https://www.bhaskar.com/g/local/mp/news/madhya-pradesh-bus-service-electronic-tickets-tracking-devices-138393124.html,2026-07-10T03:52:08+00:00
