city,publisher,source,source_url,rank,headline,link,collected_at_iso
Bengaluru,DC,Bengaluru • DC,https://www.deccanchronicle.com/location/india/karnataka/bengaluru,1,Assembly Elections 2026,https://www.deccanchronicle.com/assembly-elections-2026,2026-05-11T12:42:24+00:00
Bengaluru,DC,Bengaluru • DC,https://www.deccanchronicle.com/location/india/karnataka/bengaluru,2,Opinion and Editorials,https://www.deccanchronicle.com/opinion,2026-05-11T12:42:24+00:00
Bengaluru,DC,Bengaluru • DC,https://www.deccanchronicle.com/location/india/karnataka/bengaluru,3,Telangana Rising 2047,https://www.deccanchronicle.com/tags/Telangana-Rising-2047,2026-05-11T12:42:24+00:00
Mumbai,Mumbai Mirror,Mumbai • Mumbai Mirror,https://mumbaimirror.indiatimes.com/mumbai,1,The antibiotic-anxiety link,https://mumbaimirror.indiatimes.com/you/the-antibiotic-anxiety-link/articleshow/130996992.html,2026-05-11T12:42:24+00:00
Mumbai,Mumbai Mirror,Mumbai • Mumbai Mirror,https://mumbaimirror.indiatimes.com/mumbai,2,Why we’ve become risk-averse,https://mumbaimirror.indiatimes.com/opinion/why-weve-become-risk-averse/articleshow/130997231.html,2026-05-11T12:42:24+00:00
Mumbai,Mumbai Mirror,Mumbai • Mumbai Mirror,https://mumbaimirror.indiatimes.com/mumbai,3,Drunk doc creates hosp ruckus,https://mumbaimirror.indiatimes.com/mumbai/drunk-doc-creates-hosp-ruckus/articleshow/130997578.html,2026-05-11T12:42:24+00:00
Mumbai,Mumbai Mirror,Mumbai • Mumbai Mirror,https://mumbaimirror.indiatimes.com/mumbai,4,Fake Army officer dupes chemical firm,https://mumbaimirror.indiatimes.com/mumbai/fake-army-officer-dupes-chemical-firm/articleshow/130997577.html,2026-05-11T12:42:24+00:00
Mumbai,Mumbai Mirror,Mumbai • Mumbai Mirror,https://mumbaimirror.indiatimes.com/mumbai,5,"Soon, roadside drug tests on state highways",https://mumbaimirror.indiatimes.com/mumbai/cover-story/soon-roadside-drug-tests-on-state-highways/articleshow/130997713.html,2026-05-11T12:42:24+00:00
Mumbai,Mumbai Mirror,Mumbai • Mumbai Mirror,https://mumbaimirror.indiatimes.com/mumbai,6,India’s wild heart beckons,https://mumbaimirror.indiatimes.com/unwind/indias-wild-heart-beckons/articleshow/130996583.html,2026-05-11T12:42:24+00:00
Mumbai,Mumbai Mirror,Mumbai • Mumbai Mirror,https://mumbaimirror.indiatimes.com/mumbai,7,India’s eye in the sky,https://mumbaimirror.indiatimes.com/mumbai/indias-eye-in-the-sky/articleshow/130996579.html,2026-05-11T12:42:24+00:00
Mumbai,Mumbai Mirror,Mumbai • Mumbai Mirror,https://mumbaimirror.indiatimes.com/mumbai,8,Ask The Sexpert,https://mumbaimirror.indiatimes.com/ask-the-sexpert,2026-05-11T12:42:24+00:00
Mumbai,Sakal,Mumbai • Sakal,https://www.esakal.com/pune,1,सकाळ लाईव्ह TV,https://www.esakal.com/live-tv,2026-05-11T12:42:24+00:00
Mumbai,Sakal,Mumbai • Sakal,https://www.esakal.com/pune,2,Refund and Cancellation,https://www.esakal.com/refund-and-cancellation,2026-05-11T12:42:24+00:00
Mumbai,Lokmat,Mumbai • Lokmat,https://www.lokmat.com/city/,1,Live News in Marathi,https://www.lokmat.com/live-news/,2026-05-11T12:42:24+00:00
Mumbai,Lokmat,Mumbai • Lokmat,https://www.lokmat.com/city/,2,"बुधवार पेठेत स्वेच्छेने देहविक्रय; ५ बांगलादेशी महिला ताब्यात, गेल्या २ वर्षात १३० बांगलादेशी मायदेशी",https://www.lokmat.com/pune/voluntary-prostitution-in-budhwar-peth-5-bangladeshi-women-detained-130-bangladeshis-repatriated-in-the-last-2-years-a-a727/,2026-05-11T12:42:24+00:00
Mumbai,Lokmat,Mumbai • Lokmat,https://www.lokmat.com/city/,3,राज्यात तब्बल ४८७ शाळा बेकायदेशीरपणे सुरू; शिक्षण विभागाच्या नोंदीतून धक्कादायक माहिती समोर,https://www.lokmat.com/pune/as-many-as-487-schools-are-running-illegally-in-the-state-shocking-information-comes-to-light-from-the-records-of-the-education-department-a-a727/,2026-05-11T12:42:24+00:00
Mumbai,Lokmat,Mumbai • Lokmat,https://www.lokmat.com/city/,4,"पुणे शहराला धूळ, धूर, आणि प्रदूषणाचा वाढता विळखा; लहानांपासून गर्भवती महिला व ज्येष्ठांच्या आरोग्यावर गंभीर परिणाम",https://www.lokmat.com/pune/pune-city-is-facing-increasing-problems-of-dust-smoke-and-pollution-serious-impact-on-the-health-of-children-pregnant-women-and-the-elderly-a-a727/,2026-05-11T12:42:24+00:00
Mumbai,Lokmat,Mumbai • Lokmat,https://www.lokmat.com/city/,5,"LIVE: डोंबिवली रेल्वे स्थानकाच्या फलाटावर विद्युत जनित्राचा स्फोट, सेवा अनिश्चित काळासाठी बंद",https://www.lokmat.com/maharashtra/maharashtra-marathi-news-live-updates-11-may-2026-pm-narendra-modis-appeal-petrol-diesel-prices-fuel-crisis-west-bengal-politcs-kerala-cm-suvendy-adhikari-thalapathy-vijay-cm-devendra-fadnavis-ipl-2026-us-iran-tension-hormuz-ashok-kharat-case-a-a573/,2026-05-11T12:42:24+00:00
Mumbai,Lokmat,Mumbai • Lokmat,https://www.lokmat.com/city/,6,जगात कोणत्याही देशात प्रॉपर्टी कार्ड कॅश करता येणार - चंद्रशेखर बावनकुळे,https://www.lokmat.com/pune/property-card-can-be-cashed-in-any-country-in-the-world-chandrashekhar-bawankule-a-a727/,2026-05-11T12:42:24+00:00
Mumbai,Lokmat,Mumbai • Lokmat,https://www.lokmat.com/city/,7,"ब्लॅकलिस्टेड ठेकेदाराला पालिकेकडून पुन्हा संधी, अत्याधुनिक तंत्रज्ञानावरील ‘व्हिडिओ वॉल’चे दिले काम",https://www.lokmat.com/mumbai/bmc-gives-another-chance-to-blacklisted-contractor-gives-work-on-video-wall-using-cutting-edge-technology-a-a681/,2026-05-11T12:42:24+00:00
Mumbai,Lokmat,Mumbai • Lokmat,https://www.lokmat.com/city/,8,'नीट' परीक्षेवर गैरप्रकाराच्या संशयाचे ढग; एनटीएने तपास केंद्रीय यंत्रणांकडे सोपविला,https://www.lokmat.com/mumbai/neet-exam-under-suspicion-of-malpractice-nta-hands-over-investigation-to-central-agencies-a-a571/,2026-05-11T12:42:24+00:00
Mumbai,Lokmat,Mumbai • Lokmat,https://www.lokmat.com/city/,9,दोन हजार 'ड्रोन'ने उलगडला डॉ. आंबेडकरांचा जीवनपट; मुंबईकरांना अक्षरशः भारावून टाकले,https://www.lokmat.com/mumbai/two-thousand-drones-revealed-dr-ambedkars-life-story-mumbaikars-were-literally-overwhelmed-a-a571/,2026-05-11T12:42:24+00:00
Mumbai,Lokmat,Mumbai • Lokmat,https://www.lokmat.com/city/,10,"Mumbai Fraud Case: ५% नफा मिळवून देणार, कमावण्याच्या नादात ११ कोटी रुपये गमावले",https://www.lokmat.com/mumbai/mumbai-fraud-case-5-profit-promised-rs-11-crore-lost-in-the-name-of-earning-a-a571/,2026-05-11T12:42:24+00:00
Mumbai,Lokmat,Mumbai • Lokmat,https://www.lokmat.com/city/,11,हायकोर्टाच्या अवमान प्रकरणात वाशिम मुख्याधिकाऱ्यांना नोटीस; स्पष्टीकरण सादर करण्याचे निर्देश,https://www.lokmat.com/nagpur/notice-to-washim-chief-magistrate-in-contempt-of-high-court-case-instructions-to-submit-explanation-a-a511-c1000/,2026-05-11T12:42:24+00:00
Mumbai,Lokmat,Mumbai • Lokmat,https://www.lokmat.com/city/,12,'कूल लाइफस्टाइल'च्या नादात 'हाय क्लास' झिंग; सायकोट्रॉपिक ड्रग्जचा वाढता शिरकाव ही धोक्याची घंटी,https://www.lokmat.com/nagpur/high-class-zing-in-the-wake-of-cool-lifestyle-increasing-penetration-of-psychotropic-drugs-is-a-warning-bell-a-a382-c1000/,2026-05-11T12:42:24+00:00
Mumbai,Lokmat,Mumbai • Lokmat,https://www.lokmat.com/city/,13,"‘तुम तो ठहरे परदेसी’चे गीतकार जहीर आलम यांचे निधन; शब्दांनी जग जिंकले, पण आयुष्य काढले गरिबीत",https://www.lokmat.com/nagpur/zaheer-alam-lyricist-of-tum-toh-thuhe-pardesi-passes-away-he-conquered-the-world-with-his-words-but-spent-his-life-in-poverty-a-a1000/,2026-05-11T12:42:24+00:00
Mumbai,Lokmat,Mumbai • Lokmat,https://www.lokmat.com/city/,14,कावडीवरचा जीव अन् दुचाकीवरील मृत्यू !,https://www.lokmat.com/nagpur/life-on-a-bicycle-and-death-on-a-bike-a-a1015-c1000/,2026-05-11T12:42:24+00:00
Mumbai,Lokmat,Mumbai • Lokmat,https://www.lokmat.com/city/,15,"ब्रेनवॉशसाठी १७१ लिंक्स, धर्माकडे आकर्षित करण्यासाठी...; निदाच्या फोनमधून उलगडणार मोठं रहस्य",https://www.lokmat.com/nashik/nashik-tcs-accused-nida-khan-court-hearing-today-sit-mobile-cloning-171-religious-links-a-a597/,2026-05-11T12:42:24+00:00
Mumbai,Lokmat,Mumbai • Lokmat,https://www.lokmat.com/city/,16,"तीन वेळा कार बदलून रुपाली चाकणकर चौकशीला हजर, अशोक खरातप्रकरणी एसआयटीने केली प्रश्नांची सरबत्ती",https://www.lokmat.com/nashik/rupali-chakankar-appears-for-questioning-after-changing-cars-three-times-sit-questions-ashok-kharat-case-a-a571/,2026-05-11T12:42:24+00:00
Mumbai,Lokmat,Mumbai • Lokmat,https://www.lokmat.com/city/,17,महिलेच्या एकाकीपणाचा फायदा; 'होणाऱ्या पती'नेच लावला साडेचार लाखांचा चुना; १४ तोळे दागिनेही हडपले,https://www.lokmat.com/nashik/nasik-man-traps-woman-with-marriage-promise-loots-14-tolas-of-gold-and-cash-after-assault-a-a1001/,2026-05-11T12:42:24+00:00
Mumbai,Lokmat,Mumbai • Lokmat,https://www.lokmat.com/city/,18,भोंदू खरात प्रकरणी रूपाली चाकणकर यांची चौकशी सुरू; नाशिकमध्ये SIT समोर नोंदवला जबाब,https://www.lokmat.com/maharashtra/rupali-chakankar-investigation-begins-in-the-ashok-kharat-case-recorded-statement-before-sit-in-nashik-a-a629/,2026-05-11T12:42:24+00:00
Mumbai,Lokmat,Mumbai • Lokmat,https://www.lokmat.com/city/,19,"टीसीएस' प्रकरण: निदा खानसोबत 'स्पॉट पंचनामा', नाशिक पोलिस आयुक्तालयात कुटुंबीयांचीही चौकशी",https://www.lokmat.com/nashik/tcs-case-spot-panchnama-with-nida-khan-family-members-also-questioned-at-nashik-police-commissionerate-a-a571/,2026-05-11T12:42:24+00:00
Mumbai,Lokmat,Mumbai • Lokmat,https://www.lokmat.com/city/,20,"थांबलेल्या ट्रकला कारची धडक, चिमुकल्यासह दोघे जखमी; कोल्हापूर-रत्नागिरी महामार्गावर झाला अपघात",https://www.lokmat.com/kolhapur/three-injured-after-car-hits-truck-parked-at-talwade-on-kolhapur-ratnagiri-highway-a-a746/,2026-05-11T12:42:24+00:00
Mumbai,Lokmat,Mumbai • Lokmat,https://www.lokmat.com/city/,21,"Kolhapur News: लॉज बनले कुंटणखाने, कॅफेंमध्ये अश्लील चाळे; भरवस्तीत घडतात गैरप्रकार",https://www.lokmat.com/kolhapur/need-for-action-against-malpractices-going-on-in-lodges-and-cafes-in-kolhapur-district-a-a746/,2026-05-11T12:42:24+00:00
Mumbai,Lokmat,Mumbai • Lokmat,https://www.lokmat.com/city/,22,Kolhapur News: १५ तोळे दागिने अन् लाखाची रोकड असलेली बॅग विसरली; पोलिसांनी चार तासांत शोधली,https://www.lokmat.com/kolhapur/forgot-bag-containing-15-tolas-of-jewelry-and-lakhs-of-cash-kolhapur-police-found-it-in-four-hours-a-a746/,2026-05-11T12:42:24+00:00
Mumbai,Lokmat,Mumbai • Lokmat,https://www.lokmat.com/city/,23,Kolhapur-Gokul Dudh Sangh: ‘गोकुळ’ निवडणुकीबाबत शासन ‘सर्वोच्च’ न्यायालयात जाणार?,https://www.lokmat.com/kolhapur/will-the-government-go-to-the-supreme-court-regarding-the-gokul-dudh-sangh-elections-a-a746/,2026-05-11T12:42:24+00:00
Mumbai,Lokmat,Mumbai • Lokmat,https://www.lokmat.com/city/,24,"Kolhapur Crime: शटरचे हँडल डोक्यात मारून तरुणाचा खून, कोडोली येथे भांडणातून घडली घटना",https://www.lokmat.com/kolhapur/youth-murdered-by-hitting-him-in-the-head-with-a-shutter-handle-during-a-fight-in-kodoli-kolhapur-a-a746/,2026-05-11T12:42:24+00:00
Mumbai,Lokmat,Mumbai • Lokmat,https://www.lokmat.com/city/,25,"Sangli Crime: आष्ट्यात नशेचे इंजेक्शन विक्री करणारे दोघे जेरबंद, ७४ इंजेक्शन जप्त",https://www.lokmat.com/sangli/two-arrested-for-selling-intoxicating-injections-in-ashta-sangli-74-injections-seized-a-a746/,2026-05-11T12:42:24+00:00
Mumbai,Lokmat,Mumbai • Lokmat,https://www.lokmat.com/city/,26,"सांगली ते पुणे मार्गावर धावताहेत खराब, नादुरुस्त १४ शिवशाही बसेस; प्रवाशांना नाहक त्रास",https://www.lokmat.com/sangli/14-shivshahi-buses-are-running-on-the-sangli-to-pune-route-in-bad-condition-a-a746/,2026-05-11T12:42:24+00:00
Mumbai,Lokmat,Mumbai • Lokmat,https://www.lokmat.com/city/,27,"Sangli News: वारणा धरणाची गळती रोखण्याचे काम सुरु, ४१ कोटी रुपये निधी खर्च",https://www.lokmat.com/sangli/work-to-stop-leakage-of-warna-dam-the-lifeline-of-sangli-and-kolhapur-districts-begins-funds-of-rs-41-crore-spent-a-a746/,2026-05-11T12:42:24+00:00
Mumbai,Lokmat,Mumbai • Lokmat,https://www.lokmat.com/city/,28,"'जयंत पाटलांनी आईची शपथ घेऊन सांगावं', विशाल पाटलांच्या खासदारकीवरून पडळकरांची टीका",https://www.lokmat.com/sangli/jayant-patil-should-take-his-mothers-oath-and-say-so-padalkars-direct-challenge-on-vishal-patils-mpship-a-a941/,2026-05-11T12:42:24+00:00
Mumbai,Lokmat,Mumbai • Lokmat,https://www.lokmat.com/city/,29,सांगलीतील जलतरण केंद्रात बुडून मुंबईच्या तरुणाचा मृत्यू,https://www.lokmat.com/sangli/mumbai-youth-dies-after-drowning-at-swimming-center-in-sangli-a-a746/,2026-05-11T12:42:24+00:00
Mumbai,Lokmat,Mumbai • Lokmat,https://www.lokmat.com/city/,30,Satara Crime: सरकारी नोकरीच्या आमिषाने ६३ लाखांचा गंडा; विश्वासासाठी तयार केला बनावट शासन निर्णय,https://www.lokmat.com/satara/youths-from-various-areas-including-satara-kolhapur-were-cheated-of-rs-63-lakhs-by-promising-government-jobs-a-a746/,2026-05-11T12:42:24+00:00
Mumbai,Lokmat,Mumbai • Lokmat,https://www.lokmat.com/city/,31,विद्रोही साहित्य संमेलनात शक्तिपीठ महामार्ग रद्दसह विविध ठराव मंजूर,https://www.lokmat.com/maharashtra/various-resolutions-including-cancellation-of-shakti-peeth-highway-passed-at-vidrohi-sahitya-sammelan-in-satara-a-a746/,2026-05-11T12:42:24+00:00
Mumbai,Lokmat,Mumbai • Lokmat,https://www.lokmat.com/city/,32,"कासरथळ येथे ट्रक उलटला; पाचजण गंभीर जखमी, उरमोडी धरणालगत अपघात",https://www.lokmat.com/satara/truck-overturns-in-kasarthal-satara-five-seriously-injured-accident-near-urmodi-dam-a-a719/,2026-05-11T12:42:24+00:00
Mumbai,Lokmat,Mumbai • Lokmat,https://www.lokmat.com/city/,33,घडतंय बिघडतंय : 'कृष्णा'ची निवडणूक दुरंगी की तिरंगी? डॉ. इंद्रजीत मोहितेंची तलवार 'म्यान'? अविनाश मोहितेंची पत्नीच्या हाती 'कमान'!,https://www.lokmat.com/satara/what-is-happening-is-the-election-of-krishna-a-double-edged-sword-or-a-tricolor-dr-indrajit-mohites-sword-sheath-avinash-mohites-bow-in-the-hands-of-his-wife-a-a931-c607/,2026-05-11T12:42:24+00:00
Mumbai,Lokmat,Mumbai • Lokmat,https://www.lokmat.com/city/,34,"भरदिवसा सप्तश्रृंगी ज्वेलर्समध्ये सशस्त्र दरोडा, बंदूक-कोयत्याच्या धाकावर ४०० ग्रॅम सोन्यासह २० लाखांचा ऐवज लंपास!",https://www.lokmat.com/crime/armed-robbery-at-saptashrungi-jewelers-in-broad-daylight-400-grams-of-gold-and-20-lakhs-worth-of-goods-stolen-at-gunpoint-a-a653/,2026-05-11T12:42:24+00:00
Mumbai,Lokmat,Mumbai • Lokmat,https://www.lokmat.com/city/,35,आई-वडील कामावर जाताच शेजाऱ्याचे राक्षसी कृत्य; चिमुकलीवर ६० वर्षाच्या व्यक्तींकडून अत्याचार,https://www.lokmat.com/akola/akola-crime-monstrous-act-as-parents-go-to-work-child-repeatedly-tortured-by-60-year-old-man-living-next-door-a-a571/,2026-05-11T12:42:24+00:00
Mumbai,Lokmat,Mumbai • Lokmat,https://www.lokmat.com/city/,36,"निविष्ठा विक्रीत अनियमितता; तीन कृषी सेवा केंद्रांचे परवाने निलंबित, पाच केंद्रांना नोटीसा",https://www.lokmat.com/akola/irregularities-in-input-sales-licenses-of-three-agricultural-service-centers-suspended-a-a597/,2026-05-11T12:42:24+00:00
Mumbai,Lokmat,Mumbai • Lokmat,https://www.lokmat.com/city/,37,"सूर्य कोपला, विदर्भात तापला! उष्णतेचा कहर; अकोल्यात देशातील सर्वाधिक ४६.९ अंश सेल्सिअस तापमान",https://www.lokmat.com/akola/heatwave-wreaks-havoc-in-vidarbha-akola-records-highest-temperature-in-the-country-over-the-46-plus-degrees-celsius-a-a653/,2026-05-11T12:42:24+00:00
Mumbai,Lokmat,Mumbai • Lokmat,https://www.lokmat.com/city/,38,"दातात पकडून चिमुकल्यावर अघोरी उपचार, अकोल्यातील धक्कादायक प्रकार, व्हिडीओ व्हायरल",https://www.lokmat.com/maharashtra/aghori-treatment-of-a-toddler-by-holding-him-by-the-teeth-shocking-incident-in-akola-video-goes-viral-a-a1012/,2026-05-11T12:42:24+00:00
Mumbai,Lokmat,Mumbai • Lokmat,https://www.lokmat.com/city/,39,कांद्याला मिळाला इनमिन ५० पैसे भाव; ७३ गोणी खर्च वजा जाऊन हाती आले फक्त ४०० रुपये,https://www.lokmat.com/solapur/onions-got-a-minimum-price-of-50-paise-73-sacks-were-sold-and-after-deducting-the-cost-only-rs-400-was-received-a-a941/,2026-05-11T12:42:24+00:00
Mumbai,Lokmat,Mumbai • Lokmat,https://www.lokmat.com/city/,40,पदवी नाही तरी २० वर्षे केली प्रॅक्टिस! रुग्णांच्या जीवाशी खेळणारा बोगस डॉक्टर गजाआड; स्वतःच्याच घरात लपला,https://www.lokmat.com/solapur/1-bogus-doctor-arrested-in-barshi-practiced-medicine-without-degree-for-20-years-a-a1001/,2026-05-11T12:42:24+00:00
Mumbai,Lokmat,Mumbai • Lokmat,https://www.lokmat.com/city/,41,काय सांगता... सर्व विषयांत ३५ गुण! सोलापूरची निकिता कुसेकर दहावी पास,https://www.lokmat.com/solapur/what-can-you-say-35-marks-in-all-subjects-nikita-kusekar-of-solapur-passes-10th-a-a653/,2026-05-11T12:42:24+00:00
Mumbai,Lokmat,Mumbai • Lokmat,https://www.lokmat.com/city/,42,मोठी बातमी! मंगळवेढ्यात कृषी केंद्राला भीषण आग; कोट्यवधींचे झाले नुकसान,https://www.lokmat.com/solapur/in-solapur-massive-fire-breaks-out-at-agricultural-center-in-mangalvedha-losses-worth-crores-a-a629/,2026-05-11T12:42:24+00:00
Mumbai,Lokmat,Mumbai • Lokmat,https://www.lokmat.com/city/,43,"मनोहर भोसले प्रकरण: आरोपीला मोबाइल देणारा पोलिस निलंबित, व्हायरल झालेल्या व्हिडीओनंतर मोठी कारवाई",https://www.lokmat.com/solapur/manohar-bhosale-case-police-officer-who-gave-mobile-to-accused-suspended-major-action-after-viral-video-a-a571/,2026-05-11T12:42:24+00:00
Mumbai,Lokmat,Mumbai • Lokmat,https://www.lokmat.com/city/,44,छत्रपती संभाजीनगर-अहिल्यानगर रेल्वेलाइन ‘डीपीआर’मध्येच; मंजुरी कधी मिळणार?,https://www.lokmat.com/chhatrapati-sambhajinagar/chhatrapati-sambhajinagar-ahilyanagar-railway-line-project-stuck-in-dpr-stage-rs2235-crore-investment-proposed-a-a320/,2026-05-11T12:42:24+00:00
Mumbai,Lokmat,Mumbai • Lokmat,https://www.lokmat.com/city/,45,बोगस दिव्यांग कर्मचाऱ्यांवर उच्च न्यायालयाचा बडगा! राज्यात १२० दिवसांत पडताळणी अनिवार्य,https://www.lokmat.com/ahilyanagar/high-court-slams-bogus-disabled-employees-verification-mandatory-in-the-state-within-120-days-a-a381-c571/,2026-05-11T12:42:24+00:00
Mumbai,Lokmat,Mumbai • Lokmat,https://www.lokmat.com/city/,46,शिंदेसेनेच्या बैठकीत पदाधिकारी भिडले उदय सामंत यांच्यासमोरच घडला प्रकार,https://www.lokmat.com/ahilyanagar/shinde-sena-office-bearers-clashed-in-meeting-in-shirdi-incident-happened-in-front-of-uday-samant-a-a377-c719/,2026-05-11T12:42:24+00:00
Mumbai,Lokmat,Mumbai • Lokmat,https://www.lokmat.com/city/,47,प्रेमसंबंधाचा करुण अंत! मुलीच्या नातेवाईकांच्या मारहाणीमुळे हतबल झालेल्या तरुणाने संपवलं आयुष्य,https://www.lokmat.com/ahilyanagar/ahilyanagar-20-year-old-ends-life-after-being-assaulted-by-girlfriend-relatives-at-village-fair-a-a1001/,2026-05-11T12:42:24+00:00
Mumbai,Lokmat,Mumbai • Lokmat,https://www.lokmat.com/city/,48,"घर बांधण्यासाठी माहेरहून ४ लाख रुपये आण"" सासरच्या जाचाला कंटाळून विवाहितेचं टोकाचं पाऊल",https://www.lokmat.com/ahilyanagar/ahilyangar-bring-4-lakh-rupees-from-maher-to-build-a-house-married-womans-extreme-step-fed-up-with-in-laws-harassment-a-a1012/,2026-05-11T12:42:24+00:00
Mumbai,Lokmat,Mumbai • Lokmat,https://www.lokmat.com/city/,49,दारूचं व्यसन अन् घरही विकलं; जळगावात अखेर पत्नीचा संयम सुटला! मध्यरात्री संतापाच्या भरात पतीला संपवलं,https://www.lokmat.com/jalgaon/accidental-death-turns-into-murder-probe-woman-arrested-for-strangling-alcoholic-husband-in-jalgaon-a-a1001/,2026-05-11T12:42:24+00:00
Mumbai,Lokmat,Mumbai • Lokmat,https://www.lokmat.com/city/,50,फटका कारखान्याला जामनेरनजीक आग,https://www.lokmat.com/jalgaon/fire-hits-factory-near-jamner-a-a607/,2026-05-11T12:42:24+00:00
