city,publisher,source,source_url,rank,headline,link,collected_at_iso
Bengaluru,DC,Bengaluru • DC,https://www.deccanchronicle.com/location/india/karnataka/bengaluru,1,Assembly Elections 2026,https://www.deccanchronicle.com/assembly-elections-2026,2026-04-16T11:10:30+00:00
Bengaluru,DC,Bengaluru • DC,https://www.deccanchronicle.com/location/india/karnataka/bengaluru,2,Opinion and Editorials,https://www.deccanchronicle.com/opinion,2026-04-16T11:10:30+00:00
Bengaluru,DC,Bengaluru • DC,https://www.deccanchronicle.com/location/india/karnataka/bengaluru,3,Telangana Rising 2047,https://www.deccanchronicle.com/tags/Telangana-Rising-2047,2026-04-16T11:10:30+00:00
Mumbai,Mumbai Mirror,Mumbai • Mumbai Mirror,https://mumbaimirror.indiatimes.com/mumbai,1,Let’s end stigma around Type 1 diabetes,https://mumbaimirror.indiatimes.com/you/lets-end-stigma-around-type-1-diabetes/articleshow/130290557.html,2026-04-16T11:10:30+00:00
Mumbai,Mumbai Mirror,Mumbai • Mumbai Mirror,https://mumbaimirror.indiatimes.com/mumbai,2,Kharat’s empire unmasked,https://mumbaimirror.indiatimes.com/mumbai/cover-story/kharats-empire-unmasked/articleshow/130291014.html,2026-04-16T11:10:30+00:00
Mumbai,Mumbai Mirror,Mumbai • Mumbai Mirror,https://mumbaimirror.indiatimes.com/mumbai,3,The brass beats of Bandra,https://mumbaimirror.indiatimes.com/unwind/the-brass-beats-of-bandra/articleshow/130288496.html,2026-04-16T11:10:30+00:00
Mumbai,Mumbai Mirror,Mumbai • Mumbai Mirror,https://mumbaimirror.indiatimes.com/mumbai,4,"Rat bite, mutilation, no compensation",https://mumbaimirror.indiatimes.com/mumbai/rat-bite-mutilation-no-compensation/articleshow/130290963.html,2026-04-16T11:10:30+00:00
Mumbai,Mumbai Mirror,Mumbai • Mumbai Mirror,https://mumbaimirror.indiatimes.com/mumbai,5,"Third deadline, dumped again!",https://mumbaimirror.indiatimes.com/mumbai/third-deadline-dumped-again/articleshow/130291092.html,2026-04-16T11:10:30+00:00
Mumbai,Mumbai Mirror,Mumbai • Mumbai Mirror,https://mumbaimirror.indiatimes.com/mumbai,6,Hosp in dock for denying MRI to rape survivor,https://mumbaimirror.indiatimes.com/mumbai/hosp-in-dock-for-denying-mri-to-rape-survivor/articleshow/130290633.html,2026-04-16T11:10:30+00:00
Mumbai,Mumbai Mirror,Mumbai • Mumbai Mirror,https://mumbaimirror.indiatimes.com/mumbai,7,The business of unaffordable housing,https://mumbaimirror.indiatimes.com/opinion/the-business-of-unaffordable-housing/articleshow/130290628.html,2026-04-16T11:10:30+00:00
Mumbai,Mumbai Mirror,Mumbai • Mumbai Mirror,https://mumbaimirror.indiatimes.com/mumbai,8,Ask The Sexpert,https://mumbaimirror.indiatimes.com/ask-the-sexpert,2026-04-16T11:10:30+00:00
Mumbai,Sakal,Mumbai • Sakal,https://www.esakal.com/pune,1,सकाळ लाईव्ह TV,https://www.esakal.com/live-tv,2026-04-16T11:10:30+00:00
Mumbai,Sakal,Mumbai • Sakal,https://www.esakal.com/pune,2,Refund and Cancellation,https://www.esakal.com/refund-and-cancellation,2026-04-16T11:10:30+00:00
Mumbai,Lokmat,Mumbai • Lokmat,https://www.lokmat.com/city/,1,Live News in Marathi,https://www.lokmat.com/live-news/,2026-04-16T11:10:30+00:00
Mumbai,Lokmat,Mumbai • Lokmat,https://www.lokmat.com/city/,2,"...तर गॅस कनेक्शन बंद होईल' भीती दाखवून दोघांची तब्बल दीड लाखांची फसवणूक, पुण्यातील घटना",https://www.lokmat.com/pune/then-gas-connection-will-be-disconnected-two-cheated-of-rs-15-lakh-incident-in-pune-a-a727/,2026-04-16T11:10:30+00:00
Mumbai,Lokmat,Mumbai • Lokmat,https://www.lokmat.com/city/,3,"८५ वर्षीय वृद्धेला लोखंडी गजाने मारहाण; चोरट्यांचा थरार, जुन्नर तालुक्यातील संतापजनक घटना",https://www.lokmat.com/pune/85-year-old-woman-beaten-with-iron-rod-thieves-shocked-shocking-incident-in-junnar-taluka-a-a727/,2026-04-16T11:10:30+00:00
Mumbai,Lokmat,Mumbai • Lokmat,https://www.lokmat.com/city/,4,पिंपरी -चिंचवड :,https://www.lokmat.com/pimpri-chinchwad/,2026-04-16T11:10:30+00:00
Mumbai,Lokmat,Mumbai • Lokmat,https://www.lokmat.com/city/,5,नाशिक प्रकरणानंतर हिंजवडीतील कंपन्यांमधील महिला तक्रार निवारण समित्यांची होणार तपासणी,https://www.lokmat.com/pimpri-chinchwad/pimpari-chinchwad-women-grievance-redressal-committees-in-companies-will-be-seriously-scrutinized-a-a1008/,2026-04-16T11:10:30+00:00
Mumbai,Lokmat,Mumbai • Lokmat,https://www.lokmat.com/city/,6,Pune Crime: आंबेडकर जयंती कार्यक्रमात नक्षलवादी ‘हिडमा’ गाण्यावर डान्स; BBA च्या दोन विद्यार्थ्यांवर गुन्हा,https://www.lokmat.com/pune/pune-crime-dance-on-naxalite-song-hidma-at-ambedkar-jayanti-program-crime-against-two-bba-students-a-a727/,2026-04-16T11:10:30+00:00
Mumbai,Lokmat,Mumbai • Lokmat,https://www.lokmat.com/city/,7,नाशिकच्या गंभीर प्रकरणानंतर पुण्यातही आयटी कंपन्यांची तपासणी सुरू; नेमकं कारण काय?,https://www.lokmat.com/pune/after-the-serious-case-in-nashik-investigation-of-it-companies-has-started-in-pune-as-well-what-is-the-real-reason-a-a727/,2026-04-16T11:10:30+00:00
Mumbai,Lokmat,Mumbai • Lokmat,https://www.lokmat.com/city/,8,नाट्यगृहांच्या भाडेवाढीला शिंदेसेनेचा तीव्र विरोध; पण पालिका ठाम,https://www.lokmat.com/mumbai/shinde-sena-strongly-opposes-the-increase-in-theater-rent-but-the-municipality-is-firm-a-a301/,2026-04-16T11:10:30+00:00
Mumbai,Lokmat,Mumbai • Lokmat,https://www.lokmat.com/city/,9,"मुंबईत १० टक्के पाणी कपातीचे संकट, १ मे पासून कपात लागू होण्याची शक्यता",https://www.lokmat.com/mumbai/mumbai-faces-10-percent-water-cut-cuts-likely-to-come-into-effect-from-may-1-a-a301/,2026-04-16T11:10:30+00:00
Mumbai,Lokmat,Mumbai • Lokmat,https://www.lokmat.com/city/,10,"सहायक आयुक्तांची दालने पंचतारांकित, प्रभाग समिती अध्यक्षांचे मात्र कोंडवाडे",https://www.lokmat.com/mumbai/the-offices-of-the-assistant-commissioners-are-five-star-but-those-of-the-ward-committee-presidents-are-just-a-shambles-a-a301/,2026-04-16T11:10:30+00:00
Mumbai,Lokmat,Mumbai • Lokmat,https://www.lokmat.com/city/,11,मेरी आवाज सुनो... लॅरिंगोस्कोप आला अन् सगळेच बदलले!,https://www.lokmat.com/mumbai/listen-to-my-voice-the-laryngoscope-came-and-everything-changed-a-a301/,2026-04-16T11:10:30+00:00
Mumbai,Lokmat,Mumbai • Lokmat,https://www.lokmat.com/city/,12,‘ड्रग्ज व्हाया कॉन्सर्ट’ पोलिसांचे दुर्लक्ष झाले का?पोलिसांच्या भूमिकेवर संशयाचे ढग,https://www.lokmat.com/mumbai/did-the-police-ignore-the-drugs-via-concert-doubts-over-the-role-of-the-police-the-youth-dancing-to-the-djs-beats-at-the-event-was-intoxicated-with-drugs-a-a457-c301/,2026-04-16T11:10:30+00:00
Mumbai,Lokmat,Mumbai • Lokmat,https://www.lokmat.com/city/,13,ग्रामीण व शहरी आराेग्य व्यवस्थेची दरी कमी हाेणे आवश्यक : राष्ट्रपती द्रौपदी मुर्मु,https://www.lokmat.com/nagpur/gap-between-rural-and-urban-health-systems-must-be-reduced-president-draupadi-murmu-a-a301/,2026-04-16T11:10:30+00:00
Mumbai,Lokmat,Mumbai • Lokmat,https://www.lokmat.com/city/,14,...आता श्वासातूनच होणार मधुमेह तपासणी!,https://www.lokmat.com/nagpur/now-diabetes-will-be-tested-through-breath-a-a301/,2026-04-16T11:10:30+00:00
Mumbai,Lokmat,Mumbai • Lokmat,https://www.lokmat.com/city/,15,"उद्योगांना झटका; वीज झाली महाग, १ डिसेंबरपासून प्रतियुनिट ९.९० पैशांची झाली वाढ",https://www.lokmat.com/maharashtra/a-blow-to-industries-electricity-has-become-expensive-increased-by-990-paise-per-unit-from-december-1-a-a301/,2026-04-16T11:10:30+00:00
Mumbai,Lokmat,Mumbai • Lokmat,https://www.lokmat.com/city/,16,"भाजपाचे सहा, तर शिंदेसेनेला एक जागा, नागपूर मनपातील भाजपाच्या स्विकृत सदस्यांच्या नावांची घोषणा",https://www.lokmat.com/nagpur/bjp-wins-six-seats-shinde-sena-wins-one-names-of-bjps-accepted-members-in-nagpur-municipal-corporation-announced-a-a571/,2026-04-16T11:10:30+00:00
Mumbai,Lokmat,Mumbai • Lokmat,https://www.lokmat.com/city/,17,"सावधान...! उष्णतेच्या लाटेसारखी स्थिती; विदर्भात ४२, मराठवाडा, मध्य महाराष्ट्रात ३८-४० तर कोकणात ३४-",https://www.lokmat.com/maharashtra/beware-heat-wave-like-conditions-42-degrees-celsius-recorded-in-vidarbha-38-40-in-marathwada-madhya-maharashtra-and-34-36-degrees-celsius-in-konkan-a-a653/,2026-04-16T11:10:30+00:00
Mumbai,Lokmat,Mumbai • Lokmat,https://www.lokmat.com/city/,18,"""अशा गोष्टी घडतच असतात..."" छळ सहन करणाऱ्या तरुणीला TCSच्या महिला अधिकाऱ्यांनीच झापलं!",https://www.lokmat.com/nashik/nashik-tcs-case-such-things-happen-the-young-woman-who-endured-harassment-was-caught-by-female-tcs-officers-a-a1013/,2026-04-16T11:10:30+00:00
Mumbai,Lokmat,Mumbai • Lokmat,https://www.lokmat.com/city/,19,"""बाळ हवं तर तुझ्या बायकोला माझ्याकडे पाठव...""; धर्मांतरासाठी दबाव आणणारी गँग 'असा' करायचा छळ",https://www.lokmat.com/crime/if-you-want-a-baby-send-your-wife-to-me-the-gang-that-pressured-for-conversion-torture-to-men-employee-a-a629/,2026-04-16T11:10:30+00:00
Mumbai,Lokmat,Mumbai • Lokmat,https://www.lokmat.com/city/,20,HR निदा खानच्या WhatsApp चॅटमधून उलगडणार मोठं रहस्य; कसं व्हायचं कर्मचाऱ्यांचं ब्रेनवॉशिंग?,https://www.lokmat.com/nashik/nashik-tcs-religious-conversion-case-hr-executive-nida-khan-brainwash-unique-hiring-process-whatsapp-chat-a-a597/,2026-04-16T11:10:30+00:00
Mumbai,Lokmat,Mumbai • Lokmat,https://www.lokmat.com/city/,21,"TCS HR हेडची किती होती सॅलरी, निदा खानच्या बँक खात्यात आणखी कुठून यायचा पैसा?; तपासाला नवं वळण",https://www.lokmat.com/crime/how-much-was-the-salary-of-tcs-hr-head-where-else-could-the-money-in-nida-khan-bank-account-come-from-new-twist-in-the-investigation-a-a629/,2026-04-16T11:10:30+00:00
Mumbai,Lokmat,Mumbai • Lokmat,https://www.lokmat.com/city/,22,जिल्ह्यात भाजपा संपवण्याचं काम मंत्री मुश्रीफ करताहेत; चंदगडचे आमदार शिवाजी पाटलांचा आरोप,https://www.lokmat.com/kolhapur/minister-hasan-mushrif-is-working-to-eliminate-bjp-in-the-district-mla-shivaji-patil-alleges-a-a629/,2026-04-16T11:10:30+00:00
Mumbai,Lokmat,Mumbai • Lokmat,https://www.lokmat.com/city/,23,"रक्षा विसर्जनासाठी आलेल्यांवर मधमाशांचा हल्ला; शंभराहून अधिक जखमी, दहाहून अधिक गंभीर जखमी",https://www.lokmat.com/kolhapur/bees-attack-those-who-came-for-raksha-visarjan-more-than-a-hundred-injured-kolhapur-news-more-than-ten-seriously-injured-a-a607/,2026-04-16T11:10:30+00:00
Mumbai,Lokmat,Mumbai • Lokmat,https://www.lokmat.com/city/,24,एडिट केलेला फोटो पाठवून तरुणाचं लग्न मोडलं; १० महिन्यांनंतर 'त्या' मेसेजचं सत्य आलं समोर,https://www.lokmat.com/kolhapur/morphed-photos-sent-to-bride-family-break-off-kolhapur-youth-marriage-case-filed-after-10-months-a-a1001/,2026-04-16T11:10:30+00:00
Mumbai,Lokmat,Mumbai • Lokmat,https://www.lokmat.com/city/,25,"मोबाईल दुकानदार होता टार्गेट, बळी गेला व्यापाऱ्याचा; कोल्हापुरात खंडणीसाठी बॅटरीचा शॉक देऊन हत्या",https://www.lokmat.com/kolhapur/vegetable-merchant-abducted-and-murdered-for-25-lakh-ransom-in-shirol-two-arrested-a-a1001/,2026-04-16T11:10:30+00:00
Mumbai,Lokmat,Mumbai • Lokmat,https://www.lokmat.com/city/,26,"बालमैत्रिणीसाठी आशाताई दोनदा आल्या गडहिंग्लजला! महिला बँकेचे उद्घाटन, महाविद्यालयाच्या मदतीसाठी विनामूल्य कार्यक्रम",https://www.lokmat.com/kolhapur/ashatai-came-to-gadhinglaj-twice-for-her-childhood-friend-inauguration-of-womens-bank-free-programs-to-help-the-college-a-a571/,2026-04-16T11:10:30+00:00
Mumbai,Lokmat,Mumbai • Lokmat,https://www.lokmat.com/city/,27,"'राज्य सरकारचा निर्णय एकतर्फी, लोकशाहीविरोधी', बाजार समिती संचालक मंडळ बरखास्तीवर जयंत पाटील संतापले",https://www.lokmat.com/sangli/state-governments-decision-is-unilateral-anti-democratic-jayant-patil-angry-over-the-dismissal-of-the-market-committee-board-of-directors-a-a571/,2026-04-16T11:10:30+00:00
Mumbai,Lokmat,Mumbai • Lokmat,https://www.lokmat.com/city/,28,सांगली हादरली! किरकोळ वादातून पतीने डोक्यात रॉड घालून पत्नीची केली हत्या; मुलाला मित्राकडे सोडून पती फरार,https://www.lokmat.com/sangli/sangli-shocked-husband-kills-wife-by-putting-a-rod-in-her-head-over-a-minor-dispute-husband-absconds-leaving-child-with-friend-a-a941/,2026-04-16T11:10:30+00:00
Mumbai,Lokmat,Mumbai • Lokmat,https://www.lokmat.com/city/,29,"बहिणीला शिवीगाळ, बोअरवेल कामगार विजय पानसेची धारदार शस्त्राने वार करत हत्या, सांगली जिल्ह्यातील घटना",https://www.lokmat.com/sangli/sister-abused-borewell-worker-vijay-panse-stabbed-to-death-with-sharp-weapon-incident-in-sangli-district-a-a571/,2026-04-16T11:10:30+00:00
Mumbai,Lokmat,Mumbai • Lokmat,https://www.lokmat.com/city/,30,"मनोरुग्ण मुलाच्या डोक्यात बापाने दगड घालून केला खून, वाटेगाव येथील घटना",https://www.lokmat.com/sangli/father-kills-mentally-ill-son-by-throwing-stone-at-his-head-incident-in-wategaon-a-a732/,2026-04-16T11:10:30+00:00
Mumbai,Lokmat,Mumbai • Lokmat,https://www.lokmat.com/city/,31,कारचे तुकडे ५०० फूट फेकले गेले; केजच्या तहसीलदारांचा अपघात नेमका कसा झाला?,https://www.lokmat.com/beed/kaij-tehsildar-rakesh-gidde-dies-in-tragic-car-accident-near-renapur-vehicle-overturns-500-feet-a-a320/,2026-04-16T11:10:30+00:00
Mumbai,Lokmat,Mumbai • Lokmat,https://www.lokmat.com/city/,32,संतापजनक! मराठा साम्राज्याचा विस्तार दर्शविणारा नकाशा आठवीच्या पुस्तकातून NCERT ने वगळला,https://www.lokmat.com/maharashtra/ncert-removes-map-showing-expansion-of-maratha-empire-from-8th-standard-textbook-a-a629/,2026-04-16T11:10:30+00:00
Mumbai,Lokmat,Mumbai • Lokmat,https://www.lokmat.com/city/,33,फलटण उपजिल्हा रुग्णालयात उपचार घेणाऱ्या मुलीचा विनयभंग; संशयिताविरुद्ध तक्रार दाखल,https://www.lokmat.com/satara/shocking-18-year-old-patient-molested-inside-phaltan-sub-district-hospital-accused-arrested-a-a1012/,2026-04-16T11:10:30+00:00
Mumbai,Lokmat,Mumbai • Lokmat,https://www.lokmat.com/city/,34,"“शशिकांत शिंदे हे मूळचे शिवसैनिक, शिवसेनेत आल्यास पहिले स्वागत मी करेन”; कुणी दिली ऑफर?",https://www.lokmat.com/maharashtra/shiv-sena-shinde-group-mahesh-shinde-said-shashikant-shinde-is-originally-a-shiv-sainik-if-he-joins-party-i-will-be-the-first-to-welcome-him-a-a719/,2026-04-16T11:10:30+00:00
Mumbai,Lokmat,Mumbai • Lokmat,https://www.lokmat.com/city/,35,"नीलम शिंदेची झुंज संपली, तो कॉल ठरला काळीज चिरणारा; वडिलांना व्हिडीओद्वारे घ्यावे लागणार अंतिम दर्शन",https://www.lokmat.com/satara/neelam-shindes-fight-is-over-that-call-was-heartbreaking-father-will-have-to-have-his-last-darshan-via-video-call-a-a571/,2026-04-16T11:10:30+00:00
Mumbai,Lokmat,Mumbai • Lokmat,https://www.lokmat.com/city/,36,सभापती निवडीत भाजपचीच बाजी; राष्ट्रवादीच्या फुटलेल्या दोघींना संधी,https://www.lokmat.com/satara/bjp-wins-in-speaker-election-ncps-two-split-candidates-get-a-chance-a-a1013/,2026-04-16T11:10:30+00:00
Mumbai,Lokmat,Mumbai • Lokmat,https://www.lokmat.com/city/,37,अकोल्यात उष्माघाताचा पहिला बळी? ४४ अंश तापमानाने घेतला जीव; ऑटोमध्ये आढळला मृतदेह,https://www.lokmat.com/akola/first-victim-of-heatstroke-in-akola-44-degree-temperature-claimed-his-life-body-found-in-auto-a-a941/,2026-04-16T11:10:30+00:00
Mumbai,Lokmat,Mumbai • Lokmat,https://www.lokmat.com/city/,38,"विदर्भात पारा ५ अंशांनी वाढला; अकोला जिल्हा सर्वाधिक ‘हॉट’,थंड हवेचे ठिकाण बुलढाणाही तापले",https://www.lokmat.com/akola/mercury-rises-by-5-degrees-in-vidarbha-akola-district-is-the-hottest-a-a301/,2026-04-16T11:10:30+00:00
Mumbai,Lokmat,Mumbai • Lokmat,https://www.lokmat.com/city/,39,अकोला पोलीस दलात खळबळ! महिला आरोपीकडे मुलीची मागणी करणाऱ्या सहाय्यक पोलीस निरीक्षकाचे निलंबन,https://www.lokmat.com/akola/api-rajesh-jadhav-akola-police-officer-suspended-for-demanding-physical-pleasure-from-arrested-female-accused-a-a400-c607/,2026-04-16T11:10:30+00:00
Mumbai,Lokmat,Mumbai • Lokmat,https://www.lokmat.com/city/,40,गॅसटंचाईचा पहिला बळी अकोल्यात; सिलिंडरसाठी रांगेत असताना माजी सरपंचाचा मृत्यू,https://www.lokmat.com/akola/first-victim-of-gas-shortage-in-akola-former-sarpanch-dies-while-waiting-in-line-for-cylinder-a-a1001/,2026-04-16T11:10:30+00:00
Mumbai,Lokmat,Mumbai • Lokmat,https://www.lokmat.com/city/,41,शिंदेंच्या चार नगरसेवकांचे सदस्यत्व धोक्यात? उद्धवसेनेकडून अपात्र ठरवण्याची याचिका दाखल,https://www.lokmat.com/akola/membership-of-four-shinde-corporators-in-jeopardy-uddhav-sena-files-petition-to-disqualify-them-a-a571/,2026-04-16T11:10:30+00:00
Mumbai,Lokmat,Mumbai • Lokmat,https://www.lokmat.com/city/,42,झेंडावंदनाचं स्वप्न अन् मायक्रोसॉफ्टचं लाखोंचं पॅकेज नाकारलं; सोलापूरच्या नव्या सीईओंचा थक्क करणारा प्रवास!,https://www.lokmat.com/solapur/from-microsoft-to-ias-kushal-jain-quits-high-paying-tech-job-to-serve-the-nation-a-a1001/,2026-04-16T11:10:30+00:00
Mumbai,Lokmat,Mumbai • Lokmat,https://www.lokmat.com/city/,43,"""मला वाटतं अशोक खरातचा एन्काऊंटर करतील, कारण...!""; प्रणिती शिंदे यांनी व्यक्त केली वेगळीच शंका",https://www.lokmat.com/maharashtra/i-think-ashok-will-do-an-encounter-with-kharat-praniti-shinde-expressed-a-different-doubt-a-a653/,2026-04-16T11:10:30+00:00
Mumbai,Lokmat,Mumbai • Lokmat,https://www.lokmat.com/city/,44,"मोठी बातमी; सोलापूरचा पारा ४२.५ अंशांवर; सूर्य ओकतोय आग, जनजीवन विस्कळीत !",https://www.lokmat.com/solapur/big-news-solapurs-temperature-at-425-degrees-a-a732/,2026-04-16T11:10:30+00:00
Mumbai,Lokmat,Mumbai • Lokmat,https://www.lokmat.com/city/,45,केंद्र अन् राज्य सरकारच्या लोककल्याणकारी योजना वांझ ठरताहेत; डॉ. श्रीपाल सबनीस यांचा घणाघात,https://www.lokmat.com/solapur/the-welfare-schemes-of-the-central-and-state-governments-are-proving-fruitless-dr-shripal-sabniss-attack-a-a571/,2026-04-16T11:10:30+00:00
Mumbai,Lokmat,Mumbai • Lokmat,https://www.lokmat.com/city/,46,मोठी बातमी; साेलापुरात उच्चांकी तापमानाची नोंद; पारा पोहोचला ४१.४ अंश सेल्सिअसवर,https://www.lokmat.com/solapur/big-news-highest-temperature-recorded-in-solapur-mercury-reaches-414-degrees-celsius-a-a1013/,2026-04-16T11:10:30+00:00
Mumbai,Lokmat,Mumbai • Lokmat,https://www.lokmat.com/city/,47,"चाकणकरांच्या बहिणीची ८ तास चौकशी, ६० कोटींच्या उलाढालीवर म्हणाल्या, "" बातमी कळली तेव्हा...""",https://www.lokmat.com/ahilyanagar/police-question-pratibha-chakankar-for-8-hours-in-fake-bank-account-case-a-a1001/,2026-04-16T11:10:30+00:00
Mumbai,Lokmat,Mumbai • Lokmat,https://www.lokmat.com/city/,48,"'पतसंस्थेतील बँक खाती बनावट, सह्या सुद्धा खोट्या'; प्रतिभा चाकणकर पहिल्यांदाच अशोक खरात प्रकरणावर बोलल्या",https://www.lokmat.com/ahilyanagar/bank-accounts-in-credit-institutions-are-fake-signatures-are-also-fake-pratibha-chakankar-speaks-for-the-first-time-on-ashok-kharat-case-a-a571/,2026-04-16T11:10:30+00:00
Mumbai,Lokmat,Mumbai • Lokmat,https://www.lokmat.com/city/,49,"रुपाली चाकणकर यांची बहीण प्रतिभा चाकणकरांची चौकशी होणार,पोलिसांनी बजावली नोटीस",https://www.lokmat.com/ahilyanagar/ashok-kharat-case-rupali-chakankars-sister-pratibha-chakankar-will-be-questioned-police-issued-notice-a-a571/,2026-04-16T11:10:30+00:00
Mumbai,Lokmat,Mumbai • Lokmat,https://www.lokmat.com/city/,50,"'चाकणकर' खात्यातून २.४० कोटींची उलाढाल, चार्जशीटमधून नाव वगळले; खरातच्या अडचणी वाढणार",https://www.lokmat.com/ahilyanagar/fraudster-baba-ashok-kharat-under-lens-suspicious-transactions-uncovered-re-investigation-sought-in-staff-death-case-a-a1001/,2026-04-16T11:10:30+00:00
Mumbai,Lokmat,Mumbai • Lokmat,https://www.lokmat.com/city/,51,टँकरचे सील तोडून विमान इंधनाची चोरी; टोळीला अहिल्यानगर स्थानिक गुन्हे शाखेकडून अटक,https://www.lokmat.com/crime/jet-fuel-theft-by-breaking-tanker-seal-gang-arrested-by-ahilyanagar-local-crime-branch-a-a747/,2026-04-16T11:10:30+00:00
