city,publisher,source,source_url,rank,headline,link,collected_at_iso
Delhi-NCR,Jagran,Delhi-NCR • Jagran,https://www.jagran.com/delhi-ncr,28,"गाजियाबाद: कल्लूगढ़ी में सरकारी जमीन पर बने अवैध मदरसे पर चला बुलडोजर, 400 अन्य भी निशाने पर",https://www.jagran.com/uttar-pradesh/ghaziabad-ghaziabad-illegal-madrasa-demolished-in-kallugarhi-khora-40261210.html,2026-06-03T21:21:56+00:00
Delhi-NCR,Jagran,Delhi-NCR • Jagran,https://www.jagran.com/delhi-ncr,29,"गाजियाबाद में एक हजार से ज्यादा बुजुर्गों को 5 महीने से नहीं मिली पेंशन, निजी खर्च चलाना हो रहा मुश्किल",https://www.jagran.com/uttar-pradesh/ghaziabad-ghaziabad-elderly-pension-delay-1000-suffer-for-5-months-40261208.html,2026-06-03T21:21:56+00:00
Delhi-NCR,Jagran,Delhi-NCR • Jagran,https://www.jagran.com/delhi-ncr,30,"गाजियाबाद की हम तुम रोड बनी मौत का रास्ता, सात सोसायटियों के हजारों लोग परेशान",https://www.jagran.com/uttar-pradesh/ghaziabad-hum-tum-road-ghaziabad-residents-suffer-demand-urgent-repair-40260878.html,2026-06-03T21:21:56+00:00
Delhi-NCR,Jagran,Delhi-NCR • Jagran,https://www.jagran.com/delhi-ncr,31,"120 की स्पीड में लेन बदलते ही कटेगी आपकी जेब, दिल्ली-मुंबई एक्सप्रेसवे से गुजरने से पहले जान लें नया अपडेट",https://www.jagran.com/haryana/gurgaon-delhimumbai-expressway-lane-change-fines-imminent-40261750.html,2026-06-03T21:21:56+00:00
Delhi-NCR,Jagran,Delhi-NCR • Jagran,https://www.jagran.com/delhi-ncr,32,"दिल्ली रेस्टोरेंट अग्निकांड में उजड़ गया गुरुग्राम का परिवार, CA समेत 8 लोगों की दर्दनाक मौत",https://www.jagran.com/haryana/gurgaon-gurugram-family-devastated-in-delhi-restaurant-fire-ca-6-others-dead-40261308.html,2026-06-03T21:21:56+00:00
Delhi-NCR,Jagran,Delhi-NCR • Jagran,https://www.jagran.com/delhi-ncr,33,"पटौदी: त्रुटिरहित मतदाता सूची के लिए विशेष पुनरीक्षण अभियान शुरू, 15 जून से घर-घर जाएंगे बीएलओ",https://www.jagran.com/haryana/gurgaon-pataudi-voter-list-revision-campaign-2026-key-dates-process-40261320.html,2026-06-03T21:21:56+00:00
Delhi-NCR,Jagran,Delhi-NCR • Jagran,https://www.jagran.com/delhi-ncr,34,"गुरुग्राम में इनामी बदमाश मुठभेड़ के बाद गिरफ्तार, बुलेटप्रूफ जैकेट ने बचाई पुलिसकर्मी की जान",https://www.jagran.com/haryana/gurgaon-gurugram-encounter-5k-reward-criminal-nitin-arrested-cop-saved-40260941.html,2026-06-03T21:21:56+00:00
Delhi-NCR,Jagran,Delhi-NCR • Jagran,https://www.jagran.com/delhi-ncr,35,"गुरुग्राम में जमीन विवाद से तंग आकर व्यक्ति ने की आत्महत्या, सुसाइड वीडियो में किया खुलासा",https://www.jagran.com/haryana/gurgaon-gurugram-man-suicides-over-land-dispute-blames-accused-40260916.html,2026-06-03T21:21:56+00:00
Delhi-NCR,Jagran,Delhi-NCR • Jagran,https://www.jagran.com/delhi-ncr,36,"जर्मनी ने भारतीय नागरिकों के लिए ट्रांजिट वीजा की अनिवार्यता हटाई, निर्यातकों में खुशी",https://www.jagran.com/uttar-pradesh/noida-germany-waives-transit-visa-for-indians-exporters-rejoice-40261847.html,2026-06-03T21:21:56+00:00
Delhi-NCR,Jagran,Delhi-NCR • Jagran,https://www.jagran.com/delhi-ncr,37,"नोएडा सेक्टर-150 की सोसायटियों में एसटीपी बंद, प्रदूषण बोर्ड ने बिल्डरों को भेजा नोटिस",https://www.jagran.com/uttar-pradesh/noida-noida-sector-150-4-societies-stps-shut-pollution-board-issues-notice-40261844.html,2026-06-03T21:21:56+00:00
Delhi-NCR,Jagran,Delhi-NCR • Jagran,https://www.jagran.com/delhi-ncr,38,"जनगणना में सबसे निचले पायदान पर गौतमबुद्धनगर, नोएडा में एक प्रतिशत ऑनलाइन हुई एचएलबी",https://www.jagran.com/uttar-pradesh/noida-gautam-buddh-nagar-census-lag-noidas-hlb-online-at-1-40261803.html,2026-06-03T21:21:56+00:00
Delhi-NCR,Jagran,Delhi-NCR • Jagran,https://www.jagran.com/delhi-ncr,39,"यमुना एक्सप्रेसवे से नोएडा एयरपोर्ट जाना अब होगा बेहद आसान, 10 जून से शुरू हो रहे इलेक्ट्रिक बसों के 3 नए रूट",https://www.jagran.com/uttar-pradesh/noida-yeida-electric-bus-service-starts-june-10-3-routes-40261773.html,2026-06-03T21:21:56+00:00
Delhi-NCR,Jagran,Delhi-NCR • Jagran,https://www.jagran.com/delhi-ncr,40,"यूपी बोर्ड परीक्षा के लिए 75 प्रतिशत उपस्थिति अनिवार्य, नई गाइडलाइन जारी",https://www.jagran.com/uttar-pradesh/noida-up-board-75-attendance-mandatory-for-exams-new-guidelines-40261813.html,2026-06-03T21:21:56+00:00
Delhi-NCR,Jagran,Delhi-NCR • Jagran,https://www.jagran.com/delhi-ncr,41,"'प्लीज हमें बचा लो...', ऊपरी मंजिलों से लोग रोते हुए चिल्ला रहे थे, प्रत्यक्षदर्शियों ने बयां किया भयावह मंजर",https://www.jagran.com/delhi/new-delhi-city-malviya-nagar-fire-eyewitnesses-recall-horrific-scenes-40261867.html,2026-06-03T21:21:56+00:00
Delhi-NCR,Jagran,Delhi-NCR • Jagran,https://www.jagran.com/delhi-ncr,42,"मालवीय नगर अग्निकांड: रियाजुद्दीन के गद्दों ने बचाई कई जिंदगियां, सीपीआर देकर तीन युवकों ने नौ को बचाया",https://www.jagran.com/delhi/new-delhi-city-hauz-rani-hotel-fire-locals-heroically-rescue-trapped-guests-40261855.html,2026-06-03T21:21:56+00:00
Delhi-NCR,Jagran,Delhi-NCR • Jagran,https://www.jagran.com/delhi-ncr,43,"मालवीय नगर अग्निकांड के बाद दिल्ली सरकार सख्त, रिहायशी क्षेत्रों में अवैध व्यावसायीकरण पर होगी कार्रवाई",https://www.jagran.com/delhi/new-delhi-city-ashish-sood-zero-tolerance-for-illegal-bbs-after-delhi-fire-40261849.html,2026-06-03T21:21:56+00:00
Delhi-NCR,Jagran,Delhi-NCR • Jagran,https://www.jagran.com/delhi-ncr,44,"मालवीय नगर अग्निकांड: 21 लोगों की मौत धुएं से दम घुटने के कारण, मृतकों में 12 विदेशी नागरिक",https://www.jagran.com/delhi/new-delhi-city-malviya-nagar-hotel-fire-21-died-from-smoke-12-foreigners-among-victims-40261840.html,2026-06-03T21:21:56+00:00
Delhi-NCR,Jagran,Delhi-NCR • Jagran,https://www.jagran.com/delhi-ncr,45,"रसोई का बजट बदलेगा? फरीदाबाद में बदले फल-सब्जियों के दाम, एक क्लिक में जानिए डबुआ मंडी के नए रेट",https://www.jagran.com/haryana/faridabad-faridabad-dabua-mandi-fruit-veg-prices-fluctuate-today-40261821.html,2026-06-03T21:21:56+00:00
Delhi-NCR,Jagran,Delhi-NCR • Jagran,https://www.jagran.com/delhi-ncr,46,"फरीदाबाद: कार्रवाई के नाम पर सिर्फ नोटिस तक सिमटा विभाग, उधर प्ले स्कूलों में फिर हो गए दाखिले",https://www.jagran.com/haryana/faridabad-faridabad-play-schools-defy-norms-only-7-registered-40261530.html,2026-06-03T21:21:56+00:00
Delhi-NCR,Jagran,Delhi-NCR • Jagran,https://www.jagran.com/delhi-ncr,47,"फरीदाबाद में अज्ञात ने खड़ी कार को लगाई आग, CCTV कैमरे में कैद हुआ संदिग्ध",https://www.jagran.com/haryana/faridabad-faridabad-car-fire-suspect-caught-on-cctv-setting-vehicle-ablaze-40261502.html,2026-06-03T21:21:56+00:00
Delhi-NCR,Jagran,Delhi-NCR • Jagran,https://www.jagran.com/delhi-ncr,48,फरीदाबाद में रात होते ही क्यों बढ़ा महिलाओं का डर? दैनिक जागरण की पड़ताल में खुली पोल,https://www.jagran.com/haryana/faridabad-faridabad-dark-streets-womens-safety-at-risk-due-to-no-lights-40261333.html,2026-06-03T21:21:56+00:00
Delhi-NCR,Jagran,Delhi-NCR • Jagran,https://www.jagran.com/delhi-ncr,49,"नेहरू कॉलोनी में निगम ने शुरू की तोड़फोड़, फरीदाबाद-गुरुग्राम रोड को किया बंद",https://www.jagran.com/haryana/faridabad-faridabad-demolition-nehru-colony-houses-razed-for-road-widening-40260859.html,2026-06-03T21:21:56+00:00
Delhi-NCR,Jagran,Delhi-NCR • Jagran,https://www.jagran.com/delhi-ncr,50,"पलवल के मलाई गांव में खूनी संघर्ष: चारदीवारी कर रहे बुजुर्ग और बेटों पर जानलेवा हमला, चार गंभीर रूप से घायल",https://www.jagran.com/haryana/palwal-palwal-land-dispute-family-attacked-with-axes-4-injured-40261307.html,2026-06-03T21:21:56+00:00
Delhi-NCR,Jagran,Delhi-NCR • Jagran,https://www.jagran.com/delhi-ncr,51,"कूड़े के ढेर से मिलेगी मुक्ति, पलवल को चमकाने के लिए सरकार खर्च कर रही 113 करोड़; मेगा प्लान तैयार",https://www.jagran.com/haryana/palwal-palwal-sanitation-overhaul-113-cr-plan-for-clean-city-40260243.html,2026-06-03T21:21:56+00:00
Delhi-NCR,Jagran,Delhi-NCR • Jagran,https://www.jagran.com/delhi-ncr,52,"85 साल की सास को टब में बैठाकर कराई बृज 84 कोस परिक्रमा, बहू प्रीति चौधरी की हर ओर हो रही तारीफ",https://www.jagran.com/haryana/palwal-braj-84-kosi-parikrama-preeti-chaudhary-devotion-to-mother-in-law-40260331.html,2026-06-03T21:21:56+00:00
Delhi-NCR,Jagran,Delhi-NCR • Jagran,https://www.jagran.com/delhi-ncr,53,"पलवल में सरपंच के दबाव में चालू की आटा चक्की, बृज 84 कोस परिक्रमा का प्रसाद बना रहे हलवाई की पाटा फटने से मौत",https://www.jagran.com/haryana/palwal-palwal-flour-mill-burst-kills-halwai-sarpanch-blamed-40260128.html,2026-06-03T21:21:56+00:00
Delhi-NCR,Jagran,Delhi-NCR • Jagran,https://www.jagran.com/delhi-ncr,54,"चोरी की कार के साथ पलवल में दबोचा गया बदमाश, गुरुग्राम से चोरी हुई थी ईको कार",https://www.jagran.com/haryana/palwal-palwal-police-arrest-car-thief-with-gurugram-stolen-eco-car-40259844.html,2026-06-03T21:21:56+00:00
Delhi-NCR,Jagran,Delhi-NCR • Jagran,https://www.jagran.com/delhi-ncr,55,"गिरफ्तारी के कारणों की जानकारी न देना चिंताजनक, इलाहाबाद HC ने पुलिस को लगाई फटकार",https://www.jagran.com/uttar-pradesh/prayagraj-allahabad-hc-slams-police-over-arrest-reasons-grants-bail-40261878.html,2026-06-03T21:21:56+00:00
Delhi-NCR,Jagran,Delhi-NCR • Jagran,https://www.jagran.com/delhi-ncr,56,"यूपी में शुद्ध हवा के लिए 15 क्षेत्रीय ज्ञान केंद्रों के बीच एमओयू, पांच साल में हजारों युवाओं को दी जाएगी ट्रेनिंग",https://www.jagran.com/uttar-pradesh/lucknow-city-up-clean-air-and-green-skills-mou-for-5-year-youth-training-40261872.html,2026-06-03T21:21:56+00:00
Delhi-NCR,Jagran,Delhi-NCR • Jagran,https://www.jagran.com/delhi-ncr,57,"यूपी में वित्तविहीन स्कूलों को राहत की तैयारी, मान्यता के नियमों में होगा बदलाव",https://www.jagran.com/uttar-pradesh/lucknow-city-up-big-changes-in-unaided-school-recognition-rules-proposed-40261787.html,2026-06-03T21:21:56+00:00
Delhi-NCR,Jagran,Delhi-NCR • Jagran,https://www.jagran.com/delhi-ncr,58,"यूपी परिवहन विभाग की ओटीएस योजना को नहीं मिली मंजूरी, 35% की छूट पर कैबिनेट ने जताई आपत्ति",https://www.jagran.com/uttar-pradesh/lucknow-city-up-transport-ots-scheme-rejected-cabinet-objects-to-35-percent-tax-discount-40261843.html,2026-06-03T21:21:56+00:00
Delhi-NCR,Jagran,Delhi-NCR • Jagran,https://www.jagran.com/delhi-ncr,59,"'नवाबों से नहीं, लक्ष्मण जी से है लखनऊ की पहचान', पद्मविभूषण रामभद्राचार्य",https://www.jagran.com/uttar-pradesh/lucknow-city-rambhadracharya-lucknows-identity-is-lakshman-not-nawabs-40261856.html,2026-06-03T21:21:56+00:00
Delhi-NCR,Jagran,Delhi-NCR • Jagran,https://www.jagran.com/delhi-ncr,60,"यूपी लोक सेवा अधिकरण के अध्यक्ष, उपाध्यक्ष और सदस्यों की बढ़ी आयु सीमा, कैबिनेट बैठक में मिली मंजूरी",https://www.jagran.com/uttar-pradesh/lucknow-city-up-public-service-tribunal-age-limit-increased-by-yogi-govt-40261862.html,2026-06-03T21:21:56+00:00
Delhi-NCR,Jagran,Delhi-NCR • Jagran,https://www.jagran.com/delhi-ncr,61,"मॉर्निंग वॉक में हरदोई DM ने पकड़ा जल निगम का ‘जलता राज’, ग्रामीण पेयजल योजनाओं की सामग्री को किया जा रहा था नष्ट",https://www.jagran.com/uttar-pradesh/hardoi-hardoi-dm-exposes-jal-nigam-rural-water-scheme-materials-burned-40261863.html,2026-06-03T21:21:56+00:00
Delhi-NCR,Jagran,Delhi-NCR • Jagran,https://www.jagran.com/delhi-ncr,62,"बुलंदशहर में उन्नाव की युवती की हत्या कर खालौर स्टेडियम के पास फेंका था शव, आरोपी ने कराई पहचान",https://www.jagran.com/uttar-pradesh/bulandshahr-unnao-woman-murder-accused-identifies-body-in-bulandshahr-40261852.html,2026-06-03T21:21:56+00:00
Delhi-NCR,Jagran,Delhi-NCR • Jagran,https://www.jagran.com/delhi-ncr,63,"बिजनौर में हथियारों की वीडियो वायरल होने के मामले में तीन की जमानत निरस्त, देश विरोधी गतिविधियों का कनेक्शन",https://www.jagran.com/uttar-pradesh/bijnor-bijnor-bail-denied-for-3-in-weapon-video-anti-national-links-case-40261851.html,2026-06-03T21:21:56+00:00
Delhi-NCR,Jagran,Delhi-NCR • Jagran,https://www.jagran.com/delhi-ncr,64,"शूटर गोविंद मर्डर केस में मुजफ्फरपुर पुलिस को ब्रेक थ्रू, हि",https://www.jagran.com/bihar/muzaffarpur-shooter-govind-sharma-murder-case-history-sheeter-onkar-singh-arrested-40261413.html,2026-06-03T21:21:56+00:00
Delhi-NCR,Jagran,Delhi-NCR • Jagran,https://www.jagran.com/delhi-ncr,65,जौनपुर में ग्राहक बन पहुंचे एएसपी ने छापेमारी कर बरामद किया,https://www.jagran.com/uttar-pradesh/jaunpur-asp-recovered-two-quintals-of-34-kg-banned-dohara-in-jaunpur-40261417.html,2026-06-03T21:21:56+00:00
Delhi-NCR,Jagran,Delhi-NCR • Jagran,https://www.jagran.com/delhi-ncr,66,जालौन: बिजली संकट में पानी के लिए सोलर टंकी प्लांट बना सहारा,https://www.jagran.com/uttar-pradesh/jalaun-jalaun-power-outage-solar-plants-solve-water-crisis-in-10-villages-40261415.html,2026-06-03T21:21:56+00:00
Delhi-NCR,Jagran,Delhi-NCR • Jagran,https://www.jagran.com/delhi-ncr,67,मौजूदा ग्राम प्रधानों का कार्यकाल छह महीने आगे बढ़ाने पर हाई,https://www.jagran.com/uttar-pradesh/lucknow-city-allahabad-high-court-lucknow-bench-is-strict-on-up-panchayat-chunav-asked-government-to-tell-dates-when-will-up-panchayat-elections-be-held-gram-pradhan-and-administrator-case-40261409.html,2026-06-03T21:21:56+00:00
Delhi-NCR,Jagran,Delhi-NCR • Jagran,https://www.jagran.com/delhi-ncr,68,मानसून से पहले युद्ध स्तर पर नालों की सफाई का दावा कर रहा JM,https://www.jagran.com/jammu-and-kashmir/jammu-jammu-monsoon-prep-jmc-drain-cleaning-claims-vs-ground-reality-40261399.html,2026-06-03T21:21:56+00:00
Delhi-NCR,Jagran,Delhi-NCR • Jagran,https://www.jagran.com/delhi-ncr,69,Gold Silver Price Today LIVE: वैश्विक बाजार से दिल्ली सराफा,https://www.jagran.com/business/commodity-gold-price-today-3rd-june-2026-latest-gold-rate-silver-price-and-mcx-updates-across-india-lb-30000563.html,2026-06-03T21:21:56+00:00
Delhi-NCR,Jagran,Delhi-NCR • Jagran,https://www.jagran.com/delhi-ncr,70,"Kangana Ranaut की नई फिल्म का भाग्य बिगाड़ेगी हॉरर थ्रिलर, ब",https://www.jagran.com/entertainment/bollywood-vikram-bhatt-haunted-3d-ghosts-of-the-past-all-set-clash-with-kangana-ranaut-bharat-bhhagya-viddhaata-40261395.html,2026-06-03T21:21:56+00:00
Delhi-NCR,Jagran,Delhi-NCR • Jagran,https://www.jagran.com/delhi-ncr,71,"NCR में PUC सर्ट‍िफ‍िकेट के बिना नहीं मिलेगा पेट्रोल-डीजल, य",https://www.jagran.com/uttar-pradesh/lucknow-city-up-govts-plan-to-cut-ncr-air-pollution-by-35-no-puc-no-fuel-40261396.html,2026-06-03T21:21:56+00:00
Delhi-NCR,Jagran,Delhi-NCR • Jagran,https://www.jagran.com/delhi-ncr,72,"'दो गज की दूरी...' वाले तंज से अधीर रंजन का BJP पर हमला, बोल",https://www.jagran.com/west-bengal/kolkata-adhir-ranjan-mocks-bjp-on-rebel-tmc-mlas-with-do-gaj-ki-doori-40261406.html,2026-06-03T21:21:56+00:00
Delhi-NCR,Jagran,Delhi-NCR • Jagran,https://www.jagran.com/delhi-ncr,73,"इन 2 मूलांक वालों के साथ भूलकर भी न करें पार्टनरशिप, वरना बि",https://www.jagran.com/astrology/numerology-numerology-why-mulank-4-8-should-avoid-business-partnerships-40261405.html,2026-06-03T21:21:56+00:00
Delhi-NCR,Jagran,Delhi-NCR • Jagran,https://www.jagran.com/delhi-ncr,74,TMC में बगावत की असली वजह कौन? ममता या अभिषेक बनर्जी... तृणमूल में उत्तराधिकार की लड़ाई,https://www.jagran.com/politics/national-tmc-succession-battle-abhishek-banerjee-vs-mamatas-legacy-40261761.html,2026-06-03T21:21:56+00:00
Delhi-NCR,Jagran,Delhi-NCR • Jagran,https://www.jagran.com/delhi-ncr,75,8th Pay Commission: क्या है मिनिमम सैलरी के लिए '3490 कैलोरी' का नया फॉर्मूला? कर्मचारी यूनियनों की बड़ी मांग; समझिए गणित,https://www.jagran.com/business/biz-what-is-8th-pay-commission-3490-calorie-formula-for-minimum-wage-hike-40257853.html,2026-06-03T21:21:56+00:00
Delhi-NCR,Jagran,Delhi-NCR • Jagran,https://www.jagran.com/delhi-ncr,76,तीसरी बार शादी करने के लिए तैयार Aamir Khan? गौरी स्प्रैट को इस दिन बनाएंगे अपना हमसफर,https://www.jagran.com/entertainment/bollywood-aamir-khan-to-marry-gauri-spratt-in-intimate-ceremony-on-5-july-40261359.html,2026-06-03T21:21:56+00:00
Delhi-NCR,Jagran,Delhi-NCR • Jagran,https://www.jagran.com/delhi-ncr,77,Did You Know,https://www.jagran.com/did-you-know-news-hindi.html,2026-06-03T21:21:56+00:00
Delhi-NCR,Jagran,Delhi-NCR • Jagran,https://www.jagran.com/delhi-ncr,78,मिडिल ईस्ट संकट,https://www.jagran.com/topics/Israel-Iran-Conflict,2026-06-03T21:21:56+00:00
Delhi-NCR,Jagran,Delhi-NCR • Jagran,https://www.jagran.com/delhi-ncr,79,Submit your news,https://www.jagran.com/citizen-journalism-hindi.html,2026-06-03T21:21:56+00:00
Delhi-NCR,Jagran,Delhi-NCR • Jagran,https://www.jagran.com/delhi-ncr,80,Message from the Editor,https://www.jagran.com/policies-and-standards.html,2026-06-03T21:21:56+00:00
Hyderabad,DC,Hyderabad • DC,https://www.deccanchronicle.com/location/india/southern-states,1,Opinion and Editorials,https://www.deccanchronicle.com/opinion,2026-06-03T21:21:56+00:00
Hyderabad,DC,Hyderabad • DC,https://www.deccanchronicle.com/location/india/southern-states,2,Assembly Elections 2026,https://www.deccanchronicle.com/assembly-elections-2026,2026-06-03T21:21:56+00:00
Hyderabad,DC,Hyderabad • DC,https://www.deccanchronicle.com/location/india/southern-states,3,Telangana Rising 2047,https://www.deccanchronicle.com/tags/Telangana-Rising-2047,2026-06-03T21:21:56+00:00
Chennai,DC,Chennai • DC,https://www.deccanchronicle.com/location/india/tamil-nadu/chennai-madras,1,Opinion and Editorials,https://www.deccanchronicle.com/opinion,2026-06-03T21:21:56+00:00
Chennai,DC,Chennai • DC,https://www.deccanchronicle.com/location/india/tamil-nadu/chennai-madras,2,Assembly Elections 2026,https://www.deccanchronicle.com/assembly-elections-2026,2026-06-03T21:21:56+00:00
Chennai,DC,Chennai • DC,https://www.deccanchronicle.com/location/india/tamil-nadu/chennai-madras,3,Telangana Rising 2047,https://www.deccanchronicle.com/tags/Telangana-Rising-2047,2026-06-03T21:21:56+00:00
Chennai,The Hindu,Chennai • The Hindu,https://www.thehindu.com/news/cities/chennai/,1,"S&N by Shantnu Nikhil brings prestige-pret fashion to Chennai, debuts new store",https://www.thehindu.com/life-and-style/fashion/sn-by-shantnu-nikhil-brings-prestige-pret-fashion-to-chennai-debuts-new-store/article71054457.ece,2026-06-03T21:21:56+00:00
Chennai,The Hindu,Chennai • The Hindu,https://www.thehindu.com/news/cities/chennai/,2,"Chennai Corporation to begin immunising stray, pet dogs against rabies in August",https://www.thehindu.com/news/cities/chennai/chennai-corporation-to-begin-immunising-stray-pet-dogs-against-rabies-in-august/article71053974.ece,2026-06-03T21:21:56+00:00
Chennai,The Hindu,Chennai • The Hindu,https://www.thehindu.com/news/cities/chennai/,3,Three held for smuggling ganja from Andhra Pradesh,https://www.thehindu.com/news/cities/chennai/three-held-for-smuggling-ganja-from-andhra-pradesh/article71054158.ece,2026-06-03T21:21:56+00:00
Chennai,The Hindu,Chennai • The Hindu,https://www.thehindu.com/news/cities/chennai/,4,Farmers who gave land for Parandur airport face uncertainty,https://www.thehindu.com/news/cities/chennai/farmers-who-gave-land-for-parandur-airport-face-uncertainty/article71053240.ece,2026-06-03T21:21:56+00:00
Chennai,The Hindu,Chennai • The Hindu,https://www.thehindu.com/news/cities/chennai/,5,Minor girl injured in hit-and-run on Chennai’s Koyambedu flyover dies,https://www.thehindu.com/news/cities/chennai/minor-girl-injured-in-hit-and-run-on-chennais-koyambedu-flyover-dies/article71055514.ece,2026-06-03T21:21:56+00:00
Chennai,The Hindu,Chennai • The Hindu,https://www.thehindu.com/news/cities/chennai/,6,"As screens shrink, Tamil entertainment finds new ways to tell stories",https://www.thehindu.com/entertainment/as-screens-shrink-tamil-entertainment-finds-new-ways-of-storytelling/article71053483.ece,2026-06-03T21:21:56+00:00
