city,publisher,source,source_url,rank,headline,link,collected_at_iso
Bengaluru,DC,Bengaluru • DC,https://www.deccanchronicle.com/location/india/karnataka/bengaluru,1,Assembly Elections 2026,https://www.deccanchronicle.com/assembly-elections-2026,2026-05-04T21:13:55+00:00
Bengaluru,DC,Bengaluru • DC,https://www.deccanchronicle.com/location/india/karnataka/bengaluru,2,Opinion and Editorials,https://www.deccanchronicle.com/opinion,2026-05-04T21:13:55+00:00
Bengaluru,DC,Bengaluru • DC,https://www.deccanchronicle.com/location/india/karnataka/bengaluru,3,Telangana Rising 2047,https://www.deccanchronicle.com/tags/Telangana-Rising-2047,2026-05-04T21:13:55+00:00
Mumbai,Mumbai Mirror,Mumbai • Mumbai Mirror,https://mumbaimirror.indiatimes.com/mumbai,1,"Earning `40 lakh, yet feeling broke",https://mumbaimirror.indiatimes.com/opinion/earning-40-lakh-yet-feeling-broke/articleshow/130737557.html,2026-05-04T21:13:55+00:00
Mumbai,Mumbai Mirror,Mumbai • Mumbai Mirror,https://mumbaimirror.indiatimes.com/mumbai,2,"‘Haunted’ by wife’s ghost, man loses `1cr",https://mumbaimirror.indiatimes.com/mumbai/haunted-by-wifes-ghost-man-loses-1cr/articleshow/130738402.html,2026-05-04T21:13:55+00:00
Mumbai,Mumbai Mirror,Mumbai • Mumbai Mirror,https://mumbaimirror.indiatimes.com/mumbai,3,"Every govt dept must roll out one AI project, says CM",https://mumbaimirror.indiatimes.com/mumbai/every-govt-dept-must-roll-out-one-ai-project-says-cm/articleshow/130737188.html,2026-05-04T21:13:55+00:00
Mumbai,Mumbai Mirror,Mumbai • Mumbai Mirror,https://mumbaimirror.indiatimes.com/mumbai,4,State-level panel to be set up for rural solid waste management,https://mumbaimirror.indiatimes.com/mumbai/state-level-panel-to-be-set-up-for-rural-solid-waste-management/articleshow/130737189.html,2026-05-04T21:13:55+00:00
Mumbai,Mumbai Mirror,Mumbai • Mumbai Mirror,https://mumbaimirror.indiatimes.com/mumbai,5,FSL rules out food poisoning,https://mumbaimirror.indiatimes.com/mumbai/cover-story/fsl-rules-out-food-poisoning/articleshow/130738115.html,2026-05-04T21:13:55+00:00
Mumbai,Mumbai Mirror,Mumbai • Mumbai Mirror,https://mumbaimirror.indiatimes.com/mumbai,6,Kalina’s walk-through woes,https://mumbaimirror.indiatimes.com/mumbai/kalinas-walk-through-woes/articleshow/130737396.html,2026-05-04T21:13:55+00:00
Mumbai,Mumbai Mirror,Mumbai • Mumbai Mirror,https://mumbaimirror.indiatimes.com/mumbai,7,Shatabdi docs stitch back patient’s torn scalp for free,https://mumbaimirror.indiatimes.com/mumbai/shatabdi-docs-stitch-back-patients-torn-scalp-for-free/articleshow/130737722.html,2026-05-04T21:13:55+00:00
Mumbai,Mumbai Mirror,Mumbai • Mumbai Mirror,https://mumbaimirror.indiatimes.com/mumbai,8,Ask The Sexpert,https://mumbaimirror.indiatimes.com/ask-the-sexpert,2026-05-04T21:13:55+00:00
Mumbai,Sakal,Mumbai • Sakal,https://www.esakal.com/pune,1,सकाळ लाईव्ह TV,https://www.esakal.com/live-tv,2026-05-04T21:13:55+00:00
Mumbai,Sakal,Mumbai • Sakal,https://www.esakal.com/pune,2,Refund and Cancellation,https://www.esakal.com/refund-and-cancellation,2026-05-04T21:13:55+00:00
Mumbai,Lokmat,Mumbai • Lokmat,https://www.lokmat.com/city/,1,Live News in Marathi,https://www.lokmat.com/live-news/,2026-05-04T21:13:55+00:00
Mumbai,Lokmat,Mumbai • Lokmat,https://www.lokmat.com/city/,2,“आरोपीला फाशी मिळेपर्यंत तुमच्या सोबत...”; कुटुंबीयांची भेट घेत अमितेश कुमार यांनी दिला धीर,https://www.lokmat.com/pune/i-will-be-with-you-until-the-accused-is-highly-punished-said-pune-police-commissioner-amitesh-kumar-after-meeting-the-nasrapur-victim-family-a-a1014-c719/,2026-05-04T21:13:55+00:00
Mumbai,Lokmat,Mumbai • Lokmat,https://www.lokmat.com/city/,3,बारामतीत अभिजित बिचुकले-करुणा मुंडेंना NOTAने केले पराभूत; कोणाला किती मते मिळाली? पाहाच,https://www.lokmat.com/pune/baramati-bypoll-election-2026-result-abhijit-bichukale-and-karuna-munde-defeated-by-nota-know-how-many-votes-did-get-a-a719/,2026-05-04T21:13:55+00:00
Mumbai,Lokmat,Mumbai • Lokmat,https://www.lokmat.com/city/,4,"'ज्या ठिकाणी घटना घडली, त्याच ठिकाणी त्याला ठेचून मारलं पाहिजे', नराधमाच्या पत्नीचा संताप",https://www.lokmat.com/pune/pune-nasrapur-case-he-should-be-crushed-to-death-at-the-place-where-the-incident-took-place-says-the-wife-of-the-man-who-murdered-him-a-a727/,2026-05-04T21:13:55+00:00
Mumbai,Lokmat,Mumbai • Lokmat,https://www.lokmat.com/city/,5,बारामतीत ‘पवार पर्व’ अजिंक्यच! १९६७ पासून सलग वर्चस्व; सुनेत्रा पवारांच्या विक्रमी विजयाचा नवा इतिहा,https://www.lokmat.com/pune/baramati-bypoll-election-2026-pawar-parv-is-unbeatable-in-baramati-continuous-dominance-since-1967-new-history-of-sunetra-pawars-record-victory-a-a727/,2026-05-04T21:13:55+00:00
Mumbai,Lokmat,Mumbai • Lokmat,https://www.lokmat.com/city/,6,२ लाख १८ हजार ९३० मतांच्या विक्रमी फरकाने सुनेत्रा पवारांचा विजय; तब्बल ६४ वर्षांनंतर बारामतीचे नेतृ,https://www.lokmat.com/pune/baramati-bypoll-election-2026-sunetra-pawar-wins-by-a-record-margin-of-2-lakh-18-thousand-930-votes-baramati-is-led-by-a-woman-after-64-years-a-a727/,2026-05-04T21:13:55+00:00
Mumbai,Lokmat,Mumbai • Lokmat,https://www.lokmat.com/city/,7,LIVE: आजपासून बंगाल भयमुक्त आणि विकासयुक्त - पंतप्रधान नरेंद्र मोदी,https://www.lokmat.com/national/top-marathi-news-live-updates-assembly-election-results-live-today-5-states-counting-including-west-bengal-tamilnadu-kerala-assam-and-puducherry-result-updats-in-marathi-baramati-rahuri-by-election-results-a-a629/,2026-05-04T21:13:55+00:00
Mumbai,Lokmat,Mumbai • Lokmat,https://www.lokmat.com/city/,8,"CM फडणवीसांनी केले श्यामाप्रसाद मुखर्जींचे स्मरण; म्हणाले, “प. बंगालचा खरा पक्ष भाजपाच...”",https://www.lokmat.com/mumbai/cm-devendra-fadnavis-remembered-shyama-prasad-mukherjee-and-first-reaction-over-west-bengal-election-2026-result-a-a719/,2026-05-04T21:13:55+00:00
Mumbai,Lokmat,Mumbai • Lokmat,https://www.lokmat.com/city/,9,विरारमध्ये लोकल रोखून प्रवाशांचा तीव्र संताप; सामान्य गाडी वातानुकूलित केल्याने आंदोलन उग्र,https://www.lokmat.com/mumbai/passengers-protest-in-virar-after-regular-trains-were-air-conditioned-a-a732/,2026-05-04T21:13:55+00:00
Mumbai,Lokmat,Mumbai • Lokmat,https://www.lokmat.com/city/,10,ट्रॅव्हल्सकडून प्रवाशांची लूट; तिकीट दरांमध्ये दुप्पट-तिप्पट वाढ : परिवहन विभागाचे नियंत्रण नसल्याची जनतेची तक्रार,https://www.lokmat.com/mumbai/travels-looting-passengers-ticket-prices-doubled-tripled-public-complains-of-lack-of-control-by-the-transport-department-a-a941/,2026-05-04T21:13:55+00:00
Mumbai,Lokmat,Mumbai • Lokmat,https://www.lokmat.com/city/,11,पश्चिम रेल्वेवर अवघ्या दीड तासात ९० टन वजनाच्या गर्डरची उभारणी,https://www.lokmat.com/mumbai/erection-of-90-ton-girder-on-western-railway-in-just-one-and-a-half-hours-a-a941/,2026-05-04T21:13:55+00:00
Mumbai,Lokmat,Mumbai • Lokmat,https://www.lokmat.com/city/,12,शताब्दी वर्षात संघाच्या सूक्ष्म नियोजनामुळे पश्चिम बंगालमध्ये भाजपला ‘बूस्टर डोस’,https://www.lokmat.com/nagpur/bjp-gets-booster-dose-in-west-bengal-election-2026-due-to-rss-meticulous-planning-in-centenary-year-a-a382-c719/,2026-05-04T21:13:55+00:00
Mumbai,Lokmat,Mumbai • Lokmat,https://www.lokmat.com/city/,13,CBSE शिक्षकांना जनगणनेस बोलावणाऱ्या आदेशांना स्थगिती; नागपूर खंडपीठाने बजावली नोटीस,https://www.lokmat.com/nagpur/mumbai-high-court-nagpur-bench-interim-stay-order-to-cbse-teachers-calling-for-census-orders-and-issues-notice-a-a719/,2026-05-04T21:13:55+00:00
Mumbai,Lokmat,Mumbai • Lokmat,https://www.lokmat.com/city/,14,सरकारकडे कंत्राटदारांची ९६ हजार कोटीची बिले थकित; नागपूर कंत्राटदार संघटनेची उच्च न्यायालयात धाव,https://www.lokmat.com/nagpur/contractors-bills-worth-96000-crore-are-pending-with-the-govt-nagpur-contractors-association-moves-high-court-a-a719/,2026-05-04T21:13:55+00:00
Mumbai,Lokmat,Mumbai • Lokmat,https://www.lokmat.com/city/,15,ट्रीपल आयटीच्या विद्यार्थ्याने जीवन संपवले; मोबाईल अनलॉक झाल्यानंतर कळणार कारण,https://www.lokmat.com/nagpur/triple-it-student-ends-his-life-reason-will-be-known-after-mobile-is-unlocked-a-a879-c719/,2026-05-04T21:13:55+00:00
Mumbai,Lokmat,Mumbai • Lokmat,https://www.lokmat.com/city/,16,तीन कोटी फेक अकाउंट डिलिट; तरीही रेल्वे तिकिटांची काळाबाजारी करणाऱ्यांचा सुळसुळाट,https://www.lokmat.com/nagpur/three-crore-fake-accounts-deleted-still-those-involved-in-black-marketing-of-railway-tickets-are-thriving-a-a877-c1000/,2026-05-04T21:13:55+00:00
Mumbai,Lokmat,Mumbai • Lokmat,https://www.lokmat.com/city/,17,खरातच्या धनादेशांचे बनावट खात्यांशी कनेक्शन; आर्थिक स्रोत लपवण्यासाठी केली जात होती शक्कल,https://www.lokmat.com/nashik/kharats-checks-linked-to-fake-accounts-the-scheme-was-being-used-to-hide-the-financial-source-a-a941/,2026-05-04T21:13:55+00:00
Mumbai,Lokmat,Mumbai • Lokmat,https://www.lokmat.com/city/,18,भोंदू खरात बिल्डरच्या खर्चाने फिरून आला तब्बल २१ देश;नवव्या गुन्ह्यात आणखी ४ दिवसांची पोलिस कोठडी,https://www.lokmat.com/nashik/the-fraudster-traveled-to-21-countries-at-the-expense-of-the-builder-4-more-days-of-police-custody-for-the-ninth-crime-a-a941/,2026-05-04T21:13:55+00:00
Mumbai,Lokmat,Mumbai • Lokmat,https://www.lokmat.com/city/,19,‘परदेशांत भ्रमण न केल्यास नागदेवता दंश करेल’; फिर्यादीच्या पैशांवर भोंदू खरात करायचा मौज,https://www.lokmat.com/crime/the-imposter-ashok-kharat-swindle-four-to-five-crore-rupees-from-businessman-a-a629/,2026-05-04T21:13:55+00:00
Mumbai,Lokmat,Mumbai • Lokmat,https://www.lokmat.com/city/,20,भोंदू खरातने परिसाची शक्ती प्राप्त करण्याचे सांगून फिर्यादीच्या पैशातून केला २१ देशांचा परदेश दौरा!,https://www.lokmat.com/nashik/the-fraudster-kharat-used-the-plaintiffs-money-to-tour-21-countries-abroad-claiming-to-gain-the-power-of-parisa-a-a1013/,2026-05-04T21:13:55+00:00
Mumbai,Lokmat,Mumbai • Lokmat,https://www.lokmat.com/city/,21,शेअर मार्केटमध्ये गुंतवणुकीच्या आमिषाने नाशिकमध्ये ८४ लाखांची फसवणूक,https://www.lokmat.com/nashik/fraud-of-rs-84-lakhs-in-nashik-on-the-pretext-of-investing-in-the-stock-market-a-a1001/,2026-05-04T21:13:55+00:00
Mumbai,Lokmat,Mumbai • Lokmat,https://www.lokmat.com/city/,22,"हसन मुश्रीफ हे ताकतवान नेते, त्यांनी माझा पूर्व इतिहास काढावाच; आमदार शिवाजीराव पाटील यांचे आव्हान",https://www.lokmat.com/kolhapur/hasan-mushrif-is-a-powerful-leader-he-must-clear-my-past-history-mla-shivajirao-patils-challenge-a-a607/,2026-05-04T21:13:55+00:00
Mumbai,Lokmat,Mumbai • Lokmat,https://www.lokmat.com/city/,23,गोकुळ'च्या ६३ वर्षांच्या इतिहासात प्रथमच प्रशासक; कामकाज हाताळण्याचे राहणार आव्हान,https://www.lokmat.com/kolhapur/gokul-dudh-sangh-has-an-administrator-for-the-first-time-in-its-63-year-history-the-challenge-of-handling-the-affairs-will-remain-a-a629/,2026-05-04T21:13:55+00:00
Mumbai,Lokmat,Mumbai • Lokmat,https://www.lokmat.com/city/,24,पतीला भेटायला युवक घरी आला अन्...; कोल्हापुरात डॉक्टर महिलेवर बळजबरी करण्याचा प्रयत्न,https://www.lokmat.com/crime/attempted-molestation-of-female-doctor-in-kolhapur-police-arrest-accused-youth-a-a629/,2026-05-04T21:13:55+00:00
Mumbai,Lokmat,Mumbai • Lokmat,https://www.lokmat.com/city/,25,"कोल्हापूर जिल्ह्यात नीट परीक्षेत गोंधळ, विद्यार्थ्यांचे नुकसान झाल्याची पालकांची तक्रार; नेमकं काय घडलं?",https://www.lokmat.com/kolhapur/mess-in-neet-exam-in-kolhapur-district-parents-complain-of-loss-to-students-a-a653/,2026-05-04T21:13:55+00:00
Mumbai,Lokmat,Mumbai • Lokmat,https://www.lokmat.com/city/,26,पूर्ववैमनस्यातून तरुणाचा निर्घृण खून; पत्नीही गंभीर जखमी; तिन्ही आरोपी स्वतःहून पोलिसांत हजर,https://www.lokmat.com/kolhapur/young-man-brutally-murdered-over-past-enmity-wife-also-seriously-injured-a-a597/,2026-05-04T21:13:55+00:00
Mumbai,Lokmat,Mumbai • Lokmat,https://www.lokmat.com/city/,27,चांदोली अभयारण्यात राखाडी डोक्याच्या मत्स्यगरुडाची नोंद,https://www.lokmat.com/sangli/rare-grey-headed-fish-eagle-spotted-in-sahyadri-tiger-reserve-a-major-boost-for-chandoli-ecosystem-a-a1012/,2026-05-04T21:13:55+00:00
Mumbai,Lokmat,Mumbai • Lokmat,https://www.lokmat.com/city/,28,देशभरात कुठेही वाहन चालवा; बीएच सीरीज नंबर घेतला का? वाहनधारकांकडून प्रतिसाद,https://www.lokmat.com/sangli/drive-anywhere-in-the-country-did-you-get-a-bh-series-number-response-from-vehicle-owners-a-a941/,2026-05-04T21:13:55+00:00
Mumbai,Lokmat,Mumbai • Lokmat,https://www.lokmat.com/city/,29,"भांडण सोडवणं पडलं महागात! सांगलीत मध्यस्थी करणाऱ्या तरुणाची हत्या; दोघांना अटक, एक अल्पवयीन ताब्यात",https://www.lokmat.com/sangli/crime-news-resolving-a-dispute-became-costly-a-young-man-who-was-mediating-in-sangli-was-killed-two-arrested-a-minor-in-custody-a-a941/,2026-05-04T21:13:55+00:00
Mumbai,Lokmat,Mumbai • Lokmat,https://www.lokmat.com/city/,30,"'विशाल पाटलांना तिकीट मिळणार नाही हे जयंत पाटील-विश्वजित कदमांना माहीत होतं""; पडळकरांचा मोठा गौप्यस्फोट",https://www.lokmat.com/sangli/jayant-patil-vishwajit-kadam-knew-that-vishal-patil-would-not-get-a-ticket-gopichand-padalkars-big-revelation-a-a941/,2026-05-04T21:13:55+00:00
Mumbai,Lokmat,Mumbai • Lokmat,https://www.lokmat.com/city/,31,"पाठीला कॅन बांधल्याने मुलगा वाचला, पण काळाने बापाला ओढलं; वारणा नदीपात्रातील काळजाचा थरकाप उडवणारी घटना",https://www.lokmat.com/sangli/the-boy-was-saved-by-tying-a-can-to-his-back-but-time-took-the-father-a-heart-wrenching-incident-in-the-varna-river-basin-a-a941/,2026-05-04T21:13:55+00:00
Mumbai,Lokmat,Mumbai • Lokmat,https://www.lokmat.com/city/,32,सुट्ट्यांचा आनंद महामार्गावरच 'जाम'! खेड शिवापूर ते साताऱ्यापर्यंत वाहनांच्या लांबच लांब रांगा; प्रवासी हतबल,https://www.lokmat.com/satara/the-joy-of-holidays-is-a-jam-on-the-highway-long-queues-of-vehicles-from-khed-shivapur-to-satara-passengers-are-desperate-a-a1013/,2026-05-04T21:13:55+00:00
Mumbai,Lokmat,Mumbai • Lokmat,https://www.lokmat.com/city/,33,"वहिनीचा ओरडण्याचा आवाज आला अन् लोक धावले, वाईत दीराचं भयानक कृत्य पाहून गाव सुन्न",https://www.lokmat.com/satara/satara-shocker-man-brutes-sister-in-law-to-death-over-ancestral-land-dispute-in-wai-a-a1001/,2026-05-04T21:13:55+00:00
Mumbai,Lokmat,Mumbai • Lokmat,https://www.lokmat.com/city/,34,शरद पवार पुन्हा रुग्णालयात दाखल; बारामती पोटनिवडणूक दरम्यान पोस्ट लिहून केलं आवाहन,https://www.lokmat.com/maharashtra/sharad-pawar-admitted-to-hospital-again-appealed-through-post-during-baramati-by-election-a-a1013/,2026-05-04T21:13:55+00:00
Mumbai,Lokmat,Mumbai • Lokmat,https://www.lokmat.com/city/,35,"कार्यकर्ता अपमानित होतो, तेव्हा माझ्यातील शिवसैनिक जागा : एकनाथ शिंदे",https://www.lokmat.com/satara/when-a-worker-is-humiliated-the-shiv-sainik-in-me-disappears-eknath-shinde-a-a1013/,2026-05-04T21:13:55+00:00
Mumbai,Lokmat,Mumbai • Lokmat,https://www.lokmat.com/city/,36,साताऱ्याचे पोलीस अधीक्षक तुषार दोशी यांची बदली; एकूण ९ अधिकाऱ्यांच्या बदलीचे आदेश निघाले...,https://www.lokmat.com/maharashtra/maharashtra-ips-transfer-list-2026-satara-superintendent-of-police-tushar-doshi-transferred-orders-issued-for-transfer-of-a-total-of-9-officers-a-a607/,2026-05-04T21:13:55+00:00
Mumbai,Lokmat,Mumbai • Lokmat,https://www.lokmat.com/city/,37,"निविष्ठा विक्रीत अनियमितता; तीन कृषी सेवा केंद्रांचे परवाने निलंबित, पाच केंद्रांना नोटीसा",https://www.lokmat.com/akola/irregularities-in-input-sales-licenses-of-three-agricultural-service-centers-suspended-a-a597/,2026-05-04T21:13:55+00:00
Mumbai,Lokmat,Mumbai • Lokmat,https://www.lokmat.com/city/,38,"सूर्य कोपला, विदर्भात तापला! उष्णतेचा कहर; अकोल्यात देशातील सर्वाधिक ४६.९ अंश सेल्सिअस तापमान",https://www.lokmat.com/akola/heatwave-wreaks-havoc-in-vidarbha-akola-records-highest-temperature-in-the-country-over-the-46-plus-degrees-celsius-a-a653/,2026-05-04T21:13:55+00:00
Mumbai,Lokmat,Mumbai • Lokmat,https://www.lokmat.com/city/,39,"दातात पकडून चिमुकल्यावर अघोरी उपचार, अकोल्यातील धक्कादायक प्रकार, व्हिडीओ व्हायरल",https://www.lokmat.com/maharashtra/aghori-treatment-of-a-toddler-by-holding-him-by-the-teeth-shocking-incident-in-akola-video-goes-viral-a-a1012/,2026-05-04T21:13:55+00:00
Mumbai,Lokmat,Mumbai • Lokmat,https://www.lokmat.com/city/,40,"अकोला, वर्धा देशात सर्वाधिक ‘हॉट’; पार ४५ अंश सेल्सिअसवर पारा",https://www.lokmat.com/akola/akola-wardha-hottest-in-the-country-mercury-at-45-degrees-celsius-a-a1013/,2026-05-04T21:13:55+00:00
Mumbai,Lokmat,Mumbai • Lokmat,https://www.lokmat.com/city/,41,अकोल्यात उष्माघाताचा पहिला बळी? ४४ अंश तापमानाने घेतला जीव; ऑटोमध्ये आढळला मृतदेह,https://www.lokmat.com/akola/first-victim-of-heatstroke-in-akola-44-degree-temperature-claimed-his-life-body-found-in-auto-a-a941/,2026-05-04T21:13:55+00:00
Mumbai,Lokmat,Mumbai • Lokmat,https://www.lokmat.com/city/,42,"भीषण अपघात: सोलापूर-अक्कलकोट महामार्गावर एसटी बस आणि डंपरची जोरदार धडक; दोन प्रवाशांचा मृत्यू, डंपरने घेतला पेट",https://www.lokmat.com/solapur/solapur-akkalkot-highway-accident-big-news-st-bus-and-dumper-collide-dumper-catches-fire-after-accident-two-passengers-die-a-a311-c607/,2026-05-04T21:13:55+00:00
Mumbai,Lokmat,Mumbai • Lokmat,https://www.lokmat.com/city/,43,सोलापुरात शेतीच्या वादातून तिहेरी हत्याकांड; दिराने भावजयीसह दोन पुतण्यांची केली निर्घृण हत्या,https://www.lokmat.com/solapur/triple-murder-in-solapu-man-kills-sister-in-law-and-two-nephews-over-land-dispute-a-a311-c1001/,2026-05-04T21:13:55+00:00
Mumbai,Lokmat,Mumbai • Lokmat,https://www.lokmat.com/city/,44,जनगणना २०२७: सोलापूरकरांसाठी मोठी संधी; आता घरबसल्या करा स्वतःची ‘स्व-गणना’,https://www.lokmat.com/solapur/census-2027-big-opportunity-for-solapur-residents-now-do-your-own-self-enumeration-from-home-a-a653/,2026-05-04T21:13:55+00:00
Mumbai,Lokmat,Mumbai • Lokmat,https://www.lokmat.com/city/,45,इंटरसिटी २ तर सिद्धेश्वर एक्स्प्रेसला ७ तासांचा उशीर; लांब पल्ल्यांच्या गाड्यांचे वेळापत्रक कोलमडले,https://www.lokmat.com/solapur/intercity-2-and-siddheshwar-express-delayed-by-7-hours-schedule-of-long-distance-trains-disrupted-a-a597/,2026-05-04T21:13:55+00:00
Mumbai,Lokmat,Mumbai • Lokmat,https://www.lokmat.com/city/,46,"जिल्हाधिकाऱ्यांचा साधेपणा; पायी चालत जात मंदिर गाठलं, विठ्ठलाचं दर्शन करून केली पाहणी",https://www.lokmat.com/solapur/solapur-collector-karthikeyan-s-walks-to-vitthal-temple-to-inspect-ashadhi-wari-preparations-a-a311-c1001/,2026-05-04T21:13:55+00:00
Mumbai,Lokmat,Mumbai • Lokmat,https://www.lokmat.com/city/,47,"बारामतीत अपेक्षेप्रमाणे सुनेत्रा पवार यांना आघाडी, तर राहुरीचा कल काय? आहे अशी अपडेट",https://www.lokmat.com/maharashtra/sunetra-pawar-is-leading-in-baramati-as-expected-but-what-is-rahuris-trend-update-a-a301/,2026-05-04T21:13:55+00:00
Mumbai,Lokmat,Mumbai • Lokmat,https://www.lokmat.com/city/,48,"राहता तालुक्यात गर्भलिंग निदान तपासणी, एका घरावर छापा; डॉक्टरसह एजंट ताब्यात",https://www.lokmat.com/ahilyanagar/fetal-sex-determination-test-in-rahata-taluka-raid-on-a-house-agent-along-with-doctor-detained-a-a597/,2026-05-04T21:13:55+00:00
Mumbai,Lokmat,Mumbai • Lokmat,https://www.lokmat.com/city/,49,आमदार संजय गायकवाड यांच्याविरोधात 'वंचित' आक्रमक! शेवगावात धडकला भव्य मोर्चा; गुन्हा दाखल करण्याची मागणी,https://www.lokmat.com/ahilyanagar/deprived-aggressive-against-mla-sanjay-gaikwad-massive-march-in-shevgaon-demand-to-register-a-case-a-a941/,2026-05-04T21:13:55+00:00
