city,publisher,source,source_url,rank,headline,link,collected_at_iso
Delhi-NCR,Jagran,Delhi-NCR • Jagran,https://www.jagran.com/delhi-ncr,38,"नोएडा में औद्योगिक इकाइयां पूरी तरह से चालू, पुलिस की कड़ी निगरानी",https://www.jagran.com/uttar-pradesh/noida-noida-industrial-units-resume-work-amid-police-vigilance-40209105.html,2026-04-17T06:07:25+00:00
Delhi-NCR,Jagran,Delhi-NCR • Jagran,https://www.jagran.com/delhi-ncr,39,"श्रमिकों के कंधों पर रखकर पाकिस्तान ने चलाई 'झूठ' की बंदूक, पुलिस कमिश्नर लक्ष्मी सिंह ने साक्ष्यों के साथ बेनकाब किया विदेशी नरेटिव",https://www.jagran.com/uttar-pradesh/noida-noida-violence-pakistani-agenda-exposed-by-police-commissioner-40208964.html,2026-04-17T06:07:25+00:00
Delhi-NCR,Jagran,Delhi-NCR • Jagran,https://www.jagran.com/delhi-ncr,40,"'मुख्यमंत्री रेखा गुप्ता पर टिप्पणी करने से बचें अखिलेश यादव', हाफ सीएम वाले बयान से छिड़ा विवाद",https://www.jagran.com/delhi/new-delhi-city-delhi-bjp-warns-akhilesh-yadav-over-half-cm-remark-40209268.html,2026-04-17T06:07:25+00:00
Delhi-NCR,Jagran,Delhi-NCR • Jagran,https://www.jagran.com/delhi-ncr,41,"दिल्ली में रिटायर्ड इंजीनियर से ठगे 2.7 करोड़ रुपये, बेटी के भविष्य के लिए बचाई रकम गंवाई",https://www.jagran.com/delhi/new-delhi-city-delhi-retired-engineer-loses-27-cr-in-online-investment-scam-40209257.html,2026-04-17T06:07:25+00:00
Delhi-NCR,Jagran,Delhi-NCR • Jagran,https://www.jagran.com/delhi-ncr,42,"हरियाणा में कचरे से बिजली बनेगी: फरीदाबाद, गुरुग्राम, पंचकूला, करनाल और हिसार में वेस्ट टू एनर्जी प्लांट की तैयारी",https://www.jagran.com/haryana/faridabad-haryana-to-build-wastetoenergy-plants-in-5-major-cities-40209195.html,2026-04-17T06:07:25+00:00
Delhi-NCR,Jagran,Delhi-NCR • Jagran,https://www.jagran.com/delhi-ncr,43,"फरीदाबाद के मेवला महाराजपुर स्वास्थ्य केंद्र में अब ब्लड टेस्ट की सुविधा, मरीजों को मिलेगी बड़ी राहत",https://www.jagran.com/haryana/faridabad-faridabad-mewla-maharajpur-health-center-gets-blood-test-lab-40209114.html,2026-04-17T06:07:25+00:00
Delhi-NCR,Jagran,Delhi-NCR • Jagran,https://www.jagran.com/delhi-ncr,44,"ईस्ट-टू-वेस्ट कनेक्टिविटी को मिली गति, फरीदाबाद में 8 किमी एलिवेटेड कारिडोर और 9 किमी नई सड़क का काम तेज",https://www.jagran.com/haryana/faridabad-fmda-ceo-inspects-faridabad-eastwest-connectivity-project-40209113.html,2026-04-17T06:07:25+00:00
Delhi-NCR,Jagran,Delhi-NCR • Jagran,https://www.jagran.com/delhi-ncr,45,"फरीदाबाद रेलवे ट्रैक सुरक्षा: आरपीएफ-जीआरपी की अनधिकृत कैमरों पर पैनी नजर, अनधिकृत कैमरों की हो रही खोजबीन",https://www.jagran.com/haryana/faridabad-faridabad-rpf-grp-cracks-down-on-unauthorized-railway-cameras-40208696.html,2026-04-17T06:07:25+00:00
Delhi-NCR,Jagran,Delhi-NCR • Jagran,https://www.jagran.com/delhi-ncr,46,"फरीदाबाद में मोहना एलिवेटेड मार्ग का निर्माण कार्य एक महीने से ठप, दुकानदारों का व्यवसाय बुरी तरह प्रभावित",https://www.jagran.com/haryana/faridabad-mohana-elevated-road-work-stalled-in-ballabgarh-faridabad-40208628.html,2026-04-17T06:07:25+00:00
Delhi-NCR,Jagran,Delhi-NCR • Jagran,https://www.jagran.com/delhi-ncr,47,"पलवल में नाबालिग छात्रा छेड़ने और फोटोज खींचकर पोस्ट करने पर एफआईआर, पुलिस सिखाएगी सबक",https://www.jagran.com/haryana/palwal-palwal-schoolgirl-harassed-photos-viral-pocso-case-filed-40208149.html,2026-04-17T06:07:25+00:00
Delhi-NCR,Jagran,Delhi-NCR • Jagran,https://www.jagran.com/delhi-ncr,48,"पलवल में अमरनाथ यात्रा हेल्थ सर्टिफिकेट बनवाना अग्निपरीक्षा से कम नहीं, लंबी कतारों से श्रद्धालु परेशान",https://www.jagran.com/haryana/palwal-amarnath-yatra-health-certificate-palwals-queue-challenge-40208112.html,2026-04-17T06:07:25+00:00
Delhi-NCR,Jagran,Delhi-NCR • Jagran,https://www.jagran.com/delhi-ncr,49,"पलवल में जमीन के विवाद ने लिया खूनी संघर्ष, गोली लगने से युवक घायल; पुलिस ने दर्ज किए मुकदमे",https://www.jagran.com/haryana/palwal-palwal-land-dispute-youth-shot-cases-filed-against-both-sides-40207906.html,2026-04-17T06:07:25+00:00
Delhi-NCR,Jagran,Delhi-NCR • Jagran,https://www.jagran.com/delhi-ncr,50,"पलवल में वेतन वृद्धि विवाद: हाईवे जाम करने वालों पर दर्ज होगा केस, फैक्ट्रियों के बाद सुरक्षा सख्त",https://www.jagran.com/haryana/palwal-palwal-highway-blockade-wage-hike-dispute-leads-to-strict-action-40206465.html,2026-04-17T06:07:25+00:00
Delhi-NCR,Jagran,Delhi-NCR • Jagran,https://www.jagran.com/delhi-ncr,51,"पलवल में ईंटों के नीचे छिपाकर बिहार ले जाई जा रही 610 पेटी अंग्रेजी शराब पकड़ी, दो तस्कर गिरफ्तार",https://www.jagran.com/haryana/palwal-palwal-610-cartons-of-illegal-liquor-seized-2-arrested-40206281.html,2026-04-17T06:07:25+00:00
Delhi-NCR,Jagran,Delhi-NCR • Jagran,https://www.jagran.com/delhi-ncr,52,"यूपी में इंटर संस्कृत की प्री-बोर्ड पीरक्षा को लेकर बदला नियम, बोर्ड सचिव ने जारी किए नए निर्देश",https://www.jagran.com/uttar-pradesh/prayagraj-up-board-2026-sanskrit-main-papers-for-2027-preboards-40209301.html,2026-04-17T06:07:25+00:00
Delhi-NCR,Jagran,Delhi-NCR • Jagran,https://www.jagran.com/delhi-ncr,53,"बस्ती जिले में जमीन के टुकड़े के लिए खूनी संघर्ष, ग्राम प्रधान समेत तीन लहूलुहान",https://www.jagran.com/uttar-pradesh/basti-basti-land-dispute-gram-pradhan-two-others-seriously-injured-40209293.html,2026-04-17T06:07:25+00:00
Delhi-NCR,Jagran,Delhi-NCR • Jagran,https://www.jagran.com/delhi-ncr,54,"मंद‍िर प्रशासन की तैयारी, बाबा को इस द‍िन से लगेगी जलधारी, भक्‍ताें को भी म‍िलेगी गर्मी में राहत",https://www.jagran.com/uttar-pradesh/varanasi-city-kashi-vishwanath-temple-jaldhari-and-cooling-for-summer-devotees-40209296.html,2026-04-17T06:07:25+00:00
Delhi-NCR,Jagran,Delhi-NCR • Jagran,https://www.jagran.com/delhi-ncr,55,नेत्र चिकित्सक भर्ती: लखनऊ हाई कोर्ट ने नियुक्ति पत्रों पर लगाई अंतरिम रोक,https://www.jagran.com/uttar-pradesh/lucknow-city-lucknow-hc-stays-eye-doctor-appointments-govt-to-respond-40209288.html,2026-04-17T06:07:25+00:00
Delhi-NCR,Jagran,Delhi-NCR • Jagran,https://www.jagran.com/delhi-ncr,56,"उरई में पुलिस मुठभेड़, मेडिकल कॉलेज चोरों को लगी गोली, तीन गिरफ्तार",https://www.jagran.com/uttar-pradesh/jalaun-orai-police-encounter-3-thieves-shot-arrested-for-college-thefts-40209285.html,2026-04-17T06:07:25+00:00
Delhi-NCR,Jagran,Delhi-NCR • Jagran,https://www.jagran.com/delhi-ncr,57,"वाराणसी सह‍ित पूर्वांचल में अध‍िकतम पारा 40 ड‍िग्री के पार, ठीक दो माह के बाद मानसून पूर्वांचल में देगा दस्‍तक",https://www.jagran.com/uttar-pradesh/varanasi-city-varanasi-and-purvanchal-sizzle-temps-cross-40-degree-celcius-monsoon-two-months-away-40209283.html,2026-04-17T06:07:25+00:00
Delhi-NCR,Jagran,Delhi-NCR • Jagran,https://www.jagran.com/delhi-ncr,58,"गोरखपुर में भीषण गर्मी का प्रकोप, पारा 40 डिग्री के पार, शुष्क मौसम से बढ़ी बेचैनी",https://www.jagran.com/uttar-pradesh/gorakhpur-city-gorakhpur-heatwave-temperature-to-cross-40c-dry-weather-40209280.html,2026-04-17T06:07:25+00:00
Delhi-NCR,Jagran,Delhi-NCR • Jagran,https://www.jagran.com/delhi-ncr,59,"जनगणना-2027 के तहत आज से शुरू हो रही स्वगणना, प्रशासन तैयार",https://www.jagran.com/bihar/purnea-purnea-census-2027-self-enumeration-starts-today-digital-process-40209122.html,2026-04-17T06:07:25+00:00
Delhi-NCR,Jagran,Delhi-NCR • Jagran,https://www.jagran.com/delhi-ncr,60,"विद्युत नियामक आयोग का कड़ा रुख, नए कनेक्शन सिर्फ प्रीपेड मो",https://www.jagran.com/uttar-pradesh/lucknow-city-up-regulator-questions-power-cos-on-smart-prepaid-meter-mandate-40209121.html,2026-04-17T06:07:25+00:00
Delhi-NCR,Jagran,Delhi-NCR • Jagran,https://www.jagran.com/delhi-ncr,61,दिल्ली: डेटिंग ऐप पर फर्जी प्रोफाइल बनाकर 500 महिलाओं से 2 क,https://www.jagran.com/delhi/new-delhi-city-dating-app-scam-man-cheats-500-women-of-2-cr-in-delhi-40209120.html,2026-04-17T06:07:25+00:00
Delhi-NCR,Jagran,Delhi-NCR • Jagran,https://www.jagran.com/delhi-ncr,62,"भागलपुर नगर निगम: अब बड़े व्यापारियों की जेब होगी ढीली, ट्रे",https://www.jagran.com/bihar/bhagalpur-bhagalpur-trade-license-fees-hike-big-businesses-pay-more-40209109.html,2026-04-17T06:07:25+00:00
Delhi-NCR,Jagran,Delhi-NCR • Jagran,https://www.jagran.com/delhi-ncr,63,"दिल्ली के चार आईटीआई में बनेंगे आधुनिक लैब, छात्रों को मिलेग",https://www.jagran.com/delhi/new-delhi-city-delhi-itis-get-720-cr-for-modern-labs-boost-skill-development-40209112.html,2026-04-17T06:07:25+00:00
Delhi-NCR,Jagran,Delhi-NCR • Jagran,https://www.jagran.com/delhi-ncr,64,"MI vs PBKS: श्रेयस अय्यर का हैरतअंगेज कैच देख फटी रह गईं हर किसी की आंखें, रोहित-सूर्या के पैरों के नीचे से खिसक गई जमीन- Video",https://www.jagran.com/cricket/headlines-shreyas-iyer-catch-rohit-sharma-and-suryakumar-yadav-reaction-ipl-2026-mi-vs-pbks-40209209.html,2026-04-17T06:07:25+00:00
Delhi-NCR,Jagran,Delhi-NCR • Jagran,https://www.jagran.com/delhi-ncr,65,"गायक दिलजीत दोसांझ के नाम पर देहरादून में 1.07 करोड़ की ठगी, जांच में जुटी पुलिस",https://www.jagran.com/uttarakhand/dehradun-city-dehradun-107-cr-fraud-using-diljit-dosanjhs-name-40209218.html,2026-04-17T06:07:25+00:00
Delhi-NCR,Jagran,Delhi-NCR • Jagran,https://www.jagran.com/delhi-ncr,66,"'अपनी पत्नी को भेज दो', पुरुष कर्मचारी ने पुलिस को बताए कई राज ; TCS नासिक ब्रांच में नया बवाल",https://www.jagran.com/news/national-tcs-nashik-male-employee-alleges-forced-conversion-harassment-40209289.html,2026-04-17T06:07:25+00:00
Delhi-NCR,Jagran,Delhi-NCR • Jagran,https://www.jagran.com/delhi-ncr,67,"झांसी में ईसाई गर्लफ्रेंड का शव दफनाने के लिए कब्रिस्तान पहुंचा बॉयफ्रेंड, पति ने जमकर काटा हंगामा",https://www.jagran.com/uttar-pradesh/jhansi-city-jhansi-christian-womans-burial-sparks-controversy-police-probe-40209263.html,2026-04-17T06:07:25+00:00
Delhi-NCR,Jagran,Delhi-NCR • Jagran,https://www.jagran.com/delhi-ncr,68,Did You Know,https://www.jagran.com/did-you-know-news-hindi.html,2026-04-17T06:07:25+00:00
Delhi-NCR,Jagran,Delhi-NCR • Jagran,https://www.jagran.com/delhi-ncr,69,मिडिल ईस्ट संकट,https://www.jagran.com/topics/Israel-Iran-Conflict,2026-04-17T06:07:25+00:00
Delhi-NCR,Jagran,Delhi-NCR • Jagran,https://www.jagran.com/delhi-ncr,70,विधानसभा चुनाव 2026,https://www.jagran.com/topics/assembly-election-2026,2026-04-17T06:07:25+00:00
Delhi-NCR,Jagran,Delhi-NCR • Jagran,https://www.jagran.com/delhi-ncr,71,नोएडा श्रमिक प्रदर्शन,https://www.jagran.com/topics/Noida-protests,2026-04-17T06:07:25+00:00
Delhi-NCR,Jagran,Delhi-NCR • Jagran,https://www.jagran.com/delhi-ncr,72,Submit your news,https://www.jagran.com/citizen-journalism-hindi.html,2026-04-17T06:07:25+00:00
Delhi-NCR,Jagran,Delhi-NCR • Jagran,https://www.jagran.com/delhi-ncr,73,Message from the Editor,https://www.jagran.com/policies-and-standards.html,2026-04-17T06:07:25+00:00
Hyderabad,DC,Hyderabad • DC,https://www.deccanchronicle.com/location/india/southern-states,1,Assembly Elections 2026,https://www.deccanchronicle.com/assembly-elections-2026,2026-04-17T06:07:25+00:00
Hyderabad,DC,Hyderabad • DC,https://www.deccanchronicle.com/location/india/southern-states,2,Opinion and Editorials,https://www.deccanchronicle.com/opinion,2026-04-17T06:07:25+00:00
Hyderabad,DC,Hyderabad • DC,https://www.deccanchronicle.com/location/india/southern-states,3,Telangana Rising 2047,https://www.deccanchronicle.com/tags/Telangana-Rising-2047,2026-04-17T06:07:25+00:00
Chennai,DC,Chennai • DC,https://www.deccanchronicle.com/location/india/tamil-nadu/chennai-madras,1,Assembly Elections 2026,https://www.deccanchronicle.com/assembly-elections-2026,2026-04-17T06:07:25+00:00
Chennai,DC,Chennai • DC,https://www.deccanchronicle.com/location/india/tamil-nadu/chennai-madras,2,Opinion and Editorials,https://www.deccanchronicle.com/opinion,2026-04-17T06:07:25+00:00
Chennai,DC,Chennai • DC,https://www.deccanchronicle.com/location/india/tamil-nadu/chennai-madras,3,Telangana Rising 2047,https://www.deccanchronicle.com/tags/Telangana-Rising-2047,2026-04-17T06:07:25+00:00
Chennai,The Hindu,Chennai • The Hindu,https://www.thehindu.com/news/cities/chennai/,1,High Court dismisses Karti Chidambaram’s writ for speedy disposal of plea to de-freeze salary account,https://www.thehindu.com/news/national/tamil-nadu/high-court-dismisses-karti-chidambarams-writ-for-speedy-disposal-of-plea-to-de-freeze-salary-account/article70869198.ece,2026-04-17T06:07:25+00:00
Chennai,The Hindu,Chennai • The Hindu,https://www.thehindu.com/news/cities/chennai/,2,Three more arrested in college student’s attack during robbery bid in Minjur,https://www.thehindu.com/news/cities/chennai/three-more-arrested-in-college-students-attack-during-robbery-bid-in-minjur/article70867853.ece,2026-04-17T06:07:25+00:00
Chennai,The Hindu,Chennai • The Hindu,https://www.thehindu.com/news/cities/chennai/,3,LPG autorickshaws wait in queues as fuel outlets in Chennai go dry,https://www.thehindu.com/news/cities/chennai/lpg-autorickshaws-wait-in-queues-as-fuel-outlets-go-dry/article70870362.ece,2026-04-17T06:07:25+00:00
Chennai,The Hindu,Chennai • The Hindu,https://www.thehindu.com/news/cities/chennai/,4,"Salem C. Vijiaraghavachariar, the freedom fighter who fought against Kala Paani",https://www.thehindu.com/news/national/tamil-nadu/salem-c-vijiaraghavachariar-the-freedom-fighter-who-fought-against-kala-paani/article70868837.ece,2026-04-17T06:07:25+00:00
Chennai,The Hindu,Chennai • The Hindu,https://www.thehindu.com/news/cities/chennai/,5,"Housing for roadside dwellers and traffic solutions are top priorities for Harbour constituency, says Minister Sekarbabu",https://www.thehindu.com/elections/tamil-nadu-assembly/housing-for-roadside-dwellers-and-traffic-solutions-are-top-priorities-for-harbour-constituency-says-minister-sekarbabu/article70866290.ece,2026-04-17T06:07:25+00:00
Chennai,The Hindu,Chennai • The Hindu,https://www.thehindu.com/news/cities/chennai/,6,Election officials seize gold jewellery worth ₹245 crore in Adyar,https://www.thehindu.com/elections/tamil-nadu-assembly/election-officials-seize-gold-jewellery-worth-245-crore-in-adyar/article70868081.ece,2026-04-17T06:07:25+00:00
Chennai,The Hindu,Chennai • The Hindu,https://www.thehindu.com/news/cities/chennai/,7,TVK chief Vijay booked by Chennai police for poll code violations during campaign in city,https://www.thehindu.com/elections/tamil-nadu-assembly/tvk-chief-vijay-booked-by-chennai-police-for-poll-code-violations-during-campaign-in-city/article70868049.ece,2026-04-17T06:07:25+00:00
Chennai,The Hindu,Chennai • The Hindu,https://www.thehindu.com/news/cities/chennai/,8,"Tamil Nadu election: Home voting for 8,947 voters begins in Chennai",https://www.thehindu.com/elections/tamil-nadu-assembly/home-voting-for-8947-voters-begins-in-chennai/article70870137.ece,2026-04-17T06:07:25+00:00
Chennai,The Hindu,Chennai • The Hindu,https://www.thehindu.com/news/cities/chennai/,9,IPL 2026 | This Chennai groom’s CSK-themed wedding invite is winning hearts,https://www.thehindu.com/news/cities/chennai/ipl-2026-this-chennai-grooms-csk-themed-wedding-invite-is-winning-hearts/article70860643.ece,2026-04-17T06:07:25+00:00
Chennai,The Hindu,Chennai • The Hindu,https://www.thehindu.com/news/cities/chennai/,10,A trip down Khader Nawaz Khan Road’s residential past,https://www.thehindu.com/news/cities/chennai/a-trip-down-chennai-khader-nawaz-khan-road-residential-past/article70860497.ece,2026-04-17T06:07:25+00:00
Chennai,The Hindu,Chennai • The Hindu,https://www.thehindu.com/news/cities/chennai/,11,Some questions that are beyond textbooks,https://www.thehindu.com/children/some-questions-that-are-beyond-textbooks/article70837282.ece,2026-04-17T06:07:25+00:00
Chennai,The Hindu,Chennai • The Hindu,https://www.thehindu.com/news/cities/chennai/,12,What Anna Nagar voters want: Otteri Nullah monitored; pedestrian spaces freed up; parking policy sharpened; feeder services provided,https://www.thehindu.com/news/cities/chennai/anna-nagar-voters-bring-up-unfinished-business/article70853308.ece,2026-04-17T06:07:25+00:00
Chennai,The Hindu,Chennai • The Hindu,https://www.thehindu.com/news/cities/chennai/,13,A ‘developing’ community story with subplots in Chennai,https://www.thehindu.com/news/cities/chennai/a-developing-community-story-with-plots-and-subplots-in-chennai/article70853251.ece,2026-04-17T06:07:25+00:00
Chennai,The Hindu,Chennai • The Hindu,https://www.thehindu.com/news/cities/chennai/,14,Tiruvottiyur constituency: Environmental pollution remains a major concern in this industrial zone,https://www.thehindu.com/elections/tamil-nadu-assembly/environmental-pollution-remains-a-major-concern-in-this-industrial-zone/article70847911.ece,2026-04-17T06:07:25+00:00
Chennai,The Hindu,Chennai • The Hindu,https://www.thehindu.com/news/cities/chennai/,15,Commuters seek bus services from Vandalur railway station,https://www.thehindu.com/news/cities/chennai/commuters-seekbus-servicesfromvandalurrailway-station/article70850745.ece,2026-04-17T06:07:25+00:00
Chennai,The Hindu,Chennai • The Hindu,https://www.thehindu.com/news/cities/chennai/,16,"Tamil Nadu Assembly election 2026: CM Stalin takes surprise Chennai Metro ride, interacts with passengers",https://www.thehindu.com/elections/tamil-nadu-assembly/tamil-nadu-cm-stalin-takes-surprise-ride-in-chennai-metro-interacts-with-passengers/article70845958.ece,2026-04-17T06:07:25+00:00
Chennai,The Hindu,Chennai • The Hindu,https://www.thehindu.com/news/cities/chennai/,17,Bring northern parts of Chennai ‘closer’ to Velachery,https://www.thehindu.com/news/cities/chennai/bring-northern-parts-of-chennai-closer-to-velachery/article70831157.ece,2026-04-17T06:07:25+00:00
Chennai,The Hindu,Chennai • The Hindu,https://www.thehindu.com/news/cities/chennai/,18,Madras High Court dismisses Tamannaah Bhatia’s plea for ₹1-crore damages from Power Soaps,https://www.thehindu.com/news/national/tamil-nadu/madras-high-court-dismisses-tamannaah-bhatias-plea-for-1-crore-damages-from-power-soaps/article70867763.ece,2026-04-17T06:07:25+00:00
Chennai,The Hindu,Chennai • The Hindu,https://www.thehindu.com/news/cities/chennai/,19,"‘Bigg Boss’ fame ‘Vikkals’ Vikram turns hero with ‘Light Weight, Baby!’",https://www.thehindu.com/entertainment/movies/bigg-boss-fame-vikkals-vikram-turns-hero-with-light-weight-baby/article70860290.ece,2026-04-17T06:07:25+00:00
Chennai,The Hindu,Chennai • The Hindu,https://www.thehindu.com/news/cities/chennai/,20,Coimbatore cable TV operator arrested for telecasting leaked footage of Jana Nayagan,https://www.thehindu.com/news/national/tamil-nadu/coimbatore-cable-tv-operator-arrested-for-telecasting-leaked-footage-of-jana-nayagan/article70857584.ece,2026-04-17T06:07:25+00:00
Chennai,The Hindu,Chennai • The Hindu,https://www.thehindu.com/news/cities/chennai/,21,Tamil Nadu Assembly Elections: Voters urged to keep conscience and palms clean,https://www.thehindu.com/news/cities/chennai/tamil-nadu-assembly-elections-voters-urged-to-keep-conscience-and-palms-clean/article70872427.ece,2026-04-17T06:07:25+00:00
Chennai,The Hindu,Chennai • The Hindu,https://www.thehindu.com/news/cities/chennai/,22,Two ophthalmologists win awards for educational films,https://www.thehindu.com/news/cities/chennai/two-ophthalmologists-win-awards-for-educational-films/article70870150.ece,2026-04-17T06:07:25+00:00
Chennai,The Hindu,Chennai • The Hindu,https://www.thehindu.com/news/cities/chennai/,23,Kia creates exclusive parking at Rajinikanth’s tribute event,https://www.thehindu.com/news/cities/chennai/kia-creates-exclusive-parking-at-rajinikanths-tribute-event/article70870654.ece,2026-04-17T06:07:25+00:00
Chennai,The Hindu,Chennai • The Hindu,https://www.thehindu.com/news/cities/chennai/,24,Two held for sexual assault on minor boys,https://www.thehindu.com/news/cities/chennai/two-held-for-sexual-assault-on-minor-boys/article70869374.ece,2026-04-17T06:07:25+00:00
Chennai,The Hindu,Chennai • The Hindu,https://www.thehindu.com/news/cities/chennai/,25,BIS organises programme on safety standards for toys,https://www.thehindu.com/news/cities/chennai/bis-organises-programme-on-safety-standards-for-toys/article70869685.ece,2026-04-17T06:07:25+00:00
Chennai,The Hindu,Chennai • The Hindu,https://www.thehindu.com/news/cities/chennai/,26,Man arrested for murder in Saidapet,https://www.thehindu.com/news/cities/chennai/man-arrested-for-murder-in-saidapet/article70866324.ece,2026-04-17T06:07:25+00:00
Chennai,The Hindu,Chennai • The Hindu,https://www.thehindu.com/news/cities/chennai/,27,"Residents, NGO revive Vengathur lake into a rich groundwater source",https://www.thehindu.com/news/cities/chennai/residents-ngo-revive-vengathur-lake-into-a-rich-groundwater-source/article70865511.ece,2026-04-17T06:07:25+00:00
Chennai,The Hindu,Chennai • The Hindu,https://www.thehindu.com/news/cities/chennai/,28,Hospital launches programme for high-risk heart patients,https://www.thehindu.com/news/cities/chennai/hospital-launches-programme-for-high-risk-heart-patients/article70864639.ece,2026-04-17T06:07:25+00:00
Chennai,The Hindu,Chennai • The Hindu,https://www.thehindu.com/news/cities/chennai/,29,"Japan’s Create Medic enters India via Chennai, plans manufacturing unit",https://www.thehindu.com/news/cities/chennai/japans-create-medic-enters-india-via-chennai-plans-manufacturing-unit/article70865422.ece,2026-04-17T06:07:25+00:00
Chennai,The Hindu,Chennai • The Hindu,https://www.thehindu.com/news/cities/chennai/,30,Bartimaeus Trinity Trust completes 20 years of service to visually impaired,https://www.thehindu.com/news/cities/chennai/bartimaeus-trinity-trust-completes-20-years-of-service-to-visually-impaired/article70865712.ece,2026-04-17T06:07:25+00:00
