city,publisher,source,source_url,rank,headline,link,collected_at_iso
Pune,Pune Mirror,Pune • Pune Mirror,https://punemirror.com/,39,Gujarat-Maharashtra Day Celebrated in the US with Heritage and Diaspora Pride,https://punemirror.com/india/gujarat-maharashtra-day-celebrated-in-the-us-with-heritage-and-diaspora-pride/,2026-06-11T23:41:34+00:00
Pune,Pune Mirror,Pune • Pune Mirror,https://punemirror.com/,40,"BJP Surges in Bengal, Set for Third Term in Assam",https://punemirror.com/elections/bjp-election-results-2026-assam-west-bengal/,2026-06-11T23:41:34+00:00
Pune,Pune Mirror,Pune • Pune Mirror,https://punemirror.com/,41,"LPG Rules changing from June 1, Government Enforces One Connection Per Household",https://punemirror.com/news/lpg-rules-changing-from-june-1-government-enforces-one-connection-per-household/,2026-06-11T23:41:34+00:00
Pune,Pune Mirror,Pune • Pune Mirror,https://punemirror.com/,42,Mythos AI cybersecurity India sparks urgent and alarming security overhaul,https://punemirror.com/technology/ai/mythos-ai-cybersecurity-india-banks-govt-risk/,2026-06-11T23:41:34+00:00
Pune,Pune Mirror,Pune • Pune Mirror,https://punemirror.com/,43,Cockroach Janta Party: How a CJI Remark Sparked a Sarcastic Youth Political Movement,https://punemirror.com/news/cockroach-janta-party-abhijeet-dipke-youth-satire/,2026-06-11T23:41:34+00:00
Pune,Pune Mirror,Pune • Pune Mirror,https://punemirror.com/,44,"Global conflict, local costs",https://punemirror.com/india/global-conflict-impact-local-pune-fuel-gold-rupee-explained/,2026-06-11T23:41:34+00:00
Pune,Pune Mirror,Pune • Pune Mirror,https://punemirror.com/,45,Xbox layoffs brutal reset: powerful strategic shake-up,https://punemirror.com/business/xbox-layoffs-strategic-reset-shocks-gaming/,2026-06-11T23:41:34+00:00
Pune,Pune Mirror,Pune • Pune Mirror,https://punemirror.com/,46,Bitcoin ETF outflows trigger brutal slump in crypto market,https://punemirror.com/business/bitcoin-etf-outflows-crypto-market-pressure/,2026-06-11T23:41:34+00:00
Pune,Pune Mirror,Pune • Pune Mirror,https://punemirror.com/,47,Elon Musk Apple OpenAI lawsuit suffers major legal setback,https://punemirror.com/technology/elon-musk-apple-openai-lawsuit-emails/,2026-06-11T23:41:34+00:00
Pune,Pune Mirror,Pune • Pune Mirror,https://punemirror.com/,48,South Korea sixth-largest stock market triumphs in stunning AI-fuelled surge,https://punemirror.com/business/finance/south-korea-sixth-largest-stock-market/,2026-06-11T23:41:34+00:00
Pune,Pune Mirror,Pune • Pune Mirror,https://punemirror.com/,49,Global temperature rise predictions signal alarming climate emergency,https://punemirror.com/world/global-temperature-rise-predictions-2026-2030/,2026-06-11T23:41:34+00:00
Pune,Pune Mirror,Pune • Pune Mirror,https://punemirror.com/,50,Peace bid amid war fears,https://punemirror.com/world/trump-considering-fresh-strikes-iran-stalled-talks/,2026-06-11T23:41:34+00:00
Pune,Pune Mirror,Pune • Pune Mirror,https://punemirror.com/,51,The rupee sinks deeper,https://punemirror.com/city/pune/indian-rupee-hits-record-low-96-against-us-dollar/,2026-06-11T23:41:34+00:00
Pune,Pune Mirror,Pune • Pune Mirror,https://punemirror.com/,52,Nobody wants war,https://punemirror.com/world/barakah-nuclear-plant-drone-strike-uae-trump-iran-warning-west-asia-escalation-2026/,2026-06-11T23:41:34+00:00
Pune,Pune Mirror,Pune • Pune Mirror,https://punemirror.com/,53,"Honda June 2026 Discounts Deliver Massive Savings On Elevate, City And Amaze",https://punemirror.com/automobile/honda-june-2026-discounts-elevate-city-amaze/,2026-06-11T23:41:34+00:00
Pune,Pune Mirror,Pune • Pune Mirror,https://punemirror.com/,54,Maruti Suzuki Arena June discounts deliver big savings,https://punemirror.com/automobile/maruti-suzuki-arena-june-discounts-90000/,2026-06-11T23:41:34+00:00
Pune,Pune Mirror,Pune • Pune Mirror,https://punemirror.com/,55,VinFast Limo Green taxi delivers powerful boost to India EV cabs,https://punemirror.com/automobile/vinfast-limo-green-taxi-india-launch/,2026-06-11T23:41:34+00:00
Pune,Pune Mirror,Pune • Pune Mirror,https://punemirror.com/,56,Tata Tiago 2026 Review,https://punemirror.com/automobile/tata-tiago-2026-review/,2026-06-11T23:41:34+00:00
Pune,Pune Mirror,Pune • Pune Mirror,https://punemirror.com/,57,Flat stomach obsession: Taapsee Pannu’s powerful wake-up call,https://punemirror.com/health/flat-stomach-obsession-taapsee-body-positivity/,2026-06-11T23:41:34+00:00
Pune,Pune Mirror,Pune • Pune Mirror,https://punemirror.com/,58,Why Migraine Is More Than Just a Headache,https://punemirror.com/health/migraine-morethan-headache/,2026-06-11T23:41:34+00:00
Pune,Pune Mirror,Pune • Pune Mirror,https://punemirror.com/,59,Two-week social media break delivers powerful mental health boost,https://punemirror.com/health/two-week-social-media-break-brain-benefits/,2026-06-11T23:41:34+00:00
Pune,Pune Mirror,Pune • Pune Mirror,https://punemirror.com/,60,‘Alzheimer’s treatment can’t be generalised,https://punemirror.com/health/alzheimers-study-three-patterns-cognitive-decline/,2026-06-11T23:41:34+00:00
Pune,Pune Mirror,Pune • Pune Mirror,https://punemirror.com/,61,FIFA World Cup Launch Edition Delivers Powerful New Netflix Gaming Boost,https://punemirror.com/sports/fifa-world-cup-launch-edition-game/,2026-06-11T23:41:34+00:00
Pune,Pune Mirror,Pune • Pune Mirror,https://punemirror.com/,62,Virat Kohli Ruled out of ODI Series Due To Hamstring Injury,https://punemirror.com/sports/viratkohli-odi-ruledout-sports-injury/,2026-06-11T23:41:34+00:00
Pune,Pune Mirror,Pune • Pune Mirror,https://punemirror.com/,63,RCB Win Back-To-Back Ipl Titles But No Victory Parade In Bengaluru,https://punemirror.com/sports/cricket/rcb-ipl-2026-title-no-victory-parade-bengaluru-stampede-2025-dk-shivakumar-june-2026/,2026-06-11T23:41:34+00:00
Pune,Pune Mirror,Pune • Pune Mirror,https://punemirror.com/,64,Virat Kohli’s Unbeaten 75 Seals RCB’s Back-To-Back IPL Titles,https://punemirror.com/sports/cricket/rcb-ipl-2026-final-virat-kohli-75-back-to-back-title-gujarat-titans-ahmedabad/,2026-06-11T23:41:34+00:00
Pune,Pune Mirror,Pune • Pune Mirror,https://punemirror.com/,65,The Device on Deepinder Goyal’s Temple That Stole the Spotlight — and Why the Internet Is Split,https://punemirror.com/trending/deepinder-goyal-temple-device-podcast-viral/,2026-06-11T23:41:34+00:00
Pune,Pune Mirror,Pune • Pune Mirror,https://punemirror.com/,66,The Hyper-Speed Era: Why Everything Is a ‘Trend’ and Nothing Lasts,https://punemirror.com/trending/why-everything-is-a-trend-and-nothing-lasts/,2026-06-11T23:41:34+00:00
Pune,Pune Mirror,Pune • Pune Mirror,https://punemirror.com/,67,Amazon Black Friday OnePlus Deals 2025: Massive Savings on Flagship Phones,https://punemirror.com/technology/amazon-black-friday-oneplus-deals-2025/,2026-06-11T23:41:34+00:00
Pune,Pune Mirror,Pune • Pune Mirror,https://punemirror.com/,68,Nobel Prize 2025: Discovery of Regulatory T-Cells and FOXP3 Gene Wins Medicine Award,https://punemirror.com/news/nobel-prize-2025-discovery-of-regulatory-t-cells-and-foxp3-gene-wins-medicine-award/,2026-06-11T23:41:34+00:00
Pune,Pune Mirror,Pune • Pune Mirror,https://punemirror.com/,69,Pahalgam terrorist gunned down; Three killed in J-K encounter,https://punemirror.com/trending/pahalgam-terrorist-gunned-down-three-killed-in-j-k-encounter/,2026-06-11T23:41:34+00:00
Pune,Pune Mirror,Pune • Pune Mirror,https://punemirror.com/,70,Startup India Fund of Funds 2.0: Powerful Boost for Startups,https://punemirror.com/india/startup-india-fund-of-funds-2-0-boost/,2026-06-11T23:41:34+00:00
Pune,Pune Mirror,Pune • Pune Mirror,https://punemirror.com/,71,Sarvam AI Bulbul V3 delivers stunning win over global AI rivals,https://punemirror.com/technology/ai/sarvam-ai-bulbul-v3-outshines-rivals/,2026-06-11T23:41:34+00:00
Pune,Pune Mirror,Pune • Pune Mirror,https://punemirror.com/,72,The Startup Evolution: From Survival Mode to Sustainable Success,https://punemirror.com/business/startups/from-survival-mode-to-sustainable-success/,2026-06-11T23:41:34+00:00
Pune,Pune Mirror,Pune • Pune Mirror,https://punemirror.com/,73,Why Youngsters Prefer Late-Night Rides Despite Safety Risks,https://punemirror.com/lifestyle/latenight-ride-youngsters-freedom/,2026-06-11T23:41:34+00:00
Pune,Pune Mirror,Pune • Pune Mirror,https://punemirror.com/,74,"Air India To Cut Domestic Flights By 22%, International By 27% As High Fuel Prices Squeeze Operations",https://punemirror.com/lifestyle/travel/air-india-domestic-flights-cut-22-percent-fuel-prices-june-august-2026/,2026-06-11T23:41:34+00:00
Pune,Pune Mirror,Pune • Pune Mirror,https://punemirror.com/,75,"Denim Comeback: How Old-School Jeans Styles Are Returning, Low-Waist Vs High-Waist Jeans: What’s Trending In 2026",https://punemirror.com/lifestyle/denimcomeback-fashiontrend-jeans/,2026-06-11T23:41:34+00:00
Pune,Pune Mirror,Pune • Pune Mirror,https://punemirror.com/,76,Why is this generation delaying and questioning marriage,https://punemirror.com/news/why-is-this-generation-delaying-and-questioning-marriage/,2026-06-11T23:41:34+00:00
Pune,Pune Mirror,Pune • Pune Mirror,https://punemirror.com/,77,Morning vs Evening Workout: Which is better for weight loss and fitness,https://punemirror.com/lifestyle/morning-vs-evening-workout-weightloss/,2026-06-11T23:41:34+00:00
Pune,Pune Mirror,Pune • Pune Mirror,https://punemirror.com/,78,UPI transactions May 2026 deliver stunning record high,https://punemirror.com/business/upi-transactions-may-2026-record-surge-india/,2026-06-11T23:41:34+00:00
Pune,Pune Mirror,Pune • Pune Mirror,https://punemirror.com/,79,"India GST collections May 2026: Strong, record‑high surge powered by imports",https://punemirror.com/business/india-gst-collections-may-2026-update/,2026-06-11T23:41:34+00:00
Pune,Pune Mirror,Pune • Pune Mirror,https://punemirror.com/,80,NSE Closing Auction Session: Powerful boost as F&O timings extended,https://punemirror.com/stock-market/nse-closing-auction-session-fno-time-extension/,2026-06-11T23:41:34+00:00
Pune,Pune Mirror,Pune • Pune Mirror,https://punemirror.com/,81,India gold import duty hike: Shock plunge in demand stuns market,https://punemirror.com/business/india-gold-import-duty-hike-demand-slumps/,2026-06-11T23:41:34+00:00
Pune,Pune Mirror,Pune • Pune Mirror,https://punemirror.com/,82,Google Wallet Aadhaar Digital ID delivers powerful privacy boost,https://punemirror.com/business/google-wallet-aadhaar-digital-id-rollout/,2026-06-11T23:41:34+00:00
Pune,Pune Mirror,Pune • Pune Mirror,https://punemirror.com/,83,"Pune Police Raid “Project X” Party in Tulapur, Dozens Detained",https://punemirror.com/city/pune/pune-police-raid-project-x-party-in-tulapur-dozens-detained/,2026-06-11T23:41:34+00:00
Pune,Pune Mirror,Pune • Pune Mirror,https://punemirror.com/,84,Four Arrested In Pune After Live-In Partner Dies By Suicide; Extortion Allegations Surface,https://punemirror.com/city/pune/pune-suicide-case-four-arrested-live-in-partner-kharadi/,2026-06-11T23:41:34+00:00
Pune,Pune Mirror,Pune • Pune Mirror,https://punemirror.com/,85,Dowry Harassment Cases Surface In Pune; One Arrested After Woman’s Death,https://punemirror.com/city/pune/pune-dowry-harassment-cases-kondhwa-husband-arrested/,2026-06-11T23:41:34+00:00
Pune,Pune Mirror,Pune • Pune Mirror,https://punemirror.com/,86,Twisha Sharma Case: Samarth Singh And Mother Giribala Singh Sent To CBI Custody Till June 2,https://punemirror.com/city/crime/twisha-sharma-samarth-singh-giribala-singh-cbi-custody-june-2-bhopal-2026/,2026-06-11T23:41:34+00:00
Pune,Pune Mirror,Pune • Pune Mirror,https://punemirror.com/,87,Jewellery Showroom Employee Flees With 39 Gold Chains Worth Rs. 34 Lakh In Pimpri,https://punemirror.com/city/pune/pimpri-jewellery-showroom-employee-steals-gold-chains/,2026-06-11T23:41:34+00:00
Pune,Pune Mirror,Pune • Pune Mirror,https://punemirror.com/,88,"Ferrari unveils the HC25, a One-Off project based on the F8 Spider",https://punemirror.com/automobile/ferrari-hc25-one-off-f8-spider-special-project/,2026-06-11T23:41:34+00:00
Pune,Pune Mirror,Pune • Pune Mirror,https://punemirror.com/,89,Apple Design Awards 2026 Finalists Include Two Indian Origin Apps,https://punemirror.com/technology/apple-design-awards-2026-indian-origin-apps-finalists/,2026-06-11T23:41:34+00:00
Pune,Pune Mirror,Pune • Pune Mirror,https://punemirror.com/,90,Ultraviolette and Bolt.Earth Expand Type-6 Charging network to 130 Chargers,https://punemirror.com/automobile/ultraviolette-bolt-earth-type-6-fast-charging-network-expansion/,2026-06-11T23:41:34+00:00
Pune,Pune Mirror,Pune • Pune Mirror,https://punemirror.com/,91,Apple Announces Two New Health Features on the Apple Watch and AirPods Pro,https://punemirror.com/technology/apple-sleep-apnea-hearing-test-features-india/,2026-06-11T23:41:34+00:00
Pune,Pune Mirror,Pune • Pune Mirror,https://punemirror.com/,92,MINI Cooper S GP Inspired Edition Launched,https://punemirror.com/automobile/mini-cooper-s-gp-inspired-edition-india-launch-price/,2026-06-11T23:41:34+00:00
Pune,Pune Mirror,Pune • Pune Mirror,https://punemirror.com/,93,BMW Group India launches Summer Service Campaign 2026,https://punemirror.com/automobile/bmw-group-india-summer-service-campaign-2026/,2026-06-11T23:41:34+00:00
Pune,Pune Mirror,Pune • Pune Mirror,https://punemirror.com/,94,Samsung and Google Reveal Intelligent Eyewear at Google I/O 2026,https://punemirror.com/technology/samsung-and-google-reveal-intelligent-eyewear-at-google-i-o-2026/,2026-06-11T23:41:34+00:00
Pune,Pune Mirror,Pune • Pune Mirror,https://punemirror.com/,95,Samsung launches full 2026 Vision AI TV lineup in India,https://punemirror.com/technology/samsung-2026-tv-lineup-india-micro-rgb-oled-neo-qled/,2026-06-11T23:41:34+00:00
Pune,Pune Mirror,Pune • Pune Mirror,https://punemirror.com/,96,Governor Jishnu Dev Varma Honours Police Personnel at Pune Times Mirror’s ‘Big Salute 2026’,https://punemirror.com/city/pune/big-salute-2026-governor-jishnu-dev-varma-honours-pune-police/,2026-06-11T23:41:34+00:00
Pune,Pune Mirror,Pune • Pune Mirror,https://punemirror.com/,97,Big Salute 2026: Honouring the Guardians Who Stand Watch While We Sleep,https://punemirror.com/pune-mirror-explore/big-salute-2026-pune-times-mirror-police-honours/,2026-06-11T23:41:34+00:00
Pune,Pune Mirror,Pune • Pune Mirror,https://punemirror.com/,98,PUNE MIRROR EXPLORE,https://punemirror.com/pune-mirror-explore/,2026-06-11T23:41:34+00:00
Pune,Pune Mirror,Pune • Pune Mirror,https://punemirror.com/,99,PMC Headquarters Evacuated After Bomb Threat Email,https://punemirror.com/city/pune/pmc-bomb-threat-email-evacuation/,2026-06-11T23:41:34+00:00
Pune,Pune Mirror,Pune • Pune Mirror,https://punemirror.com/,100,Purandar Farmers get Deadline till 10th June to Submit consent letter for New Airport Project,https://punemirror.com/news/purandar-farmers-10th-june-deadline/,2026-06-11T23:41:34+00:00
Pune,Pune Mirror,Pune • Pune Mirror,https://punemirror.com/,101,Dug-Up Wagholi–Lohegaon Road Leaves Students and Commuters Struggling,https://punemirror.com/city/pune/wagholi-lohegaon-road-work-students-commuters-trouble/,2026-06-11T23:41:34+00:00
Pune,Pune Mirror,Pune • Pune Mirror,https://punemirror.com/,102,"Two Workers Killed, Three Injured in CO₂ Gas Leak at Schaeffler India Plant in Talegaon MIDC",https://punemirror.com/city/pune/schaeffler-india-co2-gas-leak-talegaon-midc-workers-killed/,2026-06-11T23:41:34+00:00
Pune,Pune Mirror,Pune • Pune Mirror,https://punemirror.com/,103,Viral Pune Divorce Maintenance Claim Sparks Debate on Social Media,https://punemirror.com/city/pune/viral-pune-divorce-maintenance-claim-alimony-debate/,2026-06-11T23:41:34+00:00
Pune,Pune Mirror,Pune • Pune Mirror,https://punemirror.com/,104,Marathi Film ‘Kapbashi’ Promotion Trip Ends in Road Mishap Near Satara; Actors Safe,https://punemirror.com/city/pune/kapbashi-film-promotion-trip-accident-satara-actors-safe/,2026-06-11T23:41:34+00:00
Pune,Pune Mirror,Pune • Pune Mirror,https://punemirror.com/,105,"Farah Khan and Riteish Deshmukh Step In as Lock Upp Season 2 Hosts, Replacing Kangana Ranaut",https://punemirror.com/entertainment/lockupp-season2-farahkhan-riteshdeshmukh-newhosts/,2026-06-11T23:41:34+00:00
Pune,Pune Mirror,Pune • Pune Mirror,https://punemirror.com/,106,Lupin Part 4 OTT Release Date Brings Powerful Comeback Surprise,https://punemirror.com/entertainment/lupin-part-4-ott-release-date-netflix/,2026-06-11T23:41:34+00:00
Pune,Pune Mirror,Pune • Pune Mirror,https://punemirror.com/,107,Michael Jackson biopic OTT triumph: powerful new way to watch ‘Michael’,https://punemirror.com/entertainment/michael-jackson-biopic-ott-release/,2026-06-11T23:41:34+00:00
Pune,Pune Mirror,Pune • Pune Mirror,https://punemirror.com/,108,Ginny Wedss Sunny 2 OTT release: ZEE5 streaming begins,https://punemirror.com/entertainment/ginny-wedss-sunny-2-ott-release/,2026-06-11T23:41:34+00:00
Pune,Pune Mirror,Pune • Pune Mirror,https://punemirror.com/,109,India Gets Access to IMAX Bookings for Christopher Nolan’s The Odyssey,https://punemirror.com/news/india-gets-access-to-imax-bookings-for-christopher-nolans-the-odyssey/,2026-06-11T23:41:34+00:00
Pune,Pune Mirror,Pune • Pune Mirror,https://punemirror.com/,110,Brown Season 1 review: Gripping yet Flawed Crime Thriller Triumphs,https://punemirror.com/entertainment/brown-season-1-review-zee5-thriller/,2026-06-11T23:41:34+00:00
Pune,Pune Mirror,Pune • Pune Mirror,https://punemirror.com/,111,The Devil Wears Prada 2 OTT: Powerful good news for fans,https://punemirror.com/entertainment/the-devil-wears-prada-2-ott-release-guide-2/,2026-06-11T23:41:34+00:00
Pune,IE,Pune • IE,https://indianexpress.com/article/cities/pune/,1,Live Cricket Score,https://indianexpress.com/section/sports/cricket/live-score/,2026-06-11T23:41:34+00:00
Pune,IE,Pune • IE,https://indianexpress.com/article/cities/pune/,2,Indian Express Live TV,https://indianexpress.com/live-tv/,2026-06-11T23:41:34+00:00
Pune,IE,Pune • IE,https://indianexpress.com/article/cities/pune/,3,Mumbai Weather Today,https://indianexpress.com/section/weather/mumbai-weather-forecast-today/,2026-06-11T23:41:34+00:00
Pune,IE,Pune • IE,https://indianexpress.com/article/cities/pune/,4,Bangalore Weather Today,https://indianexpress.com/section/weather/bangalore-weather-forecast-today/,2026-06-11T23:41:34+00:00
Pune,IE,Pune • IE,https://indianexpress.com/article/cities/pune/,5,Chennai Weather Today,https://indianexpress.com/section/weather/chennai-weather-forecast-today/,2026-06-11T23:41:34+00:00
Pune,IE,Pune • IE,https://indianexpress.com/article/cities/pune/,6,Pune Weather Today,https://indianexpress.com/section/weather/pune-weather-forecast-today/,2026-06-11T23:41:34+00:00
Pune,IE,Pune • IE,https://indianexpress.com/article/cities/pune/,7,Ahmedabad Weather Today,https://indianexpress.com/section/weather/ahmedabad-weather-forecast-today/,2026-06-11T23:41:34+00:00
Pune,IE,Pune • IE,https://indianexpress.com/article/cities/pune/,8,Lucknow Weather Today,https://indianexpress.com/section/weather/lucknow-weather-forecast-today/,2026-06-11T23:41:34+00:00
Pune,IE,Pune • IE,https://indianexpress.com/article/cities/pune/,9,Chandigarh Weather Today,https://indianexpress.com/section/weather/chandigarh-weather-forecast-today/,2026-06-11T23:41:34+00:00
Pune,IE,Pune • IE,https://indianexpress.com/article/cities/pune/,10,Indore Weather Today,https://indianexpress.com/section/weather/indore-weather-forecast-today/,2026-06-11T23:41:34+00:00
Pune,IE,Pune • IE,https://indianexpress.com/article/cities/pune/,11,Panaji Weather Today,https://indianexpress.com/section/weather/panaji-weather-forecast-today/,2026-06-11T23:41:34+00:00
Pune,IE,Pune • IE,https://indianexpress.com/article/cities/pune/,12,Manali Weather Today,https://indianexpress.com/section/weather/manali-weather-forecast-today/,2026-06-11T23:41:34+00:00
Pune,IE,Pune • IE,https://indianexpress.com/article/cities/pune/,13,Kodaikanal Weather Today,https://indianexpress.com/section/weather/kodaikanal-weather-forecast-today/,2026-06-11T23:41:34+00:00
Pune,IE,Pune • IE,https://indianexpress.com/article/cities/pune/,14,Thane Weather Today,https://indianexpress.com/section/weather/thane-weather-forecast-today/,2026-06-11T23:41:34+00:00
Pune,IE,Pune • IE,https://indianexpress.com/article/cities/pune/,15,Bijapur Weather Today,https://indianexpress.com/section/weather/bijapur-weather-forecast-today/,2026-06-11T23:41:34+00:00
Pune,IE,Pune • IE,https://indianexpress.com/article/cities/pune/,16,Gulbarga Weather Today,https://indianexpress.com/section/weather/gulbarga-weather-forecast-today/,2026-06-11T23:41:34+00:00
Pune,IE,Pune • IE,https://indianexpress.com/article/cities/pune/,17,Malegaon Weather Today,https://indianexpress.com/section/weather/malegaon-weather-forecast-today/,2026-06-11T23:41:34+00:00
Pune,IE,Pune • IE,https://indianexpress.com/article/cities/pune/,18,Bhusawal Weather Today,https://indianexpress.com/section/weather/bhusawal-weather-forecast-today/,2026-06-11T23:41:34+00:00
Pune,IE,Pune • IE,https://indianexpress.com/article/cities/pune/,19,Gurgaon Weather Today,https://indianexpress.com/section/weather/gurgaon-weather-forecast-today/,2026-06-11T23:41:34+00:00
Pune,IE,Pune • IE,https://indianexpress.com/article/cities/pune/,20,Yavatmal Weather Today,https://indianexpress.com/section/weather/yavatmal-weather-forecast-today/,2026-06-11T23:41:34+00:00
Pune,IE,Pune • IE,https://indianexpress.com/article/cities/pune/,21,Gangtok Weather Today,https://indianexpress.com/section/weather/gangtok-weather-forecast-today/,2026-06-11T23:41:34+00:00
Pune,IE,Pune • IE,https://indianexpress.com/article/cities/pune/,22,Thrissur Weather Today,https://indianexpress.com/section/weather/thrissur-weather-forecast-today/,2026-06-11T23:41:34+00:00
Pune,IE,Pune • IE,https://indianexpress.com/article/cities/pune/,23,Udupi Weather Today,https://indianexpress.com/section/weather/udupi-weather-forecast-today/,2026-06-11T23:41:34+00:00
Pune,IE,Pune • IE,https://indianexpress.com/article/cities/pune/,24,Koppal Weather Today,https://indianexpress.com/section/weather/koppal-weather-forecast-today/,2026-06-11T23:41:34+00:00
Pune,IE,Pune • IE,https://indianexpress.com/article/cities/pune/,25,Dhule Weather Today,https://indianexpress.com/section/weather/dhule-weather-forecast-today/,2026-06-11T23:41:34+00:00
Pune,IE,Pune • IE,https://indianexpress.com/article/cities/pune/,26,Ooty Weather Today,https://indianexpress.com/section/weather/ooty-weather-forecast-today/,2026-06-11T23:41:34+00:00
Pune,IE,Pune • IE,https://indianexpress.com/article/cities/pune/,27,Panchkula Weather Today,https://indianexpress.com/section/weather/panchkula-weather-forecast-today/,2026-06-11T23:41:34+00:00
Pune,IE,Pune • IE,https://indianexpress.com/article/cities/pune/,28,Kulgam Weather Today,https://indianexpress.com/section/weather/kulgam-weather-forecast-today/,2026-06-11T23:41:34+00:00
Pune,IE,Pune • IE,https://indianexpress.com/article/cities/pune/,29,Kannur Weather Today,https://indianexpress.com/section/weather/kannur-weather-forecast-today/,2026-06-11T23:41:34+00:00
Pune,IE,Pune • IE,https://indianexpress.com/article/cities/pune/,30,Valparai Weather Today,https://indianexpress.com/section/weather/valparai-weather-forecast-today/,2026-06-11T23:41:34+00:00
Pune,IE,Pune • IE,https://indianexpress.com/article/cities/pune/,31,Hosur Weather Today,https://indianexpress.com/section/weather/hosur-weather-forecast-today/,2026-06-11T23:41:34+00:00
Pune,IE,Pune • IE,https://indianexpress.com/article/cities/pune/,32,Rajouri Weather Today,https://indianexpress.com/section/weather/rajouri-weather-forecast-today/,2026-06-11T23:41:34+00:00
Pune,IE,Pune • IE,https://indianexpress.com/article/cities/pune/,33,Kolkata Weather Today,https://indianexpress.com/section/weather/kolkata-weather-forecast-today/,2026-06-11T23:41:34+00:00
Pune,IE,Pune • IE,https://indianexpress.com/article/cities/pune/,34,Davanagere Weather Today,https://indianexpress.com/section/weather/davanagere-weather-forecast-today/,2026-06-11T23:41:34+00:00
Pune,IE,Pune • IE,https://indianexpress.com/article/cities/pune/,35,Metpally Weather Today,https://indianexpress.com/section/weather/metpally-weather-forecast-today/,2026-06-11T23:41:34+00:00
Pune,IE,Pune • IE,https://indianexpress.com/article/cities/pune/,36,Dharmshala Weather Today,https://indianexpress.com/section/weather/dharamshala-weather-forecast-today/,2026-06-11T23:41:34+00:00
Pune,IE,Pune • IE,https://indianexpress.com/article/cities/pune/,37,Srinagar Weather Today,https://indianexpress.com/section/weather/srinagar-weather-forecast-today/,2026-06-11T23:41:34+00:00
Pune,IE,Pune • IE,https://indianexpress.com/article/cities/pune/,38,Tumkur Weather Today,https://indianexpress.com/section/weather/tumkur-weather-forecast-today/,2026-06-11T23:41:34+00:00
Pune,IE,Pune • IE,https://indianexpress.com/article/cities/pune/,39,Balangir Weather Today,https://indianexpress.com/section/weather/balangir-weather-forecast-today/,2026-06-11T23:41:34+00:00
Pune,IE,Pune • IE,https://indianexpress.com/article/cities/pune/,40,Greater Noida Weather Today,https://indianexpress.com/section/weather/greater-noida-weather-forecast-today/,2026-06-11T23:41:34+00:00
Pune,IE,Pune • IE,https://indianexpress.com/article/cities/pune/,41,Kalaburagi Weather Today,https://indianexpress.com/section/weather/kalaburagi-weather-forecast-today/,2026-06-11T23:41:34+00:00
Pune,IE,Pune • IE,https://indianexpress.com/article/cities/pune/,42,Mahesena Weather Today,https://indianexpress.com/section/weather/mahesana-weather-forecast-today/,2026-06-11T23:41:34+00:00
