city,publisher,source,source_url,rank,headline,link,collected_at_iso
Bengaluru,DC,Bengaluru • DC,https://www.deccanchronicle.com/location/india/karnataka/bengaluru,1,FIFA World Cup 2026,https://www.deccanchronicle.com/fifa-world-cup-2026,2026-07-10T03:52:08+00:00
Bengaluru,DC,Bengaluru • DC,https://www.deccanchronicle.com/location/india/karnataka/bengaluru,2,Opinion and Editorials,https://www.deccanchronicle.com/opinion,2026-07-10T03:52:08+00:00
Bengaluru,DC,Bengaluru • DC,https://www.deccanchronicle.com/location/india/karnataka/bengaluru,3,Assembly Elections 2026,https://www.deccanchronicle.com/assembly-elections-2026,2026-07-10T03:52:08+00:00
Bengaluru,DC,Bengaluru • DC,https://www.deccanchronicle.com/location/india/karnataka/bengaluru,4,Telangana Rising 2047,https://www.deccanchronicle.com/tags/Telangana-Rising-2047,2026-07-10T03:52:08+00:00
Mumbai,Mumbai Mirror,Mumbai • Mumbai Mirror,https://mumbaimirror.indiatimes.com/mumbai,1,Counting the silent victories,https://mumbaimirror.indiatimes.com/mumbai/counting-the-silent-victories/articleshow/132294992.html,2026-07-10T03:52:08+00:00
Mumbai,Mumbai Mirror,Mumbai • Mumbai Mirror,https://mumbaimirror.indiatimes.com/mumbai,2,A monsoon miracle: Doctors deliver baby by phone lights,https://mumbaimirror.indiatimes.com/mumbai/a-monsoon-miracle-doctors-deliver-baby-by-phone-lights/articleshow/132295715.html,2026-07-10T03:52:08+00:00
Mumbai,Mumbai Mirror,Mumbai • Mumbai Mirror,https://mumbaimirror.indiatimes.com/mumbai,3,"Saved from death, but now forgotten",https://mumbaimirror.indiatimes.com/mumbai/saved-from-death-but-now-forgotten/articleshow/132296067.html,2026-07-10T03:52:08+00:00
Mumbai,Mumbai Mirror,Mumbai • Mumbai Mirror,https://mumbaimirror.indiatimes.com/mumbai,4,HC orders return of Jhanvi Kukreja’s belongings,https://mumbaimirror.indiatimes.com/mumbai/hc-orders-return-of-jhanvi-kukrejas-belongings/articleshow/132295097.html,2026-07-10T03:52:08+00:00
Mumbai,Mumbai Mirror,Mumbai • Mumbai Mirror,https://mumbaimirror.indiatimes.com/mumbai,5,Men play the long game,https://mumbaimirror.indiatimes.com/you/men-play-the-long-game/articleshow/132289620.html,2026-07-10T03:52:08+00:00
Mumbai,Mumbai Mirror,Mumbai • Mumbai Mirror,https://mumbaimirror.indiatimes.com/mumbai,6,Italy comes to Mumbai,https://mumbaimirror.indiatimes.com/unwind/italy-comes-to-mumbai/articleshow/132291287.html,2026-07-10T03:52:08+00:00
Mumbai,Mumbai Mirror,Mumbai • Mumbai Mirror,https://mumbaimirror.indiatimes.com/mumbai,7,Breaking News: Nothing is breaking anymore,https://mumbaimirror.indiatimes.com/opinion/breaking-news-nothing-is-breaking-anymore/articleshow/132292596.html,2026-07-10T03:52:08+00:00
Mumbai,Mumbai Mirror,Mumbai • Mumbai Mirror,https://mumbaimirror.indiatimes.com/mumbai,8,Ask The Sexpert,https://mumbaimirror.indiatimes.com/ask-the-sexpert,2026-07-10T03:52:08+00:00
Mumbai,Sakal,Mumbai • Sakal,https://www.esakal.com/pune,1,सकाळ लाईव्ह TV,https://www.esakal.com/live-tv,2026-07-10T03:52:08+00:00
Mumbai,Sakal,Mumbai • Sakal,https://www.esakal.com/pune,2,Refund and Cancellation,https://www.esakal.com/refund-and-cancellation,2026-07-10T03:52:08+00:00
Mumbai,Lokmat,Mumbai • Lokmat,https://www.lokmat.com/city/,1,Live News in Marathi,https://www.lokmat.com/live-news/,2026-07-10T03:52:08+00:00
Mumbai,Lokmat,Mumbai • Lokmat,https://www.lokmat.com/city/,2,"Ashadhi Wari : वारीने दिला स्वीकाराचा हात, आता समाजानेही स्वीकार करावा'; तृतीयपंथीयांची विठ्ठल चरणी साकडे",https://www.lokmat.com/pune/ashadhi-wari-vari-has-given-the-hand-of-acceptance-now-the-society-should-also-accept-it-transgenders-bow-at-the-feet-of-vitthal-a-a1008/,2026-07-10T03:52:08+00:00
Mumbai,Lokmat,Mumbai • Lokmat,https://www.lokmat.com/city/,3,LIVE: रेल्वे प्रशासनाला उशिराने शहाणपण! पावसामुळे रेल्वे रूळाची उंची ४०० मिमीने उंचावणार,https://www.lokmat.com/maharashtra/maharashtra-marathi-news-live-updates-10-july-2026-rain-updates-vidhan-sabha-adhiveshan-cm-devendra-fadnavis-eknath-shinde-cabinet-expansion-us-iran-war-donald-trump-pm-narendra-modi-fifa-world-cup-sharad-pawar-aashadhi-wari-india-vs-england-a-a573/,2026-07-10T03:52:08+00:00
Mumbai,Lokmat,Mumbai • Lokmat,https://www.lokmat.com/city/,4,"पुण्यात कचऱ्याचा डोंगर कोसळला; एकाचा मृत्यू, ८ जण ढिगाऱ्याखालीच",https://www.lokmat.com/pune/pune-building-collapse-a-mountain-of-garbage-collapsed-in-pune-one-dead-8-people-trapped-under-the-rubble-a-a1012/,2026-07-10T03:52:08+00:00
Mumbai,Lokmat,Mumbai • Lokmat,https://www.lokmat.com/city/,5,"‘मुठा’तीरी विसावला वैष्णवांचा मेळा, ‘ज्ञानाेबा-तुकाराम’च्या नामघाेषात पुणेकर दंग; भक्तिरसात झाले चिंब",https://www.lokmat.com/pune/vaishnavite-gathering-at-mutha-pune-residents-go-wild-with-the-name-chanting-of-gyanoba-tukaram-chimbam-becomes-immersed-in-devotion-a-a1013/,2026-07-10T03:52:08+00:00
Mumbai,Lokmat,Mumbai • Lokmat,https://www.lokmat.com/city/,6,"पाऊस काही थांबत नाही! १८ राज्ये अलर्टवर; ‘एल निनो’ अधिक तीव्र, मुंबई-महाराष्ट्रात काय होणार?",https://www.lokmat.com/national/monsoon-rain-forecast-for-10-july-2026-the-rains-are-not-stopping-18-states-on-alert-el-nino-is-getting-stronger-know-what-happen-in-mumbai-maharashtra-monsoon-rain-updates-a-a719/,2026-07-10T03:52:08+00:00
Mumbai,Lokmat,Mumbai • Lokmat,https://www.lokmat.com/city/,7,"""हे तुमचं काम नाही, ते पेट्रोलियम मंत्री बघतील"", राज ठाकरेंची नितीन गडकरींवर इथेनॉल धोरणावरून टीका",https://www.lokmat.com/mumbai/raj-thackeray-its-none-of-your-business-the-petroleum-minister-will-look-into-it-raj-thackeray-criticizes-nitin-gadkari-over-ethanol-policy-a-a571/,2026-07-10T03:52:08+00:00
Mumbai,Lokmat,Mumbai • Lokmat,https://www.lokmat.com/city/,8,LIVE: ममता बॅनर्जी यांना पुन्हा झटका! तीन माजी खासदारांचा भाजपात प्रवेश,https://www.lokmat.com/maharashtra/maharashtra-marathi-news-live-updates-9-july-2026-rain-in-maharashtra-earthquake-in-nanded-latur-vidhan-sabha-adhiveshan-cm-devendra-fadnavis-pm-narendra-modi-us-israel-iran-attacks-donald-trump-india-vs-england-fifa-world-cup-eknath-shinde-a-a573/,2026-07-10T03:52:08+00:00
Mumbai,Lokmat,Mumbai • Lokmat,https://www.lokmat.com/city/,9,"""पोलीस म्हणून नोकरीला लावतो"", बारामतीत दोन पोलिसांचा तरुणीवर अत्याचार, एक आरोपी मुंबई पोलीस दलातील",https://www.lokmat.com/pune/baramati-crime-he-hired-me-as-a-policeman-two-policemen-raped-a-young-woman-in-baramati-one-of-the-policemen-is-from-the-mumbai-police-force-a-a571/,2026-07-10T03:52:08+00:00
Mumbai,Lokmat,Mumbai • Lokmat,https://www.lokmat.com/city/,10,'मॅजिक क्रिश स्पा अँड सलून सेंटर'च्या आड सुरू होता कुंटनखाना; पोलिसांचा छापा,https://www.lokmat.com/nagpur/a-brothel-was-operating-behind-magic-krish-spa-and-salon-center-police-raid-a-a877-c1013/,2026-07-10T03:52:08+00:00
Mumbai,Lokmat,Mumbai • Lokmat,https://www.lokmat.com/city/,11,"पवित्र नात्याला मामाने फासले काळे; अल्पवयीन भाचीवर लैंगिक अत्याचार, फोटो-व्हिडिओ व्हायरल करण्याची धमकी",https://www.lokmat.com/nagpur/uncle-destroys-sacred-relationship-sexually-assaults-minor-niece-threatens-to-make-photos-and-videos-viral-a-a877-c1013/,2026-07-10T03:52:08+00:00
Mumbai,Lokmat,Mumbai • Lokmat,https://www.lokmat.com/city/,12,मृत्यूसाठी कुणालाही जबाबदार धरू नका.. टोकाचे पाऊल उचललेल्या हताश महिलेचे भावनिक आवाहन,https://www.lokmat.com/nagpur/dont-blame-anyone-for-the-death-emotional-appeal-from-a-desperate-woman-who-took-extreme-measures-a-a1013/,2026-07-10T03:52:08+00:00
Mumbai,Lokmat,Mumbai • Lokmat,https://www.lokmat.com/city/,13,ओळखीच्यांनीच दिली ठेकेदाराच्या घरी घरफोडीची टीप; स्टेटसवर नोटांचा व्हिडिओ ठेवणे महागात पडले,https://www.lokmat.com/nagpur/acquaintances-tipped-off-about-burglary-at-contractors-house-putting-a-video-of-the-notes-on-status-cost-money-a-a877-c1013/,2026-07-10T03:52:08+00:00
Mumbai,Lokmat,Mumbai • Lokmat,https://www.lokmat.com/city/,14,देवीचा कोप असल्याची भीती दाखवून वृद्धेची फसवणूक; साधूच्या वेशात फिरणाऱ्या भामट्यांनी सोन्याचे दागिने पळविले,https://www.lokmat.com/nagpur/elderly-woman-cheated-by-fearing-goddesss-wrath-goons-disguised-as-sadhus-stole-gold-ornaments-a-a877-c1013/,2026-07-10T03:52:08+00:00
Mumbai,Lokmat,Mumbai • Lokmat,https://www.lokmat.com/city/,15,"अभ्यासाचा कंटाळा आला, पुण्यातील युवक घर सोडून कोल्हापुरात; पोलिसांच्या सतर्कतेने नातेवाइकांची भेट",https://www.lokmat.com/kolhapur/a-young-man-from-nashik-who-had-left-home-to-stay-with-his-aunt-in-pune-for-his-studies-after-growing-weary-of-his-academic-work-arrived-in-kolhapur-a-a746/,2026-07-10T03:52:08+00:00
Mumbai,Lokmat,Mumbai • Lokmat,https://www.lokmat.com/city/,16,"नांदूर मधमेश्वर बंधाऱ्यातून 15 हजार 248 क्युसेक्स विसर्ग, गोदावरीकाठच्या नागरिकांना सतर्कतेचा इशारा",https://www.lokmat.com/nashik/15248-cusecs-discharged-from-nandur-madhameshwar-dam-alert-issued-to-citizens-along-godavari-a-a653/,2026-07-10T03:52:08+00:00
Mumbai,Lokmat,Mumbai • Lokmat,https://www.lokmat.com/city/,17,"व्यवसायात यश मिळवून देण्याचे आश्वासन, जादूटोण्याच्या नावाने महिलेवर अत्याचार; भोंदूविरुद्ध गुन्हा दाखल",https://www.lokmat.com/nashik/promised-success-in-business-tortured-woman-in-the-name-of-witchcraft-case-registered-against-fraudster-in-nashik-a-a597/,2026-07-10T03:52:08+00:00
Mumbai,Lokmat,Mumbai • Lokmat,https://www.lokmat.com/city/,18,"नाशिक TCS धर्मांतर प्रकरणात निदा खान, तौसिफ अत्तारला मोठा दिलासा; जामीन मंजूर",https://www.lokmat.com/nashik/nida-khan-gets-bail-in-nashik-tcs-harassment-case-no-relief-for-co-accused-a-a597/,2026-07-10T03:52:08+00:00
Mumbai,Lokmat,Mumbai • Lokmat,https://www.lokmat.com/city/,19,"अतिवृष्टीचा धोका! मुंबई, ठाणे, पुण्यासह 'या' जिल्ह्यांमधील शाळा-महाविद्यालयांना सुट्टी जाहीर",https://www.lokmat.com/maharashtra/rain-alert-danger-of-heavy-rain-holiday-declared-for-schools-and-colleges-in-these-districts-including-thane-pune-orders-issued-a-a571/,2026-07-10T03:52:08+00:00
Mumbai,Lokmat,Mumbai • Lokmat,https://www.lokmat.com/city/,20,"शाळांना १ रुपये, तर ग्रामपंचायती, सरकारी संस्थांना १ हजार रोपे मोफत; कोल्हापुरात वृक्षलागवडीची धूम",https://www.lokmat.com/kolhapur/free-saplings-are-being-provided-to-schools-gram-panchayats-and-government-institutions-in-kolhapur-district-for-tree-plantation-in-the-context-of-vanmahotsav-a-a818-c746/,2026-07-10T03:52:08+00:00
Mumbai,Lokmat,Mumbai • Lokmat,https://www.lokmat.com/city/,21,"कोल्हापुरात शिक्षण संस्थेच्या लिपिकाने चार शिक्षिकांना दिली बनावट नियुक्तिपत्रे; पाच जणांवर गुन्हा, एकास अटक",https://www.lokmat.com/kolhapur/an-educational-institution-clerk-gave-fake-appointment-letters-to-four-teachers-in-kolhapur-a-a746/,2026-07-10T03:52:08+00:00
Mumbai,Lokmat,Mumbai • Lokmat,https://www.lokmat.com/city/,22,"Kolhapur: पन्हाळ्यावर झालेल्या सर्व ४२०२ दस्तांची पुन्हा चौकशी होणार, नोंदणी महानिरीक्षकांचे आदेश",https://www.lokmat.com/kolhapur/all-4202-cases-registered-at-panhala-will-be-re-investigated-orders-of-the-inspector-general-of-registration-a-a746/,2026-07-10T03:52:08+00:00
Mumbai,Lokmat,Mumbai • Lokmat,https://www.lokmat.com/city/,23,Shaktipeeth Mahamarg: शक्तिपीठसाठी जमीन अधिग्रहणाची अधिसूचना जारी,https://www.lokmat.com/maharashtra/land-acquisition-notification-issued-for-shaktipeeth-a-a746/,2026-07-10T03:52:08+00:00
Mumbai,Lokmat,Mumbai • Lokmat,https://www.lokmat.com/city/,24,Sangli Crime: चोरट्याने पेटविल्याचा बनाव...आजीला पेटविले नात जावयाने; संशयितास अटक,https://www.lokmat.com/sangli/a-granddaughters-husband-set-his-grandmother-in-law-on-fire-following-a-dispute-over-property-division-then-fabricated-a-story-claiming-a-thief-had-set-her-ablaze-at-shetphale-in-sangli-district-a-a997-c746/,2026-07-10T03:52:08+00:00
Mumbai,Lokmat,Mumbai • Lokmat,https://www.lokmat.com/city/,25,परदेशी वैद्यकीय शिक्षणानंतरच्या पात्रता परीक्षेत ८६ टक्के विद्यार्थी नापास; चार वर्षांतील सर्वांत नीचांकी टक्का,https://www.lokmat.com/maharashtra/86-percent-of-students-fail-in-qualifying-exam-after-foreign-medical-education-a-a746/,2026-07-10T03:52:08+00:00
Mumbai,Lokmat,Mumbai • Lokmat,https://www.lokmat.com/city/,26,"ईडी करणार ५४ कोटींच्या सोने तस्करी प्रकरणाचा तपास, सांगलीच्या अक्षय बनसोडेची कसून चौकशी",https://www.lokmat.com/national/the-enforcement-directorate-will-now-investigate-the-case-involving-gold-worth-54-crore-seized-in-guwahati-akshay-bansode-from-sangli-is-being-subjected-to-intensive-questioning-a-a746/,2026-07-10T03:52:08+00:00
Mumbai,Lokmat,Mumbai • Lokmat,https://www.lokmat.com/city/,27,"Sangli: येडेनिपाणीत जमिनीच्या वादातून तलवारीने जीवघेणा हल्ला, एकाच कुटुंबातील पाचजण गंभीर जखमी",https://www.lokmat.com/sangli/five-members-of-the-same-family-seriously-injured-in-fatal-sword-attack-over-land-dispute-in-yedenipani-a-a746/,2026-07-10T03:52:08+00:00
Mumbai,Lokmat,Mumbai • Lokmat,https://www.lokmat.com/city/,28,"Satara News: मुलाने तुटलेली वीज तार हातात धरली अन् चौघांचा जीव गेला, समयसूचकतेने लहान बहिणीचा जीव वाचला",https://www.lokmat.com/satara/four-members-of-the-same-family-died-while-trying-to-save-a-boy-who-had-suffered-an-electric-shock-from-a-wire-in-khamgaon-satara-district-the-younger-sisters-life-was-saved-thanks-to-quick-thinking-a-a746/,2026-07-10T03:52:08+00:00
Mumbai,Lokmat,Mumbai • Lokmat,https://www.lokmat.com/city/,29,"भूस्खलनामुळे साताऱ्याची जीवनवाहिनी फुटली, पालिकेकडून युद्धपातळीवर दुरूस्ती",https://www.lokmat.com/satara/a-landslide-caused-the-main-water-pipeline-of-the-kas-scheme-which-supplies-water-to-satara-city-to-burst-a-a746/,2026-07-10T03:52:08+00:00
Mumbai,Lokmat,Mumbai • Lokmat,https://www.lokmat.com/city/,30,"Satara: डिकी उघडली अन् पिस्टल, काडतूस सापडले!; कासवरील नाकाबंदीत पोलिसांची कारवाई",https://www.lokmat.com/satara/during-a-blockade-at-kaas-the-satara-police-detained-a-suspect-with-a-criminal-record-and-seized-a-country-made-pistol-and-a-live-cartridge-a-a746/,2026-07-10T03:52:08+00:00
Mumbai,Lokmat,Mumbai • Lokmat,https://www.lokmat.com/city/,31,"महाबळेश्वर, माथेरानमधील अनधिकृत बांधकामांची चौकशी करणार, मंत्री चंद्रशेखर बावनकुळे यांची घोषणा",https://www.lokmat.com/mumbai/inquiry-to-be-conducted-into-unauthorized-constructions-in-mahabaleshwar-and-matheran-announcement-by-minister-chandrashekhar-bawankule-a-a746/,2026-07-10T03:52:08+00:00
Mumbai,Lokmat,Mumbai • Lokmat,https://www.lokmat.com/city/,32,"सातारा जिल्ह्यात पावसाचा जोर ओसरला; कोयना धरणातील पाणीसाठ्यात वाढ, जावळीत भूस्खलनाने ६१ लोक स्थलांतरित",https://www.lokmat.com/satara/the-intensity-of-rains-has-subsided-in-satara-district-koyna-dam-is-40-percent-full-61-people-displaced-by-landslide-in-jawali-a-a746/,2026-07-10T03:52:08+00:00
Mumbai,Lokmat,Mumbai • Lokmat,https://www.lokmat.com/city/,33,काँग्रेस नगरसेविका पतीवर भरदिवसा चाकू हल्ला; उपचारादरम्यान मृत्यू,https://www.lokmat.com/akola/congress-corporators-husband-attacked-with-knife-in-broad-daylight-dies-during-treatment-a-a607/,2026-07-10T03:52:08+00:00
Mumbai,Lokmat,Mumbai • Lokmat,https://www.lokmat.com/city/,34,विनापरवाना बियाणे साठ्यावर कृषी विभागाचा छापा; २०.६० लाखांचा मुद्देमाल जप्त,https://www.lokmat.com/akola/agriculture-department-raids-unlicensed-seed-stock-goods-worth-rs-20-lakh-60-thousands-seized-a-a653/,2026-07-10T03:52:08+00:00
Mumbai,Lokmat,Mumbai • Lokmat,https://www.lokmat.com/city/,35,अकोल्यात रिलायन्स प्लांट परिसरात आगीचे तांडव; धुराच्या लोटांनी आसमंत काळवंडले,https://www.lokmat.com/akola/fire-breaks-out-in-reliance-plant-area-smoke-billows-into-the-sky-incident-on-akola-nanded-road-a-a747/,2026-07-10T03:52:08+00:00
Mumbai,Lokmat,Mumbai • Lokmat,https://www.lokmat.com/city/,36,"शिंदेसेनेच्या अकोला जिल्हाप्रमुख, महानगरप्रमुखांच्या नियुक्त्या जाहीर",https://www.lokmat.com/akola/appointments-of-shinde-senas-akola-district-chief-and-metropolitan-chief-announced-a-a941/,2026-07-10T03:52:08+00:00
Mumbai,Lokmat,Mumbai • Lokmat,https://www.lokmat.com/city/,37,"Akola: अधिक मासातील धार्मिक स्नान ठरले अखेरचे; मुलगाा बुडायला लागला, आईने उडी मारली; दोघांचाही नदीत बुडून मृत्यू",https://www.lokmat.com/akola/akola-religious-bath-in-the-rainy-season-turned-out-to-be-the-last-mother-and-daughter-drowned-in-the-river-while-saving-their-child-a-a571/,2026-07-10T03:52:08+00:00
Mumbai,Lokmat,Mumbai • Lokmat,https://www.lokmat.com/city/,38,"शक्तिपीठ महामार्ग रद्द करण्यासाठी शेतकरी विठ्ठलाला साकडे घालणार, १८ जुलैला भव्य पायी सदबुध्दी यात्रा",https://www.lokmat.com/maharashtra/against-the-backdrop-of-ashadhi-ekadashi-farmers-from-13-districts-will-undertake-a-sadbuddhi-yatra-on-foot-from-vakari-to-the-vitthal-temple-demanding-the-cancellation-of-the-shaktipeeth-highway-project-a-a746/,2026-07-10T03:52:08+00:00
Mumbai,Lokmat,Mumbai • Lokmat,https://www.lokmat.com/city/,39,"तपासणी केली, त्रुटी आढळल्या, पुरावे सापडले अन् ते मेडिकल केले सील; औषध प्रशासनाची सोलापुरात मोठी कारवाई",https://www.lokmat.com/solapur/inspection-done-errors-found-evidence-found-and-it-was-medically-sealed-drug-administration-takes-major-action-in-solapur-a-a941/,2026-07-10T03:52:08+00:00
Mumbai,Lokmat,Mumbai • Lokmat,https://www.lokmat.com/city/,40,सैराट’ फेम अभिनेता सल्याची रुग्णालयाकडून लूट; व्हिडिओ पाहिला अन् तुकाराम मुंढेंनी दिले चौकशीचे आदेश,https://www.lokmat.com/solapur/sairat-fame-actor-salya-robbed-from-hospital-watched-the-video-and-tukaram-mundhe-ordered-an-inquiry-a-a941/,2026-07-10T03:52:08+00:00
Mumbai,Lokmat,Mumbai • Lokmat,https://www.lokmat.com/city/,41,"प्रॉपर्टीच्या वादातून काका-काकूचा खून; हत्या करून पुतण्यांनी मित्राला दिले सोने, मुंबईमध्ये साहिलला अटक",https://www.lokmat.com/solapur/uncle-and-aunt-murdered-over-property-dispute-nephews-gave-gold-to-friend-after-murder-sahil-arrested-in-mumbai-a-a571/,2026-07-10T03:52:08+00:00
Mumbai,Lokmat,Mumbai • Lokmat,https://www.lokmat.com/city/,42,"भोंदू मनोहर भोसलेकडे अफाट 'माया'; २० बँक खात्यांमध्ये ३ कोटींची रोकड, २५ एकर जमीन अन् फ्लॅट",https://www.lokmat.com/solapur/sit-investigation-reveals-that-the-fraudulent-manohar-bhosale-holds-over-3-crore-across-20-bank-accounts-a-a1001/,2026-07-10T03:52:08+00:00
Mumbai,Lokmat,Mumbai • Lokmat,https://www.lokmat.com/city/,43,शिर्डी साईबाबा मंदिरात 'ब्रेक दर्शन'साठी आता मोजावे लागणार ३०० रुपये; संस्थानचा मोठा निर्णय,https://www.lokmat.com/ahilyanagar/shirdi-sai-baba-sansthan-increases-break-darshan-fee-for-vip-devotees-by-100-rupees-a-a1001/,2026-07-10T03:52:08+00:00
Mumbai,Lokmat,Mumbai • Lokmat,https://www.lokmat.com/city/,44,"""...तर शरद पवार राष्ट्रपती झाले असते""; रामदास आठवले यांचा गौप्यस्फोट",https://www.lokmat.com/ahilyanagar/sharad-pawar-could-have-been-president-if-he-joined-nda-in-2014-claims-union-minister-ramdas-athawale-a-a1001/,2026-07-10T03:52:08+00:00
Mumbai,Lokmat,Mumbai • Lokmat,https://www.lokmat.com/city/,45,"'माहिती अधिकारातील बदल रद्द न झाल्यास पुन्हा जनआंदोलन करणार', अण्णा हजारे यांचा सरकारला इशारा",https://www.lokmat.com/ahilyanagar/will-launch-another-mass-movement-if-changes-in-right-to-information-are-not-repealed-anna-hazare-warns-government-a-a571/,2026-07-10T03:52:08+00:00
Mumbai,Lokmat,Mumbai • Lokmat,https://www.lokmat.com/city/,46,"बैल नाही, ट्रॅक्टरही नाही; माणसेच ओढताहेत पाभर !",https://www.lokmat.com/maharashtra/no-bulls-no-tractors-only-people-are-pulling-the-cart-a-a301/,2026-07-10T03:52:08+00:00
Mumbai,Lokmat,Mumbai • Lokmat,https://www.lokmat.com/city/,47,"आंबित धरण भरले; मुळाही प्रवाही, बळीराजा सुखावला, भात रोपांना संजीवनी",https://www.lokmat.com/maharashtra/ambit-dam-filled-radish-also-flowing-baliraja-is-happy-rice-plants-are-revived-farmers-are-happy-due-to-heavy-rains-a-a301/,2026-07-10T03:52:08+00:00
