city,publisher,source,source_url,rank,headline,link,collected_at_iso
Delhi-NCR,Jagran,Delhi-NCR • Jagran,https://www.jagran.com/delhi-ncr,28,"गाजियाबाद में मर्डर, बेटे की हत्या पर फूट-फूटकर रोई मां; हमलावरों ने चाकू घोंपकर उतारा मौत के घाट",https://www.jagran.com/uttar-pradesh/ghaziabad-ghaziabad-loni-salon-owner-stabbed-to-death-over-old-rivalry-40270530.html,2026-06-11T23:41:34+00:00
Delhi-NCR,Jagran,Delhi-NCR • Jagran,https://www.jagran.com/delhi-ncr,29,"44 डिग्री गर्मी में दम तोड़ रहे कौशांबी डिपो की बसों के AC, यात्री परेशान",https://www.jagran.com/uttar-pradesh/ghaziabad-ghaziabad-ac-bus-failures-12-complaints-amidst-44c-heat-40270382.html,2026-06-11T23:41:34+00:00
Delhi-NCR,Jagran,Delhi-NCR • Jagran,https://www.jagran.com/delhi-ncr,30,"कौशांबी में सीएम ग्रिड सड़क निर्माण कार्य ठप, गड्ढे और मिट्टी बनी मुसीबत; 307 करोड़ का प्रोजेक्ट बना जनता की आफत",https://www.jagran.com/uttar-pradesh/ghaziabad-cm-grid-road-work-stalled-in-kaushambi-ghaziabad-40270374.html,2026-06-11T23:41:34+00:00
Delhi-NCR,Jagran,Delhi-NCR • Jagran,https://www.jagran.com/delhi-ncr,31,"गुरुग्राम में सरकार का नया आदेश, बंधवाड़ी और नुनेरा टोल प्लाजा पर 2 जुलाई तक जारी रहेगी वसूली",https://www.jagran.com/haryana/gurgaon-government-new-order-in-gurugram-and-toll-collection-will-continue-at-bandhwari-and-nunera-toll-plazas-till-july-2-40270545.html,2026-06-11T23:41:34+00:00
Delhi-NCR,Jagran,Delhi-NCR • Jagran,https://www.jagran.com/delhi-ncr,32,"गुरुग्राम वालों को मिलेगी बड़ी राहत, एक सप्ताह में भरेगा सोहना हाईवे का गड्ढा; NHAI ने शुरू किया काम",https://www.jagran.com/haryana/gurgaon-gurugramsohna-highway-road-repair-sewer-line-work-begins-40270580.html,2026-06-11T23:41:34+00:00
Delhi-NCR,Jagran,Delhi-NCR • Jagran,https://www.jagran.com/delhi-ncr,33,"गुरुग्राम में ब्रेकअप से बौखलाए दिल्ली पुलिस के सिपाही ने गर्लफ्रेंड को पीटा, थार से मारी टक्कर; Video Viral",https://www.jagran.com/haryana/gurgaon-delhi-police-constable-assaults-exgirlfriend-in-gurgaon-40270296.html,2026-06-11T23:41:34+00:00
Delhi-NCR,Jagran,Delhi-NCR • Jagran,https://www.jagran.com/delhi-ncr,34,"ग्रेटर नोएडा में प्राधिकरण-पुलिस के साथ धक्का-मुक्की, जमकर हंगामा; अतिक्रमण हटाने गई थी टीम",https://www.jagran.com/uttar-pradesh/noida-noida-encroachment-drive-halted-by-farmers-union-protest-40270597.html,2026-06-11T23:41:34+00:00
Delhi-NCR,Jagran,Delhi-NCR • Jagran,https://www.jagran.com/delhi-ncr,35,"एशिया के सबसे बड़े एयरपोर्ट पर बेहद खराब मौसम में संचालित हो सकेंगी उड़ानें, कम दृश्यता भी नहीं बनेगी चुनौती",https://www.jagran.com/uttar-pradesh/noida-noida-airport-ready-for-flights-june-15-asias-largest-hub-40270550.html,2026-06-11T23:41:34+00:00
Delhi-NCR,Jagran,Delhi-NCR • Jagran,https://www.jagran.com/delhi-ncr,36,"ग्रेटर नोएडा में निर्माणाधीन 37वीं मंजिल से गिरकर दो कामगारों की मौत, सेफ्टी बेल्ट टूटने से हुआ हादसा",https://www.jagran.com/uttar-pradesh/noida-greater-noida-construction-accident-2-workers-die-after-fall-40270542.html,2026-06-11T23:41:34+00:00
Delhi-NCR,Jagran,Delhi-NCR • Jagran,https://www.jagran.com/delhi-ncr,37,"ग्रेटर नोएडा वेस्ट के लाखों लोगों का इंतजार खत्म, अब 15 अगस्त से मिलेगा गंगाजल; डेडलाइन तय",https://www.jagran.com/uttar-pradesh/noida-greater-noida-west-to-get-gangaajal-by-independence-day-40270501.html,2026-06-11T23:41:34+00:00
Delhi-NCR,Jagran,Delhi-NCR • Jagran,https://www.jagran.com/delhi-ncr,38,"यूट्यूबर ध्रुव राठी के वीडियो से मचा बवाल, अदालत पहुंचा मामला; दिल्ली पुलिस से मांगी रिपोर्ट",https://www.jagran.com/delhi/new-delhi-city-delhi-court-seeks-details-of-action-taken-against-youtuber-dhruv-rathee-in-derogatory-video-case-40270566.html,2026-06-11T23:41:34+00:00
Delhi-NCR,Jagran,Delhi-NCR • Jagran,https://www.jagran.com/delhi-ncr,39,"सैदुलाजाब हादसे से जागा DDA, अब गलती पर बैन होंगे इंजीनियर-आर्किटेक्ट; मकान मालिकों के लिए भी बड़ा अलर्ट",https://www.jagran.com/delhi/new-delhi-city-why-is-dda-blacklisting-architects-engineers-after-saidulajab-mishap-know-the-new-warning-for-delhi-home-owners-40270198.html,2026-06-11T23:41:34+00:00
Delhi-NCR,Jagran,Delhi-NCR • Jagran,https://www.jagran.com/delhi-ncr,40,"मालवीय नगर अग्निकांड: एमसीडी की अधूरी कार्रवाई, कहीं असंतोष तो कहीं जान का खतरा",https://www.jagran.com/delhi/new-delhi-city-hauz-rani-fire-mcds-incomplete-demolition-poses-danger-in-delhi-40270532.html,2026-06-11T23:41:34+00:00
Delhi-NCR,Jagran,Delhi-NCR • Jagran,https://www.jagran.com/delhi-ncr,41,"मालवीय नगर अग्निकांड: लापरवाही पर एमसीडी ने एपीएचआई को नौकरी से निकाला, डीएचओ का तबादला",https://www.jagran.com/delhi/new-delhi-city-hauz-rani-fire-mcd-fires-aphi-transfers-dho-over-negligence-40270523.html,2026-06-11T23:41:34+00:00
Delhi-NCR,Jagran,Delhi-NCR • Jagran,https://www.jagran.com/delhi-ncr,42,"SDM साहब! 3 माह से धक्के खा रहा हूं, पत्नी के नाम इंतकाल दर्ज करा दो; दैनिक जागरण की पड़ताल में लापरवाही उजागर",https://www.jagran.com/haryana/faridabad-faridabad-samadhan-shivir-fails-sdm-leaves-early-complaints-unresolved-40270584.html,2026-06-11T23:41:34+00:00
Delhi-NCR,Jagran,Delhi-NCR • Jagran,https://www.jagran.com/delhi-ncr,43,"फरीदाबाद से आई शर्मनाक तस्वीर, अस्पताल से शव ले जाने के लिए नहीं मिला वाहन; ठेले पर ले गए परिजन",https://www.jagran.com/haryana/faridabad-faridabad-hospital-body-taken-on-vegetable-cart-after-death-40270336.html,2026-06-11T23:41:34+00:00
Delhi-NCR,Jagran,Delhi-NCR • Jagran,https://www.jagran.com/delhi-ncr,44,"फरीदाबाद में सीवर सफाई के दौरान सफाईकर्मी की मौत, बिना सेफ्टी उपकरण काम करने का आरोप",https://www.jagran.com/haryana/faridabad-faridabad-sanitation-worker-dies-in-sewer-no-safety-gear-40269865.html,2026-06-11T23:41:34+00:00
Delhi-NCR,Jagran,Delhi-NCR • Jagran,https://www.jagran.com/delhi-ncr,45,"फरीदाबाद में मुठभेड़ के बाद 28 मुकदमों में हिस्ट्रीशीटर सोनू गिरफ्तार, पुलिस पर किए चार फायर",https://www.jagran.com/haryana/faridabad-faridabad-encounter-historysheeter-sonu-arrested-after-shootout-40269559.html,2026-06-11T23:41:34+00:00
Delhi-NCR,Jagran,Delhi-NCR • Jagran,https://www.jagran.com/delhi-ncr,46,"दिल्ली-आगरा हाईवे पर हर किलोमीटर लगेंगे AI कैमरे, दिसंबर 2026 तक 215 कैमरों से होने लगेगी निगरानी",https://www.jagran.com/haryana/faridabad-delhiagra-highway-to-get-ai-cameras-by-december-2026-40269248.html,2026-06-11T23:41:34+00:00
Delhi-NCR,Jagran,Delhi-NCR • Jagran,https://www.jagran.com/delhi-ncr,47,"पलवल में तीन बच्चों की विधवा मां से शादी का झांसा देकर दुष्कर्म, आरोपित फरार",https://www.jagran.com/haryana/palwal-palwal-man-rapes-widow-on-marriage-pretext-flees-40270024.html,2026-06-11T23:41:34+00:00
Delhi-NCR,Jagran,Delhi-NCR • Jagran,https://www.jagran.com/delhi-ncr,48,"पलवल में गाड़ी हटाने के विवाद ने लिया खूनी रूप, परिवार पर जानलेवा हमला; एक युवक घायल",https://www.jagran.com/haryana/palwal-palwal-family-attacked-over-car-dispute-son-seriously-injured-40270003.html,2026-06-11T23:41:34+00:00
Delhi-NCR,Jagran,Delhi-NCR • Jagran,https://www.jagran.com/delhi-ncr,49,"पलवल में गर्मी और ओवरलोड का असर, सबस्टेशन के ट्रांसफार्मर में लगी आग; पूरे शहर में ब्लैक आउट",https://www.jagran.com/haryana/palwal-palwal-blackout-20-cr-transformer-fire-at-meghpur-substation-40269890.html,2026-06-11T23:41:34+00:00
Delhi-NCR,Jagran,Delhi-NCR • Jagran,https://www.jagran.com/delhi-ncr,50,"पलवल में 9 करोड़ की लागत से बनी सड़कें चार साल में ही जर्जर, जवाबदेही से बचते रहे अधिकारी",https://www.jagran.com/haryana/palwal-hodals-9-cr-roads-crumble-in-4-yrs-villagers-demand-fix-40269426.html,2026-06-11T23:41:34+00:00
Delhi-NCR,Jagran,Delhi-NCR • Jagran,https://www.jagran.com/delhi-ncr,51,"पलवल में जोधपुर-रायपुर और सोहन सिंह ढाणी तक की सड़कों का होगा कायाकल्प, ग्रामीणों को मिलेगी बड़ी राहत",https://www.jagran.com/haryana/palwal-palwal-jodhpurraipur-sohan-singh-dhani-roads-to-get-new-life-40269019.html,2026-06-11T23:41:34+00:00
Delhi-NCR,Jagran,Delhi-NCR • Jagran,https://www.jagran.com/delhi-ncr,52,"फिरोजाबाद में स्वर्ण शताब्दी एक्सप्रेस पर हुआ पथराव, मोहन भागवत वाले कोच का टूटा शीशा",https://www.jagran.com/uttar-pradesh/firozabad-golden-chariot-express-was-pelted-with-stones-in-firozabad-glass-of-mohan-bhagwats-coach-was-broken-40270575.html,2026-06-11T23:41:34+00:00
Delhi-NCR,Jagran,Delhi-NCR • Jagran,https://www.jagran.com/delhi-ncr,53,"कानपुर में मोहन भागवत का प्रवास, संघ प्रमुख ने की मंत्रियों-विधायकों से मुलाकात",https://www.jagran.com/uttar-pradesh/kanpur-city-mohan-bhagwat-in-kanpur-rss-chief-meets-ministers-mlas-40270591.html,2026-06-11T23:41:34+00:00
Delhi-NCR,Jagran,Delhi-NCR • Jagran,https://www.jagran.com/delhi-ncr,54,"अखिलेश यादव की बेटी पर अमर्यादित टिप्पणी और गलत फोटो की प्रचलित, कानपुर में 3 पर केस",https://www.jagran.com/uttar-pradesh/kanpur-city-fir-against-3-people-in-kanpur-for-derogatory-remarks-on-akhilesh-yadav-daughter-40270583.html,2026-06-11T23:41:34+00:00
Delhi-NCR,Jagran,Delhi-NCR • Jagran,https://www.jagran.com/delhi-ncr,55,"कानपुर जेल में बंदी से मारपीट: डिप्टी जेलर और हेड वार्डर निलंबित, विभागीय जांच शुरू",https://www.jagran.com/uttar-pradesh/kanpur-city-kanpur-jail-officials-suspended-for-inmate-beating-40270572.html,2026-06-11T23:41:34+00:00
Delhi-NCR,Jagran,Delhi-NCR • Jagran,https://www.jagran.com/delhi-ncr,56,सुप्रीम कोर्ट: बर्खास्तगी का निर्णय लेने में बरतें बहुत सावध,https://www.jagran.com/news/national-supreme-court-be-very-careful-in-taking-the-decision-of-dismissal-40270594.html,2026-06-11T23:41:34+00:00
Delhi-NCR,Jagran,Delhi-NCR • Jagran,https://www.jagran.com/delhi-ncr,57,डिजिटल खतरों से बचने की तैयारी: CISF तैयार करेगा पांच हजार स,https://www.jagran.com/news/national-cisf-to-train-5000-cyber-commandos-home-ministry-major-plan-40270592.html,2026-06-11T23:41:34+00:00
Delhi-NCR,Jagran,Delhi-NCR • Jagran,https://www.jagran.com/delhi-ncr,58,सोशल मीडिया पर महा-रिकॉर्ड: नेतन्याहू का पीएम मोदी को बधाई स,https://www.jagran.com/world/middle-east-netanyahu-congratulatory-message-to-pm-modi-was-viewed-more-times-than-israel-total-population-40270590.html,2026-06-11T23:41:34+00:00
Delhi-NCR,Jagran,Delhi-NCR • Jagran,https://www.jagran.com/delhi-ncr,59,"Sapna Choudhary के साथ मारपीट करत था पति, छोड़ दिया ससुराल; कोर्ट ने दिया अब ये आदेश",https://www.jagran.com/entertainment/bollywood-haryanvi-singer-sapna-choudhary-files-domestic-violence-case-against-husband-veer-court-ask-him-to-stay-away-from-her-40268713.html,2026-06-11T23:41:34+00:00
Delhi-NCR,Jagran,Delhi-NCR • Jagran,https://www.jagran.com/delhi-ncr,60,"कभी Sapna Choudhary ने जहर खाकर की सुसाइड की कोशिश, अब पति पर लगाए मारपीट के आरोप; हरियाणवी डांसर के बड़े विवाद",https://www.jagran.com/entertainment/bollywood-haryanvi-singer-sapna-choudhary-controversies-domestic-violence-against-husband-to-attempt-suicide-due-to-harassment-40269855.html,2026-06-11T23:41:34+00:00
Delhi-NCR,Jagran,Delhi-NCR • Jagran,https://www.jagran.com/delhi-ncr,61,तलाक के बाद फिर एक हुए Sohail Khan और उनकी पत्नी? सीमा सचदेह ने कहा- 'यह मेरी जिंदगी की सच्चाई है...',https://www.jagran.com/entertainment/bollywood-sohail-khan-ex-wife-seema-sajdeh-break-silence-on-coming-together-after-couple-spot-together-in-a-wedding-40269608.html,2026-06-11T23:41:34+00:00
Delhi-NCR,Jagran,Delhi-NCR • Jagran,https://www.jagran.com/delhi-ncr,62,"AC के साथ फैन चलाना सही या नहीं, कूलिंग और बिजली बिल पर पड़ता है क्या असर?",https://www.jagran.com/technology/tech-news-ac-and-fan-together-boost-cooling-save-electricity-bill-40269575.html,2026-06-11T23:41:34+00:00
Delhi-NCR,Jagran,Delhi-NCR • Jagran,https://www.jagran.com/delhi-ncr,63,Did You Know,https://www.jagran.com/did-you-know-news-hindi.html,2026-06-11T23:41:34+00:00
Delhi-NCR,Jagran,Delhi-NCR • Jagran,https://www.jagran.com/delhi-ncr,64,मिडिल ईस्ट संकट,https://www.jagran.com/topics/Israel-Iran-Conflict,2026-06-11T23:41:34+00:00
Delhi-NCR,Jagran,Delhi-NCR • Jagran,https://www.jagran.com/delhi-ncr,65,Submit your news,https://www.jagran.com/citizen-journalism-hindi.html,2026-06-11T23:41:34+00:00
Delhi-NCR,Jagran,Delhi-NCR • Jagran,https://www.jagran.com/delhi-ncr,66,Message from the Editor,https://www.jagran.com/policies-and-standards.html,2026-06-11T23:41:34+00:00
Hyderabad,DC,Hyderabad • DC,https://www.deccanchronicle.com/location/india/southern-states,1,FIFA World Cup 2026,https://www.deccanchronicle.com/fifa-world-cup-2026,2026-06-11T23:41:34+00:00
Hyderabad,DC,Hyderabad • DC,https://www.deccanchronicle.com/location/india/southern-states,2,Opinion and Editorials,https://www.deccanchronicle.com/opinion,2026-06-11T23:41:34+00:00
Hyderabad,DC,Hyderabad • DC,https://www.deccanchronicle.com/location/india/southern-states,3,Assembly Elections 2026,https://www.deccanchronicle.com/assembly-elections-2026,2026-06-11T23:41:34+00:00
Hyderabad,DC,Hyderabad • DC,https://www.deccanchronicle.com/location/india/southern-states,4,Telangana Rising 2047,https://www.deccanchronicle.com/tags/Telangana-Rising-2047,2026-06-11T23:41:34+00:00
Chennai,DC,Chennai • DC,https://www.deccanchronicle.com/location/india/tamil-nadu/chennai-madras,1,FIFA World Cup 2026,https://www.deccanchronicle.com/fifa-world-cup-2026,2026-06-11T23:41:34+00:00
Chennai,DC,Chennai • DC,https://www.deccanchronicle.com/location/india/tamil-nadu/chennai-madras,2,Opinion and Editorials,https://www.deccanchronicle.com/opinion,2026-06-11T23:41:34+00:00
Chennai,DC,Chennai • DC,https://www.deccanchronicle.com/location/india/tamil-nadu/chennai-madras,3,Assembly Elections 2026,https://www.deccanchronicle.com/assembly-elections-2026,2026-06-11T23:41:34+00:00
Chennai,DC,Chennai • DC,https://www.deccanchronicle.com/location/india/tamil-nadu/chennai-madras,4,Telangana Rising 2047,https://www.deccanchronicle.com/tags/Telangana-Rising-2047,2026-06-11T23:41:34+00:00
Chennai,The Hindu,Chennai • The Hindu,https://www.thehindu.com/news/cities/chennai/,1,Contesting on DMK symbol caused severe distress: Durai Vaiko,https://www.thehindu.com/news/national/tamil-nadu/contesting-on-dmk-symbol-caused-severe-distress-durai-vaiko/article71085316.ece,2026-06-11T23:41:34+00:00
Chennai,The Hindu,Chennai • The Hindu,https://www.thehindu.com/news/cities/chennai/,2,Tamil Nadu Speaker’s decision to accept resignation of MLAs challenged before Madras High Court,https://www.thehindu.com/news/national/tamil-nadu/tn-speakers-decision-to-accept-resignation-of-mlas-challenged-before-madras-high-court/article71084980.ece,2026-06-11T23:41:34+00:00
Chennai,The Hindu,Chennai • The Hindu,https://www.thehindu.com/news/cities/chennai/,3,Bharathiraja passes away LIVE | People pay homage to the late filmmaker's mortal remains,https://www.thehindu.com/entertainment/movies/bharathiraja-tamil-nadu-film-cinema-director-passes-away-chennai-hospital-reactions-updates-june-10-2026/article71083374.ece,2026-06-11T23:41:34+00:00
Chennai,The Hindu,Chennai • The Hindu,https://www.thehindu.com/news/cities/chennai/,4,"Iniya Thamizh makkale, the master director is no more",https://www.thehindu.com/entertainment/movies/bharathiraja-obituary-iniya-thamizh-makkale-the-master-director-is-no-more/article71083386.ece,2026-06-11T23:41:34+00:00
Chennai,The Hindu,Chennai • The Hindu,https://www.thehindu.com/news/cities/chennai/,5,Residents want Highways Department to widen CTH Road,https://www.thehindu.com/news/cities/chennai/residents-want-highways-department-to-widen-cth-road/article71082264.ece,2026-06-11T23:41:34+00:00
Chennai,The Hindu,Chennai • The Hindu,https://www.thehindu.com/news/cities/chennai/,6,"Deadlines pass, but private schools fail to display fee structure",https://www.thehindu.com/news/cities/chennai/deadlines-pass-but-private-schools-fail-to-display-fee-structure/article71085354.ece,2026-06-11T23:41:34+00:00
Chennai,The Hindu,Chennai • The Hindu,https://www.thehindu.com/news/cities/chennai/,7,Apollo Hospitals launches ACLS ambulance network,https://www.thehindu.com/news/cities/chennai/apollo-hospitals-launches-acls-ambulance-network/article71084802.ece,2026-06-11T23:41:34+00:00
Chennai,The Hindu,Chennai • The Hindu,https://www.thehindu.com/news/cities/chennai/,8,Vertical expansion ahead: Chennai Port to soon build a multi-level car parking facility,https://www.thehindu.com/news/cities/chennai/vertical-expansion-ahead-chennai-port-to-soon-build-a-multi-level-car-parking-facility/article71085402.ece,2026-06-11T23:41:34+00:00
Chennai,The Hindu,Chennai • The Hindu,https://www.thehindu.com/news/cities/chennai/,9,Film director Bharathiraja laid to rest with state honours in Theni district,https://www.thehindu.com/news/national/tamil-nadu/film-directorbharathirajalaid-to-rest-with-state-honours-intheni-district/article71089430.ece,2026-06-11T23:41:34+00:00
Chennai,The Hindu,Chennai • The Hindu,https://www.thehindu.com/news/cities/chennai/,10,Chennai’s Artiform blends contemporary art with everyday living spaces,https://www.thehindu.com/entertainment/art/chennais-artiform-blends-contemporary-art-with-everyday-living-spaces/article71084227.ece,2026-06-11T23:41:34+00:00
Chennai,The Hindu,Chennai • The Hindu,https://www.thehindu.com/news/cities/chennai/,11,"At Ashvita’s, Mimesis by Thukral & Tagra reflects on data, memory, surveillance and the digital selves we leave behind",https://www.thehindu.com/entertainment/art/at-ashvitas-mimesis-by-thukral-tagra-reflects-on-data-memory-surveillance-and-the-digital-selves-we-leave-behind/article71079945.ece,2026-06-11T23:41:34+00:00
Chennai,The Hindu,Chennai • The Hindu,https://www.thehindu.com/news/cities/chennai/,12,"Tamil Nadu is committed to working constructively with Centre, says Vijay",https://www.thehindu.com/news/national/tamil-nadu/tamil-nadu-is-committed-to-working-constructively-with-centre-saysvijay/article71089880.ece,2026-06-11T23:41:34+00:00
Chennai,The Hindu,Chennai • The Hindu,https://www.thehindu.com/news/cities/chennai/,13,Chennai power cuts | Some people instigating residents to protest even after restoration of supply: Minister Nirmalkumar,https://www.thehindu.com/news/cities/chennai/chennai-power-cuts-some-people-instigating-residents-to-protest-though-supply-restored-minister-nirmalkumar/article71079899.ece,2026-06-11T23:41:34+00:00
Chennai,The Hindu,Chennai • The Hindu,https://www.thehindu.com/news/cities/chennai/,14,Power cuts leave Chennai residents fuming; protests erupt across city,https://www.thehindu.com/news/cities/chennai/power-outages-leave-chennai-residents-fuming-protests-erupt-across-city-june-8-2026/article71079661.ece,2026-06-11T23:41:34+00:00
Chennai,The Hindu,Chennai • The Hindu,https://www.thehindu.com/news/cities/chennai/,15,"Poonamallee-Vadapalani stretch of Chennai Metro Rail ready, but yet to open",https://www.thehindu.com/news/cities/chennai/poonamallee-vadapalani-metro-stretch-ready-but-yet-to-open/article71077506.ece,2026-06-11T23:41:34+00:00
Chennai,The Hindu,Chennai • The Hindu,https://www.thehindu.com/news/cities/chennai/,16,11 Chennai Metro Rail stations in phase II network to have retail spaces,https://www.thehindu.com/news/cities/chennai/11-metro-rail-stations-in-phase-ii-networkto-have-retail-spaces/article71073094.ece,2026-06-11T23:41:34+00:00
Chennai,The Hindu,Chennai • The Hindu,https://www.thehindu.com/news/cities/chennai/,17,"Go well, Bharathiraja sir: Ponvannan’s heartfelt tribute to ‘Iyakkunar Imayam’",https://www.thehindu.com/entertainment/movies/bharathiraja-ponvannan-heartfelt-tribute-iyakkunar-imayam-karuththamma/article71088873.ece,2026-06-11T23:41:34+00:00
Chennai,The Hindu,Chennai • The Hindu,https://www.thehindu.com/news/cities/chennai/,18,‘Jana Nayagan’ film leak case: Mastermind among two more held,https://www.thehindu.com/news/national/tamil-nadu/jana-nayagan-film-leak-case-mastermind-among-two-more-held/article71088560.ece,2026-06-11T23:41:34+00:00
Chennai,The Hindu,Chennai • The Hindu,https://www.thehindu.com/news/cities/chennai/,19,Residents of three zones will not receive piped water supply on June 13 and 14,https://www.thehindu.com/news/cities/chennai/residents-of-three-zones-will-not-receive-piped-water-supply-on-june-13-and-14/article71089100.ece,2026-06-11T23:41:34+00:00
Chennai,The Hindu,Chennai • The Hindu,https://www.thehindu.com/news/cities/chennai/,20,"Impose fine on those littering beaches, NGT directs local bodies",https://www.thehindu.com/news/cities/chennai/impose-fine-on-those-littering-beaches-ngt-directs-local-bodies/article71089347.ece,2026-06-11T23:41:34+00:00
Chennai,The Hindu,Chennai • The Hindu,https://www.thehindu.com/news/cities/chennai/,21,Anbumani urges GCC to release May salaries of contract medical workers,https://www.thehindu.com/news/cities/chennai/anbumani-urges-gcc-to-release-may-salaries-of-contract-medical-workers/article71088718.ece,2026-06-11T23:41:34+00:00
Chennai,The Hindu,Chennai • The Hindu,https://www.thehindu.com/news/cities/chennai/,22,Anbumani calls for Right to Services Act in Tamil Nadu,https://www.thehindu.com/news/cities/chennai/anbumani-calls-for-right-to-services-act-in-tamil-nadu/article71089715.ece,2026-06-11T23:41:34+00:00
