city,publisher,source,source_url,rank,headline,link,collected_at_iso
Delhi-NCR,Jagran,Delhi-NCR • Jagran,https://www.jagran.com/delhi-ncr,27,"नालों में सीवर का पानी डालने से वसुंधरा के लोग नाराज, जाएंगे एनजीटी",https://www.jagran.com/uttar-pradesh/ghaziabad-vasundhara-residents-to-approach-ngt-over-sewer-flooding-40301984.html,2026-07-10T21:11:03+00:00
Delhi-NCR,Jagran,Delhi-NCR • Jagran,https://www.jagran.com/delhi-ncr,28,"इंदिरापुरम में करंट लगने से युवक की मौत, विद्युत निगम पर लापरवाही का आरोप",https://www.jagran.com/uttar-pradesh/ghaziabad-indirapuram-electrocution-death-fir-filed-against-power-dept-40301981.html,2026-07-10T21:11:03+00:00
Delhi-NCR,Jagran,Delhi-NCR • Jagran,https://www.jagran.com/delhi-ncr,29,"जातिसूचक शब्द कहे फिर पिस्टल तानकर बहन से की अभद्रता, विरोध करने पर भाई पर पेचकस से हमला",https://www.jagran.com/uttar-pradesh/ghaziabad-ghaziabad-girl-harassed-brother-attacked-in-ankur-vihar-40301978.html,2026-07-10T21:11:03+00:00
Delhi-NCR,Jagran,Delhi-NCR • Jagran,https://www.jagran.com/delhi-ncr,30,"स्कूल निर्माण की खोदाई से इंदिरापुरम की शिप्रा सनसिटी में चारदीवारी धंसी, पेयजल आपूर्ति बाधित",https://www.jagran.com/uttar-pradesh/ghaziabad-shipra-suncity-wall-collapses-in-indirapuram-ghaziabad-40301975.html,2026-07-10T21:11:03+00:00
Delhi-NCR,Jagran,Delhi-NCR • Jagran,https://www.jagran.com/delhi-ncr,31,"मानसून में अरावली के 10 सीक्रेट स्पॉट बना रहे NCR वालों को दीवाना; दिल्ली के पास छिपे हैं झरने, झील और रहस्यमयी जंगल",https://www.jagran.com/haryana/gurgaon-aravalli-monsoon-delhincrs-hidden-gems-secret-spots-revealed-40301521.html,2026-07-10T21:11:03+00:00
Delhi-NCR,Jagran,Delhi-NCR • Jagran,https://www.jagran.com/delhi-ncr,32,"मानेसर वालों की बल्ले-बल्ले, विकास कार्यों से लोगों को मिलेगी राहत; खर्च होंगे 1 करोड़ से ज्यादा",https://www.jagran.com/haryana/gurgaon-manesar-garhi-village-gets-156-cr-road-sewer-water-project-40301519.html,2026-07-10T21:11:03+00:00
Delhi-NCR,Jagran,Delhi-NCR • Jagran,https://www.jagran.com/delhi-ncr,33,"गुरुग्राम में मुठभेड़ में 4 शूटर ढेर, आधी रात गोलियों की तड़तड़ाहट से दहला इलाका; एनकाउंटर की Inside Story",https://www.jagran.com/haryana/gurgaon-four-shooters-were-killed-in-an-encounter-for-first-time-in-gurugrams-history-40301281.html,2026-07-10T21:11:03+00:00
Delhi-NCR,Jagran,Delhi-NCR • Jagran,https://www.jagran.com/delhi-ncr,34,"जेल में वाटर कूलर और इंसुलिन के लिए फ्रिज की मांग, AAP के पूर्व मंत्री संजीव आरोड़ा की याचिका पर फैसला आज",https://www.jagran.com/haryana/gurgaon-sanjeev-aroras-jail-petitions-insulin-fridge-water-cooler-hearing-40301286.html,2026-07-10T21:11:03+00:00
Delhi-NCR,Jagran,Delhi-NCR • Jagran,https://www.jagran.com/delhi-ncr,35,"गुरुग्राम में 51 साल बाद न्यायिक व्यवस्था का नया युग, CJI सूर्यकांत करेंगे 'टावर ऑफ जस्टिस' का उद्घाटन",https://www.jagran.com/haryana/gurgaon-gurgaons-tower-of-justice-inauguration-new-era-for-judiciary-40301108.html,2026-07-10T21:11:03+00:00
Delhi-NCR,Jagran,Delhi-NCR • Jagran,https://www.jagran.com/delhi-ncr,36,"अब गाजियाबाद-नोएडा नहीं जाएंगी ग्रेनो की ई-बसें, कासना डिपो में बनेंगे 8 चार्जिंग स्टेशन",https://www.jagran.com/uttar-pradesh/noida-greater-noida-ebus-charging-8-stations-at-kasna-depot-40302014.html,2026-07-10T21:11:03+00:00
Delhi-NCR,Jagran,Delhi-NCR • Jagran,https://www.jagran.com/delhi-ncr,37,"नोएडा: हरनंदी को तैरकर पार कर रहा युवक डूबा, तलाश में जुटी एनडीआरएफ की टीम",https://www.jagran.com/uttar-pradesh/noida-noida-man-drowns-in-harnandi-river-after-alcohol-consumption-40301332.html,2026-07-10T21:11:03+00:00
Delhi-NCR,Jagran,Delhi-NCR • Jagran,https://www.jagran.com/delhi-ncr,38,"नोएडा में चल रहा बड़ा 'खेल', अवैध कियोस्क से हर महीने 6 करोड़ की वसूली; एक्शन की तैयारी में प्राधिकरण",https://www.jagran.com/uttar-pradesh/noida-noida-illegal-kiosks-rake-in-rs-6-cr-monthly-across-societies-40301130.html,2026-07-10T21:11:03+00:00
Delhi-NCR,Jagran,Delhi-NCR • Jagran,https://www.jagran.com/delhi-ncr,39,"नोएडा में 26 एकड़ में बनेगा अंतरराष्ट्रीय खेल परिसर, खर्च होंगे 145 करोड़ रुपये; खिलाड़ियों को मिलेंगी सुविधाएं",https://www.jagran.com/uttar-pradesh/noida-noida-international-sports-complex-retender-for-2665-acres-40301124.html,2026-07-10T21:11:03+00:00
Delhi-NCR,Jagran,Delhi-NCR • Jagran,https://www.jagran.com/delhi-ncr,40,"दिल्ली में 37.50 लाख की लूट निकली फर्जी, कंपनी के दो कर्मचारियों ने दोस्त संग रची थी साजिश",https://www.jagran.com/delhi/new-delhi-city-delhi-timarpur-3750-lakh-robbery-staged-by-company-staff-40302116.html,2026-07-10T21:11:03+00:00
Delhi-NCR,Jagran,Delhi-NCR • Jagran,https://www.jagran.com/delhi-ncr,41,"दिल्ली IVF विवाद: जांच में मिले दस्तावेज, दंपती ने डोनर स्पर्म और एग्स के इस्तेमाल पर दी थी सहमति",https://www.jagran.com/delhi/new-delhi-city-gurugram-couples-ivf-twins-born-from-donor-sperm-eggs-40302112.html,2026-07-10T21:11:03+00:00
Delhi-NCR,Jagran,Delhi-NCR • Jagran,https://www.jagran.com/delhi-ncr,42,"800 KM तक किया पीछा, आगरा में की घेराबंदी; नजफगढ़ में गैंगवार से पहले दिल्‍ली पुलिस ने दबोचा बदमाश",https://www.jagran.com/delhi/new-delhi-city-delhi-police-prevent-najafgarh-gang-war-arrest-gangster-40302101.html,2026-07-10T21:11:03+00:00
Delhi-NCR,Jagran,Delhi-NCR • Jagran,https://www.jagran.com/delhi-ncr,43,"बिजवासन-कापसहेड़ा वालों की सुनी गई फरियाद, DTC ने शुरू की नई इलेक्ट्रिक बस सेवा; जानें रूट",https://www.jagran.com/delhi/new-delhi-city-dtc-launches-new-electric-bus-service-for-bijwasan-kapashera-40302084.html,2026-07-10T21:11:03+00:00
Delhi-NCR,Jagran,Delhi-NCR • Jagran,https://www.jagran.com/delhi-ncr,44,"दिल्ली-NCR के उद्योगों को बड़ा झटका, जल्द छिन सकती है 'बायोमास ईंधन' के इस्तेमाल की छूट; जानें पूरा मामला",https://www.jagran.com/delhi/new-delhi-city-delhincr-industries-biomass-fuel-exemption-ending-soon-40302071.html,2026-07-10T21:11:03+00:00
Delhi-NCR,Jagran,Delhi-NCR • Jagran,https://www.jagran.com/delhi-ncr,45,Faridabad Mandi Bhav Today: डबुआ मंडी में आज क्या रहे फल-सब्जियों और फसलों के दाम? देखें पूरी लिस्ट,https://www.jagran.com/haryana/faridabad-faridabad-dabua-mandi-fruit-veg-prices-fluctuate-40302048.html,2026-07-10T21:11:03+00:00
Delhi-NCR,Jagran,Delhi-NCR • Jagran,https://www.jagran.com/delhi-ncr,46,"फरीदाबाद में दीवार पर रेंगता दिखा 12 फुट का अजगर, इलाके में फैली दहशत; वन विभाग ने किया अलर्ट",https://www.jagran.com/haryana/faridabad-12foot-python-sighting-in-faridabad-sparks-fear-40301818.html,2026-07-10T21:11:03+00:00
Delhi-NCR,Jagran,Delhi-NCR • Jagran,https://www.jagran.com/delhi-ncr,47,"फरीदाबाद में दर्दनाक हादसा: आशियाना फ्लैट के पास पानी से भरे गड्ढे में गिरा 9 साल का मासूम, चल रहा इलाज",https://www.jagran.com/haryana/faridabad-9-year-old-drowns-in-water-pit-near-ashiana-flat-faridabad-40301425.html,2026-07-10T21:11:03+00:00
Delhi-NCR,Jagran,Delhi-NCR • Jagran,https://www.jagran.com/delhi-ncr,48,"अब 31 जुलाई तक सरचार्ज माफी की छूट, फरीदाबाद के लोगों को बड़ी राहत; फिर से उठा सकेंगे योजना का लाभ",https://www.jagran.com/haryana/faridabad-faridabad-property-tax-surcharge-waiver-extended-to-july-31-40301260.html,2026-07-10T21:11:03+00:00
Delhi-NCR,Jagran,Delhi-NCR • Jagran,https://www.jagran.com/delhi-ncr,49,"'मुझे मार रहे हैं...', फोन पर विवाहिता ने जताया था अपनी जान का खतरा; कुछ देर बाद फंदे से लटका मिला शव",https://www.jagran.com/haryana/faridabad-faridabad-dowry-death-woman-found-hanged-7-booked-40301111.html,2026-07-10T21:11:03+00:00
Delhi-NCR,Jagran,Delhi-NCR • Jagran,https://www.jagran.com/delhi-ncr,50,"मोबाइल टॉर्च की रोशनी में गर्भवती का किया ऑपरेशन; 200 बेड वाले पलवल जिला अस्पताल में बिजली, जनरेटर-इन्वर्टर तीनों फेल",https://www.jagran.com/haryana/palwal-palwal-hospital-doctors-use-phone-torch-for-surgery-during-power-cut-40301610.html,2026-07-10T21:11:03+00:00
Delhi-NCR,Jagran,Delhi-NCR • Jagran,https://www.jagran.com/delhi-ncr,51,"पलवल में वाहन चोर गिरोह का भंडाफोड़: शातिर बाइक चोर और कबाड़ी गिरफ्तार, भारी मात्रा में कटे हुए पार्ट्स बरामद",https://www.jagran.com/haryana/palwal-palwal-police-busts-vehicle-theft-ring-bike-thief-and-scrapper-arrested-40301465.html,2026-07-10T21:11:03+00:00
Delhi-NCR,Jagran,Delhi-NCR • Jagran,https://www.jagran.com/delhi-ncr,52,"PHOTOS: पलवल में आफत की बारिश! 3 घंटे में डूबा शहर, 29 करोड़ के नाले फेल; 'दो करोड़' पानी में बहे",https://www.jagran.com/haryana/palwal-palwal-weather-floods-heavy-rain-exposes-failed-drainage-system-40300387.html,2026-07-10T21:11:03+00:00
Delhi-NCR,Jagran,Delhi-NCR • Jagran,https://www.jagran.com/delhi-ncr,53,"आरटीओ का अधिकारी बनकर गोशाला की गाड़ी रोकी, 24 हजार ऐंठे; विभाग बोला- उस दिन ड्यूटी ही नहीं लगाई थी",https://www.jagran.com/haryana/palwal-palwal-rto-impersonators-extort-24k-from-gaushala-vehicle-40300366.html,2026-07-10T21:11:03+00:00
Delhi-NCR,Jagran,Delhi-NCR • Jagran,https://www.jagran.com/delhi-ncr,54,"जातिसूचक शब्द कहने का विरोध करने पर परिवार पर लाठी-डंडों और सरियों से हमला, एससी एक्ट में मामला दर्ज",https://www.jagran.com/haryana/palwal-palwal-family-attacked-for-protesting-casteist-slurs-40299247.html,2026-07-10T21:11:03+00:00
Delhi-NCR,Jagran,Delhi-NCR • Jagran,https://www.jagran.com/delhi-ncr,55,"गाजियाबाद के मुशीर चौधरी का भारतीय टीम में चयन, अंडर-18 एशियन वॉलीबॉल चैंपियनशिप के लिए चीन रवाना",https://www.jagran.com/uttar-pradesh/ghaziabad-ghaziabads-mushir-chaudhary-selected-for-u18-asian-volleyball-40302187.html,2026-07-10T21:11:03+00:00
Delhi-NCR,Jagran,Delhi-NCR • Jagran,https://www.jagran.com/delhi-ncr,56,"LTT-गोरखपुर एक्सप्रेस में 15 तोला सोना और 50 हजार रुपए कैश चोरी, प्रयागराज पुलिस ने शुरू की जांच",https://www.jagran.com/uttar-pradesh/prayagraj-ltt-gorakhpur-express-theft-gold-cash-stolen-phone-hidden-40302190.html,2026-07-10T21:11:03+00:00
Delhi-NCR,Jagran,Delhi-NCR • Jagran,https://www.jagran.com/delhi-ncr,57,"मेरठ में लाठीचार्ज और थप्पड़ कांड पर बहस तेज, SSP बोले- 'जो पक्ष में हैं 1 पेड़ लगाएं, जो विरोध में हैं 2 लगाएं'",https://www.jagran.com/uttar-pradesh/meerut-city-meerut-ssp-avinash-pandeys-unique-appeal-amidst-lathicharge-row-40302150.html,2026-07-10T21:11:03+00:00
Delhi-NCR,Jagran,Delhi-NCR • Jagran,https://www.jagran.com/delhi-ncr,58,"गौतमबुद्ध नगर में डाक सेवाएं होंगी और आसान, नई पोस्ट ऑफिस फ्रेंचाइजी के लिए 15 जुलाई से आवेदन",https://www.jagran.com/uttar-pradesh/noida-gautam-buddh-nagar-new-postal-franchises-opening-soon-40302174.html,2026-07-10T21:11:03+00:00
Delhi-NCR,Jagran,Delhi-NCR • Jagran,https://www.jagran.com/delhi-ncr,59,"गाजियाबाद में 20 नई जगहों पर लगेंगे ITMS कैमरे, ट्रैफिक नियम तोड़ने वालों पर रहेगी कड़ी नजर",https://www.jagran.com/uttar-pradesh/ghaziabad-ghaziabad-to-get-20-new-smart-itms-cameras-for-traffic-control-40302165.html,2026-07-10T21:11:03+00:00
Delhi-NCR,Jagran,Delhi-NCR • Jagran,https://www.jagran.com/delhi-ncr,60,"अब पूरे यूपी में गूंजेगा हापुड़ एसपी का गीत ""एक वृक्ष मां के नाम"", वृक्षारोपण अभियान को मिलेगी नई ऊर्जा",https://www.jagran.com/uttar-pradesh/hapur-city-hapur-sps-song-ek-vriksh-maa-ke-naam-boosts-up-tree-drive-40302148.html,2026-07-10T21:11:03+00:00
Delhi-NCR,Jagran,Delhi-NCR • Jagran,https://www.jagran.com/delhi-ncr,61,"गोरखपुर में पंक्चर वाले के दस्तावेजों से बना दी 100 करोड़ की फर्जी कंपनी, दो लोगों पर केस दर्ज",https://www.jagran.com/uttar-pradesh/gorakhpur-city-gorakhpur-puncture-shop-owners-docs-used-for-100-cr-fake-firm-40302170.html,2026-07-10T21:11:03+00:00
Delhi-NCR,Jagran,Delhi-NCR • Jagran,https://www.jagran.com/delhi-ncr,62,"MLC चुनाव में यूपी भाजपा की नई टीम की होगी कड़ी परीक्षा, तैयार की जाएगी रणनीति",https://www.jagran.com/uttar-pradesh/lucknow-city-bjp-faces-key-test-in-up-mlc-rajya-sabha-elections-40302168.html,2026-07-10T21:11:03+00:00
Delhi-NCR,Jagran,Delhi-NCR • Jagran,https://www.jagran.com/delhi-ncr,63,"बिजनौर में लकड़ी माफियाओं का आतंक: खैर के 5 पेड़ काटे, वनकर्मियों से मारपीट कर छीनी बाइक",https://www.jagran.com/uttar-pradesh/bijnor-bijnor-wood-mafia-assaults-forest-staff-steals-bikes-40302166.html,2026-07-10T21:11:03+00:00
Delhi-NCR,Jagran,Delhi-NCR • Jagran,https://www.jagran.com/delhi-ncr,64,"घर की उत्तर-पूर्व दिशा में भूलकर भी न रखें इस रंग की चीजें,",https://www.jagran.com/spiritual/vastu-shastra-never-keep-items-of-this-color-in-the-north-east-direction-of-your-home-according-to-vastu-40301370.html,2026-07-10T21:11:03+00:00
Delhi-NCR,Jagran,Delhi-NCR • Jagran,https://www.jagran.com/delhi-ncr,65,बिजनौर-हरिद्वार मार्ग पर मालन नदी का पानी आने से आवागमन रोका,https://www.jagran.com/uttar-pradesh/bijnor-traffic-halted-on-bijnor-haridwar-route-due-to-flow-of-malan-river-40301361.html,2026-07-10T21:11:03+00:00
Delhi-NCR,Jagran,Delhi-NCR • Jagran,https://www.jagran.com/delhi-ncr,66,"रेवाड़ी के पेट्रोल पंप पर युवती का 'हाईवोल्टेज ड्रामा', नशे",https://www.jagran.com/haryana/rewari-rewari-womans-highvoltage-drama-at-petrol-pump-40301358.html,2026-07-10T21:11:03+00:00
Delhi-NCR,Jagran,Delhi-NCR • Jagran,https://www.jagran.com/delhi-ncr,67,"गुजरात में चांदीपुरा वायरस का प्रकोप, अब तक 3 बच्चों की मौत,",https://www.jagran.com/gujarat/ahmedabad-chandipura-virus-outbreak-in-gujarat-health-department-on-high-alert-40301371.html,2026-07-10T21:11:03+00:00
Delhi-NCR,Jagran,Delhi-NCR • Jagran,https://www.jagran.com/delhi-ncr,68,"उत्तराखंड कांग्रेस एकजुट, आगामी चुनाव में जीत तय: केसी वेणुग",https://www.jagran.com/uttarakhand/dehradun-city-kc-venugopal-uttarakhand-congress-united-demands-temple-probe-40301362.html,2026-07-10T21:11:03+00:00
Delhi-NCR,Jagran,Delhi-NCR • Jagran,https://www.jagran.com/delhi-ncr,69,"अदाणी ग्रुप की एक और बड़ी साझेदारी, फ्रांस की नामी कंपनी से",https://www.jagran.com/business/biz-adani-group-big-move-partnership-with-dioxycle-to-advance-lowcarbon-chemical-manufacturing-40301368.html,2026-07-10T21:11:03+00:00
Delhi-NCR,Jagran,Delhi-NCR • Jagran,https://www.jagran.com/delhi-ncr,70,"लखनऊ के घूसखोर दारोगा और पीड़ित पक्ष के दर्ज होंगे बयान, एसी",https://www.jagran.com/uttar-pradesh/lucknow-city-lucknow-si-guddu-prasad-suspended-for-bribery-probe-on-40301366.html,2026-07-10T21:11:03+00:00
Delhi-NCR,Jagran,Delhi-NCR • Jagran,https://www.jagran.com/delhi-ncr,71,"आगरा में सॉफ्टवेयर इंजीनियर गिरफ्तार, मैट्रिमोनियल साइट पर क",https://www.jagran.com/uttar-pradesh/agra-city-agra-software-engineer-arrested-for-matrimonial-crypto-scam-40301353.html,2026-07-10T21:11:03+00:00
Delhi-NCR,Jagran,Delhi-NCR • Jagran,https://www.jagran.com/delhi-ncr,72,बैक-टू-बैक फ्लॉप फिल्में देने के बाद अब Aditya Roy Kapur का,https://www.jagran.com/entertainment/bollywood-aditya-roy-kapur-upcoming-romantic-film-will-be-directed-by-milap-milan-zaveri-40301328.html,2026-07-10T21:11:03+00:00
Delhi-NCR,Jagran,Delhi-NCR • Jagran,https://www.jagran.com/delhi-ncr,73,"जालंधर में बिस्त दोआब नहर फिर उफान पर, किनारा टूटते ही कॉलोन",https://www.jagran.com/punjab/jalandhar-city-bist-doab-canal-overflow-gadhaipur-kalia-colony-jalandhar-effect-40301363.html,2026-07-10T21:11:03+00:00
Delhi-NCR,Jagran,Delhi-NCR • Jagran,https://www.jagran.com/delhi-ncr,74,"रोहतास में नाबालिग से दुष्कर्म और हत्या के दोषी को फांसी की सजा, पीड़िता की मां को आर्थिक मदद",https://www.jagran.com/bihar/rohtas-rohtas-court-sentences-man-to-death-for-minors-rape-murder-40302035.html,2026-07-10T21:11:03+00:00
Delhi-NCR,Jagran,Delhi-NCR • Jagran,https://www.jagran.com/delhi-ncr,75,Lock Upp में जजमेंट डे पर होगा डबल एविक्शन? बाहर हो जाएंगे Ram Kapoor? इन कंटेस्टेंट पर लटक रही तलवार,https://www.jagran.com/entertainment/bollywood-lock-upp-judgement-day-show-may-see-double-eviction-including-sunita-ahuja-varun-kalra-40302019.html,2026-07-10T21:11:03+00:00
Delhi-NCR,Jagran,Delhi-NCR • Jagran,https://www.jagran.com/delhi-ncr,76,"तीसरी बीवी को Aamir Khan ने दी सबसे कीमती रिंग, स्टोन ढूंढने में लगे तीन महीने; 256 घंटे में बनकर हुई तैयार?",https://www.jagran.com/entertainment/bollywood-aamir-khan-gifted-his-wife-gauri-spratt-a-ruby-rare-diamond-ring-on-wedding-took-3-months-to-find-and-256-hours-to-craft-40301769.html,2026-07-10T21:11:03+00:00
Delhi-NCR,Jagran,Delhi-NCR • Jagran,https://www.jagran.com/delhi-ncr,77,"फिल्म के सेट पर कीड़े के काटने से अभिनेता Rajesh Sharma की हालत नाजुक, सिने वर्कर्स ने की जांच की मांग",https://www.jagran.com/entertainment/bollywood-actor-rajesh-sharma-insect-bite-issue-aicwa-demand-immediate-investigation-of-matter-to-chief-minister-of-telangana-40300109.html,2026-07-10T21:11:03+00:00
Delhi-NCR,Jagran,Delhi-NCR • Jagran,https://www.jagran.com/delhi-ncr,78,Did You Know,https://www.jagran.com/did-you-know-news-hindi.html,2026-07-10T21:11:03+00:00
Delhi-NCR,Jagran,Delhi-NCR • Jagran,https://www.jagran.com/delhi-ncr,79,फुटबॉल विश्व कप,https://www.jagran.com/topics/fifa-world-cup-2026,2026-07-10T21:11:03+00:00
Delhi-NCR,Jagran,Delhi-NCR • Jagran,https://www.jagran.com/delhi-ncr,80,ए आई बूटकैंप,https://www.jagran.com/events/jagran-next/ai-bootcamp/index.html,2026-07-10T21:11:03+00:00
Delhi-NCR,Jagran,Delhi-NCR • Jagran,https://www.jagran.com/delhi-ncr,81,मिडिल ईस्ट संकट,https://www.jagran.com/topics/Israel-Iran-Conflict,2026-07-10T21:11:03+00:00
Delhi-NCR,Jagran,Delhi-NCR • Jagran,https://www.jagran.com/delhi-ncr,82,फीफा वर्ल्ड कप 2026,https://www.jagran.com/topics/FIFA-World-Cup-2026,2026-07-10T21:11:03+00:00
Delhi-NCR,Jagran,Delhi-NCR • Jagran,https://www.jagran.com/delhi-ncr,83,आज का राशिफल,https://www.jagran.com/topics/rashifal,2026-07-10T21:11:03+00:00
Delhi-NCR,Jagran,Delhi-NCR • Jagran,https://www.jagran.com/delhi-ncr,84,Submit your news,https://www.jagran.com/citizen-journalism-hindi.html,2026-07-10T21:11:03+00:00
Delhi-NCR,Jagran,Delhi-NCR • Jagran,https://www.jagran.com/delhi-ncr,85,Message from the Editor,https://www.jagran.com/policies-and-standards.html,2026-07-10T21:11:03+00:00
Hyderabad,DC,Hyderabad • DC,https://www.deccanchronicle.com/location/india/southern-states,1,FIFA World Cup 2026,https://www.deccanchronicle.com/fifa-world-cup-2026,2026-07-10T21:11:03+00:00
Hyderabad,DC,Hyderabad • DC,https://www.deccanchronicle.com/location/india/southern-states,2,Opinion and Editorials,https://www.deccanchronicle.com/opinion,2026-07-10T21:11:03+00:00
Hyderabad,DC,Hyderabad • DC,https://www.deccanchronicle.com/location/india/southern-states,3,Assembly Elections 2026,https://www.deccanchronicle.com/assembly-elections-2026,2026-07-10T21:11:03+00:00
Hyderabad,DC,Hyderabad • DC,https://www.deccanchronicle.com/location/india/southern-states,4,Telangana Rising 2047,https://www.deccanchronicle.com/tags/Telangana-Rising-2047,2026-07-10T21:11:03+00:00
Chennai,DC,Chennai • DC,https://www.deccanchronicle.com/location/india/tamil-nadu/chennai-madras,1,FIFA World Cup 2026,https://www.deccanchronicle.com/fifa-world-cup-2026,2026-07-10T21:11:03+00:00
Chennai,DC,Chennai • DC,https://www.deccanchronicle.com/location/india/tamil-nadu/chennai-madras,2,Opinion and Editorials,https://www.deccanchronicle.com/opinion,2026-07-10T21:11:03+00:00
Chennai,DC,Chennai • DC,https://www.deccanchronicle.com/location/india/tamil-nadu/chennai-madras,3,Assembly Elections 2026,https://www.deccanchronicle.com/assembly-elections-2026,2026-07-10T21:11:03+00:00
