city,publisher,source,source_url,rank,headline,link,collected_at_iso
Delhi-NCR,Jagran,Delhi-NCR • Jagran,https://www.jagran.com/delhi-ncr,27,"गाजियाबाद के 5 डॉक्टरों की दिलचस्प कहानियां, कोई पोलियो को मात तो कोई अंधेरी जिंदगी में कर रहें उजाला",https://www.jagran.com/uttar-pradesh/ghaziabad-inspiring-doctors-day-stories-ghaziabads-dedicated-healers-40291077.html,2026-07-01T12:43:09+00:00
Delhi-NCR,Jagran,Delhi-NCR • Jagran,https://www.jagran.com/delhi-ncr,28,"'साहब दो दिन से नहाया नहीं हूं, पानी की एक बूंद नहीं मिली'; गाजियाबाद नगर आयुक्त के पास पहुंचा फरियादी",https://www.jagran.com/uttar-pradesh/ghaziabad-ghaziabad-water-crisis-sudamapuri-residents-plea-at-public-hearing-40290871.html,2026-07-01T12:43:09+00:00
Delhi-NCR,Jagran,Delhi-NCR • Jagran,https://www.jagran.com/delhi-ncr,29,"11 साल का प्यार, एक शक और हत्या: गाजियाबाद में प्रेमी के कत्ल के बाद सीलिंग फैन से रची सुसाइड की साजिश",https://www.jagran.com/uttar-pradesh/ghaziabad-ghaziabad-livein-partner-murdered-over-daughters-safety-40290850.html,2026-07-01T12:43:09+00:00
Delhi-NCR,Jagran,Delhi-NCR • Jagran,https://www.jagran.com/delhi-ncr,30,"गाजियाबाद में ड्रग्स तस्कर नितिन यादव गिरफ्तार, दो फ्लैट से भारी मात्रा में ड्रग्स और पांच लाख नकद बरामद",https://www.jagran.com/uttar-pradesh/ghaziabad-ghaziabad-drug-bust-nitin-yadav-arrested-drugs-cash-seized-40290723.html,2026-07-01T12:43:09+00:00
Delhi-NCR,Jagran,Delhi-NCR • Jagran,https://www.jagran.com/delhi-ncr,31,"गैंगस्टर बना पिता: काला जठेड़ी कड़ी सुरक्षा में 4 घंटे के लिए आया गुरुग्राम, पत्नी और जुड़वां बच्चियों से मिला",https://www.jagran.com/haryana/gurgaon-gangster-kala-jathedi-meets-wife-newborn-twins-in-gurugram-40290947.html,2026-07-01T12:43:09+00:00
Delhi-NCR,Jagran,Delhi-NCR • Jagran,https://www.jagran.com/delhi-ncr,32,2 जुलाई से टोल टैक्स फ्री होगा गुरुग्राम-फरीदाबाद रोड? दिल्ली-NCR के हजारों लोगों को मिलेगा फायदा,https://www.jagran.com/haryana/gurgaon-gurugramfaridabad-toll-plaza-to-close-from-july-2-ncr-relief-40290760.html,2026-07-01T12:43:09+00:00
Delhi-NCR,Jagran,Delhi-NCR • Jagran,https://www.jagran.com/delhi-ncr,33,"गुरुग्राम में 50 यात्रियों से भरी बस डिवाइडर से टकराई, DME पर फटा फ्यूल टैंक; मच गई अफरा-तफरी",https://www.jagran.com/haryana/gurgaon-gurugram-bus-accident-volvo-hits-divider-fuel-tank-bursts-40290713.html,2026-07-01T12:43:09+00:00
Delhi-NCR,Jagran,Delhi-NCR • Jagran,https://www.jagran.com/delhi-ncr,34,"नोएडा में यमुना एक्सप्रेसवे पर पैदल चलते समय एंबुलेंस से कुचलकर महिला की मौत, महोबा में है घर",https://www.jagran.com/uttar-pradesh/noida-woman-dies-in-yamuna-expressway-ambulance-accident-greater-noida-40291142.html,2026-07-01T12:43:09+00:00
Delhi-NCR,Jagran,Delhi-NCR • Jagran,https://www.jagran.com/delhi-ncr,35,"ग्रेटर नोएडा प्राधिकरण कार्यालय पर सफाई कर्मचारियों का अनिश्चितकालीन धरना शुरू, प्राधिकरण को दी चेतावनी",https://www.jagran.com/uttar-pradesh/noida-greater-noida-sanitation-workers-begin-indefinite-protest-40291011.html,2026-07-01T12:43:09+00:00
Delhi-NCR,Jagran,Delhi-NCR • Jagran,https://www.jagran.com/delhi-ncr,36,"Monsoon 2026: उत्तराखंड, हिमाचल और UP में मानसून की दस्तक, दिल्ली-NCR में और कितना इंतजार?",https://www.jagran.com/uttar-pradesh/noida-noida-monsoon-rain-expected-by-july-34-relief-from-heat-40290880.html,2026-07-01T12:43:09+00:00
Delhi-NCR,Jagran,Delhi-NCR • Jagran,https://www.jagran.com/delhi-ncr,37,YEIDA में 3181 करोड़ के निवेश से 18 हजार अधिक लोगों को मिलेगी नौकरी! 8 कंपनियों को मिली जमीन,https://www.jagran.com/uttar-pradesh/noida-yeida-secures-3181-cr-investment-creates-18k-jobs-in-greater-noida-40290728.html,2026-07-01T12:43:09+00:00
Delhi-NCR,Jagran,Delhi-NCR • Jagran,https://www.jagran.com/delhi-ncr,38,"दिल्ली के पहाड़गंज में चल रहा था देह व्यापार का कारोबार, पुलिस ने किया भंडाफोड़; चार महिलाओं को कराया मुक्त",https://www.jagran.com/delhi/new-delhi-city-paharganj-spa-bust-delhi-police-uncover-prostitution-racket-40291296.html,2026-07-01T12:43:09+00:00
Delhi-NCR,Jagran,Delhi-NCR • Jagran,https://www.jagran.com/delhi-ncr,39,"फरीदाबाद में छत पर सो रहे युवक को सिर में गोली मारी, पत्नी के पूर्व पति पर आरोप",https://www.jagran.com/haryana/faridabad-faridabad-man-shot-in-head-by-wifes-exhusband-40291274.html,2026-07-01T12:43:09+00:00
Delhi-NCR,Jagran,Delhi-NCR • Jagran,https://www.jagran.com/delhi-ncr,40,"फरीदाबाद-गुरुग्राम आने-जाने वालों को बड़ा झटका! 2 जुलाई से नहीं हटेंगे ये 4 टोल टैक्स, सरकार ने लिया बड़ा फैसला",https://www.jagran.com/haryana/faridabad-ncr-toll-tax-extended-indefinitely-on-4-faridabad-tolls-40291037.html,2026-07-01T12:43:09+00:00
Delhi-NCR,Jagran,Delhi-NCR • Jagran,https://www.jagran.com/delhi-ncr,41,"फरीदाबाद में बहन के लिव-इन पार्टनर ने युवक को चाकू से गोदा, फोन पर कहासुनी के बाद सीधे पहुंच गया घर",https://www.jagran.com/haryana/faridabad-faridabad-youth-stabbed-by-sisters-livein-partner-40291071.html,2026-07-01T12:43:09+00:00
Delhi-NCR,Jagran,Delhi-NCR • Jagran,https://www.jagran.com/delhi-ncr,42,"नकली नोट छापने के लिए दिल्ली से खरीदा था कागज, आईटी इंजीनियर को लेकर सप्लायर से मिलेगी पुलिस",https://www.jagran.com/haryana/faridabad-faridabad-it-engineer-arrested-for-fake-notes-paper-from-delhi-40290752.html,2026-07-01T12:43:09+00:00
Delhi-NCR,Jagran,Delhi-NCR • Jagran,https://www.jagran.com/delhi-ncr,43,"फरीदाबाद में छत पर सो रहे युवक के सिर में मारी गोली, गंभीर हालत में दिल्ली रेफर",https://www.jagran.com/haryana/faridabad-faridabad-man-shot-in-head-while-sleeping-critical-40290673.html,2026-07-01T12:43:09+00:00
Delhi-NCR,Jagran,Delhi-NCR • Jagran,https://www.jagran.com/delhi-ncr,44,"पलवल में नशे में धुत पड़ोसी ने सोते समय बुजुर्ग महिला पर किया तलवार से हमला, मोहल्ले में दहशत",https://www.jagran.com/haryana/palwal-palwal-drunk-neighbor-attacks-elderly-woman-with-sword-40290779.html,2026-07-01T12:43:09+00:00
Delhi-NCR,Jagran,Delhi-NCR • Jagran,https://www.jagran.com/delhi-ncr,45,"DME पर खड़े डंपर से टकराई कार, बेटे की मौत और मां ICU में; लापरवाह ड्राइवर फरार",https://www.jagran.com/haryana/palwal-dme-car-accident-son-dies-mother-critical-after-hitting-dumper-40288812.html,2026-07-01T12:43:09+00:00
Delhi-NCR,Jagran,Delhi-NCR • Jagran,https://www.jagran.com/delhi-ncr,46,"पलवल में 60 लाख कीमत का 200 किलो गांजा बरामद, राजस्थान के दो अंतरराज्यीय तस्कर गिरफ्तार",https://www.jagran.com/haryana/palwal-palwal-police-seizes-200kg-ganja-worth-60-lakh-2-arrested-40288727.html,2026-07-01T12:43:09+00:00
Delhi-NCR,Jagran,Delhi-NCR • Jagran,https://www.jagran.com/delhi-ncr,47,"पलवल में रेलवे की ऊंची दीवारों ने बढ़ाई लाखों लोगों की मुश्किलें, नए फुटओवर ब्रिज के लिए लिखा पत्र",https://www.jagran.com/haryana/palwal-palwal-residents-demand-new-railway-footover-bridge-for-connectivity-40288000.html,2026-07-01T12:43:09+00:00
Delhi-NCR,Jagran,Delhi-NCR • Jagran,https://www.jagran.com/delhi-ncr,48,"पलवल: होडल के गांवों में वर्षों से जर्जर रास्तों से मिलेगी मुक्ति, टेंडर जारी कर चमकेंगी गांवों की जर्जर सड़कें",https://www.jagran.com/haryana/palwal-palwal-hodal-villages-get-new-roads-end-to-dilapidated-paths-40286596.html,2026-07-01T12:43:09+00:00
Delhi-NCR,Jagran,Delhi-NCR • Jagran,https://www.jagran.com/delhi-ncr,49,"घोर लापरवाही, लखनऊ में अस्सी प्रतिशत कमर्शियल उपभोक्ताओं के पास विद्युत सुरक्षा निदेशालय की एनओसी नहीं",https://www.jagran.com/uttar-pradesh/lucknow-city-height-of-negligence-in-lucknow-80-percent-of-commercial-consumers-in-lucknow-lack-an-noc-from-the-directorate-of-electrical-safety-40291387.html,2026-07-01T12:43:09+00:00
Delhi-NCR,Jagran,Delhi-NCR • Jagran,https://www.jagran.com/delhi-ncr,50,"मिनी नंदिनी योजना में 10 गायों पर 11.80 लाख रुपये का अनुदान, योजना में ऋण लेने की अनिवार्यता खत्म",https://www.jagran.com/uttar-pradesh/pratapgarh-mini-nandini-yojana-1m-118k-grant-for-10-cows-in-pratapgarh-40291355.html,2026-07-01T12:43:09+00:00
Delhi-NCR,Jagran,Delhi-NCR • Jagran,https://www.jagran.com/delhi-ncr,51,"यूपी की स्वास्थ्य सेवाओं में AI क्रांति, गंभीर बीमारियों की जांच के लिए केंद्र और योगी सरकार के बीच हुआ MoU",https://www.jagran.com/uttar-pradesh/lucknow-city-up-healthcare-yogi-govt-centre-mou-for-ai-diagnostics-40291391.html,2026-07-01T12:43:09+00:00
Delhi-NCR,Jagran,Delhi-NCR • Jagran,https://www.jagran.com/delhi-ncr,52,"यूपी में वन रक्षक और वन्य जीव रक्षक के 708 पदों के लिए आवेदन शुरू, 20 जुलाई तक मौका",https://www.jagran.com/uttar-pradesh/lucknow-city-upsssc-forest-wildlife-guard-recruitment-2024-apply-by-july-20-40291374.html,2026-07-01T12:43:09+00:00
Delhi-NCR,Jagran,Delhi-NCR • Jagran,https://www.jagran.com/delhi-ncr,53,"यूपी को मिलेगी प्रशासनिक ट्रेनिंग की नई सौगात, 464 करोड़ के अत्याधुनिक 'लोहिया अकादमी' परिसर का लोकार्पण करेंगे सीएम योगी",https://www.jagran.com/uttar-pradesh/lucknow-city-cm-yogi-to-inaugurate-464-cr-lohia-academy-campus-in-lucknow-40291383.html,2026-07-01T12:43:09+00:00
Delhi-NCR,Jagran,Delhi-NCR • Jagran,https://www.jagran.com/delhi-ncr,54,"रामपुर में झमाझम बारिश से मौसम हुआ सुहावना, लेकिन जलभराव ने बढ़ाई आफत; जानें अगले 3 दिन कैसा रहेगा मौसम",https://www.jagran.com/uttar-pradesh/rampur-rampur-weather-update-heavy-rain-waterlogging-alert-monsoon-forecast-40291315.html,2026-07-01T12:43:09+00:00
Delhi-NCR,Jagran,Delhi-NCR • Jagran,https://www.jagran.com/delhi-ncr,55,CBSE की नई पहल: छात्रों के लिए AI व Python Programming जैसे 19 मुफ्त कोर्स शुरू; घर बैठे होगी इनकी ऑनलाइन पढ़ाई,https://www.jagran.com/uttar-pradesh/meerut-city-cbse-launches-19-free-online-courses-for-school-students-40291348.html,2026-07-01T12:43:09+00:00
Delhi-NCR,Jagran,Delhi-NCR • Jagran,https://www.jagran.com/delhi-ncr,56,आईएमएस-बीएचयू की शोधार्थी डाक्टर प्रिया देव को यूरोपीय संघ के प्रतिष्ठित साइलाइफलैब पल्स फेलोशिप से सम्मानित किया गया,https://www.jagran.com/uttar-pradesh/varanasi-city-dr-priya-dev-a-researcher-at-ims-bhu-has-been-awarded-the-prestigious-scilifelab-pulse-fellowship-by-the-european-union-40291360.html,2026-07-01T12:43:09+00:00
Delhi-NCR,Jagran,Delhi-NCR • Jagran,https://www.jagran.com/delhi-ncr,57,"सर्राफ ने गिरवी रखी पाजेब गलाकर रची लूट की झूठी कहानी, पुलिस जांच में उजागर हुई सच्चाई",https://www.jagran.com/uttar-pradesh/bagpat-bagpat-jeweler-fakes-robbery-melts-mortgaged-anklets-40291279.html,2026-07-01T12:43:09+00:00
Delhi-NCR,Jagran,Delhi-NCR • Jagran,https://www.jagran.com/delhi-ncr,58,"हाथरस: ससुराल में गोली मारकर पति ने की आत्महत्या, पत्नी के घ",https://www.jagran.com/uttar-pradesh/hathras-distraught-over-wife-leaving-home-husband-shoots-himself-dead-at-in-laws-house-hathras-crime-news-40290939.html,2026-07-01T12:43:09+00:00
Delhi-NCR,Jagran,Delhi-NCR • Jagran,https://www.jagran.com/delhi-ncr,59,"कानपुर में महिला को डराकर जेवर लूटने वालों का एनकाउंटर, दो ब",https://www.jagran.com/uttar-pradesh/kanpur-city-kanpur-police-encounter-3-robbers-arrested-after-shootout-40290948.html,2026-07-01T12:43:09+00:00
Delhi-NCR,Jagran,Delhi-NCR • Jagran,https://www.jagran.com/delhi-ncr,60,श्रीराम जन्मभूमि तीर्थ क्षेत्र ट्रस्ट के अध्यक्ष महंत नृत्य,https://www.jagran.com/uttar-pradesh/lucknow-city-chairman-of-the-ram-mandir-trust-mahant-nritya-gopal-das-maharaj-has-been-admitted-to-medanta-hospital-after-his-health-deteriorated-40290945.html,2026-07-01T12:43:09+00:00
Delhi-NCR,Jagran,Delhi-NCR • Jagran,https://www.jagran.com/delhi-ncr,61,"Govinda के एक्स्ट्रा मैरिटल अफेयर पर बोलीं सुनीता आहूजा, कहा",https://www.jagran.com/entertainment/bollywood-sunita-ahuja-reacts-to-govinda-extra-marital-affair-in-lock-upp-says-you-cant-stop-anyone-40290932.html,2026-07-01T12:43:09+00:00
Delhi-NCR,Jagran,Delhi-NCR • Jagran,https://www.jagran.com/delhi-ncr,62,"मुजफ्फरपुर में एएसआइ 8 हजार रुपये घूस लेते गिरफ्तार, निगरानी",https://www.jagran.com/bihar/muzaffarpur-rajepur-asi-munna-yadav-caught-taking-bribe-by-vigilance-hindi-news-today-40290943.html,2026-07-01T12:43:09+00:00
Delhi-NCR,Jagran,Delhi-NCR • Jagran,https://www.jagran.com/delhi-ncr,63,महराजगंज में द्वार पूजा के बाद ट्रांसफार्मर की चपेट में आने,https://www.jagran.com/uttar-pradesh/maharajganj-maharajganj-wedding-tragedy-2-horses-electrocuted-owner-injured-40290941.html,2026-07-01T12:43:09+00:00
Delhi-NCR,Jagran,Delhi-NCR • Jagran,https://www.jagran.com/delhi-ncr,64,"फूड प्रोसेसिंग क्षेत्र को मिलेगी नई रफ्तार, सितंबर में चंडीग",https://www.jagran.com/punjab/chandigarh-food-processing-sector-set-for-a-boost-union-minister-chirag-paswan-to-visit-chandigarh-in-september-40290938.html,2026-07-01T12:43:09+00:00
Delhi-NCR,Jagran,Delhi-NCR • Jagran,https://www.jagran.com/delhi-ncr,65,"कर्नाटक: मंगलुरु में भारी बारिश बनी काल, मकान पर दीवार गिरने",https://www.jagran.com/news/national-mangaluru-wall-collapse-kills-3-including-2-children-news-in-hindi-40290935.html,2026-07-01T12:43:09+00:00
Delhi-NCR,Jagran,Delhi-NCR • Jagran,https://www.jagran.com/delhi-ncr,66,क्या हनुमान जी आज भी जीवित हैं? जानें पुराणों के अनुसार अंजन,https://www.jagran.com/spiritual/religion-is-lord-hanuman-still-alive-mystery-of-immortality-according-to-puranas-40290916.html,2026-07-01T12:43:09+00:00
Delhi-NCR,Jagran,Delhi-NCR • Jagran,https://www.jagran.com/delhi-ncr,67,"दलहन और मिलेट्स समेत चार योजनाओं को मंजूरी, कानपुर में एग्री",https://www.jagran.com/uttar-pradesh/kanpur-city-kanpur-agrijunction-centers-4-farm-schemes-approved-40290942.html,2026-07-01T12:43:09+00:00
Delhi-NCR,Jagran,Delhi-NCR • Jagran,https://www.jagran.com/delhi-ncr,68,Did You Know,https://www.jagran.com/did-you-know-news-hindi.html,2026-07-01T12:43:09+00:00
Delhi-NCR,Jagran,Delhi-NCR • Jagran,https://www.jagran.com/delhi-ncr,69,फुटबॉल विश्व कप,https://www.jagran.com/topics/fifa-world-cup-2026,2026-07-01T12:43:09+00:00
Delhi-NCR,Jagran,Delhi-NCR • Jagran,https://www.jagran.com/delhi-ncr,70,मिडिल ईस्ट संकट,https://www.jagran.com/topics/Israel-Iran-Conflict,2026-07-01T12:43:09+00:00
Delhi-NCR,Jagran,Delhi-NCR • Jagran,https://www.jagran.com/delhi-ncr,71,फीफा वर्ल्ड कप 2026,https://www.jagran.com/topics/FIFA-World-Cup-2026,2026-07-01T12:43:09+00:00
Delhi-NCR,Jagran,Delhi-NCR • Jagran,https://www.jagran.com/delhi-ncr,72,आज का राशिफल,https://www.jagran.com/topics/rashifal,2026-07-01T12:43:09+00:00
Delhi-NCR,Jagran,Delhi-NCR • Jagran,https://www.jagran.com/delhi-ncr,73,Submit your news,https://www.jagran.com/citizen-journalism-hindi.html,2026-07-01T12:43:09+00:00
Delhi-NCR,Jagran,Delhi-NCR • Jagran,https://www.jagran.com/delhi-ncr,74,Message from the Editor,https://www.jagran.com/policies-and-standards.html,2026-07-01T12:43:09+00:00
Hyderabad,DC,Hyderabad • DC,https://www.deccanchronicle.com/location/india/southern-states,1,FIFA World Cup 2026,https://www.deccanchronicle.com/fifa-world-cup-2026,2026-07-01T12:43:09+00:00
Hyderabad,DC,Hyderabad • DC,https://www.deccanchronicle.com/location/india/southern-states,2,Opinion and Editorials,https://www.deccanchronicle.com/opinion,2026-07-01T12:43:09+00:00
Hyderabad,DC,Hyderabad • DC,https://www.deccanchronicle.com/location/india/southern-states,3,Assembly Elections 2026,https://www.deccanchronicle.com/assembly-elections-2026,2026-07-01T12:43:09+00:00
Hyderabad,DC,Hyderabad • DC,https://www.deccanchronicle.com/location/india/southern-states,4,Telangana Rising 2047,https://www.deccanchronicle.com/tags/Telangana-Rising-2047,2026-07-01T12:43:09+00:00
Chennai,DC,Chennai • DC,https://www.deccanchronicle.com/location/india/tamil-nadu/chennai-madras,1,FIFA World Cup 2026,https://www.deccanchronicle.com/fifa-world-cup-2026,2026-07-01T12:43:09+00:00
Chennai,DC,Chennai • DC,https://www.deccanchronicle.com/location/india/tamil-nadu/chennai-madras,2,Opinion and Editorials,https://www.deccanchronicle.com/opinion,2026-07-01T12:43:09+00:00
Chennai,DC,Chennai • DC,https://www.deccanchronicle.com/location/india/tamil-nadu/chennai-madras,3,Assembly Elections 2026,https://www.deccanchronicle.com/assembly-elections-2026,2026-07-01T12:43:09+00:00
Chennai,DC,Chennai • DC,https://www.deccanchronicle.com/location/india/tamil-nadu/chennai-madras,4,Telangana Rising 2047,https://www.deccanchronicle.com/tags/Telangana-Rising-2047,2026-07-01T12:43:09+00:00
Chennai,The Hindu,Chennai • The Hindu,https://www.thehindu.com/news/cities/chennai/,1,19 women affected by ammonia gas leak still under treatment,https://www.thehindu.com/news/cities/chennai/19-women-affected-by-ammonia-gas-leak-still-under-treatment/article71166876.ece,2026-07-01T12:43:09+00:00
Chennai,The Hindu,Chennai • The Hindu,https://www.thehindu.com/news/cities/chennai/,2,Court convicts EMPEE’s Shaji Purushothaman in 2013 fatal drunk driving case,https://www.thehindu.com/news/national/tamil-nadu/court-convicts-empees-shaji-purushothaman-in-2013-fatal-drunk-driving-case/article71165960.ece,2026-07-01T12:43:09+00:00
Chennai,The Hindu,Chennai • The Hindu,https://www.thehindu.com/news/cities/chennai/,3,Rainfall to dip in T.N. over the next few days,https://www.thehindu.com/news/cities/chennai/rainfall-to-dip-in-tn-over-the-next-few-days/article71166290.ece,2026-07-01T12:43:09+00:00
Chennai,The Hindu,Chennai • The Hindu,https://www.thehindu.com/news/cities/chennai/,4,Darkhast land and the Church of Our Lady of Assumption in Chennai,https://www.thehindu.com/news/cities/chennai/darkhast-land-and-the-church-of-our-lady-of-assumption-in-chennai/article71169091.ece,2026-07-01T12:43:09+00:00
Chennai,The Hindu,Chennai • The Hindu,https://www.thehindu.com/news/cities/chennai/,5,Chennai police arrest three men for bid to bribe TVK MLA for vote during no-confidence motion against Speaker,https://www.thehindu.com/news/national/tamil-nadu/three-men-arrested-for-bid-to-bribe-tvk-mla-for-vote-during-no-confidence-motion-against-tn-assembly-speaker/article71169921.ece,2026-07-01T12:43:09+00:00
Chennai,The Hindu,Chennai • The Hindu,https://www.thehindu.com/news/cities/chennai/,6,SpiceJet suspends flight services from city airport,https://www.thehindu.com/news/national/tamil-nadu/spicejet-suspends-flight-services-from-city-airport/article71166179.ece,2026-07-01T12:43:09+00:00
Chennai,The Hindu,Chennai • The Hindu,https://www.thehindu.com/news/cities/chennai/,7,Kenyan woman arrested at Chennai airport for smuggling ₹15 crore cocaine by swallowing capsules,https://www.thehindu.com/news/national/tamil-nadu/kenyan-woman-arrested-at-chennai-airport-for-smuggling-15-crore-cocaine-by-swallowing-capsules/article71166220.ece,2026-07-01T12:43:09+00:00
Chennai,The Hindu,Chennai • The Hindu,https://www.thehindu.com/news/cities/chennai/,8,Madras High Court sets aside appointment of 17 personal assistants to its judges,https://www.thehindu.com/news/national/tamil-nadu/madras-high-court-sets-aside-appointment-of-17-personal-assistants-to-its-judges/article71169263.ece,2026-07-01T12:43:09+00:00
Chennai,The Hindu,Chennai • The Hindu,https://www.thehindu.com/news/cities/chennai/,9,"Through The Magnificent Life, artist Rajesh RV imagines a world of harmony and hope",https://www.thehindu.com/entertainment/art/through-the-magnificent-life-artist-rajesh-rv-imagines-a-world-of-harmony-and-hope/article71165127.ece,2026-07-01T12:43:09+00:00
Chennai,The Hindu,Chennai • The Hindu,https://www.thehindu.com/news/cities/chennai/,10,Why are more institutes switching to co-educational system?,https://www.thehindu.com/education/why-are-more-institutes-switching-to-co-educational-system/article71160920.ece,2026-07-01T12:43:09+00:00
Chennai,The Hindu,Chennai • The Hindu,https://www.thehindu.com/news/cities/chennai/,11,Advanced sewage sludge treatment can boost Chennai’s biogas production: study,https://www.thehindu.com/news/cities/chennai/anna-university-study-finds-advanced-sludge-treatment-can-boost-biogas-production-at-chennai-stps/article71162195.ece,2026-07-01T12:43:09+00:00
Chennai,The Hindu,Chennai • The Hindu,https://www.thehindu.com/news/cities/chennai/,12,Chennai residents seek revival of Fuse-Off Call centres for quick restoration of power supply,https://www.thehindu.com/news/cities/chennai/residents-seek-revival-of-foc-centres-for-quick-restoration-of-power-supply/article71161182.ece,2026-07-01T12:43:09+00:00
Chennai,The Hindu,Chennai • The Hindu,https://www.thehindu.com/news/cities/chennai/,13,An open pit with a shutoff valve ‘lies in wait’ for unsuspecting motorists in Ramapuram,https://www.thehindu.com/news/cities/chennai/an-open-pit-with-a-shutoff-valve-lies-in-wait-for-unsuspecting-motorists-in-ramapuram/article71160409.ece,2026-07-01T12:43:09+00:00
