city,publisher,source,source_url,rank,headline,link,collected_at_iso
Bhopal,IE,Bhopal • IE,https://indianexpress.com/section/cities/bhopal/,105,Statutory provisions on reporting (sexual offenses),https://indianexpress.com/article/what-is/what-is-the-protection-of-children-from-sexual-offences-act-2012/,2026-04-20T10:03:46+00:00
Pune,Pune Mirror,Pune • Pune Mirror,https://punemirror.com/,1,‘NHAI blamed for Pashan Lake disaster’,https://punemirror.com/city/pune/pashan-lake-fish-death-nhai-pmc-action/,2026-04-20T10:03:46+00:00
Pune,Pune Mirror,Pune • Pune Mirror,https://punemirror.com/,2,Insurance firm’s snub backfires,https://punemirror.com/city/pune/pune-consumer-court-car-insurance-claim-rain-damage/,2026-04-20T10:03:46+00:00
Pune,Pune Mirror,Pune • Pune Mirror,https://punemirror.com/,3,Enough is enough…,https://punemirror.com/city/pune/undri-mohammadwadi-water-protest-pune/,2026-04-20T10:03:46+00:00
Pune,Pune Mirror,Pune • Pune Mirror,https://punemirror.com/,4,"Parks in disrepair, corporator demands closure",https://punemirror.com/city/pcmc-parks-neglect-ward-21-safety-concerns/,2026-04-20T10:03:46+00:00
Pune,Pune Mirror,Pune • Pune Mirror,https://punemirror.com/,5,Pool contract faces opposition Social activist Maruti Bhapkar demands civic-run facility,https://punemirror.com/city/pcmc-swimming-pool-outsourcing-row-mohannagar/,2026-04-20T10:03:46+00:00
Pune,Pune Mirror,Pune • Pune Mirror,https://punemirror.com/,6,Crackdown on RMC plants,https://punemirror.com/city/pcmc-seals-rmc-plants-air-pollution-violations/,2026-04-20T10:03:46+00:00
Pune,Pune Mirror,Pune • Pune Mirror,https://punemirror.com/,7,Don’t fall for that fake advert bait,https://punemirror.com/city/pune-cyber-scam-fake-social-media-ads/,2026-04-20T10:03:46+00:00
Pune,Pune Mirror,Pune • Pune Mirror,https://punemirror.com/,8,ATS deadline now Oct 2026,https://punemirror.com/city/pune/ats-deadline-extended-2026-maharashtra-transporters/,2026-04-20T10:03:46+00:00
Pune,Pune Mirror,Pune • Pune Mirror,https://punemirror.com/,9,Smartphone Face ID security shock: alarming vulnerability exposed,https://punemirror.com/technology/smartphone-face-id-security-photo-risk/,2026-04-20T10:03:46+00:00
Pune,Pune Mirror,Pune • Pune Mirror,https://punemirror.com/,10,Anthropic AI Safety Fellowship: Exceptional High-Pay Chance for Young Researchers,https://punemirror.com/technology/ai/anthropic-ai-safety-fellowship-2026-stipend/,2026-04-20T10:03:46+00:00
Pune,Pune Mirror,Pune • Pune Mirror,https://punemirror.com/,11,ChatGPT reference photo feature sparks powerful privacy debate,https://punemirror.com/technology/ai/chatgpt-reference-photo-feature-android-beta/,2026-04-20T10:03:46+00:00
Pune,Pune Mirror,Pune • Pune Mirror,https://punemirror.com/,12,Samsung Galaxy S26 Ultra discount delivers incredible deal for buyers,https://punemirror.com/technology/samsung-galaxy-s26-ultra-discount-deal-india/,2026-04-20T10:03:46+00:00
Pune,Pune Mirror,Pune • Pune Mirror,https://punemirror.com/,13,"Heavy AI usage ‘quietly’ harms thinking, warns shocking study",https://punemirror.com/technology/ai/heavy-ai-usage-weakens-human-thinking/,2026-04-20T10:03:46+00:00
Pune,Pune Mirror,Pune • Pune Mirror,https://punemirror.com/,14,Motorola Edge 50 price cut delivers powerful mid-range boost on Flipkart,https://punemirror.com/technology/motorola-edge-50-price-cut-flipkart-deal/,2026-04-20T10:03:46+00:00
Pune,Pune Mirror,Pune • Pune Mirror,https://punemirror.com/,15,Man booked for assaulting wife,https://punemirror.com/city/kothrud-assault-flat-dispute-wife-injured/,2026-04-20T10:03:46+00:00
Pune,Pune Mirror,Pune • Pune Mirror,https://punemirror.com/,16,A ‘concrete’ clash,https://punemirror.com/city/pune-rmc-plants-closure-protest-pollution-row/,2026-04-20T10:03:46+00:00
Pune,Pune Mirror,Pune • Pune Mirror,https://punemirror.com/,17,Protest against river pollution,https://punemirror.com/city/pune/pavana-river-pollution-hunger-strike-pcmc/,2026-04-20T10:03:46+00:00
Pune,Pune Mirror,Pune • Pune Mirror,https://punemirror.com/,18,"Pune Sizzles at 41°C, Heatwave Disrupts Daily Life",https://punemirror.com/city/pune/pune-heatwave-temperature-41-degree-alert/,2026-04-20T10:03:46+00:00
Pune,Pune Mirror,Pune • Pune Mirror,https://punemirror.com/,19,Woman ends life over harassment,https://punemirror.com/city/pune/pune-woman-suicide-harassment-bibvewadi-case/,2026-04-20T10:03:46+00:00
Pune,Pune Mirror,Pune • Pune Mirror,https://punemirror.com/,20,Op ‘stop slow poison’ begins,https://punemirror.com/city/kharadi-water-contamination-pmc-action-sewage-crisis/,2026-04-20T10:03:46+00:00
Pune,Pune Mirror,Pune • Pune Mirror,https://punemirror.com/,21,Green push: Bicycles on rent soon,https://punemirror.com/city/pune/pcmc-bicycle-sharing-scheme-relaunch-pimple-saudagar/,2026-04-20T10:03:46+00:00
Pune,Pune Mirror,Pune • Pune Mirror,https://punemirror.com/,22,Shocking Chrome Vulnerabilities Demand Immediate Patch,https://punemirror.com/technology/urgent-chrome-vulnerabilities-patch-2026/,2026-04-20T10:03:46+00:00
Pune,Pune Mirror,Pune • Pune Mirror,https://punemirror.com/,23,Vivo X300 Ultra Zeiss extender kit delivers stunning pro-level zoom,https://punemirror.com/technology/vivo-x300-ultra-zeiss-extender-kit-india/,2026-04-20T10:03:46+00:00
Pune,Pune Mirror,Pune • Pune Mirror,https://punemirror.com/,24,Rs 70-cr revenue lost!,https://punemirror.com/city/pmc-hoarding-data-row-revenue-loss-pune/,2026-04-20T10:03:46+00:00
Pune,Pune Mirror,Pune • Pune Mirror,https://punemirror.com/,25,No change in egg trust’s name: HC,https://punemirror.com/city/no-change-in-egg-trusts-name-hc/,2026-04-20T10:03:46+00:00
Pune,Pune Mirror,Pune • Pune Mirror,https://punemirror.com/,26,7 RMC plants razed,https://punemirror.com/city/pune/pmc-demolition-rmc-plants-lohgaon-kharadi/,2026-04-20T10:03:46+00:00
Pune,Pune Mirror,Pune • Pune Mirror,https://punemirror.com/,27,15-year wait ends,https://punemirror.com/city/pune/pmc-water-pipeline-undri-mohammadwadi-nibm/,2026-04-20T10:03:46+00:00
Pune,Pune Mirror,Pune • Pune Mirror,https://punemirror.com/,28,City gasping for clean air,https://punemirror.com/city/pcmc/pimpri-chinchwad-air-pollution-health-crisis/,2026-04-20T10:03:46+00:00
Pune,Pune Mirror,Pune • Pune Mirror,https://punemirror.com/,29,Biomedical waste poses grave threat,https://punemirror.com/city/pcmc/pcmc-biomedical-waste-risk-chemist-warning/,2026-04-20T10:03:46+00:00
Pune,Pune Mirror,Pune • Pune Mirror,https://punemirror.com/,30,"PCMC Plans ₹243 Crore Road Repairs Across 306 km, Focus on Data-Driven Maintenance",https://punemirror.com/city/pcmc/pcmc-road-repair-plan-243-crore-gis-rams/,2026-04-20T10:03:46+00:00
Pune,Pune Mirror,Pune • Pune Mirror,https://punemirror.com/,31,Civic body stares at financial crisis,https://punemirror.com/city/pcmc/pcmc-metro-development-charges-liability/,2026-04-20T10:03:46+00:00
Pune,Pune Mirror,Pune • Pune Mirror,https://punemirror.com/,32,Dust-free Pimpri-Chinchwad campaign launched,https://punemirror.com/city/pcmc/pcmc-dust-free-pimpri-chinchwad-citizen-drive/,2026-04-20T10:03:46+00:00
Pune,Pune Mirror,Pune • Pune Mirror,https://punemirror.com/,33,Smart city row sparks heated debate,https://punemirror.com/city/pcmc/pcmc-house-uproar-sambhaji-maharaj-statue-smart-city-debate/,2026-04-20T10:03:46+00:00
Pune,Pune Mirror,Pune • Pune Mirror,https://punemirror.com/,34,Financial blow for PCMC,https://punemirror.com/city/pcmc/pcmc-arbitration-liability-pavana-pipeline-nashik-phata-flyover/,2026-04-20T10:03:46+00:00
Pune,Pune Mirror,Pune • Pune Mirror,https://punemirror.com/,35,Kerosene Distribution begins in 21 States,https://punemirror.com/india/kerosene-distribution-21-states-fuel-policy/,2026-04-20T10:03:46+00:00
Pune,Pune Mirror,Pune • Pune Mirror,https://punemirror.com/,36,RUPEE IN FREEFALL: India’s Currency Hits All-Time Low,https://punemirror.com/news/rupee-all-time-low-iran-war-india-economy/,2026-04-20T10:03:46+00:00
Pune,Pune Mirror,Pune • Pune Mirror,https://punemirror.com/,37,Central Railway to Run Summer Special Trains From Pune to Meet Holiday Rush,https://punemirror.com/india/central-railways/central-railway-summer-special-trains-pune-2026/,2026-04-20T10:03:46+00:00
Pune,Pune Mirror,Pune • Pune Mirror,https://punemirror.com/,38,"Central Railway Cracks Down on Ticketless Travel, Collects ₹227 Crore in Penalties",https://punemirror.com/india/central-railways/central-railway-ticketless-travel-drive-227-crore-penalty/,2026-04-20T10:03:46+00:00
Pune,Pune Mirror,Pune • Pune Mirror,https://punemirror.com/,39,Central Railway’s Crackdown Nets Rs 251.91 Crore from Ticketless Travel,https://punemirror.com/city/pune/central-railway-ticketless-travel-penalty-record-fy2025-26/,2026-04-20T10:03:46+00:00
Pune,Pune Mirror,Pune • Pune Mirror,https://punemirror.com/,40,Central Railway Ticket Checking Staff Set Remarkable Revenue Milestone in FY 2025–26,https://punemirror.com/city/pune/central-railway-ticket-checking-crorepati-staff/,2026-04-20T10:03:46+00:00
Pune,Pune Mirror,Pune • Pune Mirror,https://punemirror.com/,41,Strengthening Passenger Amenities and Crowd Management Across Indian Railways,https://punemirror.com/news/indian-railways-34000-crore-passenger-safety-infrastructure/,2026-04-20T10:03:46+00:00
Pune,Pune Mirror,Pune • Pune Mirror,https://punemirror.com/,42,"Central Railway Posts Strong FY26 Performance with New Trains, Revenue Growth",https://punemirror.com/india/central-railways/central-railway-fy26-performance-revenue-trains-india/,2026-04-20T10:03:46+00:00
Pune,Pune Mirror,Pune • Pune Mirror,https://punemirror.com/,43,Markets test investors,https://punemirror.com/business/markets/sensex-fall-sip-investor-strategy-market-correction/,2026-04-20T10:03:46+00:00
Pune,Pune Mirror,Pune • Pune Mirror,https://punemirror.com/,44,"India smartphone shipments Q1 2026 slump rocks market, fuels dramatic brand shake-up",https://punemirror.com/business/india-smartphone-shipments-q1-2026-slump/,2026-04-20T10:03:46+00:00
Pune,Pune Mirror,Pune • Pune Mirror,https://punemirror.com/,45,Amazon AI Store delivers powerful boost to smart shopping,https://punemirror.com/business/amazon-ai-store-india-smart-shopping/,2026-04-20T10:03:46+00:00
Pune,Pune Mirror,Pune • Pune Mirror,https://punemirror.com/,46,Apple India vendors exports deliver stunning record boost to China trade,https://punemirror.com/business/apple-india-vendors-exports-record-china-ecms/,2026-04-20T10:03:46+00:00
Pune,Pune Mirror,Pune • Pune Mirror,https://punemirror.com/,47,‘Madman theory’ boomerangs,https://punemirror.com/world/trump-madman-theory-global-tensions-iran-policy/,2026-04-20T10:03:46+00:00
Pune,Pune Mirror,Pune • Pune Mirror,https://punemirror.com/,48,"US Expands Visa Screening, Starting March 30",https://punemirror.com/news/us-visa-social-media-screening-new-rules/,2026-04-20T10:03:46+00:00
Pune,Pune Mirror,Pune • Pune Mirror,https://punemirror.com/,49,"GHOST JETS, REAL THREAT: China Deploys 200+ Fighter Drones Near Taiwan Strait",https://punemirror.com/world/china/china-fighter-drones-taiwan-strait/,2026-04-20T10:03:46+00:00
Pune,Pune Mirror,Pune • Pune Mirror,https://punemirror.com/,50,The narrative of destruction,https://punemirror.com/world/us-iran-war-gulf-escalation-analysis/,2026-04-20T10:03:46+00:00
Pune,Pune Mirror,Pune • Pune Mirror,https://punemirror.com/,51,VinFast VF MPV 7: Premium Electric Seven-Seater Launched at Rs 24.49 Lakh,https://punemirror.com/automobile/vinfast-vf-mpv-7-premium-electric-seven-seater-launched-at-rs-24-49-lakh/,2026-04-20T10:03:46+00:00
Pune,Pune Mirror,Pune • Pune Mirror,https://punemirror.com/,52,Kinetic DX+ Review,https://punemirror.com/automobile/kinetic-dx-review/,2026-04-20T10:03:46+00:00
Pune,Pune Mirror,Pune • Pune Mirror,https://punemirror.com/,53,Volkswagen Launches New Taigun with 8-Speed Automatic,https://punemirror.com/automobile/volkswagen-launches-new-taigun-with-8-speed-automatic/,2026-04-20T10:03:46+00:00
Pune,Pune Mirror,Pune • Pune Mirror,https://punemirror.com/,54,Tata Sierra Electric stunning boost: powerful new EV SUV due FY27,https://punemirror.com/automobile/tata-sierra-electric-launch-fy27/,2026-04-20T10:03:46+00:00
Pune,Pune Mirror,Pune • Pune Mirror,https://punemirror.com/,55,Getting migraine? Check pollution levels,https://punemirror.com/health/health-care/air-pollution-migraine-trigger-study/,2026-04-20T10:03:46+00:00
Pune,Pune Mirror,Pune • Pune Mirror,https://punemirror.com/,56,AI for Alzheimer’s: Powerful New OpenAI Funding Offers Real Hope,https://punemirror.com/health/ai-for-alzheimers-openai-100m-research-push/,2026-04-20T10:03:46+00:00
Pune,Pune Mirror,Pune • Pune Mirror,https://punemirror.com/,57,Strong glutes for longevity: powerful secret to healthy ageing,https://punemirror.com/health/strong-glutes-for-longevity-benefits/,2026-04-20T10:03:46+00:00
Pune,Pune Mirror,Pune • Pune Mirror,https://punemirror.com/,58,Brain health powerful boost: 10 simple daily habits,https://punemirror.com/health/brain-health-simple-daily-habits-guide/,2026-04-20T10:03:46+00:00
Pune,Pune Mirror,Pune • Pune Mirror,https://punemirror.com/,59,RCB Beat MI By 18 Runs In High-Scoring Thriller At Wankhede,https://punemirror.com/sports/cricket/rcb-beat-mi-18-runs/,2026-04-20T10:03:46+00:00
Pune,Pune Mirror,Pune • Pune Mirror,https://punemirror.com/,60,Mukul Choudhary Stars as LSG Beat KKR in Last-Ball IPL,https://punemirror.com/sports/mukul-choudhary-lsg-vs-kkr-last-ball-win-ipl-202/,2026-04-20T10:03:46+00:00
Pune,Pune Mirror,Pune • Pune Mirror,https://punemirror.com/,61,Last-Ball Chaos: Gujarat Titans Snatch 1-Run Victory,https://punemirror.com/sports/cricket/gt-vs-dc-last-ball-thriller-miller-decision-ipl-2026/,2026-04-20T10:03:46+00:00
Pune,Pune Mirror,Pune • Pune Mirror,https://punemirror.com/,62,JAISWAL AND SOORYAVANSHI POWER RR TO A PERFECT THREE FROM THREE,https://punemirror.com/sports/rr-vs-mi-sooryavanshi-bumrah-ipl-2026/,2026-04-20T10:03:46+00:00
Pune,Pune Mirror,Pune • Pune Mirror,https://punemirror.com/,63,The Device on Deepinder Goyal’s Temple That Stole the Spotlight — and Why the Internet Is Split,https://punemirror.com/trending/deepinder-goyal-temple-device-podcast-viral/,2026-04-20T10:03:46+00:00
Pune,Pune Mirror,Pune • Pune Mirror,https://punemirror.com/,64,The Hyper-Speed Era: Why Everything Is a ‘Trend’ and Nothing Lasts,https://punemirror.com/trending/why-everything-is-a-trend-and-nothing-lasts/,2026-04-20T10:03:46+00:00
Pune,Pune Mirror,Pune • Pune Mirror,https://punemirror.com/,65,Amazon Black Friday OnePlus Deals 2025: Massive Savings on Flagship Phones,https://punemirror.com/technology/amazon-black-friday-oneplus-deals-2025/,2026-04-20T10:03:46+00:00
Pune,Pune Mirror,Pune • Pune Mirror,https://punemirror.com/,66,Nobel Prize 2025: Discovery of Regulatory T-Cells and FOXP3 Gene Wins Medicine Award,https://punemirror.com/news/nobel-prize-2025-discovery-of-regulatory-t-cells-and-foxp3-gene-wins-medicine-award/,2026-04-20T10:03:46+00:00
Pune,Pune Mirror,Pune • Pune Mirror,https://punemirror.com/,67,Pahalgam terrorist gunned down; Three killed in J-K encounter,https://punemirror.com/trending/pahalgam-terrorist-gunned-down-three-killed-in-j-k-encounter/,2026-04-20T10:03:46+00:00
Pune,Pune Mirror,Pune • Pune Mirror,https://punemirror.com/,68,Startup India Fund of Funds 2.0: Powerful Boost for Startups,https://punemirror.com/india/startup-india-fund-of-funds-2-0-boost/,2026-04-20T10:03:46+00:00
Pune,Pune Mirror,Pune • Pune Mirror,https://punemirror.com/,69,Sarvam AI Bulbul V3 delivers stunning win over global AI rivals,https://punemirror.com/technology/ai/sarvam-ai-bulbul-v3-outshines-rivals/,2026-04-20T10:03:46+00:00
Pune,Pune Mirror,Pune • Pune Mirror,https://punemirror.com/,70,The Startup Evolution: From Survival Mode to Sustainable Success,https://punemirror.com/business/startups/from-survival-mode-to-sustainable-success/,2026-04-20T10:03:46+00:00
Pune,Pune Mirror,Pune • Pune Mirror,https://punemirror.com/,71,6 Summer Drinks To Beat The Heat,https://punemirror.com/lifestyle/traditional-indian-summer-drinks-heat-relief/,2026-04-20T10:03:46+00:00
Pune,Pune Mirror,Pune • Pune Mirror,https://punemirror.com/,72,AI-powered predictive sleep delivers powerful boost for Eight Sleep,https://punemirror.com/lifestyle/ai-powered-predictive-sleep-funding-boost/,2026-04-20T10:03:46+00:00
Pune,Pune Mirror,Pune • Pune Mirror,https://punemirror.com/,73,Heavy social media use among teenagers sparks alarming global warning,https://punemirror.com/lifestyle/heavy-social-media-use-among-teenagers/,2026-04-20T10:03:46+00:00
Pune,Pune Mirror,Pune • Pune Mirror,https://punemirror.com/,74,📅 When is Holi in 2026?,https://punemirror.com/lifestyle/holi-2026-date-significance-holika-dahan-celebrations/,2026-04-20T10:03:46+00:00
Pune,Pune Mirror,Pune • Pune Mirror,https://punemirror.com/,75,"Early Signs of High Blood Pressure and Diabetes: Symptoms, Prevention and Care",https://punemirror.com/health/health-care/early-signs-high-blood-pressure-diabetes-prevention-care/,2026-04-20T10:03:46+00:00
Pune,Pune Mirror,Pune • Pune Mirror,https://punemirror.com/,76,OpenAI Hiro Finance acquisition marks powerful new AI fintech shift,https://punemirror.com/business/openai-hiro-finance-acquisition-ai-fintech/,2026-04-20T10:03:46+00:00
Pune,Pune Mirror,Pune • Pune Mirror,https://punemirror.com/,77,bob World Lite app sparks powerful digital banking boost for Jio users,https://punemirror.com/business/bob-world-lite-app-jio-feature-phones-india/,2026-04-20T10:03:46+00:00
Pune,Pune Mirror,Pune • Pune Mirror,https://punemirror.com/,78,RBI 1-hour delay on digital payments sparks major security shift,https://punemirror.com/business/finance/rbi-1-hour-delay-on-digital-payments/,2026-04-20T10:03:46+00:00
Pune,Pune Mirror,Pune • Pune Mirror,https://punemirror.com/,79,Axis Bank Aadhaar face authentication delivers powerful new convenience,https://punemirror.com/business/axis-bank-aadhaar-face-authentication-update/,2026-04-20T10:03:46+00:00
Pune,Pune Mirror,Pune • Pune Mirror,https://punemirror.com/,80,Bitcoin price consolidation powers cautious but resilient rally,https://punemirror.com/business/bitcoin-price-consolidation-67000-outlook/,2026-04-20T10:03:46+00:00
Pune,Pune Mirror,Pune • Pune Mirror,https://punemirror.com/,81,₹2.45 Crore Oil Trading Fraud Uncovered in Pune; Two Accused Booked Again,https://punemirror.com/city/crime/pune-oil-trading-fraud-baner-painter-death-tathawade/,2026-04-20T10:03:46+00:00
Pune,Pune Mirror,Pune • Pune Mirror,https://punemirror.com/,82,"Pune Rural Police Seize Rs.2 Crore Mephedrone in Shirur, Arrest Garage Owner",https://punemirror.com/city/pune-shirur-garage-owner-mephedrone-police-links/,2026-04-20T10:03:46+00:00
Pune,Pune Mirror,Pune • Pune Mirror,https://punemirror.com/,83,Online gaming losses theft fuels shocking Pune tyre robbery,https://punemirror.com/city/crime/online-gaming-losses-theft-pune-tyre-robbery/,2026-04-20T10:03:46+00:00
Pune,Pune Mirror,Pune • Pune Mirror,https://punemirror.com/,84,Pune stepbrother car torching case: shocking family feud rocks Thergaon​,https://punemirror.com/city/pune/pune-stepbrother-car-torching-case/,2026-04-20T10:03:46+00:00
Pune,Pune Mirror,Pune • Pune Mirror,https://punemirror.com/,85,Pune doctor abduction: shocking highway gang extortion terrorises Pune,https://punemirror.com/city/crime/pune-doctor-abduction-19-lakh-extortion/,2026-04-20T10:03:46+00:00
Pune,Pune Mirror,Pune • Pune Mirror,https://punemirror.com/,86,"Pune Land Scam: Rs 2.4 Crore Fraud Case Filed Against Retired ACP, Four Others",https://punemirror.com/city/pune/pune-land-scam-retired-acp-fraud-case/,2026-04-20T10:03:46+00:00
Pune,Pune Mirror,Pune • Pune Mirror,https://punemirror.com/,87,"Hinjawadi Traffic Alert: One Lane Open on Wipro–MIDC Road, Week-Long Congestion Expected",https://punemirror.com/city/pune/hinjawadi-traffic-alert-wipro-midc-road-one-lane/,2026-04-20T10:03:46+00:00
Pune,Pune Mirror,Pune • Pune Mirror,https://punemirror.com/,88,Apne Paraye OTT release delivers gripping new thriller drama,https://punemirror.com/entertainment/apne-paraye-ott-release-thriller-drama/,2026-04-20T10:03:46+00:00
Pune,Pune Mirror,Pune • Pune Mirror,https://punemirror.com/,89,Ustaad Bhagat Singh OTT release: powerful yet troubled Netflix debut,https://punemirror.com/entertainment/ustaad-bhagat-singh-ott-release-netflix/,2026-04-20T10:03:46+00:00
Pune,Pune Mirror,Pune • Pune Mirror,https://punemirror.com/,90,Battleground Season 2 fitness reality show delivers powerful comeback on OTT,https://punemirror.com/entertainment/battleground-season-2-fitness-reality-show/,2026-04-20T10:03:46+00:00
Pune,Pune Mirror,Pune • Pune Mirror,https://punemirror.com/,91,Mind-reading beanie delivers stunning breakthrough in brain tech,https://punemirror.com/technology/mind-reading-beanie-noninvasive-bci/,2026-04-20T10:03:46+00:00
Pune,Pune Mirror,Pune • Pune Mirror,https://punemirror.com/,92,GPT-Rosalind life sciences breakthrough: powerful new OpenAI model,https://punemirror.com/technology/openai/gpt-rosalind-life-sciences-ai-model/,2026-04-20T10:03:46+00:00
Pune,Pune Mirror,Pune • Pune Mirror,https://punemirror.com/,93,All we need is CHANGE,https://punemirror.com/city/pune/pune-womens-safety-cell-mission-police-coordination/,2026-04-20T10:03:46+00:00
Pune,Pune Mirror,Pune • Pune Mirror,https://punemirror.com/,94,Citizens Launch Weekend Art and Music Protest to Save Ganeshkhind Road Trees,https://punemirror.com/city/ganeshkhind-road-tree-protest-art-music-pune/,2026-04-20T10:03:46+00:00
Pune,Pune Mirror,Pune • Pune Mirror,https://punemirror.com/,95,Objection Raised Over PPP Road Works via ‘Credit Notes’; Demand for FIR,https://punemirror.com/city/pune/pmc-ppp-road-credit-note-irregularities-fir-demand/,2026-04-20T10:03:46+00:00
Pune,Pune Mirror,Pune • Pune Mirror,https://punemirror.com/,96,Nigdi–Chakan Metro Corridor Added to Revised DPR in Pune,https://punemirror.com/city/pune/pune-metro/nigdi-chakan-metro-corridor-dpr-pimpri-chinchwad/,2026-04-20T10:03:46+00:00
Pune,Pune Mirror,Pune • Pune Mirror,https://punemirror.com/,97,Gultekdi Demolition Row: Slum Residents Allege Action Despite Pending Case,https://punemirror.com/city/pune/gultekdi-demolition-row-pune-dias-plot-sra/,2026-04-20T10:03:46+00:00
Pune,Pune Mirror,Pune • Pune Mirror,https://punemirror.com/,98,Traffic Curbs Around Dagdusheth Temple for Akshaya Tritiya Mango Festival in Pune,https://punemirror.com/city/pune/pune-traffic-diversions-akshaya-tritiya-dagdusheth-temple/,2026-04-20T10:03:46+00:00
Pune,Pune Mirror,Pune • Pune Mirror,https://punemirror.com/,99,Pune Flight Operations Hit by Major Disruptions,https://punemirror.com/city/pune/pune-airport-flight-diversions-cancellations-breakdown/,2026-04-20T10:03:46+00:00
Pune,Pune Mirror,Pune • Pune Mirror,https://punemirror.com/,100,"Fighter Aircraft Glitch Disrupts Pune Airport, Dozens of Flights Cancelled and Diverted",https://punemirror.com/city/pune/pune-airport-runway-blocked-fighter-jet-flight-disruption/,2026-04-20T10:03:46+00:00
Pune,Pune Mirror,Pune • Pune Mirror,https://punemirror.com/,101,"Piece by Piece LEGO documentary: inspiring, unforgettable triumph on Netflix",https://punemirror.com/entertainment/piece-by-piece-lego-documentary-netflix/,2026-04-20T10:03:46+00:00
Pune,Pune Mirror,Pune • Pune Mirror,https://punemirror.com/,102,Ala Chere Seetha Ramuni Chentaku Powerful Streaming Debut on ETV Win,https://punemirror.com/entertainment/ala-chere-seetha-ramuni-chentaku-etv-win/,2026-04-20T10:03:46+00:00
Pune,Pune Mirror,Pune • Pune Mirror,https://punemirror.com/,103,"Pochamma OTT release delivers chilling, powerful new Aha thriller",https://punemirror.com/entertainment/pochamma-ott-release-aha-thriller-series/,2026-04-20T10:03:46+00:00
Pune,Pune Mirror,Pune • Pune Mirror,https://punemirror.com/,104,"PS6 graphics leak promises stunning, game‑changing leap",https://punemirror.com/entertainment/ps6-graphics-leak-10x-ray-tracing-ai-boost/,2026-04-20T10:03:46+00:00
Pune,Pune Mirror,Pune • Pune Mirror,https://punemirror.com/,105,Sonia Gandhi’s Condolence Note For Asha Bhosle Addressed To Deceased Son Draws Sharp Criticism,https://punemirror.com/entertainment/sonia-gandhi-asha-bhosle-condolence-controversy/,2026-04-20T10:03:46+00:00
Pune,Pune Mirror,Pune • Pune Mirror,https://punemirror.com/,106,Balls Up OTT release: outrageously fun action-comedy now streaming,https://punemirror.com/entertainment/balls-up-ott-release-prime-video/,2026-04-20T10:03:46+00:00
Pune,Pune Mirror,Pune • Pune Mirror,https://punemirror.com/,107,Fake Profile Season 3 shockingly raises the stakes on Netflix,https://punemirror.com/entertainment/fake-profile-season-3-netflix-thriller-release/,2026-04-20T10:03:46+00:00
Pune,Pune Mirror,Pune • Pune Mirror,https://punemirror.com/,108,Million Dollar Secrets Season 2 triumphant shocker storms Netflix,https://punemirror.com/entertainment/million-dollar-secrets-season-2-netflix/,2026-04-20T10:03:46+00:00
Pune,IE,Pune • IE,https://indianexpress.com/article/cities/pune/,1,Puzzles & Games,https://indianexpress.com/puzzles-and-games/,2026-04-20T10:03:46+00:00
Pune,IE,Pune • IE,https://indianexpress.com/article/cities/pune/,2,PM Modi’s pointed attack on Opposition after Women’s Bill defeat: 6 points,https://indianexpress.com/article/india/m-modis-pointed-attack-on-opposition-after-womens-bill-defeat-6-points-10644061/,2026-04-20T10:03:46+00:00
Pune,IE,Pune • IE,https://indianexpress.com/article/cities/pune/,3,"Snoring ok, cuddling not: Air New Zealand upgrades ‘economy’ flying with riders",https://indianexpress.com/article/world/air-new-zealand-skynest-economy-sleeping-pods-price-rules-10644044/,2026-04-20T10:03:46+00:00
