city,publisher,source,source_url,rank,headline,link,collected_at_iso
Delhi-NCR,IE,Delhi-NCR • IE,https://indianexpress.com/section/cities/delhi/,59,Davanagere Weather Today,https://indianexpress.com/section/weather/davanagere-weather-forecast-today/,2026-07-05T21:08:32+00:00
Delhi-NCR,IE,Delhi-NCR • IE,https://indianexpress.com/section/cities/delhi/,60,Metpally Weather Today,https://indianexpress.com/section/weather/metpally-weather-forecast-today/,2026-07-05T21:08:32+00:00
Delhi-NCR,IE,Delhi-NCR • IE,https://indianexpress.com/section/cities/delhi/,61,Dharmshala Weather Today,https://indianexpress.com/section/weather/dharamshala-weather-forecast-today/,2026-07-05T21:08:32+00:00
Delhi-NCR,IE,Delhi-NCR • IE,https://indianexpress.com/section/cities/delhi/,62,Srinagar Weather Today,https://indianexpress.com/section/weather/srinagar-weather-forecast-today/,2026-07-05T21:08:32+00:00
Delhi-NCR,IE,Delhi-NCR • IE,https://indianexpress.com/section/cities/delhi/,63,Tumkur Weather Today,https://indianexpress.com/section/weather/tumkur-weather-forecast-today/,2026-07-05T21:08:32+00:00
Delhi-NCR,IE,Delhi-NCR • IE,https://indianexpress.com/section/cities/delhi/,64,Balangir Weather Today,https://indianexpress.com/section/weather/balangir-weather-forecast-today/,2026-07-05T21:08:32+00:00
Delhi-NCR,IE,Delhi-NCR • IE,https://indianexpress.com/section/cities/delhi/,65,Greater Noida Weather Today,https://indianexpress.com/section/weather/greater-noida-weather-forecast-today/,2026-07-05T21:08:32+00:00
Delhi-NCR,IE,Delhi-NCR • IE,https://indianexpress.com/section/cities/delhi/,66,Kalaburagi Weather Today,https://indianexpress.com/section/weather/kalaburagi-weather-forecast-today/,2026-07-05T21:08:32+00:00
Delhi-NCR,IE,Delhi-NCR • IE,https://indianexpress.com/section/cities/delhi/,67,Mahesena Weather Today,https://indianexpress.com/section/weather/mahesana-weather-forecast-today/,2026-07-05T21:08:32+00:00
Delhi-NCR,IE,Delhi-NCR • IE,https://indianexpress.com/section/cities/delhi/,68,Hospet Weather Today,https://indianexpress.com/section/weather/hospet-weather-forecast-today/,2026-07-05T21:08:32+00:00
Delhi-NCR,IE,Delhi-NCR • IE,https://indianexpress.com/section/cities/delhi/,69,Chhatrapati Sambhajinagar Weather,https://indianexpress.com/section/weather/chhatrapati-sambhajinagar-weather-forecast-today/,2026-07-05T21:08:32+00:00
Delhi-NCR,IE,Delhi-NCR • IE,https://indianexpress.com/section/cities/delhi/,70,IND vs ENG Scorecard,https://indianexpress.com/section/sports/cricket/live-score/england-vs-india-2nd-t20-live-score-full-scorecard-highlights-india-in-england-5-t20i-series-2026-enin07042026264912/,2026-07-05T21:08:32+00:00
Delhi-NCR,IE,Delhi-NCR • IE,https://indianexpress.com/section/cities/delhi/,71,IND vs ENG Score,https://indianexpress.com/article/sports/cricket/ind-vs-eng-live-score-india-vs-england-2nd-t20i-cricket-match-today-shreyas-iyer-harry-brook-manchester-10771272/,2026-07-05T21:08:32+00:00
Delhi-NCR,IE,Delhi-NCR • IE,https://indianexpress.com/section/cities/delhi/,72,"Video: Mexico fans blast horns, set off fireworks outside England’s hotel before World Cup clash",https://indianexpress.com/article/world/fifa-world-cup-mexico-fans-disrupt-england-hotel-sleep-tuchel-azteca-10772902/,2026-07-05T21:08:32+00:00
Delhi-NCR,IE,Delhi-NCR • IE,https://indianexpress.com/section/cities/delhi/,73,Australia clinch 7th Women’s T20 World Cup with 7-wicket thrashing of England,https://indianexpress.com/article/sports/cricket/australia-win-their-7th-womens-t20-world-cup-with-7-wicket-win-over-england-10772813/,2026-07-05T21:08:32+00:00
Delhi-NCR,IE,Delhi-NCR • IE,https://indianexpress.com/section/cities/delhi/,74,What was Cape Verde’s welcome like?,https://indianexpress.com/article/sports/football/what-was-cape-verde-welcome-like-fifa-world-cup-10772887/,2026-07-05T21:08:32+00:00
Delhi-NCR,IE,Delhi-NCR • IE,https://indianexpress.com/section/cities/delhi/,75,Kajol reflects on her strict childhood: ‘Couldn’t digest food until I was beaten up’,https://indianexpress.com/article/lifestyle/kajol-reflects-on-her-strict-childhood-parenting-10624986/,2026-07-05T21:08:32+00:00
Delhi-NCR,IE,Delhi-NCR • IE,https://indianexpress.com/section/cities/delhi/,76,"Brazil vs Norway Score, FIFA World Cup 2026 Live: Nyland saves a penalty, BRA 0-0 NOR after 40 mins",https://indianexpress.com/article/sports/football/brazil-vs-norway-fifa-world-cup-2026-live-score-round-of-16-vinicius-haaland-live-updates-10772738/,2026-07-05T21:08:32+00:00
Delhi-NCR,IE,Delhi-NCR • IE,https://indianexpress.com/section/cities/delhi/,77,Court quashes woman’s petition against police after son died in custody,https://indianexpress.com/article/legal-news/bombay-high-court-minor-custody-death-kurla-rpf-dongri-compensation-10772862/,2026-07-05T21:08:32+00:00
Delhi-NCR,IE,Delhi-NCR • IE,https://indianexpress.com/section/cities/delhi/,78,‘Might play in the 2027 World Cup’: Ex-wonderkid’s prediction on Sooryavanshi,https://indianexpress.com/article/sports/cricket/vaibhav-sooryavanshi-world-cup-india-laxman-sivaramakrishnan-10772846/,2026-07-05T21:08:32+00:00
Delhi-NCR,IE,Delhi-NCR • IE,https://indianexpress.com/section/cities/delhi/,79,‘Could’ve easily batted at 3’: Manjrekar on Sanju being replaced by Sooryavanshi,https://indianexpress.com/article/sports/cricket/sanjay-manjrekar-sanju-samson-3-vaibhav-sooryavanshi-ind-vs-eng-10772847/,2026-07-05T21:08:32+00:00
Delhi-NCR,IE,Delhi-NCR • IE,https://indianexpress.com/section/cities/delhi/,80,"Road caves in near Pune, admin calls it part of planned testing",https://indianexpress.com/article/cities/pune/talegaon-road-cave-in-viral-video-municipal-council-water-pipeline-testing-reality-10772849/,2026-07-05T21:08:32+00:00
Delhi-NCR,IE,Delhi-NCR • IE,https://indianexpress.com/section/cities/delhi/,81,Gujarat to have region specific anti-snake venom in a year,https://indianexpress.com/article/cities/ahmedabad/gujarat-to-have-region-specific-anti-snake-venom-in-a-year-10772857/,2026-07-05T21:08:32+00:00
Delhi-NCR,IE,Delhi-NCR • IE,https://indianexpress.com/section/cities/delhi/,82,"Rains triggers fence collapse, 18 vehicles damaged in Pune",https://indianexpress.com/article/cities/pune/rain-fence-collapse-vehicles-damaged-pune-10772832/,2026-07-05T21:08:32+00:00
Delhi-NCR,IE,Delhi-NCR • IE,https://indianexpress.com/section/cities/delhi/,83,Mandatory procedures not followed: Court grants Kenyan woman bail in drug smuggling case,https://indianexpress.com/article/legal-news/bombay-hc-bail-kenyan-national-mwanje-faridah-mumbai-airport-cocaine-ndps-section-50-10772843/,2026-07-05T21:08:32+00:00
Delhi-NCR,IE,Delhi-NCR • IE,https://indianexpress.com/section/cities/delhi/,84,Crackdown against sand mafia: Birbhum Police arrests 32 in two weeks,https://indianexpress.com/article/cities/kolkata/birbhum-sand-mafia-crackdown-32-arrests-two-weeks-10772810/,2026-07-05T21:08:32+00:00
Delhi-NCR,IE,Delhi-NCR • IE,https://indianexpress.com/section/cities/delhi/,85,"Red alert for Dang, Navsari and Valsad as heavy rain continues to batter Gujarat",https://indianexpress.com/article/cities/ahmedabad/gujarat-rain-live-updates-amreli-wall-collapse-death-imd-red-alert-dang-navsari-valsad-10772844/,2026-07-05T21:08:32+00:00
Delhi-NCR,IE,Delhi-NCR • IE,https://indianexpress.com/section/cities/delhi/,86,Building monsoon immunity at work: Small changes that make a big difference,https://indianexpress.com/article/lifestyle/workplace/building-monsoon-immunity-at-work-small-changes-that-make-a-big-difference-10766536/,2026-07-05T21:08:32+00:00
Delhi-NCR,IE,Delhi-NCR • IE,https://indianexpress.com/section/cities/delhi/,87,Newsletters ( opens in a new tab ),https://indianexpress.com/newsletters/,2026-07-05T21:08:32+00:00
Delhi-NCR,IE,Delhi-NCR • IE,https://indianexpress.com/section/cities/delhi/,88,26/11 Stories of Strength ( opens in a new tab ),https://indianexpress.com/26-11/,2026-07-05T21:08:32+00:00
Delhi-NCR,IE,Delhi-NCR • IE,https://indianexpress.com/section/cities/delhi/,89,Statutory provisions on reporting (sexual offenses),https://indianexpress.com/article/what-is/what-is-the-protection-of-children-from-sexual-offences-act-2012/,2026-07-05T21:08:32+00:00
Delhi-NCR,Jagran,Delhi-NCR • Jagran,https://www.jagran.com/delhi-ncr,1,"दिल्‍ली में वोकेशनल और स्‍पेशल गेस्‍ट टीचर्स की सैलरी में सीधे 15 हजार प्रतिमाह की बढ़ोतरी, चेक करें नई लिस्ट",https://www.jagran.com/delhi/new-delhi-city-delhi-vocational-samagra-shiksha-teachers-get-salary-hike-40229114.html,2026-07-05T21:08:32+00:00
Delhi-NCR,Jagran,Delhi-NCR • Jagran,https://www.jagran.com/delhi-ncr,2,"दिल्ली में प्रदूषण कम करने की बड़ी पहल, इस महीने से MCD फ्री करेगी शवदाह",https://www.jagran.com/delhi/new-delhi-city-delhi-mcd-offers-free-ecofriendly-cremations-from-june-40229131.html,2026-07-05T21:08:32+00:00
Delhi-NCR,Jagran,Delhi-NCR • Jagran,https://www.jagran.com/delhi-ncr,3,"दिल्ली-एनसीआर में मौसम के कई रंग-रूप, कहीं दिनभर खिले रहे धूप; इन इलाकों तेज बारिश के साथ गिरे ओले",https://www.jagran.com/delhi/new-delhi-city-delhincr-weather-hailstorm-in-dwarka-7day-forecast-40228741.html,2026-07-05T21:08:32+00:00
Delhi-NCR,Jagran,Delhi-NCR • Jagran,https://www.jagran.com/delhi-ncr,4,"दिल्ली वालों को जाम से मिलेगी बड़ी राहत, NHAI ने लिया 3 प्रमुख रास्तों को सिग्नल-फ्री बनाने का जिम्मा",https://www.jagran.com/delhi/new-delhi-city-nhai-takes-over-3-delhi-corridors-for-jamfree-travel-40229051.html,2026-07-05T21:08:32+00:00
Delhi-NCR,Jagran,Delhi-NCR • Jagran,https://www.jagran.com/delhi-ncr,5,"GOOD NEWS : बनारस से दिल्ली के लिए एक और रेल सेवा की होने जा रही है शुरुआत, अयोध्‍या भी होगा ठहराव",https://www.jagran.com/uttar-pradesh/varanasi-city-another-train-service-from-banaras-to-delhi-to-start-soon-ayodhya-to-stagnate-40165795.html,2026-07-05T21:08:32+00:00
Delhi-NCR,Jagran,Delhi-NCR • Jagran,https://www.jagran.com/delhi-ncr,6,"दिल्ली 'रेड जोन' में, देश के सर्वाधिक पांच प्रदूषित शहर NCR के; 11 जगहों पर AQI 450 के पार",https://www.jagran.com/delhi/new-delhi-city-delhi-in-red-zone-5-cities-of-ncr-most-polluted-aqi-crosses-450-40073519.html,2026-07-05T21:08:32+00:00
Delhi-NCR,Jagran,Delhi-NCR • Jagran,https://www.jagran.com/delhi-ncr,7,"नई द‍िल्‍ली और बेंगलुरू की इंडिगो ने चार उड़ानें निरस्त कीं, मुश्‍क‍िल में पड़ा यात्र‍ियों का सफर",https://www.jagran.com/uttar-pradesh/varanasi-city-indigo-cancels-flights-from-delhi-and-bengaluru-40070108.html,2026-07-05T21:08:32+00:00
Delhi-NCR,Jagran,Delhi-NCR • Jagran,https://www.jagran.com/delhi-ncr,8,"दिल्ली में नई एसओपी लागू होने पर भी वन विभाग पेड़ बचाने को नहीं गंभीर, हो रहा काफी नुकसान",https://www.jagran.com/delhi/new-delhi-city-delhi-forest-dept-fails-tree-protection-despite-new-sop-40296075.html,2026-07-05T21:08:32+00:00
Delhi-NCR,Jagran,Delhi-NCR • Jagran,https://www.jagran.com/delhi-ncr,9,दिल्ली में फर्जी सिम गैंग पर एक्शन: साइबर अपराधियों को सिम बेचने वाला पीओएस एजेंट गिरफ्तार,https://www.jagran.com/delhi/new-delhi-city-pos-agent-arrested-in-delhi-for-illegal-sim-activation-cyber-fraud-40296014.html,2026-07-05T21:08:32+00:00
Delhi-NCR,Jagran,Delhi-NCR • Jagran,https://www.jagran.com/delhi-ncr,10,"सोनीपत के कुंडली में 200 फुट ऊंचे बिजली टावर पर चढ़ा युवक, पांच घंटे बाद सुरक्षित उतारा गया",https://www.jagran.com/haryana/sonipat-man-climbs-200ft-power-tower-in-kundli-sonipat-rescued-40296087.html,2026-07-05T21:08:32+00:00
Delhi-NCR,Jagran,Delhi-NCR • Jagran,https://www.jagran.com/delhi-ncr,11,"गुरुग्राम में वन विभाग की भूमि पर चलेगा बुलडोजर, अवैध निर्माण किए जाएंगे ध्वस्त",https://www.jagran.com/haryana/gurgaon-sohna-forest-land-demolition-illegal-structures-to-be-razed-40296064.html,2026-07-05T21:08:32+00:00
Delhi-NCR,Jagran,Delhi-NCR • Jagran,https://www.jagran.com/delhi-ncr,12,"रेवाड़ी मोनू हत्याकांड: पत्नी तनु और आरोपी हरिओम जेल भेजे गए, प्रेमी सोनू की तलाश अब भी जारी",https://www.jagran.com/haryana/rewari-rewari-monu-murder-wife-tanu-hariom-sent-to-jail-after-remand-40296032.html,2026-07-05T21:08:32+00:00
Delhi-NCR,Jagran,Delhi-NCR • Jagran,https://www.jagran.com/delhi-ncr,13,"सोनीपत में दर्दनाक सड़क हादसा, एचटेट परीक्षा दिलाने जा रहे युवक की मौत, बहन घायल",https://www.jagran.com/haryana/sonipat-sonipat-youth-dies-in-road-accident-taking-sister-for-htet-exam-40296099.html,2026-07-05T21:08:32+00:00
Delhi-NCR,Jagran,Delhi-NCR • Jagran,https://www.jagran.com/delhi-ncr,14,"नोएडा में बीच सड़क हाई-वोल्टेज ड्रामा: कार वाले की 'आंख मारने' की हरकत पर भड़की युवती, पुलिस जांच में जुटी",https://www.jagran.com/uttar-pradesh/noida-noida-woman-confronts-driver-for-winking-police-probe-viral-video-40295994.html,2026-07-05T21:08:32+00:00
Delhi-NCR,Jagran,Delhi-NCR • Jagran,https://www.jagran.com/delhi-ncr,15,रांची में पशुपालन विभाग के खाते से फिर 17 लाख की अवैध निकासी कुबेर पोर्टल पर फर्जी आईडी से घोटाला,https://www.jagran.com/jharkhand/ranchi-ranchi-frozen-semen-bank-fraud-17-lakh-embezzled-via-kuber-portal-40296164.html,2026-07-05T21:08:32+00:00
Delhi-NCR,Jagran,Delhi-NCR • Jagran,https://www.jagran.com/delhi-ncr,16,"राम मंदिर चढ़ावा चोरी: जांच… FIR, गिरफ्तारी और छापेमारी के बाद बैठक, मामले की 10 बड़ी बातें",https://www.jagran.com/uttar-pradesh/ayodhya-ram-mandir-donation-theft-trust-meeting-today-amid-probe-40296238.html,2026-07-05T21:08:32+00:00
Delhi-NCR,Jagran,Delhi-NCR • Jagran,https://www.jagran.com/delhi-ncr,17,"रिलीज के 2 दिन बाद ही OTT से हटा दी गई Diljit Dosanjh की फिल्म Satluj, प्लेटफॉर्म ने दी सफाई",https://www.jagran.com/entertainment/bollywood-diljit-dosanjh-arjun-rampal-controversial-film-satluj-removed-from-zee5-in-two-days-after-release-40296112.html,2026-07-05T21:08:32+00:00
Delhi-NCR,Jagran,Delhi-NCR • Jagran,https://www.jagran.com/delhi-ncr,18,LNG संकट टला: होर्मुज से सप्लाई सामान्य होने पर सरकार ने हटाए गैस पर लगे आपातकालीन प्रतिबंध,https://www.jagran.com/news/national-india-lifts-gas-supply-curbs-as-hormuz-lng-normalizes-40296163.html,2026-07-05T21:08:32+00:00
Delhi-NCR,Jagran,Delhi-NCR • Jagran,https://www.jagran.com/delhi-ncr,19,"मुंबई में भारी बारिश के बीच बहुमंजिला चॉल गिरने से 6 लोगों की मौत, 1 घायल",https://www.jagran.com/maharashtra/mumbai-mumbai-chawl-collapse-kills-6-in-mankhurd-amid-heavy-rain-40296179.html,2026-07-05T21:08:32+00:00
Delhi-NCR,Jagran,Delhi-NCR • Jagran,https://www.jagran.com/delhi-ncr,20,टिक-टिक करता टाइम-बम: यूक्रेन ने रूस पर लगाया कब्जे वाले इलाके में बायो-वेपन दफनाने का आरोप,https://www.jagran.com/world/russia-ukraine-accuses-russia-of-anthrax-bioweapon-threat-in-occupied-areas-40296229.html,2026-07-05T21:08:32+00:00
Delhi-NCR,Jagran,Delhi-NCR • Jagran,https://www.jagran.com/delhi-ncr,21,सशक्त भारत के स्वप्नदर्शी राजनेता: पीएम नरेंद्र मोदी,https://www.jagran.com/editorial/apnibaat-pm-modi-syama-prasad-mookerjees-vision-for-strong-india-40296110.html,2026-07-05T21:08:32+00:00
Delhi-NCR,Jagran,Delhi-NCR • Jagran,https://www.jagran.com/delhi-ncr,22,विचार: बिहार में सामाजिक बदलाव के संकेत,https://www.jagran.com/editorial/apnibaat-bihars-bharat-tiwari-encounter-a-catalyst-for-social-change-40296104.html,2026-07-05T21:08:32+00:00
Delhi-NCR,Jagran,Delhi-NCR • Jagran,https://www.jagran.com/delhi-ncr,23,विचार: मंदिरों के चढ़ावे का उपयोग,https://www.jagran.com/editorial/apnibaat-ayodhya-ram-mandir-donation-theft-and-temple-fund-management-40295097.html,2026-07-05T21:08:32+00:00
Delhi-NCR,Jagran,Delhi-NCR • Jagran,https://www.jagran.com/delhi-ncr,24,विचार: बच्चों पर मंडराता साइबर खतरा,https://www.jagran.com/editorial/apnibaat-childrens-online-safety-addressing-digital-child-labor-cyber-threats-40294136.html,2026-07-05T21:08:32+00:00
Delhi-NCR,Jagran,Delhi-NCR • Jagran,https://www.jagran.com/delhi-ncr,25,विचार: विचारधारा की बलि लेता दलबदल,https://www.jagran.com/editorial/apnibaat-political-defections-ideology-sacrificed-for-twothirds-majority-40294123.html,2026-07-05T21:08:32+00:00
Delhi-NCR,Jagran,Delhi-NCR • Jagran,https://www.jagran.com/delhi-ncr,26,आफताब हत्याकांड: 14 दिन बाद भी फरार है थप्पड़ का बदला लेने वाला मुख्य आरोपी,https://www.jagran.com/uttar-pradesh/ghaziabad-ghaziabad-police-unable-to-arrest-key-accused-in-aftab-murder-40295805.html,2026-07-05T21:08:32+00:00
Delhi-NCR,Jagran,Delhi-NCR • Jagran,https://www.jagran.com/delhi-ncr,27,"गाजियाबाद: महाराणा प्रताप पार्क में हफ्तों से भरा गंदा पानी, मच्छर और बीमारियों का बढ़ा खतरा",https://www.jagran.com/uttar-pradesh/ghaziabad-ghaziabad-maharana-pratap-park-flooded-with-sewage-issues-40295782.html,2026-07-05T21:08:32+00:00
Delhi-NCR,Jagran,Delhi-NCR • Jagran,https://www.jagran.com/delhi-ncr,28,"यूपी विधानसभा चुनाव के लिए कांग्रेस का बूथ प्लान तैयार, गाजियाबाद में हर बूथ पर उतरेंगे जिम्मेदार",https://www.jagran.com/uttar-pradesh/ghaziabad-congress-gears-up-for-up-assembly-polls-with-ghaziabad-booth-plan-40295553.html,2026-07-05T21:08:32+00:00
Delhi-NCR,Jagran,Delhi-NCR • Jagran,https://www.jagran.com/delhi-ncr,29,"गाजियाबाद में दुष्कर्म पीड़िता को तमंचा दिखाकर दोबारा रेप करने का आरोप, बयान बदलने का बनाया दबाव",https://www.jagran.com/uttar-pradesh/ghaziabad-ghaziabad-rape-victim-reraped-threatened-to-change-statement-40295544.html,2026-07-05T21:08:32+00:00
Delhi-NCR,Jagran,Delhi-NCR • Jagran,https://www.jagran.com/delhi-ncr,30,"गाजियाबाद में एचपीवी टीकाकरण में सुस्ती, लापरवाह डॉक्टरों पर होगी कार्रवाई",https://www.jagran.com/uttar-pradesh/ghaziabad-ghaziabad-hpv-vaccination-slow-action-against-doctors-planned-40295341.html,2026-07-05T21:08:32+00:00
Delhi-NCR,Jagran,Delhi-NCR • Jagran,https://www.jagran.com/delhi-ncr,31,"शादी के 3 महीने बाद खौफनाक अंत: गुरुग्राम में पत्नी की हत्या कर बाथरूम में छिपाया शव, प्रेमिका संग पति गिरफ्तार",https://www.jagran.com/haryana/gurgaon-manesar-wife-murder-husband-girlfriend-arrested-40295983.html,2026-07-05T21:08:32+00:00
Delhi-NCR,Jagran,Delhi-NCR • Jagran,https://www.jagran.com/delhi-ncr,32,"हरियाणा से पश्चिमी यूपी तक जुड़ें हैं भ्रूण लिंग जांच के तार, एजेंटों के माध्यम से चल रहा अवैध कारोबार",https://www.jagran.com/haryana/gurgaon-haryanaup-foetal-sex-determination-racket-exposed-40295967.html,2026-07-05T21:08:32+00:00
Delhi-NCR,Jagran,Delhi-NCR • Jagran,https://www.jagran.com/delhi-ncr,33,"गुरुग्राम में यू-टर्न लेते समय ट्रक ने कार को मारी टक्कर, दो लोगों की मौत और तीन घायल",https://www.jagran.com/haryana/gurgaon-gurugram-truckcar-collision-2-dead-3-injured-on-pataudi-road-40295643.html,2026-07-05T21:08:32+00:00
Delhi-NCR,Jagran,Delhi-NCR • Jagran,https://www.jagran.com/delhi-ncr,34,"मानेसर वालों की बल्ले-बल्ले, विकास कार्यों पर खर्च होंगे 3 करोड़; मेयर इंद्रजीत कौर ने किया का शुभारंभ",https://www.jagran.com/haryana/gurgaon-gurugram-harbala-ki-dhani-gets-3-cr-development-projects-40295590.html,2026-07-05T21:08:32+00:00
Delhi-NCR,Jagran,Delhi-NCR • Jagran,https://www.jagran.com/delhi-ncr,35,"दादरी की सात कॉलोनियों में पांच साल से जलभराव, 30 हजार लोग नारकीय जीवन जीने को मजबूर",https://www.jagran.com/uttar-pradesh/noida-dadri-colonies-suffer-5-years-of-waterlogging-neglect-40295939.html,2026-07-05T21:08:32+00:00
Delhi-NCR,Jagran,Delhi-NCR • Jagran,https://www.jagran.com/delhi-ncr,36,"ग्रेटर नोएडा: जून में बिगड़ी हवा की सेहत, पिछले साल से बदतर हुए हालात; 28 दिन प्रदूषण का रहा 'डबल अटैक'",https://www.jagran.com/uttar-pradesh/noida-greater-noida-air-quality-worsens-in-june-2026-pm10-soars-40295860.html,2026-07-05T21:08:32+00:00
Delhi-NCR,Jagran,Delhi-NCR • Jagran,https://www.jagran.com/delhi-ncr,37,"नोएडा में ओवरलोड वाहनों पर बड़ा एक्शन, 7 ट्रक सीज; वसूला ₹8.50 लाख का भारी जुर्माना",https://www.jagran.com/uttar-pradesh/noida-noida-7-overloaded-trucks-seized-85-lakh-fine-collected-40295702.html,2026-07-05T21:08:32+00:00
Delhi-NCR,Jagran,Delhi-NCR • Jagran,https://www.jagran.com/delhi-ncr,38,"नोएडा सेक्टर-18 की मल्टीलेवल पार्किंग में मिली महिला की लाश, इलाके में मचा हड़कंप",https://www.jagran.com/uttar-pradesh/noida-noida-unidentified-womans-body-found-in-sector-18-parking-40295513.html,2026-07-05T21:08:32+00:00
Delhi-NCR,Jagran,Delhi-NCR • Jagran,https://www.jagran.com/delhi-ncr,39,"दिल्ली सरकार का 'मिशन कायाकल्प' शुरू, सरकारी स्कूल बनेंगे स्मार्ट और छात्र-अनुकूल",https://www.jagran.com/delhi/new-delhi-city-delhis-mission-kayakalp-transforms-government-school-infrastructure-40296158.html,2026-07-05T21:08:32+00:00
Delhi-NCR,Jagran,Delhi-NCR • Jagran,https://www.jagran.com/delhi-ncr,40,"दिल्ली के सरकारी स्कूल में मिड-डे मील में मिली मरी हुई छिपकली, पुलिस जांच जारी",https://www.jagran.com/delhi/new-delhi-city-dead-lizard-found-in-delhi-school-midday-meal-fir-filed-40296204.html,2026-07-05T21:08:32+00:00
