city,publisher,source,source_url,rank,headline,link,collected_at_iso
Bengaluru,DC,Bengaluru • DC,https://www.deccanchronicle.com/location/india/karnataka/bengaluru,1,Assembly Elections 2026,https://www.deccanchronicle.com/assembly-elections-2026,2026-05-02T10:57:07+00:00
Bengaluru,DC,Bengaluru • DC,https://www.deccanchronicle.com/location/india/karnataka/bengaluru,2,Opinion and Editorials,https://www.deccanchronicle.com/opinion,2026-05-02T10:57:07+00:00
Bengaluru,DC,Bengaluru • DC,https://www.deccanchronicle.com/location/india/karnataka/bengaluru,3,Telangana Rising 2047,https://www.deccanchronicle.com/tags/Telangana-Rising-2047,2026-05-02T10:57:07+00:00
Mumbai,Mumbai Mirror,Mumbai • Mumbai Mirror,https://mumbaimirror.indiatimes.com/mumbai,1,The power of ‘Yet’,https://mumbaimirror.indiatimes.com/opinion/the-power-of-yet/articleshow/130682522.html,2026-05-02T10:57:07+00:00
Mumbai,Mumbai Mirror,Mumbai • Mumbai Mirror,https://mumbaimirror.indiatimes.com/mumbai,2,"History, off the record",https://mumbaimirror.indiatimes.com/unwind/history-off-the-record/articleshow/130682629.html,2026-05-02T10:57:07+00:00
Mumbai,Mumbai Mirror,Mumbai • Mumbai Mirror,https://mumbaimirror.indiatimes.com/mumbai,3,Kharat probe: ED summons Rupali Chakankar’s sister,https://mumbaimirror.indiatimes.com/mumbai/kharat-probe-ed-summons-rupali-chakankars-sister/articleshow/130683584.html,2026-05-02T10:57:07+00:00
Mumbai,Mumbai Mirror,Mumbai • Mumbai Mirror,https://mumbaimirror.indiatimes.com/mumbai,4,Pydhonie case: FDA lacks thecapability to identify toxins,https://mumbaimirror.indiatimes.com/mumbai/pydhonie-case-fda-lacks-thecapability-to-identify-toxins/articleshow/130683582.html,2026-05-02T10:57:07+00:00
Mumbai,Mumbai Mirror,Mumbai • Mumbai Mirror,https://mumbaimirror.indiatimes.com/mumbai,5,ED moves to seize Mirchi’s `700 cr properties,https://mumbaimirror.indiatimes.com/mumbai/ed-moves-to-seize-mirchis-700-cr-properties/articleshow/130684059.html,2026-05-02T10:57:07+00:00
Mumbai,Mumbai Mirror,Mumbai • Mumbai Mirror,https://mumbaimirror.indiatimes.com/mumbai,6,Is your phone frying your brain?,https://mumbaimirror.indiatimes.com/you/is-your-phone-frying-your-brain/articleshow/130681149.html,2026-05-02T10:57:07+00:00
Mumbai,Mumbai Mirror,Mumbai • Mumbai Mirror,https://mumbaimirror.indiatimes.com/mumbai,7,Ask The Sexpert,https://mumbaimirror.indiatimes.com/ask-the-sexpert,2026-05-02T10:57:07+00:00
Mumbai,Sakal,Mumbai • Sakal,https://www.esakal.com/pune,1,सकाळ लाईव्ह TV,https://www.esakal.com/live-tv,2026-05-02T10:57:07+00:00
Mumbai,Sakal,Mumbai • Sakal,https://www.esakal.com/pune,2,Refund and Cancellation,https://www.esakal.com/refund-and-cancellation,2026-05-02T10:57:07+00:00
Mumbai,Lokmat,Mumbai • Lokmat,https://www.lokmat.com/city/,1,Live News in Marathi,https://www.lokmat.com/live-news/,2026-05-02T10:57:07+00:00
Mumbai,Lokmat,Mumbai • Lokmat,https://www.lokmat.com/city/,2,आरोपीला लवकरात लवकर फाशीची शिक्षा मिळावी; नसरापूर प्रकरणावर मुख्यमंत्री फडणवीस कठोर,https://www.lokmat.com/pune/pune-crimethe-accused-should-be-given-death-penalty-as-soon-as-possible-chief-minister-fadnavis-is-strict-on-the-nasarapur-case-a-a1008/,2026-05-02T10:57:07+00:00
Mumbai,Lokmat,Mumbai • Lokmat,https://www.lokmat.com/city/,3,आरोपी २ वेळा बेलवर बाहेर आला अन् पुन्हा...; नसरापूर प्रकरणावर रोहित पवारांचा संताप (video),https://www.lokmat.com/pune/pune-crime-the-accused-came-out-on-bail-twice-and-again-rohit-pawars-anger-over-the-nasrapur-case-a-a1008/,2026-05-02T10:57:07+00:00
Mumbai,Lokmat,Mumbai • Lokmat,https://www.lokmat.com/city/,4,नसरापूर बालिकेच्या हत्येतील आरोपीचा काळा इतिहास उघड; महिलांच्या छळाचे आरोप,https://www.lokmat.com/pune/pune-crime-accused-in-nasrapur-girl-murder-already-faces-allegations-of-harassment-against-women-a-a1008/,2026-05-02T10:57:07+00:00
Mumbai,Lokmat,Mumbai • Lokmat,https://www.lokmat.com/city/,5,'वासरू दाखवतो’ म्हणत गोठ्यात नेलं; चिमुकलीवर अत्याचार करून मृतदेह शेणाच्या ढिगाऱ्याखाली लपवला,https://www.lokmat.com/pune/pune-crime-child-taken-away-on-the-pretext-of-showing-a-calf-child-tortured-and-brutally-murdered-a-a1008/,2026-05-02T10:57:07+00:00
Mumbai,Lokmat,Mumbai • Lokmat,https://www.lokmat.com/city/,6,पिंपरी -चिंचवड :,https://www.lokmat.com/pimpri-chinchwad/,2026-05-02T10:57:07+00:00
Mumbai,Lokmat,Mumbai • Lokmat,https://www.lokmat.com/city/,7,"मंत्रीमहोदय, रोजच वल्लभनगर आगारास भेट देणार का ? बसस्थानकातील प्रवाशांचा सवाल",https://www.lokmat.com/pimpri-chinchwad/minister-will-you-visit-vallabhnagar-agar-every-day-question-from-passengers-at-the-bus-stand-a-a1008/,2026-05-02T10:57:07+00:00
Mumbai,Lokmat,Mumbai • Lokmat,https://www.lokmat.com/city/,8,इंजिनिअर पतीचे इतर पुरुषांशी संबंध; पत्नीने घरात कॅमेरा लावून रंगेहाथ पकडलं; मुंबईत समोर आलं धक्कादायक वास्तव,https://www.lokmat.com/mumbai/up-woman-installs-hidden-camera-to-track-husband-behavior-discovers-his-relations-with-other-men-a-a1001/,2026-05-02T10:57:07+00:00
Mumbai,Lokmat,Mumbai • Lokmat,https://www.lokmat.com/city/,9,'....तर निधी देताना विचार केला जाईल'; अमित साटम यांचा मुंबईतील नगरसेवकांना सज्जड दम,https://www.lokmat.com/mumbai/then-it-will-be-considered-while-providing-funds-amit-satam-urges-corporators-in-mumbai-to-be-ready-a-a941/,2026-05-02T10:57:07+00:00
Mumbai,Lokmat,Mumbai • Lokmat,https://www.lokmat.com/city/,10,"Missing Link झाला मिसिंग, अभिजीत पानसेंचा टोला; पुण्याहून मुंबईच्या दिशेने वाहतूक कोंडीत अडकले",https://www.lokmat.com/mumbai/missing-link-went-missing-abhijeet-panses-team-stuck-in-traffic-jam-from-pune-towards-mumbai-a-a941/,2026-05-02T10:57:07+00:00
Mumbai,Lokmat,Mumbai • Lokmat,https://www.lokmat.com/city/,11,...तर भविष्यात वाहने कुठे उभी करायची? नियमांत शिथिलता नकाे; BKC मधील प्रस्तावित बदलांविरोधात आक्षेप,https://www.lokmat.com/mumbai/demand-as-proposal-regarding-the-granting-of-relaxations-in-parking-norms-for-future-construction-projects-within-blocks-r-and-g-of-bkc-should-be-withdrawn-a-a629/,2026-05-02T10:57:07+00:00
Mumbai,Lokmat,Mumbai • Lokmat,https://www.lokmat.com/city/,12,"मुदतठेवींचा वापर प्रकल्पांसाठीच, इमारतींना कराच्या कक्षेत आणणार; BMC आयुक्तांचे परखड प्रतिपादन",https://www.lokmat.com/mumbai/fixed-deposits-will-be-used-only-for-projects-buildings-will-be-brought-under-tax-ambit-bmc-commissioner-ashwini-bhide-firm-assertion-a-a629/,2026-05-02T10:57:07+00:00
Mumbai,Lokmat,Mumbai • Lokmat,https://www.lokmat.com/city/,13,बारावीच्या निकालात नागपूर विभागाचा टक्का घसरला; यंदाही शेवटून दुसरा,https://www.lokmat.com/nagpur/nagpur-divisions-percentage-drops-in-12th-result-second-from-last-this-year-too-a-a957-c1000/,2026-05-02T10:57:07+00:00
Mumbai,Lokmat,Mumbai • Lokmat,https://www.lokmat.com/city/,14,महाल दंगलीतील आरोपी फहीम खानला अटक; पाचपैकी एका गुन्ह्याच्या चौकशीसाठी अटक,https://www.lokmat.com/nagpur/mahal-riot-accused-fahim-khan-arrested-arrested-for-investigation-of-one-of-the-five-crimes-a-a1000/,2026-05-02T10:57:07+00:00
Mumbai,Lokmat,Mumbai • Lokmat,https://www.lokmat.com/city/,15,विदर्भ राज्याची चाहूल तर नाही ना ? मुख्यमंत्री-मंत्र्यांच्या बंगल्यांपासून अधिकाऱ्यांना हायराइज इमारत,https://www.lokmat.com/nagpur/isnt-vidarbha-state-a-wonder-from-the-bungalows-of-the-chief-minister-and-ministers-to-high-rise-buildings-for-officials-a-a1000/,2026-05-02T10:57:07+00:00
Mumbai,Lokmat,Mumbai • Lokmat,https://www.lokmat.com/city/,16,अविश्वास ठरावाला स्थगितीचा जिल्हाधिकाऱ्यांना अधिकारच नाही : हायकोर्ट,https://www.lokmat.com/nagpur/district-magistrate-has-no-right-to-suspend-no-confidence-motion-high-court-a-a1000/,2026-05-02T10:57:07+00:00
Mumbai,Lokmat,Mumbai • Lokmat,https://www.lokmat.com/city/,17,"शिंदेसेनेत नेते, महायुतीत भाजप कडू यांना कितपत स्वीकारणार ?",https://www.lokmat.com/nagpur/to-what-extent-will-the-bjp-accept-kadu-as-a-leader-in-the-shinde-sena-and-the-mahayuti-a-a1015-c1000/,2026-05-02T10:57:07+00:00
Mumbai,Lokmat,Mumbai • Lokmat,https://www.lokmat.com/city/,18,‘परदेशांत भ्रमण न केल्यास नागदेवता दंश करेल’; फिर्यादीच्या पैशांवर भोंदू खरात करायचा मौज,https://www.lokmat.com/crime/the-imposter-ashok-kharat-swindle-four-to-five-crore-rupees-from-businessman-a-a629/,2026-05-02T10:57:07+00:00
Mumbai,Lokmat,Mumbai • Lokmat,https://www.lokmat.com/city/,19,भोंदू खरातने परिसाची शक्ती प्राप्त करण्याचे सांगून फिर्यादीच्या पैशातून केला २१ देशांचा परदेश दौरा!,https://www.lokmat.com/nashik/the-fraudster-kharat-used-the-plaintiffs-money-to-tour-21-countries-abroad-claiming-to-gain-the-power-of-parisa-a-a1013/,2026-05-02T10:57:07+00:00
Mumbai,Lokmat,Mumbai • Lokmat,https://www.lokmat.com/city/,20,शेअर मार्केटमध्ये गुंतवणुकीच्या आमिषाने नाशिकमध्ये ८४ लाखांची फसवणूक,https://www.lokmat.com/nashik/fraud-of-rs-84-lakhs-in-nashik-on-the-pretext-of-investing-in-the-stock-market-a-a1001/,2026-05-02T10:57:07+00:00
Mumbai,Lokmat,Mumbai • Lokmat,https://www.lokmat.com/city/,21,भोंदू अशोक खरातला सातव्या गुन्ह्यात न्यायालयीन कोठडी; आठव्या गुन्ह्यात SIT ने घेतला ताबा,https://www.lokmat.com/nashik/impostor-ashok-kharat-remanded-in-judicial-custody-in-seventh-case-sit-takes-custody-in-eighth-case-a-a732/,2026-05-02T10:57:07+00:00
Mumbai,Lokmat,Mumbai • Lokmat,https://www.lokmat.com/city/,22,महिलांना तालावर नाचायला लावणाऱ्या औषधाबाबत गूढ; भोंदू खरात नेमकं काय प्यायला द्यायचा?,https://www.lokmat.com/crime/the-sit-has-yet-to-succeed-in-identifying-the-sedative-administered-to-victims-in-the-case-involving-the-ashok-kharat-a-a629/,2026-05-02T10:57:07+00:00
Mumbai,Lokmat,Mumbai • Lokmat,https://www.lokmat.com/city/,23,"शिवाजीराव, तुमचे शिक्षण किती, पूर्वायुष्य काय..? मंत्री मुश्रीफ यांचे प्रत्युत्तर",https://www.lokmat.com/kolhapur/shivajirao-what-is-your-education-level-what-is-your-background-minister-mushrifs-reply-a-a653/,2026-05-02T10:57:07+00:00
Mumbai,Lokmat,Mumbai • Lokmat,https://www.lokmat.com/city/,24,पुण्याच्या विद्यार्थ्याचा काळम्मावाडी येथील काळोखा डोहात बुडून मृत्यू,https://www.lokmat.com/kolhapur/pune-student-drowns-in-kalokha-doha-in-kalammawadi-a-a597/,2026-05-02T10:57:07+00:00
Mumbai,Lokmat,Mumbai • Lokmat,https://www.lokmat.com/city/,25,"कोल्हापुरी ब्रँड 'प्राडा'ने स्वीकारला, नवीन चप्पल बाजारात; ३० जणांना इटलीत प्रशिक्षणाची संधी",https://www.lokmat.com/kolhapur/kolhapuri-brand-prada-accepts-new-slippers-in-the-market-30-people-get-training-opportunity-in-italy-a-a597/,2026-05-02T10:57:07+00:00
Mumbai,Lokmat,Mumbai • Lokmat,https://www.lokmat.com/city/,26,"‘शिवाजी कोण होता?’ उर्दू आवृत्तीच्या २५ हजारांवर प्रतींची विक्री, पुस्तक पोहोचले पाकिस्तानात",https://www.lokmat.com/kolhapur/beyond-borders-govind-pansare-who-was-shivaji-gains-massive-popularity-in-urdu-and-reaches-pakistan-a-a1012/,2026-05-02T10:57:07+00:00
Mumbai,Lokmat,Mumbai • Lokmat,https://www.lokmat.com/city/,27,"कोल्हापूर जिल्ह्यातील मुलींच्या शोषण प्रकरणाला वेगळे वळण, बजरंग दलाच्या पदाधिकाऱ्याला पिस्तुलाचा धाक दाखवत जीवे मारण्याची धमकी",https://www.lokmat.com/kolhapur/a-different-twist-to-the-case-of-exploitation-of-girls-in-kolhapur-district-a-bajrang-dal-official-was-threatened-with-death-at-gunpoint-a-a653/,2026-05-02T10:57:07+00:00
Mumbai,Lokmat,Mumbai • Lokmat,https://www.lokmat.com/city/,28,चांदोली अभयारण्यात राखाडी डोक्याच्या मत्स्यगरुडाची नोंद,https://www.lokmat.com/sangli/rare-grey-headed-fish-eagle-spotted-in-sahyadri-tiger-reserve-a-major-boost-for-chandoli-ecosystem-a-a1012/,2026-05-02T10:57:07+00:00
Mumbai,Lokmat,Mumbai • Lokmat,https://www.lokmat.com/city/,29,देशभरात कुठेही वाहन चालवा; बीएच सीरीज नंबर घेतला का? वाहनधारकांकडून प्रतिसाद,https://www.lokmat.com/sangli/drive-anywhere-in-the-country-did-you-get-a-bh-series-number-response-from-vehicle-owners-a-a941/,2026-05-02T10:57:07+00:00
Mumbai,Lokmat,Mumbai • Lokmat,https://www.lokmat.com/city/,30,"भांडण सोडवणं पडलं महागात! सांगलीत मध्यस्थी करणाऱ्या तरुणाची हत्या; दोघांना अटक, एक अल्पवयीन ताब्यात",https://www.lokmat.com/sangli/crime-news-resolving-a-dispute-became-costly-a-young-man-who-was-mediating-in-sangli-was-killed-two-arrested-a-minor-in-custody-a-a941/,2026-05-02T10:57:07+00:00
Mumbai,Lokmat,Mumbai • Lokmat,https://www.lokmat.com/city/,31,"'विशाल पाटलांना तिकीट मिळणार नाही हे जयंत पाटील-विश्वजित कदमांना माहीत होतं""; पडळकरांचा मोठा गौप्यस्फोट",https://www.lokmat.com/sangli/jayant-patil-vishwajit-kadam-knew-that-vishal-patil-would-not-get-a-ticket-gopichand-padalkars-big-revelation-a-a941/,2026-05-02T10:57:07+00:00
Mumbai,Lokmat,Mumbai • Lokmat,https://www.lokmat.com/city/,32,"पाठीला कॅन बांधल्याने मुलगा वाचला, पण काळाने बापाला ओढलं; वारणा नदीपात्रातील काळजाचा थरकाप उडवणारी घटना",https://www.lokmat.com/sangli/the-boy-was-saved-by-tying-a-can-to-his-back-but-time-took-the-father-a-heart-wrenching-incident-in-the-varna-river-basin-a-a941/,2026-05-02T10:57:07+00:00
Mumbai,Lokmat,Mumbai • Lokmat,https://www.lokmat.com/city/,33,सुट्ट्यांचा आनंद महामार्गावरच 'जाम'! खेड शिवापूर ते साताऱ्यापर्यंत वाहनांच्या लांबच लांब रांगा; प्रवासी हतबल,https://www.lokmat.com/satara/the-joy-of-holidays-is-a-jam-on-the-highway-long-queues-of-vehicles-from-khed-shivapur-to-satara-passengers-are-desperate-a-a1013/,2026-05-02T10:57:07+00:00
Mumbai,Lokmat,Mumbai • Lokmat,https://www.lokmat.com/city/,34,"वहिनीचा ओरडण्याचा आवाज आला अन् लोक धावले, वाईत दीराचं भयानक कृत्य पाहून गाव सुन्न",https://www.lokmat.com/satara/satara-shocker-man-brutes-sister-in-law-to-death-over-ancestral-land-dispute-in-wai-a-a1001/,2026-05-02T10:57:07+00:00
Mumbai,Lokmat,Mumbai • Lokmat,https://www.lokmat.com/city/,35,शरद पवार पुन्हा रुग्णालयात दाखल; बारामती पोटनिवडणूक दरम्यान पोस्ट लिहून केलं आवाहन,https://www.lokmat.com/maharashtra/sharad-pawar-admitted-to-hospital-again-appealed-through-post-during-baramati-by-election-a-a1013/,2026-05-02T10:57:07+00:00
Mumbai,Lokmat,Mumbai • Lokmat,https://www.lokmat.com/city/,36,"कार्यकर्ता अपमानित होतो, तेव्हा माझ्यातील शिवसैनिक जागा : एकनाथ शिंदे",https://www.lokmat.com/satara/when-a-worker-is-humiliated-the-shiv-sainik-in-me-disappears-eknath-shinde-a-a1013/,2026-05-02T10:57:07+00:00
Mumbai,Lokmat,Mumbai • Lokmat,https://www.lokmat.com/city/,37,साताऱ्याचे पोलीस अधीक्षक तुषार दोशी यांची बदली; एकूण ९ अधिकाऱ्यांच्या बदलीचे आदेश निघाले...,https://www.lokmat.com/maharashtra/maharashtra-ips-transfer-list-2026-satara-superintendent-of-police-tushar-doshi-transferred-orders-issued-for-transfer-of-a-total-of-9-officers-a-a607/,2026-05-02T10:57:07+00:00
Mumbai,Lokmat,Mumbai • Lokmat,https://www.lokmat.com/city/,38,"निविष्ठा विक्रीत अनियमितता; तीन कृषी सेवा केंद्रांचे परवाने निलंबित, पाच केंद्रांना नोटीसा",https://www.lokmat.com/akola/irregularities-in-input-sales-licenses-of-three-agricultural-service-centers-suspended-a-a597/,2026-05-02T10:57:07+00:00
Mumbai,Lokmat,Mumbai • Lokmat,https://www.lokmat.com/city/,39,"सूर्य कोपला, विदर्भात तापला! उष्णतेचा कहर; अकोल्यात देशातील सर्वाधिक ४६.९ अंश सेल्सिअस तापमान",https://www.lokmat.com/akola/heatwave-wreaks-havoc-in-vidarbha-akola-records-highest-temperature-in-the-country-over-the-46-plus-degrees-celsius-a-a653/,2026-05-02T10:57:07+00:00
Mumbai,Lokmat,Mumbai • Lokmat,https://www.lokmat.com/city/,40,"दातात पकडून चिमुकल्यावर अघोरी उपचार, अकोल्यातील धक्कादायक प्रकार, व्हिडीओ व्हायरल",https://www.lokmat.com/maharashtra/aghori-treatment-of-a-toddler-by-holding-him-by-the-teeth-shocking-incident-in-akola-video-goes-viral-a-a1012/,2026-05-02T10:57:07+00:00
Mumbai,Lokmat,Mumbai • Lokmat,https://www.lokmat.com/city/,41,"अकोला, वर्धा देशात सर्वाधिक ‘हॉट’; पार ४५ अंश सेल्सिअसवर पारा",https://www.lokmat.com/akola/akola-wardha-hottest-in-the-country-mercury-at-45-degrees-celsius-a-a1013/,2026-05-02T10:57:07+00:00
Mumbai,Lokmat,Mumbai • Lokmat,https://www.lokmat.com/city/,42,अकोल्यात उष्माघाताचा पहिला बळी? ४४ अंश तापमानाने घेतला जीव; ऑटोमध्ये आढळला मृतदेह,https://www.lokmat.com/akola/first-victim-of-heatstroke-in-akola-44-degree-temperature-claimed-his-life-body-found-in-auto-a-a941/,2026-05-02T10:57:07+00:00
Mumbai,Lokmat,Mumbai • Lokmat,https://www.lokmat.com/city/,43,सोलापुरात शेतीच्या वादातून तिहेरी हत्याकांड; दिराने भावजयीसह दोन पुतण्यांची केली निर्घृण हत्या,https://www.lokmat.com/solapur/triple-murder-in-solapu-man-kills-sister-in-law-and-two-nephews-over-land-dispute-a-a311-c1001/,2026-05-02T10:57:07+00:00
Mumbai,Lokmat,Mumbai • Lokmat,https://www.lokmat.com/city/,44,जनगणना २०२७: सोलापूरकरांसाठी मोठी संधी; आता घरबसल्या करा स्वतःची ‘स्व-गणना’,https://www.lokmat.com/solapur/census-2027-big-opportunity-for-solapur-residents-now-do-your-own-self-enumeration-from-home-a-a653/,2026-05-02T10:57:07+00:00
Mumbai,Lokmat,Mumbai • Lokmat,https://www.lokmat.com/city/,45,इंटरसिटी २ तर सिद्धेश्वर एक्स्प्रेसला ७ तासांचा उशीर; लांब पल्ल्यांच्या गाड्यांचे वेळापत्रक कोलमडले,https://www.lokmat.com/solapur/intercity-2-and-siddheshwar-express-delayed-by-7-hours-schedule-of-long-distance-trains-disrupted-a-a597/,2026-05-02T10:57:07+00:00
Mumbai,Lokmat,Mumbai • Lokmat,https://www.lokmat.com/city/,46,"जिल्हाधिकाऱ्यांचा साधेपणा; पायी चालत जात मंदिर गाठलं, विठ्ठलाचं दर्शन करून केली पाहणी",https://www.lokmat.com/solapur/solapur-collector-karthikeyan-s-walks-to-vitthal-temple-to-inspect-ashadhi-wari-preparations-a-a311-c1001/,2026-05-02T10:57:07+00:00
Mumbai,Lokmat,Mumbai • Lokmat,https://www.lokmat.com/city/,47,मुंबईत 'त्या' हॉटेलमध्ये भरायचा ‘व्हीआयपी’ दरबार; मनोहरमामाच्या भक्तांची यादी पोलिसांच्या रडारवर,https://www.lokmat.com/solapur/manohar-bhosale-has-been-holding-court-in-mumbai-for-vip-devotees-a-a1001/,2026-05-02T10:57:07+00:00
Mumbai,Lokmat,Mumbai • Lokmat,https://www.lokmat.com/city/,48,"राहता तालुक्यात गर्भलिंग निदान तपासणी, एका घरावर छापा; डॉक्टरसह एजंट ताब्यात",https://www.lokmat.com/ahilyanagar/fetal-sex-determination-test-in-rahata-taluka-raid-on-a-house-agent-along-with-doctor-detained-a-a597/,2026-05-02T10:57:07+00:00
Mumbai,Lokmat,Mumbai • Lokmat,https://www.lokmat.com/city/,49,आमदार संजय गायकवाड यांच्याविरोधात 'वंचित' आक्रमक! शेवगावात धडकला भव्य मोर्चा; गुन्हा दाखल करण्याची मागणी,https://www.lokmat.com/ahilyanagar/deprived-aggressive-against-mla-sanjay-gaikwad-massive-march-in-shevgaon-demand-to-register-a-case-a-a941/,2026-05-02T10:57:07+00:00
Mumbai,Lokmat,Mumbai • Lokmat,https://www.lokmat.com/city/,50,हमाल ते भोंदू बाबा... पेढ्यातून गुंगीचं औषध देऊन महिलेवर अत्याचार; आजारपणाचा घेतला गैरफायदा,https://www.lokmat.com/ahilyanagar/self-styled-godman-arrested-in-shrirampur-for-raping-woman-and-fraud-of-20-lakh-a-a1001/,2026-05-02T10:57:07+00:00
Mumbai,Lokmat,Mumbai • Lokmat,https://www.lokmat.com/city/,51,आश्रमात २०० व्हिडिओ आणि ९० औषधांची सॅम्पल्स; भोंदू राजेंद्र गडगेच्या उपचाराने बरे वाटणाऱ्यांची होणार चौकशी,https://www.lokmat.com/ahilyanagar/police-seize-200-videos-and-90-drug-samples-from-self-styled-godman-rajendra-gadge-ashram-a-a1001/,2026-05-02T10:57:07+00:00
