city,publisher,source,source_url,rank,headline,link,collected_at_iso
Bengaluru,DC,Bengaluru • DC,https://www.deccanchronicle.com/location/india/karnataka/bengaluru,1,FIFA World Cup 2026,https://www.deccanchronicle.com/fifa-world-cup-2026,2026-07-06T15:46:24+00:00
Bengaluru,DC,Bengaluru • DC,https://www.deccanchronicle.com/location/india/karnataka/bengaluru,2,Opinion and Editorials,https://www.deccanchronicle.com/opinion,2026-07-06T15:46:24+00:00
Bengaluru,DC,Bengaluru • DC,https://www.deccanchronicle.com/location/india/karnataka/bengaluru,3,Assembly Elections 2026,https://www.deccanchronicle.com/assembly-elections-2026,2026-07-06T15:46:24+00:00
Bengaluru,DC,Bengaluru • DC,https://www.deccanchronicle.com/location/india/karnataka/bengaluru,4,Telangana Rising 2047,https://www.deccanchronicle.com/tags/Telangana-Rising-2047,2026-07-06T15:46:24+00:00
Mumbai,Mumbai Mirror,Mumbai • Mumbai Mirror,https://mumbaimirror.indiatimes.com/mumbai,1,The beauty contest called investing,https://mumbaimirror.indiatimes.com/opinion/the-beauty-contest-called-investing/articleshow/132199887.html,2026-07-06T15:46:24+00:00
Mumbai,Mumbai Mirror,Mumbai • Mumbai Mirror,https://mumbaimirror.indiatimes.com/mumbai,2,A hole lot of trouble,https://mumbaimirror.indiatimes.com/mumbai/a-hole-lot-of-trouble/articleshow/132201227.html,2026-07-06T15:46:24+00:00
Mumbai,Mumbai Mirror,Mumbai • Mumbai Mirror,https://mumbaimirror.indiatimes.com/mumbai,3,How TET leak was built,https://mumbaimirror.indiatimes.com/mumbai/how-tet-leak-was-built/articleshow/132201713.html,2026-07-06T15:46:24+00:00
Mumbai,Mumbai Mirror,Mumbai • Mumbai Mirror,https://mumbaimirror.indiatimes.com/mumbai,4,Beware of the water,https://mumbaimirror.indiatimes.com/opinion/beware-of-the-water/articleshow/132199885.html,2026-07-06T15:46:24+00:00
Mumbai,Mumbai Mirror,Mumbai • Mumbai Mirror,https://mumbaimirror.indiatimes.com/mumbai,5,Sarnaik vs Mehta,https://mumbaimirror.indiatimes.com/mumbai/sarnaik-vs-mehta/articleshow/132201372.html,2026-07-06T15:46:24+00:00
Mumbai,Mumbai Mirror,Mumbai • Mumbai Mirror,https://mumbaimirror.indiatimes.com/mumbai,6,Concrete (killed the) jungle,https://mumbaimirror.indiatimes.com/mumbai/cover-story/concrete-killed-the-jungle/articleshow/132201916.html,2026-07-06T15:46:24+00:00
Mumbai,Mumbai Mirror,Mumbai • Mumbai Mirror,https://mumbaimirror.indiatimes.com/mumbai,7,"Ambadas Danve, 5 others acquitted in 2023 Churchgate protest case",https://mumbaimirror.indiatimes.com/mumbai/ambadas-danve-5-others-acquitted-in-2023-churchgate-protest-case/articleshow/132199881.html,2026-07-06T15:46:24+00:00
Mumbai,Mumbai Mirror,Mumbai • Mumbai Mirror,https://mumbaimirror.indiatimes.com/mumbai,8,Ask The Sexpert,https://mumbaimirror.indiatimes.com/ask-the-sexpert,2026-07-06T15:46:24+00:00
Mumbai,Sakal,Mumbai • Sakal,https://www.esakal.com/pune,1,सकाळ लाईव्ह TV,https://www.esakal.com/live-tv,2026-07-06T15:46:24+00:00
Mumbai,Sakal,Mumbai • Sakal,https://www.esakal.com/pune,2,Refund and Cancellation,https://www.esakal.com/refund-and-cancellation,2026-07-06T15:46:24+00:00
Mumbai,Lokmat,Mumbai • Lokmat,https://www.lokmat.com/city/,1,Live News in Marathi,https://www.lokmat.com/live-news/,2026-07-06T15:46:24+00:00
Mumbai,Lokmat,Mumbai • Lokmat,https://www.lokmat.com/city/,2,"LIVE: महाराष्ट्रात अतिवृष्टीमुळे १३ जणांचा मृत्यू, सरकारने दिले चौकशी करण्याचे आदेश",https://www.lokmat.com/maharashtra/maharashtra-marathi-news-live-updates-6-july-2026-rain-alert-in-mumbai-thane-navi-mumbai-palghar-mumbai-pune-express-way-landslide-missing-link-video-imd-alert-pm-narendra-modi-cm-devendra-fadnavis-ayatollah-ali-khamenei-funeral-vidhan-sabha-a-a573/,2026-07-06T15:46:24+00:00
Mumbai,Lokmat,Mumbai • Lokmat,https://www.lokmat.com/city/,3,"मुसळधार पाऊस, वाहतूक ठप्प; देहू-आळंदीत वारकऱ्यांनी येऊ नये, देवस्थांनांचे आवाहन",https://www.lokmat.com/pune/heavy-rains-traffic-jam-warkaris-should-not-come-to-dehu-alandi-appeal-to-devasthanams-a-a727/,2026-07-06T15:46:24+00:00
Mumbai,Lokmat,Mumbai • Lokmat,https://www.lokmat.com/city/,4,"आळंदीत इंद्रायणीला महापूर; जनजीवन विस्कळीत, माऊलींचा पालखी प्रस्थान सोहळा वेळेतच होणार",https://www.lokmat.com/pune/indrayani-floods-in-alandi-normal-life-disrupted-maulis-palanquin-departure-ceremony-will-be-held-on-time-a-a727/,2026-07-06T15:46:24+00:00
Mumbai,Lokmat,Mumbai • Lokmat,https://www.lokmat.com/city/,5,अतिवृष्टीचा धोका कायम! मुंबईसह 'या' जिल्ह्यांना रेड अलर्ट; IMD कडून सतर्कतेचा इशारा,https://www.lokmat.com/mumbai/imd-alert-mumbai-risk-of-heavy-rain-continues-red-alert-for-these-districts-including-mumbai-imd-warns-of-caution-a-a571/,2026-07-06T15:46:24+00:00
Mumbai,Lokmat,Mumbai • Lokmat,https://www.lokmat.com/city/,6,मानखुर्द दुर्घटनेप्रकरणी गुन्हा दाखल; सुरक्षितता न पाळता अनधिकृत चार मजली इमारतीचे बांधकाम,https://www.lokmat.com/crime/case-registered-in-mankhurd-accident-case-construction-of-unauthorized-four-storey-building-without-following-safety-precautions-a-a719/,2026-07-06T15:46:24+00:00
Mumbai,Lokmat,Mumbai • Lokmat,https://www.lokmat.com/city/,7,हार्बर रेल्वे मार्गावर वाहतूक २५ मिनिटं खोळंबली... ओव्हरहेड वायरवर झाडाची फांदी कोसळली!,https://www.lokmat.com/mumbai/mumbai-local-updates-tree-branches-fell-near-gtb-nagar-station-on-the-harbour-line-services-restored-after-25-minutes-a-a747/,2026-07-06T15:46:24+00:00
Mumbai,Lokmat,Mumbai • Lokmat,https://www.lokmat.com/city/,8,"पावसाचा एसटी वाहतुकीला फटका; मुंबई, ठाणे, रायगड, पालघरमधील अनेक मार्ग बंद; मुंबई सेंट्रल मुख्यालयात कंट्रोल रूम स्थापन",https://www.lokmat.com/mumbai/rains-hit-st-traffic-many-routes-in-mumbai-thane-raigad-palghar-closed-control-room-set-up-at-mumbai-central-headquarters-a-a653/,2026-07-06T15:46:24+00:00
Mumbai,Lokmat,Mumbai • Lokmat,https://www.lokmat.com/city/,9,"""ज्यांनी एक पूल बांधला नाही, ते प्रश्न विचारतायत""; मिसिंग लिंकवरून विरोधकांना CM फडणवीसांचे प्रत्युत",https://www.lokmat.com/mumbai/missing-link-row-cm-fadnavis-hits-back-at-opposition-terms-pune-mumbai-missing-link-an-engineering-marvel-a-a1001/,2026-07-06T15:46:24+00:00
Mumbai,Lokmat,Mumbai • Lokmat,https://www.lokmat.com/city/,10,Vidarbha Rain : विदर्भात पावसाचा लपंडाव; 'या' जिल्ह्यांना मुसळधार पावसाचा ऑरेंज अलर्ट,https://www.lokmat.com/nagpur/vidarbha-rain-rain-in-vidarbha-orange-alert-for-heavy-rain-in-these-districts-a-a957-c1000/,2026-07-06T15:46:24+00:00
Mumbai,Lokmat,Mumbai • Lokmat,https://www.lokmat.com/city/,11,IIM नागपूर आता पुण्यात; ७० एकरांवर उभा राहणार अत्याधुनिक कॅम्पस!,https://www.lokmat.com/nagpur/iim-nagpur-now-in-pune-state-of-the-art-campus-to-be-built-on-70-acres-a-a1000/,2026-07-06T15:46:24+00:00
Mumbai,Lokmat,Mumbai • Lokmat,https://www.lokmat.com/city/,12,स्मार्ट मीटरवर सोशल मीडियातील दावे खरे की खोटे? महावितरण देणार स्पष्टीकरण,https://www.lokmat.com/nagpur/social-media-claims-on-smart-meters-true-or-false-mahavitaran-will-provide-clarification-a-a1000/,2026-07-06T15:46:24+00:00
Mumbai,Lokmat,Mumbai • Lokmat,https://www.lokmat.com/city/,13,प्राध्यापक भरती परीक्षेसाठी मुंबईची वारी कशाला? नागपुरात केंद्र देण्याची मुख्यमंत्र्यांकडे मागणी,https://www.lokmat.com/nagpur/why-travel-to-mumbai-for-the-professor-recruitment-exam-demand-to-the-chief-minister-to-set-up-a-center-in-nagpur-a-a1000/,2026-07-06T15:46:24+00:00
Mumbai,Lokmat,Mumbai • Lokmat,https://www.lokmat.com/city/,14,"दीक्षाभूमी स्मारक समितीतून डॉ. राजेंद्र गवई, विलास गजघाटे यांची हकालपट्टी",https://www.lokmat.com/nagpur/dr-rajendra-gavai-vilas-gajghate-expelled-from-deekshabhoomi-memorial-committee-a-a876-c1000/,2026-07-06T15:46:24+00:00
Mumbai,Lokmat,Mumbai • Lokmat,https://www.lokmat.com/city/,15,"हवामान विभागाचा ढगफुटीचा इशारा, वनविभागाकडून त्र्यंबकेश्वरमधील पर्यटनस्थळांवर बंदी",https://www.lokmat.com/nashik/meteorological-department-warns-of-cloudburst-forest-department-bans-tourist-spots-in-trimbakeshwar-a-a653/,2026-07-06T15:46:24+00:00
Mumbai,Lokmat,Mumbai • Lokmat,https://www.lokmat.com/city/,16,"नाशिकमध्ये ढगफुटीची शक्यता, यंत्रणा अलर्ट; मुख्यमंत्र्यांची माहिती, ८ जुलैपर्यंत पावसाचा इशारा",https://www.lokmat.com/maharashtra/maharashtra-rain-update-possibility-of-cloudburst-in-nashik-system-alert-cm-devendra-fadnvais-information-rain-warning-till-july-8-a-a629/,2026-07-06T15:46:24+00:00
Mumbai,Lokmat,Mumbai • Lokmat,https://www.lokmat.com/city/,17,"महाराष्ट्रातील अधिकाऱ्याच्या घरी सापडला कुबेराचा खजिना; ५२ हजारांचे झाले ५ कोटी, CBI हैराण",https://www.lokmat.com/crime/the-cbi-has-exposed-a-major-corruption-case-involving-ajay-kumar-a-former-ceo-of-the-deolali-cantonment-board-a-a629/,2026-07-06T15:46:24+00:00
Mumbai,Lokmat,Mumbai • Lokmat,https://www.lokmat.com/city/,18,आतातरी शेतकरी सरकारी गोदामे भरणार? केंद्राने कांदा खरेदीसाठी महिनाभरात पाचव्यांदा दर वाढविले...,https://www.lokmat.com/national/onion-price-hike-will-government-godowns-be-filled-now-the-center-has-increased-the-price-of-onion-procurement-for-the-fifth-time-in-a-month-a-a607/,2026-07-06T15:46:24+00:00
Mumbai,Lokmat,Mumbai • Lokmat,https://www.lokmat.com/city/,19,कुंभमेळ्याच्या निविदा प्रक्रियेतील भ्रष्टाचाराची उच्चस्तरीय चौकशी करणार : शिवेंद्रराजे भोसले,https://www.lokmat.com/nashik/high-level-inquiry-will-be-conducted-into-corruption-in-the-kumbh-mela-tender-process-shivendraraje-bhosale-a-a301/,2026-07-06T15:46:24+00:00
Mumbai,Lokmat,Mumbai • Lokmat,https://www.lokmat.com/city/,20,Satara News: बनावट नोटा खपविण्यात सरपंच रमले; पण पोलिसांनी पकडल्यानंतर नमले!,https://www.lokmat.com/satara/sarpanch-of-ural-village-in-patan-involved-in-circulating-counterfeit-notes-a-a746/,2026-07-06T15:46:24+00:00
Mumbai,Lokmat,Mumbai • Lokmat,https://www.lokmat.com/city/,21,बनावट बिलांद्वारे जीएसटीला १० कोटी ५७ लाखांचा गंडा; सहा बोगस कंपन्यांचा मालक कल्पेश कुंभार अटकेत,https://www.lokmat.com/kolhapur/gst-fraud-worth-10-crore-via-fake-bills-kalpesh-kumbhar-owner-of-six-bogus-companies-arrested-in-kolhapur-a-a746/,2026-07-06T15:46:24+00:00
Mumbai,Lokmat,Mumbai • Lokmat,https://www.lokmat.com/city/,22,आंबोलीत निसर्गाचा पांढराशुभ्र नजराणा; वीकेंडला पर्यटकांची गर्दी,https://www.lokmat.com/sindhudurga/ambolis-natural-beauty-enhanced-by-heavy-rainfall-crowd-of-tourists-as-the-waterfall-comes-alive-a-a746/,2026-07-06T15:46:24+00:00
Mumbai,Lokmat,Mumbai • Lokmat,https://www.lokmat.com/city/,23,Cyber Crime: अधिकाऱ्याचे व्हॉट्सॲप हॅक करून कोल्हापुरात ८० लाखांचा गंडा,https://www.lokmat.com/kolhapur/rs-80-lakhs-embezzled-in-kolhapur-by-hacking-official-whatsapp-a-a746/,2026-07-06T15:46:24+00:00
Mumbai,Lokmat,Mumbai • Lokmat,https://www.lokmat.com/city/,24,"पावसाचा जोर; कोल्हापूर जिल्ह्यातील ८८ गावे ‘हाय रिस्क’वर, भूस्खलनाचे संकट, यंत्रणा सतर्क मोडवर",https://www.lokmat.com/kolhapur/landslide-threat-looms-over-88-villages-in-kolhapur-district-due-to-intensifying-rainfall-a-a818-c746/,2026-07-06T15:46:24+00:00
Mumbai,Lokmat,Mumbai • Lokmat,https://www.lokmat.com/city/,25,Sangli News: दुखापतीवर मात करत समृद्धी पाटीलचे आशियाई कुस्तीत 'सुवर्ण' यश,https://www.lokmat.com/sangli/samruddhi-patil-from-sangli-district-won-the-gold-medal-in-the-33-kg-weight-category-at-the-asian-wrestling-championship-held-in-thailand-a-a746/,2026-07-06T15:46:24+00:00
Mumbai,Lokmat,Mumbai • Lokmat,https://www.lokmat.com/city/,26,"Rain in Sangli: मांगले–सावर्डे बंधाऱ्याला जोडणारा रस्ता गेला वाहून; वाहतूक बंद, शिराळ्यात सर्वाधिक पाऊस",https://www.lokmat.com/sangli/road-connecting-the-mangle-savarde-weir-washed-away-traffic-halted-shirala-in-sangli-district-records-highest-rainfall-a-a468-c746/,2026-07-06T15:46:24+00:00
Mumbai,Lokmat,Mumbai • Lokmat,https://www.lokmat.com/city/,27,"Sangli: ईश्वरपुरात भरवस्तीत बिबट्याचा धुमाकूळ; दोघांना किरकोळ इजा, सुदैवाने जीवितहानी नाही",https://www.lokmat.com/sangli/leopard-creates-havoc-in-a-densely-populated-area-of-islampur-sangli-two-sustain-minor-injuries-a-a746/,2026-07-06T15:46:24+00:00
Mumbai,Lokmat,Mumbai • Lokmat,https://www.lokmat.com/city/,28,सायबर चोरट्यांचे ‘लक्ष्य’ आता कंपन्या; व्हॉट्सॲपवर फेक मेसेज पाठवून सांगलीत कंपनीची दीड कोटीची फसवणूक,https://www.lokmat.com/sangli/companies-are-now-the-target-of-cyber-thieves-a-company-in-sangli-was-defrauded-of-rs-1-crore-by-sending-fake-messages-on-whatsapp-a-a746/,2026-07-06T15:46:24+00:00
Mumbai,Lokmat,Mumbai • Lokmat,https://www.lokmat.com/city/,29,Sangli Crime: लाजिरेवाणे कृत्य; मिरजेत तरुणाने शेळीवर केला अत्याचार,https://www.lokmat.com/sangli/a-shocking-incident-has-come-to-light-in-miraj-where-a-young-man-sexually-assaulted-a-goat-a-a746/,2026-07-06T15:46:24+00:00
Mumbai,Lokmat,Mumbai • Lokmat,https://www.lokmat.com/city/,30,विधानभवनात प्रति नरेंद्र मोदी अन् मंत्री शिवेंद्रसिंहराजे भोसले आमनेसामने!,https://www.lokmat.com/satara/photos-of-a-meeting-between-minister-shivendrasinhraje-bhosale-and-a-person-who-bears-a-striking-resemblance-to-prime-minister-narendra-modi-at-the-vidhan-bhavan-have-gone-viral-on-social-media-a-a746/,2026-07-06T15:46:24+00:00
Mumbai,Lokmat,Mumbai • Lokmat,https://www.lokmat.com/city/,31,"सातारा जिल्ह्यात पावसाचा जोर कायम, कोयना धरणात ४४ हजार क्युसेक आवक",https://www.lokmat.com/satara/heavy-rain-continues-in-satara-district-44-thousand-cusecs-inflow-in-koyna-dam-a-a746/,2026-07-06T15:46:24+00:00
Mumbai,Lokmat,Mumbai • Lokmat,https://www.lokmat.com/city/,32,"Satara: महाबळेश्वरवाडी सेवा सोसायटी गैरव्यवहारप्रकरणी गुन्हे नोंदवणार, सहकार राज्यमंत्र्यांचे आदेश",https://www.lokmat.com/satara/mahabaleshwarwadi-sewa-society-will-register-cases-of-corruption-orders-from-minister-of-state-for-cooperation-a-a746/,2026-07-06T15:46:24+00:00
Mumbai,Lokmat,Mumbai • Lokmat,https://www.lokmat.com/city/,33,नद्यांवर पूल जुने; पण धोके नवे; पावसाळ्यात सातारा जिल्ह्यावर निर्माण होते नैसर्गिक आपत्तीचे सावट,https://www.lokmat.com/satara/bridges-in-satara-district-that-have-crossed-the-100-year-mark-are-dangerous-a-a746/,2026-07-06T15:46:24+00:00
Mumbai,Lokmat,Mumbai • Lokmat,https://www.lokmat.com/city/,34,काँग्रेस नगरसेविका पतीवर भरदिवसा चाकू हल्ला; उपचारादरम्यान मृत्यू,https://www.lokmat.com/akola/congress-corporators-husband-attacked-with-knife-in-broad-daylight-dies-during-treatment-a-a607/,2026-07-06T15:46:24+00:00
Mumbai,Lokmat,Mumbai • Lokmat,https://www.lokmat.com/city/,35,विनापरवाना बियाणे साठ्यावर कृषी विभागाचा छापा; २०.६० लाखांचा मुद्देमाल जप्त,https://www.lokmat.com/akola/agriculture-department-raids-unlicensed-seed-stock-goods-worth-rs-20-lakh-60-thousands-seized-a-a653/,2026-07-06T15:46:24+00:00
Mumbai,Lokmat,Mumbai • Lokmat,https://www.lokmat.com/city/,36,अकोल्यात रिलायन्स प्लांट परिसरात आगीचे तांडव; धुराच्या लोटांनी आसमंत काळवंडले,https://www.lokmat.com/akola/fire-breaks-out-in-reliance-plant-area-smoke-billows-into-the-sky-incident-on-akola-nanded-road-a-a747/,2026-07-06T15:46:24+00:00
Mumbai,Lokmat,Mumbai • Lokmat,https://www.lokmat.com/city/,37,"शिंदेसेनेच्या अकोला जिल्हाप्रमुख, महानगरप्रमुखांच्या नियुक्त्या जाहीर",https://www.lokmat.com/akola/appointments-of-shinde-senas-akola-district-chief-and-metropolitan-chief-announced-a-a941/,2026-07-06T15:46:24+00:00
Mumbai,Lokmat,Mumbai • Lokmat,https://www.lokmat.com/city/,38,"Akola: अधिक मासातील धार्मिक स्नान ठरले अखेरचे; मुलगाा बुडायला लागला, आईने उडी मारली; दोघांचाही नदीत बुडून मृत्यू",https://www.lokmat.com/akola/akola-religious-bath-in-the-rainy-season-turned-out-to-be-the-last-mother-and-daughter-drowned-in-the-river-while-saving-their-child-a-a571/,2026-07-06T15:46:24+00:00
Mumbai,Lokmat,Mumbai • Lokmat,https://www.lokmat.com/city/,39,"भोंदू मनोहर भोसलेकडे अफाट 'माया'; २० बँक खात्यांमध्ये ३ कोटींची रोकड, २५ एकर जमीन अन् फ्लॅट",https://www.lokmat.com/solapur/sit-investigation-reveals-that-the-fraudulent-manohar-bhosale-holds-over-3-crore-across-20-bank-accounts-a-a1001/,2026-07-06T15:46:24+00:00
Mumbai,Lokmat,Mumbai • Lokmat,https://www.lokmat.com/city/,40,"'शारीरिक संबंध ठेवा तरच दाजी बरे होतील'; मनोहरमामाचा महिलेवर अत्याचार, सहावा गुन्हा दाखल",https://www.lokmat.com/solapur/fraud-godman-manohar-bhosle-booked-for-rape-sixth-case-registered-against-him-a-a1001/,2026-07-06T15:46:24+00:00
Mumbai,Lokmat,Mumbai • Lokmat,https://www.lokmat.com/city/,41,भोंदूबाबा मनोहर मामा भोसलेविरुद्ध करमाळ्यात ६ वा गुन्हा दाखल; अश्लील कृत्य आणि महिलांवर लैंगिक अत्या,https://www.lokmat.com/solapur/6th-case-registered-against-bhondubaba-manohar-mama-bhosale-in-karmala-obscene-acts-and-sexual-assault-on-women-a-a941/,2026-07-06T15:46:24+00:00
Mumbai,Lokmat,Mumbai • Lokmat,https://www.lokmat.com/city/,42,एकनाथ शिंदेंची प्रकृती कशी आहे? आरोग्यमंत्र्यांनी पंढरपुरात दिली महत्त्वाची अपडेट,https://www.lokmat.com/maharashtra/eknath-shinde-health-update-how-is-eknath-shindes-health-health-minister-gave-an-important-update-in-pandharpur-a-a607/,2026-07-06T15:46:24+00:00
Mumbai,Lokmat,Mumbai • Lokmat,https://www.lokmat.com/city/,43,व्हीआयपी प्रोटोकॉल बाजूला ठेवून थेट सुनेत्रा पवार वारकऱ्यांच्या पंगतीत,https://www.lokmat.com/solapur/leaving-vip-protocol-aside-sunetra-pawar-joins-the-ranks-of-the-warkari-pandharpur-a-a311-c607/,2026-07-06T15:46:24+00:00
Mumbai,Lokmat,Mumbai • Lokmat,https://www.lokmat.com/city/,44,"'माहिती अधिकारातील बदल रद्द न झाल्यास पुन्हा जनआंदोलन करणार', अण्णा हजारे यांचा सरकारला इशारा",https://www.lokmat.com/ahilyanagar/will-launch-another-mass-movement-if-changes-in-right-to-information-are-not-repealed-anna-hazare-warns-government-a-a571/,2026-07-06T15:46:24+00:00
Mumbai,Lokmat,Mumbai • Lokmat,https://www.lokmat.com/city/,45,"बैल नाही, ट्रॅक्टरही नाही; माणसेच ओढताहेत पाभर !",https://www.lokmat.com/maharashtra/no-bulls-no-tractors-only-people-are-pulling-the-cart-a-a301/,2026-07-06T15:46:24+00:00
Mumbai,Lokmat,Mumbai • Lokmat,https://www.lokmat.com/city/,46,"आंबित धरण भरले; मुळाही प्रवाही, बळीराजा सुखावला, भात रोपांना संजीवनी",https://www.lokmat.com/maharashtra/ambit-dam-filled-radish-also-flowing-baliraja-is-happy-rice-plants-are-revived-farmers-are-happy-due-to-heavy-rains-a-a301/,2026-07-06T15:46:24+00:00
Mumbai,Lokmat,Mumbai • Lokmat,https://www.lokmat.com/city/,47,"एसटी पार्सल सेवा राज्यभर ठप्प, कंत्राटदाराचा परवाना अचानक रद्द; ग्राहक अडचणीत, व्यापाऱ्यांमध्ये संताप",https://www.lokmat.com/maharashtra/st-parcel-service-halted-across-the-state-contractors-license-suddenly-cancelled-customers-in-trouble-traders-angry-a-a607/,2026-07-06T15:46:24+00:00
Mumbai,Lokmat,Mumbai • Lokmat,https://www.lokmat.com/city/,48,अहिल्यानगर शहरात शिवसैनिक आक्रमक; बंडखोर खासदारांच्या प्रतिमेला जोडे मारो आंदोलन,https://www.lokmat.com/ahilyanagar/shiv-sainiks-aggressive-in-ahilyanagar-city-protest-to-tie-up-the-image-of-rebel-mps-a-a629/,2026-07-06T15:46:24+00:00
Mumbai,Lokmat,Mumbai • Lokmat,https://www.lokmat.com/city/,49,"भूसंपादन फाईल गहाळ, पोलिसांकडून जळगाव महापालिकेत पंचनामा; प्रकरण काय?",https://www.lokmat.com/jalgaon/jalgaon-news-land-acquisition-file-missing-police-submit-panchnama-to-jalgaon-municipal-corporation-what-is-the-matter-a-a571/,2026-07-06T15:46:24+00:00
Mumbai,Lokmat,Mumbai • Lokmat,https://www.lokmat.com/city/,50,"डोक्यात टाकली लोखंडी पट्टी, भुसावळात रेल्वे कर्मचाऱ्याचा खून; सात दिवसात दुसरा खून",https://www.lokmat.com/jalgaon/iron-bar-thrown-at-head-railway-employee-murdered-in-bhusawal-second-murder-in-seven-days-a-a571/,2026-07-06T15:46:24+00:00
