city,publisher,source,source_url,rank,headline,link,collected_at_iso
Lucknow,IE,Lucknow • IE,https://indianexpress.com/section/cities/lucknow/,73,"Djokovic vs Sinner LIVE Streaming, Wimbledon 2026 SF: Head-to-head record, live streaming info",https://indianexpress.com/article/sports/tennis/djokovic-vs-sinner-wimbledon-2026-semifinal-live-streaming-10780247/,2026-07-10T11:10:36+00:00
Lucknow,IE,Lucknow • IE,https://indianexpress.com/section/cities/lucknow/,74,Knowledge Nugget: What is Operation ‘Hardball’ and what are Interpol Notices?,https://indianexpress.com/article/upsc-current-affairs/upsc-essentials/knowledge-nugget-operation-hardball-fbi-interpol-brar-bishnoi-upsc-10780447/,2026-07-10T11:10:36+00:00
Lucknow,IE,Lucknow • IE,https://indianexpress.com/section/cities/lucknow/,75,"Big Hit Music denies plagiarism claims against BTS’ ‘Swim’, promises legal response",https://indianexpress.com/article/entertainment/korean/big-hit-music-denies-plagiarism-claims-against-bts-swim-promises-legal-response-10780479/,2026-07-10T11:10:36+00:00
Lucknow,IE,Lucknow • IE,https://indianexpress.com/section/cities/lucknow/,76,Just 3 shots a year: Questions you must ask doctor before switching to cholesterol injections,https://indianexpress.com/article/lifestyle/health/cholesterol-lowering-injections-who-needs-them-how-do-they-work-10762567/,2026-07-10T11:10:36+00:00
Lucknow,IE,Lucknow • IE,https://indianexpress.com/section/cities/lucknow/,77,"As Ayodhya seeks a CEO devoted to Ram, Maharashtra mandates the same for trustees of Ramtek temple",https://indianexpress.com/article/cities/mumbai/ayodhya-ceo-ram-maharashtra-trustees-ramtek-temple-10780528/,2026-07-10T11:10:36+00:00
Lucknow,IE,Lucknow • IE,https://indianexpress.com/section/cities/lucknow/,78,"Dhamaal 4 post-credit scene confirms Dhamaal 5 with Farhad Samji, sparks mixed reactions",https://indianexpress.com/article/entertainment/bollywood/dhamaal-4-post-credit-scene-confirms-dhamaal-5-with-farhad-samji-sparks-mixed-reactions-10780364/,2026-07-10T11:10:36+00:00
Lucknow,IE,Lucknow • IE,https://indianexpress.com/section/cities/lucknow/,79,"In Karur, Vijay returned to the wound, governance and a side of ‘kothu parotta’",https://indianexpress.com/article/political-pulse/karur-stampede-vijay-speech-jobs-memorial-dmk-10780501/,2026-07-10T11:10:36+00:00
Lucknow,IE,Lucknow • IE,https://indianexpress.com/section/cities/lucknow/,80,Karnataka bitcoin scam: SIT closes cases against cops after prosecution nod denied,https://indianexpress.com/article/cities/bangalore/karnataka-bitcoin-scam-sit-closes-cases-against-cops-after-prosecution-nod-denied-10780454/,2026-07-10T11:10:36+00:00
Lucknow,IE,Lucknow • IE,https://indianexpress.com/section/cities/lucknow/,81,Expert Explains | How Turkey emerged as a winner from a fractious NATO summit,https://indianexpress.com/article/explained/explained-global/nato-ankara-summit-turkey-trump-erdogan-10780495/,2026-07-10T11:10:36+00:00
Lucknow,IE,Lucknow • IE,https://indianexpress.com/section/cities/lucknow/,82,"Offering pure petrol, E10 not feasible; E20 fuel is superior, cleaner: Centre",https://indianexpress.com/article/business/government-rejects-e20-petrol-backlash-logistics-pure-petrol-india-10780500/,2026-07-10T11:10:36+00:00
Lucknow,IE,Lucknow • IE,https://indianexpress.com/section/cities/lucknow/,83,"Airbags fail to deploy during crash, car manufacturer ordered to pay Rs 4.1 lakh",https://indianexpress.com/article/legal-news/airbags-to-during-crash-car-manufacturer-to-pay-rs-4-1-lakh-10780287/,2026-07-10T11:10:36+00:00
Lucknow,IE,Lucknow • IE,https://indianexpress.com/section/cities/lucknow/,84,New IRCTC website beta version to launch soon: 4 major changes for faster ticket booking,https://indianexpress.com/article/india/railways-new-irctc-website-beta-4-major-changes-faster-ticket-booking-10780465/,2026-07-10T11:10:36+00:00
Lucknow,IE,Lucknow • IE,https://indianexpress.com/section/cities/lucknow/,85,"‘I’m on every hit list’: Israel shared intelligence on alleged Iran assassination plot against Trump, say reports",https://indianexpress.com/article/world/israel-intelligence-us-iran-new-assassination-plot-donald-trump-10780283/,2026-07-10T11:10:36+00:00
Lucknow,IE,Lucknow • IE,https://indianexpress.com/section/cities/lucknow/,86,Changing City: Mumbai’s 1.2-km Dindoshi-Film City flyover to open by September,https://indianexpress.com/article/cities/mumbai/mumbai-dindoshi-film-city-flyover-september-opening-route-cost-10780394/,2026-07-10T11:10:36+00:00
Lucknow,IE,Lucknow • IE,https://indianexpress.com/section/cities/lucknow/,87,"Govinda shows bullet on Lock Upp, jokes about Sunita Ahuja wanting to shoot him in chest",https://indianexpress.com/article/entertainment/bollywood/govinda-shows-bullet-on-lock-upp-jokes-about-sunita-ahuja-wanting-to-shoot-him-in-chest-10780084/,2026-07-10T11:10:36+00:00
Lucknow,IE,Lucknow • IE,https://indianexpress.com/section/cities/lucknow/,88,Newsletters ( opens in a new tab ),https://indianexpress.com/newsletters/,2026-07-10T11:10:36+00:00
Lucknow,IE,Lucknow • IE,https://indianexpress.com/section/cities/lucknow/,89,26/11 Stories of Strength ( opens in a new tab ),https://indianexpress.com/26-11/,2026-07-10T11:10:36+00:00
Lucknow,IE,Lucknow • IE,https://indianexpress.com/section/cities/lucknow/,90,Statutory provisions on reporting (sexual offenses),https://indianexpress.com/article/what-is/what-is-the-protection-of-children-from-sexual-offences-act-2012/,2026-07-10T11:10:36+00:00
Bhopal,Bhaskar,Bhopal • Bhaskar,https://www.bhaskar.com/local/mp/bhopal/,1,जॉब - एजुकेशन,https://www.bhaskar.com/career/,2026-07-10T11:10:36+00:00
Bhopal,Bhaskar,Bhopal • Bhaskar,https://www.bhaskar.com/local/mp/bhopal/,2,फेक न्यूज एक्सपोज़,https://www.bhaskar.com/no-fake-news/,2026-07-10T11:10:36+00:00
Bhopal,Bhaskar,Bhopal • Bhaskar,https://www.bhaskar.com/local/mp/bhopal/,3,लाइफ - साइंस,https://www.bhaskar.com/happylife/,2026-07-10T11:10:36+00:00
Bhopal,Bhaskar,Bhopal • Bhaskar,https://www.bhaskar.com/local/mp/bhopal/,4,"जनपद अध्यक्ष ने मसूद को दिखाई उंगली, बोले- औकात में रहो; बीजेपी MLA बोले- स्मार्ट सिटी से भोपाल का नाश|भोपाल,Bhopal - Dainik Bhaskar",https://www.bhaskar.com/g/local/mp/bhopal/news/bhopal-master-plan-hungama-congress-mla-arif-masood-walkout-138406986.html,2026-07-10T11:10:36+00:00
Bhopal,Bhaskar,Bhopal • Bhaskar,https://www.bhaskar.com/local/mp/bhopal/,5,"सीएम बोले- फिक्स सैलरी, नियमितीकरण समेत मांगों पर होगा विचार, अटकाने-लटकाने का समय गया|भोपाल,Bhopal - Dainik Bhaskar",https://www.bhaskar.com/g/local/mp/bhopal/news/mp-guest-teachers-cm-honored-bhopal-138407256.html,2026-07-10T11:10:36+00:00
Bhopal,Bhaskar,Bhopal • Bhaskar,https://www.bhaskar.com/local/mp/bhopal/,6,"शेयर ट्रेडिंग और रियल स्टेट कारोबार में निवेश के नाम पर की वारदात|भोपाल,Bhopal - Dainik Bhaskar",https://www.bhaskar.com/g/local/mp/bhopal/news/bhopal-cheating-share-real-estate-investment-33-lakh-138407061.html,2026-07-10T11:10:36+00:00
Bhopal,Bhaskar,Bhopal • Bhaskar,https://www.bhaskar.com/local/mp/bhopal/,7,"पैरालिसिस के बाद डिप्रेशन में थे, छत के शेड के सहारे बनाया था फंदा|भोपाल,Bhopal - Dainik Bhaskar",https://www.bhaskar.com/local/mp/bhopal/news/bhopal-elderly-suicide-paralysis-depression-138406608.html,2026-07-10T11:10:36+00:00
Bhopal,Bhaskar,Bhopal • Bhaskar,https://www.bhaskar.com/local/mp/bhopal/,8,"तुर्की जैसे कपड़े पहनने की सलाह, ट्विट में लिखा- इससे मॉब लिंचिंग से बचेंगे|भोपाल,Bhopal - Dainik Bhaskar",https://www.bhaskar.com/g/local/mp/bhopal/news/niaz-khan-tweet-muslims-dress-turkish-style-avoid-mob-lynching-138406992.html,2026-07-10T11:10:36+00:00
Bhopal,Bhaskar,Bhopal • Bhaskar,https://www.bhaskar.com/local/mp/bhopal/,9,"काली पट्टी बांधकर निकले नमाजी; दो गैर-मुस्लिम सदस्यों की नियुक्ति के विरोध में पोस्टर लेकर पहुंचे|भोपाल,Bhopal - Dainik Bhaskar",https://www.bhaskar.com/g/local/mp/bhopal/news/bhopal-muslims-black-band-protest-tajul-masajid-jumma-namaz-138406294.html,2026-07-10T11:10:36+00:00
Bhopal,Bhaskar,Bhopal • Bhaskar,https://www.bhaskar.com/local/mp/bhopal/,10,"हर महीने सामने आ रहे पति–पत्नी के खतरनाक मानसिक केस, मर्डर तक की सोच|भोपाल,Bhopal - Dainik Bhaskar",https://www.bhaskar.com/g/local/mp/bhopal/news/relationships-rising-violence-men-cases-60-70-percent-increase-psychiatrist-statement-138401770.html,2026-07-10T11:10:36+00:00
Bhopal,Bhaskar,Bhopal • Bhaskar,https://www.bhaskar.com/local/mp/bhopal/,11,"कांग्रेस अध्यक्ष का भाई होना ही मेरी गलती; कल इंदौर पुलिस ने हिरासत में लिया था|भोपाल,Bhopal - Dainik Bhaskar",https://www.bhaskar.com/g/local/mp/indore/news/indore-nana-patwari-drug-case-jitu-patwari-press-conference-138406029.html,2026-07-10T11:10:36+00:00
Bhopal,Bhaskar,Bhopal • Bhaskar,https://www.bhaskar.com/local/mp/bhopal/,12,"48 लाख ग्रामीणों को मुफ्त रजिस्ट्री देने रेवेन्यू अफसरों को अधिकार, अब जल्द होगी कार्यवाही|भोपाल,Bhopal - Dainik Bhaskar",https://www.bhaskar.com/g/local/mp/bhopal/news/mp-villagers-get-free-registry-rights-to-revenue-officers-138402153.html,2026-07-10T11:10:36+00:00
Bhopal,Bhaskar,Bhopal • Bhaskar,https://www.bhaskar.com/local/mp/bhopal/,13,"कर्मचारी बोले-गैस-पेट्रोल सहित हर सामान महंगा फिर भी 7 महीने से नहीं बढ़ा भत्ता,सरकार ने बचाए 425 करोड़|भोपाल,Bhopal - Dainik Bhaskar",https://www.bhaskar.com/g/local/mp/bhopal/news/mp-govt-stops-da-hike-employees-pensioners-save-425cr-fuel-prices-rise-138406823.html,2026-07-10T11:10:36+00:00
Bhopal,Bhaskar,Bhopal • Bhaskar,https://www.bhaskar.com/local/mp/bhopal/,14,"नरोत्तम के लिए बज चुकी थी खतरे की घंटी; चुनाव लड़ने 4 बार पार्टियां बदल चुके भारती|भोपाल,Bhopal - Dainik Bhaskar",https://www.bhaskar.com/local/mp/bhopal/news/datia-narottam-mishra-election-loss-apology-rajendra-bharti-138401776.html,2026-07-10T11:10:36+00:00
Bhopal,Bhaskar,Bhopal • Bhaskar,https://www.bhaskar.com/local/mp/bhopal/,15,"विकास नहीं होने पर विधायक का छलका दर्द; 19 गाड़ियों के काफिले के साथ निकले गडकरी|भोपाल,Bhopal - Dainik Bhaskar",https://www.bhaskar.com/local/mp/news/kalapipal-shajapur-mla-ghanshyam-chandravanshi-sadak-demand-cm-mohan-yadav-protest-video-baat-khari-hai-138405148.html,2026-07-10T11:10:36+00:00
Bhopal,Bhaskar,Bhopal • Bhaskar,https://www.bhaskar.com/local/mp/bhopal/,16,"32 जिलों में सामान्य से ज्यादा पानी गिरा; आज पन्ना, सतना में आज हेवी रेन का अलर्ट|भोपाल,Bhopal - Dainik Bhaskar",https://www.bhaskar.com/local/mp/bhopal/news/panna-satna-heavy-rain-alert-mp-weather-news-138401628.html,2026-07-10T11:10:36+00:00
Bhopal,Bhaskar,Bhopal • Bhaskar,https://www.bhaskar.com/local/mp/bhopal/,17,"शिरोमणि विनोद शर्मा बने आज के 'पब्लिक स्टार'; आपकी शिकायत भी पहुंच सकती है जिम्मेदारों तक|भोपाल,Bhopal - Dainik Bhaskar",https://www.bhaskar.com/g/local/mp/bhopal/news/bhopal-public-star-vinod-sharma-resolves-electricity-issue-bhaskar-samadhan-138402118.html,2026-07-10T11:10:36+00:00
Bhopal,Bhaskar,Bhopal • Bhaskar,https://www.bhaskar.com/local/mp/bhopal/,18,"ओंकारेश्वर की आय-व्यय नहीं बताते; बगलामुखी मंदिर में फर्जी समिति ले रही थी चंदा|भोपाल,Bhopal - Dainik Bhaskar",https://www.bhaskar.com/local/mp/indore/news/ujjain-mahankal-temple-donation-security-qr-code-online-fraud-138404989.html,2026-07-10T11:10:36+00:00
Bhopal,Bhaskar,Bhopal • Bhaskar,https://www.bhaskar.com/local/mp/bhopal/,19,"चल रही चित्रांकन-2026’ कला प्रदर्शनी; जानिए भोपाल में आज कहां-क्या खास|भोपाल,Bhopal - Dainik Bhaskar",https://www.bhaskar.com/local/mp/bhopal/news/chitraankan-2026-art-exhibition-bhopal-events-138402109.html,2026-07-10T11:10:36+00:00
Bhopal,Bhaskar,Bhopal • Bhaskar,https://www.bhaskar.com/local/mp/bhopal/,20,"दिसंबर सत्र में 1,497 सवाल पूछे थे, जुलाई सत्र में सिर्फ 1,756 प्रश्न लगाए|भोपाल,Bhopal - Dainik Bhaskar",https://www.bhaskar.com/local/mp/bhopal/news/mp-vidhayak-sawal-assembly-session-mohan-sarkar-138400338.html,2026-07-10T11:10:36+00:00
Bhopal,Bhaskar,Bhopal • Bhaskar,https://www.bhaskar.com/local/mp/bhopal/,21,"इंदौर में ड्रग्स के साथ पकड़ाए आरोपियों ने लिया नाम; कांग्रेस बोली- बदले की कार्रवाई|भोपाल,Bhopal - Dainik Bhaskar",https://www.bhaskar.com/local/mp/indore/news/indore-dwarkapuri-police-chase-fugitive-arrested-escape-138400115.html,2026-07-10T11:10:36+00:00
Bhopal,Bhaskar,Bhopal • Bhaskar,https://www.bhaskar.com/local/mp/bhopal/,22,"किसानों ने मूंग खरीदी केंद्रों से बनाई दूरी, 2 हजार रु. घाटे में मंडी में बेच रहे फसल|भोपाल,Bhopal - Dainik Bhaskar",https://www.bhaskar.com/g/local/mp/bhopal/news/protests-in-12-districts-demand-for-100-procurement-at-msp-dbp-138405086.html,2026-07-10T11:10:36+00:00
Bhopal,Bhaskar,Bhopal • Bhaskar,https://www.bhaskar.com/local/mp/bhopal/,23,"फ्री स्कूटी पर डेडलाइन का दबाव, 31 तक हिसाब नहीं देने पर अटक सकता है बजट|भोपाल,Bhopal - Dainik Bhaskar",https://www.bhaskar.com/g/local/mp/bhopal/news/deadline-pressure-on-free-scooters-budget-could-be-stalled-if-accounts-are-not-submitted-by-the-31st-dbp-138405070.html,2026-07-10T11:10:36+00:00
Bhopal,Bhaskar,Bhopal • Bhaskar,https://www.bhaskar.com/local/mp/bhopal/,24,"भाजपा प्रदेशाध्यक्ष खंडेलवाल ने ग्रहण कराई सदस्यता|भोपाल,Bhopal - Dainik Bhaskar",https://www.bhaskar.com/g/local/mp/bhopal/news/congresss-rakesh-joins-bjp-dbp-138405052.html,2026-07-10T11:10:36+00:00
Bhopal,Bhaskar,Bhopal • Bhaskar,https://www.bhaskar.com/local/mp/bhopal/,25,"हर बार एक ही बहाना कि फायर एक्ट नहीं है, जबकि मौजूदा कानूनों में ही पर्याप्त प्रावधान|भोपाल,Bhopal - Dainik Bhaskar",https://www.bhaskar.com/g/local/mp/bhopal/news/1200-fire-incidents-every-year-but-no-action-is-taken-against-those-responsible-dbp-138405047.html,2026-07-10T11:10:36+00:00
Bhopal,Bhaskar,Bhopal • Bhaskar,https://www.bhaskar.com/local/mp/bhopal/,26,"बांधवगढ़ में मौत से जूझ रही मां से बिछड़ी भालू ‘लूना’ को बचाया, वन विहार में मिला नया जीवन|भोपाल,Bhopal - Dainik Bhaskar",https://www.bhaskar.com/g/local/mp/bhopal/news/bandhavgarh-bear-luna-separated-from-her-mother-battling-for-life-rescued-and-found-a-new-lease-of-life-at-van-vihar-dbp-138405038.html,2026-07-10T11:10:36+00:00
Bhopal,Bhaskar,Bhopal • Bhaskar,https://www.bhaskar.com/local/mp/bhopal/,27,"विवि कैंपस में कुत्तों को रोकने के लिए नोडल अफसर नियुक्त करें, प्रोफेसर बोले- अब क्या हम घूम-घूमकर कुत्तों को भगाएंगे|भोपाल,Bhopal - Dainik Bhaskar",https://www.bhaskar.com/g/local/mp/bhopal/news/appoint-a-nodal-officer-to-control-dogs-on-the-university-campus-the-professor-said-will-we-now-go-around-chasing-dogs-away-dbp-138405031.html,2026-07-10T11:10:36+00:00
Bhopal,Bhaskar,Bhopal • Bhaskar,https://www.bhaskar.com/local/mp/bhopal/,28,"एनजीटी ने 5 बार एक्शन टेकन रिपोर्ट मांगी, अफसर कहते रहे-कार्रवाई जारी; अब जुर्माना|भोपाल,Bhopal - Dainik Bhaskar",https://www.bhaskar.com/g/local/mp/bhopal/news/case-of-action-on-big-pond-dbp-138404994.html,2026-07-10T11:10:36+00:00
Bhopal,Bhaskar,Bhopal • Bhaskar,https://www.bhaskar.com/local/mp/bhopal/,29,"फर्जी खातों से विदेश भेजी रकम, इनमें भोपाल के 2 कारोबारी|भोपाल,Bhopal - Dainik Bhaskar",https://www.bhaskar.com/g/local/mp/bhopal/news/satta-app-owners-gave-protection-money-to-officers-dbp-138404971.html,2026-07-10T11:10:36+00:00
Bhopal,Bhaskar,Bhopal • Bhaskar,https://www.bhaskar.com/local/mp/bhopal/,30,"मेट्रो - 8 साल बाद जागे अफसर, अब नहीं बनेंगे ऐशबाग और गोविंदपुरा स्टेशन|भोपाल,Bhopal - Dainik Bhaskar",https://www.bhaskar.com/g/local/mp/bhopal/news/for-the-first-time-the-process-of-amendment-in-dpr-started-dbp-138404951.html,2026-07-10T11:10:36+00:00
Bhopal,Bhaskar,Bhopal • Bhaskar,https://www.bhaskar.com/local/mp/bhopal/,31,"पैसे लेकर भी प्लॉट व पजेशन नहीं, मेंटेनेंस के नाम पर अवैध वसूली, रहवासी पहुंचे कलेक्ट्रेट|भोपाल,Bhopal - Dainik Bhaskar",https://www.bhaskar.com/g/local/mp/bhopal/news/despite-receiving-money-no-plot-or-possession-was-given-illegal-collection-in-the-name-of-maintenance-residents-reached-the-collectorate-dbp-138405090.html,2026-07-10T11:10:36+00:00
Bhopal,Bhaskar,Bhopal • Bhaskar,https://www.bhaskar.com/local/mp/bhopal/,32,"कमाली मंदिर से रातों-रात मूर्तियां हटाईं, आरोप-यहां शॉपिंग कॉम्प्लेक्स बना रहे|भोपाल,Bhopal - Dainik Bhaskar",https://www.bhaskar.com/g/local/mp/bhopal/news/the-commotion-of-devotees-throughout-the-day-dbp-138405022.html,2026-07-10T11:10:36+00:00
Bhopal,Bhaskar,Bhopal • Bhaskar,https://www.bhaskar.com/local/mp/bhopal/,33,"तीसरी बार पकड़ी गई तो इंजीनियर को हाथ-पैर तोड़ने की धमकी|भोपाल,Bhopal - Dainik Bhaskar",https://www.bhaskar.com/g/local/mp/bhopal/news/electricity-theft-from-transformer-by-breaking-into-wall-dbp-138405011.html,2026-07-10T11:10:36+00:00
Bhopal,Bhaskar,Bhopal • Bhaskar,https://www.bhaskar.com/local/mp/bhopal/,34,500 पदों की भर्ती: कोर्ट के आदेश के चलते 87% का परिणाम जारी,https://www.bhaskar.com/g/local/mp/bhopal/news/87-results-released-due-to-court-order-dbp-138405007.html,2026-07-10T11:10:36+00:00
Bhopal,Bhaskar,Bhopal • Bhaskar,https://www.bhaskar.com/local/mp/bhopal/,35,"तत्कालीन फील्ड और प्रोजेक्ट डायरेक्टर दोनों का दावा- शंकराचार्य प्रतिमा का तकनीकी परीक्षण नहीं, शिकायत की तो बिना जांच हटाया|भोपाल,Bhopal - Dainik Bhaskar",https://www.bhaskar.com/g/local/mp/bhopal/news/the-then-field-and-project-directors-both-claimed-that-the-shankaracharya-statue-had-not-been-technically-tested-and-was-removed-without-investigation-after-a-complaint-dbp-138404980.html,2026-07-10T11:10:36+00:00
Bhopal,Bhaskar,Bhopal • Bhaskar,https://www.bhaskar.com/local/mp/bhopal/,36,स्वामित्व योजना: तहसीलदार-नायब तहसीलदारों को मिले उपपंजीयक के अधिकार,https://www.bhaskar.com/g/local/mp/bhopal/news/tehsildars-and-naib-tehsildars-have-been-given-the-powers-of-sub-registrars-dbp-138404958.html,2026-07-10T11:10:36+00:00
Bhopal,Bhaskar,Bhopal • Bhaskar,https://www.bhaskar.com/local/mp/bhopal/,37,"जीतू पटवारी और हरीश चौधरी की कार्यप्रणाली पर उठाए थे सवाल|भोपाल,Bhopal - Dainik Bhaskar",https://www.bhaskar.com/local/mp/bhopal/news/mp-rakesh-yadav-joins-bjp-jitu-patwari-harish-chaudhary-controversy-138401263.html,2026-07-10T11:10:36+00:00
Bhopal,Bhaskar,Bhopal • Bhaskar,https://www.bhaskar.com/local/mp/bhopal/,38,"मंडला सबसे ज्यादा भीगा, भिंड में रेड अलर्ट, 24 घंटे में कई जिलों में तेज बारिश की चेतावनी|भोपाल,Bhopal - Dainik Bhaskar",https://www.bhaskar.com/local/mp/bhopal/news/gwalior-chambal-heavy-rain-bhind-red-alert-mp-monsoon-138393337.html,2026-07-10T11:10:36+00:00
Bhopal,Bhaskar,Bhopal • Bhaskar,https://www.bhaskar.com/local/mp/bhopal/,39,"गिरजेश बने सह संयोजक, ओबीसी मोर्चा के चार जिलाध्यक्ष और 3 संभागीय कार्यालय मंत्री भी बनाए|भोपाल,Bhopal - Dainik Bhaskar",https://www.bhaskar.com/local/mp/bhopal/news/mp-bjp-appointments-it-obc-morcha-hitesh-nagdev-convenor-138393943.html,2026-07-10T11:10:36+00:00
Bhopal,Bhaskar,Bhopal • Bhaskar,https://www.bhaskar.com/local/mp/bhopal/,40,"भोपाल के आहूजा ब्रदर्स के खिलाफ नए सबूत पेश, सौरभ चंद्राकर, रवि उप्पल समेत 66 आरोपियों पर शिकंजा|भोपाल,Bhopal - Dainik Bhaskar",https://www.bhaskar.com/g/local/mp/bhopal/news/mahadev-app-case-cbi-files-11-chargesheets-sourav-chandrakar-ravi-uppal-bhopal-ahuja-brothers-138400345.html,2026-07-10T11:10:36+00:00
Bhopal,Bhaskar,Bhopal • Bhaskar,https://www.bhaskar.com/local/mp/bhopal/,41,"1996 से अब तक न वेतन पुनरीक्षण हुआ, न कैडर रिव्यू और न ही प्रमोशन मिला|भोपाल,Bhopal - Dainik Bhaskar",https://www.bhaskar.com/local/mp/bhopal/news/mp-patwari-strike-salary-review-demand-138400773.html,2026-07-10T11:10:36+00:00
Bhopal,Bhaskar,Bhopal • Bhaskar,https://www.bhaskar.com/local/mp/bhopal/,42,"VIDEO बनाकर पीड़िता के भाई के मोबाइल पर भेजा; एक नाबालिग हिरासत में|भोपाल,Bhopal - Dainik Bhaskar",https://www.bhaskar.com/g/local/mp/bhopal/news/bhopal-minor-gang-rape-accused-send-video-victim-brother-138399277.html,2026-07-10T11:10:36+00:00
Bhopal,Bhaskar,Bhopal • Bhaskar,https://www.bhaskar.com/local/mp/bhopal/,43,"चलती बस में लगी आग, चाचा-भतीजे को लात-घूंसों से पीटा; CM के सामने विधायक बोले-जूते-चप्पल छोड़ दूंगा|भोपाल,Bhopal - Dainik Bhaskar",https://www.bhaskar.com/local/mp/news/mp-top-10-news-today-bus-catches-fire-uncle-nephew-assaulted-bjp-mla-tells-cm-he-wont-wear-shoes-until-roads-are-built-138400391.html,2026-07-10T11:10:36+00:00
Bhopal,Bhaskar,Bhopal • Bhaskar,https://www.bhaskar.com/local/mp/bhopal/,44,"भोपाल में सड़क पर बाइक लटकाकर जताया विरोध; लिखा-मैंने एथनॉल पिया है|भोपाल,Bhopal - Dainik Bhaskar",https://www.bhaskar.com/local/mp/bhopal/news/madhya-pradesh-aaps-ethanol-policy-protest-bike-crane-bhopal-138400571.html,2026-07-10T11:10:36+00:00
