city,publisher,source,source_url,rank,headline,link,collected_at_iso
Delhi-NCR,Jagran,Delhi-NCR • Jagran,https://www.jagran.com/delhi-ncr,30,"गाजियाबाद की 400 हाईराइज सोसायटियों में डीजल का संकट, 10 लाख से ज्यादा लोग होंगे प्रभावित",https://www.jagran.com/uttar-pradesh/ghaziabad-ghaziabad-societies-face-power-backup-crisis-over-diesel-limit-40273680.html,2026-06-15T18:42:37+00:00
Delhi-NCR,Jagran,Delhi-NCR • Jagran,https://www.jagran.com/delhi-ncr,31,"टमाटर की कीमतों ने बिगाड़ा रसोई का बजट, गुरुग्राम की मंडियों में अचानक दोगुना से ज्यादा बढ़ गए दाम",https://www.jagran.com/haryana/gurgaon-gurugram-tomato-prices-soar-to-80kg-amid-supply-shortage-40274188.html,2026-06-15T18:42:37+00:00
Delhi-NCR,Jagran,Delhi-NCR • Jagran,https://www.jagran.com/delhi-ncr,32,"अच्छा खाना नहीं बनाने पर गुरुग्राम में पत्नी की बेरहमी से हत्या, बेलन से पीट-पीटकर मौत के घाट उतारा",https://www.jagran.com/haryana/gurgaon-gurugram-husband-kills-wife-over-bad-food-while-drunk-40274134.html,2026-06-15T18:42:37+00:00
Delhi-NCR,Jagran,Delhi-NCR • Jagran,https://www.jagran.com/delhi-ncr,33,"गुरुग्राम: महिला की हत्या कर जंगल में फेंका शव, कातिलों तक पहुंचने के लिए पुलिस की जांच तेज",https://www.jagran.com/haryana/gurgaon-gurgaon-woman-strangled-with-dupatta-rape-suspected-40274047.html,2026-06-15T18:42:37+00:00
Delhi-NCR,Jagran,Delhi-NCR • Jagran,https://www.jagran.com/delhi-ncr,34,"दिल्ली-एनसीआर में दिन में छाया अंधेरा, चल रही धूल भरी आंधी",https://www.jagran.com/haryana/gurgaon-gurgaon-rain-delhincr-weather-changes-waterlogging-alerts-40273687.html,2026-06-15T18:42:37+00:00
Delhi-NCR,Jagran,Delhi-NCR • Jagran,https://www.jagran.com/delhi-ncr,35,"जेप्टो डिलीवरी ब्वॉय की मौत पर गुरुग्राम में हंगामा, मुआवजे की मांग को लेकर प्रदर्शन",https://www.jagran.com/haryana/gurgaon-gurugram-zepto-delivery-boy-dies-in-accident-family-demands-compensation-40273272.html,2026-06-15T18:42:37+00:00
Delhi-NCR,Jagran,Delhi-NCR • Jagran,https://www.jagran.com/delhi-ncr,36,"नोएडा में 5 रूट पर चलेंगी ई-बसें, नमो भारत स्टेशन और ISBT आनंद विहार तक होगी कनेक्टविटी; किराया भी तय",https://www.jagran.com/uttar-pradesh/noida-noida-ebus-service-5-routes-fares-isbt-airport-connectivity-40274403.html,2026-06-15T18:42:37+00:00
Delhi-NCR,Jagran,Delhi-NCR • Jagran,https://www.jagran.com/delhi-ncr,37,"Noida Traffic Alert: अगले 4 दिन बंद रहेगा डीएनडी-आश्रम मार्ग, ट्रैफिक पुलिस ने जारी की एडवाइजरी",https://www.jagran.com/uttar-pradesh/noida-noida-dnd-ashram-traffic-advisory-ring-road-closure-for-4-days-40274415.html,2026-06-15T18:42:37+00:00
Delhi-NCR,Jagran,Delhi-NCR • Jagran,https://www.jagran.com/delhi-ncr,38,"नोएडा-ग्रेटर नोएडा जाने वालों के लिए बड़ी राहत, ट्रैफिक जाम से मुक्ति दिलाएगा 31 किमी का एलिवेटेड एक्सप्रेसवे",https://www.jagran.com/uttar-pradesh/noida-noidagreater-noida-31km-yamuna-elevated-expressway-planned-40274346.html,2026-06-15T18:42:37+00:00
Delhi-NCR,Jagran,Delhi-NCR • Jagran,https://www.jagran.com/delhi-ncr,39,"लंदन और न्यूयार्क की राह पर Delhi-NCR, दिल्ली और नोएडा एयरपोर्ट का कनेक्शन बदल देगा हवाई सफर का अंदाज",https://www.jagran.com/delhi/new-delhi-city-delhincr-airports-to-mimic-londonny-model-jewar-igi-40274445.html,2026-06-15T18:42:37+00:00
Delhi-NCR,Jagran,Delhi-NCR • Jagran,https://www.jagran.com/delhi-ncr,40,"दिल्ली एयरपोर्ट पर ढाई घंटे चली सुरक्षा जांच, नाराज होकर वापस लौटे बांग्लादेशी पीएम के सलाहकार",https://www.jagran.com/delhi/new-delhi-city-bangladesh-pm-advisor-detained-at-delhi-airport-diplomatic-row-40274469.html,2026-06-15T18:42:37+00:00
Delhi-NCR,Jagran,Delhi-NCR • Jagran,https://www.jagran.com/delhi-ncr,41,"गोवा एक्सीडेंट में मारी गई बेटी की मां को मिलेगा 92.58 लाख मुआवजा, 10 साल बाद ट्रिब्यूनल का बड़ा आदेश",https://www.jagran.com/delhi/new-delhi-city-goa-accident-delhi-mact-awards-9258-lakh-to-victims-mother-40274471.html,2026-06-15T18:42:37+00:00
Delhi-NCR,Jagran,Delhi-NCR • Jagran,https://www.jagran.com/delhi-ncr,42,"दिल्ली में 650 करोड़ के दवा घोटाले में ACB का एक्शन, 35 डॉक्टरों से पूछताछ के बाद अब गिरफ्तारियां जल्द",https://www.jagran.com/delhi/new-delhi-city-delhi-650-cr-medicine-scam-doctors-staff-arrests-soon-40274441.html,2026-06-15T18:42:37+00:00
Delhi-NCR,Jagran,Delhi-NCR • Jagran,https://www.jagran.com/delhi-ncr,43,"पूर्वी दिल्ली में अवैध होटलों की मनमानी जारी, सर्वे से बचने के लिए होटल के बाहर से हटाए गए बोर्ड",https://www.jagran.com/delhi/new-delhi-city-east-delhi-hotels-remove-boards-to-evade-safety-survey-40274451.html,2026-06-15T18:42:37+00:00
Delhi-NCR,Jagran,Delhi-NCR • Jagran,https://www.jagran.com/delhi-ncr,44,"दिल्ली-आगरा हाईवे और एक्सप्रेसवे पर गाड़ी चलाने वाले सावधान, अब सीधा घर पहुंचेगा भारी-भरकम चालान",https://www.jagran.com/haryana/faridabad-faridabad-dcp-cracks-down-on-wrongside-driving-on-highways-40274191.html,2026-06-15T18:42:37+00:00
Delhi-NCR,Jagran,Delhi-NCR • Jagran,https://www.jagran.com/delhi-ncr,45,"दो बहनों के इकलौते भाई थे फरीदाबाद के मोहित, हादसे की खबर मिलते ही गश खाकर गिरे पिता",https://www.jagran.com/haryana/faridabad-faridabads-mohit-verma-dies-in-tragic-jammu-highway-crash-40273883.html,2026-06-15T18:42:37+00:00
Delhi-NCR,Jagran,Delhi-NCR • Jagran,https://www.jagran.com/delhi-ncr,46,"मेनगेट काटती रही फरीदाबाद पुलिस और पीछे के रास्ते से फरार हुए तस्कर, कमरे से मिला हथियार",https://www.jagran.com/haryana/faridabad-faridabad-police-raid-smugglers-escape-weapon-seized-40273871.html,2026-06-15T18:42:37+00:00
Delhi-NCR,Jagran,Delhi-NCR • Jagran,https://www.jagran.com/delhi-ncr,47,"फरीदाबाद के अस्पताल में लापरवाही: गर्भ में मृत शिशु, फिर भी इलाज को चार दिन भटके दंपती",https://www.jagran.com/haryana/faridabad-faridabad-hospital-negligence-woman-carries-dead-fetus-4-days-40273666.html,2026-06-15T18:42:37+00:00
Delhi-NCR,Jagran,Delhi-NCR • Jagran,https://www.jagran.com/delhi-ncr,48,"आर्मेनिया में पढ़ रहे बेटे को इंस्टाग्राम पर धमकी, रात में पिता की स्कॉर्पियो के शीशे तोड़े",https://www.jagran.com/haryana/faridabad-faridabad-son-threatened-on-instagram-fathers-car-vandalized-40273509.html,2026-06-15T18:42:37+00:00
Delhi-NCR,Jagran,Delhi-NCR • Jagran,https://www.jagran.com/delhi-ncr,49,"केएमपी एक्सप्रेसवे पर सुरक्षित होगा सफर, 20 करोड़ से लगाई जाएंगी ग्रिल; इन शहरों के मुसाफिरों को मिलेगी राहत",https://www.jagran.com/haryana/palwal-kmp-expressway-safety-boost-20-cr-for-grills-boards-40273850.html,2026-06-15T18:42:37+00:00
Delhi-NCR,Jagran,Delhi-NCR • Jagran,https://www.jagran.com/delhi-ncr,50,"पलवल के सेक्टर-2 फ्लाईओवर पर भीषण सड़क हादसा, युवक की मौत; तीन घायल",https://www.jagran.com/haryana/palwal-palwal-sector2-flyover-accident-youth-dies-3-injured-40272547.html,2026-06-15T18:42:37+00:00
Delhi-NCR,Jagran,Delhi-NCR • Jagran,https://www.jagran.com/delhi-ncr,51,"पलवल में रिटायर्ड फौजी ने लाइसेंसी बंदूक से की आत्महत्या, तनाव में उठाया खौफनाक कदम",https://www.jagran.com/haryana/palwal-retired-soldier-dies-by-suicide-in-palwal-with-licensed-gun-40272540.html,2026-06-15T18:42:37+00:00
Delhi-NCR,Jagran,Delhi-NCR • Jagran,https://www.jagran.com/delhi-ncr,52,"पलवल में बारिश और ठंडी हवाओं से मौसम हुआ खुशनुमा, बाजारों में लौटी रौनक",https://www.jagran.com/haryana/palwal-palwal-weather-rain-cold-wind-bring-relief-temperature-drops-40272538.html,2026-06-15T18:42:37+00:00
Delhi-NCR,Jagran,Delhi-NCR • Jagran,https://www.jagran.com/delhi-ncr,53,"पलवल में सड़क हादसा: फ्लाईओवर पर खड़े कैंटर से टकराया ऑटो, युवक की मौत; तीन घायल",https://www.jagran.com/haryana/palwal-palwal-flyover-accident-one-dead-three-injured-in-auto-crash-40271797.html,2026-06-15T18:42:37+00:00
Delhi-NCR,Jagran,Delhi-NCR • Jagran,https://www.jagran.com/delhi-ncr,54,"जौनपुर की बदलापुर कोतवाली में भिड़ीं महिलाएं, काबू करने में पुलिस के छूटे पसीने",https://www.jagran.com/uttar-pradesh/jaunpur-jaunpur-women-brawl-at-police-station-over-marketing-fraud-40274461.html,2026-06-15T18:42:37+00:00
Delhi-NCR,Jagran,Delhi-NCR • Jagran,https://www.jagran.com/delhi-ncr,55,"बरातियों ने बड़े भाई को पीटा, अपमान से आहत छोटे भाई ने लगाई फांसी, बलिया में दिल दहलाने वाली घटना",https://www.jagran.com/uttar-pradesh/ballia-ballia-brother-dies-by-suicide-after-baraat-fight-incident-40274458.html,2026-06-15T18:42:37+00:00
Delhi-NCR,Jagran,Delhi-NCR • Jagran,https://www.jagran.com/delhi-ncr,56,"जम्मू मेल पर पत्थरबाजी से मचा हड़कंप, शांति भंग में चार गिरफ्तार",https://www.jagran.com/uttar-pradesh/kanpur-city-kanpur-4-arrested-after-false-jammu-mail-stone-pelting-report-40274533.html,2026-06-15T18:42:37+00:00
Delhi-NCR,Jagran,Delhi-NCR • Jagran,https://www.jagran.com/delhi-ncr,57,"मथुरा के कोसीकलां में लेनदेन विवाद बना जानलेवा, बुजुर्ग की मौत के बाद तनाव, पुलिस बल तैनात",https://www.jagran.com/uttar-pradesh/mathura-kosi-kalan-clash-financial-dispute-turns-fatal-in-mathura-40274459.html,2026-06-15T18:42:37+00:00
Delhi-NCR,Jagran,Delhi-NCR • Jagran,https://www.jagran.com/delhi-ncr,58,"रायबरेली में पानी की टंकी के चौकीदार की बेरहमी से हत्या, चेहरे पर मिले गहरे घाव",https://www.jagran.com/uttar-pradesh/raebareli-raebareli-watchman-brutally-murdered-at-water-tank-40274464.html,2026-06-15T18:42:37+00:00
Delhi-NCR,Jagran,Delhi-NCR • Jagran,https://www.jagran.com/delhi-ncr,59,"कानपुर में गर्मी और उमस का प्रकोप जारी, पारा चढ़ा, मानसून में देरी",https://www.jagran.com/uttar-pradesh/kanpur-city-kanpur-heatwave-temp-rises-to-393c-humidity-soars-40274511.html,2026-06-15T18:42:37+00:00
Delhi-NCR,Jagran,Delhi-NCR • Jagran,https://www.jagran.com/delhi-ncr,60,"कानपुर में 225 करोड़ की साइबर ठगी का बड़ा खुलासा, छह आरोपी गिरफ्तार",https://www.jagran.com/uttar-pradesh/kanpur-city-kanpur-police-busts-rs-225-cr-cyber-fraud-network-6-arrested-40274508.html,2026-06-15T18:42:37+00:00
Delhi-NCR,Jagran,Delhi-NCR • Jagran,https://www.jagran.com/delhi-ncr,61,"पवन ऊर्जा की खरीद और प्रोत्साहन देने में यूपी बना 'विंड प्रोक्योरमेंट चैंपियन', गोवा में मिला राष्ट्रीय सम्मान",https://www.jagran.com/uttar-pradesh/lucknow-city-up-wins-wind-procurement-champion-award-for-green-energy-40274521.html,2026-06-15T18:42:37+00:00
Delhi-NCR,Jagran,Delhi-NCR • Jagran,https://www.jagran.com/delhi-ncr,62,"कानपुर में दूध डेरी की आड़ में चल रहा गोकशी का धंधा, रायपुरवा थाने में भी थी दूध की सप्लाई, पुलिस मुठभेड़ में दो घायल",https://www.jagran.com/uttar-pradesh/kanpur-city-illegal-cattle-slaughter-racket-operating-under-guise-of-a-dairy-farm-in-kanpur-40274502.html,2026-06-15T18:42:37+00:00
Delhi-NCR,Jagran,Delhi-NCR • Jagran,https://www.jagran.com/delhi-ncr,63,"राजा रघुवंशी हत्याकांड: 'केस खत्म होने तक शिलॉन्ग में रहूंगी', जमानत के बाद सोनम रघुवंशी का बयान",https://www.jagran.com/madhya-pradesh/indore-sonam-raghuvanshi-on-raja-murder-case-will-stay-in-shillong-40274435.html,2026-06-15T18:42:37+00:00
Delhi-NCR,Jagran,Delhi-NCR • Jagran,https://www.jagran.com/delhi-ncr,64,"कौन हैं IPS अनुष्ठा कालिया? जिन्होंने पहली ही पोस्टिंग में मचाया तहलका, लेडी सिंघम वाला वीडियो वायरल",https://www.jagran.com/news/national-ips-anushtha-kalia-lady-singham-video-goes-viral-in-bikaner-40271730.html,2026-06-15T18:42:37+00:00
Delhi-NCR,Jagran,Delhi-NCR • Jagran,https://www.jagran.com/delhi-ncr,65,"'ओह मैं Gay ...', Mouni Roy ने सेक्सुएलिटी पर सवाल करने वालों को दिया करारा जवाब; सबकी बोलती कर दी बंद",https://www.jagran.com/entertainment/bollywood-mouni-roy-shuts-trolls-for-giving-reply-to-sexual-orientation-question-says-i-heard-rumors-about-me-that-i-am-gay-40272094.html,2026-06-15T18:42:37+00:00
Delhi-NCR,Jagran,Delhi-NCR • Jagran,https://www.jagran.com/delhi-ncr,66,"वैभव सूर्यवंशी के साथ श्रीलंकाई खिलाड़ी ने की धक्का-मुक्की, 15 साल के लड़के ने जमकर दिया जवाब",https://www.jagran.com/cricket/headlines-ind-a-vs-sl-a-vaibhav-suryavanshi-fight-with-sri-lanka-players-40274229.html,2026-06-15T18:42:37+00:00
Delhi-NCR,Jagran,Delhi-NCR • Jagran,https://www.jagran.com/delhi-ncr,67,Did You Know,https://www.jagran.com/did-you-know-news-hindi.html,2026-06-15T18:42:37+00:00
Delhi-NCR,Jagran,Delhi-NCR • Jagran,https://www.jagran.com/delhi-ncr,68,मिडिल ईस्ट संकट,https://www.jagran.com/topics/Israel-Iran-Conflict,2026-06-15T18:42:37+00:00
Delhi-NCR,Jagran,Delhi-NCR • Jagran,https://www.jagran.com/delhi-ncr,69,फीफा वर्ल्ड कप 2026,https://www.jagran.com/topics/FIFA-World-Cup-2026,2026-06-15T18:42:37+00:00
Delhi-NCR,Jagran,Delhi-NCR • Jagran,https://www.jagran.com/delhi-ncr,70,Submit your news,https://www.jagran.com/citizen-journalism-hindi.html,2026-06-15T18:42:37+00:00
Delhi-NCR,Jagran,Delhi-NCR • Jagran,https://www.jagran.com/delhi-ncr,71,Message from the Editor,https://www.jagran.com/policies-and-standards.html,2026-06-15T18:42:37+00:00
Hyderabad,DC,Hyderabad • DC,https://www.deccanchronicle.com/location/india/southern-states,1,FIFA World Cup 2026,https://www.deccanchronicle.com/fifa-world-cup-2026,2026-06-15T18:42:37+00:00
Hyderabad,DC,Hyderabad • DC,https://www.deccanchronicle.com/location/india/southern-states,2,Opinion and Editorials,https://www.deccanchronicle.com/opinion,2026-06-15T18:42:37+00:00
Hyderabad,DC,Hyderabad • DC,https://www.deccanchronicle.com/location/india/southern-states,3,Assembly Elections 2026,https://www.deccanchronicle.com/assembly-elections-2026,2026-06-15T18:42:37+00:00
Hyderabad,DC,Hyderabad • DC,https://www.deccanchronicle.com/location/india/southern-states,4,Telangana Rising 2047,https://www.deccanchronicle.com/tags/Telangana-Rising-2047,2026-06-15T18:42:37+00:00
Chennai,DC,Chennai • DC,https://www.deccanchronicle.com/location/india/tamil-nadu/chennai-madras,1,FIFA World Cup 2026,https://www.deccanchronicle.com/fifa-world-cup-2026,2026-06-15T18:42:37+00:00
Chennai,DC,Chennai • DC,https://www.deccanchronicle.com/location/india/tamil-nadu/chennai-madras,2,Opinion and Editorials,https://www.deccanchronicle.com/opinion,2026-06-15T18:42:37+00:00
Chennai,DC,Chennai • DC,https://www.deccanchronicle.com/location/india/tamil-nadu/chennai-madras,3,Assembly Elections 2026,https://www.deccanchronicle.com/assembly-elections-2026,2026-06-15T18:42:37+00:00
Chennai,DC,Chennai • DC,https://www.deccanchronicle.com/location/india/tamil-nadu/chennai-madras,4,Telangana Rising 2047,https://www.deccanchronicle.com/tags/Telangana-Rising-2047,2026-06-15T18:42:37+00:00
Chennai,The Hindu,Chennai • The Hindu,https://www.thehindu.com/news/cities/chennai/,1,Railway Board likely to give approval for CMRL takeover of MRTS in four to six weeks,https://www.thehindu.com/news/cities/chennai/railway-board-likely-to-give-approval-for-cmrl-takeover-of-mrts-in-four-to-six-weeks/article71101198.ece,2026-06-15T18:42:37+00:00
Chennai,The Hindu,Chennai • The Hindu,https://www.thehindu.com/news/cities/chennai/,2,Flight from Kenya makes priority landing in bid to save infant with heart condition,https://www.thehindu.com/news/cities/chennai/flight-from-kenya-makes-priority-landing-in-bid-to-save-infant-with-heart-condition/article71101773.ece,2026-06-15T18:42:37+00:00
Chennai,The Hindu,Chennai • The Hindu,https://www.thehindu.com/news/cities/chennai/,3,Four persons found dead along railway tracks across city,https://www.thehindu.com/news/cities/chennai/four-persons-found-dead-along-railway-tracks-across-city/article71101831.ece,2026-06-15T18:42:37+00:00
Chennai,The Hindu,Chennai • The Hindu,https://www.thehindu.com/news/cities/chennai/,4,Chennai workshops revive repair culture amid growing textile waste concerns,https://www.thehindu.com/news/cities/chennai/a-second-chance-for-everyday-things/article71100126.ece,2026-06-15T18:42:37+00:00
Chennai,The Hindu,Chennai • The Hindu,https://www.thehindu.com/news/cities/chennai/,5,New syllabus for Classes 1-3 rolls out accessible textbooks and interactive worksheets,https://www.thehindu.com/news/cities/chennai/new-syllabus-for-classes-1-3-rolls-out-accessible-textbooks-and-interactive-worksheets/article71101208.ece,2026-06-15T18:42:37+00:00
Chennai,The Hindu,Chennai • The Hindu,https://www.thehindu.com/news/cities/chennai/,6,Farmers find new customers at Nabard’s mango fest,https://www.thehindu.com/news/cities/chennai/farmers-find-new-customers-at-nabards-mango-fest/article71101901.ece,2026-06-15T18:42:37+00:00
Chennai,The Hindu,Chennai • The Hindu,https://www.thehindu.com/news/cities/chennai/,7,Villivakkam Lake and link pondset for year-round water supply,https://www.thehindu.com/news/cities/chennai/villivakkam-lake-and-link-pondset-for-year-round-water-supply/article71101686.ece,2026-06-15T18:42:37+00:00
Chennai,The Hindu,Chennai • The Hindu,https://www.thehindu.com/news/cities/chennai/,8,Three-year-old girl from Bihar dies after man rapes her near Gummidipoondi,https://www.thehindu.com/news/cities/chennai/chennai-three-year-old-girl-from-bihar-dies-after-man-rapes-her-near-gummidipoondi/article71103548.ece,2026-06-15T18:42:37+00:00
Chennai,The Hindu,Chennai • The Hindu,https://www.thehindu.com/news/cities/chennai/,9,This seller of newspaper and magazines bets big on print,https://www.thehindu.com/news/cities/chennai/this-seller-of-newspaper-and-magazines-bets-bigon-print/article71103881.ece,2026-06-15T18:42:37+00:00
Chennai,The Hindu,Chennai • The Hindu,https://www.thehindu.com/news/cities/chennai/,10,The murals that united a neighbourhood in Chennai,https://www.thehindu.com/news/cities/chennai/the-murals-that-united-a-neighbourhood/article71098143.ece,2026-06-15T18:42:37+00:00
Chennai,The Hindu,Chennai • The Hindu,https://www.thehindu.com/news/cities/chennai/,11,Departed for another sanctuary: a tribute to V. Guruswami the naturalist,https://www.thehindu.com/news/cities/chennai/departed-for-another-sanctuary-a-tribute-to-v-guruswami-the-naturalist/article71098339.ece,2026-06-15T18:42:37+00:00
Chennai,The Hindu,Chennai • The Hindu,https://www.thehindu.com/news/cities/chennai/,12,Training of field workers for Census 2027 to begin in Chennai on June 15,https://www.thehindu.com/news/cities/chennai/training-of-field-workers-for-census-2027-to-begin-in-chennai-on-june-15/article71098599.ece,2026-06-15T18:42:37+00:00
Chennai,The Hindu,Chennai • The Hindu,https://www.thehindu.com/news/cities/chennai/,13,A scary thud at Thiruvengadam Street,https://www.thehindu.com/news/cities/chennai/a-scary-thud-at-thiruvengadam-street/article71098581.ece,2026-06-15T18:42:37+00:00
Chennai,The Hindu,Chennai • The Hindu,https://www.thehindu.com/news/cities/chennai/,14,Lessons from tree plantation drives,https://www.thehindu.com/news/cities/chennai/lessons-from-tree-plantation-drives/article71096706.ece,2026-06-15T18:42:37+00:00
Chennai,The Hindu,Chennai • The Hindu,https://www.thehindu.com/news/cities/chennai/,15,Opening of Chennai airport’s second cab pick-up point deferred again,https://www.thehindu.com/news/cities/chennai/opening-of-chennai-airports-second-cab-pick-up-point-deferred-again/article71097394.ece,2026-06-15T18:42:37+00:00
Chennai,The Hindu,Chennai • The Hindu,https://www.thehindu.com/news/cities/chennai/,16,Chennai Metro Rail ropes in NCC cadets to bring about transit etiquette among commuters,https://www.thehindu.com/news/cities/chennai/metro-rail-ropes-in-ncc-cadets-to-bring-about-transit-etiquette-among-commuters/article71094639.ece,2026-06-15T18:42:37+00:00
Chennai,The Hindu,Chennai • The Hindu,https://www.thehindu.com/news/cities/chennai/,17,"Tamil Nadu is committed to working constructively with Centre, says Vijay",https://www.thehindu.com/news/national/tamil-nadu/tamil-nadu-is-committed-to-working-constructively-with-centre-saysvijay/article71089880.ece,2026-06-15T18:42:37+00:00
Chennai,The Hindu,Chennai • The Hindu,https://www.thehindu.com/news/cities/chennai/,18,Gautam Menon seeks 30 more days to release ‘Dhruva Natchathiram‘ movie,https://www.thehindu.com/news/national/tamil-nadu/gautam-menon-seeks-30-more-days-to-release-dhruva-natchathiram-movie/article71100160.ece,2026-06-15T18:42:37+00:00
Chennai,The Hindu,Chennai • The Hindu,https://www.thehindu.com/news/cities/chennai/,19,"Bharathiraja tribute, ‘Backrooms’ review",https://www.thehindu.com/newsletter/bharathiraja-tribute-backrooms-review/article71093303.ece,2026-06-15T18:42:37+00:00
Chennai,The Hindu,Chennai • The Hindu,https://www.thehindu.com/news/cities/chennai/,20,Film director Bharathiraja laid to rest with state honours in Theni district,https://www.thehindu.com/news/national/tamil-nadu/film-directorbharathirajalaid-to-rest-with-state-honours-intheni-district/article71089430.ece,2026-06-15T18:42:37+00:00
Chennai,The Hindu,Chennai • The Hindu,https://www.thehindu.com/news/cities/chennai/,21,GCC’s 200 wards to head into 2027 local body elections without expansion,https://www.thehindu.com/news/cities/chennai/gccs-200-wards-to-head-into-2027-local-body-elections-without-expansion/article71105840.ece,2026-06-15T18:42:37+00:00
