city,publisher,source,source_url,rank,headline,link,collected_at_iso
Pune,Pune Mirror,Pune • Pune Mirror,https://punemirror.com/,42,"BJP Wins West Bengal With 207 Seats, Ending TMC’s 15-Year Rule; Oath Ceremony Set For May 9",https://punemirror.com/news/west-bengal-election-results-2026-bjp-207-seats-mamata-refuses-resign-oath-may-9/,2026-05-11T12:42:24+00:00
Pune,Pune Mirror,Pune • Pune Mirror,https://punemirror.com/,43,"Bitcoin Price Surges Toward Remarkable $80,000 Milestone Amid Strong ETF Inflows",https://punemirror.com/business/bitcoin-price-surges-80000-etf-inflows/,2026-05-11T12:42:24+00:00
Pune,Pune Mirror,Pune • Pune Mirror,https://punemirror.com/,44,Amazon Prime Day 2026: Massive Discounts Announced for July Sale in India,https://punemirror.com/news/amazon-prime-day-2026-sale-july-india-offers/,2026-05-11T12:42:24+00:00
Pune,Pune Mirror,Pune • Pune Mirror,https://punemirror.com/,45,"Amazon Now India quick commerce makes bold, powerful push into 100 cities",https://punemirror.com/business/amazon-now-india-quick-commerce-100-cities/,2026-05-11T12:42:24+00:00
Pune,Pune Mirror,Pune • Pune Mirror,https://punemirror.com/,46,Elon Musk xAI OpenAI clash ignites shocking AI distillation storm,https://punemirror.com/technology/elon-musk-xai-openai-distillation-dispute/,2026-05-11T12:42:24+00:00
Pune,Pune Mirror,Pune • Pune Mirror,https://punemirror.com/,47,Hantavirus Outbreak Linked to Cruise Ship Triggers Global Health Concern,https://punemirror.com/health/hantavirus-outbreak-cruise-ship-global-alert/,2026-05-11T12:42:24+00:00
Pune,Pune Mirror,Pune • Pune Mirror,https://punemirror.com/,48,Asia Faces Double Inflation Threat As Oil Shock Meets El Niño Heatwaves,https://punemirror.com/environment/asia-inflation-double-threat-el-nino-heatwave-oil-shock-2026/,2026-05-11T12:42:24+00:00
Pune,Pune Mirror,Pune • Pune Mirror,https://punemirror.com/,49,India And Vietnam To Link UPI With Vietnam’s Fast Payment System; Ties Elevated To Enhanced Strategic Partnership,https://punemirror.com/news/india-vietnam-upi-link-payment-system-strategic-partnership-2026/,2026-05-11T12:42:24+00:00
Pune,Pune Mirror,Pune • Pune Mirror,https://punemirror.com/,50,IRAN SHUTS HORMUZ AGAIN WITHIN 24 HOURS; IRGC WARNS ALL SHIPS WILL BE TARGETED,https://punemirror.com/news/iran-closes-hormuz-again-irgc-warns-ships-april-18-2026/,2026-05-11T12:42:24+00:00
Pune,Pune Mirror,Pune • Pune Mirror,https://punemirror.com/,51,Met Gala 2026: The Best Dressed Stars Of The Night,https://punemirror.com/automobile/met-gala-2026-best-dressed-hollywood-celebrities-fashion-is-art/,2026-05-11T12:42:24+00:00
Pune,Pune Mirror,Pune • Pune Mirror,https://punemirror.com/,52,MINI Cooper S GP Inspired Edition – Pre-Launch Bookings Open,https://punemirror.com/automobile/mini-cooper-s-gp-inspired-edition-pre-launch-bookings-open/,2026-05-11T12:42:24+00:00
Pune,Pune Mirror,Pune • Pune Mirror,https://punemirror.com/,53,JLR India Announces Major Price Cuts for Range Rover SV and Sport SV,https://punemirror.com/automobile/jlr-india-announces-major-price-cuts-for-range-rover-sv-and-sport-sv/,2026-05-11T12:42:24+00:00
Pune,Pune Mirror,Pune • Pune Mirror,https://punemirror.com/,54,"Tata.ev Launches Curvv.ev SeriesX: Range, Power, and Premium Features",https://punemirror.com/automobile/tata-ev-curvv-ev-launch/,2026-05-11T12:42:24+00:00
Pune,Pune Mirror,Pune • Pune Mirror,https://punemirror.com/,55,A LIFETIME OF TRANSFUSIONS,https://punemirror.com/health/health-care/world-thalassaemia-day-pune-screening-awareness/,2026-05-11T12:42:24+00:00
Pune,Pune Mirror,Pune • Pune Mirror,https://punemirror.com/,56,Head and neck cancers in India: alarming surge hits younger adults,https://punemirror.com/health/head-and-neck-cancers-in-india-early-risk/,2026-05-11T12:42:24+00:00
Pune,Pune Mirror,Pune • Pune Mirror,https://punemirror.com/,57,Microplastics liver disease danger: alarming new health threat,https://punemirror.com/health/microplastics-liver-disease-global-risk/,2026-05-11T12:42:24+00:00
Pune,Pune Mirror,Pune • Pune Mirror,https://punemirror.com/,58,Summer heat kidney stones crisis: alarming surge in Pune,https://punemirror.com/health/summer-heat-kidney-stones-pune-surge/,2026-05-11T12:42:24+00:00
Pune,Pune Mirror,Pune • Pune Mirror,https://punemirror.com/,59,Suryakumar Yadav Set To Lose India T20 Captaincy; Shreyas Iyer Tipped To Take Over,https://punemirror.com/sports/cricket/suryakumar-yadav-t20-captaincy-shreyas-iyer-india-cricket-2026/,2026-05-11T12:42:24+00:00
Pune,Pune Mirror,Pune • Pune Mirror,https://punemirror.com/,60,IPL 2026: Yuzvendra Chahal Faces Online Backlash After Viral Flight Video,https://punemirror.com/sports/ipl-2026-yuzvendra-chahal-viral-flight-video/,2026-05-11T12:42:24+00:00
Pune,Pune Mirror,Pune • Pune Mirror,https://punemirror.com/,61,"MS Dhoni Unlikely To Play Another Game In IPL 2026, Says Ravichandran Ashwin",https://punemirror.com/sports/cricket/ms-dhoni-ipl-2026-return-unlikely-ashwin-slim-chances-csk/,2026-05-11T12:42:24+00:00
Pune,Pune Mirror,Pune • Pune Mirror,https://punemirror.com/,62,Ahmedabad To Host IPL 2026 Final On May 31; Bengaluru’s Chinnaswamy Dropped As Venue,https://punemirror.com/sports/cricket/ipl-2026-final-ahmedabad-narendra-modi-stadium-chinnaswamy-dropped-may-31/,2026-05-11T12:42:24+00:00
Pune,Pune Mirror,Pune • Pune Mirror,https://punemirror.com/,63,The Device on Deepinder Goyal’s Temple That Stole the Spotlight — and Why the Internet Is Split,https://punemirror.com/trending/deepinder-goyal-temple-device-podcast-viral/,2026-05-11T12:42:24+00:00
Pune,Pune Mirror,Pune • Pune Mirror,https://punemirror.com/,64,The Hyper-Speed Era: Why Everything Is a ‘Trend’ and Nothing Lasts,https://punemirror.com/trending/why-everything-is-a-trend-and-nothing-lasts/,2026-05-11T12:42:24+00:00
Pune,Pune Mirror,Pune • Pune Mirror,https://punemirror.com/,65,Amazon Black Friday OnePlus Deals 2025: Massive Savings on Flagship Phones,https://punemirror.com/technology/amazon-black-friday-oneplus-deals-2025/,2026-05-11T12:42:24+00:00
Pune,Pune Mirror,Pune • Pune Mirror,https://punemirror.com/,66,Nobel Prize 2025: Discovery of Regulatory T-Cells and FOXP3 Gene Wins Medicine Award,https://punemirror.com/news/nobel-prize-2025-discovery-of-regulatory-t-cells-and-foxp3-gene-wins-medicine-award/,2026-05-11T12:42:24+00:00
Pune,Pune Mirror,Pune • Pune Mirror,https://punemirror.com/,67,Pahalgam terrorist gunned down; Three killed in J-K encounter,https://punemirror.com/trending/pahalgam-terrorist-gunned-down-three-killed-in-j-k-encounter/,2026-05-11T12:42:24+00:00
Pune,Pune Mirror,Pune • Pune Mirror,https://punemirror.com/,68,Startup India Fund of Funds 2.0: Powerful Boost for Startups,https://punemirror.com/india/startup-india-fund-of-funds-2-0-boost/,2026-05-11T12:42:24+00:00
Pune,Pune Mirror,Pune • Pune Mirror,https://punemirror.com/,69,Sarvam AI Bulbul V3 delivers stunning win over global AI rivals,https://punemirror.com/technology/ai/sarvam-ai-bulbul-v3-outshines-rivals/,2026-05-11T12:42:24+00:00
Pune,Pune Mirror,Pune • Pune Mirror,https://punemirror.com/,70,The Startup Evolution: From Survival Mode to Sustainable Success,https://punemirror.com/business/startups/from-survival-mode-to-sustainable-success/,2026-05-11T12:42:24+00:00
Pune,Pune Mirror,Pune • Pune Mirror,https://punemirror.com/,71,"Emotionally cultured, yet we fear love.",https://punemirror.com/lifestyle/paradox-of-emotional-intelligence-modern-love/,2026-05-11T12:42:24+00:00
Pune,Pune Mirror,Pune • Pune Mirror,https://punemirror.com/,72,Bhavitha Mandava Wears Jeans To Met Gala 2026 — Chanel’s Bold Statement Or Fashion Misstep?,https://punemirror.com/lifestyle/fashion/bhavitha-mandava-met-gala-2026-chanel-jeans-look-controversy/,2026-05-11T12:42:24+00:00
Pune,Pune Mirror,Pune • Pune Mirror,https://punemirror.com/,73,Nykaa Summer Sale Begins: Beauty Shoppers Rush for Big Discounts on Skincare and Makeup,https://punemirror.com/lifestyle/nykaa-pink-summer-sale-2026/,2026-05-11T12:42:24+00:00
Pune,Pune Mirror,Pune • Pune Mirror,https://punemirror.com/,74,Ananya Birla Stuns At Met Gala 2026 Debut In Robert Wun Couture And Subodh Gupta Steel Mask,https://punemirror.com/lifestyle/fashion/ananya-birla-met-gala-2026-robert-wun-subodh-gupta-mask/,2026-05-11T12:42:24+00:00
Pune,Pune Mirror,Pune • Pune Mirror,https://punemirror.com/,75,Filter Coffee Softy Delight: Powerful New Summer Hit In Pune,https://punemirror.com/lifestyle/filter-coffee-softy-pune-summer-dessert-trend/,2026-05-11T12:42:24+00:00
Pune,Pune Mirror,Pune • Pune Mirror,https://punemirror.com/,76,Google Wallet Aadhaar Digital ID delivers powerful privacy boost,https://punemirror.com/business/google-wallet-aadhaar-digital-id-rollout/,2026-05-11T12:42:24+00:00
Pune,Pune Mirror,Pune • Pune Mirror,https://punemirror.com/,77,Samsung Finance+ EMI Scheme Unleashes Revolutionary Rs 33/Day Offer for Bespoke AI Appliances,https://punemirror.com/technology/samsung-finance-emi-scheme-india/,2026-05-11T12:42:24+00:00
Pune,Pune Mirror,Pune • Pune Mirror,https://punemirror.com/,78,Indian forex reserves show resilient surge even as rupee suffers steep fall,https://punemirror.com/business/indian-forex-reserves-rupee-weekly-loss-oil/,2026-05-11T12:42:24+00:00
Pune,Pune Mirror,Pune • Pune Mirror,https://punemirror.com/,79,Seamless KYC Financial Sector: Sitharaman Demands Bold SEBI Leadership,https://punemirror.com/business/seamless-kyc-financial-sector-sebi-sitharaman/,2026-05-11T12:42:24+00:00
Pune,Pune Mirror,Pune • Pune Mirror,https://punemirror.com/,80,RBI auto-debit rules bring powerful relief for digital payments,https://punemirror.com/business/rbi-auto-debit-rules-15000-limit-india/,2026-05-11T12:42:24+00:00
Pune,Pune Mirror,Pune • Pune Mirror,https://punemirror.com/,81,Kidnapping-for-Ransom Charge Under Scanner: Pune Court Flags Commercial Dispute Angle in Kharadi Case,https://punemirror.com/city/crime/kidnapping-for-ransom-charge-under-scanner-pune-court-flags-commercial-dispute-angle-in-kharadi-case/,2026-05-11T12:42:24+00:00
Pune,Pune Mirror,Pune • Pune Mirror,https://punemirror.com/,82,₹2.45 Crore Oil Trading Fraud Uncovered in Pune; Two Accused Booked Again,https://punemirror.com/city/crime/pune-oil-trading-fraud-baner-painter-death-tathawade/,2026-05-11T12:42:24+00:00
Pune,Pune Mirror,Pune • Pune Mirror,https://punemirror.com/,83,"Pune Rural Police Seize Rs.2 Crore Mephedrone in Shirur, Arrest Garage Owner",https://punemirror.com/city/pune-shirur-garage-owner-mephedrone-police-links/,2026-05-11T12:42:24+00:00
Pune,Pune Mirror,Pune • Pune Mirror,https://punemirror.com/,84,Online gaming losses theft fuels shocking Pune tyre robbery,https://punemirror.com/city/crime/online-gaming-losses-theft-pune-tyre-robbery/,2026-05-11T12:42:24+00:00
Pune,Pune Mirror,Pune • Pune Mirror,https://punemirror.com/,85,Pune stepbrother car torching case: shocking family feud rocks Thergaon​,https://punemirror.com/city/pune/pune-stepbrother-car-torching-case/,2026-05-11T12:42:24+00:00
Pune,Pune Mirror,Pune • Pune Mirror,https://punemirror.com/,86,River Indie Review,https://punemirror.com/automobile/river-indie-electric-scooter-review-2026/,2026-05-11T12:42:24+00:00
Pune,Pune Mirror,Pune • Pune Mirror,https://punemirror.com/,87,Ai+ Smartphone Launches NovaFlip 5G,https://punemirror.com/technology/ai-smartphone-launches-novaflip-5g/,2026-05-11T12:42:24+00:00
Pune,Pune Mirror,Pune • Pune Mirror,https://punemirror.com/,88,2026 Škoda Kodiaq Review,https://punemirror.com/automobile/2026-skoda-kodiaq-review/,2026-05-11T12:42:24+00:00
Pune,Pune Mirror,Pune • Pune Mirror,https://punemirror.com/,89,I Will Find You delivers intense Netflix thriller shock,https://punemirror.com/entertainment/i-will-find-you-netflix-thriller/,2026-05-11T12:42:24+00:00
Pune,Pune Mirror,Pune • Pune Mirror,https://punemirror.com/,90,"Kartavya OTT release date delivers powerful, gripping cop thriller",https://punemirror.com/entertainment/kartavya-ott-release-date-netflix-thriller/,2026-05-11T12:42:24+00:00
Pune,Pune Mirror,Pune • Pune Mirror,https://punemirror.com/,91,"Samsung Galaxy S25 Ultra unbelievable deal brings powerful flagship under Rs 95,000",https://punemirror.com/technology/samsung-galaxy-s25-ultra-best-deal/,2026-05-11T12:42:24+00:00
Pune,Pune Mirror,Pune • Pune Mirror,https://punemirror.com/,92,Curiosity rover stuck on Mars: shocking Atacama ordeal,https://punemirror.com/space/curiosity-rover-stuck-on-mars-atacama-rock/,2026-05-11T12:42:24+00:00
Pune,Pune Mirror,Pune • Pune Mirror,https://punemirror.com/,93,"Pune Horror: Father Arrested After Daughter Killed, Son Found Alive in Forest Near Junnar",https://punemirror.com/city/pune/pune-junnar-father-arrested-child-murder-case/,2026-05-11T12:42:24+00:00
Pune,Pune Mirror,Pune • Pune Mirror,https://punemirror.com/,94,NCP (Sharad Pawar Faction) Spokesperson Vikas Lavande Allegedly Attacked with Ink in Lonikand,https://punemirror.com/city/pune/vikas-lavande-attack-lonikand-pune/,2026-05-11T12:42:24+00:00
Pune,Pune Mirror,Pune • Pune Mirror,https://punemirror.com/,95,Gold Prices Dip in Pune; 24-Carat Gold Falls by Rs. 340 per 10 Grams,https://punemirror.com/city/pune/gold-price-drop-pune-may-9-2026/,2026-05-11T12:42:24+00:00
Pune,Pune Mirror,Pune • Pune Mirror,https://punemirror.com/,96,"Scan, Ride, Repeat: PMPML’s Digital Leap into Smart Commuting",https://punemirror.com/city/pune/pmpml-qr-ticketing-scan-buy-pune/,2026-05-11T12:42:24+00:00
Pune,Pune Mirror,Pune • Pune Mirror,https://punemirror.com/,97,"Gold Rates in Pune Rise on May 8, 2026; 24 Carat Gold Jumps by Rs. 1,150 per 10 Grams",https://punemirror.com/city/pune/gold-rate-in-pune-today-may-8-2026/,2026-05-11T12:42:24+00:00
Pune,Pune Mirror,Pune • Pune Mirror,https://punemirror.com/,98,Pune Shopkeeper Held for Alleged Attempt to Assault 10-Year-Old Girl in Ganesh Peth,https://punemirror.com/city/pune/pune-shopkeeper-arrested-minor-girl-complaint/,2026-05-11T12:42:24+00:00
Pune,Pune Mirror,Pune • Pune Mirror,https://punemirror.com/,99,Pune Horror: 22-Year-Old Woman Stabbed to Death by Boyfriend in Chandan Nagar,https://punemirror.com/city/pune/pune-chandan-nagar-woman-murder-boyfriend-arrested/,2026-05-11T12:42:24+00:00
Pune,Pune Mirror,Pune • Pune Mirror,https://punemirror.com/,100,"Maharashtra SSC Result 2026 Declared: State Records 92.09% Pass Rate, Konkan Tops with 97.62%",https://punemirror.com/city/pune/maharashtra-ssc-result-2026-92-pass-konkan-tops/,2026-05-11T12:42:24+00:00
Pune,Pune Mirror,Pune • Pune Mirror,https://punemirror.com/,101,"Oscars AI rules spark bold, decisive shake-up at Academy",https://punemirror.com/entertainment/oscars-ai-rules-ban-ai-actors-scripts/,2026-05-11T12:42:24+00:00
Pune,Pune Mirror,Pune • Pune Mirror,https://punemirror.com/,102,Dhurandhar 2 OTT Release Date Confirmed: To Stream On Jiohotstar From May 15,https://punemirror.com/entertainment/movie/dhurandhar-2-ott-release-may-15-jiohotstar-raw-undekha-extended-cut/,2026-05-11T12:42:24+00:00
Pune,Pune Mirror,Pune • Pune Mirror,https://punemirror.com/,103,Former India U-19 Cricketer Amanpreet Singh Gill Passes Away at 36,https://punemirror.com/news/amanpreet-singh-gill-death-cricketer/,2026-05-11T12:42:24+00:00
Pune,Pune Mirror,Pune • Pune Mirror,https://punemirror.com/,104,"Exam The System Exposed delivers a powerful, unsettling OTT thriller",https://punemirror.com/entertainment/exam-the-system-exposed-ott-release-prime/,2026-05-11T12:42:24+00:00
Pune,Pune Mirror,Pune • Pune Mirror,https://punemirror.com/,105,"Under the Stars OTT release delivers a heartwarming, irresistible escape",https://punemirror.com/entertainment/under-the-stars-ott-release-romantic-comedy/,2026-05-11T12:42:24+00:00
Pune,Pune Mirror,Pune • Pune Mirror,https://punemirror.com/,106,"Everybody Loves Sohrab Handa: Powerful, Gripping Mystery Shines on ZEE5",https://punemirror.com/entertainment/everybody-loves-sohrab-handa-zee5-thriller/,2026-05-11T12:42:24+00:00
Pune,Pune Mirror,Pune • Pune Mirror,https://punemirror.com/,107,Music Composer Palaash Muchhal Booked Under SC-ST Act Over Alleged Casteist Remarks,https://punemirror.com/entertainment/palaash-muchhal-sc-st-act-booked-smriti-mandhana-friend-2026/,2026-05-11T12:42:24+00:00
Pune,Pune Mirror,Pune • Pune Mirror,https://punemirror.com/,108,"Twenty years later, The Devil Wears Prada 2 still fits the Cerulean Sweater like a glove.",https://punemirror.com/entertainment/devil-wears-prada-2-review-2026/,2026-05-11T12:42:24+00:00
Pune,IE,Pune • IE,https://indianexpress.com/article/cities/pune/,1,‘Messi of Chess’ Faustino Oro becomes second youngest Grandmaster in history,https://indianexpress.com/article/sports/chess/faustino-oro-second-youngest-grandmaster-history-abhimanyu-mishra-10682878/,2026-05-11T12:42:24+00:00
Pune,IE,Pune • IE,https://indianexpress.com/article/cities/pune/,2,Deepika-Ankita-Kumkum stay calm in windy conditions to defeat China for Archery World Cup Stage 2 gold,https://indianexpress.com/article/sports/india-beat-china-archery-world-cup-stage-2-gold-shanghai-10682657/,2026-05-11T12:42:24+00:00
Pune,IE,Pune • IE,https://indianexpress.com/article/cities/pune/,3,Foggy brain? Maybe it’s your gut,https://indianexpress.com/article/lifestyle/health/foggy-brain-maybe-its-your-gut-10681902/,2026-05-11T12:42:24+00:00
Pune,IE,Pune • IE,https://indianexpress.com/article/cities/pune/,4,"Dahisar river’s water quality to improve, Piyush Goyal inaugurates two sewage treatment plans",https://indianexpress.com/article/cities/mumbai/dahisar-rivers-water-quality-piyush-goyal-sewage-treatment-10682861/,2026-05-11T12:42:24+00:00
Pune,IE,Pune • IE,https://indianexpress.com/article/cities/pune/,5,Bird watchers record 208 bird species in Himachal Pradesh; 126 in Kangra,https://indianexpress.com/article/cities/chandigarh/himachal-pradesh-himalayan-bird-count-2026-record-species-districts-10682857/,2026-05-11T12:42:24+00:00
Pune,IE,Pune • IE,https://indianexpress.com/article/cities/pune/,6,"CBSE 12th Result 2026 Live Updates: CBSE Science, Arts, Commerce results at DigiLocker ‘coming soon’51 seconds ago",https://indianexpress.com/article/education/cbse-class-12th-result-2026-live-updates-date-results-link-science-arts-commerce-cbse-gov-in-cbseresults-nic-in-sarkari-results-10679382/,2026-05-11T12:42:24+00:00
Pune,IE,Pune • IE,https://indianexpress.com/article/cities/pune/,7,PBKS vs DC LIVE Score IPL 2026: Shreyas Iyer’s Punjab Kings will take on Axar Patel’s Delhi Capitals in Dharamsala3 minutes ago,https://indianexpress.com/article/sports/cricket/pbks-vs-dc-live-score-ipl-2026-punjab-kings-vs-delhi-capitals-knockout-race-elimination-scare-dharamsala-10683620/,2026-05-11T12:42:24+00:00
Pune,IE,Pune • IE,https://indianexpress.com/article/cities/pune/,8,"West Bengal Live Updates: Government terminates nominated members, directors and chairpersons across all departments4 minutes ago",https://indianexpress.com/article/cities/kolkata/west-bengal-government-live-updates-suvendu-adhikari-cabinet-meeting-10683312/,2026-05-11T12:42:24+00:00
Pune,IE,Pune • IE,https://indianexpress.com/article/cities/pune/,9,"Can file fresh pleas related to victory margin being less than deletion of votes in SIR: Supreme Court to Mamata Banerjee, others22 minutes ago",https://indianexpress.com/article/legal-news/west-bengal-sir-hearing-live-updates-supreme-court-to-resume-hearing-10683334/,2026-05-11T12:42:24+00:00
Pune,IE,Pune • IE,https://indianexpress.com/article/cities/pune/,10,Iran US War News Live Updates: Iran says ties with Egypt based on ‘mutual respect’ amid regional tensions40 minutes ago,https://indianexpress.com/article/world/us-news/iran-us-war-news-live-updates-donald-trump-hormuz-live-updates-10683279/,2026-05-11T12:42:24+00:00
Pune,IE,Pune • IE,https://indianexpress.com/article/cities/pune/,11,Mobile & Tabs,https://indianexpress.com/section/technology/mobile-tabs/,2026-05-11T12:42:24+00:00
Pune,IE,Pune • IE,https://indianexpress.com/article/cities/pune/,12,Food & Wine,https://indianexpress.com/section/lifestyle/food-wine/,2026-05-11T12:42:24+00:00
Pune,IE,Pune • IE,https://indianexpress.com/article/cities/pune/,13,Live Cricket Score,https://indianexpress.com/section/sports/cricket/live-score/,2026-05-11T12:42:24+00:00
Pune,IE,Pune • IE,https://indianexpress.com/article/cities/pune/,14,Indian Express Live TV,https://indianexpress.com/live-tv/,2026-05-11T12:42:24+00:00
Pune,IE,Pune • IE,https://indianexpress.com/article/cities/pune/,15,IPL 2026 Schedule,https://indianexpress.com/section/sports/ipl/schedules-fixtures/,2026-05-11T12:42:24+00:00
Pune,IE,Pune • IE,https://indianexpress.com/article/cities/pune/,16,IPL 2026 Stats,https://indianexpress.com/section/sports/ipl/stats/,2026-05-11T12:42:24+00:00
Pune,IE,Pune • IE,https://indianexpress.com/article/cities/pune/,17,IPL 2026 Points Table,https://indianexpress.com/section/sports/ipl/points-table/,2026-05-11T12:42:24+00:00
Pune,IE,Pune • IE,https://indianexpress.com/article/cities/pune/,18,Mumbai Weather Today,https://indianexpress.com/section/weather/mumbai-weather-forecast-today/,2026-05-11T12:42:24+00:00
Pune,IE,Pune • IE,https://indianexpress.com/article/cities/pune/,19,Bangalore Weather Today,https://indianexpress.com/section/weather/bangalore-weather-forecast-today/,2026-05-11T12:42:24+00:00
Pune,IE,Pune • IE,https://indianexpress.com/article/cities/pune/,20,Chennai Weather Today,https://indianexpress.com/section/weather/chennai-weather-forecast-today/,2026-05-11T12:42:24+00:00
Pune,IE,Pune • IE,https://indianexpress.com/article/cities/pune/,21,Pune Weather Today,https://indianexpress.com/section/weather/pune-weather-forecast-today/,2026-05-11T12:42:24+00:00
Pune,IE,Pune • IE,https://indianexpress.com/article/cities/pune/,22,Ahmedabad Weather Today,https://indianexpress.com/section/weather/ahmedabad-weather-forecast-today/,2026-05-11T12:42:24+00:00
Pune,IE,Pune • IE,https://indianexpress.com/article/cities/pune/,23,Lucknow Weather Today,https://indianexpress.com/section/weather/lucknow-weather-forecast-today/,2026-05-11T12:42:24+00:00
Pune,IE,Pune • IE,https://indianexpress.com/article/cities/pune/,24,Chandigarh Weather Today,https://indianexpress.com/section/weather/chandigarh-weather-forecast-today/,2026-05-11T12:42:24+00:00
Pune,IE,Pune • IE,https://indianexpress.com/article/cities/pune/,25,Indore Weather Today,https://indianexpress.com/section/weather/indore-weather-forecast-today/,2026-05-11T12:42:24+00:00
Pune,IE,Pune • IE,https://indianexpress.com/article/cities/pune/,26,Panaji Weather Today,https://indianexpress.com/section/weather/panaji-weather-forecast-today/,2026-05-11T12:42:24+00:00
Pune,IE,Pune • IE,https://indianexpress.com/article/cities/pune/,27,Manali Weather Today,https://indianexpress.com/section/weather/manali-weather-forecast-today/,2026-05-11T12:42:24+00:00
Pune,IE,Pune • IE,https://indianexpress.com/article/cities/pune/,28,Kodaikanal Weather Today,https://indianexpress.com/section/weather/kodaikanal-weather-forecast-today/,2026-05-11T12:42:24+00:00
Pune,IE,Pune • IE,https://indianexpress.com/article/cities/pune/,29,Thane Weather Today,https://indianexpress.com/section/weather/thane-weather-forecast-today/,2026-05-11T12:42:24+00:00
Pune,IE,Pune • IE,https://indianexpress.com/article/cities/pune/,30,Bijapur Weather Today,https://indianexpress.com/section/weather/bijapur-weather-forecast-today/,2026-05-11T12:42:24+00:00
Pune,IE,Pune • IE,https://indianexpress.com/article/cities/pune/,31,Gulbarga Weather Today,https://indianexpress.com/section/weather/gulbarga-weather-forecast-today/,2026-05-11T12:42:24+00:00
Pune,IE,Pune • IE,https://indianexpress.com/article/cities/pune/,32,Malegaon Weather Today,https://indianexpress.com/section/weather/malegaon-weather-forecast-today/,2026-05-11T12:42:24+00:00
Pune,IE,Pune • IE,https://indianexpress.com/article/cities/pune/,33,Bhusawal Weather Today,https://indianexpress.com/section/weather/bhusawal-weather-forecast-today/,2026-05-11T12:42:24+00:00
Pune,IE,Pune • IE,https://indianexpress.com/article/cities/pune/,34,Gurgaon Weather Today,https://indianexpress.com/section/weather/gurgaon-weather-forecast-today/,2026-05-11T12:42:24+00:00
Pune,IE,Pune • IE,https://indianexpress.com/article/cities/pune/,35,Yavatmal Weather Today,https://indianexpress.com/section/weather/yavatmal-weather-forecast-today/,2026-05-11T12:42:24+00:00
Pune,IE,Pune • IE,https://indianexpress.com/article/cities/pune/,36,Gangtok Weather Today,https://indianexpress.com/section/weather/gangtok-weather-forecast-today/,2026-05-11T12:42:24+00:00
Pune,IE,Pune • IE,https://indianexpress.com/article/cities/pune/,37,Thrissur Weather Today,https://indianexpress.com/section/weather/thrissur-weather-forecast-today/,2026-05-11T12:42:24+00:00
Pune,IE,Pune • IE,https://indianexpress.com/article/cities/pune/,38,Udupi Weather Today,https://indianexpress.com/section/weather/udupi-weather-forecast-today/,2026-05-11T12:42:24+00:00
Pune,IE,Pune • IE,https://indianexpress.com/article/cities/pune/,39,Koppal Weather Today,https://indianexpress.com/section/weather/koppal-weather-forecast-today/,2026-05-11T12:42:24+00:00
Pune,IE,Pune • IE,https://indianexpress.com/article/cities/pune/,40,Dhule Weather Today,https://indianexpress.com/section/weather/dhule-weather-forecast-today/,2026-05-11T12:42:24+00:00
Pune,IE,Pune • IE,https://indianexpress.com/article/cities/pune/,41,Ooty Weather Today,https://indianexpress.com/section/weather/ooty-weather-forecast-today/,2026-05-11T12:42:24+00:00
Pune,IE,Pune • IE,https://indianexpress.com/article/cities/pune/,42,Panchkula Weather Today,https://indianexpress.com/section/weather/panchkula-weather-forecast-today/,2026-05-11T12:42:24+00:00
