city,publisher,source,source_url,rank,headline,link,collected_at_iso
Bengaluru,DC,Bengaluru • DC,https://www.deccanchronicle.com/location/india/karnataka/bengaluru,1,FIFA World Cup 2026,https://www.deccanchronicle.com/fifa-world-cup-2026,2026-06-11T23:41:34+00:00
Bengaluru,DC,Bengaluru • DC,https://www.deccanchronicle.com/location/india/karnataka/bengaluru,2,Opinion and Editorials,https://www.deccanchronicle.com/opinion,2026-06-11T23:41:34+00:00
Bengaluru,DC,Bengaluru • DC,https://www.deccanchronicle.com/location/india/karnataka/bengaluru,3,Assembly Elections 2026,https://www.deccanchronicle.com/assembly-elections-2026,2026-06-11T23:41:34+00:00
Bengaluru,DC,Bengaluru • DC,https://www.deccanchronicle.com/location/india/karnataka/bengaluru,4,Telangana Rising 2047,https://www.deccanchronicle.com/tags/Telangana-Rising-2047,2026-06-11T23:41:34+00:00
Mumbai,Mumbai Mirror,Mumbai • Mumbai Mirror,https://mumbaimirror.indiatimes.com/mumbai,1,"After 54 yrs, Parsi baug residents to get tenancy rights",https://mumbaimirror.indiatimes.com/mumbai/after-54-yrs-parsi-baug-residents-to-get-tenancy-rights/articleshow/131665137.html,2026-06-11T23:41:34+00:00
Mumbai,Mumbai Mirror,Mumbai • Mumbai Mirror,https://mumbaimirror.indiatimes.com/mumbai,2,"Same uncle, new time zone",https://mumbaimirror.indiatimes.com/opinion/same-uncle-new-time-zone/articleshow/131665751.html,2026-06-11T23:41:34+00:00
Mumbai,Mumbai Mirror,Mumbai • Mumbai Mirror,https://mumbaimirror.indiatimes.com/mumbai,3,Who speaks for Harry Boxer?,https://mumbaimirror.indiatimes.com/mumbai/who-speaks-for-harry-boxer/articleshow/131665817.html,2026-06-11T23:41:34+00:00
Mumbai,Mumbai Mirror,Mumbai • Mumbai Mirror,https://mumbaimirror.indiatimes.com/mumbai,4,"Contractors lowball for EEH, WEH repair work",https://mumbaimirror.indiatimes.com/mumbai/cover-story/contractors-lowball-for-eeh-weh-repair-work/articleshow/131666675.html,2026-06-11T23:41:34+00:00
Mumbai,Mumbai Mirror,Mumbai • Mumbai Mirror,https://mumbaimirror.indiatimes.com/mumbai,5,New rake stuck in the yard,https://mumbaimirror.indiatimes.com/mumbai/new-rake-stuck-in-the-yard/articleshow/131665912.html,2026-06-11T23:41:34+00:00
Mumbai,Mumbai Mirror,Mumbai • Mumbai Mirror,https://mumbaimirror.indiatimes.com/mumbai,6,Plainclothes officials to monitor BEST bus drivers,https://mumbaimirror.indiatimes.com/mumbai/plainclothes-officials-to-monitor-best-bus-drivers/articleshow/131666667.html,2026-06-11T23:41:34+00:00
Mumbai,Mumbai Mirror,Mumbai • Mumbai Mirror,https://mumbaimirror.indiatimes.com/mumbai,7,‘When do we teach?’,https://mumbaimirror.indiatimes.com/mumbai/when-do-we-teach/articleshow/131666665.html,2026-06-11T23:41:34+00:00
Mumbai,Mumbai Mirror,Mumbai • Mumbai Mirror,https://mumbaimirror.indiatimes.com/mumbai,8,Ask The Sexpert,https://mumbaimirror.indiatimes.com/ask-the-sexpert,2026-06-11T23:41:34+00:00
Mumbai,Sakal,Mumbai • Sakal,https://www.esakal.com/pune,1,सकाळ लाईव्ह TV,https://www.esakal.com/live-tv,2026-06-11T23:41:34+00:00
Mumbai,Sakal,Mumbai • Sakal,https://www.esakal.com/pune,2,Refund and Cancellation,https://www.esakal.com/refund-and-cancellation,2026-06-11T23:41:34+00:00
Mumbai,Lokmat,Mumbai • Lokmat,https://www.lokmat.com/city/,1,Live News in Marathi,https://www.lokmat.com/live-news/,2026-06-11T23:41:34+00:00
Mumbai,Lokmat,Mumbai • Lokmat,https://www.lokmat.com/city/,2,पुण्यात टीसीएसच्या कर्मचाऱ्यानं उचललं टोकाचं पाऊल; कंपनीतील सहकाऱ्यांवर मानसिक छळाचा आरोप,https://www.lokmat.com/pune/tcs-employee-in-pune-takes-extreme-step-accuses-colleagues-of-mental-harassment-a-a629/,2026-06-11T23:41:34+00:00
Mumbai,Lokmat,Mumbai • Lokmat,https://www.lokmat.com/city/,3,"पेपरफुटी, निकाल विलंब ते भरतीतील अडथळे...; सीजेपीच्या 'या' मागण्या, सरकार काय निर्णय घेणार?",https://www.lokmat.com/pune/abhijeet-dipke-from-paper-leaks-delay-in-results-to-obstacles-in-recruitment-what-decision-will-the-government-take-on-these-demands-of-cjp-a-a1008/,2026-06-11T23:41:34+00:00
Mumbai,Lokmat,Mumbai • Lokmat,https://www.lokmat.com/city/,4,काही मिनिटांत होत्याचं नव्हतं..! स्विमिंग टँकमध्ये मुलाचा मृत्यू; गुन्हा दाखल,https://www.lokmat.com/pune/it-was-gone-in-a-few-minutes-boy-dies-in-swimming-tank-case-registered-a-a1008/,2026-06-11T23:41:34+00:00
Mumbai,Lokmat,Mumbai • Lokmat,https://www.lokmat.com/city/,5,"Pune Land Scam: मुंढवा गैरव्यवहारातील दस्त रद्द होण्याच्या मार्गावर, पुढील सुनावणी ६ जुलैला",https://www.lokmat.com/pune/pune-land-scam-mundhwa-scam-case-on-verge-of-cancellation-next-hearing-on-july-6-a-a1008/,2026-06-11T23:41:34+00:00
Mumbai,Lokmat,Mumbai • Lokmat,https://www.lokmat.com/city/,6,"कॉमेडियन प्रणीत मोरे, '३७०ची बिर्याणी'वाला हिमांशू जांग्रा, KEMची डॉ. सेजल पवारविरोधात FIR",https://www.lokmat.com/crime/fir-against-pranit-more-himanshu-jangra-dr-sejal-pawar-over-rs-370-biryani-remark-and-cadavers-genitals-joke-a-a747/,2026-06-11T23:41:34+00:00
Mumbai,Lokmat,Mumbai • Lokmat,https://www.lokmat.com/city/,7,"LIVE: 'देशी गाईला राष्ट्रीय प्राणी म्हणून घोषित करा', अबू आझमी यांची पंतप्रधानांकडे मागणी",https://www.lokmat.com/maharashtra/maharashtra-marathi-news-live-updates-11-june-2026-us-iran-attacks-strait-of-hormuz-donald-trump-pm-narendra-modi-cm-devendra-fadnavis-neet-exam-paper-leak-cockroach-janata-party-fuel-prices-mamata-banerjee-tmc-monsoon-rain-in-maharashtra-a-a573/,2026-06-11T23:41:34+00:00
Mumbai,Lokmat,Mumbai • Lokmat,https://www.lokmat.com/city/,8,"उपमुख्यमंत्री सुनेत्रा पवारांचे विमान दिल्लीला निघण्यापूर्वी बिघडलं, मुंबई विमानतळावर काय घडलं?",https://www.lokmat.com/mumbai/deputy-chief-minister-sunetra-pawars-plane-broke-down-before-leaving-for-delhi-what-happened-at-mumbai-airport-a-a571/,2026-06-11T23:41:34+00:00
Mumbai,Lokmat,Mumbai • Lokmat,https://www.lokmat.com/city/,9,सोशल वायरल :,https://www.lokmat.com/social-viral/,2026-06-11T23:41:34+00:00
Mumbai,Lokmat,Mumbai • Lokmat,https://www.lokmat.com/city/,10,"""चूक दोघांची, मग नोकरी एकाचीच का गेली?""; KEMची डॉ. सेजल पवारविरोधात इंटरनेटवर संताप",https://www.lokmat.com/social-viral/sejal-pawar-viral-video-kem-doctor-apologises-after-cadaver-joke-at-pranit-more-show-video-a-a747/,2026-06-11T23:41:34+00:00
Mumbai,Lokmat,Mumbai • Lokmat,https://www.lokmat.com/city/,11,रिअल इस्टेट :,https://www.lokmat.com/real-estate/,2026-06-11T23:41:34+00:00
Mumbai,Lokmat,Mumbai • Lokmat,https://www.lokmat.com/city/,12,"रिअल इस्टेट हादरवणार...! मुंबईत २ लाख तर पुण्यात १ लाख घरांची डिलिव्हरी रखडणार, युद्धाचे धक्कादायक दुष्परिणाम...",https://www.lokmat.com/real-estate/pune-flat-delivery-crisis-real-estate-will-be-shaken-delivery-of-2-lakh-houses-in-mumbai-and-1-lakh-in-pune-will-be-delayed-shocking-consequences-of-war-a-a607/,2026-06-11T23:41:34+00:00
Mumbai,Lokmat,Mumbai • Lokmat,https://www.lokmat.com/city/,13,"विटाभट्ट्या, बांधकामस्थळे आणि कारखान्यांत करपत आहे बालमजुरांचे भविष्य",https://www.lokmat.com/nagpur/child-protection-department-took-into-custody-41-children-who-were-working-as-child-laborers-a-a629/,2026-06-11T23:41:34+00:00
Mumbai,Lokmat,Mumbai • Lokmat,https://www.lokmat.com/city/,14,अमेरिकेत फडकणार बुद्ध-आंबेडकर विचारांचा धम्मध्वज; टेक्सासला उभारले महाबोधी इंटरनॅशनल बौद्ध सेंटर,https://www.lokmat.com/nagpur/the-buddhist-flag-of-buddha-ambedkars-thoughts-will-fly-in-america-mahabodhi-international-buddhist-center-set-up-in-texas-a-a876-c1000/,2026-06-11T23:41:34+00:00
Mumbai,Lokmat,Mumbai • Lokmat,https://www.lokmat.com/city/,15,"मान्सूनची प्रतीक्षा वाढली, विदर्भ 44°C च्या ज्वाळांत! उष्णतेच्या लाटेचा आणखी 24 तास इशारा",https://www.lokmat.com/nagpur/the-wait-for-monsoon-has-increased-vidarbha-is-in-the-heat-of-44degc-heat-wave-warning-for-another-24-hours-a-a957-c1000/,2026-06-11T23:41:34+00:00
Mumbai,Lokmat,Mumbai • Lokmat,https://www.lokmat.com/city/,16,"मूर्तिकार, विटा आणि कवेलू उत्पादकांना दिलासा; ७०० ब्रास माती-वाळू मोफत देणार सरकार",https://www.lokmat.com/nagpur/relief-for-sculptors-brick-and-stone-manufacturers-government-will-provide-700-brass-of-clay-and-sand-free-of-cost-a-a876-c1000/,2026-06-11T23:41:34+00:00
Mumbai,Lokmat,Mumbai • Lokmat,https://www.lokmat.com/city/,17,'मोठ्या इमारतींना वेगळा तर सर्वसामान्यांच्या घरांना स्वतंत्र दर' महसूल मंत्री चंद्रशेखर बावनकुळे,https://www.lokmat.com/nagpur/separate-rates-for-large-buildings-and-separate-rates-for-common-peoples-homes-revenue-minister-chandrashekhar-bawankule-a-a876-c1000/,2026-06-11T23:41:34+00:00
Mumbai,Lokmat,Mumbai • Lokmat,https://www.lokmat.com/city/,18,"""माझा शपथविधी निश्चित होता, पण...""; समीर भुजबळांचा गौप्यस्फोट; भाजपाचा होता विरोध?",https://www.lokmat.com/maharashtra/my-oath-taking-ceremony-was-certain-but-ncp-sameer-bhujbal-revelation-was-bjp-opposed-a-a629/,2026-06-11T23:41:34+00:00
Mumbai,Lokmat,Mumbai • Lokmat,https://www.lokmat.com/city/,19,"राष्ट्रवादीकडून राजेंद्र जैन यांना राज्यसभेची उमेदवारी, छगन भुजबळ समर्थकांची उघड नाराजी, फलकबाजीमुळे चर्चांना उधाण",https://www.lokmat.com/nashik/rajendra-jain-nominated-for-rajya-sabha-by-ncp-chhagan-bhujbal-supporters-openly-displeased-placards-spark-discussions-a-a941/,2026-06-11T23:41:34+00:00
Mumbai,Lokmat,Mumbai • Lokmat,https://www.lokmat.com/city/,20,"""मीच नमाजचं ट्रेनिंग द्यायचे"", निदा खानची कबुली; TCS प्रकरणात चार्जशीटमधून ५ मोठे खुलासे",https://www.lokmat.com/crime/five-big-revelations-in-nashik-tcs-case-nida-khan-confesses-i-was-trained-girl-to-pray-namaz-a-a597/,2026-06-11T23:41:34+00:00
Mumbai,Lokmat,Mumbai • Lokmat,https://www.lokmat.com/city/,21,"अल्पवयीन मुलीचे बाळ विकणार होते डॉक्टर, खासगी रुग्णालयातील चार डॉक्टरांसह ११ जण अटकेत",https://www.lokmat.com/nashik/doctor-was-going-to-sell-the-baby-of-a-minor-girl-11-people-including-four-doctors-from-a-private-hospital-arrested-a-a653/,2026-06-11T23:41:34+00:00
Mumbai,Lokmat,Mumbai • Lokmat,https://www.lokmat.com/city/,22,मान्सून लांबणीवर! नाशिकचा पाणीसाठा आला २६ टक्क्यांवर! पाचशे गावांची तहान १४३ टँकरवर,https://www.lokmat.com/nashik/water-scarcity-monsoon-delayed-nashiks-water-supply-reaches-26-percent-143-tankers-to-quench-the-thirst-of-500-villages-a-a893-c571/,2026-06-11T23:41:34+00:00
Mumbai,Lokmat,Mumbai • Lokmat,https://www.lokmat.com/city/,23,आजरा पं. स.च्या सभापती जयश्री गाडे यांचा कुणबी जातीचा दाखला अवैद्य; राष्ट्रवादीला धक्का,https://www.lokmat.com/kolhapur/azra-pt-samiti-chairman-jayashree-gades-kunbi-caste-certificate-invalid-shock-to-ncp-a-a629/,2026-06-11T23:41:34+00:00
Mumbai,Lokmat,Mumbai • Lokmat,https://www.lokmat.com/city/,24,"फोन आला म्हणून बाहेर पडला, अन् घरी परत आलाच नाही; कोल्हापुरातील तरुण उद्योजकाने संपविले जीवन",https://www.lokmat.com/kolhapur/young-entrepreneur-from-kolhapur-ends-his-life-a-a746/,2026-06-11T23:41:34+00:00
Mumbai,Lokmat,Mumbai • Lokmat,https://www.lokmat.com/city/,25,Kolhapur: अंबाबाईचं नुसतं शिखरच दिसतंय.. अहो दादा दर्शनाला जायचं कसं ?; कारवाईनंतर चार दिवसांत पुन्हा अतिक्रमण,https://www.lokmat.com/kolhapur/ambabai-temple-precincts-besieged-by-encroachments-devotees-unable-to-find-the-path-to-the-temple-a-a746/,2026-06-11T23:41:34+00:00
Mumbai,Lokmat,Mumbai • Lokmat,https://www.lokmat.com/city/,26,"कोल्हापुरात गॅस सिलिंडरचा काळाबाजार; ३८ टाक्या जप्त, दोघांना अटक",https://www.lokmat.com/kolhapur/black-market-of-gas-cylinders-in-kolhapur-38-tanks-seized-two-arrested-a-a746/,2026-06-11T23:41:34+00:00
Mumbai,Lokmat,Mumbai • Lokmat,https://www.lokmat.com/city/,27,दूध संस्थांसह गुऱ्हाळघरे ‘अन्न-औषध’च्या रडारवर; भेसळ आढळल्यास थेट कारवाईचे आदेश,https://www.lokmat.com/kolhapur/milk-institutes-and-other-food-establishments-on-the-radar-of-food-and-drug-administration-direct-action-ordered-if-adulteration-is-found-a-a746/,2026-06-11T23:41:34+00:00
Mumbai,Lokmat,Mumbai • Lokmat,https://www.lokmat.com/city/,28,"सांगली हादरली! हमाल पंचायत नेत्याच्या घरात घुसून १४ वर्षीय नातवाला मारली गोळी, संशयित फरार",https://www.lokmat.com/crime/dispute-over-railway-contract-firing-on-innocent-14-year-old-boy-to-clash-between-two-groups-a-a629/,2026-06-11T23:41:34+00:00
Mumbai,Lokmat,Mumbai • Lokmat,https://www.lokmat.com/city/,29,"Vidhan Parishad Election: कुणी नाराज नाही, जयंत पाटील पायात साप सोडताहेत - शिवेंद्रसिंहराजे",https://www.lokmat.com/satara/no-one-in-the-mahayuti-is-disgruntled-jayant-patil-is-spreading-misconceptions-says-shivendraraje-bhosale-a-a746/,2026-06-11T23:41:34+00:00
Mumbai,Lokmat,Mumbai • Lokmat,https://www.lokmat.com/city/,30,Vidhan Parishad Election: सांगली-सातारा विधानपरिषद रणांगणात ‘कोट्यधीश’ उमेदवार आमने-सामने !,https://www.lokmat.com/maharashtra/mahayuti-candidate-dhairyasheel-kadam-and-maha-aghadi-candidate-abhaysinh-jagtap-are-millionaires-in-the-sangli-satara-vidhan-parishad-election-a-a746/,2026-06-11T23:41:34+00:00
Mumbai,Lokmat,Mumbai • Lokmat,https://www.lokmat.com/city/,31,"ladki bahin yojana: सांगली जिल्ह्यातील लाखांवर लाडक्या बहिणी कायमच्या अपात्र, ई-केवायसीची मुदत संपली",https://www.lokmat.com/sangli/lakhs-of-ladki-bahin-in-sangli-district-permanently-ineligible-a-a746/,2026-06-11T23:41:34+00:00
Mumbai,Lokmat,Mumbai • Lokmat,https://www.lokmat.com/city/,32,सौरपथदिव्यांच्या निविदेवरून सांगली जिल्हा परिषदेत राडा; सत्ताधारी गटाच्या वर्षा कांबळे यांच्या आंदोलनास भाजपचा पाठिंबा,https://www.lokmat.com/sangli/ruckus-in-sangli-zilla-parishad-over-solar-street-light-tender-bjp-supports-ruling-partys-varsha-kambles-protest-a-a746/,2026-06-11T23:41:34+00:00
Mumbai,Lokmat,Mumbai • Lokmat,https://www.lokmat.com/city/,33,"Satara News: अश्रू, आठवणी अन् आयुष्यभराची वेदना; अपघाताने तिन्ही भावंडे हिरावली",https://www.lokmat.com/satara/three-siblings-from-murum-in-satara-district-killed-in-a-accident-a-tempo-and-a-two-wheeler-a-a746/,2026-06-11T23:41:34+00:00
Mumbai,Lokmat,Mumbai • Lokmat,https://www.lokmat.com/city/,34,Krishna Factory Election: 'कृष्णा'च्या मैदानात संस्थापक पॅनलची बांधणी जुळली,https://www.lokmat.com/sangli/the-election-for-the-krishna-factory-has-evolved-beyond-a-mere-contest-for-the-board-of-directors-into-a-battle-of-prestige-the-founders-panel-has-successfully-consolidated-its-organization-a-a746/,2026-06-11T23:41:34+00:00
Mumbai,Lokmat,Mumbai • Lokmat,https://www.lokmat.com/city/,35,"उरीतील स्फोटात कराड येथील जवान अर्जुन जाधव शहीद, शुक्रवारी होणार शासकीय इतमामात अंत्यसंस्कार",https://www.lokmat.com/satara/karad-soldier-arjun-jadhav-martyred-in-uri-blast-cremation-with-state-honours-to-be-held-on-friday-a-a746/,2026-06-11T23:41:34+00:00
Mumbai,Lokmat,Mumbai • Lokmat,https://www.lokmat.com/city/,36,"Akola: अधिक मासातील धार्मिक स्नान ठरले अखेरचे; मुलगाा बुडायला लागला, आईने उडी मारली; दोघांचाही नदीत बुडून मृत्यू",https://www.lokmat.com/akola/akola-religious-bath-in-the-rainy-season-turned-out-to-be-the-last-mother-and-daughter-drowned-in-the-river-while-saving-their-child-a-a571/,2026-06-11T23:41:34+00:00
Mumbai,Lokmat,Mumbai • Lokmat,https://www.lokmat.com/city/,37,"अकोल्यातील आणखी एक भीषण वास्तव; बेडचा दुष्काळ, रुग्ण जमिनीवर झोपलेले",https://www.lokmat.com/akola/another-grim-reality-in-akola-bed-shortage-patients-sleeping-on-the-floor-a-a653/,2026-06-11T23:41:34+00:00
Mumbai,Lokmat,Mumbai • Lokmat,https://www.lokmat.com/city/,38,महाराष्ट्राच्या वीरपुत्राला मरणोत्तर 'कीर्ती चक्र'; प्रोटोकॉल सोडत राष्ट्रपतींनी जवानाच्या मातेला मारली मिठी,https://www.lokmat.com/national/maharashtra-martyr-who-killed-2-terrorists-gets-kirti-chakra-president-hugs-emotional-mother-a-a1001/,2026-06-11T23:41:34+00:00
Mumbai,Lokmat,Mumbai • Lokmat,https://www.lokmat.com/city/,39,"“६० आमदारांच्या संख्याबळावर CM पद मागणे योग्य नाही”; प्रताप सरनाईकांचे विधान, चर्चांना उधाण",https://www.lokmat.com/maharashtra/minister-pratap-sarnaik-said-that-it-is-not-right-to-ask-for-the-cm-post-on-the-strength-of-60-mlas-a-a719/,2026-06-11T23:41:34+00:00
Mumbai,Lokmat,Mumbai • Lokmat,https://www.lokmat.com/city/,40,"एका हातात मूल, पाठीवर ब्रेन स्ट्रोकग्रस्त पती; सरकारी रुग्णालयातील विदारक वास्तव उघड",https://www.lokmat.com/akola/child-in-one-hand-husband-suffering-from-brain-stroke-on-his-back-the-shocking-reality-of-a-government-hospital-is-revealed-a-a1000/,2026-06-11T23:41:34+00:00
Mumbai,Lokmat,Mumbai • Lokmat,https://www.lokmat.com/city/,41,"महाराष्ट्र केसरी सिकंदर शेखचा अपघात, पायाला किरकोळ दुखापत; बक्षीस मिळालेल्या चारचाकीचा चक्काचूर",https://www.lokmat.com/sangli/maharashtra-kesari-sikander-sheikhs-car-accident-on-nagpur-ratnagiri-highway-at-vitthalwadi-in-sangli-district-a-a746/,2026-06-11T23:41:34+00:00
Mumbai,Lokmat,Mumbai • Lokmat,https://www.lokmat.com/city/,42,"सिद्धू भोसलेलाचा मातीच्या ढिगाऱ्यात आढळला कुजलेला मृतदेह, तुटलेल्या दातावरून पटली ओळख",https://www.lokmat.com/solapur/solapur-crime-sidhu-bhosales-decomposed-body-found-in-a-pile-of-dirt-identified-from-broken-teeth-a-a571/,2026-06-11T23:41:34+00:00
Mumbai,Lokmat,Mumbai • Lokmat,https://www.lokmat.com/city/,43,पांडुरंगाची भक्ती सातासमुद्रापार! पन्नास दिवसात ११ देशांचा प्रवास; पहिल्यांदाच लंडनमधून येणार विठ्ठलाची पालखी,https://www.lokmat.com/solapur/pandurangas-devotion-crosses-the-ocean-travels-to-11-countries-in-fifty-days-vitthals-palanquin-will-come-from-london-for-the-first-time-a-a571/,2026-06-11T23:41:34+00:00
Mumbai,Lokmat,Mumbai • Lokmat,https://www.lokmat.com/city/,44,Vidhan Parishad Election 2026: निवडणूक चुरशीने व्हावी ही नगरसेवकांचीच इच्छा; पण मोहिते-पाटलांची रणनीती काय?,https://www.lokmat.com/solapur/vidhan-parishad-election-2026-the-corporators-want-the-election-to-be-held-in-a-tight-manner-but-what-is-the-strategy-of-mohite-patal-a-a571/,2026-06-11T23:41:34+00:00
Mumbai,Lokmat,Mumbai • Lokmat,https://www.lokmat.com/city/,45,MLC Election: राजेंद्र राऊतांकडे सर्वाधिक ६८ कोटी; तर जीवन जानकरांकडे सर्वात कमी ८६ लाखांची संपत्ती,https://www.lokmat.com/solapur/mlc-election-rajendra-raut-has-the-highest-wealth-of-rs-68-crore-while-jeevan-jankar-has-the-lowest-wealth-of-rs-86-lakh-a-a571/,2026-06-11T23:41:34+00:00
Mumbai,Lokmat,Mumbai • Lokmat,https://www.lokmat.com/city/,46,साईनगरीत भक्तांच्या श्रद्धेशी खेळ! विक्रेत्यांकडे दगडासारखे कडक आणि बुरशी लागलेले पेढे,https://www.lokmat.com/ahilyanagar/fda-raids-sweet-shops-in-shirdi-for-selling-fungus-laced-pedas-to-sai-devotees-a-a1001/,2026-06-11T23:41:34+00:00
Mumbai,Lokmat,Mumbai • Lokmat,https://www.lokmat.com/city/,47,गर्भलिंग निदान प्रकरणी मेडिकल चालकाला अटक; कारही जप्त,https://www.lokmat.com/ahilyanagar/medical-driver-arrested-in-fetal-gender-detection-case-car-also-seized-a-a653/,2026-06-11T23:41:34+00:00
Mumbai,Lokmat,Mumbai • Lokmat,https://www.lokmat.com/city/,48,कारखान्याचा जीएसटी हॉटेलच्या नावावर! अधिकाऱ्याने युजर आयडी वापरून ३.८७ कोटी केले गायब,https://www.lokmat.com/ahilyanagar/ahilyanagar-gst-fraud-retired-assistant-commissioner-booked-for-387-crore-embezzlement-using-official-user-id-a-a1001/,2026-06-11T23:41:34+00:00
Mumbai,Lokmat,Mumbai • Lokmat,https://www.lokmat.com/city/,49,"""होय, मीच मारलं पप्पांना""; चापट मारल्याच्या रागातून इंजिनिअर मुलाने केली वडिलांची हत्या",https://www.lokmat.com/ahilyanagar/engineer-arrested-for-killing-father-in-shrirampur-after-family-dispute-a-a1001/,2026-06-11T23:41:34+00:00
