city,publisher,source,source_url,rank,headline,link,collected_at_iso
Delhi-NCR,Jagran,Delhi-NCR • Jagran,https://www.jagran.com/delhi-ncr,45,"दिल्लीवालों को जाम से मिलेगी राहत, ब्रिटानिया चौक से आउटर रिंग रोड तक बनेगा 6 KM एलिवेटेड रोड",https://www.jagran.com/delhi/new-delhi-city-delhi-britannia-chowk-elevated-road-to-ease-traffic-congestion-40296608.html,2026-07-06T15:46:24+00:00
Delhi-NCR,Jagran,Delhi-NCR • Jagran,https://www.jagran.com/delhi-ncr,46,"पोंछा लगाते गिरी या हुई हत्या? फरीदाबाद में 6 माह की गर्भवती की मौत पर उठे सवाल, 7 दिन मायके रुकना पड़ा भारी",https://www.jagran.com/haryana/faridabad-faridabad-pregnant-womans-suspicious-death-family-alleges-murder-40297111.html,2026-07-06T15:46:24+00:00
Delhi-NCR,Jagran,Delhi-NCR • Jagran,https://www.jagran.com/delhi-ncr,47,"फरीदाबाद वाले ध्यान दें! SIR की आखिरी तारीख 10 जुलाई, मतदाता सूची से नाम कटा तो नहीं मिलेगा सरकारी योजनाओं का लाभ",https://www.jagran.com/haryana/faridabad-faridabad-sir-moolchand-sharma-urges-voter-list-form-submission-40296829.html,2026-07-06T15:46:24+00:00
Delhi-NCR,Jagran,Delhi-NCR • Jagran,https://www.jagran.com/delhi-ncr,48,फरीदाबाद में मोबाइल पर बात कर रहे बस ड्राइवर ने 6 साल की बच्ची को कुचला; हादसे में मासूम की दर्दनाक मौत,https://www.jagran.com/haryana/faridabad-faridabad-bus-accident-girl-crushed-by-driver-on-phone-40296315.html,2026-07-06T15:46:24+00:00
Delhi-NCR,Jagran,Delhi-NCR • Jagran,https://www.jagran.com/delhi-ncr,49,Faridabad Mandi Bhav Today: डबुआ मंडी में आज क्या रहे फल-सब्जियों और फसलों के दाम? देखें पूरी लिस्ट,https://www.jagran.com/haryana/faridabad-faridabad-dabua-mandi-fruit-veg-prices-fluctuate-40296143.html,2026-07-06T15:46:24+00:00
Delhi-NCR,Jagran,Delhi-NCR • Jagran,https://www.jagran.com/delhi-ncr,50,"'पापा को पुलिस पकड़ ले गई', अकेले बच्चों को निशाना बना रहे ठग; कहकर लूट रहे आभूषण",https://www.jagran.com/haryana/faridabad-faridabad-conman-targets-kids-steals-gold-with-police-lie-40295846.html,2026-07-06T15:46:24+00:00
Delhi-NCR,Jagran,Delhi-NCR • Jagran,https://www.jagran.com/delhi-ncr,51,"रास्ते में उड़ा दी 3400 किलो LPG गैस, गुजरात से उत्तराखंड जा रहे टैंकर में बड़ी हेराफेरी, ड्राइवर फरार",https://www.jagran.com/haryana/palwal-palwal-lpg-tanker-gas-theft-driver-absconds-with-3400kg-40296740.html,2026-07-06T15:46:24+00:00
Delhi-NCR,Jagran,Delhi-NCR • Jagran,https://www.jagran.com/delhi-ncr,52,"पंजाब से गिरफ्तार हुआ पलवल का 5000 रुपये का इनामी बदमाश, पांच साल से था फरार",https://www.jagran.com/haryana/palwal-palwals-5k-wanted-criminal-mohammad-yusuf-arrested-in-mohali-40296641.html,2026-07-06T15:46:24+00:00
Delhi-NCR,Jagran,Delhi-NCR • Jagran,https://www.jagran.com/delhi-ncr,53,"पलवल: झूठे मुकदमे और प्रताड़ना से परेशान होकर युवक ने की आत्महत्या, नूंह के 7 लोगों पर केस दर्ज",https://www.jagran.com/haryana/palwal-palwal-man-dies-by-suicide-after-false-case-harassment-40296603.html,2026-07-06T15:46:24+00:00
Delhi-NCR,Jagran,Delhi-NCR • Jagran,https://www.jagran.com/delhi-ncr,54,"पलवल में 63 लाख की साइबर ठगी, आरोपी हिमाचल प्रदेश से गिरफ्तार; 'इनकम ग्रोथ प्लान' के झांसे में फंसा पीड़ित",https://www.jagran.com/haryana/palwal-palwal-cyber-fraud-himachal-man-arrested-in-63-lakh-scam-40295816.html,2026-07-06T15:46:24+00:00
Delhi-NCR,Jagran,Delhi-NCR • Jagran,https://www.jagran.com/delhi-ncr,55,"होटल की आड़ में चल रहा था ये धंधा, छापामारी के दौरान मालिक गिरफ्तार; मामला दर्ज",https://www.jagran.com/haryana/palwal-palwal-hotel-owner-arrested-with-345-kg-poppy-husk-40295773.html,2026-07-06T15:46:24+00:00
Delhi-NCR,Jagran,Delhi-NCR • Jagran,https://www.jagran.com/delhi-ncr,56,"यूपी के आठ जिलों में पुराने बस-ट्रक स्क्रैप करने पर रोड टैक्स होगा माफ, EV वाहन खरीदने पर मिलेगी छूट",https://www.jagran.com/uttar-pradesh/lucknow-city-up-vehicle-scrapping-policy-road-tax-waiver-ev-incentives-in-ncr-40297160.html,2026-07-06T15:46:24+00:00
Delhi-NCR,Jagran,Delhi-NCR • Jagran,https://www.jagran.com/delhi-ncr,57,"न्यू कानपुर सिटी में विकास कार्य तेज, केडीए ने 8 बैकहो लोडर लगा शुरू कराई खुदाई",https://www.jagran.com/uttar-pradesh/kanpur-city-kda-resumes-new-kanpur-city-development-amidst-protests-40297080.html,2026-07-06T15:46:24+00:00
Delhi-NCR,Jagran,Delhi-NCR • Jagran,https://www.jagran.com/delhi-ncr,58,"खुशखबरी: पीतल नगरी को मिला 100 बेड का ESIC अस्पताल, 4.5 लाख से अधिक लोगों को मिलेगा सीधा फायदा",https://www.jagran.com/uttar-pradesh/moradabad-city-moradabad-100-bed-esic-hospital-yogi-cabinet-approves-free-land-allocation-40297163.html,2026-07-06T15:46:24+00:00
Delhi-NCR,Jagran,Delhi-NCR • Jagran,https://www.jagran.com/delhi-ncr,59,"AU UG Admission 2026-27 : इलाहाबाद विश्वविद्यालय में 3698 सीटों पर होंगे स्नातक प्रवेश, BA में सबसे अधिक 1995 सीटें",https://www.jagran.com/uttar-pradesh/prayagraj-allahabad-university-ug-admission-2026-27-3698-seats-open-40297162.html,2026-07-06T15:46:24+00:00
Delhi-NCR,Jagran,Delhi-NCR • Jagran,https://www.jagran.com/delhi-ncr,60,यमुना एक्सप्रेसवे पर हिट एंड रन: दो कारों की टक्कर के बाद सड़क पर खड़े 7 लोगों को तेज रफ्तार वाहन ने लिया चपेट में; मासूम की मौत,https://www.jagran.com/uttar-pradesh/mathura-yamuna-expressway-hit-run-child-dies-7-injured-in-mathura-40297156.html,2026-07-06T15:46:24+00:00
Delhi-NCR,Jagran,Delhi-NCR • Jagran,https://www.jagran.com/delhi-ncr,61,"टैक्सपेयर्स ध्यान दें! केवल आर्थिक हानि नहीं है शेयर बाजार का नुकसान, जानें कैसे यह कम करेगा आपकी टैक्स देनदारी में",https://www.jagran.com/uttar-pradesh/kanpur-city-taxpayers-guide-turn-your-stock-market-losses-into-tax-savings-before-the-july-31-itr-deadline-40297077.html,2026-07-06T15:46:24+00:00
Delhi-NCR,Jagran,Delhi-NCR • Jagran,https://www.jagran.com/delhi-ncr,62,"कौन हैं कृष्ण मोहन? जिन्हें राम मंदिर बैठक में मिली रामजन्मभूमि ट्रस्ट की कमान, आरएसएस से नाता",https://www.jagran.com/uttar-pradesh/ayodhya-ram-mandir-trust-meeting-krishna-mohan-interim-general-secretary-after-theft-case-know-who-are-krishna-mohan-40297087.html,2026-07-06T15:46:24+00:00
Delhi-NCR,Jagran,Delhi-NCR • Jagran,https://www.jagran.com/delhi-ncr,63,"मुंबई में मूसलाधार बारिश, नासिक में मंगलवार को बादल फटने की",https://www.jagran.com/maharashtra/mumbai-mumbai-rains-13-dead-infrastructure-halted-nashik-cloudburst-alert-40296957.html,2026-07-06T15:46:24+00:00
Delhi-NCR,Jagran,Delhi-NCR • Jagran,https://www.jagran.com/delhi-ncr,64,"चंडीगढ़ एस्टेट ऑफिस के क्लर्क पर आरोप तय, 20 हजार रुपये रिश्",https://www.jagran.com/punjab/chandigarh-chandigarh-estate-office-clerk-charged-in-20k-bribe-case-40296981.html,2026-07-06T15:46:24+00:00
Delhi-NCR,Jagran,Delhi-NCR • Jagran,https://www.jagran.com/delhi-ncr,65,"रेवाड़ी के लोगों के लिए खुशखबरी, मिलेगी मेट्रो की सौगात; गुर",https://www.jagran.com/haryana/rewari-panchgaon-metro-gurugram-extension-to-benefit-rewari-dharuhera-40296935.html,2026-07-06T15:46:24+00:00
Delhi-NCR,Jagran,Delhi-NCR • Jagran,https://www.jagran.com/delhi-ncr,66,"चंडीगढ़ से हिमाचल का सफर अब मिनटों में, 3500 रुपये में कर सक",https://www.jagran.com/himachal-pradesh/shimla-himachal-helicopter-service-kullumandichandigarh-flights-start-40296947.html,2026-07-06T15:46:24+00:00
Delhi-NCR,Jagran,Delhi-NCR • Jagran,https://www.jagran.com/delhi-ncr,67,सोनभद्र में बारिश से बचने के लिए कच्चे मकान में बैठ गई बच्ची,https://www.jagran.com/uttar-pradesh/sonbhadra-girl-dies-after-wall-collapses-in-sonbhadra-she-had-taken-shelter-from-the-rain-in-a-mud-house-40296983.html,2026-07-06T15:46:24+00:00
Delhi-NCR,Jagran,Delhi-NCR • Jagran,https://www.jagran.com/delhi-ncr,68,CIA फर्जी एजेंट: इंडोनेशियाई राष्ट्रपति और अरबों डॉलर की डिफ,https://www.jagran.com/world/other-gaurav-srivastava-posed-as-cia-agent-for-indonesia-defense-deal-40296817.html,2026-07-06T15:46:24+00:00
Delhi-NCR,Jagran,Delhi-NCR • Jagran,https://www.jagran.com/delhi-ncr,69,चंडीगढ़ में लैंडमार्क अस्पताल के डाॅक्टर और स्टाफ पर चलेगा म,https://www.jagran.com/punjab/chandigarh-chandigarh-landmark-hospital-doctor-charged-in-negligence-death-40296968.html,2026-07-06T15:46:24+00:00
Delhi-NCR,Jagran,Delhi-NCR • Jagran,https://www.jagran.com/delhi-ncr,70,बिहार के स्नातक पास छात्राओं की बल्ले-बल्ले! जल्द खाते में आ,https://www.jagran.com/bihar/patna-city-bihar-kanya-utthan-yojana-15-lakh-graduate-girls-to-get-50k-40296970.html,2026-07-06T15:46:24+00:00
Delhi-NCR,Jagran,Delhi-NCR • Jagran,https://www.jagran.com/delhi-ncr,71,झारखंड की नई औद्योगिक नीति: सुपर स्पेशियलिटी अस्पतालों और शै,https://www.jagran.com/jharkhand/ranchi-jharkhand-industrial-policy-2026-30-cr-subsidy-for-hospitals-40296907.html,2026-07-06T15:46:24+00:00
Delhi-NCR,Jagran,Delhi-NCR • Jagran,https://www.jagran.com/delhi-ncr,72,"दरभंगा में शिक्षकों और पेंशनभोगियों को बड़ी राहत, 20 जुलाई त",https://www.jagran.com/bihar/darbhanga-lnmu-darbhanga-salary-and-pension-grievance-camp-for-staff-40296958.html,2026-07-06T15:46:24+00:00
Delhi-NCR,Jagran,Delhi-NCR • Jagran,https://www.jagran.com/delhi-ncr,73,Did You Know,https://www.jagran.com/did-you-know-news-hindi.html,2026-07-06T15:46:24+00:00
Delhi-NCR,Jagran,Delhi-NCR • Jagran,https://www.jagran.com/delhi-ncr,74,फुटबॉल विश्व कप,https://www.jagran.com/topics/fifa-world-cup-2026,2026-07-06T15:46:24+00:00
Delhi-NCR,Jagran,Delhi-NCR • Jagran,https://www.jagran.com/delhi-ncr,75,मिडिल ईस्ट संकट,https://www.jagran.com/topics/Israel-Iran-Conflict,2026-07-06T15:46:24+00:00
Delhi-NCR,Jagran,Delhi-NCR • Jagran,https://www.jagran.com/delhi-ncr,76,फीफा वर्ल्ड कप 2026,https://www.jagran.com/topics/FIFA-World-Cup-2026,2026-07-06T15:46:24+00:00
Delhi-NCR,Jagran,Delhi-NCR • Jagran,https://www.jagran.com/delhi-ncr,77,आज का राशिफल,https://www.jagran.com/topics/rashifal,2026-07-06T15:46:24+00:00
Delhi-NCR,Jagran,Delhi-NCR • Jagran,https://www.jagran.com/delhi-ncr,78,Submit your news,https://www.jagran.com/citizen-journalism-hindi.html,2026-07-06T15:46:24+00:00
Delhi-NCR,Jagran,Delhi-NCR • Jagran,https://www.jagran.com/delhi-ncr,79,Message from the Editor,https://www.jagran.com/policies-and-standards.html,2026-07-06T15:46:24+00:00
Hyderabad,DC,Hyderabad • DC,https://www.deccanchronicle.com/location/india/southern-states,1,FIFA World Cup 2026,https://www.deccanchronicle.com/fifa-world-cup-2026,2026-07-06T15:46:24+00:00
Hyderabad,DC,Hyderabad • DC,https://www.deccanchronicle.com/location/india/southern-states,2,Opinion and Editorials,https://www.deccanchronicle.com/opinion,2026-07-06T15:46:24+00:00
Hyderabad,DC,Hyderabad • DC,https://www.deccanchronicle.com/location/india/southern-states,3,Assembly Elections 2026,https://www.deccanchronicle.com/assembly-elections-2026,2026-07-06T15:46:24+00:00
Hyderabad,DC,Hyderabad • DC,https://www.deccanchronicle.com/location/india/southern-states,4,Telangana Rising 2047,https://www.deccanchronicle.com/tags/Telangana-Rising-2047,2026-07-06T15:46:24+00:00
Chennai,DC,Chennai • DC,https://www.deccanchronicle.com/location/india/tamil-nadu/chennai-madras,1,FIFA World Cup 2026,https://www.deccanchronicle.com/fifa-world-cup-2026,2026-07-06T15:46:24+00:00
Chennai,DC,Chennai • DC,https://www.deccanchronicle.com/location/india/tamil-nadu/chennai-madras,2,Opinion and Editorials,https://www.deccanchronicle.com/opinion,2026-07-06T15:46:24+00:00
Chennai,DC,Chennai • DC,https://www.deccanchronicle.com/location/india/tamil-nadu/chennai-madras,3,Assembly Elections 2026,https://www.deccanchronicle.com/assembly-elections-2026,2026-07-06T15:46:24+00:00
Chennai,DC,Chennai • DC,https://www.deccanchronicle.com/location/india/tamil-nadu/chennai-madras,4,Telangana Rising 2047,https://www.deccanchronicle.com/tags/Telangana-Rising-2047,2026-07-06T15:46:24+00:00
Chennai,The Hindu,Chennai • The Hindu,https://www.thehindu.com/news/cities/chennai/,1,Scuffle between ticket examiner and lawyer causes stir among commuters at Egmore railway station,https://www.thehindu.com/news/cities/chennai/scuffle-between-ticket-examiner-and-a-lawyer-causes-stir-among-the-commuters-at-egmore-railway-station/article71185342.ece,2026-07-06T15:46:24+00:00
Chennai,The Hindu,Chennai • The Hindu,https://www.thehindu.com/news/cities/chennai/,2,Mylapore Fine Arts Club’s drama festival inaugurated,https://www.thehindu.com/news/cities/chennai/mylapore-fine-arts-clubs-drama-festival-inaugurated/article71186082.ece,2026-07-06T15:46:24+00:00
Chennai,The Hindu,Chennai • The Hindu,https://www.thehindu.com/news/cities/chennai/,3,Tamil Nadu government holds review on Chennai airport’s capacity and proposed satellite terminal project,https://www.thehindu.com/news/cities/chennai/tamil-nadu-government-holds-review-on-chennai-airports-capacity-and-proposed-satellite-terminal-project/article71183377.ece,2026-07-06T15:46:24+00:00
Chennai,The Hindu,Chennai • The Hindu,https://www.thehindu.com/news/cities/chennai/,4,Commuters put to hardship as Southern Railway cancels 41 suburban services,https://www.thehindu.com/news/cities/chennai/commuters-put-to-hardship-as-southern-railway-cancels-41-suburban-services/article71186068.ece,2026-07-06T15:46:24+00:00
Chennai,The Hindu,Chennai • The Hindu,https://www.thehindu.com/news/cities/chennai/,5,West Chromepet needs more lung spaces,https://www.thehindu.com/news/cities/chennai/west-chromepet-needs-more-lung-spaces/article71188861.ece,2026-07-06T15:46:24+00:00
Chennai,The Hindu,Chennai • The Hindu,https://www.thehindu.com/news/cities/chennai/,6,"Madras HC calls for order closing corruption case against former Minister C. Vijayabaskar, educationist Ishari K. Ganesh",https://www.thehindu.com/news/national/tamil-nadu/madras-hc-calls-for-order-closing-corruption-case-against-former-minister-c-vijayabaskar-educationist-ishari-k-ganesh/article71185089.ece,2026-07-06T15:46:24+00:00
Chennai,The Hindu,Chennai • The Hindu,https://www.thehindu.com/news/cities/chennai/,7,Lakeside snack stall in Madipakkam bolstered by an indomitable spirit,https://www.thehindu.com/news/cities/chennai/lakeside-snack-stall-in-madipakkam-bolstered-by-an-indomitable-spirit/article71186635.ece,2026-07-06T15:46:24+00:00
Chennai,The Hindu,Chennai • The Hindu,https://www.thehindu.com/news/cities/chennai/,8,"GCC to levy ₹25,000 fine for violation of Solid Waste Management Rules",https://www.thehindu.com/news/cities/chennai/gcc-to-levy-25000-fine-for-violation-of-solid-waste-management-rules/article71185510.ece,2026-07-06T15:46:24+00:00
Chennai,The Hindu,Chennai • The Hindu,https://www.thehindu.com/news/cities/chennai/,9,"Assisted by his wife, curd pot maker in Chennai supplies stock regularly to star hotel",https://www.thehindu.com/news/cities/chennai/assisted-by-his-wife-curd-pot-maker-in-chennai-supplies-stock-regularly-to-star-hotel/article71182642.ece,2026-07-06T15:46:24+00:00
Chennai,The Hindu,Chennai • The Hindu,https://www.thehindu.com/news/cities/chennai/,10,"How India’s warehouse boom is fuelling a ₹7,000 crore storage solutions industry",https://www.thehindu.com/society/india-warehouse-boom-storage-solutions-automation/article71173714.ece,2026-07-06T15:46:24+00:00
Chennai,The Hindu,Chennai • The Hindu,https://www.thehindu.com/news/cities/chennai/,11,CMRL to begin work on commercial hub at Thirumangalam in September,https://www.thehindu.com/news/cities/chennai/cmrl-to-begin-work-on-commercial-hub-at-thirumangalam-in-september/article71189187.ece,2026-07-06T15:46:24+00:00
Chennai,The Hindu,Chennai • The Hindu,https://www.thehindu.com/news/cities/chennai/,12,Twice a day collection model in St. Thomas Mount-cum-Pallavaram Cantonment Board,https://www.thehindu.com/news/cities/chennai/twice-a-day-collection-model-in-st-thomas-mount-cum-pallavaram-cantonment-board/article71182664.ece,2026-07-06T15:46:24+00:00
Chennai,The Hindu,Chennai • The Hindu,https://www.thehindu.com/news/cities/chennai/,13,The case for equitable development in Tamil Nadu should apply to airport too: Poovulagin Nanbargal,https://www.thehindu.com/news/national/tamil-nadu/the-case-for-equitable-development-in-tamil-nadu-should-apply-to-airport-too-poovulagin-nanbargal/article71172963.ece,2026-07-06T15:46:24+00:00
Chennai,The Hindu,Chennai • The Hindu,https://www.thehindu.com/news/cities/chennai/,14,"Pradeep Ranganathan turns producer, backs film with Mamitha Baiju",https://www.thehindu.com/entertainment/movies/pradeep-ranganathan-turns-producer-backs-film-with-mamitha-baiju/article71188969.ece,2026-07-06T15:46:24+00:00
Chennai,The Hindu,Chennai • The Hindu,https://www.thehindu.com/news/cities/chennai/,15,Sivakarthikeyan’s ‘Seyon’ teases Raj B Shetty’s first look on his birthday,https://www.thehindu.com/entertainment/movies/sivakarthikeyans-seyon-teases-raj-b-shettys-first-look-on-his-birthday/article71185538.ece,2026-07-06T15:46:24+00:00
Chennai,The Hindu,Chennai • The Hindu,https://www.thehindu.com/news/cities/chennai/,16,Sundeep Kishan: Jason Sanjay’s sense of grounding is similar to Vijay sir,https://www.thehindu.com/entertainment/movies/sundeep-kishan-jason-sanjays-sense-of-grounding-is-similar-to-vijay-sir/article71179447.ece,2026-07-06T15:46:24+00:00
Chennai,The Hindu,Chennai • The Hindu,https://www.thehindu.com/news/cities/chennai/,17,"A month after reopening, many students in government schools across T.N. yet to receive some textbooks",https://www.thehindu.com/news/cities/chennai/a-month-after-reopening-many-students-in-government-schools-across-tn-yet-to-receive-some-textbooks/article71189954.ece,2026-07-06T15:46:24+00:00
Chennai,The Hindu,Chennai • The Hindu,https://www.thehindu.com/news/cities/chennai/,18,Chettinad Group donates ₹3 crore to CM’s Relief Fund,https://www.thehindu.com/news/cities/chennai/chettinad-group-donates-3-crore-to-cms-relief-fund/article71189533.ece,2026-07-06T15:46:24+00:00
Chennai,The Hindu,Chennai • The Hindu,https://www.thehindu.com/news/cities/chennai/,19,"Polluted waterbodies, livelihood woes: Chennai’s coastal communities question ‘blue economy’ projects",https://www.thehindu.com/news/cities/chennai/polluted-waterbodies-livelihood-woes-chennais-coastal-communities-question-blue-economy-projects/article71183220.ece,2026-07-06T15:46:24+00:00
Chennai,The Hindu,Chennai • The Hindu,https://www.thehindu.com/news/cities/chennai/,20,Two college students killed in two separate road accidents near Tambaram,https://www.thehindu.com/news/cities/chennai/two-college-students-killed-in-two-separate-road-accidents-near-tambaram/article71185584.ece,2026-07-06T15:46:24+00:00
Chennai,The Hindu,Chennai • The Hindu,https://www.thehindu.com/news/cities/chennai/,21,City Traffic police arrest eight persons in Tondiarpet,https://www.thehindu.com/news/cities/chennai/city-traffic-police-arrest-eight-persons-in-tondiarpet/article71185844.ece,2026-07-06T15:46:24+00:00
Chennai,The Hindu,Chennai • The Hindu,https://www.thehindu.com/news/cities/chennai/,22,VIT Chennai holds induction programme for law students,https://www.thehindu.com/news/cities/chennai/vitchennai-holds-induction-programme-for-law-students/article71186072.ece,2026-07-06T15:46:24+00:00
Chennai,The Hindu,Chennai • The Hindu,https://www.thehindu.com/news/cities/chennai/,23,Over 1.6 lakh teachers across Tamil Nadu appear for eligibility test paper-II,https://www.thehindu.com/news/cities/chennai/over-16-lakh-teachers-across-tamil-nadu-appear-for-eligibility-test-paper-ii/article71185723.ece,2026-07-06T15:46:24+00:00
Chennai,The Hindu,Chennai • The Hindu,https://www.thehindu.com/news/cities/chennai/,24,"Registration of properties has become easy, says Minister",https://www.thehindu.com/news/cities/chennai/registration-of-properties-has-become-easy-says-minister/article71186625.ece,2026-07-06T15:46:24+00:00
Chennai,The Hindu,Chennai • The Hindu,https://www.thehindu.com/news/cities/chennai/,25,Govt. issues notice to Meta on ‘child sexual abuse’ ads,https://www.thehindu.com/todays-paper/2026-07-06/th_chennai/articleGARG78LDC-15261265.ece,2026-07-06T15:46:24+00:00
Chennai,The Hindu,Chennai • The Hindu,https://www.thehindu.com/news/cities/chennai/,26,"Three dead, four injured as rain pounds Mumbai and other parts of Maharashtra",https://www.thehindu.com/todays-paper/2026-07-06/th_chennai/articleGARG78LDA-15261268.ece,2026-07-06T15:46:24+00:00
Chennai,The Hindu,Chennai • The Hindu,https://www.thehindu.com/news/cities/chennai/,27,"Govt. pushing ‘dangerous’, ‘diabolical’ Bills, Opposition prepared, says Jairam Ramesh",https://www.thehindu.com/todays-paper/2026-07-06/th_chennai/articleGARG78LCU-15261273.ece,2026-07-06T15:46:24+00:00
Chennai,The Hindu,Chennai • The Hindu,https://www.thehindu.com/news/cities/chennai/,28,Go to My Account,https://www.thehindu.com/myaccount/,2026-07-06T15:46:24+00:00
Chennai,The Hindu,Chennai • The Hindu,https://www.thehindu.com/news/cities/chennai/,29,4 mins ago - Manipur Gunmen kill two Assam Rifles personnel in Manipur ambush,https://www.thehindu.com/news/national/manipur/gunmen-kill-two-assam-rifles-personnel-in-manipur-ambush/article71190119.ece,2026-07-06T15:46:24+00:00
Chennai,The Hindu,Chennai • The Hindu,https://www.thehindu.com/news/cities/chennai/,30,"8 mins ago - India INS Mahendragiri set to join Indian Navy, boosting maritime combat capability",https://www.thehindu.com/news/national/ins-mahendragiri-set-to-join-indian-navy-boosting-maritime-combat-capability/article71190078.ece,2026-07-06T15:46:24+00:00
Chennai,The Hindu,Chennai • The Hindu,https://www.thehindu.com/news/cities/chennai/,31,"20 mins ago - West Bengal Mamata Banerjee hits the streets against Baruipur minor’s rape, murder",https://www.thehindu.com/news/national/west-bengal/mamata-banerjee-hitsthe-streets-againstbaruipurminors-rape-murder/article71189727.ece,2026-07-06T15:46:24+00:00
Chennai,The Hindu,Chennai • The Hindu,https://www.thehindu.com/news/cities/chennai/,32,Andhra Pradesh launches ‘Mee Mart’ to modernise public distribution system,https://www.thehindu.com/news/national/andhra-pradesh/andhra-pradesh-launches-mee-mart-to-modernise-public-distribution-system/article71190103.ece,2026-07-06T15:46:24+00:00
Chennai,The Hindu,Chennai • The Hindu,https://www.thehindu.com/news/cities/chennai/,33,Doctors protest at Srirangam govt. hospital,https://www.thehindu.com/news/cities/Tiruchirapalli/doctors-protest-at-srirangam-govt-hospital/article71190095.ece,2026-07-06T15:46:24+00:00
