city,publisher,source,source_url,rank,headline,link,collected_at_iso
Bengaluru,DC,Bengaluru • DC,https://www.deccanchronicle.com/location/india/karnataka/bengaluru,1,FIFA World Cup 2026,https://www.deccanchronicle.com/fifa-world-cup-2026,2026-07-01T12:43:09+00:00
Bengaluru,DC,Bengaluru • DC,https://www.deccanchronicle.com/location/india/karnataka/bengaluru,2,Opinion and Editorials,https://www.deccanchronicle.com/opinion,2026-07-01T12:43:09+00:00
Bengaluru,DC,Bengaluru • DC,https://www.deccanchronicle.com/location/india/karnataka/bengaluru,3,Assembly Elections 2026,https://www.deccanchronicle.com/assembly-elections-2026,2026-07-01T12:43:09+00:00
Bengaluru,DC,Bengaluru • DC,https://www.deccanchronicle.com/location/india/karnataka/bengaluru,4,Telangana Rising 2047,https://www.deccanchronicle.com/tags/Telangana-Rising-2047,2026-07-01T12:43:09+00:00
Mumbai,Mumbai Mirror,Mumbai • Mumbai Mirror,https://mumbaimirror.indiatimes.com/mumbai,1,Operation Tiger’s Dhurandhar,https://mumbaimirror.indiatimes.com/mumbai/operation-tigers-dhurandhar/articleshow/132098865.html,2026-07-01T12:43:09+00:00
Mumbai,Mumbai Mirror,Mumbai • Mumbai Mirror,https://mumbaimirror.indiatimes.com/mumbai,2,Kandivli’s 12-yr-old rolls into the record books,https://mumbaimirror.indiatimes.com/mumbai/kandivlis-12-yr-old-rolls-into-the-record-books/articleshow/132096003.html,2026-07-01T12:43:09+00:00
Mumbai,Mumbai Mirror,Mumbai • Mumbai Mirror,https://mumbaimirror.indiatimes.com/mumbai,3,Redvpt derails electoral roll revision work,https://mumbaimirror.indiatimes.com/mumbai/cover-story/redvpt-derails-electoral-roll-revision-work/articleshow/132099106.html,2026-07-01T12:43:09+00:00
Mumbai,Mumbai Mirror,Mumbai • Mumbai Mirror,https://mumbaimirror.indiatimes.com/mumbai,4,Tree was flagged as unsafe,https://mumbaimirror.indiatimes.com/mumbai/cover-story/tree-was-flagged-as-unsafe/articleshow/132099102.html,2026-07-01T12:43:09+00:00
Mumbai,Mumbai Mirror,Mumbai • Mumbai Mirror,https://mumbaimirror.indiatimes.com/mumbai,5,Corruption is the X factor,https://mumbaimirror.indiatimes.com/opinion/corruption-is-the-x-factor/articleshow/132097909.html,2026-07-01T12:43:09+00:00
Mumbai,Mumbai Mirror,Mumbai • Mumbai Mirror,https://mumbaimirror.indiatimes.com/mumbai,6,"Nutrition apps help build healthy habits, but...",https://mumbaimirror.indiatimes.com/opinion/nutrition-apps-help-build-healthy-habits-but-/articleshow/132097906.html,2026-07-01T12:43:09+00:00
Mumbai,Mumbai Mirror,Mumbai • Mumbai Mirror,https://mumbaimirror.indiatimes.com/mumbai,7,Ask The Sexpert,https://mumbaimirror.indiatimes.com/ask-the-sexpert,2026-07-01T12:43:09+00:00
Mumbai,Sakal,Mumbai • Sakal,https://www.esakal.com/pune,1,सकाळ लाईव्ह TV,https://www.esakal.com/live-tv,2026-07-01T12:43:09+00:00
Mumbai,Sakal,Mumbai • Sakal,https://www.esakal.com/pune,2,Refund and Cancellation,https://www.esakal.com/refund-and-cancellation,2026-07-01T12:43:09+00:00
Mumbai,Lokmat,Mumbai • Lokmat,https://www.lokmat.com/city/,1,Live News in Marathi,https://www.lokmat.com/live-news/,2026-07-01T12:43:09+00:00
Mumbai,Lokmat,Mumbai • Lokmat,https://www.lokmat.com/city/,2,संत तुकाराम महाराज पालखी सोहळ्यानिमित्त वाहतुकीत बदल,https://www.lokmat.com/pune/changes-in-traffic-on-the-occasion-of-sant-tukaram-maharaj-palkhi-ceremony-a-a1008/,2026-07-01T12:43:09+00:00
Mumbai,Lokmat,Mumbai • Lokmat,https://www.lokmat.com/city/,3,महिलांच्या नावावरील ५०० चौरस फुटांपर्यंतच्या घरांना मिळकत करात ५० टक्के सवलत,https://www.lokmat.com/pune/50-percent-income-tax-rebate-for-houses-up-to-500-square-feet-in-the-name-of-women-a-a1008/,2026-07-01T12:43:09+00:00
Mumbai,Lokmat,Mumbai • Lokmat,https://www.lokmat.com/city/,4,"'लग्नानंतर राजस्थानला शिफ्ट होणार होतो, पैशांची सोय सिया करणार होती'; चेतनच्या मित्रांचा मोठा खुलासा!",https://www.lokmat.com/pune/ketan-agrawal-murder-case-we-were-going-to-shift-to-rajasthan-after-marriage-siya-goyal-was-going-to-arrange-the-money-chetan-chaudharys-friends-big-revelation-a-a607/,2026-07-01T12:43:09+00:00
Mumbai,Lokmat,Mumbai • Lokmat,https://www.lokmat.com/city/,5,"LIVE: ""मुंबईकरांनो, काम असेल तरच बाहेर पडा, तीन तासांसाठी रेड अलर्ट"", महापौर तावडे यांचे आवाहन",https://www.lokmat.com/maharashtra/maharashtra-marathi-news-live-updates-1-july-2026-monsoon-rain-in-india-vidhan-sabha-adhiveshan-vidhan-parishad-shiv-sena-eknath-shinde-pm-narendra-modi-cm-devendra-fadnavis-fuel-prices-us-iran-deal-donald-trump-indian-vs-england-pune-crime-a-a573/,2026-07-01T12:43:09+00:00
Mumbai,Lokmat,Mumbai • Lokmat,https://www.lokmat.com/city/,6,पुण्यात भररस्त्यात झाड कोसळल्याने खळबळ; रस्ता ओलांडणारी तरुणी थोडक्यात बचावली,https://www.lokmat.com/pune/a-tree-fell-on-a-busy-road-in-pune-causing-panic-a-young-woman-crossing-the-road-narrowly-escaped-thrilling-moment-captured-on-cctv-a-a1014-c1008/,2026-07-01T12:43:09+00:00
Mumbai,Lokmat,Mumbai • Lokmat,https://www.lokmat.com/city/,7,"""सचिन अहिर जमिनीशी जोडलेला कार्यकर्ता...""; विधान परिषदेत ठाकरेंचे आमदार अनिल परबांनी केले कौतुक",https://www.lokmat.com/maharashtra/sachin-ahir-is-a-worker-connected-to-the-ground-uddhav-thackeray-mla-anil-parab-praised-him-in-the-legislative-council-a-a629/,2026-07-01T12:43:09+00:00
Mumbai,Lokmat,Mumbai • Lokmat,https://www.lokmat.com/city/,8,"विधान परिषदेत मोठा ट्विस्ट, ठाकरेंच्या उमेदवाराने घेतली माघार; सचिन अहिर बिनविरोध उपसभापती",https://www.lokmat.com/mumbai/big-twist-shiv-sena-shinde-group-sachin-ahir-unanimously-elected-deputy-chairman-in-vidhan-parishad-uddhav-thackeray-candidate-withdraws-a-a719/,2026-07-01T12:43:09+00:00
Mumbai,Lokmat,Mumbai • Lokmat,https://www.lokmat.com/city/,9,ऐन पावसाळ्यात कुलाबा वेधशाळेचे डॉप्लर रडार तांत्रिक कारणांमुळे बंद,https://www.lokmat.com/mumbai/colaba-observatorys-doppler-radar-shut-down-due-to-technical-reasons-during-monsoon-season-a-a301/,2026-07-01T12:43:09+00:00
Mumbai,Lokmat,Mumbai • Lokmat,https://www.lokmat.com/city/,10,नरिमन पाॅइंट ते कफ परेड सागरी किनारा मार्ग लवकरच,https://www.lokmat.com/mumbai/nariman-point-to-cuffe-parade-sea-coast-route-coming-soon-a-a301/,2026-07-01T12:43:09+00:00
Mumbai,Lokmat,Mumbai • Lokmat,https://www.lokmat.com/city/,11,यूपीएससीच्या एका उत्तरामुळे मुख्य परीक्षेची संधी गेल्याचा दावा; उमेदवाराची न्यायालयात धाव,https://www.lokmat.com/nagpur/claim-that-one-upsc-answer-ruined-the-opportunity-for-the-main-exam-candidate-moves-court-a-a1000/,2026-07-01T12:43:09+00:00
Mumbai,Lokmat,Mumbai • Lokmat,https://www.lokmat.com/city/,12,"""अध्यक्षपदाचा वाद महत्त्वाचा नाही, दीक्षाभूमीचा विकास जलद गतीने व्हावा"" : भदंत सुरेई ससाई",https://www.lokmat.com/nagpur/the-dispute-over-the-presidency-is-not-important-the-development-of-deekshabhoomi-should-be-done-at-a-fast-pace-bhadant-surei-sasai-a-a876-c1000/,2026-07-01T12:43:09+00:00
Mumbai,Lokmat,Mumbai • Lokmat,https://www.lokmat.com/city/,13,महागाईचा सर्वात मोठा फटका आता शालेय खरेदीला; पालकांकडून विशिष्ट दुकानाच्या सक्तीवरही नाराजी,https://www.lokmat.com/nagpur/school-purchases-are-now-the-biggest-hit-from-inflation-parents-are-also-unhappy-with-the-compulsion-to-buy-from-a-specific-store-a-a1000/,2026-07-01T12:43:09+00:00
Mumbai,Lokmat,Mumbai • Lokmat,https://www.lokmat.com/city/,14,महाराष्ट्रात प्रत्येक १२ पैकी एक प्रौढ मधुमेही; आयसीएमआरच्या अभ्यासातून धक्कादायक वास्तव,https://www.lokmat.com/nagpur/one-in-every-12-adults-in-maharashtra-is-diabetic-shocking-reality-from-icmr-study-a-a1000/,2026-07-01T12:43:09+00:00
Mumbai,Lokmat,Mumbai • Lokmat,https://www.lokmat.com/city/,15,डॉक्टरांची जागा एआय घेणार? नागपूरच्या तज्ज्ञांनी दिले स्पष्ट आणि ठोस उत्तर!,https://www.lokmat.com/nagpur/will-ai-replace-doctors-nagpur-experts-gave-a-clear-and-concrete-answer-a-a1000/,2026-07-01T12:43:09+00:00
Mumbai,Lokmat,Mumbai • Lokmat,https://www.lokmat.com/city/,16,"शेतीला एआयची जोड; एआयमुळे हवामान अंदाज अचूक येतात का, उत्पादनात वाढ झाली का?",https://www.lokmat.com/agriculture/farming-ideas/latest-news-ai-in-agriculture-does-ai-make-weather-forecasts-more-accurate-has-it-increased-production-a-a993/,2026-07-01T12:43:09+00:00
Mumbai,Lokmat,Mumbai • Lokmat,https://www.lokmat.com/city/,17,लोकमत शेती :,https://www.lokmat.com/agriculture/,2026-07-01T12:43:09+00:00
Mumbai,Lokmat,Mumbai • Lokmat,https://www.lokmat.com/city/,18,"पाटण्याच्या डाळिंबाला उच्चांकी दर; 190 रुपये किलो दराने विक्री, दिल्ली आणि बांगलादेशला निर्यात",https://www.lokmat.com/agriculture/market-yard/latest-news-highest-price-for-pomegranates-from-patna-sold-at-rs-190-per-kg-exported-to-delhi-and-bangladesh-a-a993/,2026-07-01T12:43:09+00:00
Mumbai,Lokmat,Mumbai • Lokmat,https://www.lokmat.com/city/,19,निवृत्तीनाथ महाराजांच्या पालखीचे टाळ-मृदंगाच्या गजरात त्र्यंबकेश्वहून भव्य प्रस्थान,https://www.lokmat.com/nashik/nivruttinath-maharajs-palanquin-departs-grandly-amidst-the-sound-of-drums-and-mridangam-warkari-departs-from-trimbakeshwar-with-60-dindas-a-a301/,2026-07-01T12:43:09+00:00
Mumbai,Lokmat,Mumbai • Lokmat,https://www.lokmat.com/city/,20,"लोकांचे भविष्य सांगणारा खरात भविष्याबाबत चिंतेत, फसवणुकीची मोडस ऑपरेंडी कथन",https://www.lokmat.com/maharashtra/peoples-fortune-teller-ashok-kharat-worried-about-the-future-reveals-modus-operandi-of-fraud-a-a301/,2026-07-01T12:43:09+00:00
Mumbai,Lokmat,Mumbai • Lokmat,https://www.lokmat.com/city/,21,पैशांचा पाऊस पाडण्यासाठी पूजा; ९ संशयितांना अटक,https://www.lokmat.com/nashik/pooja-to-make-money-rain-9-suspects-arrested-a-a301/,2026-07-01T12:43:09+00:00
Mumbai,Lokmat,Mumbai • Lokmat,https://www.lokmat.com/city/,22,"Kolhapur: झोपाळा खेळताना गळफास लागून शाळकरी मुलीचा मृत्यू, आजऱ्यातील घटना",https://www.lokmat.com/kolhapur/school-girl-dies-after-hanging-while-playing-with-hammock-in-ajara-kolhapur-a-a746/,2026-07-01T12:43:09+00:00
Mumbai,Lokmat,Mumbai • Lokmat,https://www.lokmat.com/city/,23,Kolhapur-केशवराव भोसले नाट्यगृह: मेड इन इंग्लंड गर्डल्स विमा कंपनीने सांगितले म्हणून विकले भंगारात,https://www.lokmat.com/kolhapur/it-has-been-revealed-that-the-made-in-england-iron-girders-rendered-useless-by-the-fire-at-keshavrao-bhosale-natyagruha-were-sold-not-by-the-municipal-corporation-but-in-accordance-with-the-insurance-companys-instructions-a-a746/,2026-07-01T12:43:09+00:00
Mumbai,Lokmat,Mumbai • Lokmat,https://www.lokmat.com/city/,24,Rain in Kolhapur: जूनने दगा दिला... कोल्हापूर जिल्ह्यात सात वर्षांतील यंदा नीचांकी पावसाची नोंद,https://www.lokmat.com/kolhapur/kolhapur-district-records-lowest-rainfall-in-seven-years-a-a817-c746/,2026-07-01T12:43:09+00:00
Mumbai,Lokmat,Mumbai • Lokmat,https://www.lokmat.com/city/,25,Kolhapur News: अंबाबाईच्या दरबारात ‘भक्तीचे मौन’; म्युझिकल सिस्टीम बंद,https://www.lokmat.com/kolhapur/heritage-musical-sound-system-at-the-ambabai-temple-and-its-surrounding-area-to-remain-shut-for-two-months-a-a746/,2026-07-01T12:43:09+00:00
Mumbai,Lokmat,Mumbai • Lokmat,https://www.lokmat.com/city/,26,"कोल्हापुरातील शेतकऱ्यांचे साडेदहा कोटी ‘सरकारी विहिरीत’; कामे पूर्ण, अनुदान मिळेना",https://www.lokmat.com/kolhapur/three-years-worth-of-mgnrega-scheme-grants-pending-in-kolhapur-a-a818-c746/,2026-07-01T12:43:09+00:00
Mumbai,Lokmat,Mumbai • Lokmat,https://www.lokmat.com/city/,27,सांगली जिल्ह्यात पावसाचे दमदार पुनरागमन; शिराळ्यात सर्वाधिक १९.९ मिलीमीटर,https://www.lokmat.com/sangli/heavy-rains-return-to-sangli-district-shirala-receives-highest-19-mm-a-a746/,2026-07-01T12:43:09+00:00
Mumbai,Lokmat,Mumbai • Lokmat,https://www.lokmat.com/city/,28,"आत्महत्येस प्रवृत्त केल्याप्रकरणी एकाला अटक, सांगलीतील तरुणाला लग्नासाठी घातली होती धर्मांतराची अट",https://www.lokmat.com/sangli/one-person-arrested-for-abetting-the-suicide-of-a-young-man-from-sangli-by-making-religious-conversion-a-condition-for-marriage-a-a746/,2026-07-01T12:43:09+00:00
Mumbai,Lokmat,Mumbai • Lokmat,https://www.lokmat.com/city/,29,"५५ कोटींचं 37 किलो २४ कॅरेट सोनं; महाराष्ट्राच्या अक्षय बनसोडेचा दोन महिने गुवाहाटीत मुक्काम, पण पोलिसांनी पकडलाच",https://www.lokmat.com/national/37-kg-of-24-carat-gold-worth-rs-55-crore-akshay-bansode-from-maharashtra-stayed-in-guwahati-for-two-months-but-was-caught-by-the-police-a-a571/,2026-07-01T12:43:09+00:00
Mumbai,Lokmat,Mumbai • Lokmat,https://www.lokmat.com/city/,30,सांगली जिल्हा बँकेवर प्रशासक आणून नोकरभरती रोखण्याचा पडळकरांचा डाव : मानसिंगराव नाईक,https://www.lokmat.com/sangli/padalkars-plan-to-stop-recruitment-by-appointing-an-administrator-in-sangli-district-bank-says-mansingrao-naik-a-a746/,2026-07-01T12:43:09+00:00
Mumbai,Lokmat,Mumbai • Lokmat,https://www.lokmat.com/city/,31,"काँग्रेसने राजदंड पळविल्याने महासभा गुंडाळली, पूर नियंत्रण प्रकल्पावरून सांगली महापालिकेच्या सभेत गदारोळ",https://www.lokmat.com/sangli/congress-makes-off-with-the-ceremonial-mace-uproar-in-the-sangli-municipal-corporation-meeting-over-the-flood-control-project-a-a746/,2026-07-01T12:43:09+00:00
Mumbai,Lokmat,Mumbai • Lokmat,https://www.lokmat.com/city/,32,"'कोयने'च्या गाळात आढळली ‘ढोकरा’ शैलीतील गणेशमूर्ती!; अनेक वर्षे पाणी, गाळाच्या खाली राहूनही मूर्ती सुस्थितीत",https://www.lokmat.com/satara/ganesha-idol-in-dhokra-style-found-in-koyna-dam-silt-a-a746/,2026-07-01T12:43:09+00:00
Mumbai,Lokmat,Mumbai • Lokmat,https://www.lokmat.com/city/,33,"Rain in Satara: सातारा जिल्ह्यात पावसाचा पुन्हा जोर; नवजाला ८६ मिलिमीटरची नोंद, कोयनेत २५५६ क्युसेक आवक",https://www.lokmat.com/satara/heavy-rains-again-in-satara-district-navjala-records-86-mm-a-a746/,2026-07-01T12:43:09+00:00
Mumbai,Lokmat,Mumbai • Lokmat,https://www.lokmat.com/city/,34,"‘कास’ ठरणार खास, सातारकरांना पाणी २४ तास !; नूतन जलवाहिनीचे काम अंतिम टप्प्यात",https://www.lokmat.com/satara/work-on-the-new-27-kilometer-long-water-pipeline-between-kaas-dam-and-satara-city-is-now-in-its-final-stage-a-a832-c746/,2026-07-01T12:43:09+00:00
Mumbai,Lokmat,Mumbai • Lokmat,https://www.lokmat.com/city/,35,Sant Dnyaneshwar Maharaj Palkhi: माउलींच्या स्वागतासाठी सातारा सज्ज; १००० अधिकारी-कर्मचारी देणार सेवा,https://www.lokmat.com/satara/satara-geared-up-to-welcome-the-sant-dnyaneshwar-maharaj-palkhi-1000-officials-and-staff-to-provide-services-a-a746/,2026-07-01T12:43:09+00:00
Mumbai,Lokmat,Mumbai • Lokmat,https://www.lokmat.com/city/,36,"मंत्री शिवेंद्रसिंहराजेंनी केले बैलगाडीचे सारथ्य, सातारा शहरातील विविध विकासकामांची पाहणी",https://www.lokmat.com/satara/minister-shivendrasinh-raje-rode-a-bullock-cart-and-inspected-various-development-works-in-satara-city-a-a746/,2026-07-01T12:43:09+00:00
Mumbai,Lokmat,Mumbai • Lokmat,https://www.lokmat.com/city/,37,काँग्रेस नगरसेविका पतीवर भरदिवसा चाकू हल्ला; उपचारादरम्यान मृत्यू,https://www.lokmat.com/akola/congress-corporators-husband-attacked-with-knife-in-broad-daylight-dies-during-treatment-a-a607/,2026-07-01T12:43:09+00:00
Mumbai,Lokmat,Mumbai • Lokmat,https://www.lokmat.com/city/,38,विनापरवाना बियाणे साठ्यावर कृषी विभागाचा छापा; २०.६० लाखांचा मुद्देमाल जप्त,https://www.lokmat.com/akola/agriculture-department-raids-unlicensed-seed-stock-goods-worth-rs-20-lakh-60-thousands-seized-a-a653/,2026-07-01T12:43:09+00:00
Mumbai,Lokmat,Mumbai • Lokmat,https://www.lokmat.com/city/,39,अकोल्यात रिलायन्स प्लांट परिसरात आगीचे तांडव; धुराच्या लोटांनी आसमंत काळवंडले,https://www.lokmat.com/akola/fire-breaks-out-in-reliance-plant-area-smoke-billows-into-the-sky-incident-on-akola-nanded-road-a-a747/,2026-07-01T12:43:09+00:00
Mumbai,Lokmat,Mumbai • Lokmat,https://www.lokmat.com/city/,40,"शिंदेसेनेच्या अकोला जिल्हाप्रमुख, महानगरप्रमुखांच्या नियुक्त्या जाहीर",https://www.lokmat.com/akola/appointments-of-shinde-senas-akola-district-chief-and-metropolitan-chief-announced-a-a941/,2026-07-01T12:43:09+00:00
Mumbai,Lokmat,Mumbai • Lokmat,https://www.lokmat.com/city/,41,"Akola: अधिक मासातील धार्मिक स्नान ठरले अखेरचे; मुलगाा बुडायला लागला, आईने उडी मारली; दोघांचाही नदीत बुडून मृत्यू",https://www.lokmat.com/akola/akola-religious-bath-in-the-rainy-season-turned-out-to-be-the-last-mother-and-daughter-drowned-in-the-river-while-saving-their-child-a-a571/,2026-07-01T12:43:09+00:00
Mumbai,Lokmat,Mumbai • Lokmat,https://www.lokmat.com/city/,42,"पंढरपूर: लेकीने प्रेमविवाह केल्याने बाप संतापला! मुलाच्या घरात घुसून कुटुंबाला मारहाण, डिझेल ओतून घर पेटवले",https://www.lokmat.com/solapur/pandharpur-father-furious-over-daughters-love-marriage-he-entered-his-sons-house-beat-up-the-family-poured-diesel-on-them-and-set-the-house-on-fire-a-a941/,2026-07-01T12:43:09+00:00
Mumbai,Lokmat,Mumbai • Lokmat,https://www.lokmat.com/city/,43,पावसासाठी सोलापुरात मुस्लिम समाजाचे सामुदायिक नमाज पठण,https://www.lokmat.com/solapur/muslim-community-offers-communal-prayers-in-solapur-for-rain-a-a653/,2026-07-01T12:43:09+00:00
Mumbai,Lokmat,Mumbai • Lokmat,https://www.lokmat.com/city/,44,विठ्ठल-रुक्मिणी मूर्तीच्या रासायनिक लेपनास स्थगिती,https://www.lokmat.com/solapur/suspension-of-chemical-coating-of-vitthal-rukmini-idols-a-a1001/,2026-07-01T12:43:09+00:00
Mumbai,Lokmat,Mumbai • Lokmat,https://www.lokmat.com/city/,45,"Sangli Crime: कमी दरात साखर पुरवठा करण्याचे आमिष, हातनूरच्या व्यापाऱ्याची ९.१६ कोटी रुपयांची फसवणूक",https://www.lokmat.com/sangli/a-trader-from-hatnur-in-sangli-district-was-cheated-of-rs-9-crores-by-promising-to-supply-sugar-at-a-low-price-a-a746/,2026-07-01T12:43:09+00:00
Mumbai,Lokmat,Mumbai • Lokmat,https://www.lokmat.com/city/,46,सोलापूर विधान परिषद निवडणुकीत भाजप महायुतीचे राजेंद्र राऊत यांचा दिमाखदार विजय,https://www.lokmat.com/solapur/bjp-rajendra-rauts-stunning-victory-in-solapur-legislative-council-elections-a-a914-c747/,2026-07-01T12:43:09+00:00
Mumbai,Lokmat,Mumbai • Lokmat,https://www.lokmat.com/city/,47,"आंबित धरण भरले; मुळाही प्रवाही, बळीराजा सुखावला, भात रोपांना संजीवनी",https://www.lokmat.com/maharashtra/ambit-dam-filled-radish-also-flowing-baliraja-is-happy-rice-plants-are-revived-farmers-are-happy-due-to-heavy-rains-a-a301/,2026-07-01T12:43:09+00:00
Mumbai,Lokmat,Mumbai • Lokmat,https://www.lokmat.com/city/,48,"एसटी पार्सल सेवा राज्यभर ठप्प, कंत्राटदाराचा परवाना अचानक रद्द; ग्राहक अडचणीत, व्यापाऱ्यांमध्ये संताप",https://www.lokmat.com/maharashtra/st-parcel-service-halted-across-the-state-contractors-license-suddenly-cancelled-customers-in-trouble-traders-angry-a-a607/,2026-07-01T12:43:09+00:00
Mumbai,Lokmat,Mumbai • Lokmat,https://www.lokmat.com/city/,49,अहिल्यानगर शहरात शिवसैनिक आक्रमक; बंडखोर खासदारांच्या प्रतिमेला जोडे मारो आंदोलन,https://www.lokmat.com/ahilyanagar/shiv-sainiks-aggressive-in-ahilyanagar-city-protest-to-tie-up-the-image-of-rebel-mps-a-a629/,2026-07-01T12:43:09+00:00
Mumbai,Lokmat,Mumbai • Lokmat,https://www.lokmat.com/city/,50,"""मला जगू दिलं नाही""; भिशीचे लाखो रुपये थकल्याने तरुणाची आत्महत्या; संघाचे काम केल्याने छळाचा आरोप",https://www.lokmat.com/ahilyanagar/ahilyanagar-man-dies-after-consuming-poison-video-raises-serious-allegations-a-a1001/,2026-07-01T12:43:09+00:00
Mumbai,Lokmat,Mumbai • Lokmat,https://www.lokmat.com/city/,51,"श्रीगोंद्यात 'लिव्ह इन'मधील मैत्रिणीचा खून, मृतदेह जाळला; मित्रामुळे अडकला आरोपी",https://www.lokmat.com/ahilyanagar/shrigonda-horror-man-kills-17-year-old-live-in-partner-over-suspicion-burns-body-in-forest-with-father-help-a-a1001/,2026-07-01T12:43:09+00:00
