city,publisher,source,source_url,rank,headline,link,collected_at_iso
Delhi-NCR,Jagran,Delhi-NCR • Jagran,https://www.jagran.com/delhi-ncr,27,"गाजियाबाद में PIT-NDPS की पहली कार्रवाई, कफ सिरप तस्करों को एक साल तक नहीं मिलेगी जमानत",https://www.jagran.com/uttar-pradesh/ghaziabad-ghaziabad-first-pit-ndps-action-against-cough-syrup-traffickers-40300445.html,2026-07-09T15:22:28+00:00
Delhi-NCR,Jagran,Delhi-NCR • Jagran,https://www.jagran.com/delhi-ncr,28,"गाजियाबाद में 15 फीट धंसी सड़क, टाटा पंच और स्कूटी समाई",https://www.jagran.com/uttar-pradesh/ghaziabad-a-15foot-road-caved-in-in-sahibabad-of-ghaziabad-and-engulfing-car-and-scooter-of-retired-superintendent-engineer-40300307.html,2026-07-09T15:22:28+00:00
Delhi-NCR,Jagran,Delhi-NCR • Jagran,https://www.jagran.com/delhi-ncr,29,"गुरुग्राम में 10000 करोड़ की रिहायशी परियोजना पर हाईकोर्ट की रोक, नई बुकिंग पर फिलहाल प्रतिबंध",https://www.jagran.com/haryana/gurgaon-high-court-stays-new-bookings-at-oberoi-360-north-gurugram-40300389.html,2026-07-09T15:22:28+00:00
Delhi-NCR,Jagran,Delhi-NCR • Jagran,https://www.jagran.com/delhi-ncr,30,"सोहना पहाड़ी कंकाल केस: गला दबाकर की गई थी हत्या, DNA और कपड़ों से होगी पहचान; मिसिंग रिपोर्ट खंगाल रही पुलिस",https://www.jagran.com/haryana/gurgaon-sohna-hill-skeleton-case-murder-by-strangulation-confirmed-40300227.html,2026-07-09T15:22:28+00:00
Delhi-NCR,Jagran,Delhi-NCR • Jagran,https://www.jagran.com/delhi-ncr,31,"गुरुग्राम में रिहायशी प्लॉट में दुकान-सैलून चलाने वाले सावधान! डीएलएफ में सीलिंग की तैयारी, थमाया गया नोटिस",https://www.jagran.com/haryana/gurgaon-dlf-gurugram-sealing-notices-issued-for-illegal-commercial-use-40300220.html,2026-07-09T15:22:28+00:00
Delhi-NCR,Jagran,Delhi-NCR • Jagran,https://www.jagran.com/delhi-ncr,32,"NHAI ने पहले किए होते इंतजाम तो न डूबता दिल्ली-जयपुर हाईवे, 3 दिन की बारिश ने खोली पोल; 10 साल से लोग परेशान",https://www.jagran.com/haryana/gurgaon-delhi-jaipur-highway-waterlogging-exposes-nhai-failure-after-rain-40300120.html,2026-07-09T15:22:28+00:00
Delhi-NCR,Jagran,Delhi-NCR • Jagran,https://www.jagran.com/delhi-ncr,33,"गुरुग्राम नगर निगम का बड़ा फैसला, पानी-सीवरेज की सभी सेवाएं हुईं डिजिटल; घर बैठे मिलेंगे नए कनेक्शन",https://www.jagran.com/haryana/gurgaon-gurugram-digitizes-water-management-smart-meters-gis-40299853.html,2026-07-09T15:22:28+00:00
Delhi-NCR,Jagran,Delhi-NCR • Jagran,https://www.jagran.com/delhi-ncr,34,"'हाईटेक' नोएडा का बुरा हाल! आफत की बारिश से सड़कें बनीं तालाब, जलभराव से थमी वाहनों की रफ्तार",https://www.jagran.com/uttar-pradesh/noida-noida-rains-waterlogging-power-outages-expose-poor-civic-infra-40300275.html,2026-07-09T15:22:28+00:00
Delhi-NCR,Jagran,Delhi-NCR • Jagran,https://www.jagran.com/delhi-ncr,35,"चाय की चुस्की से कीमो और सर्जरी के बाद रिकवरी होगी फास्ट, एमिटी नोएडा की प्रोफसर ने बनाई विशेष Herbal Tea",https://www.jagran.com/uttar-pradesh/noida-amity-develops-special-herbal-tea-for-postsurgery-recovery-40300166.html,2026-07-09T15:22:28+00:00
Delhi-NCR,Jagran,Delhi-NCR • Jagran,https://www.jagran.com/delhi-ncr,36,"स्कूटी ट्रेनर निकला बाइक चोर गिरोह का सरगना, नोएडा पुलिस ने दबोचे दो आरोपी; 10 बाइक बरामद",https://www.jagran.com/uttar-pradesh/noida-noida-bike-theft-gang-busted-trainer-accomplice-arrested-40300126.html,2026-07-09T15:22:28+00:00
Delhi-NCR,Jagran,Delhi-NCR • Jagran,https://www.jagran.com/delhi-ncr,37,"VIDEO: नोएडा में आधी रात को कोठी में घुसे 3 चोर, सिक्योरिटी गार्ड ने पत्थर खाकर भी बचाई बड़ी चोरी",https://www.jagran.com/uttar-pradesh/noida-noida-security-guard-foils-midnight-bungalow-theft-attempt-40300119.html,2026-07-09T15:22:28+00:00
Delhi-NCR,Jagran,Delhi-NCR • Jagran,https://www.jagran.com/delhi-ncr,38,"जलभराव की समस्या पर एक्शन मोड में दिल्ली सरकार, सीएम रेखा गुप्ता ने किया संवेदनशील इलाकों का निरीक्षण",https://www.jagran.com/delhi/new-delhi-city-cm-rekha-gupta-inspects-delhi-waterlogging-directs-action-40300559.html,2026-07-09T15:22:28+00:00
Delhi-NCR,Jagran,Delhi-NCR • Jagran,https://www.jagran.com/delhi-ncr,39,"फरीदाबाद में 2 एक्सप्रेसवे को जोड़ने वाली मोहना रोड में भ्रष्टाचार, 66 फुट की सड़क नहीं बनाई; ACB से शिकायत",https://www.jagran.com/haryana/faridabad-mohana-road-cracks-acb-probe-sought-over-poor-construction-40300177.html,2026-07-09T15:22:28+00:00
Delhi-NCR,Jagran,Delhi-NCR • Jagran,https://www.jagran.com/delhi-ncr,40,"फरीदाबाद में प्रॉपर्टी टैक्स भरने वालों को बड़ी राहत, 31 अगस्त तक जमा करने पर ब्याज में मिलेगी 75% छूट",https://www.jagran.com/haryana/faridabad-faridabad-property-tax-interest-waiver-extended-to-aug-31-40300174.html,2026-07-09T15:22:28+00:00
Delhi-NCR,Jagran,Delhi-NCR • Jagran,https://www.jagran.com/delhi-ncr,41,"10 महीने से जिसकी हत्या के लिए काट रहे थे जेल, वो शव किसी और का निकला; सवालों में फरीदाबाद पुलिस की जांच",https://www.jagran.com/haryana/faridabad-faridabad-murder-case-dna-twist-frees-accused-after-10-months-40300031.html,2026-07-09T15:22:28+00:00
Delhi-NCR,Jagran,Delhi-NCR • Jagran,https://www.jagran.com/delhi-ncr,42,"फरीदाबाद में भारी बारिश से पुराना खेड़ी पुल धंसा, रास्ता पूरी तरह बंद; नगला एंक्लेव में बड़ा हादसा टला",https://www.jagran.com/haryana/faridabad-faridabad-old-khedi-bridge-collapses-due-to-rain-traffic-halted-40300049.html,2026-07-09T15:22:28+00:00
Delhi-NCR,Jagran,Delhi-NCR • Jagran,https://www.jagran.com/delhi-ncr,43,"फरीदाबाद में पहली ही बारिश में डूबे सरकारी स्कूल, पढ़ाई छोड़ बाल्टी से पानी निकालने को मजबूर गुरुजी",https://www.jagran.com/haryana/faridabad-faridabad-govt-schools-waterlogged-after-first-monsoon-rain-40300004.html,2026-07-09T15:22:28+00:00
Delhi-NCR,Jagran,Delhi-NCR • Jagran,https://www.jagran.com/delhi-ncr,44,"PHOTOS: पलवल में आफत की बारिश! 3 घंटे में डूबा शहर, 29 करोड़ के नाले फेल; 'दो करोड़' पानी में बहे",https://www.jagran.com/haryana/palwal-palwal-weather-floods-heavy-rain-exposes-failed-drainage-system-40300387.html,2026-07-09T15:22:28+00:00
Delhi-NCR,Jagran,Delhi-NCR • Jagran,https://www.jagran.com/delhi-ncr,45,"आरटीओ का अधिकारी बनकर गोशाला की गाड़ी रोकी, 24 हजार ऐंठे; विभाग बोला- उस दिन ड्यूटी ही नहीं लगाई थी",https://www.jagran.com/haryana/palwal-palwal-rto-impersonators-extort-24k-from-gaushala-vehicle-40300366.html,2026-07-09T15:22:28+00:00
Delhi-NCR,Jagran,Delhi-NCR • Jagran,https://www.jagran.com/delhi-ncr,46,"जातिसूचक शब्द कहने का विरोध करने पर परिवार पर लाठी-डंडों और सरियों से हमला, एससी एक्ट में मामला दर्ज",https://www.jagran.com/haryana/palwal-palwal-family-attacked-for-protesting-casteist-slurs-40299247.html,2026-07-09T15:22:28+00:00
Delhi-NCR,Jagran,Delhi-NCR • Jagran,https://www.jagran.com/delhi-ncr,47,"पलवल में ग्राहक सेवा केंद्र चोरी का खुलासा, आरोपी गिरफ्तार; 1.80 लाख रुपये बरामद",https://www.jagran.com/haryana/palwal-palwal-man-arrested-for-csc-theft-rupees-1lakh-80-thousand-cash-recovered-40299229.html,2026-07-09T15:22:28+00:00
Delhi-NCR,Jagran,Delhi-NCR • Jagran,https://www.jagran.com/delhi-ncr,48,"बिहार में 6 हजार मोबाइलों से भरे ट्रक की महालूट! पलवल से मास्टरमाइंड गिरफ्तार, फिल्मी है पूरी कहानी",https://www.jagran.com/haryana/palwal-ecommerce-truck-loot-mastermind-naim-arrested-by-palwal-stf-40299140.html,2026-07-09T15:22:28+00:00
Delhi-NCR,Jagran,Delhi-NCR • Jagran,https://www.jagran.com/delhi-ncr,49,"‘एक आंख से देखना’ मुहावरे का अर्थ ‘अंधाधुंध करना’...को उप्र शिक्षा सेवा चयन आयोग ने सही माना, अभ्यर्थियों को आपत्ति",https://www.jagran.com/uttar-pradesh/prayagraj-uptet-2026-answer-key-row-candidates-object-to-upessc-responses-40300755.html,2026-07-09T15:22:28+00:00
Delhi-NCR,Jagran,Delhi-NCR • Jagran,https://www.jagran.com/delhi-ncr,50,लोनी में एसीपी ऑफिस के सामने सड़क पर तैरता मिला युवक का शव,https://www.jagran.com/uttar-pradesh/ghaziabad-body-found-floating-near-loni-acp-office-ghaziabad-40300740.html,2026-07-09T15:22:28+00:00
Delhi-NCR,Jagran,Delhi-NCR • Jagran,https://www.jagran.com/delhi-ncr,51,"गाजियाबाद पुलिस में बड़ा फेरबदल, 7 ACP के बदले कार्यक्षेत्र; जानें किसे मिली कौन सी जिम्मेदारी?",https://www.jagran.com/uttar-pradesh/ghaziabad-ghaziabad-police-reshuffle-7-acps-transferred-new-roles-40300736.html,2026-07-09T15:22:28+00:00
Delhi-NCR,Jagran,Delhi-NCR • Jagran,https://www.jagran.com/delhi-ncr,52,"'कार्रवाई की तो तेरा भी ओमकार जैसा होगा हाल', डेयरी संचालक की हत्या के बाद अब बड़े भाई को मिली जान से मारने की धमकी",https://www.jagran.com/uttar-pradesh/ghaziabad-loni-dairy-owner-murder-brother-threatened-after-omkars-death-40300724.html,2026-07-09T15:22:28+00:00
Delhi-NCR,Jagran,Delhi-NCR • Jagran,https://www.jagran.com/delhi-ncr,53,"अनुकंपा के आधार पर नौकरी पाने वाले रेलकर्मियों को मिलेगा पुरानी पेंशन का लाभ, पूर्वोत्तर रेलवे ने जारी की गाइडलाइन",https://www.jagran.com/uttar-pradesh/gorakhpur-city-railway-staff-on-compassionate-grounds-get-old-pension-scheme-40300721.html,2026-07-09T15:22:28+00:00
Delhi-NCR,Jagran,Delhi-NCR • Jagran,https://www.jagran.com/delhi-ncr,54,"D.El.Ed. Training 2026 : डीएलएड में सवा लाख से ज्यादा सीटें रह जाएंगी खाली, अब तिथि बढ़ाने का प्रस्ताव",https://www.jagran.com/uttar-pradesh/prayagraj-deled-2026-over-1-lakh-25-thousand-seats-vacant-date-extension-proposed-40300714.html,2026-07-09T15:22:28+00:00
Delhi-NCR,Jagran,Delhi-NCR • Jagran,https://www.jagran.com/delhi-ncr,55,"VIDEO: बारिश में खंभों-ट्रांसफॉर्मरों से करंट का बढ़ा खतरा, पावर काॅरपोरेशन की बचाव को इन बातों का ध्यान रखने की अपील",https://www.jagran.com/uttar-pradesh/meerut-city-electrical-safety-tips-for-rainy-season-hazards-40300690.html,2026-07-09T15:22:28+00:00
Delhi-NCR,Jagran,Delhi-NCR • Jagran,https://www.jagran.com/delhi-ncr,56,"मुरादाबाद में रूह कंपा देने वाली वारदात: पति से अलग रह रही मां-बेटे की बेरहमी से हत्या, पहचान छिपाने के लिए चेहरे भी जलाए",https://www.jagran.com/uttar-pradesh/moradabad-city-moradabad-double-murder-mother-son-killed-bodies-found-field-pakbara-crime-news-40300710.html,2026-07-09T15:22:28+00:00
Delhi-NCR,Jagran,Delhi-NCR • Jagran,https://www.jagran.com/delhi-ncr,57,"महराजगंज में 41 मुकदमे वाला शातिर वाहन चोर गिरफ्तार, दो बाइक और नेपाली मुद्रा बरामद",https://www.jagran.com/uttar-pradesh/maharajganj-notorious-vehicle-thief-arrested-in-maharajganj-bikes-seized-40300711.html,2026-07-09T15:22:28+00:00
Delhi-NCR,Jagran,Delhi-NCR • Jagran,https://www.jagran.com/delhi-ncr,58,"ऑर्डिनेंस फैक्ट्री जीएम को कोरिया की हवाई यात्रा, लोकल फर्म",https://www.jagran.com/uttar-pradesh/firozabad-ordinance-factory-hajratpur-scam-gm-gave-local-firm-orders-of-50-crores-cbi-enquiry-40300217.html,2026-07-09T15:22:28+00:00
Delhi-NCR,Jagran,Delhi-NCR • Jagran,https://www.jagran.com/delhi-ncr,59,"पंचकूला में करोड़ों की विवादित जमीन सौदे में बड़ा खुलासा, खर",https://www.jagran.com/haryana/panchkula-panchkula-land-scam-extehsildar-joginder-sharma-mastermind-40300202.html,2026-07-09T15:22:28+00:00
Delhi-NCR,Jagran,Delhi-NCR • Jagran,https://www.jagran.com/delhi-ncr,60,"हरियाणा से चलेगी देश की पहली हाइड्रोजन ट्रेन, 17 जुलाई को दे",https://www.jagran.com/haryana/sonipat-pm-modi-to-launch-indias-first-hydrogen-train-in-jind-40300155.html,2026-07-09T15:22:28+00:00
Delhi-NCR,Jagran,Delhi-NCR • Jagran,https://www.jagran.com/delhi-ncr,61,इन तंग गलियों में छिपा है स्वाद का असली खजाना! हर फूड लवर को,https://www.jagran.com/lifestyle/food-news-five-best-street-foods-places-in-india-every-food-lover-must-go-40300218.html,2026-07-09T15:22:28+00:00
Delhi-NCR,Jagran,Delhi-NCR • Jagran,https://www.jagran.com/delhi-ncr,62,'गलती मेरी तरफ से...'Alliance में सीमा सजदेह संग अपने डायवोर,https://www.jagran.com/entertainment/bollywood-sohail-khan-ex-wife-seema-sajdeh-enters-alliance-as-wild-cart-contestant-actor-accepts-his-mistake-40300211.html,2026-07-09T15:22:28+00:00
Delhi-NCR,Jagran,Delhi-NCR • Jagran,https://www.jagran.com/delhi-ncr,63,"भागलपुर में 20 मिनट गनपॉइंट पर बंधक रही महिला, अलमारी खंगाल",https://www.jagran.com/bihar/bhagalpur-bhagalpur-robbery-army-jawan-family-held-hostage-lakhs-looted-40300191.html,2026-07-09T15:22:28+00:00
Delhi-NCR,Jagran,Delhi-NCR • Jagran,https://www.jagran.com/delhi-ncr,64,"हरियाणा के इस जिले में धड़ाधड़ कट रहे ट्रैफिक चालान, तीन मही",https://www.jagran.com/haryana/mewat-nuh-police-issues-83759-traffic-challans-in-3-months-40300216.html,2026-07-09T15:22:28+00:00
Delhi-NCR,Jagran,Delhi-NCR • Jagran,https://www.jagran.com/delhi-ncr,65,पुत्र न हो तो क्या क्या पुत्री कर सकती है माता-पिता का श्राद,https://www.jagran.com/spiritual/religion-can-a-daughter-perform-shraddha-for-her-parents-if-there-is-no-son-garuda-purana-rules-40300208.html,2026-07-09T15:22:28+00:00
Delhi-NCR,Jagran,Delhi-NCR • Jagran,https://www.jagran.com/delhi-ncr,66,"हिमाचल के किन्नौर में बाढ़ से खतरे में गांव, मलबा डंप होने स",https://www.jagran.com/himachal-pradesh/shimla-kinnaur-flood-lippa-village-cut-off-bridge-submerged-40300201.html,2026-07-09T15:22:28+00:00
Delhi-NCR,Jagran,Delhi-NCR • Jagran,https://www.jagran.com/delhi-ncr,67,"VIDEO: अयातुल्ला अली खामेनेई का अंतिम सफर, मशहद की इमाम रजा दरगाह में किया जाएगा सुपुर्द-ए-खाक",https://www.jagran.com/world/middle-east-ayatollah-ali-khamenei-final-journey-video-fighter-jets-escort-laid-to-rest-at-imam-reza-shrine-in-mashhad-40300683.html,2026-07-09T15:22:28+00:00
Delhi-NCR,Jagran,Delhi-NCR • Jagran,https://www.jagran.com/delhi-ncr,68,"ENG vs IND 4th T20I Live: सीरीज के साथ साख बचाने उतरेगी भारतीय टीम, संजू सैमसन को मिल सकता है मौका",https://www.jagran.com/cricket/match-report-eng-vs-ind-4th-t20i-live-sanju-samson-vaibhav-suryavanshi-harry-brook-england-vs-india-aaj-ka-match-lb-30000622.html,2026-07-09T15:22:28+00:00
Delhi-NCR,Jagran,Delhi-NCR • Jagran,https://www.jagran.com/delhi-ncr,69,"VIDEO : चीन में बाढ़ के बाद पानी में तैरने लगे हजारों सांप, कई लोगों को काटा; एक महिला की मौत",https://www.jagran.com/world/china-china-floods-nine-hundred-snakes-escape-farms-in-guangxi-40300707.html,2026-07-09T15:22:28+00:00
Delhi-NCR,Jagran,Delhi-NCR • Jagran,https://www.jagran.com/delhi-ncr,70,"आइआइटी बीएचयू छात्रा से सामूहिक दुष्कर्म के मामले में विवेचक से बचाव पक्ष की जिरह पूरी, अगली सुनवाई 13 जुलाई को",https://www.jagran.com/uttar-pradesh/varanasi-city-cross-examination-of-the-investigating-officer-by-the-defense-in-the-iit-bhu-gang-misdeed-case-has-concluded-the-next-hearing-is-scheduled-for-13-july-40300539.html,2026-07-09T15:22:28+00:00
Delhi-NCR,Jagran,Delhi-NCR • Jagran,https://www.jagran.com/delhi-ncr,71,Did You Know,https://www.jagran.com/did-you-know-news-hindi.html,2026-07-09T15:22:28+00:00
Delhi-NCR,Jagran,Delhi-NCR • Jagran,https://www.jagran.com/delhi-ncr,72,फुटबॉल विश्व कप,https://www.jagran.com/topics/fifa-world-cup-2026,2026-07-09T15:22:28+00:00
Delhi-NCR,Jagran,Delhi-NCR • Jagran,https://www.jagran.com/delhi-ncr,73,ए आई बूटकैंप,https://www.jagran.com/events/jagran-next/ai-bootcamp/index.html,2026-07-09T15:22:28+00:00
Delhi-NCR,Jagran,Delhi-NCR • Jagran,https://www.jagran.com/delhi-ncr,74,मिडिल ईस्ट संकट,https://www.jagran.com/topics/Israel-Iran-Conflict,2026-07-09T15:22:28+00:00
Delhi-NCR,Jagran,Delhi-NCR • Jagran,https://www.jagran.com/delhi-ncr,75,फीफा वर्ल्ड कप 2026,https://www.jagran.com/topics/FIFA-World-Cup-2026,2026-07-09T15:22:28+00:00
Delhi-NCR,Jagran,Delhi-NCR • Jagran,https://www.jagran.com/delhi-ncr,76,आज का राशिफल,https://www.jagran.com/topics/rashifal,2026-07-09T15:22:28+00:00
Delhi-NCR,Jagran,Delhi-NCR • Jagran,https://www.jagran.com/delhi-ncr,77,Submit your news,https://www.jagran.com/citizen-journalism-hindi.html,2026-07-09T15:22:28+00:00
Delhi-NCR,Jagran,Delhi-NCR • Jagran,https://www.jagran.com/delhi-ncr,78,Message from the Editor,https://www.jagran.com/policies-and-standards.html,2026-07-09T15:22:28+00:00
Hyderabad,DC,Hyderabad • DC,https://www.deccanchronicle.com/location/india/southern-states,1,FIFA World Cup 2026,https://www.deccanchronicle.com/fifa-world-cup-2026,2026-07-09T15:22:28+00:00
Hyderabad,DC,Hyderabad • DC,https://www.deccanchronicle.com/location/india/southern-states,2,Opinion and Editorials,https://www.deccanchronicle.com/opinion,2026-07-09T15:22:28+00:00
Hyderabad,DC,Hyderabad • DC,https://www.deccanchronicle.com/location/india/southern-states,3,Assembly Elections 2026,https://www.deccanchronicle.com/assembly-elections-2026,2026-07-09T15:22:28+00:00
Hyderabad,DC,Hyderabad • DC,https://www.deccanchronicle.com/location/india/southern-states,4,Telangana Rising 2047,https://www.deccanchronicle.com/tags/Telangana-Rising-2047,2026-07-09T15:22:28+00:00
Chennai,DC,Chennai • DC,https://www.deccanchronicle.com/location/india/tamil-nadu/chennai-madras,1,FIFA World Cup 2026,https://www.deccanchronicle.com/fifa-world-cup-2026,2026-07-09T15:22:28+00:00
Chennai,DC,Chennai • DC,https://www.deccanchronicle.com/location/india/tamil-nadu/chennai-madras,2,Opinion and Editorials,https://www.deccanchronicle.com/opinion,2026-07-09T15:22:28+00:00
Chennai,DC,Chennai • DC,https://www.deccanchronicle.com/location/india/tamil-nadu/chennai-madras,3,Assembly Elections 2026,https://www.deccanchronicle.com/assembly-elections-2026,2026-07-09T15:22:28+00:00
Chennai,DC,Chennai • DC,https://www.deccanchronicle.com/location/india/tamil-nadu/chennai-madras,4,Telangana Rising 2047,https://www.deccanchronicle.com/tags/Telangana-Rising-2047,2026-07-09T15:22:28+00:00
Chennai,The Hindu,Chennai • The Hindu,https://www.thehindu.com/news/cities/chennai/,1,Issue of appointment of V-Cs to State-run varsities heats up,https://www.thehindu.com/news/national/tamil-nadu/issue-of-appointment-of-v-cs-to-state-run-varsities-heats-up/article71198993.ece,2026-07-09T15:22:28+00:00
Chennai,The Hindu,Chennai • The Hindu,https://www.thehindu.com/news/cities/chennai/,2,A total of 139 entries receive awards in The Hindu Margazhi Competition 2025,https://www.thehindu.com/news/cities/chennai/a-total-of-139-entries-receive-awards-in-the-hindumargazhi-competition-2025/article71195512.ece,2026-07-09T15:22:28+00:00
Chennai,The Hindu,Chennai • The Hindu,https://www.thehindu.com/news/cities/chennai/,3,"CMDA plans to shelve projects as it grapples with outstanding liabilities up to ₹3,500 cr.",https://www.thehindu.com/news/cities/chennai/cmda-plans-to-shelve-projects-as-it-grapples-with-outstanding-liabilities-up-to-3500-cr/article71199249.ece,2026-07-09T15:22:28+00:00
Chennai,The Hindu,Chennai • The Hindu,https://www.thehindu.com/news/cities/chennai/,4,There is a need to build a national front against BJP: Thirumavalavan,https://www.thehindu.com/news/national/tamil-nadu/there-is-a-need-to-build-a-national-front-against-bjp-thirumavalavan/article71199202.ece,2026-07-09T15:22:28+00:00
Chennai,The Hindu,Chennai • The Hindu,https://www.thehindu.com/news/cities/chennai/,5,"34 electricity substations to come up in city, three neighbouring districts",https://www.thehindu.com/news/cities/chennai/34-electricity-substations-to-come-up-in-city-three-neighbouring-districts/article71198348.ece,2026-07-09T15:22:28+00:00
Chennai,The Hindu,Chennai • The Hindu,https://www.thehindu.com/news/cities/chennai/,6,Chennai couple’s half-century journey from pottery to star hotels,https://www.thehindu.com/news/cities/chennai/assisted-by-his-wife-curd-pot-maker-in-chennai-supplies-stock-regularly-to-star-hotel/article71182642.ece,2026-07-09T15:22:28+00:00
Chennai,The Hindu,Chennai • The Hindu,https://www.thehindu.com/news/cities/chennai/,7,CM Vijay conducts surprise inspection at Govt. Hospital for Women and Children in Egmore,https://www.thehindu.com/news/national/tamil-nadu/cm-vijay-conducts-surprise-inspection-at-govt-hospital-for-women-and-children-in-egmore/article71198667.ece,2026-07-09T15:22:28+00:00
Chennai,The Hindu,Chennai • The Hindu,https://www.thehindu.com/news/cities/chennai/,8,Minister Nirmalkumar’s claims on Parandur site a false propaganda: T.N. BJP,https://www.thehindu.com/news/national/tamil-nadu/minister-nirmalkumarsclaims-on-parandur-site-a-false-propaganda-tn-bjp/article71201277.ece,2026-07-09T15:22:28+00:00
