city,publisher,source,source_url,rank,headline,link,collected_at_iso
Bengaluru,DC,Bengaluru • DC,https://www.deccanchronicle.com/location/india/karnataka/bengaluru,1,Assembly Elections 2026,https://www.deccanchronicle.com/assembly-elections-2026,2026-04-20T10:03:46+00:00
Bengaluru,DC,Bengaluru • DC,https://www.deccanchronicle.com/location/india/karnataka/bengaluru,2,Opinion and Editorials,https://www.deccanchronicle.com/opinion,2026-04-20T10:03:46+00:00
Bengaluru,DC,Bengaluru • DC,https://www.deccanchronicle.com/location/india/karnataka/bengaluru,3,Telangana Rising 2047,https://www.deccanchronicle.com/tags/Telangana-Rising-2047,2026-04-20T10:03:46+00:00
Mumbai,Mumbai Mirror,Mumbai • Mumbai Mirror,https://mumbaimirror.indiatimes.com/mumbai,1,Burst pipeline leaves seven buildings dry,https://mumbaimirror.indiatimes.com/mumbai/burst-pipeline-leaves-seven-buildings-dry/articleshow/130376105.html,2026-04-20T10:03:46+00:00
Mumbai,Mumbai Mirror,Mumbai • Mumbai Mirror,https://mumbaimirror.indiatimes.com/mumbai,2,The other modernists,https://mumbaimirror.indiatimes.com/unwind/the-other-modernists/articleshow/130375334.html,2026-04-20T10:03:46+00:00
Mumbai,Mumbai Mirror,Mumbai • Mumbai Mirror,https://mumbaimirror.indiatimes.com/mumbai,3,SIR alert: Cong trains cadre as voter fears rise,https://mumbaimirror.indiatimes.com/mumbai/sir-alert-cong-trains-cadre-as-voter-fears-rise/articleshow/130376014.html,2026-04-20T10:03:46+00:00
Mumbai,Mumbai Mirror,Mumbai • Mumbai Mirror,https://mumbaimirror.indiatimes.com/mumbai,4,‘Fitness is not for the screen; it’s about longevity’,https://mumbaimirror.indiatimes.com/you/fitness-is-not-for-the-screen-its-about-longevity/articleshow/130374731.html,2026-04-20T10:03:46+00:00
Mumbai,Mumbai Mirror,Mumbai • Mumbai Mirror,https://mumbaimirror.indiatimes.com/mumbai,5,Rich kids sold drugs for a year,https://mumbaimirror.indiatimes.com/mumbai/cover-story/rich-kids-sold-drugs-for-a-year/articleshow/130376098.html,2026-04-20T10:03:46+00:00
Mumbai,Mumbai Mirror,Mumbai • Mumbai Mirror,https://mumbaimirror.indiatimes.com/mumbai,6,HOSP TRANSFERS CRITICAL PATIENT IN AUTO,https://mumbaimirror.indiatimes.com/mumbai/hosp-transfers-critical-patient-in-auto/articleshow/130376004.html,2026-04-20T10:03:46+00:00
Mumbai,Mumbai Mirror,Mumbai • Mumbai Mirror,https://mumbaimirror.indiatimes.com/mumbai,7,"YO SAM, IT’S GONE TOO FAR!",https://mumbaimirror.indiatimes.com/mumbai/cover-story/yo-sam-its-gone-too-far/articleshow/130376097.html,2026-04-20T10:03:46+00:00
Mumbai,Mumbai Mirror,Mumbai • Mumbai Mirror,https://mumbaimirror.indiatimes.com/mumbai,8,Ask The Sexpert,https://mumbaimirror.indiatimes.com/ask-the-sexpert,2026-04-20T10:03:46+00:00
Mumbai,Sakal,Mumbai • Sakal,https://www.esakal.com/pune,1,सकाळ लाईव्ह TV,https://www.esakal.com/live-tv,2026-04-20T10:03:46+00:00
Mumbai,Sakal,Mumbai • Sakal,https://www.esakal.com/pune,2,Refund and Cancellation,https://www.esakal.com/refund-and-cancellation,2026-04-20T10:03:46+00:00
Mumbai,Lokmat,Mumbai • Lokmat,https://www.lokmat.com/city/,1,Live News in Marathi,https://www.lokmat.com/live-news/,2026-04-20T10:03:46+00:00
Mumbai,Lokmat,Mumbai • Lokmat,https://www.lokmat.com/city/,2,"महिला आरक्षण: सुप्रिया सुळेंनी CM फडणवीसांचे आव्हान स्वीकारले; म्हणाल्या, “वेळ-जागा सांगा”",https://www.lokmat.com/maharashtra/women-reservation-bill-row-ncp-sp-group-mp-supriya-sule-accepts-cm-devendra-fadnavis-challenge-and-said-tell-the-time-and-place-a-a719/,2026-04-20T10:03:46+00:00
Mumbai,Lokmat,Mumbai • Lokmat,https://www.lokmat.com/city/,3,पिंपरी -चिंचवड :,https://www.lokmat.com/pimpri-chinchwad/,2026-04-20T10:03:46+00:00
Mumbai,Lokmat,Mumbai • Lokmat,https://www.lokmat.com/city/,4,"भरधाव वेगाने व निष्काळजीपणे चालवली दुचाकी; रस्ता दुभाजकाला धडकून तरुणाचा जागीच मृत्यू, निगडीतील घटना",https://www.lokmat.com/pimpri-chinchwad/a-young-man-died-on-the-spot-after-hitting-a-road-divider-while-riding-a-two-wheeler-at-high-speed-and-carelessly-incident-in-nigdi-a-a727/,2026-04-20T10:03:46+00:00
Mumbai,Lokmat,Mumbai • Lokmat,https://www.lokmat.com/city/,5,ऐन उन्हाळ्यात पिंपरी चिंचवडच्या 'या' भागात तब्बल १७ तास बत्ती गुल; उकाड्याने नागरिक हैराण,https://www.lokmat.com/pimpri-chinchwad/in-the-middle-of-summer-electricity-went-out-for-17-hours-in-this-area-of-pimpri-chinchwad-citizens-were-shocked-by-the-heat-a-a727/,2026-04-20T10:03:46+00:00
Mumbai,Lokmat,Mumbai • Lokmat,https://www.lokmat.com/city/,6,वर्षात साडेपाच हजार पुणेकरांनी काढला आंतरराष्ट्रीय वाहन परवाना; परदेशात ड्रायव्हिंगची वाढली क्रेझ,https://www.lokmat.com/pune/five-and-a-half-thousand-pune-residents-obtained-international-driving-licenses-in-a-year-driving-abroad-craze-increases-a-a727/,2026-04-20T10:03:46+00:00
Mumbai,Lokmat,Mumbai • Lokmat,https://www.lokmat.com/city/,7,पुण्यात व्यावसायिकाची निवृत्त एसीपीकडून तब्बल अडीच कोटींची फसवणूक; धमकी दिल्याचाही आरोप,https://www.lokmat.com/pune/businessman-in-pune-cheated-of-rs-25-crore-by-retired-acp-also-accused-of-threatening-him-a-a727/,2026-04-20T10:03:46+00:00
Mumbai,Lokmat,Mumbai • Lokmat,https://www.lokmat.com/city/,8,शेवटची इच्छा पूर्ण! 'स्वरस्वामिनी' आशा भोसले यांच्या अस्थींचे पवित्र गंगेत विसर्जन,https://www.lokmat.com/filmy/late-singer-asha-bhosle-mortal-remains-immersed-in-holy-river-ganga-see-photos-a-a747/,2026-04-20T10:03:46+00:00
Mumbai,Lokmat,Mumbai • Lokmat,https://www.lokmat.com/city/,9,"“राज्यातून १ कोटी सह्या घेणार, काँग्रेसचा महिला विरोधी चेहरा उघड करू”: CM देवेंद्र फडणवीस",https://www.lokmat.com/mumbai/cm-devendra-fadnavis-slams-congress-thackeray-group-and-ncp-sp-group-over-women-reservation-bill-and-said-we-will-collect-1-crore-women-signatures-from-the-state-a-a719/,2026-04-20T10:03:46+00:00
Mumbai,Lokmat,Mumbai • Lokmat,https://www.lokmat.com/city/,10,बिल्डर अविनाश भोसले यांना दिलासा; मालमत्तांवरील कारवाई रद्द,https://www.lokmat.com/mumbai/relief-for-avinash-bhosale-pmla-tribunal-quashes-ed-asset-seizure-in-dhfl-case-a-a1012/,2026-04-20T10:03:46+00:00
Mumbai,Lokmat,Mumbai • Lokmat,https://www.lokmat.com/city/,11,‘तुम्ही घुसखोर आहात का? हे सिद्ध करण्याची वेळ आणू नका’ म्हाडाच्या उपाध्यक्षांची नागरिकांना दमदाटी,https://www.lokmat.com/mumbai/are-you-an-intruder-dont-waste-time-proving-it-mhada-vice-chairman-tells-citizens-a-a1012/,2026-04-20T10:03:46+00:00
Mumbai,Lokmat,Mumbai • Lokmat,https://www.lokmat.com/city/,12,कॉन्सर्टमध्ये ड्रग्ज विक्रेत्यांना एन्ट्री देणारा सुरक्षा रक्षक अटकेत; आरोपींची संख्या १० वर!,https://www.lokmat.com/mumbai/security-guard-arrested-for-allowing-drug-dealers-into-concert-number-of-accused-rises-to-10-a-a1012/,2026-04-20T10:03:46+00:00
Mumbai,Lokmat,Mumbai • Lokmat,https://www.lokmat.com/city/,13,संघाच्या 'झेड प्लस' सुरक्षेचा खर्च वसूल करण्याची मागणी हायकोर्टाने फेटाळली,https://www.lokmat.com/nagpur/high-court-rejects-demand-to-recover-expenses-for-teams-z-plus-security-a-a597/,2026-04-20T10:03:46+00:00
Mumbai,Lokmat,Mumbai • Lokmat,https://www.lokmat.com/city/,14,"धार्मिक चालीरितींचे पालन करण्याचा कार्यालयातील तरुणींवर दबाव, नागपुरातील एनजीओ चालकाला अटक",https://www.lokmat.com/nagpur/ngo-driver-in-nagpur-arrested-for-pressuring-young-women-in-office-to-follow-religious-customs-a-a1013/,2026-04-20T10:03:46+00:00
Mumbai,Lokmat,Mumbai • Lokmat,https://www.lokmat.com/city/,15,विदर्भ बनला आगीची भट्टी ! नागपूरचा पारा ४४.४ वर; २१ तारखेपासून 'या' जिल्ह्यात पावसाचे संकेत,https://www.lokmat.com/nagpur/vidarbha-has-become-a-fire-pit-nagpurs-mercury-hits-444-rain-likely-in-this-district-from-21st-a-a957-c1000/,2026-04-20T10:03:46+00:00
Mumbai,Lokmat,Mumbai • Lokmat,https://www.lokmat.com/city/,16,परिवहन महामंडळाच्या जमीन लीजवरून सरकारला फटकारले; दोन आठवड्यांत स्पष्टीकरण मागितले,https://www.lokmat.com/nagpur/government-reprimanded-over-land-lease-of-transport-corporation-asked-for-explanation-within-two-weeks-a-a1000/,2026-04-20T10:03:46+00:00
Mumbai,Lokmat,Mumbai • Lokmat,https://www.lokmat.com/city/,17,"नाशिक TCS प्रकरण: ""लग्नानंतर रात्री कशात व्यस्त असतेस?"" चौथ्या पीडितेचा थरकाप उडवणारा जबाब",https://www.lokmat.com/maharashtra/nashik-tcs-case-what-are-you-busy-with-at-night-after-marriage-the-shocking-answer-of-the-fourth-victim-a-a607/,2026-04-20T10:03:46+00:00
Mumbai,Lokmat,Mumbai • Lokmat,https://www.lokmat.com/city/,18,"""...तर नागदेवता तुझ्या मुलास दंश करेल""; भोंदू अशोक खरातने महिलेला दाखवलेली भीती",https://www.lokmat.com/nashik/then-the-snake-will-bite-your-child-the-fear-shown-to-the-woman-by-the-fraudster-ashok-kharat-a-a597/,2026-04-20T10:03:46+00:00
Mumbai,Lokmat,Mumbai • Lokmat,https://www.lokmat.com/city/,19,TCS धर्मांतरातील आरोपी निदा खानने ११ एप्रिलला मुंब्र्यात घेतले उपचार; जामीन अर्जावर सुनावणी,https://www.lokmat.com/nashik/tcs-conversion-case-accused-nida-khan-underwent-treatment-in-mumbai-on-april-11-bail-application-to-be-heard-today-a-a597/,2026-04-20T10:03:46+00:00
Mumbai,Lokmat,Mumbai • Lokmat,https://www.lokmat.com/city/,20,जबरदस्तीने फोटो काढून अत्याचार अन् धर्मांतरास प्रवृत्त केल्याचा आरोप; पंचवटी पोलिसांची मोठी कारवाई,https://www.lokmat.com/nashik/allegations-of-forcibly-taking-photos-and-inciting-torture-and-conversion-panchavati-police-take-major-action-a-a1012/,2026-04-20T10:03:46+00:00
Mumbai,Lokmat,Mumbai • Lokmat,https://www.lokmat.com/city/,21,"WWE नाही मनमाडच्या स्थानकावरील Video! अंगावर शहारे येतील, रेल्वेच्या ओव्हरहेड इलेक्ट्रिक खांबावर चढला माथेफिरू",https://www.lokmat.com/nashik/no-wwe-video-from-nashik-manmad-railway-station-high-voltage-drama-at-manmad-railway-station-man-climbs-overhead-electric-pole-a-a607/,2026-04-20T10:03:46+00:00
Mumbai,Lokmat,Mumbai • Lokmat,https://www.lokmat.com/city/,22,लेझीम-हलगीच्या ठेक्यावर शिवशाही अवतरली; सर्वत्र छत्रपती शिवाजी महाराज जयंतीचा जल्लोष,https://www.lokmat.com/kolhapur/shivshahi-descends-on-the-lezim-halgi-border-chhatrapati-shivaji-maharaj-jayanti-celebrated-everywhere-a-a719/,2026-04-20T10:03:46+00:00
Mumbai,Lokmat,Mumbai • Lokmat,https://www.lokmat.com/city/,23,वीरशैव समाजातर्फे बसवेश्वर जयंती मिरवणूक; महिलांचा मोठा सहभाग,https://www.lokmat.com/kolhapur/basaveshwara-jayanti-procession-by-veerashaiva-samaj-large-participation-of-women-a-a719/,2026-04-20T10:03:46+00:00
Mumbai,Lokmat,Mumbai • Lokmat,https://www.lokmat.com/city/,24,"जयसिंगपूरसह शिरोळ, कुरुंदवाडला पावसाने झोडपले; वातावरणात गारवा, काही ठिकाणी गारांचा पाऊस",https://www.lokmat.com/kolhapur/rain-lashed-jaysingpur-shirol-kurundwad-sleet-in-the-atmosphere-hail-in-some-places-a-a719/,2026-04-20T10:03:46+00:00
Mumbai,Lokmat,Mumbai • Lokmat,https://www.lokmat.com/city/,25,महाराष्ट्राचा इतिहास जगभर व्हावा हा जयसिंगराव पवारांचा प्रयत्न - आमदार रोहित पवार,https://www.lokmat.com/kolhapur/jaisingrao-pawars-effort-is-to-make-maharashtras-history-known-to-the-world-says-mla-rohit-pawar-a-a597/,2026-04-20T10:03:46+00:00
Mumbai,Lokmat,Mumbai • Lokmat,https://www.lokmat.com/city/,26,'गोकुळ'मधील वाद मिटवण्यासाठी मंत्री चंद्रकांत पाटील यांचा पुढाकार; राष्ट्रवादीच्या नेत्यांसोबत चर्चा,https://www.lokmat.com/kolhapur/minister-chandrakant-patil-initiative-to-resolve-the-dispute-in-gokul-discussion-with-ncp-leaders-a-a719/,2026-04-20T10:03:46+00:00
Mumbai,Lokmat,Mumbai • Lokmat,https://www.lokmat.com/city/,27,अंतर्गत मतभेद चव्हाट्यावर: सांगलीत ‘स्वीकृत’वरून राष्ट्रवादीच्या ३५ पदाधिकाऱ्यांचे राजीनामे,https://www.lokmat.com/sangli/internal-differences-on-the-rise-35-ncp-office-bearers-resign-over-in-sangli-a-a732/,2026-04-20T10:03:46+00:00
Mumbai,Lokmat,Mumbai • Lokmat,https://www.lokmat.com/city/,28,मोबाईल-लॅपटॉप गायब अन् कारची अदलाबदल! तहसीलदार गिड्डे यांच्या मृत्यूचे गूढ वाढले; तपास आता गुन्हे शाखेकडे!,https://www.lokmat.com/beed/tehsildar-rakesh-gidde-death-case-accident-or-murder-investigation-handed-over-to-local-crime-branch-a-a320/,2026-04-20T10:03:46+00:00
Mumbai,Lokmat,Mumbai • Lokmat,https://www.lokmat.com/city/,29,प्रेमविवाहानंतर पतीची 'चॉईस' बदलली; तृतीयपंथी सोबतच्या नको त्या संबंधाना विरोध केल्याने पत्नीची हत्या,https://www.lokmat.com/sangli/sangli-crime-vita-man-kills-wife-with-iron-rod-over-his-alleged-relationship-with-a-transgender-person-a-a1001/,2026-04-20T10:03:46+00:00
Mumbai,Lokmat,Mumbai • Lokmat,https://www.lokmat.com/city/,30,शेततळ्यात बुडून आजोबाचा मृत्युः नातवाला वाचवले,https://www.lokmat.com/sangli/miraj-farmer-drowns-in-farm-pond-two-young-sisters-save-7-year-old-brother-life-a-a1001/,2026-04-20T10:03:46+00:00
Mumbai,Lokmat,Mumbai • Lokmat,https://www.lokmat.com/city/,31,सांगली हादरली! पत्नीला घरात ठेवण्याच्या हट्टापायी आईची हत्या; वडील घरी नसताना मुलाचे क्रूर कृत्य,https://www.lokmat.com/sangli/miraj-son-kills-mother-following-dispute-over-bringing-wife-home-arrested-by-kupwad-police-a-a1001/,2026-04-20T10:03:46+00:00
Mumbai,Lokmat,Mumbai • Lokmat,https://www.lokmat.com/city/,32,अर्भक मृत्यू प्रकरणात 'सिव्हिल'च्या डॉक्टरांवर सदोष मनुष्यवधाचा गुन्हा,https://www.lokmat.com/satara/mobile-money-at-the-risk-of-life-friend-killed-friend-by-crushing-him-with-a-stone-under-the-bridge-on-kolhapur-sangli-highway-a-a1001/,2026-04-20T10:03:46+00:00
Mumbai,Lokmat,Mumbai • Lokmat,https://www.lokmat.com/city/,33,साताऱ्याने ४१ अंशाचा टप्पाही पार केला; माण तालुक्यात उष्माघाताचा बळी,https://www.lokmat.com/satara/satara-heat-wave-news-satara-crosses-41-degree-mark-heatstroke-victim-in-maan-taluka-a-a829-c607/,2026-04-20T10:03:46+00:00
Mumbai,Lokmat,Mumbai • Lokmat,https://www.lokmat.com/city/,34,संतापजनक! मराठा साम्राज्याचा विस्तार दर्शविणारा नकाशा आठवीच्या पुस्तकातून NCERT ने वगळला,https://www.lokmat.com/maharashtra/ncert-removes-map-showing-expansion-of-maratha-empire-from-8th-standard-textbook-a-a629/,2026-04-20T10:03:46+00:00
Mumbai,Lokmat,Mumbai • Lokmat,https://www.lokmat.com/city/,35,फलटण उपजिल्हा रुग्णालयात उपचार घेणाऱ्या मुलीचा विनयभंग; संशयिताविरुद्ध तक्रार दाखल,https://www.lokmat.com/satara/shocking-18-year-old-patient-molested-inside-phaltan-sub-district-hospital-accused-arrested-a-a1012/,2026-04-20T10:03:46+00:00
Mumbai,Lokmat,Mumbai • Lokmat,https://www.lokmat.com/city/,36,"“शशिकांत शिंदे हे मूळचे शिवसैनिक, शिवसेनेत आल्यास पहिले स्वागत मी करेन”; कुणी दिली ऑफर?",https://www.lokmat.com/maharashtra/shiv-sena-shinde-group-mahesh-shinde-said-shashikant-shinde-is-originally-a-shiv-sainik-if-he-joins-party-i-will-be-the-first-to-welcome-him-a-a719/,2026-04-20T10:03:46+00:00
Mumbai,Lokmat,Mumbai • Lokmat,https://www.lokmat.com/city/,37,"अकोला, वर्धा देशात सर्वाधिक ‘हॉट’; पार ४५ अंश सेल्सिअसवर पारा",https://www.lokmat.com/akola/akola-wardha-hottest-in-the-country-mercury-at-45-degrees-celsius-a-a1013/,2026-04-20T10:03:46+00:00
Mumbai,Lokmat,Mumbai • Lokmat,https://www.lokmat.com/city/,38,अकोल्यात उष्माघाताचा पहिला बळी? ४४ अंश तापमानाने घेतला जीव; ऑटोमध्ये आढळला मृतदेह,https://www.lokmat.com/akola/first-victim-of-heatstroke-in-akola-44-degree-temperature-claimed-his-life-body-found-in-auto-a-a941/,2026-04-20T10:03:46+00:00
Mumbai,Lokmat,Mumbai • Lokmat,https://www.lokmat.com/city/,39,"विदर्भात पारा ५ अंशांनी वाढला; अकोला जिल्हा सर्वाधिक ‘हॉट’,थंड हवेचे ठिकाण बुलढाणाही तापले",https://www.lokmat.com/akola/mercury-rises-by-5-degrees-in-vidarbha-akola-district-is-the-hottest-a-a301/,2026-04-20T10:03:46+00:00
Mumbai,Lokmat,Mumbai • Lokmat,https://www.lokmat.com/city/,40,अकोला पोलीस दलात खळबळ! महिला आरोपीकडे मुलीची मागणी करणाऱ्या सहाय्यक पोलीस निरीक्षकाचे निलंबन,https://www.lokmat.com/akola/api-rajesh-jadhav-akola-police-officer-suspended-for-demanding-physical-pleasure-from-arrested-female-accused-a-a400-c607/,2026-04-20T10:03:46+00:00
Mumbai,Lokmat,Mumbai • Lokmat,https://www.lokmat.com/city/,41,गॅसटंचाईचा पहिला बळी अकोल्यात; सिलिंडरसाठी रांगेत असताना माजी सरपंचाचा मृत्यू,https://www.lokmat.com/akola/first-victim-of-gas-shortage-in-akola-former-sarpanch-dies-while-waiting-in-line-for-cylinder-a-a1001/,2026-04-20T10:03:46+00:00
Mumbai,Lokmat,Mumbai • Lokmat,https://www.lokmat.com/city/,42,"'तुम्ही येथून निघून जा म्हणायचा', मृतदेह सापडलेल्या मल्हारीचा बहिणीनेच आवळला गळा; हत्येचे बिंग फुटले",https://www.lokmat.com/solapur/solapur-crime-he-have-said-tha-get-out-of-from-my-house-sister-kills-brother-in-solapur-a-a571/,2026-04-20T10:03:46+00:00
Mumbai,Lokmat,Mumbai • Lokmat,https://www.lokmat.com/city/,43,झेंडावंदनाचं स्वप्न अन् मायक्रोसॉफ्टचं लाखोंचं पॅकेज नाकारलं; सोलापूरच्या नव्या सीईओंचा थक्क करणारा प्रवास!,https://www.lokmat.com/solapur/from-microsoft-to-ias-kushal-jain-quits-high-paying-tech-job-to-serve-the-nation-a-a1001/,2026-04-20T10:03:46+00:00
Mumbai,Lokmat,Mumbai • Lokmat,https://www.lokmat.com/city/,44,"""मला वाटतं अशोक खरातचा एन्काऊंटर करतील, कारण...!""; प्रणिती शिंदे यांनी व्यक्त केली वेगळीच शंका",https://www.lokmat.com/maharashtra/i-think-ashok-will-do-an-encounter-with-kharat-praniti-shinde-expressed-a-different-doubt-a-a653/,2026-04-20T10:03:46+00:00
Mumbai,Lokmat,Mumbai • Lokmat,https://www.lokmat.com/city/,45,"मोठी बातमी; सोलापूरचा पारा ४२.५ अंशांवर; सूर्य ओकतोय आग, जनजीवन विस्कळीत !",https://www.lokmat.com/solapur/big-news-solapurs-temperature-at-425-degrees-a-a732/,2026-04-20T10:03:46+00:00
Mumbai,Lokmat,Mumbai • Lokmat,https://www.lokmat.com/city/,46,केंद्र अन् राज्य सरकारच्या लोककल्याणकारी योजना वांझ ठरताहेत; डॉ. श्रीपाल सबनीस यांचा घणाघात,https://www.lokmat.com/solapur/the-welfare-schemes-of-the-central-and-state-governments-are-proving-fruitless-dr-shripal-sabniss-attack-a-a571/,2026-04-20T10:03:46+00:00
Mumbai,Lokmat,Mumbai • Lokmat,https://www.lokmat.com/city/,47,"""माझ्यामध्ये दैवीशक्ती आहे, कॅन्सरसारखे आजारही बरे करतो"", संगमनेरमधील भोंदूबाबा गजाआड",https://www.lokmat.com/ahilyanagar/i-have-divine-power-i-can-cure-diseases-like-cancer-bhondubaba-gajaad-from-sangamner-a-a1012/,2026-04-20T10:03:46+00:00
Mumbai,Lokmat,Mumbai • Lokmat,https://www.lokmat.com/city/,48,"भोंदू खरातच्या ट्रस्टवरील विश्वस्त जितेंद्र शेळकेंचा अपघाती मृत्यू, १२ वर्षांचा मुलगा बचावला",https://www.lokmat.com/ahilyanagar/jitendra-shelke-a-trustee-of-ashok-kharats-trust-died-in-an-accident-a-a301/,2026-04-20T10:03:46+00:00
Mumbai,Lokmat,Mumbai • Lokmat,https://www.lokmat.com/city/,49,"""मूल नसणाऱ्या स्त्रियांना मूल देतो""; संगमनेरच्या भोंदू गडगे बाबाचा पर्दाफाश, पोलिसांनी ठोकल्या बेड्या!",https://www.lokmat.com/ahilyanagar/self-styled-godman-gadge-baba-arrested-in-sangamner-wadgaon-pan-for-defrauding-people-a-a377-c1001/,2026-04-20T10:03:46+00:00
Mumbai,Lokmat,Mumbai • Lokmat,https://www.lokmat.com/city/,50,"चाकणकरांच्या बहिणीची ८ तास चौकशी, ६० कोटींच्या उलाढालीवर म्हणाल्या, "" बातमी कळली तेव्हा...""",https://www.lokmat.com/ahilyanagar/police-question-pratibha-chakankar-for-8-hours-in-fake-bank-account-case-a-a1001/,2026-04-20T10:03:46+00:00
