city,publisher,source,source_url,rank,headline,link,collected_at_iso
Pune,Pune Mirror,Pune • Pune Mirror,https://punemirror.com/,16,"Pune Gears Up for Grand Arrival of Sant Dnyaneshwar, Tukaram Maharaj Palkhis",https://punemirror.com/news/pune-ready-welcome-sant-dnyaneshwar-tukaram-maharaj-palkhis/,2026-07-10T11:10:36+00:00
Pune,Pune Mirror,Pune • Pune Mirror,https://punemirror.com/,17,"Three Tremors Jolt Marathwada Overnight, Collector Calls for Calm and Caution",https://punemirror.com/city/pune/marathwada-tremors-jolt-overnight-collectot-calm-caution-calls/,2026-07-10T11:10:36+00:00
Pune,Pune Mirror,Pune • Pune Mirror,https://punemirror.com/,18,"Moshi Building Collapse: Rescue Enters Day 2, Six to Seven Still Feared Trapped",https://punemirror.com/city/pune/moshi-building-collapse-rescue-day-2-six-seven-still-trapped/,2026-07-10T11:10:36+00:00
Pune,Pune Mirror,Pune • Pune Mirror,https://punemirror.com/,19,Google Pixel 11 series Stunning Leak Signals Big Price Jump,https://punemirror.com/technology/google-pixel-11-series-price-storage-leak/,2026-07-10T11:10:36+00:00
Pune,Pune Mirror,Pune • Pune Mirror,https://punemirror.com/,20,Meta Business Agent delivers powerful boost for WhatsApp businesses in India,https://punemirror.com/news/meta-business-agent-whatsapp-india-launch/,2026-07-10T11:10:36+00:00
Pune,Pune Mirror,Pune • Pune Mirror,https://punemirror.com/,21,Meta super sensing smart glasses spark serious privacy backlash,https://punemirror.com/technology/meta-super-sensing-smart-glasses/,2026-07-10T11:10:36+00:00
Pune,Pune Mirror,Pune • Pune Mirror,https://punemirror.com/,22,Muse Image Instagram backlash: powerful new AI sparks privacy alarm,https://punemirror.com/technology/muse-image-instagram-privacy-tools/,2026-07-10T11:10:36+00:00
Pune,Pune Mirror,Pune • Pune Mirror,https://punemirror.com/,23,Noise REP Band Powerful Launch Delights Health-Focused Users in India,https://punemirror.com/technology/noise-rep-band-screenless-fitness-tracker/,2026-07-10T11:10:36+00:00
Pune,Pune Mirror,Pune • Pune Mirror,https://punemirror.com/,24,"No VIP Darshan, Only Discipline: Pune Police Lock In Security Plan Ahead Of Palkhi Arrival",https://punemirror.com/city/pune/pune-police-palkhi-arrival-no-vip-darshan-only-discipline-security-plan/,2026-07-10T11:10:36+00:00
Pune,Pune Mirror,Pune • Pune Mirror,https://punemirror.com/,25,"PMC Faces Residents’ Wrath Over Two-Month-Old Road Crater at NIBM Annexe, Safety Concerns Mount",https://punemirror.com/city/pune/pmc-nibm-residents-wrath-2-months-old-road-safety-concerns/,2026-07-10T11:10:36+00:00
Pune,Pune Mirror,Pune • Pune Mirror,https://punemirror.com/,26,Marathi Actor Arbaz Shaikh Alleges Overcharging by Solapur Hospital While Seeking Help for Ailing Father,https://punemirror.com/city/pune/arbaz-shaikh-alleges-solapur-hospital-forced-costly-medicine-purchases/,2026-07-10T11:10:36+00:00
Pune,Pune Mirror,Pune • Pune Mirror,https://punemirror.com/,27,PMC Restores Daily Water Supply Till July 12 as Reservoir Levels Improve,https://punemirror.com/city/pune/pmc-restores-daily-water-supply-till-july-12/,2026-07-10T11:10:36+00:00
Pune,Pune Mirror,Pune • Pune Mirror,https://punemirror.com/,28,Baner-Balewadi Residents Blame PCMC’S River Rejuvenation Project for Worsening Floods,https://punemirror.com/city/pcmc/baner-balewadi-river-project-pcmc-project/,2026-07-10T11:10:36+00:00
Pune,Pune Mirror,Pune • Pune Mirror,https://punemirror.com/,29,State Government Hands Over 50 Acres in Tathawade for Pimpri Chinchwad Police Headquarters,https://punemirror.com/city/state-government-hands-over-50-acres-in-tathawade-for-pimpri-chinchwad-police-headquarters/,2026-07-10T11:10:36+00:00
Pune,Pune Mirror,Pune • Pune Mirror,https://punemirror.com/,30,Gutkha Dispute Turns Violent: Man Allegedly Attacks Sister With Axe in Pimpri-Chinchwad,https://punemirror.com/city/pune/pimpri-chinchwad-man-attacks-sister-with-axe-over-gutkha-dispute/,2026-07-10T11:10:36+00:00
Pune,Pune Mirror,Pune • Pune Mirror,https://punemirror.com/,31,"Caught Red-Handed: PCMC Inspector Nabbed Accepting ₹70,000 Bribe in ACB Sting",https://punemirror.com/city/pune/pcmc-inspector-nabbed-bribe-70000-acb-string/,2026-07-10T11:10:36+00:00
Pune,Pune Mirror,Pune • Pune Mirror,https://punemirror.com/,32,City gasping for clean air,https://punemirror.com/city/pcmc/pimpri-chinchwad-air-pollution-health-crisis/,2026-07-10T11:10:36+00:00
Pune,Pune Mirror,Pune • Pune Mirror,https://punemirror.com/,33,Biomedical waste poses grave threat,https://punemirror.com/city/pcmc/pcmc-biomedical-waste-risk-chemist-warning/,2026-07-10T11:10:36+00:00
Pune,Pune Mirror,Pune • Pune Mirror,https://punemirror.com/,34,"Tamara Residents Flag Safety Lapses, Move PCMC Against Builder",https://punemirror.com/city/pcmc/tamara-society-pcmc-builder-safety-complaint/,2026-07-10T11:10:36+00:00
Pune,Pune Mirror,Pune • Pune Mirror,https://punemirror.com/,35,Six-Woman Gang Held for Stealing Gold from Bus Passengers in Pimpri Chinchwad,https://punemirror.com/city/pcmc/pimpri-chinchwad-bus-jewellery-theft-women-gang/,2026-07-10T11:10:36+00:00
Pune,Pune Mirror,Pune • Pune Mirror,https://punemirror.com/,36,"PCMC Plans ₹243 Crore Road Repairs Across 306 km, Focus on Data-Driven Maintenance",https://punemirror.com/city/pcmc/pcmc-road-repair-plan-243-crore-gis-rams/,2026-07-10T11:10:36+00:00
Pune,Pune Mirror,Pune • Pune Mirror,https://punemirror.com/,37,Indus Waters Treaty Shines as New India-Pakistan Flashpoint After Track-2 Discussions Trigger Speculation,https://punemirror.com/india/indus-waters-treaty-india-pakistan-track-2-talks/,2026-07-10T11:10:36+00:00
Pune,Pune Mirror,Pune • Pune Mirror,https://punemirror.com/,38,"Flames, Fear, and a Frantic Monday: Fire Tears Through Lucknow Coaching Centre as Students Leap for Their Lives",https://punemirror.com/news/flames-fear-and-a-frantic-monday-fire-tears-through-lucknow-coaching-centre-as-students-leap-for-their-lives/,2026-07-10T11:10:36+00:00
Pune,Pune Mirror,Pune • Pune Mirror,https://punemirror.com/,39,Mythos AI cybersecurity India sparks urgent and alarming security overhaul,https://punemirror.com/technology/ai/mythos-ai-cybersecurity-india-banks-govt-risk/,2026-07-10T11:10:36+00:00
Pune,Pune Mirror,Pune • Pune Mirror,https://punemirror.com/,40,Cockroach Janta Party: How a CJI Remark Sparked a Sarcastic Youth Political Movement,https://punemirror.com/news/cockroach-janta-party-abhijeet-dipke-youth-satire/,2026-07-10T11:10:36+00:00
Pune,Pune Mirror,Pune • Pune Mirror,https://punemirror.com/,41,India’s Passport ranked 125th in the Global Passport Index 2026; yet mobility is a challenge,https://punemirror.com/india/india-passport-rank-global-passport-index-2026/,2026-07-10T11:10:36+00:00
Pune,Pune Mirror,Pune • Pune Mirror,https://punemirror.com/,42,SC Denies Meghalaya’s Request To Re-Arrest Sonam Raghuvanshi In Honeymoon Murder Case,https://punemirror.com/india/supreme-court-sonam-raghuvanshi-bail-meghalaya-honeymoon-murder-case/,2026-07-10T11:10:36+00:00
Pune,Pune Mirror,Pune • Pune Mirror,https://punemirror.com/,43,"More Than 100 Indians, Pakistanis Urge Modi And Shehbaz To Revive Dialogue, Resume Talks On Kashmir",https://punemirror.com/india/india-pakistan-open-letter-modi-shehbaz-dialogue-kashmir/,2026-07-10T11:10:36+00:00
Pune,Pune Mirror,Pune • Pune Mirror,https://punemirror.com/,44,"TOURIST KILLED, 3 HURT IN HIMACHAL",https://punemirror.com/news/tourist-killed-3-hurt-in-himachal/,2026-07-10T11:10:36+00:00
Pune,Pune Mirror,Pune • Pune Mirror,https://punemirror.com/,45,Samsung price hike in India hits seven Galaxy phones,https://punemirror.com/business/samsung-price-hike-in-india-galaxy-phones/,2026-07-10T11:10:36+00:00
Pune,Pune Mirror,Pune • Pune Mirror,https://punemirror.com/,46,Meta $1.4 trillion lawsuit sparks alarming tech reckoning,https://punemirror.com/business/meta-1-4-trillion-lawsuit-teen-harm-safety/,2026-07-10T11:10:36+00:00
Pune,Pune Mirror,Pune • Pune Mirror,https://punemirror.com/,47,Airtel Rs 548 vs Jio Rs 448: Powerful savings or costly mistake?,https://punemirror.com/business/airtel-rs-548-vs-jio-rs-448-plans/,2026-07-10T11:10:36+00:00
Pune,Pune Mirror,Pune • Pune Mirror,https://punemirror.com/,48,Super El Niño India coal boom sparks alarming power shift,https://punemirror.com/business/super-el-nino-india-coal-boom-risk/,2026-07-10T11:10:36+00:00
Pune,Pune Mirror,Pune • Pune Mirror,https://punemirror.com/,49,Trump Says Netanyahu ‘Knows Who The Boss Is’ Ahead Of Possible White House Meeting,https://punemirror.com/world/trump-netanyahu-white-house-meeting-iran-talks-2026/,2026-07-10T11:10:36+00:00
Pune,Pune Mirror,Pune • Pune Mirror,https://punemirror.com/,50,World held hostage!,https://punemirror.com/world/strait-of-hormuz-us-iran-tensions-cargo-ship-attack-global-impact/,2026-07-10T11:10:36+00:00
Pune,Pune Mirror,Pune • Pune Mirror,https://punemirror.com/,51,Taylor Swift and Travis Kelce’s Wedding: Manhattan Braces for the Ceremony,https://punemirror.com/news/taylor-swift-travis-kelce-wedding-rumours-madison-square-garden-nyc/,2026-07-10T11:10:36+00:00
Pune,Pune Mirror,Pune • Pune Mirror,https://punemirror.com/,52,"India LPG imports Strait of Hormuz crisis shows fragile relief, powerful warning",https://punemirror.com/world/india-lpg-imports-strait-of-hormuz/,2026-07-10T11:10:36+00:00
Pune,Pune Mirror,Pune • Pune Mirror,https://punemirror.com/,53,CNG and EV car sales in India deliver powerful gains in June,https://punemirror.com/automobile/cng-and-ev-car-sales-in-india-june-record/,2026-07-10T11:10:36+00:00
Pune,Pune Mirror,Pune • Pune Mirror,https://punemirror.com/,54,Chinese e-rickshaw apps spark alarming crackdown after ‘prank’ shutdowns,https://punemirror.com/news/chinese-e-rickshaw-apps-prank-ban-safety-risk/,2026-07-10T11:10:36+00:00
Pune,Pune Mirror,Pune • Pune Mirror,https://punemirror.com/,55,Delhi EV policy delivers bold zero-emission push by 2030,https://punemirror.com/news/delhi-ev-policy-zero-emission-push/,2026-07-10T11:10:36+00:00
Pune,Pune Mirror,Pune • Pune Mirror,https://punemirror.com/,56,"Affordable EVs in India: Exciting Hyundai, Kia plan to challenge Tata Nexon EV",https://punemirror.com/automobile/affordable-evs-in-india-hyundai-kia-nexon/,2026-07-10T11:10:36+00:00
Pune,Pune Mirror,Pune • Pune Mirror,https://punemirror.com/,57,Samsung Health update delivers powerful new heart health boost,https://punemirror.com/technology/samsung-health-update-vitals-heart-score/,2026-07-10T11:10:36+00:00
Pune,Pune Mirror,Pune • Pune Mirror,https://punemirror.com/,58,Flat stomach obsession: Taapsee Pannu’s powerful wake-up call,https://punemirror.com/health/flat-stomach-obsession-taapsee-body-positivity/,2026-07-10T11:10:36+00:00
Pune,Pune Mirror,Pune • Pune Mirror,https://punemirror.com/,59,Why Migraine Is More Than Just a Headache,https://punemirror.com/health/migraine-morethan-headache/,2026-07-10T11:10:36+00:00
Pune,Pune Mirror,Pune • Pune Mirror,https://punemirror.com/,60,Two-week social media break delivers powerful mental health boost,https://punemirror.com/health/two-week-social-media-break-brain-benefits/,2026-07-10T11:10:36+00:00
Pune,Pune Mirror,Pune • Pune Mirror,https://punemirror.com/,61,Ronaldo’s World Cup Journey Ends in Dallas as Spain Edge Portugal 1-0,https://punemirror.com/sports/ronaldo-football-worldcup-retirement-portugal-spain/,2026-07-10T11:10:36+00:00
Pune,Pune Mirror,Pune • Pune Mirror,https://punemirror.com/,62,Neymar Calls Time on His Brazil Career After World Cup Heartbreak,https://punemirror.com/sports/football/neymar-retirement-fifa-2026-brazil-heart-break/,2026-07-10T11:10:36+00:00
Pune,Pune Mirror,Pune • Pune Mirror,https://punemirror.com/,63,Meta FIFA World Cup 2026 features deliver powerful fan boost,https://punemirror.com/sports/meta-fifa-world-cup-2026-features/,2026-07-10T11:10:36+00:00
Pune,Pune Mirror,Pune • Pune Mirror,https://punemirror.com/,64,FIFA World Cup Launch Edition Delivers Powerful New Netflix Gaming Boost,https://punemirror.com/sports/fifa-world-cup-launch-edition-game/,2026-07-10T11:10:36+00:00
Pune,Pune Mirror,Pune • Pune Mirror,https://punemirror.com/,65,The Device on Deepinder Goyal’s Temple That Stole the Spotlight — and Why the Internet Is Split,https://punemirror.com/trending/deepinder-goyal-temple-device-podcast-viral/,2026-07-10T11:10:36+00:00
Pune,Pune Mirror,Pune • Pune Mirror,https://punemirror.com/,66,The Hyper-Speed Era: Why Everything Is a ‘Trend’ and Nothing Lasts,https://punemirror.com/trending/why-everything-is-a-trend-and-nothing-lasts/,2026-07-10T11:10:36+00:00
Pune,Pune Mirror,Pune • Pune Mirror,https://punemirror.com/,67,Amazon Black Friday OnePlus Deals 2025: Massive Savings on Flagship Phones,https://punemirror.com/technology/amazon-black-friday-oneplus-deals-2025/,2026-07-10T11:10:36+00:00
Pune,Pune Mirror,Pune • Pune Mirror,https://punemirror.com/,68,Nobel Prize 2025: Discovery of Regulatory T-Cells and FOXP3 Gene Wins Medicine Award,https://punemirror.com/news/nobel-prize-2025-discovery-of-regulatory-t-cells-and-foxp3-gene-wins-medicine-award/,2026-07-10T11:10:36+00:00
Pune,Pune Mirror,Pune • Pune Mirror,https://punemirror.com/,69,Pahalgam terrorist gunned down; Three killed in J-K encounter,https://punemirror.com/trending/pahalgam-terrorist-gunned-down-three-killed-in-j-k-encounter/,2026-07-10T11:10:36+00:00
Pune,Pune Mirror,Pune • Pune Mirror,https://punemirror.com/,70,Startup India Fund of Funds 2.0: Powerful Boost for Startups,https://punemirror.com/india/startup-india-fund-of-funds-2-0-boost/,2026-07-10T11:10:36+00:00
Pune,Pune Mirror,Pune • Pune Mirror,https://punemirror.com/,71,Sarvam AI Bulbul V3 delivers stunning win over global AI rivals,https://punemirror.com/technology/ai/sarvam-ai-bulbul-v3-outshines-rivals/,2026-07-10T11:10:36+00:00
Pune,Pune Mirror,Pune • Pune Mirror,https://punemirror.com/,72,The Startup Evolution: From Survival Mode to Sustainable Success,https://punemirror.com/business/startups/from-survival-mode-to-sustainable-success/,2026-07-10T11:10:36+00:00
Pune,Pune Mirror,Pune • Pune Mirror,https://punemirror.com/,73,6 fast and nutritious oat breakfast recipes to get you going,https://punemirror.com/lifestyle/healthy-oat-breakfast-recipes/,2026-07-10T11:10:36+00:00
Pune,Pune Mirror,Pune • Pune Mirror,https://punemirror.com/,74,Why Youngsters Prefer Late-Night Rides Despite Safety Risks,https://punemirror.com/lifestyle/latenight-ride-youngsters-freedom/,2026-07-10T11:10:36+00:00
Pune,Pune Mirror,Pune • Pune Mirror,https://punemirror.com/,75,"Air India To Cut Domestic Flights By 22%, International By 27% As High Fuel Prices Squeeze Operations",https://punemirror.com/lifestyle/travel/air-india-domestic-flights-cut-22-percent-fuel-prices-june-august-2026/,2026-07-10T11:10:36+00:00
Pune,Pune Mirror,Pune • Pune Mirror,https://punemirror.com/,76,"Denim Comeback: How Old-School Jeans Styles Are Returning, Low-Waist Vs High-Waist Jeans: What’s Trending In 2026",https://punemirror.com/lifestyle/denimcomeback-fashiontrend-jeans/,2026-07-10T11:10:36+00:00
Pune,Pune Mirror,Pune • Pune Mirror,https://punemirror.com/,77,Why is this generation delaying and questioning marriage,https://punemirror.com/news/why-is-this-generation-delaying-and-questioning-marriage/,2026-07-10T11:10:36+00:00
Pune,Pune Mirror,Pune • Pune Mirror,https://punemirror.com/,78,India GST collections June 2026: Powerful surge lifts revenues,https://punemirror.com/business/india-gst-collections-june-2026-surge/,2026-07-10T11:10:36+00:00
Pune,Pune Mirror,Pune • Pune Mirror,https://punemirror.com/,79,EPFO 3.0 PF withdrawal delivers powerful relief for workers,https://punemirror.com/business/epfo-3-0-pf-withdrawal-upi-atm-benefits/,2026-07-10T11:10:36+00:00
Pune,Pune Mirror,Pune • Pune Mirror,https://punemirror.com/,80,EPFO services unavailable: urgent warning as major system upgrade pauses key PF facilities,https://punemirror.com/business/finance/epfo-services-unavailable-june-26-29-upgrade/,2026-07-10T11:10:36+00:00
Pune,Pune Mirror,Pune • Pune Mirror,https://punemirror.com/,81,PhonePe inactive wallet fee draws backlash over Rs 100 charge,https://punemirror.com/business/phonepe-inactive-wallet-fee-rs100-quarterly/,2026-07-10T11:10:36+00:00
Pune,Pune Mirror,Pune • Pune Mirror,https://punemirror.com/,82,RBI WhatsApp phishing scam sparks dangerous new fraud warning,https://punemirror.com/business/rbi-whatsapp-phishing-scam-warning/,2026-07-10T11:10:36+00:00
Pune,Pune Mirror,Pune • Pune Mirror,https://punemirror.com/,83,"₹5 Crore Fraud Rocks DPU B-School: Ex-Director Booked for Embezzlement, Data Wipe and Digital Evidence Destruction",https://punemirror.com/city/crime/%e2%82%b95-crore-fraud-rocks-dpu-b-school-ex-director-booked-for-embezzlement-data-wipe-and-digital-evidence-destruction/,2026-07-10T11:10:36+00:00
Pune,Pune Mirror,Pune • Pune Mirror,https://punemirror.com/,84,Death Sentence in Nasrapur Child Murder Case,https://punemirror.com/city/pune/nasrapur-horror-convict-gets-death-penalty/,2026-07-10T11:10:36+00:00
Pune,Pune Mirror,Pune • Pune Mirror,https://punemirror.com/,85,Lohagad Murder Probe: Police Send Accused’s Phones for Forensic Analysis After Alleged Deletion of Chats,https://punemirror.com/city/pune/lohagad-murder-deleted-chats-forensic-probe-siya-goyal-chetan-chaudhary/,2026-07-10T11:10:36+00:00
Pune,Pune Mirror,Pune • Pune Mirror,https://punemirror.com/,86,Lohagad Murder Probe: Accused Shift Blame on Each Other as Police Uncover Fresh Interrogation Details,https://punemirror.com/city/pune/lohagad-murder-case-siya-goyal-chetan-chaudhary-conflicting-statements-police-probe/,2026-07-10T11:10:36+00:00
Pune,Pune Mirror,Pune • Pune Mirror,https://punemirror.com/,87,"Lohagad Murder Case: Siya Goyal’s Parents Break Silence, Seek Strictest Punishment if Daughter Is Found Guilty",https://punemirror.com/city/pune/lohagad-murder-case-siya-goyal-parents-break-silence-demand-strict-punishment/,2026-07-10T11:10:36+00:00
Pune,Pune Mirror,Pune • Pune Mirror,https://punemirror.com/,88,"Inside the Emergency Response That Helped Protect 2,000 Residents",https://punemirror.com/city/pune/pimpri-chinchwad/pune-township-battles-flash-flood-as-pawana-river-overflows-140-staff-work-round-the-clock-to-restore-normalcy/,2026-07-10T11:10:36+00:00
Pune,Pune Mirror,Pune • Pune Mirror,https://punemirror.com/,89,"Farmers Stage Noose Protest Atop Tree Outside Mantralaya in Mumbai, Demand Complete Loan Waiver",https://punemirror.com/city/mumbai/mumbai-farmers-protest-outside-mantralaya-demand-waiver-off/,2026-07-10T11:10:36+00:00
Pune,Pune Mirror,Pune • Pune Mirror,https://punemirror.com/,90,One Dead in Moshi Building Collapse; Victim Identified as 33-Year-Old Accounts Executive,https://punemirror.com/city/pune/moshi-building-collapse-bhavesh-mohan-wani-death-rescue-operation/,2026-07-10T11:10:36+00:00
Pune,Pune Mirror,Pune • Pune Mirror,https://punemirror.com/,91,"Bridge Collapses on Nanded-Tuljapur Highway, Two Injured as Traffic Grinds to a Halt",https://punemirror.com/news/nanded-tuljhapur-bridge-collapsed-two-injured-traffic-grinds-to-halt/,2026-07-10T11:10:36+00:00
Pune,Pune Mirror,Pune • Pune Mirror,https://punemirror.com/,92,"PMC to Hire 4,814 Contract Workers in Three-Month Drive to Improve City Cleanliness",https://punemirror.com/city/pune/pmc-hires-4814-contract-workers-three-month-cleanliness-drive/,2026-07-10T11:10:36+00:00
Pune,Pune Mirror,Pune • Pune Mirror,https://punemirror.com/,93,"Pune’s Passport Office Moves to Baner, But Leaves Citizens Standing Out for Hours",https://punemirror.com/city/pune/pune-passport-office-baner-citizens-standing-out-hours/,2026-07-10T11:10:36+00:00
Pune,Pune Mirror,Pune • Pune Mirror,https://punemirror.com/,94,"Mumbai’s New Flood Fix: ₹13,000 Crore Plan Promises Water drained In 30 Minutes",https://punemirror.com/news/mumbais-new-flood-fix-%e2%82%b913000-crore-plan-promises-water-drained-in-30-minutes/,2026-07-10T11:10:36+00:00
Pune,Pune Mirror,Pune • Pune Mirror,https://punemirror.com/,95,Maharashtra Govt Sets Up Two-Tier Panel to Fast-Track Pune’s Mega Traffic Projects,https://punemirror.com/city/pune/maharashtra-govt-two-tier-committee-pune-traffic-projects/,2026-07-10T11:10:36+00:00
Pune,Pune Mirror,Pune • Pune Mirror,https://punemirror.com/,96,Thousands of LPG Cylinders Swept Away as Floods Hit Raigad’s HPCL Plant,https://punemirror.com/city/pune/lpg-cylinder-swept-flood-hit-raigad-hpcl-plant-3000/,2026-07-10T11:10:36+00:00
Pune,Pune Mirror,Pune • Pune Mirror,https://punemirror.com/,97,"Khadakwasla Dam Chain Receives 1.43 TMC Inflow; Water Storage Crosses 51%, River Discharge Stopped",https://punemirror.com/city/pune/khadakwasla-dam-chain-1-43-tmc-inflow-water-storage-crosses-51-percent/,2026-07-10T11:10:36+00:00
Pune,Pune Mirror,Pune • Pune Mirror,https://punemirror.com/,98,Aswath S Becomes India’s 98th Grandmaster After Triumph at Pune Tournament,https://punemirror.com/city/pune/aswath-s-india-98th-grandmaster-pune-international-chess-tournament/,2026-07-10T11:10:36+00:00
Pune,Pune Mirror,Pune • Pune Mirror,https://punemirror.com/,99,Several Feared Trapped After Administrative Building Collapses at PCMC Waste-to-Energy Plant in Moshi,https://punemirror.com/city/pune/moshi-pcmc-waste-to-energy-plant-building-collapse-rescue/,2026-07-10T11:10:36+00:00
Pune,Pune Mirror,Pune • Pune Mirror,https://punemirror.com/,100,Building the Nation One City at a Time: Inside Pune Times Mirror’s Future City Forum 2026 and Its Place in the Viksit Bharat Initiative,https://punemirror.com/city/pune/pune-times-mirror-future-city-forum-viksit-bharat-initiative-nation/,2026-07-10T11:10:36+00:00
Pune,Pune Mirror,Pune • Pune Mirror,https://punemirror.com/,101,Pune Prepares to Welcome Sant Dnyaneshwar and Sant Tukaram Palkhis; Accommodation and Facilities Ready for Warkaris,https://punemirror.com/city/pune/pune-ready-for-sant-dnyaneshwar-sant-tukaram-palkhi-arrival/,2026-07-10T11:10:36+00:00
Pune,Pune Mirror,Pune • Pune Mirror,https://punemirror.com/,102,"Toll Collected from Warkari Vehicles Despite Government’s Waiver Announcement, Devotees Raise Concerns",https://punemirror.com/city/pune/warkari-toll-collected-despite-maharashtra-ashadhi-wari-toll-waiver/,2026-07-10T11:10:36+00:00
Pune,Pune Mirror,Pune • Pune Mirror,https://punemirror.com/,103,Pati Patni Aur Woh Do OTT release sparks joyful Netflix buzz,https://punemirror.com/entertainment/pati-patni-aur-woh-do-ott-release-netflix-3/,2026-07-10T11:10:36+00:00
Pune,Pune Mirror,Pune • Pune Mirror,https://punemirror.com/,104,The Devil Wears Prada 2 OTT Delight: Powerful Streaming Debut On JioHotstar,https://punemirror.com/entertainment/the-devil-wears-prada-2-ott-jiohotstar/,2026-07-10T11:10:36+00:00
Pune,Pune Mirror,Pune • Pune Mirror,https://punemirror.com/,105,"YouTube unauthorized court hearing videos face serious, shocking limits",https://punemirror.com/entertainment/youtube/youtube-unauthorized-court-hearing-videos/,2026-07-10T11:10:36+00:00
Pune,Pune Mirror,Pune • Pune Mirror,https://punemirror.com/,106,Xbox layoffs shock: Massive shake-up rocks Microsoft’s gaming empire,https://punemirror.com/entertainment/video-game/xbox-layoffs-microsoft-restructuring-2026/,2026-07-10T11:10:36+00:00
Pune,Pune Mirror,Pune • Pune Mirror,https://punemirror.com/,107,"Akanksha Chamola Tears Up in Lock Upp 2, Comes Out of the Closet",https://punemirror.com/entertainment/akanksha-chamola-opens-up-about-sexuality-lock-upp-season-2/,2026-07-10T11:10:36+00:00
Pune,Pune Mirror,Pune • Pune Mirror,https://punemirror.com/,108,Kangana Ranaut grills Yogesh Rawat over cheating charges on Lock Upp 2,https://punemirror.com/entertainment/kangana-ranaut-yogesh-rawat-lock-upp-2-cheating-allegations/,2026-07-10T11:10:36+00:00
Pune,Pune Mirror,Pune • Pune Mirror,https://punemirror.com/,109,Shilpa Shinde to ENTER Lock Upp Season 2 as First Wildcard!,https://punemirror.com/entertainment/shilpa-shinde-lock-upp-season-2-first-wildcard-entry/,2026-07-10T11:10:36+00:00
Pune,Pune Mirror,Pune • Pune Mirror,https://punemirror.com/,110,Aamir Khan Weds Gauri Spratt In Intimate Ceremony At His Mumbai Home Post Two-Year Romance,https://punemirror.com/entertainment/aamir-khan-gauri-spratt-married-intimate-mumbai-wedding/,2026-07-10T11:10:36+00:00
Pune,IE,Pune • IE,https://indianexpress.com/article/cities/pune/,1,26/11 Stories of Strength,https://indianexpress.com/26-11/,2026-07-10T11:10:36+00:00
Pune,IE,Pune • IE,https://indianexpress.com/article/cities/pune/,2,Statutory provisions on reporting (sexual offenses),https://indianexpress.com/article/what-is/what-is-the-protection-of-children-from-sexual-offences-act-2012/,2026-07-10T11:10:36+00:00
Pune,Sakal,Pune • Sakal,https://www.esakal.com/pune,1,सकाळ लाईव्ह TV,https://www.esakal.com/live-tv,2026-07-10T11:10:36+00:00
Pune,Sakal,Pune • Sakal,https://www.esakal.com/pune,2,Refund and Cancellation,https://www.esakal.com/refund-and-cancellation,2026-07-10T11:10:36+00:00
Pune,Lokmat,Pune • Lokmat,https://www.lokmat.com/city/,1,Live News in Marathi,https://www.lokmat.com/live-news/,2026-07-10T11:10:36+00:00
Pune,Lokmat,Pune • Lokmat,https://www.lokmat.com/city/,2,गोठ्यात दूध काढण्याचे मशीन सुरू करताना विजेचा धक्का; आंबेगाव तालुक्यातील युवकाचा मृत्यू,https://www.lokmat.com/pune/a-youth-from-ambegaon-taluka-died-after-getting-electrocuted-while-starting-a-milking-machine-in-a-cowshed-a-a727/,2026-07-10T11:10:36+00:00
