city,publisher,source,source_url,rank,headline,link,collected_at_iso
Bengaluru,DC,Bengaluru • DC,https://www.deccanchronicle.com/location/india/karnataka/bengaluru,1,FIFA World Cup 2026,https://www.deccanchronicle.com/fifa-world-cup-2026,2026-07-10T21:11:03+00:00
Bengaluru,DC,Bengaluru • DC,https://www.deccanchronicle.com/location/india/karnataka/bengaluru,2,Opinion and Editorials,https://www.deccanchronicle.com/opinion,2026-07-10T21:11:03+00:00
Bengaluru,DC,Bengaluru • DC,https://www.deccanchronicle.com/location/india/karnataka/bengaluru,3,Assembly Elections 2026,https://www.deccanchronicle.com/assembly-elections-2026,2026-07-10T21:11:03+00:00
Bengaluru,DC,Bengaluru • DC,https://www.deccanchronicle.com/location/india/karnataka/bengaluru,4,Telangana Rising 2047,https://www.deccanchronicle.com/tags/Telangana-Rising-2047,2026-07-10T21:11:03+00:00
Mumbai,Mumbai Mirror,Mumbai • Mumbai Mirror,https://mumbaimirror.indiatimes.com/mumbai,1,Counting the silent victories,https://mumbaimirror.indiatimes.com/mumbai/counting-the-silent-victories/articleshow/132294992.html,2026-07-10T21:11:03+00:00
Mumbai,Mumbai Mirror,Mumbai • Mumbai Mirror,https://mumbaimirror.indiatimes.com/mumbai,2,A monsoon miracle: Doctors deliver baby by phone lights,https://mumbaimirror.indiatimes.com/mumbai/a-monsoon-miracle-doctors-deliver-baby-by-phone-lights/articleshow/132295715.html,2026-07-10T21:11:03+00:00
Mumbai,Mumbai Mirror,Mumbai • Mumbai Mirror,https://mumbaimirror.indiatimes.com/mumbai,3,Men play the long game,https://mumbaimirror.indiatimes.com/you/men-play-the-long-game/articleshow/132289620.html,2026-07-10T21:11:03+00:00
Mumbai,Mumbai Mirror,Mumbai • Mumbai Mirror,https://mumbaimirror.indiatimes.com/mumbai,4,Italy comes to Mumbai,https://mumbaimirror.indiatimes.com/unwind/italy-comes-to-mumbai/articleshow/132291287.html,2026-07-10T21:11:03+00:00
Mumbai,Mumbai Mirror,Mumbai • Mumbai Mirror,https://mumbaimirror.indiatimes.com/mumbai,5,HC orders return of Jhanvi Kukreja’s belongings,https://mumbaimirror.indiatimes.com/mumbai/hc-orders-return-of-jhanvi-kukrejas-belongings/articleshow/132295097.html,2026-07-10T21:11:03+00:00
Mumbai,Mumbai Mirror,Mumbai • Mumbai Mirror,https://mumbaimirror.indiatimes.com/mumbai,6,"Saved from death, but now forgotten",https://mumbaimirror.indiatimes.com/mumbai/saved-from-death-but-now-forgotten/articleshow/132296067.html,2026-07-10T21:11:03+00:00
Mumbai,Mumbai Mirror,Mumbai • Mumbai Mirror,https://mumbaimirror.indiatimes.com/mumbai,7,Breaking News: Nothing is breaking anymore,https://mumbaimirror.indiatimes.com/opinion/breaking-news-nothing-is-breaking-anymore/articleshow/132292596.html,2026-07-10T21:11:03+00:00
Mumbai,Mumbai Mirror,Mumbai • Mumbai Mirror,https://mumbaimirror.indiatimes.com/mumbai,8,Ask The Sexpert,https://mumbaimirror.indiatimes.com/ask-the-sexpert,2026-07-10T21:11:03+00:00
Mumbai,Sakal,Mumbai • Sakal,https://www.esakal.com/pune,1,सकाळ लाईव्ह TV,https://www.esakal.com/live-tv,2026-07-10T21:11:03+00:00
Mumbai,Sakal,Mumbai • Sakal,https://www.esakal.com/pune,2,Refund and Cancellation,https://www.esakal.com/refund-and-cancellation,2026-07-10T21:11:03+00:00
Mumbai,Lokmat,Mumbai • Lokmat,https://www.lokmat.com/city/,1,Live News in Marathi,https://www.lokmat.com/live-news/,2026-07-10T21:11:03+00:00
Mumbai,Lokmat,Mumbai • Lokmat,https://www.lokmat.com/city/,2,"LIVE: आधी विनोद तावडेंसोबत बैठक, आता एकनाथ खडसेंनी घेतली उद्धव ठाकरेंची भेट",https://www.lokmat.com/maharashtra/maharashtra-marathi-news-live-updates-10-july-2026-rain-updates-vidhan-sabha-adhiveshan-cm-devendra-fadnavis-eknath-shinde-cabinet-expansion-us-iran-war-donald-trump-pm-narendra-modi-fifa-world-cup-sharad-pawar-aashadhi-wari-india-vs-england-a-a573/,2026-07-10T21:11:03+00:00
Mumbai,Lokmat,Mumbai • Lokmat,https://www.lokmat.com/city/,3,"डेक्कन क्वीनसह अनेक रेल्वे १७ जुलैपर्यंत रद्द, लोणावळा-कर्जत मार्गावरील भूस्खलनाचा परिणाम",https://www.lokmat.com/pune/deccan-queen-cancelled-many-trains-including-deccan-queen-cancelled-till-july-17-due-to-landslide-on-lonavala-karjat-route-a-a727/,2026-07-10T21:11:03+00:00
Mumbai,Lokmat,Mumbai • Lokmat,https://www.lokmat.com/city/,4,"48 तास...! तरी ८ जीव ढिगाऱ्याखाली; आई.. आई..'च्या आर्त हाका, नातेवाईकांचा तीव्र संताप",https://www.lokmat.com/pune/moshi-building-collapse-48-hours-still-8-lives-under-the-rubble-mother-mothers-cries-intense-anger-of-relatives-a-a727/,2026-07-10T21:11:03+00:00
Mumbai,Lokmat,Mumbai • Lokmat,https://www.lokmat.com/city/,5,"माझा मुलगा द्या, नाहीतर मलाही ढिगाऱ्याखाली गाडा! कुणाची आई, तर कुणाचे वडिलांची याचना, प्रशासनासमोर आ",https://www.lokmat.com/pune/moshi-building-collapse-give-me-my-son-or-else-bury-me-under-the-rubble-too-someones-mother-someones-fathers-plea-crying-out-in-front-of-the-administration-a-a727/,2026-07-10T21:11:03+00:00
Mumbai,Lokmat,Mumbai • Lokmat,https://www.lokmat.com/city/,6,"Moshi Building Collapse: २ दिवस कचरा कोसळत होता, धोका दिसत होता, तरीही प्रशासनाचे दुर्लक्ष; जखमी कामगाराने दिली धक्कादायक माहिती",https://www.lokmat.com/pune/moshi-building-collapse-garbage-was-falling-for-2-days-danger-was-visible-yet-administration-ignored-it-injured-worker-gives-shocking-information-a-a727/,2026-07-10T21:11:03+00:00
Mumbai,Lokmat,Mumbai • Lokmat,https://www.lokmat.com/city/,7,...तर त्वरित तक्रार नोंदवा; मॅनहोल प्रकरणी मुंबई मनपाकडून स्वतंत्र व्हॉट्सअ‍ॅप चॅटबॉट सुरू,https://www.lokmat.com/mumbai/mumbai-municipal-corporation-bmc-launches-separate-whatsapp-chatbot-for-file-complaint-immediately-on-any-query-related-manhole-a-a719/,2026-07-10T21:11:03+00:00
Mumbai,Lokmat,Mumbai • Lokmat,https://www.lokmat.com/city/,8,अजितदादांच्या विमान अपघात प्रकरणी CM फडणवीसांनी दिली मोठी माहिती; विधानसभेत सगळेच सांगितले,https://www.lokmat.com/mumbai/cm-devendra-fadnavis-gave-big-information-about-late-ajit-pawar-plane-crash-case-told-everything-in-the-monsoon-assembly-session-2026-a-a719/,2026-07-10T21:11:03+00:00
Mumbai,Lokmat,Mumbai • Lokmat,https://www.lokmat.com/city/,9,प्रशांत दामले यांची ‘बृहन्मुंबई क्रीडा आणि ललितकला प्रतिष्ठान’ च्या व्यवस्थापकीय विश्वस्तपदी नियुक्ती,https://www.lokmat.com/mumbai/legendary-marathi-actor-prashant-damle-appointed-as-managing-trustee-of-brihanmumbai-sports-and-fine-arts-foundation-a-a719/,2026-07-10T21:11:03+00:00
Mumbai,Lokmat,Mumbai • Lokmat,https://www.lokmat.com/city/,10,“MIDC प्रकल्प राबवताना शेतकरी हिताला सर्वोच्च प्राधान्य द्या”; सुनेत्रा पवार यांचे निर्देश,https://www.lokmat.com/maharashtra/deputy-cm-sunetra-ajit-pawar-said-prioritize-the-highest-interests-of-farmers-while-implementing-bhor-utroli-vadgaon-midc-projects-a-a719/,2026-07-10T21:11:03+00:00
Mumbai,Lokmat,Mumbai • Lokmat,https://www.lokmat.com/city/,11,सावत्र आईकडून खोट्या बलात्काराच्या गुन्ह्यात अडकविण्याची धमकी; मुलावर लैंगिक संबंधांसाठी दबाव,https://www.lokmat.com/nagpur/stepmother-threatens-to-frame-him-in-false-rape-case-pressures-son-for-sexual-relations-a-a1013/,2026-07-10T21:11:03+00:00
Mumbai,Lokmat,Mumbai • Lokmat,https://www.lokmat.com/city/,12,एसीबीची भ्रष्टाचाऱ्यांवर कारवाई प्रभावी अन् निष्पक्षच : एसपी एसीबी,https://www.lokmat.com/nagpur/acbs-action-against-corrupt-people-is-effective-and-fair-sp-acb-a-a877-c1013/,2026-07-10T21:11:03+00:00
Mumbai,Lokmat,Mumbai • Lokmat,https://www.lokmat.com/city/,13,"मध्य नागपूर हिंसाचारातील आरोपी फहीम खानचे घर कोणत्या अधिकाऱ्यांनी पाडले, सांगा!",https://www.lokmat.com/nagpur/tell-us-which-officials-demolished-the-house-of-faheem-khan-an-accused-in-the-central-nagpur-violence-a-a1013/,2026-07-10T21:11:03+00:00
Mumbai,Lokmat,Mumbai • Lokmat,https://www.lokmat.com/city/,14,"Organ Donor: वारकरी भजनात दंग राहणाऱ्या हातांनी मृत्यूनंतरही साधला परमार्थ, तिघांना जीवदान तर दोघांना मिळणार दृष्टी",https://www.lokmat.com/nagpur/nagpur-organ-donor-hands-that-are-stunned-in-the-warkari-bhajan-achieve-altruism-even-after-death-three-will-be-given-life-and-two-will-gain-sight-a-a515-c571/,2026-07-10T21:11:03+00:00
Mumbai,Lokmat,Mumbai • Lokmat,https://www.lokmat.com/city/,15,शिक्षकाने अभ्यासाकरिता रागावणे म्हणजे विद्यार्थ्याला आत्महत्येस प्रवृत्त करणे नव्हे; नागपूर उच्च न्यायालयाचा महत्त्वाचा निर्णय,https://www.lokmat.com/nagpur/a-teacher-getting-angry-for-the-sake-of-studying-does-not-mean-inciting-a-student-to-commit-suicide-important-decision-of-nagpur-high-court-a-a571/,2026-07-10T21:11:03+00:00
Mumbai,Lokmat,Mumbai • Lokmat,https://www.lokmat.com/city/,16,"नाशिकमध्ये गुप्त बैठका, ठाकरेंचे १०-१२ नगरसेवक शिंदेसेनेच्या गळाला; प्रभागनिहाय ५ कोटी मिळणार?",https://www.lokmat.com/nashik/secret-meetings-in-nashik-10-12-uddhav-thackeray-corporators-may-join-eknath-shinde-shiv-sena-will-they-get-5-crores-ward-wise-a-a629/,2026-07-10T21:11:03+00:00
Mumbai,Lokmat,Mumbai • Lokmat,https://www.lokmat.com/city/,17,नाशिक हादरले! ९ वीच्या विद्यार्थिनीने दिला बाळाला जन्म; संबंध ठेवणाऱ्याबद्दल धक्कादायक खुलासा,https://www.lokmat.com/nashik/shocking-incident-in-nashik-9th-grade-student-gives-birth-at-government-ashram-school-a-a1001/,2026-07-10T21:11:03+00:00
Mumbai,Lokmat,Mumbai • Lokmat,https://www.lokmat.com/city/,18,"अभ्यासाचा कंटाळा आला, पुण्यातील युवक घर सोडून कोल्हापुरात; पोलिसांच्या सतर्कतेने नातेवाइकांची भेट",https://www.lokmat.com/kolhapur/a-young-man-from-nashik-who-had-left-home-to-stay-with-his-aunt-in-pune-for-his-studies-after-growing-weary-of-his-academic-work-arrived-in-kolhapur-a-a746/,2026-07-10T21:11:03+00:00
Mumbai,Lokmat,Mumbai • Lokmat,https://www.lokmat.com/city/,19,"नांदूर मधमेश्वर बंधाऱ्यातून 15 हजार 248 क्युसेक्स विसर्ग, गोदावरीकाठच्या नागरिकांना सतर्कतेचा इशारा",https://www.lokmat.com/nashik/15248-cusecs-discharged-from-nandur-madhameshwar-dam-alert-issued-to-citizens-along-godavari-a-a653/,2026-07-10T21:11:03+00:00
Mumbai,Lokmat,Mumbai • Lokmat,https://www.lokmat.com/city/,20,"व्यवसायात यश मिळवून देण्याचे आश्वासन, जादूटोण्याच्या नावाने महिलेवर अत्याचार; भोंदूविरुद्ध गुन्हा दाखल",https://www.lokmat.com/nashik/promised-success-in-business-tortured-woman-in-the-name-of-witchcraft-case-registered-against-fraudster-in-nashik-a-a597/,2026-07-10T21:11:03+00:00
Mumbai,Lokmat,Mumbai • Lokmat,https://www.lokmat.com/city/,21,"Sangli News: चांदोली धरण परिसरात 'तारा' वाघिणीचा वावर, तातडीने गस्त पथकाची मागणी",https://www.lokmat.com/sangli/tara-tigresss-movement-in-chandoli-dam-area-anger-over-alleged-negligence-of-forest-department-a-a746/,2026-07-10T21:11:03+00:00
Mumbai,Lokmat,Mumbai • Lokmat,https://www.lokmat.com/city/,22,"Smart Meter: ग्राहकांना धास्ती, ‘स्मार्ट मीटर’मुळे जादा भार; महावितरणचा दावा, वीज बिल अचूक येणार",https://www.lokmat.com/kolhapur/kolhapur-consumers-oppose-smart-meters-being-installed-by-mahavitaran-a-a818-c746/,2026-07-10T21:11:03+00:00
Mumbai,Lokmat,Mumbai • Lokmat,https://www.lokmat.com/city/,23,"Kolhapur Crime: वाद सुरू असल्याचा कॉल, पोलिस गेले अन् फसवणुकीचा झाला उलगडा; एकास अटक",https://www.lokmat.com/kolhapur/while-inquiring-into-the-dispute-a-case-of-fraud-came-to-light-in-kolhapur-district-where-many-people-were-swindled-under-the-pretext-of-securing-government-grants-a-a746/,2026-07-10T21:11:03+00:00
Mumbai,Lokmat,Mumbai • Lokmat,https://www.lokmat.com/city/,24,Kolhapur Crime: मस्करीतून अंगावर मोपेड घालण्याचा प्रयत्न; रागाच्या भरात मित्राच्या डोक्यात घातला दगड,https://www.lokmat.com/kolhapur/attempted-to-drive-a-moped-at-a-friend-as-a-prank-struck-the-friend-on-the-head-with-a-stone-in-a-fit-of-rage-in-kolhapur-a-a746/,2026-07-10T21:11:03+00:00
Mumbai,Lokmat,Mumbai • Lokmat,https://www.lokmat.com/city/,25,"२५ कोटींचे गैरव्यवहार प्रकरण, कोल्हापूर जिल्हा परिषदेच्या २३ कर्मचाऱ्यांची विभागीय चौकशी",https://www.lokmat.com/kolhapur/25-crores-fraud-case-departmental-inquiry-of-23-employees-of-kolhapur-zilla-parishad-a-a746/,2026-07-10T21:11:03+00:00
Mumbai,Lokmat,Mumbai • Lokmat,https://www.lokmat.com/city/,26,"Sangli: मिरजेत भीषण आगीत इंधन टँकर, दुचाकींसह शेड जळून खाक, इंधन तस्करीच्या चर्चांना पुन्हा उधाण",https://www.lokmat.com/sangli/fuel-tanker-shed-along-with-two-wheelers-burnt-down-in-a-massive-fire-in-miraj-fuel-smuggling-talks-reignited-a-a746/,2026-07-10T21:11:03+00:00
Mumbai,Lokmat,Mumbai • Lokmat,https://www.lokmat.com/city/,27,"सांगलीत पाच घरात पुराचे पाणी शिरले, महापौरांकडून पाहणी; नदीकाठच्या नागरिकांना स्थलांतराचे आवाहन",https://www.lokmat.com/sangli/flood-water-entered-five-houses-in-sangli-inspection-by-the-mayor-a-a746/,2026-07-10T21:11:03+00:00
Mumbai,Lokmat,Mumbai • Lokmat,https://www.lokmat.com/city/,28,"सांगली महापालिकेत राष्ट्रवादीला धक्का, अश्विनी कोळींचे नगरसेवकपद रद्द",https://www.lokmat.com/sangli/the-councillorship-of-ashwini-koli-a-corporator-from-the-ncp-ajit-pawar-faction-in-the-sangli-municipal-corporation-has-been-cancelled-after-her-caste-certificate-was-declared-invalid-a-a746/,2026-07-10T21:11:03+00:00
Mumbai,Lokmat,Mumbai • Lokmat,https://www.lokmat.com/city/,29,"दोन कोटी रुपयांचा गांजा जाळून नष्ट, सांगली पोलिसांची कारवाई",https://www.lokmat.com/sangli/ganja-worth-rs-2-crore-destroyed-by-burning-sangli-police-take-action-a-a746/,2026-07-10T21:11:03+00:00
Mumbai,Lokmat,Mumbai • Lokmat,https://www.lokmat.com/city/,30,"दापोली-महाबळेश्वर राष्ट्रीय महामार्ग करा, प्रवीण दरेकर यांचे केंद्रीय मंत्री नितीन गडकरी यांना साकडे",https://www.lokmat.com/ratnagiri/make-dapoli-mahabaleshwar-national-highway-praveen-darekar-urges-union-minister-nitin-gadkari-a-a746/,2026-07-10T21:11:03+00:00
Mumbai,Lokmat,Mumbai • Lokmat,https://www.lokmat.com/city/,31,"Rain in Satara: कोयना धरणात ९ दिवसांत ३६ टीएमसीची भर, अर्धशतकी पाणीसाठ्याचा टप्पा पार",https://www.lokmat.com/satara/36-tmc-of-water-in-koyna-dam-in-9-days-heavy-rain-disrupts-normal-life-in-patan-taluka-a-a746/,2026-07-10T21:11:03+00:00
Mumbai,Lokmat,Mumbai • Lokmat,https://www.lokmat.com/city/,32,"रत्नागिरी-सातारा जिल्ह्याला जोडणाऱ्या रघुवीर घाटात भूस्खलन; रस्त्याची एक बाजू दरीत खचली, वाहतूक बंद",https://www.lokmat.com/ratnagiri/landslide-in-raghuveer-ghat-connecting-ratnagiri-satara-district-one-side-of-the-road-collapsed-into-a-valley-traffic-closed-a-a746/,2026-07-10T21:11:03+00:00
Mumbai,Lokmat,Mumbai • Lokmat,https://www.lokmat.com/city/,33,काँग्रेस नगरसेविका पतीवर भरदिवसा चाकू हल्ला; उपचारादरम्यान मृत्यू,https://www.lokmat.com/akola/congress-corporators-husband-attacked-with-knife-in-broad-daylight-dies-during-treatment-a-a607/,2026-07-10T21:11:03+00:00
Mumbai,Lokmat,Mumbai • Lokmat,https://www.lokmat.com/city/,34,विनापरवाना बियाणे साठ्यावर कृषी विभागाचा छापा; २०.६० लाखांचा मुद्देमाल जप्त,https://www.lokmat.com/akola/agriculture-department-raids-unlicensed-seed-stock-goods-worth-rs-20-lakh-60-thousands-seized-a-a653/,2026-07-10T21:11:03+00:00
Mumbai,Lokmat,Mumbai • Lokmat,https://www.lokmat.com/city/,35,अकोल्यात रिलायन्स प्लांट परिसरात आगीचे तांडव; धुराच्या लोटांनी आसमंत काळवंडले,https://www.lokmat.com/akola/fire-breaks-out-in-reliance-plant-area-smoke-billows-into-the-sky-incident-on-akola-nanded-road-a-a747/,2026-07-10T21:11:03+00:00
Mumbai,Lokmat,Mumbai • Lokmat,https://www.lokmat.com/city/,36,"शिंदेसेनेच्या अकोला जिल्हाप्रमुख, महानगरप्रमुखांच्या नियुक्त्या जाहीर",https://www.lokmat.com/akola/appointments-of-shinde-senas-akola-district-chief-and-metropolitan-chief-announced-a-a941/,2026-07-10T21:11:03+00:00
Mumbai,Lokmat,Mumbai • Lokmat,https://www.lokmat.com/city/,37,"Akola: अधिक मासातील धार्मिक स्नान ठरले अखेरचे; मुलगाा बुडायला लागला, आईने उडी मारली; दोघांचाही नदीत बुडून मृत्यू",https://www.lokmat.com/akola/akola-religious-bath-in-the-rainy-season-turned-out-to-be-the-last-mother-and-daughter-drowned-in-the-river-while-saving-their-child-a-a571/,2026-07-10T21:11:03+00:00
Mumbai,Lokmat,Mumbai • Lokmat,https://www.lokmat.com/city/,38,"शक्तिपीठ महामार्ग रद्द करण्यासाठी शेतकरी विठ्ठलाला साकडे घालणार, १८ जुलैला भव्य पायी सदबुध्दी यात्रा",https://www.lokmat.com/maharashtra/against-the-backdrop-of-ashadhi-ekadashi-farmers-from-13-districts-will-undertake-a-sadbuddhi-yatra-on-foot-from-vakari-to-the-vitthal-temple-demanding-the-cancellation-of-the-shaktipeeth-highway-project-a-a746/,2026-07-10T21:11:03+00:00
Mumbai,Lokmat,Mumbai • Lokmat,https://www.lokmat.com/city/,39,"तपासणी केली, त्रुटी आढळल्या, पुरावे सापडले अन् ते मेडिकल केले सील; औषध प्रशासनाची सोलापुरात मोठी कारवाई",https://www.lokmat.com/solapur/inspection-done-errors-found-evidence-found-and-it-was-medically-sealed-drug-administration-takes-major-action-in-solapur-a-a941/,2026-07-10T21:11:03+00:00
Mumbai,Lokmat,Mumbai • Lokmat,https://www.lokmat.com/city/,40,सैराट’ फेम अभिनेता सल्याची रुग्णालयाकडून लूट; व्हिडिओ पाहिला अन् तुकाराम मुंढेंनी दिले चौकशीचे आदेश,https://www.lokmat.com/solapur/sairat-fame-actor-salya-robbed-from-hospital-watched-the-video-and-tukaram-mundhe-ordered-an-inquiry-a-a941/,2026-07-10T21:11:03+00:00
Mumbai,Lokmat,Mumbai • Lokmat,https://www.lokmat.com/city/,41,"प्रॉपर्टीच्या वादातून काका-काकूचा खून; हत्या करून पुतण्यांनी मित्राला दिले सोने, मुंबईमध्ये साहिलला अटक",https://www.lokmat.com/solapur/uncle-and-aunt-murdered-over-property-dispute-nephews-gave-gold-to-friend-after-murder-sahil-arrested-in-mumbai-a-a571/,2026-07-10T21:11:03+00:00
Mumbai,Lokmat,Mumbai • Lokmat,https://www.lokmat.com/city/,42,"भोंदू मनोहर भोसलेकडे अफाट 'माया'; २० बँक खात्यांमध्ये ३ कोटींची रोकड, २५ एकर जमीन अन् फ्लॅट",https://www.lokmat.com/solapur/sit-investigation-reveals-that-the-fraudulent-manohar-bhosale-holds-over-3-crore-across-20-bank-accounts-a-a1001/,2026-07-10T21:11:03+00:00
Mumbai,Lokmat,Mumbai • Lokmat,https://www.lokmat.com/city/,43,बाळासाहेब थोरात यांची एसीबी चौकशी नाकारण्याचा निर्णय कोणाचा?,https://www.lokmat.com/ahilyanagar/bombay-high-court-asks-maharashtra-govt-who-decided-to-deny-acb-probe-against-balasaheb-thorat-a-a1001/,2026-07-10T21:11:03+00:00
Mumbai,Lokmat,Mumbai • Lokmat,https://www.lokmat.com/city/,44,शिर्डी साईबाबा मंदिरात 'ब्रेक दर्शन'साठी आता मोजावे लागणार ३०० रुपये; संस्थानचा मोठा निर्णय,https://www.lokmat.com/ahilyanagar/shirdi-sai-baba-sansthan-increases-break-darshan-fee-for-vip-devotees-by-100-rupees-a-a1001/,2026-07-10T21:11:03+00:00
Mumbai,Lokmat,Mumbai • Lokmat,https://www.lokmat.com/city/,45,"""...तर शरद पवार राष्ट्रपती झाले असते""; रामदास आठवले यांचा गौप्यस्फोट",https://www.lokmat.com/ahilyanagar/sharad-pawar-could-have-been-president-if-he-joined-nda-in-2014-claims-union-minister-ramdas-athawale-a-a1001/,2026-07-10T21:11:03+00:00
Mumbai,Lokmat,Mumbai • Lokmat,https://www.lokmat.com/city/,46,"'माहिती अधिकारातील बदल रद्द न झाल्यास पुन्हा जनआंदोलन करणार', अण्णा हजारे यांचा सरकारला इशारा",https://www.lokmat.com/ahilyanagar/will-launch-another-mass-movement-if-changes-in-right-to-information-are-not-repealed-anna-hazare-warns-government-a-a571/,2026-07-10T21:11:03+00:00
Mumbai,Lokmat,Mumbai • Lokmat,https://www.lokmat.com/city/,47,"बैल नाही, ट्रॅक्टरही नाही; माणसेच ओढताहेत पाभर !",https://www.lokmat.com/maharashtra/no-bulls-no-tractors-only-people-are-pulling-the-cart-a-a301/,2026-07-10T21:11:03+00:00
