city,publisher,source,source_url,rank,headline,link,collected_at_iso
Delhi-NCR,Jagran,Delhi-NCR • Jagran,https://www.jagran.com/delhi-ncr,35,"बंधवाड़ी लैंडफिल के कूड़े में लगी आग, जहरीले धुएं से गुरुग्राम में हाहाकार",https://www.jagran.com/haryana/gurgaon-gurugram-bandhwari-landfill-fire-rages-methane-suspected-40207617.html,2026-04-15T20:59:01+00:00
Delhi-NCR,Jagran,Delhi-NCR • Jagran,https://www.jagran.com/delhi-ncr,36,"नोएडा श्रमिक आंदोलन: 45 गैर-श्रमिक गिरफ्तार, योगी सरकार ने नाकाम की अराजकता की साजिश",https://www.jagran.com/uttar-pradesh/noida-noida-unrest-45-nonworkers-among-66-arrested-conspiracy-40207918.html,2026-04-15T20:59:01+00:00
Delhi-NCR,Jagran,Delhi-NCR • Jagran,https://www.jagran.com/delhi-ncr,37,"टप्पल मल्टी-मॉडल लॉजिस्टिक्स पार्क 1450 हेक्टेयर भूमि अधिग्रहीत करेगा यीडा, 2056 करोड़ का मुआवजा तय",https://www.jagran.com/uttar-pradesh/noida-tappal-multimodal-logistics-park-yida-reserves-2056-cr-40207831.html,2026-04-15T20:59:01+00:00
Delhi-NCR,Jagran,Delhi-NCR • Jagran,https://www.jagran.com/delhi-ncr,38,"दिल्ली की सड़कों पर गायब हो रही जेब्रा क्रासिंग, पैदल राहगीरों की सुरक्षा को खतरा",https://www.jagran.com/delhi/new-delhi-city-delhis-missing-road-markings-a-major-safety-hazard-40207964.html,2026-04-15T20:59:01+00:00
Delhi-NCR,Jagran,Delhi-NCR • Jagran,https://www.jagran.com/delhi-ncr,39,"10 करोड़ की लागत से नैनी झील बनेगी पर्यटन हब, MCD ने शुरू की टेंडर प्रक्रिया",https://www.jagran.com/delhi/new-delhi-city-naini-lake-delhi-new-plan-for-longdelayed-beautification-40207957.html,2026-04-15T20:59:01+00:00
Delhi-NCR,Jagran,Delhi-NCR • Jagran,https://www.jagran.com/delhi-ncr,40,"CBSE 10वीं कंपार्टमेंट: 1.47 लाख छात्रों को मिलेगा दूसरा मौका, मई में होगी परीक्षा",https://www.jagran.com/delhi/new-delhi-city-cbse-class-10-compartment-147-lakh-students-may-reexam-40207955.html,2026-04-15T20:59:01+00:00
Delhi-NCR,Jagran,Delhi-NCR • Jagran,https://www.jagran.com/delhi-ncr,41,"दिल्ली सरकार के स्कूलों ने रचा इतिहास, 10वीं में पास प्रतिशत बढ़कर हुआ 97.27%",https://www.jagran.com/delhi/new-delhi-city-delhi-govt-schools-excel-in-cbse-10th-results-beat-national-avg-40207953.html,2026-04-15T20:59:01+00:00
Delhi-NCR,Jagran,Delhi-NCR • Jagran,https://www.jagran.com/delhi-ncr,42,"'सरकारी रिकॉर्ड में ट्रांसजेंडर की पहचान पर अपना रुख स्पष्ट करें', केंद्र सरकार से दिल्ली HC ने मांगा जवाब",https://www.jagran.com/delhi/new-delhi-city-delhi-hc-seeks-centres-stance-on-transgender-identity-in-records-40207921.html,2026-04-15T20:59:01+00:00
Delhi-NCR,Jagran,Delhi-NCR • Jagran,https://www.jagran.com/delhi-ncr,43,"फरीदाबाद: गांधी कॉलोनी को मिलेगी टूटी सड़क से मुक्ति, 1.14 करोड़ से होगा पैरीफेरी रोड का निर्माण",https://www.jagran.com/haryana/faridabad-faridabad-peripheral-road-construction-begins-after-10-years-40207970.html,2026-04-15T20:59:01+00:00
Delhi-NCR,Jagran,Delhi-NCR • Jagran,https://www.jagran.com/delhi-ncr,44,"'मैं मदद के लिए चिल्लाता रहा, उन्होंने मेरे सामने बड़े भाई को पीटकर मार डाला'; फरीदाबाद में सनसनीखेज वारदात",https://www.jagran.com/haryana/faridabad-ballabgarh-liquor-vends-manager-murdered-by-mob-in-faridabad-40207549.html,2026-04-15T20:59:01+00:00
Delhi-NCR,Jagran,Delhi-NCR • Jagran,https://www.jagran.com/delhi-ncr,45,"फरीदाबाद के मोठूका में तीन महीने पहले बनकर तैयार हो गया था रेनीवेल, तब से है बिजली कनेक्शन का इंतजार",https://www.jagran.com/haryana/faridabad-faridabad-mothuka-reniewells-await-power-water-supply-hit-40207452.html,2026-04-15T20:59:01+00:00
Delhi-NCR,Jagran,Delhi-NCR • Jagran,https://www.jagran.com/delhi-ncr,46,"डीजी हेल्थ के आदेश ने फरीदाबाद में रोका गरीबों का इलाज, डे केयर फाइल को लेकर बदले नियम से खड़ी हुई मुसीबत",https://www.jagran.com/haryana/faridabad-faridabad-bpl-patients-denied-free-ctmri-scans-at-hospital-40207454.html,2026-04-15T20:59:01+00:00
Delhi-NCR,Jagran,Delhi-NCR • Jagran,https://www.jagran.com/delhi-ncr,47,"फरीदाबाद में 10 साल बाद बनेगा गांधी कॉलोनी का पैरीफेरी रोड, 50 हजार से ज्यादा लोगों को मिलेगी राहत",https://www.jagran.com/haryana/faridabad-faridabad-gandhi-colony-peripheral-road-construction-begins-after-10-years-40207426.html,2026-04-15T20:59:01+00:00
Delhi-NCR,Jagran,Delhi-NCR • Jagran,https://www.jagran.com/delhi-ncr,48,"पलवल में जमीन के विवाद ने लिया खूनी संघर्ष, गोली लगने से युवक घायल; पुलिस ने दर्ज किए मुकदमे",https://www.jagran.com/haryana/palwal-palwal-land-dispute-youth-shot-cases-filed-against-both-sides-40207906.html,2026-04-15T20:59:01+00:00
Delhi-NCR,Jagran,Delhi-NCR • Jagran,https://www.jagran.com/delhi-ncr,49,"पलवल में वेतन वृद्धि विवाद: हाईवे जाम करने वालों पर दर्ज होगा केस, फैक्ट्रियों के बाद सुरक्षा सख्त",https://www.jagran.com/haryana/palwal-palwal-highway-blockade-wage-hike-dispute-leads-to-strict-action-40206465.html,2026-04-15T20:59:01+00:00
Delhi-NCR,Jagran,Delhi-NCR • Jagran,https://www.jagran.com/delhi-ncr,50,"पलवल में ईंटों के नीचे छिपाकर बिहार ले जाई जा रही 610 पेटी अंग्रेजी शराब पकड़ी, दो तस्कर गिरफ्तार",https://www.jagran.com/haryana/palwal-palwal-610-cartons-of-illegal-liquor-seized-2-arrested-40206281.html,2026-04-15T20:59:01+00:00
Delhi-NCR,Jagran,Delhi-NCR • Jagran,https://www.jagran.com/delhi-ncr,51,"नोएडा में हिंसा और राजमार्ग पर जाम लगाने के बाद पुलिस चौकना, फैक्ट्रियों के बाहर सुरक्षा सख्त",https://www.jagran.com/haryana/palwal-palwal-factories-on-alert-after-wage-protests-security-tightened-40206273.html,2026-04-15T20:59:01+00:00
Delhi-NCR,Jagran,Delhi-NCR • Jagran,https://www.jagran.com/delhi-ncr,52,"पलवल में 50 लाख की अवैध अंग्रेजी शराब बरामद, सीमेंट के ब्लॉकों में छिपाकर ट्रक से बिहार ले जा रहे थे तस्कर",https://www.jagran.com/haryana/palwal-palwal-police-seizes-50-lakh-illegal-liquor-in-truck-40205934.html,2026-04-15T20:59:01+00:00
Delhi-NCR,Jagran,Delhi-NCR • Jagran,https://www.jagran.com/delhi-ncr,53,"बुलंदशहर में महिलाओं की फोटो खींचने पर दो पक्षो में खूनी संघर्ष, 10 से ज्यादा लोग जख्मी",https://www.jagran.com/uttar-pradesh/bulandshahr-bulandshahr-walima-conflict-over-10-injured-in-photo-dispute-40207977.html,2026-04-15T20:59:01+00:00
Delhi-NCR,Jagran,Delhi-NCR • Jagran,https://www.jagran.com/delhi-ncr,54,"गुटखा कंपनियों के प्रचार में क्रिकेटरों और अभिनेताओं की भूमिका पर हाई कोर्ट सख्त, CCPA पर लगाया 5500 का हर्जाना",https://www.jagran.com/uttar-pradesh/lucknow-city-allahabad-hc-fines-ccpa-over-gutkha-promotion-probe-delay-40207980.html,2026-04-15T20:59:01+00:00
Delhi-NCR,Jagran,Delhi-NCR • Jagran,https://www.jagran.com/delhi-ncr,55,"बिजनौर पुलिस का बड़ा एक्शन, देश विरोधी गतिविधियों में इस्तेमाल ग्रुप के Admin समेत दो को किया गिरफ्तार",https://www.jagran.com/uttar-pradesh/bijnor-aakib-case-telegram-admin-arrested-for-antinational-incitement-40207983.html,2026-04-15T20:59:01+00:00
Delhi-NCR,Jagran,Delhi-NCR • Jagran,https://www.jagran.com/delhi-ncr,56,"बरेली के होनहारों का जलवा! CBSE 10th रिजल्ट में ओम सिंह ने किया टॉप, कनिष्क और नैनिका ने भी गाड़े झंडे",https://www.jagran.com/uttar-pradesh/bareilly-city-cbse-10th-result-bareilly-toppers-list-dps-bbl-sr-international-schools-40207965.html,2026-04-15T20:59:01+00:00
Delhi-NCR,Jagran,Delhi-NCR • Jagran,https://www.jagran.com/delhi-ncr,57,"कानपुर में कुत्तों को पकड़ने गई नगर निगम की टीम पर हमला, 4 घायल, मोबाइल -वाहन तोड़े",https://www.jagran.com/uttar-pradesh/kanpur-city-kanpur-dog-catching-team-attacked-4-injured-vehicles-damaged-40207976.html,2026-04-15T20:59:01+00:00
Delhi-NCR,Jagran,Delhi-NCR • Jagran,https://www.jagran.com/delhi-ncr,58,"Kanpur इलेक्ट्रिक वाहन मालिकों के साथ बड़ा खेल, बैटरी से असली 'सेल' निकालकर भर देते थे रेत, एक गिरफ्तार",https://www.jagran.com/uttar-pradesh/kanpur-city-ev-battery-fraud-company-employees-replaced-real-cells-with-sand-in-kanpur-sold-to-meerut-traders-40207971.html,2026-04-15T20:59:01+00:00
Delhi-NCR,Jagran,Delhi-NCR • Jagran,https://www.jagran.com/delhi-ncr,59,"आसमान से नजर और जमीन पर एक्शन! कानपुर पुलिस की ड्रोन से घेराबंदी, नशे की बड़ी खेप के साथ 7 महिलाओं समेत 8 गिरफ्तार",https://www.jagran.com/uttar-pradesh/kanpur-city-high-tech-raid-in-kanpur-drones-help-catch-drug-smugglers-in-operation-white-powder-8-arrested-including-7-women-40207958.html,2026-04-15T20:59:01+00:00
Delhi-NCR,Jagran,Delhi-NCR • Jagran,https://www.jagran.com/delhi-ncr,60,"बलिया में पिकअप और ई-रिक्शा की टक्कर में युवक की मौत, दो घाय",https://www.jagran.com/uttar-pradesh/ballia-ballia-e-rickshaw-pickup-crash-1-dead-2-injured-in-kapuri-40207289.html,2026-04-15T20:59:01+00:00
Delhi-NCR,Jagran,Delhi-NCR • Jagran,https://www.jagran.com/delhi-ncr,61,"आखिरी गेंद तक कांपता रोमांच, कलेक्टरेट ने 1 रन से जीता फाइनल",https://www.jagran.com/bihar/bhagalpur-collectorate-xi-wins-thrilling-bhagalpur-cricket-final-by-1-run-40207278.html,2026-04-15T20:59:01+00:00
Delhi-NCR,Jagran,Delhi-NCR • Jagran,https://www.jagran.com/delhi-ncr,62,US-India Trade Deal पर बड़ी खबर! भारतीय प्रतिनिधिमंडल जाएगा,https://www.jagran.com/business/biz-india-us-trade-talks-delegation-will-go-to-washington-amid-tariff-changes-40207291.html,2026-04-15T20:59:01+00:00
Delhi-NCR,Jagran,Delhi-NCR • Jagran,https://www.jagran.com/delhi-ncr,63,JPSC CSE Admit Card 2026: झारखंड सिविल सेवा प्रारंभिक परीक्ष,https://www.jagran.com/news/education-jpsc-cse-admit-card-2026-download-jharkhand-civil-services-preliminary-exam-admit-card-from-the-link-given-here-exam-on-april-19-40207283.html,2026-04-15T20:59:01+00:00
Delhi-NCR,Jagran,Delhi-NCR • Jagran,https://www.jagran.com/delhi-ncr,64,"दिल्ली विधानसभा को फिर मिली बम से उड़ाने की धमकी, लिखा- तमिल",https://www.jagran.com/delhi/new-delhi-city-delhi-assembly-receives-another-bomb-threat-via-email-40207282.html,2026-04-15T20:59:01+00:00
Delhi-NCR,Jagran,Delhi-NCR • Jagran,https://www.jagran.com/delhi-ncr,65,"पैसे कैसे और कहां बनेंगे, यह जानता था अभिषेक, किशनगंज नगर था",https://www.jagran.com/bihar/muzaffarpur-bihar-news-abhishek-ranjan-assets-case-muzaffarpur-police-career-investigation-hindi-news-40207292.html,2026-04-15T20:59:01+00:00
Delhi-NCR,Jagran,Delhi-NCR • Jagran,https://www.jagran.com/delhi-ncr,66,"अयान तनवीर पर तगड़ा एक्शन, घर पर चला बुलडोजर; 180 लड़कियों ब",https://www.jagran.com/maharashtra/mumbai-strict-action-taken-against-ayan-tanveer-bulldozer-deployed-at-his-home-had-targeted-180-girls-40207290.html,2026-04-15T20:59:01+00:00
Delhi-NCR,Jagran,Delhi-NCR • Jagran,https://www.jagran.com/delhi-ncr,67,भाजपा-जदयू दोनों की पसंद बने सम्राट; पिता ने बताया पूरा कारण,https://www.jagran.com/bihar/patna-city-samrat-chaudhary-cm-father-shakuni-chaudharys-pride-in-sons-achievement-40207264.html,2026-04-15T20:59:01+00:00
Delhi-NCR,Jagran,Delhi-NCR • Jagran,https://www.jagran.com/delhi-ncr,68,CBSE की पहली बोर्ड परीक्षा का रिजल्ट जारी होने के बाद जमा हो,https://www.jagran.com/uttar-pradesh/meerut-city-cbse-class-10-two-exams-fees-post-result-best-of-two-rule-40207261.html,2026-04-15T20:59:01+00:00
Delhi-NCR,Jagran,Delhi-NCR • Jagran,https://www.jagran.com/delhi-ncr,69,"OTT पर पलटेगा मनोरंजन का ट्रक, 'बीफ' की जंग से 'यूफोरिया' के",https://www.jagran.com/entertainment/web-series-review-new-ott-release-from-beef-matka-king-to-euphoria-grand-finale-more-than-ten-pius-series-movies-will-stream-on-prime-and-netflix-40207271.html,2026-04-15T20:59:01+00:00
Delhi-NCR,Jagran,Delhi-NCR • Jagran,https://www.jagran.com/delhi-ncr,70,"'मैं उसे मरा हुआ...', RD Burman की मौत के बाद उन्हें देखने नहीं गईं थी Asha Bhosle, 'पंचम' के जाने पर हुई थीं बेसुध!",https://www.jagran.com/entertainment/bollywood-vishesh-asha-bhosle-death-the-tragic-truth-behind-asha-bhosles-reaction-to-pancham-da-aka-rd-burman-death-40204948.html,2026-04-15T20:59:01+00:00
Delhi-NCR,Jagran,Delhi-NCR • Jagran,https://www.jagran.com/delhi-ncr,71,"Asha Bhosle के अंतिम संस्कार में क्यों नहीं गए शाह रुख-सलमान? मुंबई में थे मौजूद, सामने आई वजह",https://www.jagran.com/entertainment/bollywood-shah-rukh-khan-and-salman-khan-did-not-attend-asha-bhosle-funeral-due-to-security-reason-40207477.html,2026-04-15T20:59:01+00:00
Delhi-NCR,Jagran,Delhi-NCR • Jagran,https://www.jagran.com/delhi-ncr,72,"Kareena Kapoor के बड़बोलेपन से बुरी तरह चिढ़ गई थीं Preity Zinta, सरेआम 'उतरी हुई जींस' से की थी तुलना",https://www.jagran.com/entertainment/bollywood-preity-zintas-befitting-reply-to-kareena-kapoors-i-rejected-kal-ho-naa-ho-statement-on-karan-johars-show-throwback-video-40206059.html,2026-04-15T20:59:01+00:00
Delhi-NCR,Jagran,Delhi-NCR • Jagran,https://www.jagran.com/delhi-ncr,73,"बिकिनी में इस हसीना को देखकर छूट गए थे Ranveer Singh के पसीने, पोज देने में Dhurandhar हीरो की हालत हुई थी खराब",https://www.jagran.com/entertainment/bollywood-model-sonali-raut-recalls-bikini-shoot-with-ranveer-singh-says-he-was-very-shy-and-nervous-40207838.html,2026-04-15T20:59:01+00:00
Delhi-NCR,Jagran,Delhi-NCR • Jagran,https://www.jagran.com/delhi-ncr,74,Did You Know,https://www.jagran.com/did-you-know-news-hindi.html,2026-04-15T20:59:01+00:00
Delhi-NCR,Jagran,Delhi-NCR • Jagran,https://www.jagran.com/delhi-ncr,75,मिडिल ईस्ट संकट,https://www.jagran.com/topics/Israel-Iran-Conflict,2026-04-15T20:59:01+00:00
Delhi-NCR,Jagran,Delhi-NCR • Jagran,https://www.jagran.com/delhi-ncr,76,विधानसभा चुनाव 2026,https://www.jagran.com/topics/assembly-election-2026,2026-04-15T20:59:01+00:00
Delhi-NCR,Jagran,Delhi-NCR • Jagran,https://www.jagran.com/delhi-ncr,77,नोएडा श्रमिक प्रदर्शन,https://www.jagran.com/topics/Noida-protests,2026-04-15T20:59:01+00:00
Delhi-NCR,Jagran,Delhi-NCR • Jagran,https://www.jagran.com/delhi-ncr,78,Submit your news,https://www.jagran.com/citizen-journalism-hindi.html,2026-04-15T20:59:01+00:00
Delhi-NCR,Jagran,Delhi-NCR • Jagran,https://www.jagran.com/delhi-ncr,79,Message from the Editor,https://www.jagran.com/policies-and-standards.html,2026-04-15T20:59:01+00:00
Hyderabad,DC,Hyderabad • DC,https://www.deccanchronicle.com/location/india/southern-states,1,Assembly Elections 2026,https://www.deccanchronicle.com/assembly-elections-2026,2026-04-15T20:59:01+00:00
Hyderabad,DC,Hyderabad • DC,https://www.deccanchronicle.com/location/india/southern-states,2,Opinion and Editorials,https://www.deccanchronicle.com/opinion,2026-04-15T20:59:01+00:00
Hyderabad,DC,Hyderabad • DC,https://www.deccanchronicle.com/location/india/southern-states,3,Telangana Rising 2047,https://www.deccanchronicle.com/tags/Telangana-Rising-2047,2026-04-15T20:59:01+00:00
Chennai,DC,Chennai • DC,https://www.deccanchronicle.com/location/india/tamil-nadu/chennai-madras,1,Assembly Elections 2026,https://www.deccanchronicle.com/assembly-elections-2026,2026-04-15T20:59:01+00:00
Chennai,DC,Chennai • DC,https://www.deccanchronicle.com/location/india/tamil-nadu/chennai-madras,2,Opinion and Editorials,https://www.deccanchronicle.com/opinion,2026-04-15T20:59:01+00:00
Chennai,DC,Chennai • DC,https://www.deccanchronicle.com/location/india/tamil-nadu/chennai-madras,3,Telangana Rising 2047,https://www.deccanchronicle.com/tags/Telangana-Rising-2047,2026-04-15T20:59:01+00:00
Chennai,The Hindu,Chennai • The Hindu,https://www.thehindu.com/news/cities/chennai/,1,IPL 2026 | This Chennai groom’s CSK-themed wedding invite is winning hearts,https://www.thehindu.com/news/cities/chennai/ipl-2026-this-chennai-grooms-csk-themed-wedding-invite-is-winning-hearts/article70860643.ece,2026-04-15T20:59:01+00:00
Chennai,The Hindu,Chennai • The Hindu,https://www.thehindu.com/news/cities/chennai/,2,Maduravoyal treated as second-rung constituency by both Dravidian parties: TVK candidate Revanth,https://www.thehindu.com/elections/tamil-nadu-assembly/maduravoyal-treated-as-second-rung-constituency-by-both-dravidian-parties-tvk-candidate-revanth-saran/article70862194.ece,2026-04-15T20:59:01+00:00
Chennai,The Hindu,Chennai • The Hindu,https://www.thehindu.com/news/cities/chennai/,3,"Edappadi Palaniswami paving way for BJP, RSS to enter Tamil Nadu: Brinda Karat",https://www.thehindu.com/elections/tamil-nadu-assembly/edappadi-palaniswami-paving-way-for-bjp-and-rss-to-enter-tamil-nadu-says-brinda-karat/article70862429.ece,2026-04-15T20:59:01+00:00
Chennai,The Hindu,Chennai • The Hindu,https://www.thehindu.com/news/cities/chennai/,4,A trip down Khader Nawaz Khan Road’s residential past,https://www.thehindu.com/news/cities/chennai/a-trip-down-chennai-khader-nawaz-khan-road-residential-past/article70860497.ece,2026-04-15T20:59:01+00:00
Chennai,The Hindu,Chennai • The Hindu,https://www.thehindu.com/news/cities/chennai/,5,Udhayanidhi Stalin’s assets: Madras High Court calls for report from Director General of Income Tax,https://www.thehindu.com/elections/tamil-nadu-assembly/udhayanidhi-stalins-assets-madras-high-court-calls-for-report-from-director-general-of-income-tax/article70864025.ece,2026-04-15T20:59:01+00:00
Chennai,The Hindu,Chennai • The Hindu,https://www.thehindu.com/news/cities/chennai/,6,DMK candidate for Villivakkam outlines plans for infrastructure development,https://www.thehindu.com/elections/tamil-nadu-assembly/dmk-candidate-for-villivakkam-outlines-plans-for-infrastructure-development/article70860932.ece,2026-04-15T20:59:01+00:00
Chennai,The Hindu,Chennai • The Hindu,https://www.thehindu.com/news/cities/chennai/,7,PIL in HC seeks headphone-based audio-enabled VVPAT system in polls,https://www.thehindu.com/news/national/tamil-nadu/pil-in-hc-seeks-headphone-based-audio-enabled-vvpat-system-in-polls/article70860708.ece,2026-04-15T20:59:01+00:00
Chennai,The Hindu,Chennai • The Hindu,https://www.thehindu.com/news/cities/chennai/,8,College girl suffers knife injuries after she raises alarm against two intruders in Minjur,https://www.thehindu.com/news/cities/chennai/college-girl-suffers-knife-injuries-after-she-raises-alarm-against-two-intruders-in-minjur/article70864577.ece,2026-04-15T20:59:01+00:00
Chennai,The Hindu,Chennai • The Hindu,https://www.thehindu.com/news/cities/chennai/,9,Some questions that are beyond textbooks,https://www.thehindu.com/children/some-questions-that-are-beyond-textbooks/article70837282.ece,2026-04-15T20:59:01+00:00
Chennai,The Hindu,Chennai • The Hindu,https://www.thehindu.com/news/cities/chennai/,10,What Anna Nagar voters want: Otteri Nullah monitored; pedestrian spaces freed up; parking policy sharpened; feeder services provided,https://www.thehindu.com/news/cities/chennai/anna-nagar-voters-bring-up-unfinished-business/article70853308.ece,2026-04-15T20:59:01+00:00
Chennai,The Hindu,Chennai • The Hindu,https://www.thehindu.com/news/cities/chennai/,11,A ‘developing’ community story with subplots in Chennai,https://www.thehindu.com/news/cities/chennai/a-developing-community-story-with-plots-and-subplots-in-chennai/article70853251.ece,2026-04-15T20:59:01+00:00
Chennai,The Hindu,Chennai • The Hindu,https://www.thehindu.com/news/cities/chennai/,12,Tiruvottiyur constituency: Environmental pollution remains a major concern in this industrial zone,https://www.thehindu.com/elections/tamil-nadu-assembly/environmental-pollution-remains-a-major-concern-in-this-industrial-zone/article70847911.ece,2026-04-15T20:59:01+00:00
Chennai,The Hindu,Chennai • The Hindu,https://www.thehindu.com/news/cities/chennai/,13,Commuters seek bus services from Vandalur railway station,https://www.thehindu.com/news/cities/chennai/commuters-seekbus-servicesfromvandalurrailway-station/article70850745.ece,2026-04-15T20:59:01+00:00
Chennai,The Hindu,Chennai • The Hindu,https://www.thehindu.com/news/cities/chennai/,14,"Tamil Nadu Assembly election 2026: CM Stalin takes surprise Chennai Metro ride, interacts with passengers",https://www.thehindu.com/elections/tamil-nadu-assembly/tamil-nadu-cm-stalin-takes-surprise-ride-in-chennai-metro-interacts-with-passengers/article70845958.ece,2026-04-15T20:59:01+00:00
Chennai,The Hindu,Chennai • The Hindu,https://www.thehindu.com/news/cities/chennai/,15,Bring northern parts of Chennai ‘closer’ to Velachery,https://www.thehindu.com/news/cities/chennai/bring-northern-parts-of-chennai-closer-to-velachery/article70831157.ece,2026-04-15T20:59:01+00:00
Chennai,The Hindu,Chennai • The Hindu,https://www.thehindu.com/news/cities/chennai/,16,Coimbatore cable TV operator arrested for telecasting leaked footage of Jana Nayagan,https://www.thehindu.com/news/national/tamil-nadu/coimbatore-cable-tv-operator-arrested-for-telecasting-leaked-footage-of-jana-nayagan/article70857584.ece,2026-04-15T20:59:01+00:00
Chennai,The Hindu,Chennai • The Hindu,https://www.thehindu.com/news/cities/chennai/,17,Six persons arrested for leaking Jana Nayagan film,https://www.thehindu.com/news/national/tamil-nadu/six-persons-arrested-for-leakingjana-nayaganfilm/article70854992.ece,2026-04-15T20:59:01+00:00
Chennai,The Hindu,Chennai • The Hindu,https://www.thehindu.com/news/cities/chennai/,18,Coimbatore’s local cable TV telecasts Jana Nayagan; TVK supporters seek action,https://www.thehindu.com/news/national/tamil-nadu/coimbatore-local-cable-tv-telecasts-jana-nayagan-movie-tvk-supporters-seek-action/article70854080.ece,2026-04-15T20:59:01+00:00
