city,publisher,source,source_url,rank,headline,link,collected_at_iso
Bengaluru,DC,Bengaluru • DC,https://www.deccanchronicle.com/location/india/karnataka/bengaluru,1,FIFA World Cup 2026,https://www.deccanchronicle.com/fifa-world-cup-2026,2026-06-15T18:42:37+00:00
Bengaluru,DC,Bengaluru • DC,https://www.deccanchronicle.com/location/india/karnataka/bengaluru,2,Opinion and Editorials,https://www.deccanchronicle.com/opinion,2026-06-15T18:42:37+00:00
Bengaluru,DC,Bengaluru • DC,https://www.deccanchronicle.com/location/india/karnataka/bengaluru,3,Assembly Elections 2026,https://www.deccanchronicle.com/assembly-elections-2026,2026-06-15T18:42:37+00:00
Bengaluru,DC,Bengaluru • DC,https://www.deccanchronicle.com/location/india/karnataka/bengaluru,4,Telangana Rising 2047,https://www.deccanchronicle.com/tags/Telangana-Rising-2047,2026-06-15T18:42:37+00:00
Mumbai,Mumbai Mirror,Mumbai • Mumbai Mirror,https://mumbaimirror.indiatimes.com/mumbai,1,BEST drivers are doubling up as cabbies,https://mumbaimirror.indiatimes.com/mumbai/cover-story/best-drivers-are-doubling-up-as-cabbies/articleshow/131727555.html,2026-06-15T18:42:37+00:00
Mumbai,Mumbai Mirror,Mumbai • Mumbai Mirror,https://mumbaimirror.indiatimes.com/mumbai,2,The rains are a time to upskill,https://mumbaimirror.indiatimes.com/opinion/the-rains-are-a-time-to-upskill/articleshow/131725836.html,2026-06-15T18:42:37+00:00
Mumbai,Mumbai Mirror,Mumbai • Mumbai Mirror,https://mumbaimirror.indiatimes.com/mumbai,3,Childhood lost in the gutter,https://mumbaimirror.indiatimes.com/mumbai/childhood-lost-in-the-gutter/articleshow/131727451.html,2026-06-15T18:42:37+00:00
Mumbai,Mumbai Mirror,Mumbai • Mumbai Mirror,https://mumbaimirror.indiatimes.com/mumbai,4,‘No refuge area in Juhu bldg’,https://mumbaimirror.indiatimes.com/mumbai/no-refuge-area-in-juhu-bldg/articleshow/131727459.html,2026-06-15T18:42:37+00:00
Mumbai,Mumbai Mirror,Mumbai • Mumbai Mirror,https://mumbaimirror.indiatimes.com/mumbai,5,"Parents, kids and artificial intelligence",https://mumbaimirror.indiatimes.com/opinion/parents-kids-and-artificial-intelligence/articleshow/131725839.html,2026-06-15T18:42:37+00:00
Mumbai,Mumbai Mirror,Mumbai • Mumbai Mirror,https://mumbaimirror.indiatimes.com/mumbai,6,Why the NewsClick case fell flat in court,https://mumbaimirror.indiatimes.com/mumbai/why-the-newsclick-case-fell-flat-in-court/articleshow/131727057.html,2026-06-15T18:42:37+00:00
Mumbai,Mumbai Mirror,Mumbai • Mumbai Mirror,https://mumbaimirror.indiatimes.com/mumbai,7,MHRC shuts leak case despite unfinished repairs in VN Desai,https://mumbaimirror.indiatimes.com/mumbai/mhrc-shuts-leak-case-despite-unfinished-repairs-in-vn-desai/articleshow/131727553.html,2026-06-15T18:42:37+00:00
Mumbai,Mumbai Mirror,Mumbai • Mumbai Mirror,https://mumbaimirror.indiatimes.com/mumbai,8,Ask The Sexpert,https://mumbaimirror.indiatimes.com/ask-the-sexpert,2026-06-15T18:42:37+00:00
Mumbai,Sakal,Mumbai • Sakal,https://www.esakal.com/pune,1,सकाळ लाईव्ह TV,https://www.esakal.com/live-tv,2026-06-15T18:42:37+00:00
Mumbai,Sakal,Mumbai • Sakal,https://www.esakal.com/pune,2,Refund and Cancellation,https://www.esakal.com/refund-and-cancellation,2026-06-15T18:42:37+00:00
Mumbai,Lokmat,Mumbai • Lokmat,https://www.lokmat.com/city/,1,Live News in Marathi,https://www.lokmat.com/live-news/,2026-06-15T18:42:37+00:00
Mumbai,Lokmat,Mumbai • Lokmat,https://www.lokmat.com/city/,2,"LIVE: ""उद्धव ठाकरेंच्या १६ आमदार आणि ७ खासदारांसोबत शिंदेंची अंतिम बोलणी झालीये""",https://www.lokmat.com/maharashtra/maharashtra-marathi-news-live-updates-15-june-2026-us-iran-deal-strait-of-hormuz-donald-trump-cruide-oil-prices-fuel-prices-in-india-pm-narendra-modi-cm-devendra-fadnavis-neet-exam-cockroach-janta-party-fifa-world-cup-2026-womens-t20-world-cup-a-a573/,2026-06-15T18:42:37+00:00
Mumbai,Lokmat,Mumbai • Lokmat,https://www.lokmat.com/city/,3,पहिली घंटा वाजली! किलबिलाटाने पुन्हा गजबजल्या शाळा; नव्या शैक्षणिक वर्षाचे उत्साहात स्वागत,https://www.lokmat.com/pune/the-first-bell-rang-schools-are-buzzing-with-chirping-again-welcoming-the-new-academic-year-with-enthusiasm-a-a727/,2026-06-15T18:42:37+00:00
Mumbai,Lokmat,Mumbai • Lokmat,https://www.lokmat.com/city/,4,५ महिन्यांनंतर उघडले भीमाशंकरचे दरवाजे; 'हर हर महादेव'च्या जयघोषात हजार भाविकांना दर्शन,https://www.lokmat.com/pune/bhimashankars-gates-opened-after-5-months-thousands-of-devotees-had-darshan-amidst-chants-of-har-har-mahadev-a-a727/,2026-06-15T18:42:37+00:00
Mumbai,Lokmat,Mumbai • Lokmat,https://www.lokmat.com/city/,5,"पतीचे अनैतिक संबंध, जाब विचारल्याने वेळोवेळी मारहाण, विवाहितेने उचलले टोकाचे पाऊल",https://www.lokmat.com/pune/husbands-immoral-relationship-repeatedly-beaten-for-asking-for-answers-married-woman-takes-extreme-step-a-a727/,2026-06-15T18:42:37+00:00
Mumbai,Lokmat,Mumbai • Lokmat,https://www.lokmat.com/city/,6,एपीके फाईल ओपन करताच झटकन पैसे गेले; सायबर चोरांकडून दोघांना ११ लाख २९ हजारांचा गंडा,https://www.lokmat.com/pune/money-disappeared-as-soon-as-the-apk-file-was-opened-two-people-were-robbed-of-rs-11-lakh-29-thousand-by-cyber-thieves-a-a727/,2026-06-15T18:42:37+00:00
Mumbai,Lokmat,Mumbai • Lokmat,https://www.lokmat.com/city/,7,सोशल मीडियावर वादग्रस्त वक्तव्य भोवले! युट्युबर प्रणित मोरे आणि सेजल सायबर पोलिसांच्या रडारवर,https://www.lokmat.com/filmy/controversial-statement-on-social-media-youtubers-praneet-more-and-sejal-on-the-radar-of-cyber-police-a-a941/,2026-06-15T18:42:37+00:00
Mumbai,Lokmat,Mumbai • Lokmat,https://www.lokmat.com/city/,8,"""ज्यांना जायचं आहे, त्यांनी खुशाल जावं; त्यांचे..."", मातोश्रीवरील खासदारांच्या बैठकीत उद्धव ठाकरेंचे उद्गार",https://www.lokmat.com/mumbai/those-who-want-to-go-should-go-happily-they-should-uddhav-thackerays-statement-at-the-mps-meeting-on-matoshree-a-a571/,2026-06-15T18:42:37+00:00
Mumbai,Lokmat,Mumbai • Lokmat,https://www.lokmat.com/city/,9,"""दुसऱ्यांची मुलं चोरण्यापेक्षा तुम्ही तुमची मुलं मोठी करा""; शर्मिला ठाकरेंचं भाजपावर टीकास्त्र",https://www.lokmat.com/mumbai/mns-sharmila-thackeray-slams-bjp-over-party-splitting-politics-a-a597/,2026-06-15T18:42:37+00:00
Mumbai,Lokmat,Mumbai • Lokmat,https://www.lokmat.com/city/,10,दिल्लीत हालचाली! उद्धवसेनेचे 'ते' खासदार स्वतंत्र गट बनवण्यासाठी लोकसभा अध्यक्षांना देणार पत्र?,https://www.lokmat.com/maharashtra/will-some-mp-of-uddhav-thackeray-sena-submit-a-letter-to-the-lok-sabha-speaker-to-form-an-independent-group-sanjay-raut-reaction-a-a629/,2026-06-15T18:42:37+00:00
Mumbai,Lokmat,Mumbai • Lokmat,https://www.lokmat.com/city/,11,पाली भाषेच्या संवर्धनासाठी शेवटपर्यंत लढणारा योद्धा हरपला; ज्येष्ठ आंबेडकरी कार्यकर्ते डॉ. सुधीर भगत यांचे निधन,https://www.lokmat.com/nagpur/a-warrior-who-fought-till-the-end-for-the-preservation-of-pali-language-has-been-lost-senior-ambedkarite-activist-dr-sudhir-bhagat-passes-away-a-a941/,2026-06-15T18:42:37+00:00
Mumbai,Lokmat,Mumbai • Lokmat,https://www.lokmat.com/city/,12,"विदर्भात २० जूनपर्यंत मान्सूनच्या सक्रियतेची आशा; वर्धा, गाेंदियात उष्णतेची लाट",https://www.lokmat.com/nagpur/monsoon-activity-expected-in-vidarbha-by-june-20-heat-wave-in-wardha-gondia-a-a957-c1000/,2026-06-15T18:42:37+00:00
Mumbai,Lokmat,Mumbai • Lokmat,https://www.lokmat.com/city/,13,एका विद्यार्थ्याच्या स्वप्नाची जात कोणती?,https://www.lokmat.com/nagpur/what-is-a-students-dream-caste-a-a1015-c1000/,2026-06-15T18:42:37+00:00
Mumbai,Lokmat,Mumbai • Lokmat,https://www.lokmat.com/city/,14,१७ जागांवर महायुतीचाच विजय निश्चित; अमरावतीतील उमेदवारांच्या माघारीवर रवींद्र चव्हाणांची स्पष्टोक्ती!,https://www.lokmat.com/nagpur/mahayutis-victory-is-certain-in-17-seats-ravindra-chavans-clarification-on-the-withdrawal-of-candidates-from-amravati-a-a1000/,2026-06-15T18:42:37+00:00
Mumbai,Lokmat,Mumbai • Lokmat,https://www.lokmat.com/city/,15,नगरसेवक मतदारांचे ‘फेस रिकग्निशन’; नाशिकमध्ये राज्यातील पहिला प्रयोग राबवण्यात येणार,https://www.lokmat.com/nashik/face-recognition-of-corporator-voters-the-first-experiment-in-the-state-will-be-implemented-in-nashik-a-a333-c747/,2026-06-15T18:42:37+00:00
Mumbai,Lokmat,Mumbai • Lokmat,https://www.lokmat.com/city/,16,"'एक राज्य, एक जागतिक पर्यटन स्थळ' योजनेत 'या' दोन जिल्ह्यांची निवड",https://www.lokmat.com/sindhudurga/sindhudurg-selected-for-the-one-state-one-global-tourist-destination-scheme-a-a746/,2026-06-15T18:42:37+00:00
Mumbai,Lokmat,Mumbai • Lokmat,https://www.lokmat.com/city/,17,TCS धर्मांतर प्रकरणी मतीन पटेलसह हनीफ खानची निदाच्या कुटुंबासोबत चौकशी,https://www.lokmat.com/nashik/hanif-khan-mateen-patel-questioned-along-with-nidas-family-in-tcs-conversion-case-a-a597/,2026-06-15T18:42:37+00:00
Mumbai,Lokmat,Mumbai • Lokmat,https://www.lokmat.com/city/,18,धोंड्याच्या जेवणाने आनंदाने न्हाऊन निघालेलं घर बुडालं दुःखाच्या सागरात; चौघांचा बुडून मृत्यू,https://www.lokmat.com/nashik/three-teenage-cousins-among-four-drown-at-nashiks-gangapur-dam-a-a597/,2026-06-15T18:42:37+00:00
Mumbai,Lokmat,Mumbai • Lokmat,https://www.lokmat.com/city/,19,वाढदिवशी काळाचा घाला; कुटुंबातील चौघांचा बुडून मृत्यू,https://www.lokmat.com/nashik/weather-conditions-on-birthday-four-members-of-a-family-drown-to-death-a-a653/,2026-06-15T18:42:37+00:00
Mumbai,Lokmat,Mumbai • Lokmat,https://www.lokmat.com/city/,20,"कोल्हापुरातील अंबाबाई मंदिराच्या जतन संवर्धन, सक्षमीकरणाला वेग; १५०० कोटींच्या विकास आराखड्याचा पहिला टप्पा",https://www.lokmat.com/kolhapur/acceleration-in-the-preservation-and-empowerment-of-ambabai-temple-in-kolhapur-a-a746/,2026-06-15T18:42:37+00:00
Mumbai,Lokmat,Mumbai • Lokmat,https://www.lokmat.com/city/,21,"Kolhapur: गडहिंग्लजच्या नगराध्यक्षपदाचा कार्यभार उपनगराध्यक्ष सलवादे यांच्याकडे, नगरपालिकेच्या इतिहासातील पहिलीच वेळ",https://www.lokmat.com/kolhapur/the-charge-of-the-post-of-mayor-of-gadhinglaj-municipality-was-handed-over-to-deputy-mayor-bhimrao-alias-mahesh-salwade-a-a746/,2026-06-15T18:42:37+00:00
Mumbai,Lokmat,Mumbai • Lokmat,https://www.lokmat.com/city/,22,"Kolhapur: टायर फुटून कार धडकली, दुचाकीस्वार ठार; गडहिंग्लज-संकेश्वर महामार्गावर झाला अपघात",https://www.lokmat.com/kolhapur/car-hits-two-wheeler-after-tyre-bursts-on-gadhinglaj-sankeshwar-highway-one-killed-a-a746/,2026-06-15T18:42:37+00:00
Mumbai,Lokmat,Mumbai • Lokmat,https://www.lokmat.com/city/,23,मालवाहतुकीच्या चाकांना डिझेल निर्बंधाचा 'ब्रेक'; लांब पल्ल्याची वाहतूक होणार कशी?,https://www.lokmat.com/kolhapur/diesel-restrictions-imposed-by-the-central-government-have-disrupted-freight-and-long-distance-transport-services-a-a1002-c746/,2026-06-15T18:42:37+00:00
Mumbai,Lokmat,Mumbai • Lokmat,https://www.lokmat.com/city/,24,Kolhapur city entry tax: कोल्हापूर शहरातील प्रवेश कराचा प्रस्ताव मागे घेणार,https://www.lokmat.com/kolhapur/kolhapur-city-entry-tax-proposal-to-be-withdrawn-a-a746/,2026-06-15T18:42:37+00:00
Mumbai,Lokmat,Mumbai • Lokmat,https://www.lokmat.com/city/,25,"Sangli News: विधानसभेत तुमचे बहुमत, रस्त्यावर आमचे; शक्तिपीठविरोधात कामेरीत एल्गार",https://www.lokmat.com/sangli/all-party-farmers-gathering-at-kameri-to-cancel-shaktipeeth-highway-a-a746/,2026-06-15T18:42:37+00:00
Mumbai,Lokmat,Mumbai • Lokmat,https://www.lokmat.com/city/,26,Vidhan Parishad Election: भाजपचे मतदारांवर तर महाआघाडीचे अस्वस्थ गटावर लक्ष,https://www.lokmat.com/maharashtra/in-the-backdrop-of-sangli-satara-vidhan-parishad-election-bjps-focus-is-on-voters-while-the-mahaaghadi-focus-is-on-restless-groups-a-a746/,2026-06-15T18:42:37+00:00
Mumbai,Lokmat,Mumbai • Lokmat,https://www.lokmat.com/city/,27,Sangli Crime: गुन्हेगारांची ‘जेल हिस्ट्री’ अन् आदान-प्रदानचा फज्जा उडाल्याने गेला बळी,https://www.lokmat.com/sangli/the-criminals-jail-history-and-the-shame-of-exchange-led-to-the-death-of-the-victim-in-sangli-a-a997-c746/,2026-06-15T18:42:37+00:00
Mumbai,Lokmat,Mumbai • Lokmat,https://www.lokmat.com/city/,28,"सांगलीत माजी नगरसेवकाची व्यवसायातून नऊ लाखांची फसवणूक, तिघांवर गुन्हा दाखल",https://www.lokmat.com/sangli/former-corporator-in-sangli-cheated-of-rs-9-lakhs-from-business-case-registered-against-three-a-a746/,2026-06-15T18:42:37+00:00
Mumbai,Lokmat,Mumbai • Lokmat,https://www.lokmat.com/city/,29,विद्युतीकरण पूर्ण; तरीही मिरज–कोल्हापूर मार्गावर ‘डेमू’चा धूर!,https://www.lokmat.com/sangli/with-the-completion-of-electrification-of-the-pune-miraj-kolhapur-railway-line-many-passenger-trains-are-running-on-diesel-on-this-route-a-a746/,2026-06-15T18:42:37+00:00
Mumbai,Lokmat,Mumbai • Lokmat,https://www.lokmat.com/city/,30,"Satara: कोयना धरणाच्या पोटातून उलघडल्या विस्थापनाचा विदारक पाऊलखूणा!, भग्नावशेष पाहून अनेकांच्या डोळ्यांत अश्रू",https://www.lokmat.com/satara/tears-welled-up-in-the-eyes-of-dam-victims-as-they-saw-debris-exposed-from-the-bottom-of-the-reservoir-due-to-the-decrease-in-the-water-level-of-the-koyna-dam-a-a746/,2026-06-15T18:42:37+00:00
Mumbai,Lokmat,Mumbai • Lokmat,https://www.lokmat.com/city/,31,"उदयनराजे यांच्या समोरच आठवले यांनी उडवली कॉलर !, एकापाठोपाठ एक कविता करून खळखळून हसवले",https://www.lokmat.com/satara/union-minister-ramdas-athawale-blew-his-own-collar-in-udayanrajes-style-a-a746/,2026-06-15T18:42:37+00:00
Mumbai,Lokmat,Mumbai • Lokmat,https://www.lokmat.com/city/,32,"चालकाचे नियंत्रण सुटल्याने कार शेतात कोसळली; अभियंता ठार, दोघे जखमी",https://www.lokmat.com/satara/one-died-after-the-car-of-three-young-engineers-who-were-on-their-way-to-ganapatipule-crashed-into-a-field-at-vadoli-bhikeshwar-on-the-pandharpur-patan-state-highway-a-a746/,2026-06-15T18:42:37+00:00
Mumbai,Lokmat,Mumbai • Lokmat,https://www.lokmat.com/city/,33,Vidhan Parishad Election: भाजपविरोधात राष्ट्रवादी पदाधिकाऱ्यांनी व्यक्त केली खदखद!,https://www.lokmat.com/satara/ncp-office-bearers-expressed-their-anger-against-bjp-at-a-meeting-in-satara-in-the-backdrop-of-the-vidhan-parishad-election-a-a746/,2026-06-15T18:42:37+00:00
Mumbai,Lokmat,Mumbai • Lokmat,https://www.lokmat.com/city/,34,"Akola: अधिक मासातील धार्मिक स्नान ठरले अखेरचे; मुलगाा बुडायला लागला, आईने उडी मारली; दोघांचाही नदीत बुडून मृत्यू",https://www.lokmat.com/akola/akola-religious-bath-in-the-rainy-season-turned-out-to-be-the-last-mother-and-daughter-drowned-in-the-river-while-saving-their-child-a-a571/,2026-06-15T18:42:37+00:00
Mumbai,Lokmat,Mumbai • Lokmat,https://www.lokmat.com/city/,35,"अकोल्यातील आणखी एक भीषण वास्तव; बेडचा दुष्काळ, रुग्ण जमिनीवर झोपलेले",https://www.lokmat.com/akola/another-grim-reality-in-akola-bed-shortage-patients-sleeping-on-the-floor-a-a653/,2026-06-15T18:42:37+00:00
Mumbai,Lokmat,Mumbai • Lokmat,https://www.lokmat.com/city/,36,महाराष्ट्राच्या वीरपुत्राला मरणोत्तर 'कीर्ती चक्र'; प्रोटोकॉल सोडत राष्ट्रपतींनी जवानाच्या मातेला मारली मिठी,https://www.lokmat.com/national/maharashtra-martyr-who-killed-2-terrorists-gets-kirti-chakra-president-hugs-emotional-mother-a-a1001/,2026-06-15T18:42:37+00:00
Mumbai,Lokmat,Mumbai • Lokmat,https://www.lokmat.com/city/,37,"“६० आमदारांच्या संख्याबळावर CM पद मागणे योग्य नाही”; प्रताप सरनाईकांचे विधान, चर्चांना उधाण",https://www.lokmat.com/maharashtra/minister-pratap-sarnaik-said-that-it-is-not-right-to-ask-for-the-cm-post-on-the-strength-of-60-mlas-a-a719/,2026-06-15T18:42:37+00:00
Mumbai,Lokmat,Mumbai • Lokmat,https://www.lokmat.com/city/,38,"एका हातात मूल, पाठीवर ब्रेन स्ट्रोकग्रस्त पती; सरकारी रुग्णालयातील विदारक वास्तव उघड",https://www.lokmat.com/akola/child-in-one-hand-husband-suffering-from-brain-stroke-on-his-back-the-shocking-reality-of-a-government-hospital-is-revealed-a-a1000/,2026-06-15T18:42:37+00:00
Mumbai,Lokmat,Mumbai • Lokmat,https://www.lokmat.com/city/,39,बाळाच्या प्रकृती स्वास्थ्यासाठी कुलदैवताला गेलेल्या बावचे कुटुंबावर अमावास्येच्या दिवशीच घाला,https://www.lokmat.com/solapur/tragedy-strikes-pandharpur-family-8-dead-as-pickup-plunges-into-well-during-pilgrimage-a-a1001/,2026-06-15T18:42:37+00:00
Mumbai,Lokmat,Mumbai • Lokmat,https://www.lokmat.com/city/,40,"देवदर्शन करून परतताना सोलापूरमध्ये भाविकांचा पिकअप विहिरीत कोसळला, ८ ठार",https://www.lokmat.com/solapur/devotees-pickup-falls-into-well-in-solapur-while-returning-after-worshipping-god-8-killed-a-a747/,2026-06-15T18:42:37+00:00
Mumbai,Lokmat,Mumbai • Lokmat,https://www.lokmat.com/city/,41,मोठी बातमी! मंत्री गिरीश महाजनांची शिष्टाई फळाला! तीन दिवसानंतर आमदार रोहित पवारांचे अन्नत्याग आंदोलन मागे,https://www.lokmat.com/solapur/big-news-rohit-pawar-ends-hunger-strike-pandharpur-girish-mahajan-mediation-a-a941/,2026-06-15T18:42:37+00:00
Mumbai,Lokmat,Mumbai • Lokmat,https://www.lokmat.com/city/,42,पंढरपूर अपघातातील मृतांच्या वारसांना मिळणार प्रत्येकी ५ लाख; मुख्यमंत्री फडणवीसांची घोषणा,https://www.lokmat.com/solapur/solapur-accident-heirs-of-those-killed-in-the-pandharpur-accident-will-get-rs-5-lakh-each-cm-fadnavis-announces-a-a941/,2026-06-15T18:42:37+00:00
Mumbai,Lokmat,Mumbai • Lokmat,https://www.lokmat.com/city/,43,"देवदर्शनावरुन परतणाऱ्या भाविकांवर काळाची झडप, गाडीच विहिरीत कोसळली; ९ जणांचा मृत्यू",https://www.lokmat.com/solapur/solapur-accident-time-strikes-on-devotees-returning-from-devdarshan-car-falls-into-well-14-people-die-a-a571/,2026-06-15T18:42:37+00:00
Mumbai,Lokmat,Mumbai • Lokmat,https://www.lokmat.com/city/,44,बांधावर मुरुम टाकल्याच्या रागातून निवृत्त शिक्षकाचा कुऱ्हाडीने खून; आरोपीला पकडले,https://www.lokmat.com/ahilyanagar/ahilyanagar-retired-teacher-hacked-to-death-with-axe-by-neighbor-over-farm-boundary-dispute-accused-arrested-a-a1001/,2026-06-15T18:42:37+00:00
Mumbai,Lokmat,Mumbai • Lokmat,https://www.lokmat.com/city/,45,"भेसळखोरांना मुंढेंची भीती, खवा आणि पनीर महागले; ८० ते १०० रुपये दरवाढ; व्यावसायिकांना कमतरता",https://www.lokmat.com/ahilyanagar/adulterers-fear-the-price-of-khava-and-paneer-price-hiked-by-80-to-100-rupees-shortage-for-traders-a-a653/,2026-06-15T18:42:37+00:00
Mumbai,Lokmat,Mumbai • Lokmat,https://www.lokmat.com/city/,46,साईनगरीत भक्तांच्या श्रद्धेशी खेळ! विक्रेत्यांकडे दगडासारखे कडक आणि बुरशी लागलेले पेढे,https://www.lokmat.com/ahilyanagar/fda-raids-sweet-shops-in-shirdi-for-selling-fungus-laced-pedas-to-sai-devotees-a-a1001/,2026-06-15T18:42:37+00:00
Mumbai,Lokmat,Mumbai • Lokmat,https://www.lokmat.com/city/,47,गर्भलिंग निदान प्रकरणी मेडिकल चालकाला अटक; कारही जप्त,https://www.lokmat.com/ahilyanagar/medical-driver-arrested-in-fetal-gender-detection-case-car-also-seized-a-a653/,2026-06-15T18:42:37+00:00
Mumbai,Lokmat,Mumbai • Lokmat,https://www.lokmat.com/city/,48,कारखान्याचा जीएसटी हॉटेलच्या नावावर! अधिकाऱ्याने युजर आयडी वापरून ३.८७ कोटी केले गायब,https://www.lokmat.com/ahilyanagar/ahilyanagar-gst-fraud-retired-assistant-commissioner-booked-for-387-crore-embezzlement-using-official-user-id-a-a1001/,2026-06-15T18:42:37+00:00
Mumbai,Lokmat,Mumbai • Lokmat,https://www.lokmat.com/city/,49,जिद्दीसमोर गरिबी हरली : दोन भावांनी औत ओढत चार एकर जमीन कसली; आर्थिक संकटात सापडले पण...,https://www.lokmat.com/jalgaon/poverty-defeated-by-stubbornness-two-brothers-cultivated-four-acres-of-land-by-pulling-ropes-they-found-themselves-in-financial-trouble-but-a-a653/,2026-06-15T18:42:37+00:00
