city,publisher,source,source_url,rank,headline,link,collected_at_iso
Delhi-NCR,Jagran,Delhi-NCR • Jagran,https://www.jagran.com/delhi-ncr,33,U-20 नेशनल फुटबॉल में क्यों गई हरियाणा की टीम? एडहॉक कमेटी और चुनाव के फेर में फंसा खिलाड़ियों का भविष्य,https://www.jagran.com/haryana/gurgaon-haryana-football-team-misses-u20-national-competition-40234835.html,2026-05-11T12:42:24+00:00
Delhi-NCR,Jagran,Delhi-NCR • Jagran,https://www.jagran.com/delhi-ncr,34,"हरियाणा में पटवारियों की नियुक्ति में बड़ी रुकावट हटी, अब दोबारा मेडिकल कराने की जरूरत नहीं; आदेश जारी",https://www.jagran.com/haryana/gurgaon-121-patwari-appointments-medical-certificate-issue-resolved-in-haryana-40234834.html,2026-05-11T12:42:24+00:00
Delhi-NCR,Jagran,Delhi-NCR • Jagran,https://www.jagran.com/delhi-ncr,35,"नोएडा में खूंखार हुए आवारा कुत्ते... मौसम और 'कोर्टिसोल' हार्मोन का असर, 4 महीने में 61 हजार से ज्यादा लोगों पर किया हमला",https://www.jagran.com/uttar-pradesh/noida-noida-dog-attacks-soar-stray-dogs-more-aggressive-in-2026-40235421.html,2026-05-11T12:42:24+00:00
Delhi-NCR,Jagran,Delhi-NCR • Jagran,https://www.jagran.com/delhi-ncr,36,"मां ने किडनी देकर जिगर के टुकड़े को दी जिंदगी, मदर्स-डे पर पेश की ममता की मिसाल",https://www.jagran.com/uttar-pradesh/noida-mothers-day-miracle-noida-mom-donates-kidney-to-son-despite-mismatch-40235370.html,2026-05-11T12:42:24+00:00
Delhi-NCR,Jagran,Delhi-NCR • Jagran,https://www.jagran.com/delhi-ncr,37,"पलक झपकते ही उड़ा देते थे बाइक, नोएडा में गिरोह का हुआ फर्दाफाश; पुलिस के हत्थे चढ़े चार शातिर",https://www.jagran.com/uttar-pradesh/noida-noida-police-arrests-4member-bike-theft-gang-recovers-6-bikes-40235348.html,2026-05-11T12:42:24+00:00
Delhi-NCR,Jagran,Delhi-NCR • Jagran,https://www.jagran.com/delhi-ncr,38,ट्रैफिक नियम तोड़े तो खैर नहीं! नोएडा पुलिस का बड़ा एक्शन; एक दिन में काटे 5 हजार से ज्यादा चालान,https://www.jagran.com/uttar-pradesh/noida-noida-traffic-challans-22-for-pressure-horns-5651-total-fines-40235331.html,2026-05-11T12:42:24+00:00
Delhi-NCR,Jagran,Delhi-NCR • Jagran,https://www.jagran.com/delhi-ncr,39,"हाईराइज सोसायटियों में 'जीरो बिजली बिल' सपना, नहीं लगवा सकते हैं सोलर; मालिकाना हक के नियम ने फंसाया पेंच",https://www.jagran.com/uttar-pradesh/noida-pm-surya-ghar-yojana-highrise-residents-face-solar-panel-hurdle-40235069.html,2026-05-11T12:42:24+00:00
Delhi-NCR,Jagran,Delhi-NCR • Jagran,https://www.jagran.com/delhi-ncr,40,"PM मोदी की अपील पर दिल्ली की CM रेखा गुप्ता की सलाह, 'पेट्रोल-डीजल बचाओ, मेट्रो, बस और कारपूलिंग से करें सफर'",https://www.jagran.com/delhi/new-delhi-city-delhi-cm-rekha-gupta-urges-public-transport-carpooling-for-fuel-saving-40235393.html,2026-05-11T12:42:24+00:00
Delhi-NCR,Jagran,Delhi-NCR • Jagran,https://www.jagran.com/delhi-ncr,41,"मंगोलपुरी RUB की 17 मई तक होगी मरम्मत, दिल्ली ट्रैफिक पुलिस ने बताया किन रास्तों से करें यात्रा",https://www.jagran.com/delhi/new-delhi-city-mangolpuri-rub-repair-delhi-traffic-diversion-alternate-routes-40235356.html,2026-05-11T12:42:24+00:00
Delhi-NCR,Jagran,Delhi-NCR • Jagran,https://www.jagran.com/delhi-ncr,42,"दिल्ली पुलिस ने OPPO, OnePlus और Realme के नकली मोबाइल बेचने वालों का किया पर्दाफाश, 2 गोदाम और 1 फैक्ट्री सीज",https://www.jagran.com/delhi/new-delhi-city-delhi-police-busts-fake-oppo-realme-oneplus-mobile-racket-40235303.html,2026-05-11T12:42:24+00:00
Delhi-NCR,Jagran,Delhi-NCR • Jagran,https://www.jagran.com/delhi-ncr,43,"फरीदाबाद के सरकारी स्कूलों में पेयजल संकट... कहीं टीडीएस 500 के पार तो कहीं 35, बच्चों की सेहत से खिलवाड़",https://www.jagran.com/haryana/faridabad-faridabad-schools-contaminated-water-puts-students-health-at-risk-40235446.html,2026-05-11T12:42:24+00:00
Delhi-NCR,Jagran,Delhi-NCR • Jagran,https://www.jagran.com/delhi-ncr,44,"फरीदाबाद के किसानों पर मौसम की दोहरी मार, गेहूं के बाद अब बारिश ने छीना 'सफेद सोना'",https://www.jagran.com/haryana/faridabad-faridabad-cotton-crop-hit-by-rain-acreage-drastically-down-40235377.html,2026-05-11T12:42:24+00:00
Delhi-NCR,Jagran,Delhi-NCR • Jagran,https://www.jagran.com/delhi-ncr,45,"फरीदाबाद: कम वेतन मिलने पर फूटा कर्मचारियों का गुस्सा, कंपनी के गेट पर जोरदार प्रदर्शन; ये हैं प्रमुख मांगें",https://www.jagran.com/haryana/faridabad-faridabad-factory-workers-protest-low-wages-demand-hike-40235049.html,2026-05-11T12:42:24+00:00
Delhi-NCR,Jagran,Delhi-NCR • Jagran,https://www.jagran.com/delhi-ncr,46,"फरीदाबाद में कपास की खेती पर फिरा पानी, लक्ष्य से दूर रह गई बुवाई; क्या अब धान से भरेगी किसानों की जेब?",https://www.jagran.com/haryana/faridabad-faridabad-farmers-struggle-with-cotton-planting-due-to-weather-40235008.html,2026-05-11T12:42:24+00:00
Delhi-NCR,Jagran,Delhi-NCR • Jagran,https://www.jagran.com/delhi-ncr,47,"पलवल में 17 मई से शुरू होगी 84 कोस की बृज परिक्रमा, उपायुक्त ने अधिकारियों संग लिया तैयारियों का जायजा",https://www.jagran.com/haryana/palwal-palwal-dc-reviews-84-kosi-braj-parikrama-preparations-40234809.html,2026-05-11T12:42:24+00:00
Delhi-NCR,Jagran,Delhi-NCR • Jagran,https://www.jagran.com/delhi-ncr,48,पलवल में 6.28 करोड़ के विकास कार्य: टूटी सड़कों और जलभराव से मिलेगी राहत,https://www.jagran.com/haryana/palwal-palwal-development-628-cr-projects-for-roads-drainage-40234808.html,2026-05-11T12:42:24+00:00
Delhi-NCR,Jagran,Delhi-NCR • Jagran,https://www.jagran.com/delhi-ncr,49,"पलवल में राष्ट्रीय लोक अदालत में 508 केसों का हुआ निपटारा, 4 करोड़ 31 लाख रुपये की हुई सेटलमेंट",https://www.jagran.com/haryana/palwal-palwal-lok-adalat-settles-508-cases-431-crore-settlement-40233665.html,2026-05-11T12:42:24+00:00
Delhi-NCR,Jagran,Delhi-NCR • Jagran,https://www.jagran.com/delhi-ncr,50,"पलवल: 3 साल में ही जर्जर हो गई करोड़ों रुपये से बनी सड़क, जगह-जगह हुए गहरे गड्ढे; हादसों का खतरा बढ़ा",https://www.jagran.com/haryana/palwal-khambighaseda-road-deteriorates-in-3-years-potholes-wreak-havoc-40233314.html,2026-05-11T12:42:24+00:00
Delhi-NCR,Jagran,Delhi-NCR • Jagran,https://www.jagran.com/delhi-ncr,51,"पलवल में 5 करोड़ की एलईडी स्ट्रीट लाइट परियोजना का शुभारंभ, शहर होगा रोशन और सुरक्षित",https://www.jagran.com/haryana/palwal-palwal-shines-5-cr-led-street-lights-inaugurated-by-gurjar-40232623.html,2026-05-11T12:42:24+00:00
Delhi-NCR,Jagran,Delhi-NCR • Jagran,https://www.jagran.com/delhi-ncr,52,"पीएम के एक साल सोना न खरीदों के बयान पर भड़के सराफा व्यापारी, सुलतानपुर में दुकानें बंद कर जताया विरोध",https://www.jagran.com/uttar-pradesh/sultanpur-sultanpur-jewelers-protest-pm-modi-gold-purchase-call-40235484.html,2026-05-11T12:42:24+00:00
Delhi-NCR,Jagran,Delhi-NCR • Jagran,https://www.jagran.com/delhi-ncr,53,"डरें नहीं, अपने काम पर लौटें... गांव से हटेंगी शराब की दुकानें, DM-SP ने दिया निर्दोषों को बड़ा भरोसा, महिलाओं की हुई जीत",https://www.jagran.com/uttar-pradesh/pilibhit-pilibhit-bundi-bhuda-liquor-shop-protest-dm-sp-assurance-no-action-innocents-40235360.html,2026-05-11T12:42:24+00:00
Delhi-NCR,Jagran,Delhi-NCR • Jagran,https://www.jagran.com/delhi-ncr,54,"सिद्धार्थनगर में 22 मई से 20 जून तक प्रगणक घर-घर जाकर करेंगे जनगणना, 21 तक कर सकेंगे स्वगणना",https://www.jagran.com/uttar-pradesh/sidharth-nagar-siddharthnagar-census-2027-self-enumeration-and-enumerator-drive-40235472.html,2026-05-11T12:42:24+00:00
Delhi-NCR,Jagran,Delhi-NCR • Jagran,https://www.jagran.com/delhi-ncr,55,कमजोर की सजा सिर्फ मौत! पीलीभीत टाइगर रिजर्व में बाघों का ऐसा खौफ कि घर छोड़ने को मजबूर हुए तेंदुए,https://www.jagran.com/uttar-pradesh/pilibhit-pilibhit-tiger-reserve-leopard-attacks-human-wildlife-conflict-rise-40235354.html,2026-05-11T12:42:24+00:00
Delhi-NCR,Jagran,Delhi-NCR • Jagran,https://www.jagran.com/delhi-ncr,56,"Jewar Airport से Ganga Expressway को जोड़ेने वाले लिंक एक्सप्रेसवे की भूमि का बढ़े सर्किल रेट, किसानों ने उठाई मांग",https://www.jagran.com/uttar-pradesh/bulandshahr-ganga-expressway-bku-demand-to-increase-circle-rates-for-land-acquired-for-jewar-link-airport-expressway-40235454.html,2026-05-11T12:42:24+00:00
Delhi-NCR,Jagran,Delhi-NCR • Jagran,https://www.jagran.com/delhi-ncr,57,"प्रयागराज में कातिलों ने युवक की बेरहमी से की हत्या, घर के निकट खेत में मिला शव, चेहरे पर चोट के निशान",https://www.jagran.com/uttar-pradesh/prayagraj-prayagraj-youth-murder-dead-body-found-in-field-police-investigation-40235464.html,2026-05-11T12:42:24+00:00
Delhi-NCR,Jagran,Delhi-NCR • Jagran,https://www.jagran.com/delhi-ncr,58,आगरा-लखनऊ एक्सप्रेसवे पर खड़ी कार को मिनी ट्रक ने मारी टक्कर,https://www.jagran.com/uttar-pradesh/kannauj-kannauj-expressway-crash-family-of-5-injured-as-mini-truck-hits-car-40235075.html,2026-05-11T12:42:24+00:00
Delhi-NCR,Jagran,Delhi-NCR • Jagran,https://www.jagran.com/delhi-ncr,59,"सोमनाथ मंदिर में पीएम मोदी, 11 तीर्थों के पवित्र जल से किया",https://www.jagran.com/news/national-pm-modis-somnath-visit-roadshow-puja-amrit-mahotsav-40235006.html,2026-05-11T12:42:24+00:00
Delhi-NCR,Jagran,Delhi-NCR • Jagran,https://www.jagran.com/delhi-ncr,60,PSEB 10th Result 2026 OUT: जारी हुआ पंजाब बोर्ड 10वीं का रिज,https://www.jagran.com/news/education-pseb-10th-result-2026-punjab-board-10th-result-released-on-psebacin-download-marksheet-by-roll-number-40234930.html,2026-05-11T12:42:24+00:00
Delhi-NCR,Jagran,Delhi-NCR • Jagran,https://www.jagran.com/delhi-ncr,61,"आरओ से अलग नई सोच, बच्चों ने बनाया ऐसा वॉटर प्यूरीफायर जो गा",https://www.jagran.com/punjab/amritsar-innovative-water-purifier-with-sound-ro-technique-failed-amritsar-dav-international-students-40235067.html,2026-05-11T12:42:24+00:00
Delhi-NCR,Jagran,Delhi-NCR • Jagran,https://www.jagran.com/delhi-ncr,62,Stock Market Today Live: ईरान-यूएस तनाव बढ़ने से औंधे मुंह ग,https://www.jagran.com/business/share-market-share-market-today-11th-may-sensex-nifty-live-updates-stocks-to-watch-us-rejects-iran-proposal-lb-30000522.html,2026-05-11T12:42:24+00:00
Delhi-NCR,Jagran,Delhi-NCR • Jagran,https://www.jagran.com/delhi-ncr,63,"मध्य पूर्व युद्ध का भारत की अर्थव्यवस्था पर क्या पड़ेगा असर,",https://www.jagran.com/business/biz-india-economy-growth-sbi-predicts-66-by-fy27-amid-crises-40235073.html,2026-05-11T12:42:24+00:00
Delhi-NCR,Jagran,Delhi-NCR • Jagran,https://www.jagran.com/delhi-ncr,64,बिहार में मंत्रालय का नया स्वरूप : पथ निर्माण विभाग को चार ज,https://www.jagran.com/bihar/bhagalpur-bihar-road-minister-shailendra-to-review-roads-divide-dept-into-4-zones-40235065.html,2026-05-11T12:42:24+00:00
Delhi-NCR,Jagran,Delhi-NCR • Jagran,https://www.jagran.com/delhi-ncr,65,"रेलवे की परियोजनाओं को मिलेगी नई रफ्तार, 'डेडिकेटेड आफिस' से",https://www.jagran.com/uttar-pradesh/prayagraj-railways-to-set-up-dedicated-offices-for-project-monitoring-in-prayagraj-40235070.html,2026-05-11T12:42:24+00:00
Delhi-NCR,Jagran,Delhi-NCR • Jagran,https://www.jagran.com/delhi-ncr,66,"हरियाणा के कैथल में 3 फीट के दूल्हे को मिली 3 फीट की दुल्हन,",https://www.jagran.com/haryana/kaithal-a-3-foot-tall-groom-found-a-3-foot-tall-bride-he-arrived-riding-a-bullet-motorcycle-to-fetch-her-in-kaithal-40235058.html,2026-05-11T12:42:24+00:00
Delhi-NCR,Jagran,Delhi-NCR • Jagran,https://www.jagran.com/delhi-ncr,67,Vijay के सीएम बनते ही तृषा ने कर दिया प्यार का इजहार! एक्ट्रेस की पोस्ट ने मचा दी खलबली,https://www.jagran.com/entertainment/bollywood-trisha-krishnan-express-her-love-after-thalapathy-vijay-becomes-cm-of-tamilnadu-40235134.html,2026-05-11T12:42:24+00:00
Delhi-NCR,Jagran,Delhi-NCR • Jagran,https://www.jagran.com/delhi-ncr,68,"90s की टॉप हीरोइन, तीन बार टूटी शादी; लोगों ने एक्ट्रेस पर मढ़ा तलाक का दोष, बोलीं- 'मैं तो शराब...'",https://www.jagran.com/entertainment/bollywood-shahid-kapoor-mother-neelima-azeem-reacts-on-criticism-for-her-three-failed-marriages-40235118.html,2026-05-11T12:42:24+00:00
Delhi-NCR,Jagran,Delhi-NCR • Jagran,https://www.jagran.com/delhi-ncr,69,"IRCTC Tour Package: चिलचिलाती गर्मी में बर्फ का मजा, इतने रुपये में बुक करें शिमला-मनाली का ये टूर पैकेज",https://www.jagran.com/business/biz-irctc-shimla-manali-tour-package-8-days-himachal-getaway-40235278.html,2026-05-11T12:42:24+00:00
Delhi-NCR,Jagran,Delhi-NCR • Jagran,https://www.jagran.com/delhi-ncr,70,"'वे हमारा सहयोग नहीं कर रहे…', IPL टीम मालिकों को BCCI की चेतावनी; अगली बार नहीं बख्शा जाएगा",https://www.jagran.com/cricket/apni-baat-bcci-warning-ipl-team-owners-not-cooperating-next-time-no-mercy-on-breaching-code-of-conduct-40235381.html,2026-05-11T12:42:24+00:00
Delhi-NCR,Jagran,Delhi-NCR • Jagran,https://www.jagran.com/delhi-ncr,71,Did You Know,https://www.jagran.com/did-you-know-news-hindi.html,2026-05-11T12:42:24+00:00
Delhi-NCR,Jagran,Delhi-NCR • Jagran,https://www.jagran.com/delhi-ncr,72,मिडिल ईस्ट संकट,https://www.jagran.com/topics/Israel-Iran-Conflict,2026-05-11T12:42:24+00:00
Delhi-NCR,Jagran,Delhi-NCR • Jagran,https://www.jagran.com/delhi-ncr,73,विधानसभा चुनाव परिणाम 2026,https://www.jagran.com/topics/assembly-election-2026,2026-05-11T12:42:24+00:00
Delhi-NCR,Jagran,Delhi-NCR • Jagran,https://www.jagran.com/delhi-ncr,74,Submit your news,https://www.jagran.com/citizen-journalism-hindi.html,2026-05-11T12:42:24+00:00
Delhi-NCR,Jagran,Delhi-NCR • Jagran,https://www.jagran.com/delhi-ncr,75,Message from the Editor,https://www.jagran.com/policies-and-standards.html,2026-05-11T12:42:24+00:00
Hyderabad,DC,Hyderabad • DC,https://www.deccanchronicle.com/location/india/southern-states,1,Assembly Elections 2026,https://www.deccanchronicle.com/assembly-elections-2026,2026-05-11T12:42:24+00:00
Hyderabad,DC,Hyderabad • DC,https://www.deccanchronicle.com/location/india/southern-states,2,Opinion and Editorials,https://www.deccanchronicle.com/opinion,2026-05-11T12:42:24+00:00
Hyderabad,DC,Hyderabad • DC,https://www.deccanchronicle.com/location/india/southern-states,3,Telangana Rising 2047,https://www.deccanchronicle.com/tags/Telangana-Rising-2047,2026-05-11T12:42:24+00:00
Chennai,DC,Chennai • DC,https://www.deccanchronicle.com/location/india/tamil-nadu/chennai-madras,1,Assembly Elections 2026,https://www.deccanchronicle.com/assembly-elections-2026,2026-05-11T12:42:24+00:00
Chennai,DC,Chennai • DC,https://www.deccanchronicle.com/location/india/tamil-nadu/chennai-madras,2,Opinion and Editorials,https://www.deccanchronicle.com/opinion,2026-05-11T12:42:24+00:00
Chennai,DC,Chennai • DC,https://www.deccanchronicle.com/location/india/tamil-nadu/chennai-madras,3,Telangana Rising 2047,https://www.deccanchronicle.com/tags/Telangana-Rising-2047,2026-05-11T12:42:24+00:00
Chennai,The Hindu,Chennai • The Hindu,https://www.thehindu.com/news/cities/chennai/,1,"CREDAI Tamil Nadu calls for transparent governance, faster urban development",https://www.thehindu.com/news/national/tamil-nadu/credai-tamil-nadu-calls-for-transparent-governance-faster-urban-development/article70962555.ece,2026-05-11T12:42:24+00:00
Chennai,The Hindu,Chennai • The Hindu,https://www.thehindu.com/news/cities/chennai/,2,Swearing-in ceremony broadcast live in 23 areas,https://www.thehindu.com/news/cities/chennai/swearing-in-ceremony-broadcast-live-in-23-areas/article70963152.ece,2026-05-11T12:42:24+00:00
Chennai,The Hindu,Chennai • The Hindu,https://www.thehindu.com/news/cities/chennai/,3,Webinar on allied health and nursing to be held on May 11,https://www.thehindu.com/news/cities/chennai/webinar-on-allied-health-and-nursing-to-be-held-on-may-11/article70962252.ece,2026-05-11T12:42:24+00:00
Chennai,The Hindu,Chennai • The Hindu,https://www.thehindu.com/news/cities/chennai/,4,"Subsidy for power supply to domestic consumers to cross ₹10,000-crore mark",https://www.thehindu.com/news/cities/chennai/subsidy-for-power-supply-to-domestic-consumers-to-cross-10000-croremark/article70962501.ece,2026-05-11T12:42:24+00:00
Chennai,The Hindu,Chennai • The Hindu,https://www.thehindu.com/news/cities/chennai/,5,CMRL’s tunnelling work from Perambur Barracks to Purasawalkam delayed,https://www.thehindu.com/news/cities/chennai/cmrls-tunnelling-work-from-perambur-barracks-to-purasawalkam-delayed/article70962615.ece,2026-05-11T12:42:24+00:00
Chennai,The Hindu,Chennai • The Hindu,https://www.thehindu.com/news/cities/chennai/,6,Messages from OMCs stating IT statuscause confusion among LPG consumers,https://www.thehindu.com/news/cities/chennai/messages-from-omcs-stating-it-statuscause-confusion-among-lpg-consumers/article70962893.ece,2026-05-11T12:42:24+00:00
Chennai,The Hindu,Chennai • The Hindu,https://www.thehindu.com/news/cities/chennai/,7,No idlis in Amma Canteens: services hit owing to shortage in cooking gas across city,https://www.thehindu.com/news/cities/chennai/no-idlis-in-amma-canteens-services-hit-owing-to-shortage-in-cooking-gas-across-city/article70963059.ece,2026-05-11T12:42:24+00:00
Chennai,The Hindu,Chennai • The Hindu,https://www.thehindu.com/news/cities/chennai/,8,Chief Minister C. Joseph Vijay chairs meeting to take stock of law and order,https://www.thehindu.com/news/national/tamil-nadu/chief-minister-c-joseph-vijay-chairs-meeting-to-take-stock-of-law-and-order/article70962449.ece,2026-05-11T12:42:24+00:00
Chennai,The Hindu,Chennai • The Hindu,https://www.thehindu.com/news/cities/chennai/,9,Migratory birds read invisible maps,https://www.thehindu.com/news/cities/chennai/migratory-birds-read-invisible-maps/article70960474.ece,2026-05-11T12:42:24+00:00
Chennai,The Hindu,Chennai • The Hindu,https://www.thehindu.com/news/cities/chennai/,10,Thirst aids for strays,https://www.thehindu.com/news/cities/chennai/thirst-aids-for-strays/article70958147.ece,2026-05-11T12:42:24+00:00
Chennai,The Hindu,Chennai • The Hindu,https://www.thehindu.com/news/cities/chennai/,11,Sarala’s Art Centre is selling decades-old artworks from its archives,https://www.thehindu.com/entertainment/art/saralas-art-centre-is-selling-decades-old-artworks-from-its-archives/article70950701.ece,2026-05-11T12:42:24+00:00
Chennai,The Hindu,Chennai • The Hindu,https://www.thehindu.com/news/cities/chennai/,12,Adding to the distress of the bereaved,https://www.thehindu.com/news/cities/chennai/adding-to-the-distress-of-the-bereaved/article70964933.ece,2026-05-11T12:42:24+00:00
Chennai,The Hindu,Chennai • The Hindu,https://www.thehindu.com/news/cities/chennai/,13,Garbage dump fire chokes residential zone in Perumbakkam,https://www.thehindu.com/news/cities/chennai/garbage-dumpfire-chokes-residential-zone-in-perumbakkam/article70934260.ece,2026-05-11T12:42:24+00:00
Chennai,The Hindu,Chennai • The Hindu,https://www.thehindu.com/news/cities/chennai/,14,"Passenger from Sharjah detained after he opens emergency exit door, runs on tarmac after landing",https://www.thehindu.com/news/cities/chennai/passenger-arriving-from-sharjah-opens-emergency-door-held/article70934557.ece,2026-05-11T12:42:24+00:00
Chennai,The Hindu,Chennai • The Hindu,https://www.thehindu.com/news/cities/chennai/,15,Chennai Metro Rail starts tunnelling at Villivakkam under railway tracks for Phase II project,https://www.thehindu.com/news/cities/chennai/cmrl-starts-tunnelling-at-villivakkam-under-railway-tracks-for-phase-ii-project/article70931745.ece,2026-05-11T12:42:24+00:00
Chennai,The Hindu,Chennai • The Hindu,https://www.thehindu.com/news/cities/chennai/,16,Chug down the Madras of 1856 at this mini train exhibition,https://www.thehindu.com/news/cities/chennai/chug-down-the-madras-of-1856-at-this-mini-train-exhibition/article70931974.ece,2026-05-11T12:42:24+00:00
Chennai,The Hindu,Chennai • The Hindu,https://www.thehindu.com/news/cities/chennai/,17,‘29’ movie review: Rathna Kumar’s romance drama has its heart in the right place,https://www.thehindu.com/entertainment/movies/29-the-film-movie-review-rathna-kumar-vidhu-preethi-asrani-sean-roldan/article70955470.ece,2026-05-11T12:42:24+00:00
Chennai,The Hindu,Chennai • The Hindu,https://www.thehindu.com/news/cities/chennai/,18,"Vijay’s TN poll win, ‘Mortal Kombat II’ review",https://www.thehindu.com/newsletter/vijay-tn-elections-first-day-first-show-newsletter-mortal-kombat-ii-movie-review-peddi-patriot-mohanlal/article70954483.ece,2026-05-11T12:42:24+00:00
Chennai,The Hindu,Chennai • The Hindu,https://www.thehindu.com/news/cities/chennai/,19,Vijay’s blockbuster opening: How cinema powered the superstar’s rise in Tamil Nadu politics,https://www.thehindu.com/entertainment/movies/vijay-tvk-tamilaga-vettri-kazhagam-jana-nayagan-tn-elections-tamil-cinema/article70942697.ece,2026-05-11T12:42:24+00:00
Chennai,The Hindu,Chennai • The Hindu,https://www.thehindu.com/news/cities/chennai/,20,Tamil Nadu swearing-in ceremony LIVE: C. Joseph Vijay promises 'a new beginning' after taking oath as CM,https://www.thehindu.com/elections/tamil-nadu-assembly/tamil-nadu-government-formation-tvk-swearing-in-vijay-oath-ceremony-new-chief-minister-live-updates-may-10-2026/article70960233.ece,2026-05-11T12:42:24+00:00
