city,publisher,source,source_url,rank,headline,link,collected_at_iso
Delhi-NCR,Jagran,Delhi-NCR • Jagran,https://www.jagran.com/delhi-ncr,27,लोनी में एसीपी ऑफिस के सामने सड़क पर तैरता मिला युवक का शव,https://www.jagran.com/uttar-pradesh/ghaziabad-body-found-floating-near-loni-acp-office-ghaziabad-40300740.html,2026-07-09T18:01:37+00:00
Delhi-NCR,Jagran,Delhi-NCR • Jagran,https://www.jagran.com/delhi-ncr,28,"गाजियाबाद पुलिस में बड़ा फेरबदल, 7 ACP के बदले कार्यक्षेत्र; जानें किसे मिली कौन सी जिम्मेदारी?",https://www.jagran.com/uttar-pradesh/ghaziabad-ghaziabad-police-reshuffle-7-acps-transferred-new-roles-40300736.html,2026-07-09T18:01:37+00:00
Delhi-NCR,Jagran,Delhi-NCR • Jagran,https://www.jagran.com/delhi-ncr,29,"'कार्रवाई की तो तेरा भी ओमकार जैसा होगा हाल', डेयरी संचालक की हत्या के बाद अब बड़े भाई को मिली जान से मारने की धमकी",https://www.jagran.com/uttar-pradesh/ghaziabad-loni-dairy-owner-murder-brother-threatened-after-omkars-death-40300724.html,2026-07-09T18:01:37+00:00
Delhi-NCR,Jagran,Delhi-NCR • Jagran,https://www.jagran.com/delhi-ncr,30,"गाजियाबाद में गली में भरे पानी में फिसला पैर, 3 साल की बच्ची की डूबकर मौत; गुस्साए लोगों ने एनएच-9 पर लगाया जाम",https://www.jagran.com/uttar-pradesh/ghaziabad-ghaziabad-3yearold-drowns-in-rainwater-at-home-40300485.html,2026-07-09T18:01:37+00:00
Delhi-NCR,Jagran,Delhi-NCR • Jagran,https://www.jagran.com/delhi-ncr,31,"गुरुग्राम में 10000 करोड़ की रिहायशी परियोजना पर हाईकोर्ट की रोक, नई बुकिंग पर फिलहाल प्रतिबंध",https://www.jagran.com/haryana/gurgaon-high-court-stays-new-bookings-at-oberoi-360-north-gurugram-40300389.html,2026-07-09T18:01:37+00:00
Delhi-NCR,Jagran,Delhi-NCR • Jagran,https://www.jagran.com/delhi-ncr,32,"सोहना पहाड़ी कंकाल केस: गला दबाकर की गई थी हत्या, DNA और कपड़ों से होगी पहचान; मिसिंग रिपोर्ट खंगाल रही पुलिस",https://www.jagran.com/haryana/gurgaon-sohna-hill-skeleton-case-murder-by-strangulation-confirmed-40300227.html,2026-07-09T18:01:37+00:00
Delhi-NCR,Jagran,Delhi-NCR • Jagran,https://www.jagran.com/delhi-ncr,33,"गुरुग्राम में रिहायशी प्लॉट में दुकान-सैलून चलाने वाले सावधान! डीएलएफ में सीलिंग की तैयारी, थमाया गया नोटिस",https://www.jagran.com/haryana/gurgaon-dlf-gurugram-sealing-notices-issued-for-illegal-commercial-use-40300220.html,2026-07-09T18:01:37+00:00
Delhi-NCR,Jagran,Delhi-NCR • Jagran,https://www.jagran.com/delhi-ncr,34,"NHAI ने पहले किए होते इंतजाम तो न डूबता दिल्ली-जयपुर हाईवे, 3 दिन की बारिश ने खोली पोल; 10 साल से लोग परेशान",https://www.jagran.com/haryana/gurgaon-delhi-jaipur-highway-waterlogging-exposes-nhai-failure-after-rain-40300120.html,2026-07-09T18:01:37+00:00
Delhi-NCR,Jagran,Delhi-NCR • Jagran,https://www.jagran.com/delhi-ncr,35,"गुरुग्राम नगर निगम का बड़ा फैसला, पानी-सीवरेज की सभी सेवाएं हुईं डिजिटल; घर बैठे मिलेंगे नए कनेक्शन",https://www.jagran.com/haryana/gurgaon-gurugram-digitizes-water-management-smart-meters-gis-40299853.html,2026-07-09T18:01:37+00:00
Delhi-NCR,Jagran,Delhi-NCR • Jagran,https://www.jagran.com/delhi-ncr,36,"गंगा लिंक एक्सप्रेसवे को यमुना एक्सप्रेसवे से जोड़ने की तैयारी तेज, खरीदी गई 60% जमीन; जानें YEIDA-UPEIDA का पूरा प्लान",https://www.jagran.com/uttar-pradesh/noida-jewar-airport-to-ganga-expressway-link-60-land-acquired-40300812.html,2026-07-09T18:01:37+00:00
Delhi-NCR,Jagran,Delhi-NCR • Jagran,https://www.jagran.com/delhi-ncr,37,"नोएडा बना 'तालाब सिटी', बारिश की पहली परीक्षा में प्राधिकरण 'फेल'; लो-लाइंग एरिया डूबे और हाइटेक वाले हैरान",https://www.jagran.com/uttar-pradesh/noida-noida-waterlogging-authority-fails-first-monsoon-test-city-submerged-40300412.html,2026-07-09T18:01:37+00:00
Delhi-NCR,Jagran,Delhi-NCR • Jagran,https://www.jagran.com/delhi-ncr,38,"'हाईटेक' नोएडा का बुरा हाल! आफत की बारिश से सड़कें बनीं तालाब, जलभराव से थमी वाहनों की रफ्तार",https://www.jagran.com/uttar-pradesh/noida-noida-rains-waterlogging-power-outages-expose-poor-civic-infra-40300275.html,2026-07-09T18:01:37+00:00
Delhi-NCR,Jagran,Delhi-NCR • Jagran,https://www.jagran.com/delhi-ncr,39,"चाय की चुस्की से कीमो और सर्जरी के बाद रिकवरी होगी फास्ट, एमिटी नोएडा की प्रोफसर ने बनाई विशेष Herbal Tea",https://www.jagran.com/uttar-pradesh/noida-amity-develops-special-herbal-tea-for-postsurgery-recovery-40300166.html,2026-07-09T18:01:37+00:00
Delhi-NCR,Jagran,Delhi-NCR • Jagran,https://www.jagran.com/delhi-ncr,40,"स्कूटी ट्रेनर निकला बाइक चोर गिरोह का सरगना, नोएडा पुलिस ने दबोचे दो आरोपी; 10 बाइक बरामद",https://www.jagran.com/uttar-pradesh/noida-noida-bike-theft-gang-busted-trainer-accomplice-arrested-40300126.html,2026-07-09T18:01:37+00:00
Delhi-NCR,Jagran,Delhi-NCR • Jagran,https://www.jagran.com/delhi-ncr,41,"फरीदाबाद में 2 एक्सप्रेसवे को जोड़ने वाली मोहना रोड में भ्रष्टाचार, 66 फुट की सड़क नहीं बनाई; ACB से शिकायत",https://www.jagran.com/haryana/faridabad-mohana-road-cracks-acb-probe-sought-over-poor-construction-40300177.html,2026-07-09T18:01:37+00:00
Delhi-NCR,Jagran,Delhi-NCR • Jagran,https://www.jagran.com/delhi-ncr,42,"फरीदाबाद में प्रॉपर्टी टैक्स भरने वालों को बड़ी राहत, 31 अगस्त तक जमा करने पर ब्याज में मिलेगी 75% छूट",https://www.jagran.com/haryana/faridabad-faridabad-property-tax-interest-waiver-extended-to-aug-31-40300174.html,2026-07-09T18:01:37+00:00
Delhi-NCR,Jagran,Delhi-NCR • Jagran,https://www.jagran.com/delhi-ncr,43,"10 महीने से जिसकी हत्या के लिए काट रहे थे जेल, वो शव किसी और का निकला; सवालों में फरीदाबाद पुलिस की जांच",https://www.jagran.com/haryana/faridabad-faridabad-murder-case-dna-twist-frees-accused-after-10-months-40300031.html,2026-07-09T18:01:37+00:00
Delhi-NCR,Jagran,Delhi-NCR • Jagran,https://www.jagran.com/delhi-ncr,44,"फरीदाबाद में भारी बारिश से पुराना खेड़ी पुल धंसा, रास्ता पूरी तरह बंद; नगला एंक्लेव में बड़ा हादसा टला",https://www.jagran.com/haryana/faridabad-faridabad-old-khedi-bridge-collapses-due-to-rain-traffic-halted-40300049.html,2026-07-09T18:01:37+00:00
Delhi-NCR,Jagran,Delhi-NCR • Jagran,https://www.jagran.com/delhi-ncr,45,"PHOTOS: पलवल में आफत की बारिश! 3 घंटे में डूबा शहर, 29 करोड़ के नाले फेल; 'दो करोड़' पानी में बहे",https://www.jagran.com/haryana/palwal-palwal-weather-floods-heavy-rain-exposes-failed-drainage-system-40300387.html,2026-07-09T18:01:37+00:00
Delhi-NCR,Jagran,Delhi-NCR • Jagran,https://www.jagran.com/delhi-ncr,46,"आरटीओ का अधिकारी बनकर गोशाला की गाड़ी रोकी, 24 हजार ऐंठे; विभाग बोला- उस दिन ड्यूटी ही नहीं लगाई थी",https://www.jagran.com/haryana/palwal-palwal-rto-impersonators-extort-24k-from-gaushala-vehicle-40300366.html,2026-07-09T18:01:37+00:00
Delhi-NCR,Jagran,Delhi-NCR • Jagran,https://www.jagran.com/delhi-ncr,47,"जातिसूचक शब्द कहने का विरोध करने पर परिवार पर लाठी-डंडों और सरियों से हमला, एससी एक्ट में मामला दर्ज",https://www.jagran.com/haryana/palwal-palwal-family-attacked-for-protesting-casteist-slurs-40299247.html,2026-07-09T18:01:37+00:00
Delhi-NCR,Jagran,Delhi-NCR • Jagran,https://www.jagran.com/delhi-ncr,48,"पलवल में ग्राहक सेवा केंद्र चोरी का खुलासा, आरोपी गिरफ्तार; 1.80 लाख रुपये बरामद",https://www.jagran.com/haryana/palwal-palwal-man-arrested-for-csc-theft-rupees-1lakh-80-thousand-cash-recovered-40299229.html,2026-07-09T18:01:37+00:00
Delhi-NCR,Jagran,Delhi-NCR • Jagran,https://www.jagran.com/delhi-ncr,49,"बिहार में 6 हजार मोबाइलों से भरे ट्रक की महालूट! पलवल से मास्टरमाइंड गिरफ्तार, फिल्मी है पूरी कहानी",https://www.jagran.com/haryana/palwal-ecommerce-truck-loot-mastermind-naim-arrested-by-palwal-stf-40299140.html,2026-07-09T18:01:37+00:00
Delhi-NCR,Jagran,Delhi-NCR • Jagran,https://www.jagran.com/delhi-ncr,50,"यूपी में PM आवास से वंचित गरीबों परिवारों को मिलेगा मुख्यमंत्री आवास योजना का लाभ, बनेंगे 1.16 लाख नए मकान",https://www.jagran.com/uttar-pradesh/lucknow-city-up-cm-awas-yojana-to-benefit-pm-awas-excluded-families-40300895.html,2026-07-09T18:01:37+00:00
Delhi-NCR,Jagran,Delhi-NCR • Jagran,https://www.jagran.com/delhi-ncr,51,"12 करोड़ का टेंडर घोटाला: शाहजहांपुर OCF में CBI की बड़ी कार्रवाई, फरार मैनेजर का सरकारी आवास सील",https://www.jagran.com/uttar-pradesh/shahjahanpur-shahjahanpur-cbi-raid-ocf-manager-residence-seals-firozabad-12-crore-oef-scam-40300888.html,2026-07-09T18:01:37+00:00
Delhi-NCR,Jagran,Delhi-NCR • Jagran,https://www.jagran.com/delhi-ncr,52,"अब 'लंच ब्रेक' के नाम पर नहीं रुकेगा काम, यूपी ग्रामीण बैंक ने शुरू की नई व्यवस्था",https://www.jagran.com/uttar-pradesh/gorakhpur-city-up-gramin-bank-ends-lunch-break-disruptions-better-customer-service-40300882.html,2026-07-09T18:01:37+00:00
Delhi-NCR,Jagran,Delhi-NCR • Jagran,https://www.jagran.com/delhi-ncr,53,अगस्त में सौमित्र विहार आवासीय योजना शुरू करेगा परिषद; यूपी रेरा में रजिस्ट्रेशन की प्रक्रिया इसी माह पूरी होने की उम्मीद,https://www.jagran.com/uttar-pradesh/lucknow-city-soumitra-vihar-housing-scheme-launching-in-august-in-lucknow-40300878.html,2026-07-09T18:01:37+00:00
Delhi-NCR,Jagran,Delhi-NCR • Jagran,https://www.jagran.com/delhi-ncr,54,"दुकान ले जाने के बहाने 7 साल की बच्ची से स्कूल में दुष्कर्म, ग्रामीणों ने पकड़ा तो आरोपित को छुड़ा ले गए कुछ लोग",https://www.jagran.com/uttar-pradesh/pilibhit-pilibhit-crime-news-seven-year-old-girl-assaulted-puranpur-school-accused-gulfam-flees-40300869.html,2026-07-09T18:01:37+00:00
Delhi-NCR,Jagran,Delhi-NCR • Jagran,https://www.jagran.com/delhi-ncr,55,"गोरखपुर में NIA की छापेमारी के बाद सामने आया नाबालिग छात्र का 'विजयवाड़ा B पार्टी कनेक्शन', इंस्टाग्राम से खुला राज",https://www.jagran.com/uttar-pradesh/gorakhpur-city-nia-gorakhpur-raid-minor-linked-to-vijayawada-b-party-network-40300874.html,2026-07-09T18:01:37+00:00
Delhi-NCR,Jagran,Delhi-NCR • Jagran,https://www.jagran.com/delhi-ncr,56,"ठाकुर बांकेबिहारी मंदिर में ऑनलाइन रजिस्ट्रेशन पर नहीं हो सका निर्णय, प्रबंधन समिति की बैठक में सेवायतों ने रखा प्रपोजल",https://www.jagran.com/uttar-pradesh/mathura-banke-bihari-temple-online-darshan-registration-undecided-40300867.html,2026-07-09T18:01:37+00:00
Delhi-NCR,Jagran,Delhi-NCR • Jagran,https://www.jagran.com/delhi-ncr,57,"यूपी चुनाव से पहले CM योगी का बड़ा एलान, शिक्षकों को स्वास्थ्य और सामाजिक सुरक्षा देने की तैयारी में सरकार",https://www.jagran.com/uttar-pradesh/varanasi-city-up-cm-yogi-announces-cashless-health-insurance-for-teachers-40300862.html,2026-07-09T18:01:37+00:00
Delhi-NCR,Jagran,Delhi-NCR • Jagran,https://www.jagran.com/delhi-ncr,58,"ऑर्डिनेंस फैक्ट्री जीएम को कोरिया की हवाई यात्रा, लोकल फर्म",https://www.jagran.com/uttar-pradesh/firozabad-ordinance-factory-hajratpur-scam-gm-gave-local-firm-orders-of-50-crores-cbi-enquiry-40300217.html,2026-07-09T18:01:37+00:00
Delhi-NCR,Jagran,Delhi-NCR • Jagran,https://www.jagran.com/delhi-ncr,59,"पंचकूला में करोड़ों की विवादित जमीन सौदे में बड़ा खुलासा, खर",https://www.jagran.com/haryana/panchkula-panchkula-land-scam-extehsildar-joginder-sharma-mastermind-40300202.html,2026-07-09T18:01:37+00:00
Delhi-NCR,Jagran,Delhi-NCR • Jagran,https://www.jagran.com/delhi-ncr,60,"हरियाणा से चलेगी देश की पहली हाइड्रोजन ट्रेन, 17 जुलाई को दे",https://www.jagran.com/haryana/sonipat-pm-modi-to-launch-indias-first-hydrogen-train-in-jind-40300155.html,2026-07-09T18:01:37+00:00
Delhi-NCR,Jagran,Delhi-NCR • Jagran,https://www.jagran.com/delhi-ncr,61,इन तंग गलियों में छिपा है स्वाद का असली खजाना! हर फूड लवर को,https://www.jagran.com/lifestyle/food-news-five-best-street-foods-places-in-india-every-food-lover-must-go-40300218.html,2026-07-09T18:01:37+00:00
Delhi-NCR,Jagran,Delhi-NCR • Jagran,https://www.jagran.com/delhi-ncr,62,'गलती मेरी तरफ से...'Alliance में सीमा सजदेह संग अपने डायवोर,https://www.jagran.com/entertainment/bollywood-sohail-khan-ex-wife-seema-sajdeh-enters-alliance-as-wild-cart-contestant-actor-accepts-his-mistake-40300211.html,2026-07-09T18:01:37+00:00
Delhi-NCR,Jagran,Delhi-NCR • Jagran,https://www.jagran.com/delhi-ncr,63,"भागलपुर में 20 मिनट गनपॉइंट पर बंधक रही महिला, अलमारी खंगाल",https://www.jagran.com/bihar/bhagalpur-bhagalpur-robbery-army-jawan-family-held-hostage-lakhs-looted-40300191.html,2026-07-09T18:01:37+00:00
Delhi-NCR,Jagran,Delhi-NCR • Jagran,https://www.jagran.com/delhi-ncr,64,"हरियाणा के इस जिले में धड़ाधड़ कट रहे ट्रैफिक चालान, तीन मही",https://www.jagran.com/haryana/mewat-nuh-police-issues-83759-traffic-challans-in-3-months-40300216.html,2026-07-09T18:01:37+00:00
Delhi-NCR,Jagran,Delhi-NCR • Jagran,https://www.jagran.com/delhi-ncr,65,पुत्र न हो तो क्या क्या पुत्री कर सकती है माता-पिता का श्राद,https://www.jagran.com/spiritual/religion-can-a-daughter-perform-shraddha-for-her-parents-if-there-is-no-son-garuda-purana-rules-40300208.html,2026-07-09T18:01:37+00:00
Delhi-NCR,Jagran,Delhi-NCR • Jagran,https://www.jagran.com/delhi-ncr,66,"हिमाचल के किन्नौर में बाढ़ से खतरे में गांव, मलबा डंप होने स",https://www.jagran.com/himachal-pradesh/shimla-kinnaur-flood-lippa-village-cut-off-bridge-submerged-40300201.html,2026-07-09T18:01:37+00:00
Delhi-NCR,Jagran,Delhi-NCR • Jagran,https://www.jagran.com/delhi-ncr,67,8 जुलाई का अंक राशिफल: किस मूलांक की चमकेगी किस्मत और किसे रहना होगा सतर्क? पढ़ें 1 से 9 तक का भविष्यफल,https://www.jagran.com/astrology/numerology-aaj-ka-ank-rashifal-8-july-2026-career-money-love-predictions-for-all-mulank-numerology-numbers-40297972.html,2026-07-09T18:01:37+00:00
Delhi-NCR,Jagran,Delhi-NCR • Jagran,https://www.jagran.com/delhi-ncr,68,"लव राशिफल 8 जुलाई: वृषभ, सिंह और मीन राशि वालों का चमकेगा भाग्य, जीवन में आएगा नया प्यार!",https://www.jagran.com/astrology/love-rashifal-aaj-ka-love-rashifal-8-july-2026-romance-blossoms-for-taurus-leo-and-pisces-as-a-thrilling-new-chapter-of-love-unfolds-40297967.html,2026-07-09T18:01:37+00:00
Delhi-NCR,Jagran,Delhi-NCR • Jagran,https://www.jagran.com/delhi-ncr,69,"350 दिनों तक थिएटर्स में लगातार चली थी Dev Anand की कल्ट फिल्म, 61 साल पहले रही थी गोल्डन जुबली",https://www.jagran.com/entertainment/bollywood-dev-anand-longest-running-movie-guide-over-50-week-in-theaters-become-golden-jubilee-40298751.html,2026-07-09T18:01:37+00:00
Delhi-NCR,Jagran,Delhi-NCR • Jagran,https://www.jagran.com/delhi-ncr,70,"'चांदी की चेन' पहनने से कमजोर चंद्रमा का प्रभाव होगा कम, नहीं आएंगी जीवन में ये मुसीबतें",https://www.jagran.com/spiritual/grah-nakshatra-wearing-a-silver-chain-may-reduce-the-effects-of-weak-moon-in-astrology-40300762.html,2026-07-09T18:01:37+00:00
Delhi-NCR,Jagran,Delhi-NCR • Jagran,https://www.jagran.com/delhi-ncr,71,Did You Know,https://www.jagran.com/did-you-know-news-hindi.html,2026-07-09T18:01:37+00:00
Delhi-NCR,Jagran,Delhi-NCR • Jagran,https://www.jagran.com/delhi-ncr,72,फुटबॉल विश्व कप,https://www.jagran.com/topics/fifa-world-cup-2026,2026-07-09T18:01:37+00:00
Delhi-NCR,Jagran,Delhi-NCR • Jagran,https://www.jagran.com/delhi-ncr,73,ए आई बूटकैंप,https://www.jagran.com/events/jagran-next/ai-bootcamp/index.html,2026-07-09T18:01:37+00:00
Delhi-NCR,Jagran,Delhi-NCR • Jagran,https://www.jagran.com/delhi-ncr,74,मिडिल ईस्ट संकट,https://www.jagran.com/topics/Israel-Iran-Conflict,2026-07-09T18:01:37+00:00
Delhi-NCR,Jagran,Delhi-NCR • Jagran,https://www.jagran.com/delhi-ncr,75,फीफा वर्ल्ड कप 2026,https://www.jagran.com/topics/FIFA-World-Cup-2026,2026-07-09T18:01:37+00:00
Delhi-NCR,Jagran,Delhi-NCR • Jagran,https://www.jagran.com/delhi-ncr,76,आज का राशिफल,https://www.jagran.com/topics/rashifal,2026-07-09T18:01:37+00:00
Delhi-NCR,Jagran,Delhi-NCR • Jagran,https://www.jagran.com/delhi-ncr,77,Submit your news,https://www.jagran.com/citizen-journalism-hindi.html,2026-07-09T18:01:37+00:00
Delhi-NCR,Jagran,Delhi-NCR • Jagran,https://www.jagran.com/delhi-ncr,78,Message from the Editor,https://www.jagran.com/policies-and-standards.html,2026-07-09T18:01:37+00:00
Hyderabad,DC,Hyderabad • DC,https://www.deccanchronicle.com/location/india/southern-states,1,FIFA World Cup 2026,https://www.deccanchronicle.com/fifa-world-cup-2026,2026-07-09T18:01:37+00:00
Hyderabad,DC,Hyderabad • DC,https://www.deccanchronicle.com/location/india/southern-states,2,Opinion and Editorials,https://www.deccanchronicle.com/opinion,2026-07-09T18:01:37+00:00
Hyderabad,DC,Hyderabad • DC,https://www.deccanchronicle.com/location/india/southern-states,3,Assembly Elections 2026,https://www.deccanchronicle.com/assembly-elections-2026,2026-07-09T18:01:37+00:00
Hyderabad,DC,Hyderabad • DC,https://www.deccanchronicle.com/location/india/southern-states,4,Telangana Rising 2047,https://www.deccanchronicle.com/tags/Telangana-Rising-2047,2026-07-09T18:01:37+00:00
Chennai,DC,Chennai • DC,https://www.deccanchronicle.com/location/india/tamil-nadu/chennai-madras,1,FIFA World Cup 2026,https://www.deccanchronicle.com/fifa-world-cup-2026,2026-07-09T18:01:37+00:00
Chennai,DC,Chennai • DC,https://www.deccanchronicle.com/location/india/tamil-nadu/chennai-madras,2,Opinion and Editorials,https://www.deccanchronicle.com/opinion,2026-07-09T18:01:37+00:00
Chennai,DC,Chennai • DC,https://www.deccanchronicle.com/location/india/tamil-nadu/chennai-madras,3,Assembly Elections 2026,https://www.deccanchronicle.com/assembly-elections-2026,2026-07-09T18:01:37+00:00
Chennai,DC,Chennai • DC,https://www.deccanchronicle.com/location/india/tamil-nadu/chennai-madras,4,Telangana Rising 2047,https://www.deccanchronicle.com/tags/Telangana-Rising-2047,2026-07-09T18:01:37+00:00
Chennai,The Hindu,Chennai • The Hindu,https://www.thehindu.com/news/cities/chennai/,1,Issue of appointment of V-Cs to State-run varsities heats up,https://www.thehindu.com/news/national/tamil-nadu/issue-of-appointment-of-v-cs-to-state-run-varsities-heats-up/article71198993.ece,2026-07-09T18:01:37+00:00
Chennai,The Hindu,Chennai • The Hindu,https://www.thehindu.com/news/cities/chennai/,2,A total of 139 entries receive awards in The Hindu Margazhi Competition 2025,https://www.thehindu.com/news/cities/chennai/a-total-of-139-entries-receive-awards-in-the-hindumargazhi-competition-2025/article71195512.ece,2026-07-09T18:01:37+00:00
Chennai,The Hindu,Chennai • The Hindu,https://www.thehindu.com/news/cities/chennai/,3,"CMDA plans to shelve projects as it grapples with outstanding liabilities up to ₹3,500 cr.",https://www.thehindu.com/news/cities/chennai/cmda-plans-to-shelve-projects-as-it-grapples-with-outstanding-liabilities-up-to-3500-cr/article71199249.ece,2026-07-09T18:01:37+00:00
Chennai,The Hindu,Chennai • The Hindu,https://www.thehindu.com/news/cities/chennai/,4,There is a need to build a national front against BJP: Thirumavalavan,https://www.thehindu.com/news/national/tamil-nadu/there-is-a-need-to-build-a-national-front-against-bjp-thirumavalavan/article71199202.ece,2026-07-09T18:01:37+00:00
Chennai,The Hindu,Chennai • The Hindu,https://www.thehindu.com/news/cities/chennai/,5,"34 electricity substations to come up in city, three neighbouring districts",https://www.thehindu.com/news/cities/chennai/34-electricity-substations-to-come-up-in-city-three-neighbouring-districts/article71198348.ece,2026-07-09T18:01:37+00:00
Chennai,The Hindu,Chennai • The Hindu,https://www.thehindu.com/news/cities/chennai/,6,Chennai couple’s half-century journey from pottery to star hotels,https://www.thehindu.com/news/cities/chennai/assisted-by-his-wife-curd-pot-maker-in-chennai-supplies-stock-regularly-to-star-hotel/article71182642.ece,2026-07-09T18:01:37+00:00
Chennai,The Hindu,Chennai • The Hindu,https://www.thehindu.com/news/cities/chennai/,7,CM Vijay conducts surprise inspection at Govt. Hospital for Women and Children in Egmore,https://www.thehindu.com/news/national/tamil-nadu/cm-vijay-conducts-surprise-inspection-at-govt-hospital-for-women-and-children-in-egmore/article71198667.ece,2026-07-09T18:01:37+00:00
