city,publisher,source,source_url,rank,headline,link,collected_at_iso
Bengaluru,DC,Bengaluru • DC,https://www.deccanchronicle.com/location/india/karnataka/bengaluru,1,Assembly Elections 2026,https://www.deccanchronicle.com/assembly-elections-2026,2026-04-15T20:59:01+00:00
Bengaluru,DC,Bengaluru • DC,https://www.deccanchronicle.com/location/india/karnataka/bengaluru,2,Opinion and Editorials,https://www.deccanchronicle.com/opinion,2026-04-15T20:59:01+00:00
Bengaluru,DC,Bengaluru • DC,https://www.deccanchronicle.com/location/india/karnataka/bengaluru,3,Telangana Rising 2047,https://www.deccanchronicle.com/tags/Telangana-Rising-2047,2026-04-15T20:59:01+00:00
Mumbai,Mumbai Mirror,Mumbai • Mumbai Mirror,https://mumbaimirror.indiatimes.com/mumbai,1,Fix your gums for joint pain,https://mumbaimirror.indiatimes.com/mumbai/fix-your-gums-for-joint-pain/articleshow/130265715.html,2026-04-15T20:59:01+00:00
Mumbai,Mumbai Mirror,Mumbai • Mumbai Mirror,https://mumbaimirror.indiatimes.com/mumbai,2,"With monsoons fast approaching, BMC’s desiliting work lags far behind targets",https://mumbaimirror.indiatimes.com/mumbai/with-monsoons-fast-approaching-bmcs-desiliting-work-lags-far-behind-targets/articleshow/130266804.html,2026-04-15T20:59:01+00:00
Mumbai,Mumbai Mirror,Mumbai • Mumbai Mirror,https://mumbaimirror.indiatimes.com/mumbai,3,48-hour blind spot,https://mumbaimirror.indiatimes.com/mumbai/48-hour-blind-spot/articleshow/130266655.html,2026-04-15T20:59:01+00:00
Mumbai,Mumbai Mirror,Mumbai • Mumbai Mirror,https://mumbaimirror.indiatimes.com/mumbai,4,GT Hospital’s ‘heartless treatment’ of rape survivor,https://mumbaimirror.indiatimes.com/mumbai/gt-hospitals-heartless-treatment-of-rape-survivor/articleshow/130267349.html,2026-04-15T20:59:01+00:00
Mumbai,Mumbai Mirror,Mumbai • Mumbai Mirror,https://mumbaimirror.indiatimes.com/mumbai,5,KNOW Marathi or lose licence,https://mumbaimirror.indiatimes.com/mumbai/know-marathi-or-lose-licence/articleshow/130267352.html,2026-04-15T20:59:01+00:00
Mumbai,Mumbai Mirror,Mumbai • Mumbai Mirror,https://mumbaimirror.indiatimes.com/mumbai,6,Calvin Harris gig under tight watch,https://mumbaimirror.indiatimes.com/mumbai/calvin-harris-gig-under-tight-watch/articleshow/130267028.html,2026-04-15T20:59:01+00:00
Mumbai,Mumbai Mirror,Mumbai • Mumbai Mirror,https://mumbaimirror.indiatimes.com/mumbai,7,Ask The Sexpert,https://mumbaimirror.indiatimes.com/ask-the-sexpert,2026-04-15T20:59:01+00:00
Mumbai,Sakal,Mumbai • Sakal,https://www.esakal.com/pune,1,सकाळ लाईव्ह TV,https://www.esakal.com/live-tv,2026-04-15T20:59:01+00:00
Mumbai,Sakal,Mumbai • Sakal,https://www.esakal.com/pune,2,Refund and Cancellation,https://www.esakal.com/refund-and-cancellation,2026-04-15T20:59:01+00:00
Mumbai,Lokmat,Mumbai • Lokmat,https://www.lokmat.com/city/,1,Live News in Marathi,https://www.lokmat.com/live-news/,2026-04-15T20:59:01+00:00
Mumbai,Lokmat,Mumbai • Lokmat,https://www.lokmat.com/city/,2,पुणे शहरात गुरुवारी पाणी येणार; टँकर चालकांच्या संपामुळे 'पाणीपुरवठा बंद' पुढे ढकलला,https://www.lokmat.com/pune/water-will-come-to-pune-city-on-thursday-water-supply-shutdown-postponed-due-to-tanker-drivers-strike-a-a727/,2026-04-15T20:59:01+00:00
Mumbai,Lokmat,Mumbai • Lokmat,https://www.lokmat.com/city/,3,"पुण्यात पालखी मुक्काम हलविण्याचा प्रयत्न; नागरिकांमध्ये नाराजी, ३५० वर्षांची परंपरा कायम ठेवण्याची मागणी",https://www.lokmat.com/pune/attempt-to-shift-palanquin-stop-in-pune-displeasure-among-citizens-demand-to-maintain-350-year-old-tradition-a-a727/,2026-04-15T20:59:01+00:00
Mumbai,Lokmat,Mumbai • Lokmat,https://www.lokmat.com/city/,4,"'लोहगाव' बनले हॉटस्पॉट; तापमान ४१ .८ अंशाच्या घरात, मध्यवर्ती भागापेक्षा उपनगरांमध्ये उष्णतेची तीव्र",https://www.lokmat.com/pune/lohgaon-becomes-hotspot-temperature-at-418-degrees-celsius-heat-intensity-more-in-suburbs-than-central-area-a-a727/,2026-04-15T20:59:01+00:00
Mumbai,Lokmat,Mumbai • Lokmat,https://www.lokmat.com/city/,5,पुण्यात घरगुती गॅसचा काळाबाजार करणाऱ्या दुकानावर छापा; तब्बल १०३ सिलिंडरच्या टाक्या जप्त,https://www.lokmat.com/pune/raid-on-a-shop-selling-domestic-gas-in-black-market-in-pune-103-cylinders-seized-a-a727/,2026-04-15T20:59:01+00:00
Mumbai,Lokmat,Mumbai • Lokmat,https://www.lokmat.com/city/,6,जागा दाखवण्याच्या बहाण्याने एका ठिकाणी नेले; पुण्यात मेट्रो ठेकेदाराचे ५० लाखांच्या खंडणीसाठी अपहरण,https://www.lokmat.com/pune/taken-to-a-place-on-the-pretext-of-showing-the-place-metro-contractor-kidnapped-in-pune-for-ransom-of-rs-50-lakhs-a-a727/,2026-04-15T20:59:01+00:00
Mumbai,Lokmat,Mumbai • Lokmat,https://www.lokmat.com/city/,7,अनिल अंबानी प्रकरणात मोठी घडामोड! विश्वासू सहकाऱ्याला ईडीने ठोकल्या बेड्या,https://www.lokmat.com/business/news/big-development-in-anil-ambani-case-ed-arrests-trusted-colleague-amitabh-jhunjhunwala-reliance-adag-arrest-news-a-a607/,2026-04-15T20:59:01+00:00
Mumbai,Lokmat,Mumbai • Lokmat,https://www.lokmat.com/city/,8,"इलेक्ट्रिक बाईक्स,रिक्षा, डिलिव्हरी बाईक्ससह विविध साहित्याचे वाटप; अनंत सेवा फाऊंडेशनकडून कष्टकरी कुटुंबांना आधार",https://www.lokmat.com/mumbai/distribution-of-various-materials-including-electric-bikes-rickshaws-delivery-bikes-support-to-hardworking-families-from-anant-seva-foundation-a-a571/,2026-04-15T20:59:01+00:00
Mumbai,Lokmat,Mumbai • Lokmat,https://www.lokmat.com/city/,9,"LIVE: US-इराण यांच्यातील युद्धविराम आणखी २ आठवडे वाढण्याची शक्यता, पुन्हा होणार चर्चा?",https://www.lokmat.com/maharashtra/maharashtra-marathi-news-live-updates-15-april-2026-us-iran-talks-israel-stand-on-war-strait-of-hormuz-donald-trump-pm-narendra-modi-cm-devendra-fadnavis-ipl-2026-ashok-kharat-crime-case-fuel-prices-bjp-cm-in-bihar-a-a573/,2026-04-15T20:59:01+00:00
Mumbai,Lokmat,Mumbai • Lokmat,https://www.lokmat.com/city/,10,"५९१ कोटींचा तोटा; ३१ पैकी ८ विभाग नफ्यात, STचा तोटा कमी करण्यासाठी उपाययोजना करायचे निर्देश",https://www.lokmat.com/maharashtra/591-crore-loss-8-out-of-only-31-unit-in-profit-minister-pratap-sarnaik-instructions-to-take-measures-to-reduce-st-bus-losses-a-a719/,2026-04-15T20:59:01+00:00
Mumbai,Lokmat,Mumbai • Lokmat,https://www.lokmat.com/city/,11,"""उबाठा गट ताब्यात घेण्याचे राऊतांचे प्रयत्न, आदित्य ठाकरेंशी 'सामना""; भाजपा नेत्याचा दावा",https://www.lokmat.com/mumbai/sanjay-rauts-attempts-to-take-over-ubatha-group-confrontation-with-aditya-thackeray-bjp-leader-claims-a-a747/,2026-04-15T20:59:01+00:00
Mumbai,Lokmat,Mumbai • Lokmat,https://www.lokmat.com/city/,12,"भाजपाचे सहा, तर शिंदेसेनेला एक जागा, नागपूर मनपातील भाजपाच्या स्विकृत सदस्यांच्या नावांची घोषणा",https://www.lokmat.com/nagpur/bjp-wins-six-seats-shinde-sena-wins-one-names-of-bjps-accepted-members-in-nagpur-municipal-corporation-announced-a-a571/,2026-04-15T20:59:01+00:00
Mumbai,Lokmat,Mumbai • Lokmat,https://www.lokmat.com/city/,13,"सावधान...! उष्णतेच्या लाटेसारखी स्थिती; विदर्भात ४२, मराठवाडा, मध्य महाराष्ट्रात ३८-४० तर कोकणात ३४-",https://www.lokmat.com/maharashtra/beware-heat-wave-like-conditions-42-degrees-celsius-recorded-in-vidarbha-38-40-in-marathwada-madhya-maharashtra-and-34-36-degrees-celsius-in-konkan-a-a653/,2026-04-15T20:59:01+00:00
Mumbai,Lokmat,Mumbai • Lokmat,https://www.lokmat.com/city/,14,सरसंघचालक भागवत यांनी घेतली माजी सरन्यायाधीश शरद बोबडे यांची सदिच्छा भेट,https://www.lokmat.com/nagpur/rss-chief-bhagwat-receives-goodwill-visit-from-former-chief-justice-sharad-bobde-a-a571/,2026-04-15T20:59:01+00:00
Mumbai,Lokmat,Mumbai • Lokmat,https://www.lokmat.com/city/,15,"डीआरआयचे 'सिमोल्लंघन'; कोकेन प्रकरणात दिल्ली, बेंगळुरू आणि हैदराबादवर नजर, तस्करांविरुद्ध जोरदार आघाडी",https://www.lokmat.com/nagpur/dris-symbol-violation-delhi-bengaluru-and-hyderabad-under-scrutiny-in-cocaine-case-strong-front-against-smugglers-a-a877-c571/,2026-04-15T20:59:01+00:00
Mumbai,Lokmat,Mumbai • Lokmat,https://www.lokmat.com/city/,16,चोऱ्या करा; महिन्याला २५ हजार पगार घ्या; बिहारी टोळीची बेराेजगारांना विचित्र ऑफर,https://www.lokmat.com/nagpur/nagpur-crime-steal-get-a-salary-of-25-thousand-per-month-bihari-gangs-strange-offer-to-the-unemployed-a-a877-c301/,2026-04-15T20:59:01+00:00
Mumbai,Lokmat,Mumbai • Lokmat,https://www.lokmat.com/city/,17,"हात पकडून जवळ खेचले, मग Kiss केले आणि शरीरसंबंध ठेवले; TCS प्रकरणातील पीडितेचा थरारक अनुभव",https://www.lokmat.com/crime/statement-of-the-victim-in-the-nashik-tcs-abuse-and-forced-conversion-case-surfaces-for-the-first-time-a-a629/,2026-04-15T20:59:01+00:00
Mumbai,Lokmat,Mumbai • Lokmat,https://www.lokmat.com/city/,18,टार्गेटवर होत्या २३ वर्षीय तरुणी; रिसॉर्टवर नेऊन केला अत्याचार; टीसीएस कंपनीत धक्कादायक प्रकार,https://www.lokmat.com/nashik/nashik-case-update-sit-seizes-cctv-footage-from-trimbak-road-resort-forensic-evidence-collected-from-office-a-a1001/,2026-04-15T20:59:01+00:00
Mumbai,Lokmat,Mumbai • Lokmat,https://www.lokmat.com/city/,19,एकाच्या पापाची शिक्षा इतरांना का? नाशिकमध्ये संबंध नसलेल्यांना अडकवल्याचा आरोपींच्या पत्नींचा दावा,https://www.lokmat.com/nashik/one-failed-relationship-ruined-innocent-lives-wife-of-arrested-tcs-employee-claims-wrongful-charges-a-a1001/,2026-04-15T20:59:01+00:00
Mumbai,Lokmat,Mumbai • Lokmat,https://www.lokmat.com/city/,20,नाशिकच्या तरुणींना मलेशियात विकण्याचा कट? आयटी कंपनीतील 'त्या' प्रकरणाला मानवी तस्करीचे भयानक वळण,https://www.lokmat.com/nashik/nashik-it-scandal-girls-targeted-for-human-trafficking-to-malaysia-forced-conversion-racket-unearthed-a-a1001/,2026-04-15T20:59:01+00:00
Mumbai,Lokmat,Mumbai • Lokmat,https://www.lokmat.com/city/,21,टीसीएस प्रकरण; पीडितेवर रिसॉर्टमध्ये झाला अत्याचार,https://www.lokmat.com/nashik/tcs-case-victim-was-tortured-in-resort-a-a301/,2026-04-15T20:59:01+00:00
Mumbai,Lokmat,Mumbai • Lokmat,https://www.lokmat.com/city/,22,"रक्षा विसर्जनासाठी आलेल्यांवर मधमाशांचा हल्ला; शंभराहून अधिक जखमी, दहाहून अधिक गंभीर जखमी",https://www.lokmat.com/kolhapur/bees-attack-those-who-came-for-raksha-visarjan-more-than-a-hundred-injured-kolhapur-news-more-than-ten-seriously-injured-a-a607/,2026-04-15T20:59:01+00:00
Mumbai,Lokmat,Mumbai • Lokmat,https://www.lokmat.com/city/,23,एडिट केलेला फोटो पाठवून तरुणाचं लग्न मोडलं; १० महिन्यांनंतर 'त्या' मेसेजचं सत्य आलं समोर,https://www.lokmat.com/kolhapur/morphed-photos-sent-to-bride-family-break-off-kolhapur-youth-marriage-case-filed-after-10-months-a-a1001/,2026-04-15T20:59:01+00:00
Mumbai,Lokmat,Mumbai • Lokmat,https://www.lokmat.com/city/,24,"मोबाईल दुकानदार होता टार्गेट, बळी गेला व्यापाऱ्याचा; कोल्हापुरात खंडणीसाठी बॅटरीचा शॉक देऊन हत्या",https://www.lokmat.com/kolhapur/vegetable-merchant-abducted-and-murdered-for-25-lakh-ransom-in-shirol-two-arrested-a-a1001/,2026-04-15T20:59:01+00:00
Mumbai,Lokmat,Mumbai • Lokmat,https://www.lokmat.com/city/,25,"बालमैत्रिणीसाठी आशाताई दोनदा आल्या गडहिंग्लजला! महिला बँकेचे उद्घाटन, महाविद्यालयाच्या मदतीसाठी विनामूल्य कार्यक्रम",https://www.lokmat.com/kolhapur/ashatai-came-to-gadhinglaj-twice-for-her-childhood-friend-inauguration-of-womens-bank-free-programs-to-help-the-college-a-a571/,2026-04-15T20:59:01+00:00
Mumbai,Lokmat,Mumbai • Lokmat,https://www.lokmat.com/city/,26,"'सीईटी'ची केंद्रे दूर; विद्यार्थ्यांचे प्रचंड हाल, पालकांमध्ये तीव्र नाराजी",https://www.lokmat.com/kolhapur/cet-exam-cet-centers-are-far-away-students-are-in-great-trouble-a-a1012/,2026-04-15T20:59:01+00:00
Mumbai,Lokmat,Mumbai • Lokmat,https://www.lokmat.com/city/,27,"'राज्य सरकारचा निर्णय एकतर्फी, लोकशाहीविरोधी', बाजार समिती संचालक मंडळ बरखास्तीवर जयंत पाटील संतापले",https://www.lokmat.com/sangli/state-governments-decision-is-unilateral-anti-democratic-jayant-patil-angry-over-the-dismissal-of-the-market-committee-board-of-directors-a-a571/,2026-04-15T20:59:01+00:00
Mumbai,Lokmat,Mumbai • Lokmat,https://www.lokmat.com/city/,28,सांगली हादरली! किरकोळ वादातून पतीने डोक्यात रॉड घालून पत्नीची केली हत्या; मुलाला मित्राकडे सोडून पती फरार,https://www.lokmat.com/sangli/sangli-shocked-husband-kills-wife-by-putting-a-rod-in-her-head-over-a-minor-dispute-husband-absconds-leaving-child-with-friend-a-a941/,2026-04-15T20:59:01+00:00
Mumbai,Lokmat,Mumbai • Lokmat,https://www.lokmat.com/city/,29,"बहिणीला शिवीगाळ, बोअरवेल कामगार विजय पानसेची धारदार शस्त्राने वार करत हत्या, सांगली जिल्ह्यातील घटना",https://www.lokmat.com/sangli/sister-abused-borewell-worker-vijay-panse-stabbed-to-death-with-sharp-weapon-incident-in-sangli-district-a-a571/,2026-04-15T20:59:01+00:00
Mumbai,Lokmat,Mumbai • Lokmat,https://www.lokmat.com/city/,30,"मनोरुग्ण मुलाच्या डोक्यात बापाने दगड घालून केला खून, वाटेगाव येथील घटना",https://www.lokmat.com/sangli/father-kills-mentally-ill-son-by-throwing-stone-at-his-head-incident-in-wategaon-a-a732/,2026-04-15T20:59:01+00:00
Mumbai,Lokmat,Mumbai • Lokmat,https://www.lokmat.com/city/,31,कारचे तुकडे ५०० फूट फेकले गेले; केजच्या तहसीलदारांचा अपघात नेमका कसा झाला?,https://www.lokmat.com/beed/kaij-tehsildar-rakesh-gidde-dies-in-tragic-car-accident-near-renapur-vehicle-overturns-500-feet-a-a320/,2026-04-15T20:59:01+00:00
Mumbai,Lokmat,Mumbai • Lokmat,https://www.lokmat.com/city/,32,संतापजनक! मराठा साम्राज्याचा विस्तार दर्शविणारा नकाशा आठवीच्या पुस्तकातून NCERT ने वगळला,https://www.lokmat.com/maharashtra/ncert-removes-map-showing-expansion-of-maratha-empire-from-8th-standard-textbook-a-a629/,2026-04-15T20:59:01+00:00
Mumbai,Lokmat,Mumbai • Lokmat,https://www.lokmat.com/city/,33,फलटण उपजिल्हा रुग्णालयात उपचार घेणाऱ्या मुलीचा विनयभंग; संशयिताविरुद्ध तक्रार दाखल,https://www.lokmat.com/satara/shocking-18-year-old-patient-molested-inside-phaltan-sub-district-hospital-accused-arrested-a-a1012/,2026-04-15T20:59:01+00:00
Mumbai,Lokmat,Mumbai • Lokmat,https://www.lokmat.com/city/,34,"“शशिकांत शिंदे हे मूळचे शिवसैनिक, शिवसेनेत आल्यास पहिले स्वागत मी करेन”; कुणी दिली ऑफर?",https://www.lokmat.com/maharashtra/shiv-sena-shinde-group-mahesh-shinde-said-shashikant-shinde-is-originally-a-shiv-sainik-if-he-joins-party-i-will-be-the-first-to-welcome-him-a-a719/,2026-04-15T20:59:01+00:00
Mumbai,Lokmat,Mumbai • Lokmat,https://www.lokmat.com/city/,35,"नीलम शिंदेची झुंज संपली, तो कॉल ठरला काळीज चिरणारा; वडिलांना व्हिडीओद्वारे घ्यावे लागणार अंतिम दर्शन",https://www.lokmat.com/satara/neelam-shindes-fight-is-over-that-call-was-heartbreaking-father-will-have-to-have-his-last-darshan-via-video-call-a-a571/,2026-04-15T20:59:01+00:00
Mumbai,Lokmat,Mumbai • Lokmat,https://www.lokmat.com/city/,36,सभापती निवडीत भाजपचीच बाजी; राष्ट्रवादीच्या फुटलेल्या दोघींना संधी,https://www.lokmat.com/satara/bjp-wins-in-speaker-election-ncps-two-split-candidates-get-a-chance-a-a1013/,2026-04-15T20:59:01+00:00
Mumbai,Lokmat,Mumbai • Lokmat,https://www.lokmat.com/city/,37,अकोल्यात उष्माघाताचा पहिला बळी? ४४ अंश तापमानाने घेतला जीव; ऑटोमध्ये आढळला मृतदेह,https://www.lokmat.com/akola/first-victim-of-heatstroke-in-akola-44-degree-temperature-claimed-his-life-body-found-in-auto-a-a941/,2026-04-15T20:59:01+00:00
Mumbai,Lokmat,Mumbai • Lokmat,https://www.lokmat.com/city/,38,"विदर्भात पारा ५ अंशांनी वाढला; अकोला जिल्हा सर्वाधिक ‘हॉट’,थंड हवेचे ठिकाण बुलढाणाही तापले",https://www.lokmat.com/akola/mercury-rises-by-5-degrees-in-vidarbha-akola-district-is-the-hottest-a-a301/,2026-04-15T20:59:01+00:00
Mumbai,Lokmat,Mumbai • Lokmat,https://www.lokmat.com/city/,39,अकोला पोलीस दलात खळबळ! महिला आरोपीकडे मुलीची मागणी करणाऱ्या सहाय्यक पोलीस निरीक्षकाचे निलंबन,https://www.lokmat.com/akola/api-rajesh-jadhav-akola-police-officer-suspended-for-demanding-physical-pleasure-from-arrested-female-accused-a-a400-c607/,2026-04-15T20:59:01+00:00
Mumbai,Lokmat,Mumbai • Lokmat,https://www.lokmat.com/city/,40,गॅसटंचाईचा पहिला बळी अकोल्यात; सिलिंडरसाठी रांगेत असताना माजी सरपंचाचा मृत्यू,https://www.lokmat.com/akola/first-victim-of-gas-shortage-in-akola-former-sarpanch-dies-while-waiting-in-line-for-cylinder-a-a1001/,2026-04-15T20:59:01+00:00
Mumbai,Lokmat,Mumbai • Lokmat,https://www.lokmat.com/city/,41,शिंदेंच्या चार नगरसेवकांचे सदस्यत्व धोक्यात? उद्धवसेनेकडून अपात्र ठरवण्याची याचिका दाखल,https://www.lokmat.com/akola/membership-of-four-shinde-corporators-in-jeopardy-uddhav-sena-files-petition-to-disqualify-them-a-a571/,2026-04-15T20:59:01+00:00
Mumbai,Lokmat,Mumbai • Lokmat,https://www.lokmat.com/city/,42,"""मला वाटतं अशोक खरातचा एन्काऊंटर करतील, कारण...!""; प्रणिती शिंदे यांनी व्यक्त केली वेगळीच शंका",https://www.lokmat.com/maharashtra/i-think-ashok-will-do-an-encounter-with-kharat-praniti-shinde-expressed-a-different-doubt-a-a653/,2026-04-15T20:59:01+00:00
Mumbai,Lokmat,Mumbai • Lokmat,https://www.lokmat.com/city/,43,"मोठी बातमी; सोलापूरचा पारा ४२.५ अंशांवर; सूर्य ओकतोय आग, जनजीवन विस्कळीत !",https://www.lokmat.com/solapur/big-news-solapurs-temperature-at-425-degrees-a-a732/,2026-04-15T20:59:01+00:00
Mumbai,Lokmat,Mumbai • Lokmat,https://www.lokmat.com/city/,44,केंद्र अन् राज्य सरकारच्या लोककल्याणकारी योजना वांझ ठरताहेत; डॉ. श्रीपाल सबनीस यांचा घणाघात,https://www.lokmat.com/solapur/the-welfare-schemes-of-the-central-and-state-governments-are-proving-fruitless-dr-shripal-sabniss-attack-a-a571/,2026-04-15T20:59:01+00:00
Mumbai,Lokmat,Mumbai • Lokmat,https://www.lokmat.com/city/,45,मोठी बातमी; साेलापुरात उच्चांकी तापमानाची नोंद; पारा पोहोचला ४१.४ अंश सेल्सिअसवर,https://www.lokmat.com/solapur/big-news-highest-temperature-recorded-in-solapur-mercury-reaches-414-degrees-celsius-a-a1013/,2026-04-15T20:59:01+00:00
Mumbai,Lokmat,Mumbai • Lokmat,https://www.lokmat.com/city/,46,"वाहनमालकांनो...! उद्यापासून टोल नाक्यावर रोख रक्कम बंद! फास्टॅग, युपीआय नसेल तर...",https://www.lokmat.com/auto/new-toll-rules-april-2026-vehicle-owners-from-tomorrow-cash-will-not-be-accepted-at-toll-booths-if-you-dont-have-fastag-upi-you-wont-be-able-to-move-forward-a-a607/,2026-04-15T20:59:01+00:00
Mumbai,Lokmat,Mumbai • Lokmat,https://www.lokmat.com/city/,47,"चाकणकरांच्या बहिणीची ८ तास चौकशी, ६० कोटींच्या उलाढालीवर म्हणाल्या, "" बातमी कळली तेव्हा...""",https://www.lokmat.com/ahilyanagar/police-question-pratibha-chakankar-for-8-hours-in-fake-bank-account-case-a-a1001/,2026-04-15T20:59:01+00:00
Mumbai,Lokmat,Mumbai • Lokmat,https://www.lokmat.com/city/,48,"'पतसंस्थेतील बँक खाती बनावट, सह्या सुद्धा खोट्या'; प्रतिभा चाकणकर पहिल्यांदाच अशोक खरात प्रकरणावर बोलल्या",https://www.lokmat.com/ahilyanagar/bank-accounts-in-credit-institutions-are-fake-signatures-are-also-fake-pratibha-chakankar-speaks-for-the-first-time-on-ashok-kharat-case-a-a571/,2026-04-15T20:59:01+00:00
Mumbai,Lokmat,Mumbai • Lokmat,https://www.lokmat.com/city/,49,"रुपाली चाकणकर यांची बहीण प्रतिभा चाकणकरांची चौकशी होणार,पोलिसांनी बजावली नोटीस",https://www.lokmat.com/ahilyanagar/ashok-kharat-case-rupali-chakankars-sister-pratibha-chakankar-will-be-questioned-police-issued-notice-a-a571/,2026-04-15T20:59:01+00:00
