city,publisher,source,source_url,rank,headline,link,collected_at_iso
Delhi-NCR,Jagran,Delhi-NCR • Jagran,https://www.jagran.com/delhi-ncr,33,"गुरुग्राम में थाने के सामने सीतापुर के युवक ने खुद को लगाई आग, लिव-इन पार्टनर से विवाद के बाद उठाया खौफनाक कदम",https://www.jagran.com/haryana/gurgaon-gurugram-man-attempts-selfimmolation-after-livein-dispute-40208226.html,2026-04-16T11:10:30+00:00
Delhi-NCR,Jagran,Delhi-NCR • Jagran,https://www.jagran.com/delhi-ncr,34,"गुरुग्राम में तेज रफ्तार थार ने डिलीवरी बॉय की बाइक को मारी टक्कर, 20 वर्षीय युवक की मौत",https://www.jagran.com/haryana/gurgaon-gurugram-delivery-worker-killed-by-speeding-thar-in-sector-49-40208044.html,2026-04-16T11:10:30+00:00
Delhi-NCR,Jagran,Delhi-NCR • Jagran,https://www.jagran.com/delhi-ncr,35,"'साहब! एक बार और रजिस्टर देख लो... मेरा भाई तीन दिन से लापता है', श्रमिक आंदोलन के बाद थाने पहुंच रहे लोग",https://www.jagran.com/uttar-pradesh/noida-noida-violence-families-search-for-missing-workers-40208276.html,2026-04-16T11:10:30+00:00
Delhi-NCR,Jagran,Delhi-NCR • Jagran,https://www.jagran.com/delhi-ncr,36,"स्वीडन के IAAM के प्रोफेसर पद से भी हटाए गए GBU वाले डॉ. विश्वास, दुनिया में कम वैज्ञानिकों को मिलता है ये सम्मान",https://www.jagran.com/uttar-pradesh/noida-doctor-vishwas-tripathi-removed-from-iaam-professorship-amid-gbu-scam-greater-noida-40208135.html,2026-04-16T11:10:30+00:00
Delhi-NCR,Jagran,Delhi-NCR • Jagran,https://www.jagran.com/delhi-ncr,37,"नोएडा के स्पार्क मिंडा कंपनी के बाहर पुलिस ने तितर-बितर की भीड़, प्रदर्शन के लिए आए तीन कर्मी हिरासत में",https://www.jagran.com/uttar-pradesh/noida-spark-minda-noida-protest-police-detain-3-employees-40208159.html,2026-04-16T11:10:30+00:00
Delhi-NCR,Jagran,Delhi-NCR • Jagran,https://www.jagran.com/delhi-ncr,38,"दिल्ली के आईटीआई बनेंगे 'सेंटर ऑफ एक्सीलेंस', सीएम रेखा गुप्ता ने तकनीकी शिक्षा को आधुनिक बनाने के लिए खोला पिटारा",https://www.jagran.com/delhi/new-delhi-city-delhi-iti-modernization-cm-rekha-gupta-boosts-technical-education-40208525.html,2026-04-16T11:10:30+00:00
Delhi-NCR,Jagran,Delhi-NCR • Jagran,https://www.jagran.com/delhi-ncr,39,"दिल्ली के बृजपुरी में माहौल बिगाड़ने की कोशिश, कंडोम में पेशाब भरकर मंदिर के गेट पर टांगा",https://www.jagran.com/delhi/new-delhi-city-delhi-brijpuri-temple-desecration-urinefilled-condom-incident-40207883.html,2026-04-16T11:10:30+00:00
Delhi-NCR,Jagran,Delhi-NCR • Jagran,https://www.jagran.com/delhi-ncr,40,"फरीदाबाद वालों के लिए गुड न्यूज, अब मेवला महाराजपुर शहरी स्वास्थ्य केंद्र में अल्ट्रासाउंड और एक्सरे की मिलेगी सुविधा",https://www.jagran.com/haryana/faridabad-faridabad-mewla-maharajpur-health-center-gets-ultrasound-xray-40208337.html,2026-04-16T11:10:30+00:00
Delhi-NCR,Jagran,Delhi-NCR • Jagran,https://www.jagran.com/delhi-ncr,41,"फरीदाबाद के अनंगपुर गांव में टहलता दिखा तेंदुआ, अरावली के जंगल से भटक कर आया बाहर",https://www.jagran.com/haryana/faridabad-leopard-sighting-in-anangpur-faridabad-residents-fearful-40208086.html,2026-04-16T11:10:30+00:00
Delhi-NCR,Jagran,Delhi-NCR • Jagran,https://www.jagran.com/delhi-ncr,42,"फरीदाबाद: बल्लभगढ़ में जाम से मिलेगी मुक्ति, इन जगहों पर गाड़ी खड़ी की तो कटेगा चालान",https://www.jagran.com/haryana/faridabad-ballabgarh-traffic-fines-for-parking-outside-white-line-40208024.html,2026-04-16T11:10:30+00:00
Delhi-NCR,Jagran,Delhi-NCR • Jagran,https://www.jagran.com/delhi-ncr,43,"मां को प्लाट-पैसे के लालच में गला घोंटकर मार डाला, 29 दिन बाद फरार बेटे ललित गिरफ्तार",https://www.jagran.com/haryana/faridabad-faridabad-son-arrested-for-mothers-murder-over-property-40208023.html,2026-04-16T11:10:30+00:00
Delhi-NCR,Jagran,Delhi-NCR • Jagran,https://www.jagran.com/delhi-ncr,44,"फरीदाबाद में गुमशुदगी विज्ञापन पर साइबर ठगी, बेटे को लौटाने के नाम पर 10 हजार लूटे; खाताधारक गिरफ्तार",https://www.jagran.com/haryana/faridabad-faridabad-missing-ad-fraud-10k-stolen-accused-held-40208022.html,2026-04-16T11:10:30+00:00
Delhi-NCR,Jagran,Delhi-NCR • Jagran,https://www.jagran.com/delhi-ncr,45,"पलवल में नाबालिग छात्रा छेड़ने और फोटोज खींचकर पोस्ट करने पर एफआईआर, पुलिस सिखाएगी सबक",https://www.jagran.com/haryana/palwal-palwal-schoolgirl-harassed-photos-viral-pocso-case-filed-40208149.html,2026-04-16T11:10:30+00:00
Delhi-NCR,Jagran,Delhi-NCR • Jagran,https://www.jagran.com/delhi-ncr,46,"पलवल में अमरनाथ यात्रा हेल्थ सर्टिफिकेट बनवाना अग्निपरीक्षा से कम नहीं, लंबी कतारों से श्रद्धालु परेशान",https://www.jagran.com/haryana/palwal-amarnath-yatra-health-certificate-palwals-queue-challenge-40208112.html,2026-04-16T11:10:30+00:00
Delhi-NCR,Jagran,Delhi-NCR • Jagran,https://www.jagran.com/delhi-ncr,47,"पलवल में जमीन के विवाद ने लिया खूनी संघर्ष, गोली लगने से युवक घायल; पुलिस ने दर्ज किए मुकदमे",https://www.jagran.com/haryana/palwal-palwal-land-dispute-youth-shot-cases-filed-against-both-sides-40207906.html,2026-04-16T11:10:30+00:00
Delhi-NCR,Jagran,Delhi-NCR • Jagran,https://www.jagran.com/delhi-ncr,48,"पलवल में वेतन वृद्धि विवाद: हाईवे जाम करने वालों पर दर्ज होगा केस, फैक्ट्रियों के बाद सुरक्षा सख्त",https://www.jagran.com/haryana/palwal-palwal-highway-blockade-wage-hike-dispute-leads-to-strict-action-40206465.html,2026-04-16T11:10:30+00:00
Delhi-NCR,Jagran,Delhi-NCR • Jagran,https://www.jagran.com/delhi-ncr,49,"पलवल में ईंटों के नीचे छिपाकर बिहार ले जाई जा रही 610 पेटी अंग्रेजी शराब पकड़ी, दो तस्कर गिरफ्तार",https://www.jagran.com/haryana/palwal-palwal-610-cartons-of-illegal-liquor-seized-2-arrested-40206281.html,2026-04-16T11:10:30+00:00
Delhi-NCR,Jagran,Delhi-NCR • Jagran,https://www.jagran.com/delhi-ncr,50,"रेल यात्रियों की सेहत से खिलवाड़! इन 3 ट्रेनों में बिक रहा था अनअप्रूव्ड ब्रांड का पानी, रेलवे टीम ने मारा छापा",https://www.jagran.com/uttar-pradesh/bareilly-city-railway-raid-illegal-water-bottles-seized-bareilly-izzatnagar-division-40208539.html,2026-04-16T11:10:30+00:00
Delhi-NCR,Jagran,Delhi-NCR • Jagran,https://www.jagran.com/delhi-ncr,51,"बाराबंकी में बस अड्डे पर नहीं, ढ़ाबों से मिल रहीं परिवहन निगम की बसें, ढूंढना के लिए इधर-उधर भटक रहे यात्री",https://www.jagran.com/uttar-pradesh/barabanki-bhitaria-bus-stand-buses-skip-for-dhabas-in-barabanki-40208547.html,2026-04-16T11:10:30+00:00
Delhi-NCR,Jagran,Delhi-NCR • Jagran,https://www.jagran.com/delhi-ncr,52,"गाजियाबाद की इस सोसायटी में दूर होगी में लिफ्ट और बिजली की समस्या, लोगों को मिलेगी बड़ी राहत",https://www.jagran.com/uttar-pradesh/ghaziabad-ghaziabad-ganga-yamuna-hindon-apartment-lift-power-fixed-40208548.html,2026-04-16T11:10:30+00:00
Delhi-NCR,Jagran,Delhi-NCR • Jagran,https://www.jagran.com/delhi-ncr,53,कौशांबी में दर्दनाक हादसा : घर में लगी आग से जिंदा जल गई मासूम बच्ची; तीन मवेशियों की भी मौत,https://www.jagran.com/uttar-pradesh/kaushambi-tragic-accident-in-kaushambi-8-year-old-girl-dies-in-house-fire-40208555.html,2026-04-16T11:10:30+00:00
Delhi-NCR,Jagran,Delhi-NCR • Jagran,https://www.jagran.com/delhi-ncr,54,"रायबरेली में तिलकोत्सव में फूड प्वाइजनिंग से बिगड़ी 40 लोगों की तबीयत, इलाज के बाद भेजा गया घर",https://www.jagran.com/uttar-pradesh/raebareli-food-poisoning-in-tilak-program-in-raibareilly-treatment-of-40-in-chc-40208553.html,2026-04-16T11:10:30+00:00
Delhi-NCR,Jagran,Delhi-NCR • Jagran,https://www.jagran.com/delhi-ncr,55,"जब रात के अंधेरे में सादे कपड़ों में स्कूटी से निकलीं महिला दारोगा, देखते ही देखते 16 मनचले हो गए गिरफ्तार",https://www.jagran.com/uttar-pradesh/meerut-city-meerut-police-catch-16-eveteasers-in-undercover-operation-40208536.html,2026-04-16T11:10:30+00:00
Delhi-NCR,Jagran,Delhi-NCR • Jagran,https://www.jagran.com/delhi-ncr,56,"स्मार्ट बिजली मीटर का विरोध करना पड़ेगा अब भारी, कर्मचारियों",https://www.jagran.com/himachal-pradesh/mandi-himachal-smart-meter-opposition-power-cut-if-resisted-40208533.html,2026-04-16T11:10:30+00:00
Delhi-NCR,Jagran,Delhi-NCR • Jagran,https://www.jagran.com/delhi-ncr,57,"अमृतसर में घर के चिराग से भड़की आग, लकड़ी का टाल और वाहन जलक",https://www.jagran.com/punjab/amritsar-fire-sparked-by-a-household-lamp-in-amritsar-timber-yard-and-vehicles-reduced-to-ashes-losses-worth-lakhs-40208530.html,2026-04-16T11:10:30+00:00
Delhi-NCR,Jagran,Delhi-NCR • Jagran,https://www.jagran.com/delhi-ncr,58,"ओडिशा के हक पर सियासत तेज, नवीन पटनायक ने विधानसभा का विशेष",https://www.jagran.com/odisha/bhubaneshwar-odisha-delimitation-row-naveen-patnaik-demands-special-assembly-session-40208528.html,2026-04-16T11:10:30+00:00
Delhi-NCR,Jagran,Delhi-NCR • Jagran,https://www.jagran.com/delhi-ncr,59,"'ब्लैंक चेक देता हूं, सरकारी खर्च से आपकी फोटो भी छपवा दूंगा",https://www.jagran.com/news/national-pm-narendra-modi-in-parliament-on-women-reservation-and-other-two-bill-in-special-session-40208506.html,2026-04-16T11:10:30+00:00
Delhi-NCR,Jagran,Delhi-NCR • Jagran,https://www.jagran.com/delhi-ncr,60,₹200 की ओर बढ़ा सरसों तेल... दाल भी महंगी होने से घरों का बि,https://www.jagran.com/uttar-pradesh/raebareli-raebareli-edible-oil-pulse-prices-soar-kitchen-budget-hit-40208497.html,2026-04-16T11:10:30+00:00
Delhi-NCR,Jagran,Delhi-NCR • Jagran,https://www.jagran.com/delhi-ncr,61,दरभंगा शहर का खूबसूरत चौराहा अब ऐसा है कि लोग नजारा देखें या,https://www.jagran.com/bihar/darbhanga-darbhanga-beautiful-chowk-now-leaves-people-choosing-between-scenic-views-and-suffocating-dust-40208520.html,2026-04-16T11:10:30+00:00
Delhi-NCR,Jagran,Delhi-NCR • Jagran,https://www.jagran.com/delhi-ncr,62,LIVE Updates: 'बुरी नजर से बचाने के लिए काला टीका भी लगा दिय,https://www.jagran.com/news/national-parliament-special-session-live-updates-bills-to-implement-women-reservation-and-delimitation-to-be-tabled-in-parliament-lb-30000431.html,2026-04-16T11:10:30+00:00
Delhi-NCR,Jagran,Delhi-NCR • Jagran,https://www.jagran.com/delhi-ncr,63,"महादेव में थी अटूट आस्था: शिक्षक फैज बने सोनू चौहान, गंगाजल",https://www.jagran.com/uttar-pradesh/shahjahanpur-shahjahanpur-school-teacher-faiz-converts-hinduism-renamed-sonu-chauhan-40208514.html,2026-04-16T11:10:30+00:00
Delhi-NCR,Jagran,Delhi-NCR • Jagran,https://www.jagran.com/delhi-ncr,64,Did You Know,https://www.jagran.com/did-you-know-news-hindi.html,2026-04-16T11:10:30+00:00
Delhi-NCR,Jagran,Delhi-NCR • Jagran,https://www.jagran.com/delhi-ncr,65,मिडिल ईस्ट संकट,https://www.jagran.com/topics/Israel-Iran-Conflict,2026-04-16T11:10:30+00:00
Delhi-NCR,Jagran,Delhi-NCR • Jagran,https://www.jagran.com/delhi-ncr,66,विधानसभा चुनाव 2026,https://www.jagran.com/topics/assembly-election-2026,2026-04-16T11:10:30+00:00
Delhi-NCR,Jagran,Delhi-NCR • Jagran,https://www.jagran.com/delhi-ncr,67,नोएडा श्रमिक प्रदर्शन,https://www.jagran.com/topics/Noida-protests,2026-04-16T11:10:30+00:00
Delhi-NCR,Jagran,Delhi-NCR • Jagran,https://www.jagran.com/delhi-ncr,68,Submit your news,https://www.jagran.com/citizen-journalism-hindi.html,2026-04-16T11:10:30+00:00
Delhi-NCR,Jagran,Delhi-NCR • Jagran,https://www.jagran.com/delhi-ncr,69,Message from the Editor,https://www.jagran.com/policies-and-standards.html,2026-04-16T11:10:30+00:00
Hyderabad,DC,Hyderabad • DC,https://www.deccanchronicle.com/location/india/southern-states,1,Assembly Elections 2026,https://www.deccanchronicle.com/assembly-elections-2026,2026-04-16T11:10:30+00:00
Hyderabad,DC,Hyderabad • DC,https://www.deccanchronicle.com/location/india/southern-states,2,Opinion and Editorials,https://www.deccanchronicle.com/opinion,2026-04-16T11:10:30+00:00
Hyderabad,DC,Hyderabad • DC,https://www.deccanchronicle.com/location/india/southern-states,3,Telangana Rising 2047,https://www.deccanchronicle.com/tags/Telangana-Rising-2047,2026-04-16T11:10:30+00:00
Chennai,DC,Chennai • DC,https://www.deccanchronicle.com/location/india/tamil-nadu/chennai-madras,1,Assembly Elections 2026,https://www.deccanchronicle.com/assembly-elections-2026,2026-04-16T11:10:30+00:00
Chennai,DC,Chennai • DC,https://www.deccanchronicle.com/location/india/tamil-nadu/chennai-madras,2,Opinion and Editorials,https://www.deccanchronicle.com/opinion,2026-04-16T11:10:30+00:00
Chennai,DC,Chennai • DC,https://www.deccanchronicle.com/location/india/tamil-nadu/chennai-madras,3,Telangana Rising 2047,https://www.deccanchronicle.com/tags/Telangana-Rising-2047,2026-04-16T11:10:30+00:00
Chennai,The Hindu,Chennai • The Hindu,https://www.thehindu.com/news/cities/chennai/,1,Bartimaeus Trinity Trust completes 20 years of service to visually impaired,https://www.thehindu.com/news/cities/chennai/bartimaeus-trinity-trust-completes-20-years-of-service-to-visually-impaired/article70865712.ece,2026-04-16T11:10:30+00:00
Chennai,The Hindu,Chennai • The Hindu,https://www.thehindu.com/news/cities/chennai/,2,Udhayanidhi Stalin’s assets: Madras High Court directs Director General of Income Tax to respond by April 20,https://www.thehindu.com/elections/tamil-nadu-assembly/udhayanidhi-stalins-assets-madras-high-court-calls-for-report-from-director-general-of-income-tax/article70864025.ece,2026-04-16T11:10:30+00:00
Chennai,The Hindu,Chennai • The Hindu,https://www.thehindu.com/news/cities/chennai/,3,Man arrested for murder in Saidapet,https://www.thehindu.com/news/cities/chennai/man-arrested-for-murder-in-saidapet/article70866324.ece,2026-04-16T11:10:30+00:00
Chennai,The Hindu,Chennai • The Hindu,https://www.thehindu.com/news/cities/chennai/,4,"Residents, NGO revive Vengathur lake into a rich groundwater source",https://www.thehindu.com/news/cities/chennai/residents-ngo-revive-vengathur-lake-into-a-rich-groundwater-source/article70865511.ece,2026-04-16T11:10:30+00:00
Chennai,The Hindu,Chennai • The Hindu,https://www.thehindu.com/news/cities/chennai/,5,Tamil Nadu registers 99.92% pass rate in CBSE Class 10 exams; most students gear up for second exam,https://www.thehindu.com/news/cities/chennai/tamil-nadu-registers-9992-pass-rate-in-cbse-class-10-exams-most-students-gear-up-for-second-exam/article70866081.ece,2026-04-16T11:10:30+00:00
Chennai,The Hindu,Chennai • The Hindu,https://www.thehindu.com/news/cities/chennai/,6,"As polling day draws near, political parties brave the heat and step up their campaign across Chennai",https://www.thehindu.com/news/cities/chennai/as-polling-day-draws-near-political-parties-brave-the-heat-and-step-up-their-campaign-across-chennai/article70866000.ece,2026-04-16T11:10:30+00:00
Chennai,The Hindu,Chennai • The Hindu,https://www.thehindu.com/news/cities/chennai/,7,Fishermen of Srinivasapuram show black flags to Mylapore DMK candidate,https://www.thehindu.com/news/cities/chennai/fishermen-of-srinivasapuram-show-black-flags-to-mylapore-dmk-candidate/article70866180.ece,2026-04-16T11:10:30+00:00
Chennai,The Hindu,Chennai • The Hindu,https://www.thehindu.com/news/cities/chennai/,8,"Cleanliness, safety, housing top agenda of many women candidates contesting in Chennai",https://www.thehindu.com/elections/tamil-nadu-assembly/cleanliness-safety-housing-top-agenda-of-many-women-candidates-contesting-in-chennai/article70865785.ece,2026-04-16T11:10:30+00:00
Chennai,The Hindu,Chennai • The Hindu,https://www.thehindu.com/news/cities/chennai/,9,IPL 2026 | This Chennai groom’s CSK-themed wedding invite is winning hearts,https://www.thehindu.com/news/cities/chennai/ipl-2026-this-chennai-grooms-csk-themed-wedding-invite-is-winning-hearts/article70860643.ece,2026-04-16T11:10:30+00:00
Chennai,The Hindu,Chennai • The Hindu,https://www.thehindu.com/news/cities/chennai/,10,A trip down Khader Nawaz Khan Road’s residential past,https://www.thehindu.com/news/cities/chennai/a-trip-down-chennai-khader-nawaz-khan-road-residential-past/article70860497.ece,2026-04-16T11:10:30+00:00
Chennai,The Hindu,Chennai • The Hindu,https://www.thehindu.com/news/cities/chennai/,11,Some questions that are beyond textbooks,https://www.thehindu.com/children/some-questions-that-are-beyond-textbooks/article70837282.ece,2026-04-16T11:10:30+00:00
Chennai,The Hindu,Chennai • The Hindu,https://www.thehindu.com/news/cities/chennai/,12,What Anna Nagar voters want: Otteri Nullah monitored; pedestrian spaces freed up; parking policy sharpened; feeder services provided,https://www.thehindu.com/news/cities/chennai/anna-nagar-voters-bring-up-unfinished-business/article70853308.ece,2026-04-16T11:10:30+00:00
Chennai,The Hindu,Chennai • The Hindu,https://www.thehindu.com/news/cities/chennai/,13,A ‘developing’ community story with subplots in Chennai,https://www.thehindu.com/news/cities/chennai/a-developing-community-story-with-plots-and-subplots-in-chennai/article70853251.ece,2026-04-16T11:10:30+00:00
Chennai,The Hindu,Chennai • The Hindu,https://www.thehindu.com/news/cities/chennai/,14,Tiruvottiyur constituency: Environmental pollution remains a major concern in this industrial zone,https://www.thehindu.com/elections/tamil-nadu-assembly/environmental-pollution-remains-a-major-concern-in-this-industrial-zone/article70847911.ece,2026-04-16T11:10:30+00:00
Chennai,The Hindu,Chennai • The Hindu,https://www.thehindu.com/news/cities/chennai/,15,Commuters seek bus services from Vandalur railway station,https://www.thehindu.com/news/cities/chennai/commuters-seekbus-servicesfromvandalurrailway-station/article70850745.ece,2026-04-16T11:10:30+00:00
Chennai,The Hindu,Chennai • The Hindu,https://www.thehindu.com/news/cities/chennai/,16,"Tamil Nadu Assembly election 2026: CM Stalin takes surprise Chennai Metro ride, interacts with passengers",https://www.thehindu.com/elections/tamil-nadu-assembly/tamil-nadu-cm-stalin-takes-surprise-ride-in-chennai-metro-interacts-with-passengers/article70845958.ece,2026-04-16T11:10:30+00:00
Chennai,The Hindu,Chennai • The Hindu,https://www.thehindu.com/news/cities/chennai/,17,Bring northern parts of Chennai ‘closer’ to Velachery,https://www.thehindu.com/news/cities/chennai/bring-northern-parts-of-chennai-closer-to-velachery/article70831157.ece,2026-04-16T11:10:30+00:00
Chennai,The Hindu,Chennai • The Hindu,https://www.thehindu.com/news/cities/chennai/,18,Madras High Court dismisses Tamannaah Bhatia’s plea for ₹1-crore damages from Power Soaps,https://www.thehindu.com/news/national/tamil-nadu/madras-high-court-dismisses-tamannaah-bhatias-plea-for-1-crore-damages-from-power-soaps/article70867763.ece,2026-04-16T11:10:30+00:00
Chennai,The Hindu,Chennai • The Hindu,https://www.thehindu.com/news/cities/chennai/,19,"‘Bigg Boss’ fame ‘Vikkals’ Vikram turns hero with ‘Light Weight, Baby!’",https://www.thehindu.com/entertainment/movies/bigg-boss-fame-vikkals-vikram-turns-hero-with-light-weight-baby/article70860290.ece,2026-04-16T11:10:30+00:00
Chennai,The Hindu,Chennai • The Hindu,https://www.thehindu.com/news/cities/chennai/,20,Coimbatore cable TV operator arrested for telecasting leaked footage of Jana Nayagan,https://www.thehindu.com/news/national/tamil-nadu/coimbatore-cable-tv-operator-arrested-for-telecasting-leaked-footage-of-jana-nayagan/article70857584.ece,2026-04-16T11:10:30+00:00
Chennai,The Hindu,Chennai • The Hindu,https://www.thehindu.com/news/cities/chennai/,21,Three more arrested in college student’s attack during robbery bid in Minjur,https://www.thehindu.com/news/cities/chennai/three-more-arrested-in-college-students-attack-during-robbery-bid-in-minjur/article70867853.ece,2026-04-16T11:10:30+00:00
Chennai,The Hindu,Chennai • The Hindu,https://www.thehindu.com/news/cities/chennai/,22,Hospital launches programme for high-risk heart patients,https://www.thehindu.com/news/cities/chennai/hospital-launches-programme-for-high-risk-heart-patients/article70864639.ece,2026-04-16T11:10:30+00:00
Chennai,The Hindu,Chennai • The Hindu,https://www.thehindu.com/news/cities/chennai/,23,"Japan’s Create Medic enters India via Chennai, plans manufacturing unit",https://www.thehindu.com/news/cities/chennai/japans-create-medic-enters-india-via-chennai-plans-manufacturing-unit/article70865422.ece,2026-04-16T11:10:30+00:00
Chennai,The Hindu,Chennai • The Hindu,https://www.thehindu.com/news/cities/chennai/,24,Geriatric vaccination centre in the city launched,https://www.thehindu.com/news/cities/chennai/geriatric-vaccination-centre-in-the-city-launched/article70865440.ece,2026-04-16T11:10:30+00:00
Chennai,The Hindu,Chennai • The Hindu,https://www.thehindu.com/news/cities/chennai/,25,Koyambedu market complex will not function on April 23,https://www.thehindu.com/news/cities/chennai/koyambedu-market-complex-will-not-function-on-april-23/article70865050.ece,2026-04-16T11:10:30+00:00
Chennai,The Hindu,Chennai • The Hindu,https://www.thehindu.com/news/cities/chennai/,26,Puzhal police arrest history-sheeter for harassing woman,https://www.thehindu.com/news/cities/chennai/puzhal-police-arrest-history-sheeter-for-harassing-woman/article70865262.ece,2026-04-16T11:10:30+00:00
Chennai,The Hindu,Chennai • The Hindu,https://www.thehindu.com/news/cities/chennai/,27,College girl suffers knife injuries after she raises alarm against two intruders in Minjur,https://www.thehindu.com/news/cities/chennai/college-girl-suffers-knife-injuries-after-she-raises-alarm-against-two-intruders-in-minjur/article70864577.ece,2026-04-16T11:10:30+00:00
Chennai,The Hindu,Chennai • The Hindu,https://www.thehindu.com/news/cities/chennai/,28,States’ seats will rise 50% after delimitation: Centre,https://www.thehindu.com/todays-paper/2026-04-16/th_chennai/articleGAKFRVHFR-14249346.ece,2026-04-16T11:10:30+00:00
Chennai,The Hindu,Chennai • The Hindu,https://www.thehindu.com/news/cities/chennai/,29,"Iran says ceasefire is at risk, threatens to close Red Sea traffic",https://www.thehindu.com/todays-paper/2026-04-16/th_chennai/articleGAKFRVHFP-14249349.ece,2026-04-16T11:10:30+00:00
