city,publisher,source,source_url,rank,headline,link,collected_at_iso
Pune,Pune Mirror,Pune • Pune Mirror,https://punemirror.com/,75,"Early Signs of High Blood Pressure and Diabetes: Symptoms, Prevention and Care",https://punemirror.com/health/health-care/early-signs-high-blood-pressure-diabetes-prevention-care/,2026-04-15T20:59:01+00:00
Pune,Pune Mirror,Pune • Pune Mirror,https://punemirror.com/,76,Axis Bank Aadhaar face authentication delivers powerful new convenience,https://punemirror.com/business/axis-bank-aadhaar-face-authentication-update/,2026-04-15T20:59:01+00:00
Pune,Pune Mirror,Pune • Pune Mirror,https://punemirror.com/,77,Bitcoin price consolidation powers cautious but resilient rally,https://punemirror.com/business/bitcoin-price-consolidation-67000-outlook/,2026-04-15T20:59:01+00:00
Pune,Pune Mirror,Pune • Pune Mirror,https://punemirror.com/,78,April 1 financial changes in India bring powerful shake-up,https://punemirror.com/business/personal-finance/april-1-financial-changes-in-india/,2026-04-15T20:59:01+00:00
Pune,Pune Mirror,Pune • Pune Mirror,https://punemirror.com/,79,GST 2.0 car buyers: Powerful tax cut fuels upbeat demand surge,https://punemirror.com/automobile/gst-2-0-car-buyers-boost-demand/,2026-04-15T20:59:01+00:00
Pune,Pune Mirror,Pune • Pune Mirror,https://punemirror.com/,80,Fake Mudra loan shocker: urgent warning for borrowers,https://punemirror.com/technology/fake-mudra-loan-scam-warning-guide/,2026-04-15T20:59:01+00:00
Pune,Pune Mirror,Pune • Pune Mirror,https://punemirror.com/,81,₹2.45 Crore Oil Trading Fraud Uncovered in Pune; Two Accused Booked Again,https://punemirror.com/city/crime/pune-oil-trading-fraud-baner-painter-death-tathawade/,2026-04-15T20:59:01+00:00
Pune,Pune Mirror,Pune • Pune Mirror,https://punemirror.com/,82,"Pune Rural Police Seize Rs.2 Crore Mephedrone in Shirur, Arrest Garage Owner",https://punemirror.com/city/pune-shirur-garage-owner-mephedrone-police-links/,2026-04-15T20:59:01+00:00
Pune,Pune Mirror,Pune • Pune Mirror,https://punemirror.com/,83,Online gaming losses theft fuels shocking Pune tyre robbery,https://punemirror.com/city/crime/online-gaming-losses-theft-pune-tyre-robbery/,2026-04-15T20:59:01+00:00
Pune,Pune Mirror,Pune • Pune Mirror,https://punemirror.com/,84,Pune stepbrother car torching case: shocking family feud rocks Thergaon​,https://punemirror.com/city/pune/pune-stepbrother-car-torching-case/,2026-04-15T20:59:01+00:00
Pune,Pune Mirror,Pune • Pune Mirror,https://punemirror.com/,85,Pune doctor abduction: shocking highway gang extortion terrorises Pune,https://punemirror.com/city/crime/pune-doctor-abduction-19-lakh-extortion/,2026-04-15T20:59:01+00:00
Pune,Pune Mirror,Pune • Pune Mirror,https://punemirror.com/,86,VinFast VF MPV 7: Premium Electric Seven-Seater Launched at Rs 24.49 Lakh,https://punemirror.com/automobile/vinfast-vf-mpv-7-premium-electric-seven-seater-launched-at-rs-24-49-lakh/,2026-04-15T20:59:01+00:00
Pune,Pune Mirror,Pune • Pune Mirror,https://punemirror.com/,87,Volkswagen Launches New Taigun with 8-Speed Automatic,https://punemirror.com/automobile/volkswagen-launches-new-taigun-with-8-speed-automatic/,2026-04-15T20:59:01+00:00
Pune,Pune Mirror,Pune • Pune Mirror,https://punemirror.com/,88,"Microsoft OpenClaw Copilot AI Sparks Bold Promise, Serious Fears",https://punemirror.com/technology/ai/microsoft-openclaw-copilot-ai-agents/,2026-04-15T20:59:01+00:00
Pune,Pune Mirror,Pune • Pune Mirror,https://punemirror.com/,89,Kinetic DX+ Review,https://punemirror.com/automobile/kinetic-dx-review/,2026-04-15T20:59:01+00:00
Pune,Pune Mirror,Pune • Pune Mirror,https://punemirror.com/,90,"Minor lured with mango, assaulted in Pimpri-Chinchwad",https://punemirror.com/news/pimpri-chinchwad-minor-lured-fruit-assault-case/,2026-04-15T20:59:01+00:00
Pune,Pune Mirror,Pune • Pune Mirror,https://punemirror.com/,91,Centralised kitchen facility inaugurated in Shivajinagar,https://punemirror.com/city/pune/centralised-kitchen-facility-inaugurated-in-shivajinagar/,2026-04-15T20:59:01+00:00
Pune,Pune Mirror,Pune • Pune Mirror,https://punemirror.com/,92,OpenAI Hiro Finance acquisition marks powerful new AI fintech shift,https://punemirror.com/business/openai-hiro-finance-acquisition-ai-fintech/,2026-04-15T20:59:01+00:00
Pune,Pune Mirror,Pune • Pune Mirror,https://punemirror.com/,93,"‘Godman’ Booked for Rape, Rs 50 Lakh Fraud in Pune’s Swargate; Accused Absconding",https://punemirror.com/city/pune-godman-rape-fraud-swargate-case/,2026-04-15T20:59:01+00:00
Pune,Pune Mirror,Pune • Pune Mirror,https://punemirror.com/,94,Widened but Worse: Katraj–Kondhwa Road Turns Accident-Prone Despite Upgrade,https://punemirror.com/city/pune/katraj-kondhwa-road-traffic-chaos-undri-pisoli/,2026-04-15T20:59:01+00:00
Pune,Pune Mirror,Pune • Pune Mirror,https://punemirror.com/,95,"RTE Admissions Chaos in Pune: No Verification Committee Yet, Parents Forced to Make Repeated Visits",https://punemirror.com/city/pune/pune-rte-admission-chaos-no-verification-committee/,2026-04-15T20:59:01+00:00
Pune,Pune Mirror,Pune • Pune Mirror,https://punemirror.com/,96,A Tanker on the Edge: One Man’s Timely Stand Averts Disaster in Mohammadwadi,https://punemirror.com/city/pune/pune-mohammadwadi-drunk-tanker-driver-detained/,2026-04-15T20:59:01+00:00
Pune,Pune Mirror,Pune • Pune Mirror,https://punemirror.com/,97,Pune Airport Expands Horizons with New Flight Slots and Routes,https://punemirror.com/city/pune/pune-airport-new-flight-slots-routes-expansion/,2026-04-15T20:59:01+00:00
Pune,Pune Mirror,Pune • Pune Mirror,https://punemirror.com/,98,Opposition to Shifting Palkhi Halt in Pune; Demand to Retain Tradition,https://punemirror.com/city/pune/pune-palkhi-halt-shift-opposition-nana-peth/,2026-04-15T20:59:01+00:00
Pune,Pune Mirror,Pune • Pune Mirror,https://punemirror.com/,99,"PMC Urges Residents to Prevent Water Wastage in Bund Garden Area, Warns of Action",https://punemirror.com/city/pune/pmc-bund-garden-water-wastage-warning/,2026-04-15T20:59:01+00:00
Pune,Pune Mirror,Pune • Pune Mirror,https://punemirror.com/,100,"Pune Metro Unveils New Lines for Khadakwasla–Hadapsar–Kharadi, Karvenagar–Warje–Manikbag",https://punemirror.com/city/pune/pune-metro-line-4-4a-khadakwasla-kharadi-plan/,2026-04-15T20:59:01+00:00
Pune,Pune Mirror,Pune • Pune Mirror,https://punemirror.com/,101,Mangeshkar Family To Build Asia’s Largest Hospital In Memory Of Lata And Asha,https://punemirror.com/entertainment/mangeshkar-family-hospital-lata-asha-tribute/,2026-04-15T20:59:01+00:00
Pune,Pune Mirror,Pune • Pune Mirror,https://punemirror.com/,102,"Candy And The Pizza Ggirl Shines in Wild, Unforgettable OTT Debut",https://punemirror.com/entertainment/candy-and-the-pizza-ggirl-ott-review/,2026-04-15T20:59:01+00:00
Pune,Pune Mirror,Pune • Pune Mirror,https://punemirror.com/,103,"Assi OTT release: Powerful, unflinching courtroom drama on Zee5",https://punemirror.com/entertainment/assi-ott-release-zee5-streaming-date/,2026-04-15T20:59:01+00:00
Pune,Pune Mirror,Pune • Pune Mirror,https://punemirror.com/,104,Pakistan’s Media Regulator Issues Notice To Geo News For Airing Asha Bhosle Tribute Content,https://punemirror.com/entertainment/pakistan-geo-news-asha-bhosle-tribute-notice/,2026-04-15T20:59:01+00:00
Pune,Pune Mirror,Pune • Pune Mirror,https://punemirror.com/,105,"Dhurandhar 2 Crosses ₹1,000 Crore, First Hindi Film to Hit Milestone",https://punemirror.com/entertainment/movie/dhurandhar-2-1000-crore-box-office-record/,2026-04-15T20:59:01+00:00
Pune,Pune Mirror,Pune • Pune Mirror,https://punemirror.com/,106,Bhanupriya Bhooter Hotel OTT Release Date Delivers Thrilling Success,https://punemirror.com/entertainment/bhanupriya-bhooter-hotel-ott-release-date/,2026-04-15T20:59:01+00:00
Pune,Pune Mirror,Pune • Pune Mirror,https://punemirror.com/,107,"Jerax Zee5 Kannada series delivers exciting, powerful new fantasy ride",https://punemirror.com/entertainment/jerax-zee5-kannada-series/,2026-04-15T20:59:01+00:00
Pune,Pune Mirror,Pune • Pune Mirror,https://punemirror.com/,108,Athiya Shetty Trolled Online Over Alleged Mix-Up In Asha Bhosle Tribute Post,https://punemirror.com/entertainment/athiya-shetty-tribute-controversy-asha-bhosle/,2026-04-15T20:59:01+00:00
Pune,IE,Pune • IE,https://indianexpress.com/article/cities/pune/,1,Puzzles & Games,https://indianexpress.com/puzzles-and-games/,2026-04-15T20:59:01+00:00
Pune,IE,Pune • IE,https://indianexpress.com/article/cities/pune/,2,"Why a 37-year-old, who ran 5 km daily and ate no junk food, needed two heart stents: ‘If your father/uncle…’",https://indianexpress.com/article/lifestyle/health/heart-specialist-37-year-old-man-running-5-kms-every-day-no-junk-two-stents-genetic-experts-10457788/,2026-04-15T20:59:01+00:00
Pune,IE,Pune • IE,https://indianexpress.com/article/cities/pune/,3,Why AFI wants to vet athletes’ contracts with sponsors,https://indianexpress.com/article/sports/cricket/why-afi-wants-to-vet-athletes-contracts-with-sponsors-10636789/,2026-04-15T20:59:01+00:00
Pune,IE,Pune • IE,https://indianexpress.com/article/cities/pune/,4,"16 killed, 19 injured in boiler blast at Vedanta plant in Chhattisgarh",https://indianexpress.com/article/india/vedanta-power-plant-chhattisgarh-600-degree-steam-men-lunch-dead-10636801/,2026-04-15T20:59:01+00:00
Pune,IE,Pune • IE,https://indianexpress.com/article/cities/pune/,5,"Amendment to Nari Shakti Vandan Act: BJP’s women cadre ready to contest next Lok Sabha polls in Pune, says Medha Kulkarni",https://indianexpress.com/article/cities/pune/bokaro-missing-girl-case-jpa-demands-sp-suspension-after-28-cops-axed-10636793/,2026-04-15T20:59:01+00:00
Pune,IE,Pune • IE,https://indianexpress.com/article/cities/pune/,6,"Disney to eliminate 1,000 positions",https://indianexpress.com/article/world/disney-layoffs-2026-ceo-josh-damaro-espn-studios-job-cuts-10636773/,2026-04-15T20:59:01+00:00
Pune,IE,Pune • IE,https://indianexpress.com/article/cities/pune/,7,"IPL 2026, RCB vs LSG Live Cricket Score: Rajat Patidar wins toss and opts to bowl first in Bengaluru2 minutes ago",https://indianexpress.com/article/sports/cricket/rcb-vs-lsg-ipl-2026-live-cricket-score-indian-premier-league-bangalore-lucknow-match-scorecard-at-m-chinnaswamy-stadium-10637916/,2026-04-15T20:59:01+00:00
Pune,IE,Pune • IE,https://indianexpress.com/article/cities/pune/,8,AP Inter 1st 2nd Year Results 2026 LIVE Updates: Results out; girls performed in both streams3 minutes ago,https://indianexpress.com/article/education/ap-inter-1st-2nd-year-results-2026-live-updates-mamrk-memo-declared-mana-mitra-roll-number-topper-results-bie-ap-gov-in-10636693/,2026-04-15T20:59:01+00:00
Pune,IE,Pune • IE,https://indianexpress.com/article/cities/pune/,9,"BIE AP Inter Results 2026 LIVE Updates: Result out; recheck process, supply exam dates4 minutes ago",https://indianexpress.com/article/education/bie-ap-inter-1st-2nd-year-results-2026-released-live-updates-bie-ap-gov-in-resultsbie-ap-gov-in-10636606/,2026-04-15T20:59:01+00:00
Pune,IE,Pune • IE,https://indianexpress.com/article/cities/pune/,10,"CBSE 10th Result 2026, Results.cbse.nic.in [OUT] LIVE: Scorecards download links available at cbse.gov.in, and DigiLocker6 minutes ago",https://indianexpress.com/article/education/cbse-class-10th-result-2026-live-updates-scorecard-link-digilocker-cbse-gov-in-cbseresults-nic-in-results-cbse-nic-in-topper-10603956/,2026-04-15T20:59:01+00:00
Pune,IE,Pune • IE,https://indianexpress.com/article/cities/pune/,11,"MP Board 10th 12th Result 2026 LIVE [OUT] Updates: Meet the toppers, link active at result.mponline.gov.in9 minutes ago",https://indianexpress.com/article/education/mpbse-mp-board-result-declared-2026-live-updates-class-10th-12th-scorecards-toppers-mpbse-nic-in-mpresults-nic-in-high-school-higher-secondary-digilocker-10635990/,2026-04-15T20:59:01+00:00
Pune,IE,Pune • IE,https://indianexpress.com/article/cities/pune/,12,Mobile & Tabs,https://indianexpress.com/section/technology/mobile-tabs/,2026-04-15T20:59:01+00:00
Pune,IE,Pune • IE,https://indianexpress.com/article/cities/pune/,13,Food & Wine,https://indianexpress.com/section/lifestyle/food-wine/,2026-04-15T20:59:01+00:00
Pune,IE,Pune • IE,https://indianexpress.com/article/cities/pune/,14,Live Cricket Score,https://indianexpress.com/section/sports/cricket/live-score/,2026-04-15T20:59:01+00:00
Pune,IE,Pune • IE,https://indianexpress.com/article/cities/pune/,15,Indian Express Live TV,https://indianexpress.com/live-tv/,2026-04-15T20:59:01+00:00
Pune,IE,Pune • IE,https://indianexpress.com/article/cities/pune/,16,KKR vs PBKS Scorecard,https://indianexpress.com/section/sports/cricket/live-score/kolkata-knight-riders-vs-punjab-kings-12-t20-live-score-full-scorecard-highlights-indian-premier-league-2026-krkp04062026270059/,2026-04-15T20:59:01+00:00
Pune,IE,Pune • IE,https://indianexpress.com/article/cities/pune/,17,KKR vs PBKS Score,https://indianexpress.com/article/sports/cricket/ipl-2026-kkr-vs-pbks-live-cricket-score-12th-match-kolkata-knight-riders-vs-punjab-kings-live-scorecard-today-updates-10621921/,2026-04-15T20:59:01+00:00
Pune,IE,Pune • IE,https://indianexpress.com/article/cities/pune/,18,Kerala Election 2026 Date,https://indianexpress.com/elections/kerala-assembly-election/schedule/,2026-04-15T20:59:01+00:00
Pune,IE,Pune • IE,https://indianexpress.com/article/cities/pune/,19,Assam Election 2026 Date,https://indianexpress.com/elections/assam-assembly-election/schedule/,2026-04-15T20:59:01+00:00
Pune,IE,Pune • IE,https://indianexpress.com/article/cities/pune/,20,Tamil Nadu Election 2026 Date,https://indianexpress.com/elections/tamil-nadu-assembly-election/schedule/,2026-04-15T20:59:01+00:00
Pune,IE,Pune • IE,https://indianexpress.com/article/cities/pune/,21,West Bengal Election 2026 Dates,https://indianexpress.com/elections/west-bengal-assembly-election/schedule/,2026-04-15T20:59:01+00:00
Pune,IE,Pune • IE,https://indianexpress.com/article/cities/pune/,22,Puducherry Election 2026 Date,https://indianexpress.com/elections/puducherry-assembly-election/schedule/,2026-04-15T20:59:01+00:00
Pune,IE,Pune • IE,https://indianexpress.com/article/cities/pune/,23,IPL 2026 Schedule,https://indianexpress.com/section/sports/ipl/schedules-fixtures/,2026-04-15T20:59:01+00:00
Pune,IE,Pune • IE,https://indianexpress.com/article/cities/pune/,24,IPL 2026 Stats,https://indianexpress.com/section/sports/ipl/stats/,2026-04-15T20:59:01+00:00
Pune,IE,Pune • IE,https://indianexpress.com/article/cities/pune/,25,IPL 2026 Points Table,https://indianexpress.com/section/sports/ipl/points-table/,2026-04-15T20:59:01+00:00
Pune,IE,Pune • IE,https://indianexpress.com/article/cities/pune/,26,RCB vs LSG Scorecard,https://indianexpress.com/section/sports/cricket/live-score/royal-challengers-bengaluru-vs-lucknow-super-giants-23-t20-live-score-full-scorecard-highlights-indian-premier-league-2026-bclko04152026270294/,2026-04-15T20:59:01+00:00
Pune,IE,Pune • IE,https://indianexpress.com/article/cities/pune/,27,CBSE Class 10th Result 2026,https://indianexpress.com/article/education/cbse-class-10th-results-2026-declared-april-session-1-live-updates-cbse-gov-in-cbseresults-nic-in-set-up-accounts-says-digilocker-when-where-10633902/,2026-04-15T20:59:01+00:00
Pune,IE,Pune • IE,https://indianexpress.com/article/cities/pune/,28,Dhurandhar 2 Box Office Collection,https://indianexpress.com/article/entertainment/bollywood/dhurandhar-2-box-office-collection-day-27-live-updates-ranveer-singh-film-rs-1727-cr-10636655/,2026-04-15T20:59:01+00:00
Pune,IE,Pune • IE,https://indianexpress.com/article/cities/pune/,29,Iran-US-Israel War News,https://indianexpress.com/article/world/us-news/iran-war-live-updates-us-military-to-block-iranian-port-traffic-in-hormuz-strait-10633398/,2026-04-15T20:59:01+00:00
Pune,IE,Pune • IE,https://indianexpress.com/article/cities/pune/,30,‘I am not going to yield’: Starmer defies Trump as US president threatens to rip up 2025 UK trade deal,https://indianexpress.com/article/world/i-am-not-going-to-yield-starmer-defies-trump-as-us-president-threatens-to-rip-up-2025-uk-trade-deal-10638354/,2026-04-15T20:59:01+00:00
Pune,IE,Pune • IE,https://indianexpress.com/article/cities/pune/,31,"BRICS Foreign Ministers’ meet on May 14-15; Wang Yi, Lavrov may attend",https://indianexpress.com/article/india/brics-foreign-ministers-russia-china-to-attend-10638483/,2026-04-15T20:59:01+00:00
Pune,IE,Pune • IE,https://indianexpress.com/article/cities/pune/,32,Theatre group adapts Agatha Christie’s classic The Mousetrap in Hindi,https://indianexpress.com/article/cities/pune/shikanja-play-pune-mousetrap-hindi-adaptation-10638490/,2026-04-15T20:59:01+00:00
Pune,IE,Pune • IE,https://indianexpress.com/article/cities/pune/,33,Swapan Dasgupta: ‘TMC treats South Kolkata as its fief. Will ensure entitlement is short-lived… No SIR effect in Rashbehari’,https://indianexpress.com/article/political-pulse/swapan-dasgupta-bengal-election-bjp-tmc-10638456/,2026-04-15T20:59:01+00:00
Pune,IE,Pune • IE,https://indianexpress.com/article/cities/pune/,34,"Delivery, not delay, done right, done to last: Why delimitation is the bedrock of women’s reservation",https://indianexpress.com/article/opinion/columns/delimitation-is-the-bedrock-of-womens-reservation-10638481/,2026-04-15T20:59:01+00:00
Pune,IE,Pune • IE,https://indianexpress.com/article/cities/pune/,35,"Salman Khan’s bodyguard Shera, Shah Rukh’s bodyguard Ravi get salaries in crores? SRK’s ex security chief debunks claims: ‘Who pays Rs 10 lakhs?’",https://indianexpress.com/article/entertainment/bollywood/shah-rukh-khan-bodyguard-yaseen-khan-salary-myths-ravi-singh-shera-income-debunked-10637511/,2026-04-15T20:59:01+00:00
Pune,IE,Pune • IE,https://indianexpress.com/article/cities/pune/,36,"UPSC Key: Blockade, Right to vote and Sports Genomics",https://indianexpress.com/article/upsc-current-affairs/upsc-key-blockade-right-to-vote-and-sports-genomics-10638462/,2026-04-15T20:59:01+00:00
Pune,IE,Pune • IE,https://indianexpress.com/article/cities/pune/,37,Varanasi court acquits six in two-decade old attack on former MP,https://indianexpress.com/article/legal-news/varanasi-court-acquits-six-in-two-decade-old-attack-on-former-mp-10638444/,2026-04-15T20:59:01+00:00
Pune,IE,Pune • IE,https://indianexpress.com/article/cities/pune/,38,"On Himachal day, story of how the state nearly became part of Punjab",https://indianexpress.com/article/explained/explained-history/himachal-day-story-state-formation-integration-10638442/,2026-04-15T20:59:01+00:00
Pune,IE,Pune • IE,https://indianexpress.com/article/cities/pune/,39,The coriander potli: Expert explains the viral hack for a blocked nose,https://indianexpress.com/article/lifestyle/life-style/coriander-seeds-cold-cough-blocked-nose-relief-expert-9621104/,2026-04-15T20:59:01+00:00
Pune,IE,Pune • IE,https://indianexpress.com/article/cities/pune/,40,‘No moral policing in elections’: Madhya Pradesh High Court reinstates local municipal body president,https://indianexpress.com/article/legal-news/madhya-pradesh-high-court-reinstates-multai-municipal-president-10638235/,2026-04-15T20:59:01+00:00
Pune,IE,Pune • IE,https://indianexpress.com/article/cities/pune/,41,World’s busiest airports in 2025: No Indian airport in top 10; check which is at No 1,https://indianexpress.com/article/trending/top-10-listing/top-10-busiest-airports-by-total-passengers-in-2025-10638415/,2026-04-15T20:59:01+00:00
Pune,IE,Pune • IE,https://indianexpress.com/article/cities/pune/,42,"Ram Charan’s Peddi pushed to June: Makers confirm delay, say one song still left to shoot",https://indianexpress.com/article/entertainment/telugu/ram-charan-peddi-pushed-to-june-makers-confirm-postponement-say-one-song-still-left-to-shoot-10638371/,2026-04-15T20:59:01+00:00
Pune,IE,Pune • IE,https://indianexpress.com/article/cities/pune/,43,‘Punishing progress’: D K Shivakumar warns of united resistance by southern states against delimitation,https://indianexpress.com/article/cities/bangalore/dk-shivakumar-lok-sabha-seat-expansion-delimitation-south-states-protest-10638419/,2026-04-15T20:59:01+00:00
Pune,IE,Pune • IE,https://indianexpress.com/article/cities/pune/,44,Vignesh Shivan recalls seeing Jana Nayagan’s leaked version playing on a phone in Madurai: ‘I felt like breaking it’,https://indianexpress.com/article/entertainment/tamil/vignesh-shivan-recalls-seeing-jana-nayagans-leaked-version-playing-on-a-phone-in-madurai-i-felt-like-breaking-it-10638060/,2026-04-15T20:59:01+00:00
Pune,IE,Pune • IE,https://indianexpress.com/article/cities/pune/,45,Yadon Ka Jashan: The forgotten Urdu memoir modern India needs to read,https://indianexpress.com/article/books-and-literature/urdu-yadon-ka-jashan-mohinder-bedi-sahar-kamna-prasad-review-partition-10638296/,2026-04-15T20:59:01+00:00
Pune,IE,Pune • IE,https://indianexpress.com/article/cities/pune/,46,Newsletters ( opens in a new tab ),https://indianexpress.com/newsletters/,2026-04-15T20:59:01+00:00
Pune,IE,Pune • IE,https://indianexpress.com/article/cities/pune/,47,26/11 Stories of Strength ( opens in a new tab ),https://indianexpress.com/26-11/,2026-04-15T20:59:01+00:00
Pune,IE,Pune • IE,https://indianexpress.com/article/cities/pune/,48,Statutory provisions on reporting (sexual offenses),https://indianexpress.com/article/what-is/what-is-the-protection-of-children-from-sexual-offences-act-2012/,2026-04-15T20:59:01+00:00
Pune,Sakal,Pune • Sakal,https://www.esakal.com/pune,1,सकाळ लाईव्ह TV,https://www.esakal.com/live-tv,2026-04-15T20:59:01+00:00
Pune,Sakal,Pune • Sakal,https://www.esakal.com/pune,2,Refund and Cancellation,https://www.esakal.com/refund-and-cancellation,2026-04-15T20:59:01+00:00
Pune,Lokmat,Pune • Lokmat,https://www.lokmat.com/city/,1,Live News in Marathi,https://www.lokmat.com/live-news/,2026-04-15T20:59:01+00:00
Pune,Lokmat,Pune • Lokmat,https://www.lokmat.com/city/,2,पुणे शहरात गुरुवारी पाणी येणार; टँकर चालकांच्या संपामुळे 'पाणीपुरवठा बंद' पुढे ढकलला,https://www.lokmat.com/pune/water-will-come-to-pune-city-on-thursday-water-supply-shutdown-postponed-due-to-tanker-drivers-strike-a-a727/,2026-04-15T20:59:01+00:00
Pune,Lokmat,Pune • Lokmat,https://www.lokmat.com/city/,3,"पुण्यात पालखी मुक्काम हलविण्याचा प्रयत्न; नागरिकांमध्ये नाराजी, ३५० वर्षांची परंपरा कायम ठेवण्याची मागणी",https://www.lokmat.com/pune/attempt-to-shift-palanquin-stop-in-pune-displeasure-among-citizens-demand-to-maintain-350-year-old-tradition-a-a727/,2026-04-15T20:59:01+00:00
Pune,Lokmat,Pune • Lokmat,https://www.lokmat.com/city/,4,"'लोहगाव' बनले हॉटस्पॉट; तापमान ४१ .८ अंशाच्या घरात, मध्यवर्ती भागापेक्षा उपनगरांमध्ये उष्णतेची तीव्र",https://www.lokmat.com/pune/lohgaon-becomes-hotspot-temperature-at-418-degrees-celsius-heat-intensity-more-in-suburbs-than-central-area-a-a727/,2026-04-15T20:59:01+00:00
Pune,Lokmat,Pune • Lokmat,https://www.lokmat.com/city/,5,पुण्यात घरगुती गॅसचा काळाबाजार करणाऱ्या दुकानावर छापा; तब्बल १०३ सिलिंडरच्या टाक्या जप्त,https://www.lokmat.com/pune/raid-on-a-shop-selling-domestic-gas-in-black-market-in-pune-103-cylinders-seized-a-a727/,2026-04-15T20:59:01+00:00
Pune,Lokmat,Pune • Lokmat,https://www.lokmat.com/city/,6,जागा दाखवण्याच्या बहाण्याने एका ठिकाणी नेले; पुण्यात मेट्रो ठेकेदाराचे ५० लाखांच्या खंडणीसाठी अपहरण,https://www.lokmat.com/pune/taken-to-a-place-on-the-pretext-of-showing-the-place-metro-contractor-kidnapped-in-pune-for-ransom-of-rs-50-lakhs-a-a727/,2026-04-15T20:59:01+00:00
Pune,Lokmat,Pune • Lokmat,https://www.lokmat.com/city/,7,अनिल अंबानी प्रकरणात मोठी घडामोड! विश्वासू सहकाऱ्याला ईडीने ठोकल्या बेड्या,https://www.lokmat.com/business/news/big-development-in-anil-ambani-case-ed-arrests-trusted-colleague-amitabh-jhunjhunwala-reliance-adag-arrest-news-a-a607/,2026-04-15T20:59:01+00:00
Pune,Lokmat,Pune • Lokmat,https://www.lokmat.com/city/,8,"इलेक्ट्रिक बाईक्स,रिक्षा, डिलिव्हरी बाईक्ससह विविध साहित्याचे वाटप; अनंत सेवा फाऊंडेशनकडून कष्टकरी कुटुंबांना आधार",https://www.lokmat.com/mumbai/distribution-of-various-materials-including-electric-bikes-rickshaws-delivery-bikes-support-to-hardworking-families-from-anant-seva-foundation-a-a571/,2026-04-15T20:59:01+00:00
